12936,578098,PLASTERS IN TIN SKULLS,0
12936,578098,PLASTERS IN TIN WOODLAND ANIMALS,0
12936,567859,SET OF 10 LED DOLLY LIGHTS,0
12936,567859,CAMOUFLAGE LED TORCH,0
12936,567859,HOMEMADE JAM SCENTED CANDLES,0
12936,578098,ZINC METAL HEART DECORATION,0
12936,578098,DINOSAURS  WRITING SET,0
12936,567859,FELTCRAFT PRINCESS CHARLOTTE DOLL,0
12936,567859,FELTCRAFT PRINCESS LOLA DOLL,0
12936,578098,JAZZ HEARTS PURSE NOTEBOOK,0
12936,578098,PAPER CHAIN KIT 50'S CHRISTMAS,0
12936,567859,GIRAFFE WOODEN RULER,0
12936,567859,TREASURE TIN GYMKHANA DESIGN,0
12936,578096,PAPER CHAIN KIT 50'S CHRISTMAS,0
12936,578098,SET OF 5 LUCKY CAT MAGNETS,0
12936,578098,12 PENCILS TALL TUBE WOODLAND,0
12936,567859,SET 36 COLOUR PENCILS SPACEBOY,0
12936,567859,GROW A FLYTRAP OR SUNFLOWER IN TIN,0
12936,567859,SPACEBOY MINI BACKPACK,0
12936,578098,200 BENDY SKULL STRAWS,0
12936,578098,SET OF 9 HEART SHAPED BALLOONS,0
12936,578098,HAPPY STENCIL CRAFT,0
12936,567859,RETROSPOT TEA SET CERAMIC 11 PC,0
12936,578098,SET/6 PURPLE BUTTERFLY T-LIGHTS,0
12936,578098,3 HEARTS HANGING DECORATION RUSTIC,0
12936,578098,JUMBO BAG 50'S CHRISTMAS,0
12936,567859,CHRISTMAS CRAFT TREE TOP ANGEL,0
12936,578098,PENCIL CASE LIFE IS BEAUTIFUL,0
12936,578098,GLASS HEART T-LIGHT HOLDER,0
12936,567859,DOLLY GIRL MINI BACKPACK,0
12936,578098,BALLOONS  WRITING SET,0
12936,567859,MAGIC DRAWING SLATE DOLLY GIRL,0
12936,567859,FELTCRAFT BUTTERFLY HEARTS,0
12936,567859,MAGIC DRAWING SLATE SPACEBOY,0
12936,567859,CHILDREN'S APRON DOLLY GIRL,0
12936,578098,GARDENERS KNEELING PAD CUP OF TEA,0
12936,567859,PAPER CHAIN KIT VINTAGE CHRISTMAS,0
12936,567859,SET 36 COLOUR PENCILS DOLLY GIRL,0
12936,578098,SET/10 RED POLKADOT PARTY CANDLES,0
12936,578098,DOUGHNUT LIP GLOSS,0
12936,567859,BOX OF 6 MINI VINTAGE CRACKERS,0
12936,567859,RED  HARMONICA IN BOX,0
12936,567859,FELTCRAFT PRINCESS OLIVIA DOLL,0
12936,567859,DOUGHNUT LIP GLOSS,0
12936,567859,BLUE HARMONICA IN BOX,0
12936,567859,SET OF 20 VINTAGE CHRISTMAS NAPKINS,0
12936,578098,SET/10 PINK POLKADOT PARTY CANDLES,0
12936,578098,HEART FILIGREE DOVE LARGE,0
12936,567859,ICE CREAM BUBBLES,0
12936,578096,RABBIT NIGHT LIGHT,0
12936,567859,3 HEARTS HANGING DECORATION RUSTIC,0
12936,567859,GARDENERS KNEELING PAD KEEP CALM,0
12936,567859,10 COLOUR SPACEBOY PEN,0
12936,567859,GIANT 50'S CHRISTMAS CRACKER,0
12936,567859,PAPER CHAIN KIT 50'S CHRISTMAS,0
12936,578098,PLASTERS IN TIN VINTAGE PAISLEY,0
12936,567859,TREASURE TIN BUFFALO BILL,0
12936,578098,RABBIT NIGHT LIGHT,0
12936,577166,PAPER CHAIN KIT VINTAGE CHRISTMAS,0
12936,567859,JAM MAKING SET WITH JARS,0
12936,578098,12 PENCIL SMALL TUBE WOODLAND,0
12936,578098,HAND WARMER RED LOVE HEART,0
12967,536851,SET/6 RED SPOTTY PAPER PLATES,2
12967,539319,GREEN 3 PIECE POLKADOT CUTLERY SET,2
12967,536851,ASSORTED COLOUR MINI CASES,2
12967,536851,RED RETROSPOT CHILDRENS UMBRELLA,2
12967,536851,RETROSPOT LAMP,2
12967,539319,RED 3 PIECE RETROSPOT CUTLERY SET,2
12967,536851,SET/3 RED GINGHAM ROSE STORAGE BOX,2
12967,536851,CABIN BAG VINTAGE PAISLEY,2
12967,536851,RETROSPOT HEART HOT WATER BOTTLE,2
12967,536851,RETROSPOT PARTY BAG + STICKER SET,2
12967,536851,SCOTTIE DOG HOT WATER BOTTLE,2
12967,536851,RED GINGHAM ROSE JEWELLERY BOX,2
12967,536851,CABIN BAG VINTAGE RETROSPOT,2
12967,539319,PINK 3 PIECE POLKADOT CUTLERY SET,2
12967,536851,WASH BAG VINTAGE ROSE PAISLEY,2
12967,536851,SET3 BOOK BOX GREEN GINGHAM FLOWER,2
12967,536851,PARTY CONES CANDY ASSORTED,2
12967,536851,SET/6 RED SPOTTY PAPER CUPS,2
12967,539319,BLUE 3 PIECE POLKADOT CUTLERY SET,2
13240,557310,ENAMEL FLOWER JUG CREAM,0
13240,538015,SILVER LATTICE VANILLA CANDLE POT,0
13240,547873,JARDIN ETCHED GLASS LARGE BELL JAR,0
13240,565441,HANGING HEART BONHEUR,0
13240,538015,SET/6 BLACK BIRD T-LIGHT CANDLES,0
13240,538015,GAOLERS KEYS DECORATIVE GARDEN,0
13240,565441,4 LILY  BOTANICAL DINNER CANDLES,0
13240,565441,4 VANILLA BOTANICAL CANDLES,0
13240,538015,CHRISTMAS METAL TAGS ASSORTED,0
13240,538015,ANTIQUE ALL GLASS CANDLESTICK,0
13240,547873,RED TEA TOWEL CLASSIC DESIGN,0
13240,538015,GLASS STAR FROSTED T-LIGHT HOLDER,0
13240,557310,SMALL CAMPHOR WOOD FIELD  MUSHROOM,0
13240,547873,LARGE  TALL CAMPHOR WOOD TOADSTOOL,0
13240,538015,CINNAMON SCENTED VOTIVE CANDLE,0
13240,538015,SMALL SILVER TRELLIS CANDLEPOT,0
13240,565441,GLASS CLOCHE SMALL,0
13240,565441,TRELLIS COAT RACK,0
13240,565441,GLASS SPHERE CANDLE STAND MEDIUM,0
13240,547873,BLUE TEA TOWEL CLASSIC DESIGN,0
13240,547873,S/12 VANILLA  BOTANICAL T-LIGHTS,0
13240,547873,SLATE TILE NATURAL HANGING,0
13240,538015,CUT GLASS T-LIGHT HOLDER OCTAGON,0
13240,557310,LARGE CAMPHOR WOOD FIELD MUSHROOM,0
13240,547873,CALENDAR IN SEASON DESIGN,0
13240,565441,FLUTED ANTIQUE CANDLE HOLDER,0
13240,565441,BLACK CANDELABRA T-LIGHT HOLDER,0
13240,547873,COFFEE MUG PEARS  DESIGN,0
13240,538015,GLASS CLOCHE SMALL,0
13240,538015,GREY HEART HOT WATER BOTTLE,0
13240,547873,CHERRY BLOSSOM  DECORATIVE FLASK,0
13240,547873,ENAMEL FLOWER JUG CREAM,0
13240,565441,VINTAGE  2 METER FOLDING RULER,0
13240,547873,CITRONELLA CANDLE GARDEN POT,0
13240,547873,FRENCH ENAMEL CANDLEHOLDER,0
13240,547873,GLASS STAR FROSTED T-LIGHT HOLDER,0
13240,538015,BLACK LOVE BIRD CANDLE,0
13240,565441,GLASS BON BON JAR,0
13240,547873,SOAP DISH BROCANTE,0
13240,557310,CAMPHOR WOOD PORTOBELLO MUSHROOM,0
13240,538015,ANTIQUE GLASS HEART DECORATION,0
13240,547873,BLACK HEART CARD HOLDER,0
13240,547873,Manual,0
13240,547873,NATURAL SLATE RECTANGLE CHALKBOARD,0
13240,565441,POSTE FRANCE CUSHION COVER,0
13240,547873,JARDIN ETCHED GLASS CHEESE DISH,0
13240,557310,GLASS APOTHECARY BOTTLE ELIXIR,0
13240,547873,BLACK TEA TOWEL CLASSIC DESIGN,0
13240,557310,SMALL TALL CAMPHOR WOOD TOADSTOOL,0
13240,547873,JARDIN ETCHED GLASS FRUITBOWL,0
13240,538015,IVORY LOVE BIRD CANDLE,0
13240,538015,S/15 SILVER GLASS BAUBLES IN BAG,0
13240,557310,GAOLERS KEYS DECORATIVE GARDEN,0
13240,557310,GLASS APOTHECARY BOTTLE ELIXIR,0
13240,565441,SET/6 BLACK BIRD T-LIGHT CANDLES,0
13240,547873,CHERRY BLOSSOM DECORATIVE FLASK,0
13240,538015,SMALL SQUARE CUT GLASS CANDLESTICK,0
13240,547873,NATURAL SLATE HEART CHALKBOARD,0
13240,538015,COLOUR GLASS. STAR T-LIGHT HOLDER,0
13240,538015,ORANGE VOTIVE CANDLE,0
13240,565441,CUT GLASS T-LIGHT HOLDER OCTAGON,0
13240,538015,SOAP DISH BROCANTE,0
13240,565441,ETCHED GLASS COASTER,0
13240,538015,GLASS CLOCHE LARGE,0
13240,547873,MINI CAKE STAND T-LIGHT HOLDER,0
13240,538015,S/4 BLACK MINI ROSE CANDLE IN BOWL,0
13240,565441,HOME SWEET HOME HANGING HEART,0
13299,546752,NATURAL SLATE CHALKBOARD LARGE,2
13299,546752,ROSES REGENCY TEACUP AND SAUCER,2
13299,546752,ROUND SNACK BOXES SET OF4 WOODLAND,2
13299,546752,PICNIC BASKET WICKER LARGE,2
13299,546752,NATURAL SLATE HEART CHALKBOARD,2
13658,553894,CHOCOLATE HOT WATER BOTTLE,0
13658,579540,TRADITIONAL PICK UP STICKS GAME,0
13658,579540,DOORMAT HOME SWEET HOME BLUE,0
13658,553894,JUMBO BAG VINTAGE LEAF,0
13658,579540,JUMBO BAG APPLES,0
13658,579542,JUMBO BAG PAISLEY PARK,0
13658,566869,60 CAKE CASES DOLLY GIRL DESIGN,0
13658,566869,PLASTERS IN TIN WOODLAND ANIMALS,0
13658,566869,ICE CREAM BUBBLES,0
13658,566869,BAKING SET 9 PIECE RETROSPOT,0
13658,566869,JUMBO BAG VINTAGE LEAF,0
13658,566869,HOLIDAY FUN LUDO,0
13658,553894,WOODEN CROQUET GARDEN SET,0
13658,566869,PLASTERS IN TIN SKULLS,0
13658,566869,I LOVE LONDON BABY GIFT SET,0
13658,553894,CREAM SWEETHEART EGG HOLDER,0
13658,566869,JUMBO BAG VINTAGE DOILY,0
13658,553894,RECYCLED ACAPULCO MAT GREEN,0
13658,579540,JUMBO BAG PINK VINTAGE PAISLEY,0
13658,579540,JUMBO BAG 50'S CHRISTMAS,0
13658,553894,CHILDREN'S APRON DOLLY GIRL,0
13658,553894,BLUE SPOT CERAMIC DRAWER KNOB,0
13658,566869,COTTON APRON PANTRY DESIGN,0
13658,566869,CERAMIC STRAWBERRY CAKE MONEY BANK,0
13658,566869,CERAMIC HEART FAIRY CAKE MONEY BANK,0
13658,553894,RECYCLED ACAPULCO MAT PINK,0
13658,553894,JUMBO BAG DOILEY PATTERNS,0
13658,566869,SET 2 PANTRY DESIGN TEA TOWELS,0
13658,566870,DRAWER KNOB VINTAGE GLASS BALL,0
13658,553894,RED STRIPE CERAMIC DRAWER KNOB,0
13658,553894,LARGE CAKE STAND  HANGING STRAWBERY,0
13658,566869,TRADITIONAL KNITTING NANCY,0
13658,553894,SWEETHEART CERAMIC TRINKET BOX,0
13658,579540,JUMBO BAG WOODLAND ANIMALS,0
13658,579542,DOORMAT KEEP CALM AND COME IN,0
13658,566869,HOT WATER BOTTLE KEEP CALM,0
13658,553894,PINK FAIRY CAKE CHILDRENS APRON,0
13658,553894,SET OF 72 PINK HEART PAPER DOILIES,0
13658,553894,RED SPOT CERAMIC DRAWER KNOB,0
13658,566869,PLASTERS IN TIN CIRCUS PARADE,0
13658,579540,EDWARDIAN PARASOL BLACK,0
13658,566869,JUMBO BAG DOLLY GIRL DESIGN,0
13658,579540,WOODEN BOX OF DOMINOES,0
13658,566870,DRAWER KNOB VINTAGE GLASS STAR,0
13658,566869,WORLD WAR 2 GLIDERS ASSTD DESIGNS,0
13658,553894,JUMBO STORAGE BAG SKULLS,0
13658,553894,SET OF 36 TEATIME PAPER DOILIES,0
13658,566869,REGENCY CAKESTAND 3 TIER,0
13658,553894,PICNIC BASKET WICKER LARGE,0
13658,579540,DOORMAT UNION FLAG,0
13658,579540,JUMBO STORAGE BAG SKULLS,0
13658,579540,JUMBO BAG VINTAGE CHRISTMAS,0
13658,566869,JUMBO BAG SPACEBOY DESIGN,0
13658,566869,LUNCH BAG ALPHABET DESIGN,0
13658,566869,JUMBO BAG VINTAGE CHRISTMAS,0
13658,566869,LUNCH BAG DOLLY GIRL DESIGN,0
13658,579540,DOORMAT KEEP CALM AND COME IN,0
13658,553894,CINDERELLA CHANDELIER,0
13658,553894,BLUE STRIPE CERAMIC DRAWER KNOB,0
13658,566869,DOORMAT SPOTTY HOME SWEET HOME,0
13658,579540,VINTAGE DOILY JUMBO BAG RED,0
13658,579542,VINTAGE DOILY JUMBO BAG RED,0
13658,579540,TRADITIONAL NAUGHTS & CROSSES,0
13658,566869,JUMBO BAG ALPHABET,0
13658,553894,RECYCLED ACAPULCO MAT TURQUOISE,0
13658,566869,JUMBO BAG APPLES,0
13658,553894,WATERING CAN BLUE ELEPHANT,0
13658,566869,BINGO SET,0
13658,566870,SET OF 12 FORK CANDLES,0
13658,566869,CERAMIC CHERRY CAKE MONEY BANK,0
13658,579540,PLASTERS IN TIN SKULLS,0
13658,553894,REGENCY CAKESTAND 3 TIER,0
13658,553894,RECYCLED ACAPULCO MAT LAVENDER,0
13658,566869,DOLLY GIRL BABY GIFT SET,0
13658,579540,EDWARDIAN PARASOL NATURAL,0
13658,566869,JUMBO BAG 50'S CHRISTMAS,0
13658,579540,DOORMAT RED RETROSPOT,0
13658,553894,VINTAGE SNAKES & LADDERS,0
13658,566869,DOORMAT PEACE ON EARTH BLUE,0
13658,566870,SET OF 36 DOILIES PANTRY DESIGN,0
13658,579540,JUMBO BAG ALPHABET,0
13658,566870,DRAWER KNOB CERAMIC RED,0
13658,553894,CHILDRENS APRON APPLES DESIGN,0
13658,566869,VINTAGE SNAKES & LADDERS,0
13658,566869,DOORMAT UNION FLAG,0
13658,566869,PLASTERS IN TIN SPACEBOY,0
13658,553894,STRAWBERRY CERAMIC TRINKET BOX,0
13658,553894,WHITE SPOT BLUE CERAMIC DRAWER KNOB,0
13658,553894,JUMBO BAG DOLLY GIRL DESIGN,0
13658,566869,LUNCH BAG CARS BLUE,0
13658,566869,LUNCH BAG  BLACK SKULL.,0
13658,579540,EDWARDIAN PARASOL PINK,0
13658,579540,JUMBO BAG SPACEBOY DESIGN,0
13658,566869,DOORMAT CHRISTMAS VILLAGE,0
13658,566869,WOODEN SCHOOL COLOURING SET,0
13658,566869,BOX OF VINTAGE JIGSAW BLOCKS,0
13658,579540,JUMBO BAG PEARS,0
13658,566869,VINTAGE SNAP CARDS,0
13658,566869,JUMBO BAG PEARS,0
13658,579542,LUNCH BAG RED VINTAGE DOILY,0
13658,553894,JUMBO BAG ALPHABET,0
13658,566870,SET OF 72 RETROSPOT PAPER  DOILIES,0
13658,553894,WHITE SPOT RED CERAMIC DRAWER KNOB,0
13658,553894,WATERING CAN PINK BUNNY,0
13658,566869,TRADITIONAL WOODEN CATCH CUP GAME,0
13658,566870,DRAWER KNOB CERAMIC BLACK,0
13658,566869,LUNCH BAG APPLE DESIGN,0
13658,579540,HOT WATER BOTTLE I AM SO POORLY,0
14029,570184,DISCO BALL ROTATOR BATTERY OPERATED,0
14029,560441,PINK PAPER PARASOL,0
14029,560441,MRS ROBOT SOFT TOY,0
14029,560441,RED PAPER PARASOL,0
14029,570184,KEY RING BASEBALL BOOT UNION JACK,0
14029,560441,WOODEN CROQUET GARDEN SET,0
14029,570184,ABC TREASURE BOOK BOX,0
14029,570184,MIRRORED DISCO BALL,0
14029,570184,VINTAGE SNAP CARDS,0
14029,560441,WOODEN SKITTLES GARDEN SET,0
14029,570184,GROW A FLYTRAP OR SUNFLOWER IN TIN,0
14029,570184,PACK OF 12 LONDON TISSUES,0
14029,560441,MR ROBOT SOFT TOY,0
14029,570184,VINTAGE SNAKES & LADDERS,0
14029,570184,KEY RING BASEBALL BOOT ASSORTED,0
14259,560805,CHOCOLATE BOX RIBBONS,2
14259,560805,RIBBON REEL HEARTS DESIGN,2
14259,560805,6 RIBBONS RUSTIC CHARM,2
14259,560805,BLUE POLKADOT GARDEN PARASOL,2
14259,560805,RIBBON REEL FLORA + FAUNA,2
14805,542598,DOORMAT FANCY FONT HOME SWEET HOME,0
14805,542598,PLEASE ONE PERSON METAL SIGN,0
14805,542598,NO SINGING METAL SIGN,0
14805,578631,DOORMAT KEEP CALM AND COME IN,0
14805,577408,CHOCOLATE HOT WATER BOTTLE,0
14805,542598,OVAL WALL MIRROR DIAMANTE,0
14805,542598,DOORMAT UNION FLAG,0
14805,542598,MIRROR MOSAIC GOBLET CANDLE HOLDER,0
14805,542598,DOORMAT NEW ENGLAND,0
14805,577408,DOORMAT KEEP CALM AND COME IN,0
14805,571464,DOORMAT UNION FLAG,0
14805,542598,DOORMAT SPOTTY HOME SWEET HOME,0
14805,577408,DOORMAT SPOTTY HOME SWEET HOME,0
14805,571464,DOORMAT KEEP CALM AND COME IN,0
14805,571464,PEACE WOODEN BLOCK LETTERS,0
14805,542598,CHOCOLATE THIS WAY METAL SIGN,0
14805,571464,DOORMAT NEW ENGLAND,0
14805,571464,OVAL WALL MIRROR DIAMANTE,0
14805,542598,STRAWBERRY RAFFIA FOOD COVER,0
14805,542598,PINK FLOWER CROCHET FOOD COVER,0
14805,577408,OVAL WALL MIRROR DIAMANTE,0
14805,578631,DOORMAT UNION FLAG,0
14805,577408,DOORMAT FANCY FONT HOME SWEET HOME,0
14805,542598,RED FLOWER CROCHET FOOD COVER,0
14805,578631,DOORMAT FAIRY CAKE,0
14805,578631,CHOCOLATE HOT WATER BOTTLE,0
14805,542598,GIN + TONIC DIET METAL SIGN,0
14805,578631,DOORMAT RESPECTABLE HOUSE,0
14805,578631,HOT WATER BOTTLE KEEP CALM,0
14805,578631,LOVE HOT WATER BOTTLE,0
14805,577408,DOORMAT UNION FLAG,0
14805,571464,DOORMAT FANCY FONT HOME SWEET HOME,0
14805,571464,LOVE BUILDING BLOCK WORD,0
14805,542598,GRAND CHOCOLATECANDLE,0
14805,542598,FLOWER VINE RAFFIA FOOD COVER,0
14805,542598,METAL SIGN HIS DINNER IS SERVED,0
14805,542598,METAL SIGN HER DINNER IS SERVED,0
14805,571464,PANTRY ROLLING PIN,0
14805,571464,GRAND CHOCOLATECANDLE,0
14805,578631,HOT WATER BOTTLE TEA AND SYMPATHY,0
14805,542598,METAL SIGN TAKE IT OR LEAVE IT,0
14805,571464,OPEN CLOSED METAL SIGN,0
14805,577408,LOVE HOT WATER BOTTLE,0
14805,577408,HOT WATER BOTTLE TEA AND SYMPATHY,0
14805,542598,LADYBIRD + BEE RAFFIA FOOD COVER,0
14805,577408,HOT WATER BOTTLE KEEP CALM,0
15221,537801,CREAM SWEETHEART WALL CABINET,2
15221,537801,WOOD S/3 CABINET ANT WHITE FINISH,2
15221,537801,CHEST 7 DRAWER MA CAMPAGNE,2
15221,537801,WOOD 2 DRAWER CABINET WHITE FINISH,2
15221,537801,CUPBOARD 3 DRAWER MA CAMPAGNE,2
15758,576398,KNITTED UNION FLAG HOT WATER BOTTLE,0
15758,576398,LOVE HOT WATER BOTTLE,0
15758,576398,WHITE SKULL HOT WATER BOTTLE,0
15758,576398,GREY HEART HOT WATER BOTTLE,0
15758,576398,RETROSPOT HEART HOT WATER BOTTLE,0
15758,576398,SCOTTIE DOG HOT WATER BOTTLE,0
15758,576398,CHOCOLATE HOT WATER BOTTLE,0
15758,576398,FAWN BLUE HOT WATER BOTTLE,0
15758,576398,BIRD HOUSE HOT WATER BOTTLE,0
15921,557389,EDWARDIAN PARASOL BLACK,2
15921,557389,RECYCLED ACAPULCO MAT RED,2
15921,557389,WASHROOM METAL SIGN,2
15921,557389,VICTORIAN  METAL POSTCARD SPRING,2
15921,557389,LARGE MEDINA STAMPED METAL BOWL,2
15921,557389,SMALL GLASS HEART TRINKET POT,2
15921,557389,VINTAGE CREAM CAT FOOD CONTAINER,2
15921,557389,DOORMAT ENGLISH ROSE,2
15921,557389,BREAD BIN DINER STYLE IVORY,2
15921,557389,SET OF 9 HEART SHAPED BALLOONS,2
15921,557389,RIDGED GLASS FINGER BOWL,2
15921,557389,JUMBO  BAG BAROQUE BLACK WHITE,2
15921,557389,FRENCH WC SIGN BLUE METAL,2
15921,557389,TOILET SIGN OCCUPIED OR VACANT,2
15921,557389,HANGING HEART JAR T-LIGHT HOLDER,2
15921,557389,REGENCY SUGAR BOWL GREEN,2
15921,557389,YOU'RE CONFUSING ME METAL SIGN,2
15921,557389,MOROCCAN TEA GLASS,2
15921,557389,VINTAGE CREAM DOG FOOD CONTAINER,2
15921,557389,EMPIRE TISSUE BOX,2
15921,557389,REGENCY MILK JUG PINK,2
15921,557389,METAL SIGN EMPIRE TEA,2
15921,557389,ENGLISH ROSE GARDEN SECATEURS,2
15921,557389,HANGING ENGRAVED METAL HEART,2
16441,544596,T-LIGHT GLASS FLUTED ANTIQUE,0
16441,544596,SET OF 4 NAPKIN CHARMS CUTLERY,0
16441,544596,RETROSPOT TEA SET CERAMIC 11 PC,0
16441,569396,STOOL HOME SWEET HOME,0
16441,544596,GOLD SCROLL GLASS T-LIGHT HOLDER,0
16441,544596,4 VANILLA BOTANICAL CANDLES,0
16441,569396,GLITTER STAR GARLAND WITH BELLS,0
16441,569396,SMALL HAMMERED SILVER CANDLEPOT,0
16441,569396,COFFEE MUG PINK PAISLEY DESIGN,0
16441,569396,SOLDIERS EGG CUP,0
16441,569396,SET OF 4 NAPKIN CHARMS CUTLERY,0
16441,569396,HOME SWEET HOME CUSHION COVER,0
16441,544596,FLUTED ANTIQUE CANDLE HOLDER,0
16441,569396,COFFEE MUG DOG + BALL DESIGN,0
16441,544596,SMALL GLASS HEART TRINKET POT,0
16441,569396,SET OF 4 ROSE BOTANICAL CANDLES,0
16441,569396,FOOT STOOL HOME SWEET HOME,0
16441,544596,HEART FILIGREE DOVE  SMALL,0
16441,544596,GOLD SCROLL GLASS T-LIGHT HOLDER,0
16441,544596,ROSES REGENCY TEACUP AND SAUCER,0
16441,544596,QUEENS GUARD COFFEE MUG,0
16441,544596,HEART FILIGREE DOVE LARGE,0
16441,569396,DECORATIVE WICKER HEART LARGE,0
16441,544596,GLITTER HEART GARLAND WITH BELLS,0
16781,536759,CAKE STAND VICTORIAN FILIGREE MED,2
16781,536759,GAOLERS KEYS DECORATIVE GARDEN,2
16781,536759,VICTORIAN SEWING BOX MEDIUM,2
16781,536759,RED RETROSPOT MUG,2
16781,536759,MA CAMPAGNE CUTLERY BOX,2
16781,536759,WOOD BLACK BOARD ANT WHITE FINISH,2
16781,536759,DOORMAT 3 SMILEY CATS,2
16781,536759,BLACK WINE GLASS,2
16781,536759,CLASSICAL ROSE CANDLESTAND,2
16781,536759,GLITTER BUTTERFLY CLIPS,2
16781,536759,FRIDGE MAGNETS LA VIE EN ROSE,2
16781,536759,BLACK CHAMPAGNE GLASS,2
16781,536759,YELLOW GIANT GARDEN THERMOMETER,2
16781,536759,WOODEN FRAME ANTIQUE WHITE,2
16781,536759,WOOD S/3 CABINET ANT WHITE FINISH,2
16781,536759,HEART IVORY TRELLIS LARGE,2
16781,536759,DOORMAT FAIRY CAKE,2
17370,557857,DRAWER KNOB CERAMIC BLACK,0
17370,557857,DRAWER KNOB CERAMIC IVORY,0
17370,567141,72 SWEETHEART FAIRY CAKE CASES,0
17370,566047,GUMBALL COAT RACK,0
17370,566047,HOUSE SHAPE PENCIL SHARPENER,0
17370,568585,PLASTERS IN TIN SKULLS,0
17370,567141,RED FLOCK LOVE HEART PHOTO FRAME,0
17370,567141,PLASTERS IN TIN CIRCUS PARADE,0
17370,568585,TRAVEL CARD WALLET SKULLS,0
17370,567141,JAZZ HEARTS ADDRESS BOOK,0
17370,567141,BOUDOIR SQUARE TISSUE BOX,0
17370,566047,12 PENCILS TALL TUBE POSY,0
17370,557857,PURPLE DRAWERKNOB ACRYLIC EDWARDIAN,0
17370,568585,TRAVEL CARD WALLET FLOWER MEADOW,0
17370,566047,DRAWER KNOB CERAMIC BLACK,0
17370,568585,TRAVEL CARD WALLET VINTAGE TICKET,0
17370,567141,PACK OF 72 SKULL CAKE CASES,0
17370,568585,CHILDS BREAKFAST SET CIRCUS PARADE,0
17370,557857,DRAWER KNOB CRACKLE GLAZE IVORY,0
17370,566047,BATHROOM SCALES FOOTPRINTS IN SAND,0
17370,557857,RED DRAWER KNOB ACRYLIC EDWARDIAN,0
17370,567141,PLASTERS IN TIN SKULLS,0
17370,566047,SET OF 6 NATIVITY MAGNETS,0
17370,557857,PINK MONTE CARLO HANDBAG,0
17370,568585,SUKI  SHOULDER BAG,0
17370,557857,BLUE DRAWER KNOB ACRYLIC EDWARDIAN,0
17370,568585,SKULL SHOULDER BAG,0
17370,566047,MINIATURE ANTIQUE ROSE HOOK IVORY,0
17370,557857,PINK DRAWER KNOB ACRYLIC EDWARDIAN,0
17370,566047,SINGLE ANTIQUE ROSE HOOK IVORY,0
17370,568585,TRAVEL CARD WALLET SUKI,0
17370,566047,CLEAR DRAWER KNOB ACRYLIC EDWARDIAN,0
17370,567141,SKULLS SQUARE TISSUE BOX,0
17595,574079,LARGE ANTIQUE WHITE PHOTO FRAME,0
17595,574079,GLASS JAR PEACOCK BATH SALTS,0
17595,578999,RED METAL BOX TOP SECRET,0
17595,578999,SET OF 6 T-LIGHTS SNOWMEN,0
17595,578999,SET OF 3 WOODEN STOCKING DECORATION,0
17595,578999,ABSTRACT CIRCLES SKETCHBOOK,0
17595,578999,MOODY GIRL DOOR HANGER,0
17595,574079,BUNDLE OF 3 RETRO NOTE BOOKS,0
17595,578999,BEWARE OF THE CAT METAL SIGN,0
17595,578999,PACK OF SIX LED TEA LIGHTS,0
17595,574079,AREA PATROLLED METAL SIGN,0
17595,574079,GLASS JAR ENGLISH CONFECTIONERY,0
17595,578999,NATURAL SLATE CHALKBOARD LARGE,0
17595,578999,PACK OF 6 BIRDY GIFT TAGS,0
17595,578999,NATURAL SLATE HEART CHALKBOARD,0
17595,578999,DAISY SKETCHBOOK,0
17595,578999,PLEASE ONE PERSON METAL SIGN,0
17595,574079,WHITE ROCKING HORSE HAND PAINTED,0
17595,574079,CLASSIC CAFE SUGAR DISPENSER,0
17595,574079,CACTI T-LIGHT CANDLES,0
17595,574079,BOX OF 9 PEBBLE CANDLES,0
17595,574079,WHITE WOOD GARDEN PLANT LADDER,0
17595,578999,6 CHOCOLATE LOVE HEART T-LIGHTS,0
17595,574079,GREEN METAL BOX ARMY SUPPLIES,0
17595,578999,DECORATIVE WICKER HEART MEDIUM,0
17595,578999,IVORY WICKER HEART MEDIUM,0
17595,574079,LARGE CIRCULAR MIRROR MOBILE,0
17595,574079,3 HEARTS HANGING DECORATION RUSTIC,0
17595,578999,HEART WREATH DECORATION WITH BELL,0
17595,578999,N0 SINGING METAL SIGN,0
17595,574079,HAND OVER THE CHOCOLATE   SIGN,0
17595,578999,MOODY BOY  DOOR HANGER,0
17595,578999,CLASSIC CAFE SUGAR DISPENSER,0
17595,578999,GIN AND TONIC DIET METAL SIGN,0
17595,578999,RED ROCKING HORSE HAND PAINTED,0
17595,578999,LARGE CIRCULAR MIRROR MOBILE,0
17595,578999,GREEN METAL BOX ARMY SUPPLIES,0
17595,578999,GREEN FERN JOURNAL,0
17595,574079,GLASS JAR KINGS CHOICE,0
17595,574079,DECORATIVE WICKER HEART SMALL,0
17595,574079,SET OF 4 SANTA PLACE SETTINGS,0
17595,574079,AGED GLASS SILVER T-LIGHT HOLDER,0
17595,574079,GARDEN PATH SKETCHBOOK,0
17595,574079,MADRAS NOTEBOOK MEDIUM,0
17595,578999,DECORATIVE WICKER HEART LARGE,0
17595,574079,THREE MINI HANGING FRAMES,0
17595,574079,RED METAL BOX TOP SECRET,0
17595,578999,NOEL WOODEN BLOCK LETTERS,0
17595,574079,IVORY WICKER HEART SMALL,0
17595,578999,SET OF 6 T-LIGHTS SANTA,0
17595,578999,GARDEN PATH JOURNAL,0
17595,578999,CACTI T-LIGHT CANDLES,0
17595,578999,BLUE PAISLEY JOURNAL,0
17595,578999,CHRYSANTHEMUM SKETCHBOOK,0
17595,574079,OPEN CLOSED METAL SIGN,0
17595,578999,VINTAGE BELLS GARLAND,0
17595,578999,AGED GLASS SILVER T-LIGHT HOLDER,0
17595,574079,CLASSIC GLASS COOKIE JAR,0
17595,578999,IVORY WICKER HEART LARGE,0
17595,574079,ABSTRACT CIRCLES SKETCHBOOK,0
17595,578999,DAISY JOURNAL,0
17595,578999,I'M ON HOLIDAY METAL SIGN,0
17595,578999,SMALL MEDINA STAMPED METAL BOWL,0
17595,578999,WHITE ROCKING HORSE HAND PAINTED,0
17595,574079,HOT BATHS METAL SIGN,0
17595,578999,SLATE TILE NATURAL HANGING,0
17595,578999,NATURAL SLATE RECTANGLE CHALKBOARD,0
17595,578999,REX CASH+CARRY JUMBO SHOPPER,0
17595,578999,ANTIQUE SILVER T-LIGHT GLASS,0
17595,578999,ZINC HEART LATTICE T-LIGHT HOLDER,0
17595,574079,GLASS JAR DAISY FRESH COTTON WOOL,0
17595,578999,HAND OVER THE CHOCOLATE   SIGN,0
17595,578999,PACK OF 12 50'S CHRISTMAS TISSUES,0
17595,574079,SET OF 3 WOODEN STOCKING DECORATION,0
17595,574079,RED ROCKING HORSE HAND PAINTED,0
17595,574079,ANTIQUE SILVER TEA GLASS ENGRAVED,0
17595,574079,CHRYSANTHEMUM SKETCHBOOK,0
17595,574079,6 CHOCOLATE LOVE HEART T-LIGHTS,0
17595,578999,PACK OF 12 VINTAGE CHRISTMAS TISSUE,0
17595,578999,SCENTED VELVET LOUNGE CANDLE,0
17595,578999,3 HEARTS HANGING DECORATION RUSTIC,0
17595,578999,WASHROOM METAL SIGN,0
18117,576213,PENS ASSORTED FUNKY JEWELED,0
18117,576213,RETROSPOT GIANT TUBE MATCHES,0
18117,576213,SWALLOW SQUARE TISSUE BOX,0
18117,576213,EDWARDIAN PARASOL PINK,0
18117,576213,12 MESSAGE CARDS WITH ENVELOPES,0
18117,576213,SQUARECUSHION COVER PINK UNION JACK,0
18117,576213,WHITE GOOSE FEATHER TREE 60CM,0
18117,576213,LARGE WHITE HEART OF WICKER,0
18117,576213,PACK OF 12 VINTAGE CHRISTMAS TISSUE,0
18117,576213,WOODEN HEART CHRISTMAS SCANDINAVIAN,0
18117,576213,OVERNIGHT BAG VINTAGE ROSE PAISLEY,0
18117,576213,PENS ASSORTED SPACEBALL,0
18117,576213,Manual,0
18117,576213,ENGLISH ROSE NOTEBOOK A7 SIZE,0
18117,576213,ASS FLORAL PRINT MULTI SCREWDRIVER,0
18117,576213,PACK OF 12 RED RETROSPOT TISSUES,0
18117,576213,SMALL WHITE HEART OF WICKER,0
18117,576213,ZINC FOLKART SLEIGH BELLS,0
18117,576213,CUTE CATS TAPE,0
18117,576213,3 HEARTS HANGING DECORATION RUSTIC,0
18117,576213,RIBBON REEL POLKADOTS,0
18117,576213,SET/6 COLLAGE PAPER PLATES,0
18117,576213,BROCADE RING PURSE,0
18117,576213,ASS FLORAL PRINT SPIRIT LEVEL,0
18117,576213,SET OF 12 MINI LOAF BAKING CASES,0
18117,576213,JINGLE BELL HEART DECORATION,0
18117,576213,WOODEN HEART CHRISTMAS SCANDINAVIAN,0
18117,576213,COSMETIC BAG VINTAGE ROSE PAISLEY,0
18117,576213,BOUDOIR SQUARE TISSUE BOX,0
18117,576213,SET OF 3 WOODEN HEART DECORATIONS,0
18117,576213,STAR DECORATION RUSTIC,0
18117,576213,SILVER GLITTER FLOWER VOTIVE HOLDER,0
18117,576213,JINGLE BELL HEART DECORATION,0
18117,576213,SILVER MUG BONE CHINA TREE OF LIFE,0
18117,576213,REX CASH+CARRY JUMBO SHOPPER,0
18117,576213,LETTER SHAPE PENCIL SHARPENER,0
18117,576213,PACK OF 72 RETROSPOT CAKE CASES,0
18117,576213,12 PENCILS TALL TUBE RED RETROSPOT,0
18117,576213,PINK PAISLEY SQUARE TISSUE BOX,0
18117,576213,CLOTHES PEGS RETROSPOT PACK 24,0
18117,576213,WOOD STAMP SET FLOWERS,0
18117,576213,STAR DECORATION PAINTED ZINC,0
18117,576213,PAPER BUNTING RETROSPOT,0
18117,576213,SCENTED VELVET LOUNGE CANDLE,0
18117,576213,PANTRY WASHING UP BRUSH,0
18117,576213,JAM MAKING SET PRINTED,0
18117,576213,GLITTER CHRISTMAS STAR,0
18117,576213,COLUMBIAN CANDLE ROUND,0
18117,576213,RETROSPOT CIGAR BOX MATCHES,0
18117,576213,BOUDOIR SQUARE TISSUE BOX,0
18117,576213,SET OF 3 WOODEN STOCKING DECORATION,0
18117,576213,BOX OF 6 MINI 50'S CRACKERS,0
18117,576213,SET OF 3 WOODEN TREE DECORATIONS,0
18117,576213,WOOD STAMP SET THANK YOU,0
18117,576213,WOODEN STAR CHRISTMAS SCANDINAVIAN,0
18117,576213,SLEEPING CAT ERASERS,0
18117,576213,GREEN CHRISTMAS TREE CARD HOLDER,0
18117,576213,GLITTER HEART DECORATION,0
18117,576213,HANGING METAL HEART LANTERN,0
18117,576213,"FEATHER PEN,COAL BLACK",0
18117,576213,RETROSPOT SMALL TUBE MATCHES,0
18117,576213,4 VANILLA BOTANICAL CANDLES,0
18117,576213,WOODEN STAR CHRISTMAS SCANDINAVIAN,0
18117,576213,HEART DECORATION PAINTED ZINC,0
18117,576213,PAPER BUNTING VINTAGE PAISLEY,0
18117,576213,"FEATHER PEN,HOT PINK",0
18117,576213,HANGING METAL STAR LANTERN,0
18117,576213,GLAMOROUS  MUG,0
18117,576213,CHRISTMAS GINGHAM TREE,0
18117,576213,RED RETROSPOT CHARLOTTE BAG,0
18117,576213,PACK OF 12 PAISLEY PARK TISSUES,0
18117,576213,ORIGAMI LAVENDER INCENSE/CANDL SET,0
