12949,548648,36 PENCILS TUBE RED RETROSPOT,1
12949,561933,WOODEN PICTURE FRAME WHITE FINISH,1
12949,563578,ZINC WILLIE WINKIE  CANDLE STICK,1
12949,548648,PACK OF 12 RED RETROSPOT TISSUES,1
12949,548648,WASHROOM METAL SIGN,1
12949,548648,BATH BUILDING BLOCK WORD,1
12949,548648,CLOTHES PEGS RETROSPOT PACK 24,1
12949,553505,REGENCY TEA PLATE GREEN,1
12949,575221,ANTIQUE SILVER T-LIGHT GLASS,1
12949,575221,SILVER BELLS TABLE DECORATION,1
12949,575221,BIRD HOUSE HOT WATER BOTTLE,1
12949,548648,RETROSPOT PADDED SEAT CUSHION,1
12949,561933,PINK BLUE FELT CRAFT TRINKET BOX,1
12949,561933,FRENCH WC SIGN BLUE METAL,1
12949,561933,HEART FILIGREE DOVE  SMALL,1
12949,548648,ENCHANTED BIRD COATHANGER 5 HOOK,1
12949,561933,CREAM HEART CARD HOLDER,1
12949,563578,FUNKY DIVA PEN,1
12949,548648,TEA BAG PLATE RED RETROSPOT,1
12949,561933,WHITE BROCANTE SOAP DISH,1
12949,575221,REGENCY TEA PLATE ROSES,1
12949,561933,POPCORN HOLDER,1
12949,561952,RIDGED BONNE JAM JAR T-LIGHT HOLDER,1
12949,548648,HANGING JAM JAR T-LIGHT HOLDER,1
12949,548648,"KEY FOB , SHED",1
12949,575221,PANTRY MAGNETIC  SHOPPING LIST,1
12949,575221,3 DRAWER ANTIQUE WHITE WOOD CABINET,1
12949,548648,VINTAGE BILLBOARD LOVE/HATE MUG,1
12949,563578,12 PENCILS TALL TUBE WOODLAND,1
12949,548648,PACK OF 72 RETROSPOT CAKE CASES,1
12949,553505,RED RETROSPOT MINI CASES,1
12949,553505,WRAP DOILEY DESIGN,1
12949,561952,DRAWER KNOB CRACKLE GLAZE BLUE,1
12949,563578,CALENDAR PAPER CUT DESIGN,1
12949,548648,LAUNDRY 15C METAL SIGN,1
12949,548648,ANTIQUE SILVER TEA GLASS ENGRAVED,1
12949,548648,LOVE BUILDING BLOCK WORD,1
12949,548648,WOOD S/3 CABINET ANT WHITE FINISH,1
12949,561933,CARD GINGHAM ROSE,1
12949,561933,FANCY FONTS BIRTHDAY WRAP,1
12949,563578,HEART OF WICKER LARGE,1
12949,548648,NO SINGING METAL SIGN,1
12949,548648,ANTIQUE GLASS PEDESTAL BOWL,1
12949,548648,CLEAR DRAWER KNOB ACRYLIC EDWARDIAN,1
12949,561933,PARTY METAL SIGN,1
12949,553505,COLOUR GLASS T-LIGHT HOLDER HANGING,1
12949,561933,RED RETROSPOT CUP,1
12949,548648,COFFEE MUG APPLES DESIGN,1
12949,548648,VICTORIAN GLASS HANGING T-LIGHT,1
12949,548648,SET/20 RED RETROSPOT PAPER NAPKINS,1
12949,561933,NO SINGING METAL SIGN,1
12949,553505,GINGHAM ROSE WRAP,1
12949,553505,WOOD S/3 CABINET ANT WHITE FINISH,1
12949,563578,36 PENCILS TUBE SKULLS,1
12949,575221,SET OF 3 REGENCY CAKE TINS,1
12949,575221,PACK OF 12 SKULL TISSUES,1
12949,561933,RIBBON REEL HEARTS DESIGN,1
12949,575221,HAND WARMER RED LOVE HEART,1
12949,575221,HOME SWEET HOME HANGING HEART,1
12949,548648,ROSES REGENCY TEACUP AND SAUCER,1
12949,548648,HEART FILIGREE DOVE LARGE,1
12949,553505,STRAWBERRY CERAMIC TRINKET BOX,1
12949,548648,PAINTED METAL PEARS ASSORTED,1
12949,553505,RED RETROSPOT PLATE,1
12949,548648,SILVER HANGING T-LIGHT HOLDER,1
12949,553505,RED SPOTTY BISCUIT TIN,1
12949,561933,PAPER BUNTING RETROSPOT,1
12949,548648,RECYCLING BAG RETROSPOT,1
12949,553505,REGENCY TEA PLATE ROSES,1
12949,575221,HAND WARMER SCOTTY DOG DESIGN,1
12949,575221,FOOT STOOL HOME SWEET HOME,1
12949,548648,ANTIQUE GLASS DRESSING TABLE POT,1
12949,553505,UNION STRIPE WITH FRINGE  HAMMOCK,1
12949,548648,60 TEATIME FAIRY CAKE CASES,1
12949,561933,I'M ON HOLIDAY METAL SIGN,1
12949,553506,METAL 4 HOOK HANGER FRENCH CHATEAU,1
12949,548648,GREEN REGENCY TEACUP AND SAUCER,1
12949,548648,SET 7 BABUSHKA NESTING BOXES,1
12949,561952,SET OF 3 REGENCY CAKE TINS,1
12949,548648,POTTERING IN THE SHED METAL SIGN,1
12949,553505,ANTIQUE GLASS PEDESTAL BOWL,1
12949,553505,"BIRTHDAY CARD, RETRO SPOT",1
12949,561933,RIBBON REEL STRIPES DESIGN,1
12949,548648,RED RETROSPOT ROUND CAKE TINS,1
12949,553505,RED RETROSPOT CUP,1
12949,548648,FINE WICKER HEART,1
12949,553505,EMBOSSED GLASS TEALIGHT HOLDER,1
12949,561933,RED RETROSPOT SMALL MILK JUG,1
12949,575221,AGED GLASS SILVER T-LIGHT HOLDER,1
12949,548648,PAPER CHAIN KIT EMPIRE,1
12949,561933,"FANCY FONT BIRTHDAY CARD,",1
12949,548648,WHITE HANGING HEART T-LIGHT HOLDER,1
12949,561933,FRENCH LAUNDRY SIGN BLUE METAL,1
12949,561933,WOOD 2 DRAWER CABINET WHITE FINISH,1
12949,563578,12 PENCILS TALL TUBE SKULLS,1
12949,561933,ROSES REGENCY TEACUP AND SAUCER,1
12949,561933,CARD BILLBOARD FONT,1
12949,561933,ASSORTED COLOUR BIRD ORNAMENT,1
12949,563578,HEART FILIGREE DOVE  SMALL,1
12949,561933,ANTIQUE SILVER T-LIGHT GLASS,1
12949,575221,CHILLI LIGHTS,1
12949,548648,LUNCH BAG RED RETROSPOT,1
12949,548648,FLUTED ANTIQUE CANDLE HOLDER,1
12949,553505,REGENCY TEAPOT ROSES,1
12949,563578,12 PENCILS SMALL TUBE SKULL,1
12949,563578,SET OF 3 CAKE TINS PANTRY DESIGN,1
12949,575221,T-LIGHT GLASS FLUTED ANTIQUE,1
12949,548648,12 RED ROSE PEG PLACE SETTINGS,1
12949,575221,SET OF 3 CAKE TINS PANTRY DESIGN,1
12949,575221,LE JARDIN BOTANIQUE CUSHION COVER,1
12949,548648,PINK HEART SHAPE EGG FRYING PAN,1
12949,548648,WOOD 2 DRAWER CABINET WHITE FINISH,1
12949,563578,ANTIQUE TALL SWIRLGLASS TRINKET POT,1
12949,548648,HANGING HEART ZINC T-LIGHT HOLDER,1
12949,575221,BATH BUILDING BLOCK WORD,1
12949,548648,RED RETROSPOT UMBRELLA,1
12949,553505,PARTY BUNTING,1
12949,553505,RED RETROSPOT BOWL,1
12949,553505,SET OF 10 LED DOLLY LIGHTS,1
12949,575221,WOOD BLACK BOARD ANT WHITE FINISH,1
12949,548648,POTTING SHED TEA MUG,1
12949,553505,VINTAGE CREAM DOG FOOD CONTAINER,1
12949,548648,ASSORTED COLOUR BIRD ORNAMENT,1
12949,561933,LARGE CERAMIC TOP STORAGE JAR,1
12949,548648,6 RIBBONS RUSTIC CHARM,1
12949,553505,VINTAGE CREAM CAT FOOD CONTAINER,1
12949,548648,RED RETROSPOT SHOPPER BAG,1
12949,563578,CALENDAR FAMILY FAVOURITES,1
12949,553505,DOLLY GIRL CHILDRENS EGG CUP,1
12949,563578,SWEETHEART RECIPE BOOK STAND,1
12949,548648,PAPER BUNTING RETROSPOT,1
12949,563578,STRAWBERRY CERAMIC TRINKET BOX,1
12949,548648,RETRO COFFEE MUGS ASSORTED,1
12949,548648,ANTIQUE TALL SWIRLGLASS TRINKET POT,1
12949,561933,HAND OVER THE CHOCOLATE   SIGN,1
12949,575221,HOT WATER BOTTLE I AM SO POORLY,1
12949,561955,SET OF 72 RETROSPOT PAPER  DOILIES,1
12949,548648,BIRDHOUSE GARDEN MARKER,1
12949,561933,WHITE HANGING HEART T-LIGHT HOLDER,1
12949,575221,ASSORTED COLOUR BIRD ORNAMENT,1
12949,561933,POTTERING IN THE SHED METAL SIGN,1
12949,563578,FILIGREE HEART BUTTERFLY WHITE,1
12949,575221,HAND WARMER OWL DESIGN,1
12949,548648,ENAMEL FLOWER JUG CREAM,1
12949,553505,PARISIENNE KEY CABINET,1
12949,575221,WOODEN PICTURE FRAME WHITE FINISH,1
12949,548648,ZINC METAL HEART DECORATION,1
12949,563578,PARTY BUNTING,1
12949,563578,ANTIQUE GLASS PEDESTAL BOWL,1
12949,548648,EMBOSSED GLASS TEALIGHT HOLDER,1
12949,575221,PINK CREAM FELT CRAFT TRINKET BOX,1
12949,561933,WOOD S/3 CABINET ANT WHITE FINISH,1
12949,575221,LUNCH BAG  BLACK SKULL.,1
12949,548648,SET/3 RED GINGHAM ROSE STORAGE BOX,1
12949,548648,HEART FILIGREE DOVE  SMALL,1
12949,553505,WOOD BLACK BOARD ANT WHITE FINISH,1
12949,575221,HOT BATHS METAL SIGN,1
12949,575221,SET OF 2 TRAYS HOME SWEET HOME,1
12949,553505,HANGING METAL HEART LANTERN,1
12949,561955,WOODEN FRAME ANTIQUE WHITE,1
12949,563578,HEART FILIGREE DOVE LARGE,1
12949,575221,SET OF TEA COFFEE SUGAR TINS PANTRY,1
12949,553505,HEART OF WICKER LARGE,1
12949,561933,COLOUR GLASS T-LIGHT HOLDER HANGING,1
12949,553505,SMALL POPCORN HOLDER,1
12949,548648,BLUE DRAWER KNOB ACRYLIC EDWARDIAN,1
12949,553505,PARISIENNE CURIO CABINET,1
12949,548648,12 PENCILS TALL TUBE RED RETROSPOT,1
12949,548648,UNION STRIPE CUSHION COVER,1
12949,548648,HOT BATHS METAL SIGN,1
12949,575221,ROSES REGENCY TEACUP AND SAUCER,1
12949,575221,SET OF 6 SPICE TINS PANTRY DESIGN,1
12949,548648,20 DOLLY PEGS RETROSPOT,1
12949,553505,SWEETHEART WIRE FRUIT BOWL,1
12949,553506,T-LIGHT GLASS FLUTED ANTIQUE,1
12949,548648,COLOUR GLASS T-LIGHT HOLDER HANGING,1
12949,553505,PARISIENNE JEWELLERY DRAWER,1
12949,553505,RED METAL BOX TOP SECRET,1
12949,575221,SWEET HEART CAKE CARRIER,1
12949,548648,UNION STRIPE WITH FRINGE  HAMMOCK,1
12949,575221,LUNCH BAG VINTAGE DOILY,1
12949,553505,CARD GINGHAM ROSE,1
12949,548648,VICTORIAN  METAL POSTCARD SPRING,1
12949,548648,BLUE COAT RACK PARIS FASHION,1
12949,548648,REGENCY CAKESTAND 3 TIER,1
12949,553505,HEART OF WICKER SMALL,1
12949,561933,SPOTTY BUNTING,1
12949,553505,CREAM SWEETHEART EGG HOLDER,1
12949,561933,FILIGRIS HEART WITH BUTTERFLY,1
12949,561933,FILIGREE HEART BUTTERFLY WHITE,1
12949,548648,GREEN DRAWER KNOB ACRYLIC EDWARDIAN,1
12949,553505,HANGING HEART ZINC T-LIGHT HOLDER,1
12949,563578,POPCORN HOLDER,1
12949,575221,WOODEN FRAME ANTIQUE WHITE,1
12949,548648,MOROCCAN TEA GLASS,1
12949,553505,HOME BUILDING BLOCK WORD,1
12949,563578,HEART OF WICKER SMALL,1
12949,575221,HANGING  BUTTERFLY T-LIGHT HOLDER,1
12949,561933,FRENCH BATHROOM SIGN BLUE METAL,1
12949,548648,ANTIQUE SILVER T-LIGHT GLASS,1
12949,548648,SET OF 36 TEATIME PAPER DOILIES,1
12949,561933,FELTCRAFT 6 FLOWER FRIENDS,1
12949,561933,12 PENCILS TALL TUBE SKULLS,1
12949,548648,WOODEN PICTURE FRAME WHITE FINISH,1
12949,548648,GLITTER BUTTERFLY CLIPS,1
12949,563578,IVORY WIRE SWEETHEART LETTER TRAY,1
12949,548648,CREAM CUPID HEARTS COAT HANGER,1
12949,575221,WOOD 2 DRAWER CABINET WHITE FINISH,1
12949,561933,MEDIUM CERAMIC TOP STORAGE JAR,1
12949,548648,POTTERING MUG,1
12949,575221,WRAP PAISLEY PARK,1
12949,548648,PARTY METAL SIGN,1
12949,553505,ANTIQUE SILVER T-LIGHT GLASS,1
12949,553505,CERAMIC CHERRY CAKE MONEY BANK,1
12949,561933,6 RIBBONS RUSTIC CHARM,1
13422,569846,MAKE YOUR OWN FLOWERPOWER CARD KIT,0
13422,569846,MAKE YOUR OWN MONSOON CARD KIT,0
13422,569846,PAPER CHAIN KIT VINTAGE CHRISTMAS,0
13422,569846,HOLIDAY FUN LUDO,0
13422,569846,FAIRY TALE COTTAGE NIGHTLIGHT,0
13422,569846,BUTTON BOX,0
13422,569846,BOX OF VINTAGE ALPHABET BLOCKS,0
13422,569846,POPPY FIELDS CHOPPING BOARD,0
13422,569846,HOT WATER BOTTLE KEEP CALM,0
13422,569846,PLAYING CARDS KEEP CALM & CARRY ON,0
13422,569846,RIBBON REEL SNOWY VILLAGE,0
13422,569846,SET 8 CANDLES VINTAGE DOILEY,0
13422,569846,HAND WARMER SCOTTY DOG DESIGN,0
13422,569846,PANTRY ROLLING PIN,0
13422,569846,VINTAGE CHRISTMAS GIFT SACK,0
13422,569846,DELUXE SEWING KIT,0
13422,569846,PACK OF 12 TRADITIONAL CRAYONS,0
13422,569846,LUNCH BAG VINTAGE LEAF DESIGN,0
13422,569846,SET 6 SCHOOL MILK BOTTLES IN CRATE,0
13422,569846,VINTAGE CHRISTMAS TABLECLOTH,0
13422,569846,SET OF 6 NATIVITY MAGNETS,0
13422,569846,PACK OF 12 COLOURED PENCILS,0
13422,569846,HEADS AND TAILS SPORTING FUN,0
13422,569846,VINTAGE SNAKES & LADDERS,0
13422,569846,SOLDIERS EGG CUP,0
13422,569846,JUMBO BAG ALPHABET,0
13422,569846,JUMBO BAG PEARS,0
13422,569846,PICTURE DOMINOES,0
13422,569846,HAND WARMER OWL DESIGN,0
13422,569846,FELTCRAFT 6 FLOWER FRIENDS,0
13422,569846,DOILEY STORAGE TIN,0
13422,569846,CURIO CABINET LINEN AND LACE,0
13422,569846,36 DOILIES VINTAGE CHRISTMAS,0
13422,569846,SET OF 4 SANTA PLACE SETTINGS,0
13422,569846,SET OF 20 VINTAGE CHRISTMAS NAPKINS,0
13422,569846,VINTAGE SNAP CARDS,0
13422,569846,TRAVEL CARD WALLET KEEP CALM,0
13422,569846,PANTRY CHOPPING BOARD,0
13422,569846,CHRISTMAS METAL TAGS ASSORTED,0
13422,569846,SET OF 4 KNICK KNACK TINS DOILEY,0
13422,569846,GLASS  SONGBIRD STORAGE JAR,0
13422,569846,FELTCRAFT BUTTERFLY HEARTS,0
13422,569846,GLASS BONNE JAM JAR,0
13422,569846,SET OF 12 FORK CANDLES,0
13422,569846,SET OF 6 TEA TIME BAKING CASES,0
13422,569846,JAM JAR WITH PINK LID,0
13422,569846,PACK OF 20 NAPKINS PANTRY DESIGN,0
13422,569846,SILVER STARS TABLE DECORATION,0
13422,569846,CLOTHES PEGS RETROSPOT PACK 24,0
13422,569846,SET OF TEA COFFEE SUGAR TINS PANTRY,0
13422,569846,VILLAGE SHOW WALL ART,0
13422,569846,FELTCRAFT CHRISTMAS FAIRY,0
13422,569846,PACK OF 12 DOILEY TISSUES,0
13422,569846,FELTCRAFT PRINCESS CHARLOTTE DOLL,0
13422,569846,SET OF 60 PANTRY DESIGN CAKE CASES,0
13422,569846,BISCUIT TIN VINTAGE CHRISTMAS,0
13422,569846,PAINT YOUR OWN CANVAS SET,0
13422,569846,VINTAGE DONKEY TAIL GAME,0
13422,569846,SET 6 PAPER TABLE LANTERN HEARTS,0
13422,569846,BINGO SET,0
13422,569846,TRAVEL CARD WALLET PANTRY,0
13422,569846,BOX OF 6 MINI VINTAGE CRACKERS,0
13422,569846,VINTAGE CHRISTMAS PAPER GIFT BAG,0
13422,569846,FELTCRAFT CUSHION OWL,0
13422,569846,BLUE HARMONICA IN BOX,0
13422,569846,SET OF 4 KNICK KNACK TINS POPPIES,0
13422,569846,JUMBO BAG DOILEY PATTERNS,0
13422,569846,CHRISTMAS CRAFT WHITE FAIRY,0
13422,569846,SCOTTIE DOG HOT WATER BOTTLE,0
13422,569846,GINGHAM RECIPE BOOK BOX,0
13422,569846,SET OF 20 KIDS COOKIE CUTTERS,0
13422,569846,CUPCAKE LACE PAPER SET 6,0
13422,569846,GIFT BAG LARGE VINTAGE CHRISTMAS,0
13422,569846,TRAVEL CARD WALLET TRANSPORT,0
13422,569846,SET/5 RED RETROSPOT LID GLASS BOWLS,0
13422,569846,3 TIER CAKE TIN RED AND CREAM,0
13422,569846,WOODEN BOX OF DOMINOES,0
13422,569846,LUNCH BAG WOODLAND,0
13422,569846,PHOTO CUBE,0
13422,569846,JUMBO BAG APPLES,0
13422,569846,CLASSIC GLASS COOKIE JAR,0
13422,569846,TRADITIONAL MODELLING CLAY,0
13422,569846,3 STRIPEY MICE FELTCRAFT,0
13422,569846,SET OF 12 T-LIGHTS VINTAGE DOILEY,0
13422,569846,JUMBO BAG VINTAGE CHRISTMAS,0
13422,569846,VINTAGE LEAF CHOPPING BOARD,0
13422,569846,SILVER BELLS TABLE DECORATION,0
13422,569846,BATHROOM HOOK,0
13422,569846,3D TRADITIONAL CHRISTMAS STICKERS,0
13422,569846,COTTON APRON PANTRY DESIGN,0
13422,569846,RED APPLES CHOPPING BOARD,0
13422,569846,DOG LICENCE WALL ART,0
13422,569846,SET OF 6 RIBBONS VINTAGE CHRISTMAS,0
13422,569846,TRAVEL CARD WALLET VINTAGE LEAF,0
13422,569846,JAM MAKING SET WITH JARS,0
13422,569846,JUMBO BAG VINTAGE LEAF,0
13422,569846,JAM JAR WITH GREEN LID,0
13422,569846,SET 2 PANTRY DESIGN TEA TOWELS,0
13422,569846,HOME SWEET HOME HOOK,0
13422,569846,SET OF 3 CAKE TINS PANTRY DESIGN,0
13422,569846,LUNCH BAG ALPHABET DESIGN,0
13422,569846,CHRISTMAS LIGHTS 10 VINTAGE BAUBLES,0
13422,569846,HOT WATER BOTTLE I AM SO POORLY,0
13422,569846,RED  HARMONICA IN BOX,0
13422,569846,ROLL WRAP VINTAGE CHRISTMAS,0
13422,569846,HOMEMADE JAM SCENTED CANDLES,0
13422,569846,JAM MAKING SET PRINTED,0
13422,569846,VINTAGE CHRISTMAS STOCKING,0
13422,569846,RED TOADSTOOL LED NIGHT LIGHT,0
13422,569846,DOORMAT WELCOME TO OUR HOME,0
13422,569846,LUNCH BAG CARS BLUE,0
13422,569846,BOX OF VINTAGE JIGSAW BLOCKS,0
13422,569846,VINTAGE CHRISTMAS CAKE FRILL,0
13422,569846,3D CHRISTMAS STAMPS STICKERS,0
13422,569846,VINTAGE HEADS AND TAILS CARD GAME,0
13422,569846,MAKE YOUR OWN PLAYTIME CARD KIT,0
13422,569846,RUSTIC STRAWBERRY JAMPOT SMALL,0
13422,569846,HAND WARMER BIRD DESIGN,0
13422,569846,60 CAKE CASES VINTAGE CHRISTMAS,0
13422,569846,SET OF 12 FAIRY CAKE BAKING CASES,0
13422,569846,RUSTIC STRAWBERRY JAMPOT LARGE,0
13422,569846,70'S ALPHABET WALL ART,0
13422,569846,GINGERBREAD MAN COOKIE CUTTER,0
13422,569846,16 PIECE CUTLERY SET PANTRY DESIGN,0
13422,569846,CHAMBRE HOOK,0
13422,569846,DOORMAT KEEP CALM AND COME IN,0
13422,569846,WOODLAND BUNNIES LOLLY MAKERS,0
14396,569702,TRIPLE HOOK ANTIQUE IVORY ROSE,0
14396,536993,SCOTTIE DOG HOT WATER BOTTLE,0
14396,569702,IVORY WICKER HEART LARGE,0
14396,569702,DRAWER KNOB CRACKLE GLAZE IVORY,0
14396,569702,JUMBO BAG PINK POLKADOT,0
14396,536993,STRAWBERRY   PICNIC BAG,0
14396,536993,PINK DOG BOWL,0
14396,569702,TRAVEL SEWING KIT,0
14396,569702,ROCKING HORSE RED CHRISTMAS,0
14396,569702,LARGE DECO JEWELLERY STAND,0
14396,569702,EMBROIDERED RIBBON REEL SALLY,0
14396,536993,6 RIBBONS RUSTIC CHARM,0
14396,536993,PINK VINTAGE PAISLEY PICNIC BAG,0
14396,569702,HEART BEADED TRELLIS DECORATION,0
14396,569702,METAL SIGN TAKE IT OR LEAVE IT,0
14396,536993,SCANDINAVIAN PAISLEY PICNIC BAG,0
14396,536993,HEART OF WICKER LARGE,0
14396,536993,RED RETROSPOT PICNIC BAG,0
14396,569702,EMBROIDERED RIBBON REEL ROSIE,0
14396,536993,RED HANGING HEART T-LIGHT HOLDER,0
14396,536993,WHITE HANGING HEART T-LIGHT HOLDER,0
14396,569702,DECORATIVE WICKER HEART LARGE,0
14396,569702,DRAWER KNOB CERAMIC BLACK,0
14396,569702,EMBROIDERED RIBBON REEL SUSIE,0
14396,569702,DRAWER KNOB CERAMIC IVORY,0
14396,536993,RIBBON REEL SOCKS AND MITTENS,0
14396,569702,WHITE HANGING HEART T-LIGHT HOLDER,0
14396,536993,HAND WARMER SCOTTY DOG DESIGN,0
14396,536993,10 COLOUR SPACEBOY PEN,0
14396,536993,HAND WARMER BIRD DESIGN,0
14396,569702,SINGLE ANTIQUE ROSE HOOK IVORY,0
14396,536993,HOT WATER BOTTLE BABUSHKA,0
14396,569702,HAND OVER THE CHOCOLATE   SIGN,0
14396,569702,YOU'RE CONFUSING ME METAL SIGN,0
14396,569702,GLITTER HANGING BUTTERFLY STRING,0
14396,536993,GLASS JAR KINGS CHOICE,0
14396,536993,DINOSAURS  WRITING SET,0
14396,569702,COOK WITH WINE METAL SIGN,0
14396,536993,GLASS JAR PEACOCK BATH SALTS,0
14396,536993,HAND WARMER OWL DESIGN,0
14396,569702,GARAGE KEY FOB,0
14396,536993,SKULLS WRITING SET,0
14396,569702,JUMBO BAG ALPHABET,0
14396,569702,EMBROIDERED RIBBON REEL EMILY,0
14396,569702,DRAWER KNOB CRACKLE GLAZE BLUE,0
14396,536993,RIBBON REEL CHRISTMAS SOCK BAUBLE,0
14396,536993,RIBBON REEL CHRISTMAS PRESENT,0
14396,536993,PINK/WHITE RIBBED MELAMINE JUG,0
14396,569702,GLASS APOTHECARY BOTTLE PERFUME,0
14396,536993,DOORMAT UNION JACK GUNS AND ROSES,0
14396,536993,COSY HOUR CIGAR BOX MATCHES,0
14396,569702,DRAWER KNOB CRACKLE GLAZE PINK,0
14396,536993,LUNCH BAG WOODLAND,0
14396,569702,GLASS APOTHECARY BOTTLE ELIXIR,0
14396,569702,"KEY FOB , BACK DOOR",0
14396,536993,3 PIECE SPACEBOY COOKIE CUTTER SET,0
14396,536993,NEW BAROQUE BLACK PHOTO ALBUM,0
14396,569702,HOME SWEET HOME HANGING HEART,0
14396,569702,DRAWER KNOB VINTAGE GLASS BALL,0
14396,569702,DRAWER KNOB CERAMIC RED,0
14396,536993,GLITTER BUTTERFLY CLIPS,0
14396,536993,RIBBON REEL MAKING SNOWMEN,0
14396,536993,GLASS JAR DAISY FRESH COTTON WOOL,0
14396,536993,BATHROOM SCALES FOOTPRINTS IN SAND,0
14396,569702,EMBROIDERED RIBBON REEL DAISY,0
14396,569702,SET OF 6 RIBBONS VINTAGE CHRISTMAS,0
14396,569702,GLASS APOTHECARY BOTTLE TONIC,0
14396,536993,RECIPE BOX PANTRY YELLOW DESIGN,0
14396,569702,ASSORTED COLOUR BIRD ORNAMENT,0
14396,569702,GLITTER BUTTERFLY CLIPS,0
14396,569702,JINGLE BELL HEART DECORATION,0
14396,569702,AREA PATROLLED METAL SIGN,0
14396,536993,MODERN VINTAGE COTTON SHOPPING BAG,0
14407,560864,RED VINTAGE SPOT BEAKER,0
14407,561688,WOODEN ADVENT CALENDAR CREAM,0
14407,561688,12 PENCILS TALL TUBE POSY,0
14407,553670,BREAD BIN DINER STYLE PINK,0
14407,564332,PINK HORSE SOCK PUPPET,0
14407,545928,BREAD BIN DINER STYLE MINT,0
14407,553670,SPOTTY BUNTING,0
14407,560864,12 PENCILS TALL TUBE POSY,0
14407,560864,BEADED CRYSTAL HEART PINK LARGE,0
14407,561688,VINTAGE SNAP CARDS,0
14407,553670,FELTCRAFT PRINCESS CHARLOTTE DOLL,0
14407,545928,SET OF 3 CAKE TINS PANTRY DESIGN,0
14407,561688,SET OF 3 CAKE TINS PANTRY DESIGN,0
14407,564332,COLOUR GLASS. STAR T-LIGHT HOLDER,0
14407,560864,WOOD STAMP SET BEST WISHES,0
14407,560864,MADRAS NOTEBOOK MEDIUM,0
14407,560864,SET OF 3 REGENCY CAKE TINS,0
14407,545928,YOU'RE CONFUSING ME METAL SIGN,0
14407,560864,GREEN VINTAGE SPOT BEAKER,0
14407,560864,WOOD STAMP SET HAPPY BIRTHDAY,0
14407,553670,FELTCRAFT BUTTERFLY HEARTS,0
14407,560864,JUMBO BAG 50'S CHRISTMAS,0
14407,553670,FELTCRAFT DOLL MOLLY,0
14407,560864,SMALL PINK MAGIC CHRISTMAS TREE,0
14407,545928,PINK GLASS CANDLEHOLDER,0
14407,560864,JUMBO BAG VINTAGE CHRISTMAS,0
14407,561688,BREAD BIN DINER STYLE RED,0
14407,553670,CERAMIC HEART FAIRY CAKE MONEY BANK,0
14407,545928,JUMBO BAG RED RETROSPOT,0
14407,553670,SWEETHEART CERAMIC TRINKET BOX,0
14407,560864,ASSORTED TUTTI FRUTTI PEN,0
14407,560864,JAZZ HEARTS ADDRESS BOOK,0
14407,560864,ASSORTED TUTTI FRUTTI BRACELET,0
14407,545928,RECYCLED ACAPULCO MAT TURQUOISE,0
14407,560864,COLOURING PENCILS BROWN TUBE,0
14407,561688,WRAP 50'S  CHRISTMAS,0
14407,545928,JUMBO BAG PINK VINTAGE PAISLEY,0
14407,545928,SET OF 6 SPICE TINS PANTRY DESIGN,0
14407,545928,HOME SWEET HOME METAL SIGN,0
14407,545928,SET 3 SONG BIRD PAPER EGGS ASSORTED,0
14407,545928,BREAD BIN DINER STYLE PINK,0
14407,545928,JUMBO STORAGE BAG SKULLS,0
14407,560864,PINK VINTAGE PAISLEY PICNIC BAG,0
14407,553670,FELTCRAFT DOLL ROSIE,0
14407,564332,SPOTTY BUNTING,0
14407,553670,CERAMIC STRAWBERRY DESIGN MUG,0
14407,564332,6 GIFT TAGS 50'S CHRISTMAS,0
14407,560864,SET OF TEA COFFEE SUGAR TINS PANTRY,0
14407,561688,CHRISTMAS CARD SINGING ANGEL,0
14407,553670,STRAWBERRY FAIRY CAKE TEAPOT,0
14407,560864,VANILLA INCENSE IN TIN,0
14407,553670,WORLD WAR 2 GLIDERS ASSTD DESIGNS,0
14407,560864,WOOD STAMP SET THANK YOU,0
14407,545928,SET OF 4 PANTRY JELLY MOULDS,0
14407,553670,STRAWBERRY CERAMIC TRINKET BOX,0
14407,561688,BAG 125g SWIRLY MARBLES,0
14407,545928,PINK FLOWER CROCHET FOOD COVER,0
14407,560864,PINK VINTAGE SPOT BEAKER,0
14407,560864,POLKADOT COFFEE CUP & SAUCER PINK,0
14407,553670,CERAMIC STRAWBERRY CAKE MONEY BANK,0
14407,563383,POSTAGE,0
14407,545928,ENAMEL BREAD BIN CREAM,0
14407,545928,JUMBO BAG WOODLAND ANIMALS,0
14407,553670,FELTCRAFT 6 FLOWER FRIENDS,0
14407,553670,COLOUR GLASS T-LIGHT HOLDER HANGING,0
14407,560864,BREAD BIN DINER STYLE IVORY,0
14407,560864,SWALLOW SQUARE TISSUE BOX,0
14407,560864,SCANDINAVIAN PAISLEY PICNIC BAG,0
14407,545928,PLEASE ONE PERSON METAL SIGN,0
14407,553670,BREAD BIN DINER STYLE MINT,0
14407,545928,LARGE HEART MEASURING SPOONS,0
14407,545928,JUMBO BAG CHARLIE AND LOLA TOYS,0
14407,561688,VANILLA INCENSE IN TIN,0
14603,546169,ASSORTED COLOURS SILK FAN,2
14603,546169,SWISS ROLL TOWEL PINK  SPOTS,2
15230,549933,6 RIBBONS RUSTIC CHARM,2
15230,549933,WHITE HANGING HEART T-LIGHT HOLDER,2
15230,549933,WRAP VINTAGE PETALS  DESIGN,2
15230,549933,WRAP POPPIES  DESIGN,2
15230,549933,PAPER CHAIN KIT EMPIRE,2
15230,549933,WRAP DOILEY DESIGN,2
15230,549933,CANDLEHOLDER PINK HANGING HEART,2
15230,549933,TEA PARTY  WRAPPING PAPER,2
15230,549933,RIBBON REEL STRIPES DESIGN,2
15230,549933,EMPIRE GIFT WRAP,2
15230,549933,COFFEE MUG DOG + BALL DESIGN,2
15230,550150,TEA TIME PARTY BUNTING,2
15230,549933,WRAP ALPHABET DESIGN,2
15230,549933,"WRAP, BILLBOARD FONTS DESIGN",2
15230,549933,PAPER BUNTING WHITE LACE,2
15230,549933,WRAP WEDDING DAY,2
15230,549933,WRAP PINK FAIRY CAKES,2
15230,549933,PARTY BUNTING,2
15230,549933,RED HANGING HEART T-LIGHT HOLDER,2
15230,549933,SET 20 NAPKINS FAIRY CAKES DESIGN,2
15230,549933,RIBBON REEL HEARTS DESIGN,2
15230,549933,COFFEE MUG CAT + BIRD DESIGN,2
15230,549933,RIBBON REEL FLORA + FAUNA,2
15306,569833,GIN AND TONIC MUG,0
15306,569833,ROSE CARAVAN DOORSTOP,0
15306,560051,BUBBLEGUM RING ASSORTED,0
15306,566021,PAPER BUNTING RETROSPOT,0
15306,569833,POTTERING MUG,0
15306,566021,PINK POLKADOT WRAP,0
15306,560051,ICE CREAM SUNDAE LIP GLOSS,0
15306,560051,SWEETHEART CERAMIC TRINKET BOX,0
15306,569833,VINTAGE CREAM 3 BASKET CAKE STAND,0
15306,569833,ASSORTED COLOUR BIRD ORNAMENT,0
15306,566021,HOME BUILDING BLOCK WORD,0
15306,569833,WELCOME  WOODEN BLOCK LETTERS,0
15306,569833,GLAMOROUS  MUG,0
15306,560051,MINI PAINT SET VINTAGE,0
15306,560051,HOMEMADE JAM SCENTED CANDLES,0
15306,560051,PINK FLORAL FELTCRAFT SHOULDER BAG,0
15306,566021,RED RETROSPOT WRAP,0
15306,569833,POTTERING IN THE SHED METAL SIGN,0
15306,560051,LARGE CAKE STAND  HANGING STRAWBERY,0
15306,569833,OWL DOORSTOP,0
15306,560051,CERAMIC STRAWBERRY CAKE MONEY BANK,0
15306,569833,GARAGE KEY FOB,0
15306,566021,BLUE POLKADOT WRAP,0
15306,560051,FELTCRAFT 6 FLOWER FRIENDS,0
15306,569833,SET OF 3 BUTTERFLY COOKIE CUTTERS,0
15306,569833,SET OF 20 KIDS COOKIE CUTTERS,0
15306,569833,GLASS JAR ENGLISH CONFECTIONERY,0
15306,566021,CLOTHES PEGS RETROSPOT PACK 24,0
15306,566021,"FANCY FONT BIRTHDAY CARD,",0
15306,560051,WATERING CAN BLUE ELEPHANT,0
15306,560051,RED FLORAL FELTCRAFT SHOULDER BAG,0
15306,566021,TOAST ITS - FAIRY FLOWER,0
15306,569833,GLASS JAR DIGESTIVE BISCUITS,0
15306,560051,ASSORTED COLOURS SILK FAN,0
15306,569833,STARS GIFT TAPE,0
15306,566021,DOORMAT ENGLISH ROSE,0
15306,560051,STRAWBERRY CERAMIC TRINKET BOX,0
15306,569833,RED RETROSPOT TAPE,0
15306,560051,WATERING CAN PINK BUNNY,0
15306,566021,WOODEN ROUNDERS GARDEN SET,0
15306,569833,"KEY FOB , BACK DOOR",0
15306,569833,GINGHAM HEART  DOORSTOP RED,0
15306,560051,RECIPE BOX PANTRY YELLOW DESIGN,0
15306,569833,DECORATIVE ROSE BATHROOM BOTTLE,0
15306,569833,HOME SWEET HOME METAL SIGN,0
15306,566021,CACTI T-LIGHT CANDLES,0
15306,560051,CERAMIC HEART FAIRY CAKE MONEY BANK,0
15306,569833,"KEY FOB , FRONT  DOOR",0
15306,560051,CERAMIC BOWL WITH STRAWBERRY DESIGN,0
15306,569833,"KEY FOB , SHED",0
15306,569833,IF YOU CAN'T STAND THE HEAT MUG,0
15306,569833,PAPERWEIGHT HOME SWEET HOME,0
15306,569833,HOME BUILDING BLOCK WORD,0
15306,569833,PAPERWEIGHT SAVE THE PLANET,0
15306,566021,PACK OF 12 RED RETROSPOT TISSUES,0
15306,566021,FLOWER VINE RAFFIA FOOD COVER,0
15306,569833,DECORATIVE FLORE BATHROOM BOTTLE,0
15306,569833,DOORSTOP RETROSPOT HEART,0
15478,571184,PLAYING CARDS KEEP CALM & CARRY ON,0
15478,573384,JUMBO BAG PAISLEY PARK,0
15478,571184,JINGLE BELL HEART DECORATION,0
15478,573384,3 DRAWER ANTIQUE WHITE WOOD CABINET,0
15478,571184,MEDIUM MEDINA STAMPED METAL BOWL,0
15478,571184,ILLUSTRATED CAT BOWL,0
15478,571184,JUMBO BAG SCANDINAVIAN BLUE PAISLEY,0
15478,571184,IVORY WICKER HEART LARGE,0
15478,573384,GLITTER CHRISTMAS TREE,0
15478,573384,HOT WATER BOTTLE KEEP CALM,0
15478,571184,JUMBO BAG ALPHABET,0
15478,571184,CHOCOLATE HOT WATER BOTTLE,0
15478,573384,PETIT TRAY CHIC,0
15478,571184,JUMBO BAG PEARS,0
15478,573384,DECORATIVE WICKER HEART LARGE,0
15478,571184,LARGE WHITE HEART OF WICKER,0
15478,571184,SWEETHEART 3 TIER CAKE STAND,0
15478,571184,HEART OF WICKER LARGE,0
15478,573384,IVORY WICKER HEART LARGE,0
15478,571184,3 HEARTS HANGING DECORATION RUSTIC,0
15478,571184,GARDENERS KNEELING PAD KEEP CALM,0
15478,573384,JUMBO SHOPPER VINTAGE RED PAISLEY,0
15478,571184,CAMOUFLAGE LED TORCH,0
15478,571184,EMPIRE UNION JACK TV DINNER TRAY,0
15478,573384,JUMBO STORAGE BAG SUKI,0
15478,571184,DECORATIVE WICKER HEART LARGE,0
15478,571184,LE GRAND TRAY CHIC SET,0
15478,571184,JUMBO  BAG BAROQUE BLACK WHITE,0
15478,573384,WOOD 2 DRAWER CABINET WHITE FINISH,0
15478,573384,T-LIGHT HOLDER HANGING LOVE BIRD,0
15478,573384,JUMBO BAG SCANDINAVIAN BLUE PAISLEY,0
15478,573384,GLITTER HEART DECORATION,0
15478,571184,DINOSAURS  WRITING SET,0
15478,573384,HEART OF WICKER LARGE,0
15478,573384,JINGLE BELL HEART DECORATION,0
15478,571184,HEART T-LIGHT HOLDER WILLIE WINKIE,0
15478,573384,JUMBO BAG PEARS,0
15478,571184,VINTAGE CREAM 3 BASKET CAKE STAND,0
15478,571184,LARGE MEDINA STAMPED METAL BOWL,0
15478,573384,LARGE WHITE HEART OF WICKER,0
