16678,560254,PLASTERS IN TIN WOODLAND ANIMALS,1
16678,579434,CLASSIC CHROME BICYCLE BELL,1
16678,545344,HANGING HEART JAR T-LIGHT HOLDER,1
16678,579434,BICYCLE PUNCTURE REPAIR KIT,1
16678,563191,CHRISTMAS CRAFT TREE TOP ANGEL,1
16678,563191,WOODEN STAR CHRISTMAS SCANDINAVIAN,1
16678,563191,SET OF 3 WOODEN HEART DECORATIONS,1
16678,548710,CARD CAT AND TREE,1
16678,545344,MOTORING TISSUE BOX,1
16678,545344,CARAVAN SQUARE TISSUE BOX,1
16678,551842,PLASTERS IN TIN VINTAGE PAISLEY,1
16678,574228,GINGERBREAD MAN COOKIE CUTTER,1
16705,539107,RED  HARMONICA IN BOX,1
16705,549837,CREAM HEART CARD HOLDER,1
16705,542891,ALARM CLOCK BAKELIKE RED,1
16705,568196,PLAYING CARDS KEEP CALM & CARRY ON,1
16705,579106,RABBIT NIGHT LIGHT,1
16705,560364,DOORMAT WELCOME PUPPIES,1
16705,565230,RED REFECTORY CLOCK,1
16705,568315,EMBROIDERED RIBBON REEL DAISY,1
16705,549837,ROUND CAKE TIN VINTAGE GREEN,1
16705,542891,SET OF SALT AND PEPPER TOADSTOOLS,1
16705,549837,DOORMAT UNION FLAG,1
16705,565230,CHILDRENS CUTLERY RETROSPOT RED,1
16705,560364,CHILDRENS CUTLERY POLKADOT PINK,1
16705,542891,WOOD BLACK BOARD ANT WHITE FINISH,1
16705,542891,DOORMAT RED RETROSPOT,1
16705,542891,SET/5 RED RETROSPOT LID GLASS BOWLS,1
16705,568196,RED SPOT PAPER GIFT BAG,1
16705,573584,SET OF SALT AND PEPPER TOADSTOOLS,1
16705,579106,RED SPOT PAPER GIFT BAG,1
16705,579107,LUNCH BAG RED VINTAGE DOILY,1
16705,579106,RED KITCHEN SCALES,1
16705,573584,REGENCY CAKE SLICE,1
16705,542891,WOODEN PICTURE FRAME WHITE FINISH,1
16705,542891,SET/10 RED POLKADOT PARTY CANDLES,1
16705,553315,JAM MAKING SET WITH JARS,1
16705,568196,VINTAGE DOILY TRAVEL SEWING KIT,1
16705,539106,SET OF 6 HERB TINS SKETCHBOOK,1
16705,542891,WRAP DOILEY DESIGN,1
16705,565230,WOOD 2 DRAWER CABINET WHITE FINISH,1
16705,573584,RECIPE BOX RETROSPOT,1
16705,560364,DOORMAT NEW ENGLAND,1
16705,565230,RECYCLED ACAPULCO MAT GREEN,1
16705,565230,RECIPE BOX RETROSPOT,1
16705,539107,QUEENS GUARD COFFEE MUG,1
16705,542891,BLACK HEART CARD HOLDER,1
16705,542891,WHITE HANGING HEART T-LIGHT HOLDER,1
16705,573584,HAND WARMER RED RETROSPOT,1
16705,542891,MINT KITCHEN SCALES,1
16705,573584,JUMBO BAG ALPHABET,1
16705,553315,ROUND SNACK BOXES SET OF 4 FRUITS,1
16705,560364,DOORMAT RED RETROSPOT,1
16705,549837,DOORMAT NEW ENGLAND,1
16705,560364,PARTY BUNTING,1
16705,565230,RETROSPOT LARGE MILK JUG,1
16705,573584,DOORMAT VINTAGE LEAF,1
16705,572100,ROCOCO WALL MIRROR WHITE,1
16705,579106,PEARLISED IVORY HEART SMALL,1
16705,560364,CHILDRENS CUTLERY POLKADOT BLUE,1
16705,542891,BLACK RECORD COVER FRAME,1
16705,549837,SET OF SALT AND PEPPER TOADSTOOLS,1
16705,573584,REGENCY TEA STRAINER,1
16705,539106,DOORMAT FANCY FONT HOME SWEET HOME,1
16705,553315,MOROCCAN TEA GLASS,1
16705,579106,RED SPOT GIFT BAG LARGE,1
16705,579106,POLYESTER FILLER PAD 45x45cm,1
16705,579106,PLAYING CARDS KEEP CALM & CARRY ON,1
16705,542891,RETROSPOT LARGE MILK JUG,1
16705,573584,WALL ART CAT AND BIRD,1
16705,573584,NATURAL SLATE CHALKBOARD LARGE,1
16705,542891,SET OF 6 SPICE TINS PANTRY DESIGN,1
16705,579106,CHILDS BREAKFAST SET SPACEBOY,1
16705,549837,QUEENS GUARD COFFEE MUG,1
16705,565230,JAM JAR WITH GREEN LID,1
16705,565230,DOORMAT ENGLISH ROSE,1
16705,553315,JAM JAR WITH GREEN LID,1
16705,572101,LARGE PARLOUR PICTURE FRAME,1
16705,549837,JAM MAKING SET WITH JARS,1
16705,553315,WHITE HANGING HEART T-LIGHT HOLDER,1
16705,560364,WOOD S/3 CABINET ANT WHITE FINISH,1
16705,565230,DOORMAT UNION FLAG,1
16705,549837,WOODEN PICTURE FRAME WHITE FINISH,1
16705,553315,SET/5 RED RETROSPOT LID GLASS BOWLS,1
16705,549838,RECYCLED ACAPULCO MAT GREEN,1
16705,568196,SET 12 COLOURING PENCILS DOILY,1
16705,560364,SET 20 NAPKINS FAIRY CAKES DESIGN,1
16705,553317,DOORMAT VINTAGE LEAVES DESIGN,1
16705,572101,PEARLISED IVORY HEART LARGE,1
16705,539106,JAM JAR WITH GREEN LID,1
16705,573584,LUNCH BAG VINTAGE DOILY,1
16705,568196,PLAYING CARDS I LOVE LONDON,1
16705,573584,RECYCLED ACAPULCO MAT BLUE,1
16705,560364,DOORMAT VINTAGE LEAF,1
16705,565230,ROUND SNACK BOXES SET OF 4 FRUITS,1
16705,539106,JAM JAR WITH PINK LID,1
16705,573584,RECYCLED ACAPULCO MAT TURQUOISE,1
16705,542891,ROUND SNACK BOXES SET OF 4 FRUITS,1
16705,568315,EMBROIDERED RIBBON REEL SOPHIE,1
16705,572101,SMALL PARLOUR PICTURE FRAME,1
16705,565230,ROUND CAKE TIN VINTAGE RED,1
16705,579106,JAM MAKING SET WITH JARS,1
16705,542891,NATURAL SLATE CHALKBOARD LARGE,1
16705,568196,SET 12 COLOUR PENCILS LOVE LONDON,1
16705,565230,MINT KITCHEN SCALES,1
16705,573584,RECYCLED ACAPULCO MAT GREEN,1
16705,573584,CREAM HEART CARD HOLDER,1
16705,560364,WOODEN PICTURE FRAME WHITE FINISH,1
16705,565230,RECYCLED ACAPULCO MAT BLUE,1
16705,542891,WOOD 2 DRAWER CABINET WHITE FINISH,1
16705,549837,WHITE HANGING HEART T-LIGHT HOLDER,1
16705,579106,PEARLISED IVORY HEART LARGE,1
16705,542891,ENCHANTED BIRD COATHANGER 5 HOOK,1
16705,560364,ROUND SNACK BOXES SET OF 4 FRUITS,1
16705,565230,VINTAGE RED ENAMEL TRIM JUG,1
16705,539106,IVORY KITCHEN SCALES,1
16705,549838,LUNCH BAG APPLE DESIGN,1
16705,565230,RECYCLED ACAPULCO MAT TURQUOISE,1
16705,568196,EMBROIDERED RIBBON REEL ROSIE,1
16705,572101,PEARLISED IVORY HEART SMALL,1
16705,579106,WALL ART BIG LOVE,1
16705,565230,SET OF 3 REGENCY CAKE TINS,1
16705,549837,JUMBO BAG ALPHABET,1
16705,542891,MOROCCAN TEA GLASS,1
16705,553317,DOORMAT KEEP CALM AND COME IN,1
16705,542891,DOORMAT ENGLISH ROSE,1
16705,542891,RED RETROSPOT SMALL MILK JUG,1
16705,573584,CHILDRENS CUTLERY POLKADOT BLUE,1
16705,560364,RECYCLED ACAPULCO MAT GREEN,1
16705,568196,EMBROIDERED RIBBON REEL EMILY,1
16705,581572,SET OF 3 REGENCY CAKE TINS,1
16705,542891,BISCUIT TIN VINTAGE GREEN,1
16705,542891,VINTAGE BILLBOARD MUG,1
16705,560364,RECYCLED ACAPULCO MAT TURQUOISE,1
16705,573584,RED RETROSPOT SMALL MILK JUG,1
16705,581572,MINT KITCHEN SCALES,1
16705,573584,VINTAGE DOILY JUMBO BAG RED,1
16705,553315,RECYCLED ACAPULCO MAT GREEN,1
16705,579106,WOODEN PICTURE FRAME WHITE FINISH,1
16705,573584,DOORMAT ENGLISH ROSE,1
16705,573584,JAM MAKING SET WITH JARS,1
16705,579106,ENAMEL BREAD BIN CREAM,1
16705,539106,GINGERBREAD MAN COOKIE CUTTER,1
16705,560364,JAM MAKING SET WITH JARS,1
16705,560364,RECYCLED ACAPULCO MAT BLUE,1
16705,542891,ROUND CAKE TIN VINTAGE GREEN,1
16705,542891,VICTORIAN GLASS HANGING T-LIGHT,1
16705,560364,SET OF SALT AND PEPPER TOADSTOOLS,1
16705,573584,DOORMAT NEW ENGLAND,1
16705,549837,WRAP DOILEY DESIGN,1
16705,539106,RED KITCHEN SCALES,1
16705,553315,PARTY BUNTING,1
16705,573584,RED REFECTORY CLOCK,1
16705,539106,SET OF 6 SPICE TINS PANTRY DESIGN,1
16705,539107,JAM MAKING SET WITH JARS,1
16705,560364,SET OF 4 PANTRY JELLY MOULDS,1
16705,560364,PACK OF 20 NAPKINS RED APPLES,1
16705,560364,DOORMAT ENGLISH ROSE,1
16705,553315,SET OF SALT AND PEPPER TOADSTOOLS,1
16705,549838,RECYCLED ACAPULCO MAT TURQUOISE,1
16705,542891,SWEETHEART WIRE MAGAZINE RACK,1
16705,573584,3 DRAWER ANTIQUE WHITE WOOD CABINET,1
16705,560364,RECYCLED ACAPULCO MAT LAVENDER,1
16705,549837,RED RETROSPOT SMALL MILK JUG,1
16705,579106,BICYCLE PUNCTURE REPAIR KIT,1
16705,568196,POSTE FRANCE CUSHION COVER,1
16705,542891,SET 12 RETRO WHITE CHALK STICKS,1
16705,542891,IVORY DINER WALL CLOCK,1
16705,553315,DOORMAT ENGLISH ROSE,1
16705,560364,MINT KITCHEN SCALES,1
16705,560364,WHITE HANGING HEART T-LIGHT HOLDER,1
16705,560364,CREAM HEART CARD HOLDER,1
16705,565230,DOORMAT RED RETROSPOT,1
16705,579106,BREAD BIN DINER STYLE IVORY,1
16705,542891,BREAD BIN DINER STYLE IVORY,1
16705,572101,TUSCAN VILLA DOVECOTE,1
16705,579106,ALARM CLOCK BAKELIKE GREEN,1
16705,572101,SWEETHEART BIRD HOUSE,1
16705,579106,SET 12 COLOURING PENCILS DOILY,1
16705,542891,RECIPE BOX RETROSPOT,1
16705,560364,CHILDRENS CUTLERY POLKADOT GREEN,1
16705,579106,3 DRAWER ANTIQUE WHITE WOOD CABINET,1
16705,573584,GUMBALL COAT RACK,1
16705,553315,DOORMAT UNION FLAG,1
16705,560364,GUMBALL COAT RACK,1
16705,568196,RED SPOT GIFT BAG LARGE,1
16705,579106,SET OF 4 PANTRY JELLY MOULDS,1
16705,568196,PLAYING CARDS JUBILEE UNION JACK,1
16705,565230,REGENCY CAKESTAND 3 TIER,1
16705,572100,WALL ART BIG LOVE,1
16705,579109,CLASSIC BICYCLE CLIPS,1
16705,565230,WOODEN FRAME ANTIQUE WHITE,1
16705,539106,COFFEE MUG PEARS  DESIGN,1
16705,549837,GUMBALL COAT RACK,1
16705,549837,WOOD BLACK BOARD ANT WHITE FINISH,1
16705,573584,REGENCY CAKESTAND 3 TIER,1
16705,573584,POLYESTER FILLER PAD 45x45cm,1
16705,553315,RECYCLED ACAPULCO MAT LAVENDER,1
16705,581572,IVORY KITCHEN SCALES,1
16705,565230,REGENCY TEA STRAINER,1
16705,568196,ICE CREAM BUBBLES,1
16705,565230,BREAD BIN DINER STYLE IVORY,1
16705,565230,JAM MAKING SET WITH JARS,1
16705,549837,PARTY BUNTING,1
16705,542891,DOORMAT NEW ENGLAND,1
16705,565230,BLACK RECORD COVER FRAME,1
16705,553317,CLASSIC SUGAR DISPENSER,1
16705,573584,RECYCLED ACAPULCO MAT LAVENDER,1
16705,573584,WOOD 2 DRAWER CABINET WHITE FINISH,1
16705,539106,DOORMAT RED RETROSPOT,1
16705,542891,TEA BAG PLATE RED RETROSPOT,1
16705,539106,MOROCCAN TEA GLASS,1
16705,542891,VINTAGE BILLBOARD TEA MUG,1
16705,581572,SET 6 SCHOOL MILK BOTTLES IN CRATE,1
16705,560364,ROUND CAKE TIN VINTAGE RED,1
16705,568196,POLYESTER FILLER PAD 45x45cm,1
16705,573584,LUNCH BAG  BLACK SKULL.,1
16705,542891,WOODEN FRAME ANTIQUE WHITE,1
16705,542891,GLASS  BEURRE DISH,1
16705,549837,GLASS  BEURRE DISH,1
16705,573584,ROUND SNACK BOXES SET OF 4 FRUITS,1
16705,539106,HAND WARMER BABUSHKA DESIGN,1
16705,542891,RED RETROSPOT ROUND CAKE TINS,1
16705,553315,RECYCLED ACAPULCO MAT TURQUOISE,1
16705,565230,DOORMAT NEW ENGLAND,1
16705,573584,DOORMAT WELCOME PUPPIES,1
16705,542891,SET 7 BABUSHKA NESTING BOXES,1
16705,565230,RED KITCHEN SCALES,1
16705,549837,WOOD S/3 CABINET ANT WHITE FINISH,1
16705,542891,JAM MAKING SET WITH JARS,1
16705,549837,ALARM CLOCK BAKELIKE RED,1
16705,560364,RED RETROSPOT SMALL MILK JUG,1
16705,579108,SET OF 6 RIBBONS PARTY,1
16705,568315,EMBROIDERED RIBBON REEL RUBY,1
16705,573584,LUNCH BAG ALPHABET DESIGN,1
16705,542891,GUMBALL COAT RACK,1
16705,579106,TRADTIONAL ALPHABET STAMP SET,1
16705,542891,WRAP ALPHABET DESIGN,1
16705,553317,SET 6 PAPER TABLE LANTERN HEARTS,1
16705,573584,CHILDRENS CUTLERY POLKADOT PINK,1
16705,560364,CHILDRENS CUTLERY RETROSPOT RED,1
16705,565230,WRAP RED VINTAGE DOILY,1
16705,572101,TUSCAN VILLA BIRD TABLE,1
16705,553315,DOORMAT NEW ENGLAND,1
16705,549837,LUNCH BAG ALPHABET DESIGN,1
16705,565230,WOOD BLACK BOARD ANT WHITE FINISH,1
16705,565230,IVORY KITCHEN SCALES,1
16705,579106,RECYCLED ACAPULCO MAT GREEN,1
16705,560364,NATURAL SLATE CHALKBOARD LARGE,1
16705,568196,HEART MIRROR ANTIQUE WHITE,1
16705,579109,CLASSIC CHROME BICYCLE BELL,1
16705,579106,WOOD 2 DRAWER CABINET WHITE FINISH,1
16705,579106,VINTAGE DOILY TRAVEL SEWING KIT,1
16705,553319,LUNCH BAG DOILEY PATTERN,1
16705,573584,DOORMAT RED RETROSPOT,1
16705,549838,SET OF 4 PANTRY JELLY MOULDS,1
16705,573584,HAND WARMER OWL DESIGN,1
16705,579106,POSTE FRANCE CUSHION COVER,1
16705,560364,WOODEN FRAME ANTIQUE WHITE,1
16705,579106,ALARM CLOCK BAKELIKE IVORY,1
16705,542891,SET 3 SONG BIRD PAPER EGGS ASSORTED,1
16705,565230,BUNDLE OF 3 ALPHABET EXERCISE BOOKS,1
16705,572101,MEDIUM PARLOUR PICTURE FRAME,1
16705,573584,SET OF 4 PANTRY JELLY MOULDS,1
16705,542891,SMALL GLASS HEART TRINKET POT,1
16705,542891,FANCY FONTS BIRTHDAY WRAP,1
16705,553315,BLACK RECORD COVER FRAME,1
16705,560364,WOOD 2 DRAWER CABINET WHITE FINISH,1
16705,560364,SET/20 STRAWBERRY PAPER NAPKINS,1
16705,560364,BREAD BIN DINER STYLE IVORY,1
16705,553315,GUMBALL COAT RACK,1
16705,573584,VINTAGE RED ENAMEL TRIM JUG,1
16705,579106,SET 6 SCHOOL MILK BOTTLES IN CRATE,1
16705,573584,WHITE HANGING HEART T-LIGHT HOLDER,1
16705,553317,SET OF 10 LED DOLLY LIGHTS,1
16705,553315,DOORMAT WELCOME PUPPIES,1
16705,565230,RECYCLED ACAPULCO MAT LAVENDER,1
16705,573584,WOOD BLACK BOARD ANT WHITE FINISH,1
16705,553315,RETROSPOT LARGE MILK JUG,1
16705,549837,DOORMAT ENGLISH ROSE,1
16705,565230,WHITE HANGING HEART T-LIGHT HOLDER,1
16705,573584,WOODEN PICTURE FRAME WHITE FINISH,1
16796,566277,DECORATIVE WICKER HEART MEDIUM,0
16796,566277,HOMEMADE JAM SCENTED CANDLES,0
16796,566277,VINTAGE CHRISTMAS BUNTING,0
16796,566277,STRAWBERRY CERAMIC TRINKET BOX,0
16796,566277,NATURAL SLATE HEART CHALKBOARD,0
16796,566277,HANGING METAL HEART LANTERN,0
16796,566277,SET OF 2 CHRISTMAS DECOUPAGE CANDLE,0
16796,566277,ORANGE SCENTED SET/9 T-LIGHTS,0
16796,566277,SET OF 12 FAIRY CAKE BAKING CASES,0
16796,566277,SET OF 12 MINI LOAF BAKING CASES,0
16796,566277,PAINTED METAL HEART WITH HOLLY BELL,0
16796,566277,BISCUIT TIN VINTAGE CHRISTMAS,0
16796,566277,BISCUIT TIN 50'S CHRISTMAS,0
16796,566277,REINDEER HEART DECORATION SILVER,0
16796,566277,SWEETHEART CERAMIC TRINKET BOX,0
16796,566277,SET OF 4 ENGLISH ROSE COASTERS,0
16796,566277,PACK 3 BOXES CHRISTMAS PANNETONE,0
16796,566277,HANGING METAL STAR LANTERN,0
16826,571890,TRADITIONAL KNITTING NANCY,0
16826,571890,ZINC WILLIE WINKIE  CANDLE STICK,0
16826,571890,DOORMAT FANCY FONT HOME SWEET HOME,0
16826,571890,DOORMAT KEEP CALM AND COME IN,0
16826,571890,HOT WATER BOTTLE KEEP CALM,0
16826,571890,RETROSPOT HEART HOT WATER BOTTLE,0
16826,571890,DOORMAT UNION FLAG,0
16826,571890,SET OF 4 KNICK KNACK TINS DOILY,0
16826,571890,SHELF WITH 4 HOOKS HOME SWEET HOME,0
16826,571890,PARTY BUNTING,0
16826,571890,HOMEMADE JAM SCENTED CANDLES,0
16826,571890,VINTAGE SNAP CARDS,0
16826,571890,FRIDGE MAGNETS US DINER ASSORTED,0
16826,571890,HOME SWEET HOME MUG,0
16826,571890,SET OF 3 NOTEBOOKS IN PARCEL,0
16826,571890,50'S CHRISTMAS PAPER GIFT BAG,0
16826,571890,ENAMEL BREAD BIN CREAM,0
16826,571890,HOME BUILDING BLOCK WORD,0
16826,571890,POPCORN HOLDER,0
16826,571890,TREASURE ISLAND BOOK BOX,0
16826,571890,WALL ART WORK REST AND PLAY,0
16826,571890,HOME SWEET HOME HANGING HEART,0
16957,550136,GOLD FISHING GNOME,2
16957,550136,CHILDS GARDEN TROWEL PINK,2
16957,550136,WATERING CAN GREEN DINOSAUR,2
16957,550136,PICNIC BASKET WICKER LARGE,2
16957,550136,PARTY BUNTING,2
16957,550136,SILVER FISHING GNOME,2
16957,545465,2 PICTURE BOOK EGGS EASTER BUNNY,2
16957,545465,PARTY BUNTING,2
16957,550136,PARTY METAL SIGN,2
16957,545465,HEN HOUSE W CHICK STANDING,2
16957,550136,CHILDS GARDEN SPADE PINK,2
16957,550136,WATERING CAN PINK BUNNY,2
16957,550136,CHILDS GARDEN SPADE BLUE,2
16957,545465,HANGING SPRING FLOWER EGG SMALL,2
16957,550136,PICNIC BASKET WICKER SMALL,2
16957,550136,CHILDS GARDEN TROWEL BLUE,2
17063,544798,HOME BUILDING BLOCK WORD,0
17063,571006,JUMBO  BAG BAROQUE BLACK WHITE,0
17063,577365,CHILDRENS CUTLERY DOLLY GIRL,0
17063,571006,SMALL HEART MEASURING SPOONS,0
17063,558454,LUNCH BAG ALPHABET DESIGN,0
17063,571006,HI TEC ALPINE HAND WARMER,0
17063,577365,SET OF 3 CAKE TINS PANTRY DESIGN,0
17063,558454,LUNCH BAG PINK POLKADOT,0
17063,558456,SET OF 10 LED DOLLY LIGHTS,0
17063,577365,BOX OF 6 CHRISTMAS CAKE DECORATIONS,0
17063,544798,DINOSAUR HEIGHT CHART STICKER SET,0
17063,544799,SWEETHEART CAKESTAND 3 TIER,0
17063,544798,FAIRY CAKE BIRTHDAY CANDLE SET,0
17063,544799,LUNCH BAG RED RETROSPOT,0
17063,558454,CHILDRENS CUTLERY SPACEBOY,0
17063,571006,CLASSIC GLASS COOKIE JAR,0
17063,558454,JUMBO BAG RED RETROSPOT,0
17063,544798,FELTCRAFT 6 FLOWER FRIENDS,0
17063,571006,JUMBO BAG VINTAGE DOILY,0
17063,571006,GARDENERS KNEELING PAD KEEP CALM,0
17063,558454,FELTCRAFT PRINCESS OLIVIA DOLL,0
17063,544798,JUMBO BAG SCANDINAVIAN PAISLEY,0
17063,558454,DOORMAT KEEP CALM AND COME IN,0
17063,577365,CHILDRENS CUTLERY SPACEBOY,0
17063,544799,JUMBO BAG WOODLAND ANIMALS,0
17063,577365,JUMBO BAG 50'S CHRISTMAS,0
17063,544798,STRAWBERRY LUNCH BOX WITH CUTLERY,0
17063,571006,SET OF 3 CAKE TINS PANTRY DESIGN,0
17063,544798,MAKE YOUR OWN FLOWERPOWER CARD KIT,0
17063,571006,JUMBO BAG RED RETROSPOT,0
17063,544798,WOODLAND  HEIGHT CHART STICKERS,0
17063,544798,JUMBO STORAGE BAG SKULLS,0
17063,544799,PACK OF 12 HEARTS DESIGN TISSUES,0
17063,577365,ANTIQUE SILVER BAUBLE LAMP,0
17063,544799,TRADITIONAL KNITTING NANCY,0
17063,571006,SET 12 COLOUR PENCILS SPACEBOY,0
17063,571006,JUMBO BAG 50'S CHRISTMAS,0
17063,577365,SPACEBOY CHILDRENS BOWL,0
17063,544799,JUMBO BAG RED RETROSPOT,0
17063,558454,JUMBO BAG DOILEY PATTERNS,0
17063,571006,PAPERWEIGHT VINTAGE COLLAGE,0
17063,571006,SET OF 3 HEART COOKIE CUTTERS,0
17063,577365,DECORATIVE WICKER HEART LARGE,0
17063,571006,BAKING SET 9 PIECE RETROSPOT,0
17063,558454,FELTCRAFT PRINCESS CHARLOTTE DOLL,0
17063,571006,SET 12 COLOUR PENCILS DOLLY GIRL,0
17063,544798,JUMBO BAG PINK POLKADOT,0
17063,558454,LUNCH BAG WOODLAND,0
17063,558454,FELTCRAFT 6 FLOWER FRIENDS,0
17063,558454,JUMBO BAG PINK POLKADOT,0
17063,571006,JUMBO BAG VINTAGE LEAF,0
17063,577365,DOLLY GIRL CHILDRENS CUP,0
17063,577365,DECORATIVE WICKER HEART SMALL,0
17063,558454,CHILDRENS CUTLERY POLKADOT PINK,0
17063,571006,DECORATIVE WICKER HEART LARGE,0
17063,577365,DECORATIVE WICKER HEART MEDIUM,0
17063,577365,JUMBO BAG RED RETROSPOT,0
17063,571006,36 FOIL STAR CAKE CASES,0
17063,571008,WHITE HANGING HEART T-LIGHT HOLDER,0
17063,577365,SET 12 VINTAGE DOILY CHALK,0
17063,544799,LUNCH BAG  BLACK SKULL.,0
17063,571006,JUMBO SHOPPER VINTAGE RED PAISLEY,0
17063,558454,JUMBO BAG STRAWBERRY,0
17063,558454,PINK FAIRY CAKE CHILDRENS APRON,0
17063,558456,SET 6 PAPER TABLE LANTERN HEARTS,0
17063,571006,ANTIQUE SILVER T-LIGHT GLASS,0
17063,544798,SKULL LUNCH BOX WITH CUTLERY,0
17063,571006,PORCELAIN T-LIGHT HOLDERS ASSORTED,0
17063,571006,GINGERBREAD MAN COOKIE CUTTER,0
17063,577365,DOLLY GIRL CHILDRENS BOWL,0
17063,544799,PACK OF 12 PINK POLKADOT TISSUES,0
17063,558454,CHILDRENS CUTLERY DOLLY GIRL,0
17063,571006,DECORATIVE WICKER HEART MEDIUM,0
17063,571006,36 FOIL HEART CAKE CASES,0
17063,577365,SPACEBOY CHILDRENS CUP,0
17063,544799,WOODLAND CHARLOTTE BAG,0
17063,577365,VINTAGE DOILY JUMBO BAG RED,0
17063,558454,DOORMAT ENGLISH ROSE,0
17189,564554,SET OF 10 LED DOLLY LIGHTS,0
17189,539075,KNITTED UNION FLAG HOT WATER BOTTLE,0
17189,564554,SET OF 3 CAKE TINS PANTRY DESIGN,0
17189,539075,OVEN MITT APPLES DESIGN,0
17189,539075,MINT KITCHEN SCALES,0
17189,539075,NATURAL SLATE CHALKBOARD LARGE,0
17189,539075,PACK OF 12 WOODLAND TISSUES,0
17189,564554,PANTRY MAGNETIC  SHOPPING LIST,0
17189,539075,FULL ENGLISH BREAKFAST PLATE,0
17189,564554,SKETCHBOOK MAGNETIC SHOPPING LIST,0
17189,539075,PACK OF 72 RETROSPOT CAKE CASES,0
17189,564554,TRAVEL CARD WALLET SKULLS,0
17189,539075,RAINY LADIES BIRTHDAY CARD,0
17189,539075,SET 12 KIDS  WHITE CHALK STICKS,0
17189,564554,SET OF 4 PANTRY JELLY MOULDS,0
17189,539075,SET OF 3 CAKE TINS PANTRY DESIGN,0
17189,539075,LONDON BUS COFFEE MUG,0
17189,564554,ROUND CAKE TIN VINTAGE RED,0
17189,564554,SET OF 12 FORK CANDLES,0
17189,539075,TEA TIME OVEN GLOVE,0
17189,539075,GUMBALL MAGAZINE RACK,0
17189,539075,200 RED + WHITE BENDY STRAWS,0
17189,539075,SET OF 72 RETROSPOT PAPER  DOILIES,0
17189,564554,TEA PARTY BIRTHDAY CARD,0
17189,539075,RED RETROSPOT OVEN GLOVE,0
17189,539075,SET/6 RED SPOTTY PAPER CUPS,0
17189,539075,PACK OF 12 SKULL TISSUES,0
17189,539075,TEA TIME OVEN GLOVE,0
17189,539075,SET 2 TEA TOWELS I LOVE LONDON,0
17189,539075,ROUND CONTAINER SET OF 5 RETROSPOT,0
17189,564554,GUMBALL MAGAZINE RACK,0
17189,539075,DOORMAT RED RETROSPOT,0
17189,564554,CERAMIC CHERRY CAKE MONEY BANK,0
17189,564554,FULL ENGLISH BREAKFAST PLATE,0
17189,539075,SET OF 2 TEA TOWELS APPLE AND PEARS,0
17189,539075,FELTCRAFT HAIRBANDS PINK AND WHITE,0
17189,539075,SWALLOWS GREETING CARD,0
17189,539075,PICTURE DOMINOES,0
17189,564554,SPACEBOY BIRTHDAY CARD,0
17189,539075,TEA BAG PLATE RED RETROSPOT,0
17189,539075,ROUND CAKE TIN VINTAGE RED,0
17189,564554,CARD I LOVE LONDON,0
17189,539075,SKULL SHOULDER BAG,0
17189,539075,TEA TIME DES TEA COSY,0
17189,564554,CARD BILLBOARD FONT,0
17189,539075,CHOCOLATE THIS WAY METAL SIGN,0
17189,564554,FOLDING BUTTERFLY MIRROR HOT PINK,0
17189,539075,AIRLINE BAG VINTAGE TOKYO 78,0
17189,539075,CHRISTMAS PUDDING TRINKET POT,0
17189,539075,CERAMIC CHERRY CAKE MONEY BANK,0
17189,564554,CARD WEDDING DAY,0
17189,564554,"GREETING CARD, STICKY GORDON",0
17189,564554,RAINY LADIES BIRTHDAY CARD,0
17189,539075,PIZZA PLATE IN BOX,0
17189,564554,JUMBO BAG VINTAGE LEAF,0
17189,564554,OVEN MITT APPLES DESIGN,0
17189,539075,CERAMIC CAKE DESIGN SPOTTED MUG,0
17189,539075,SET/20 RED RETROSPOT PAPER NAPKINS,0
17189,564554,TRAVEL CARD WALLET TRANSPORT,0
17189,564554,TRAVEL CARD WALLET I LOVE LONDON,0
17490,568480,SET OF 4 SANTA PLACE SETTINGS,0
17490,581481,DANISH ROSE ROUND SEWING BOX,0
17490,581482,VINTAGE RED ENAMEL TRIM MUG,0
17490,569936,VINTAGE RED ENAMEL TRIM PLATE,0
17490,569936,GARDENERS KNEELING PAD CUP OF TEA,0
17490,567295,WOODEN UNION JACK BUNTING,0
17490,556958,CLOTHES PEGS RETROSPOT PACK 24,0
17490,581481,CERAMIC STRAWBERRY DESIGN MUG,0
17490,568480,SET OF 2 WOODEN MARKET CRATES,0
17490,556958,MINT KITCHEN SCALES,0
17490,581143,VINTAGE RED TRIM ENAMEL BOWL,0
17490,556958,SET/20 RED RETROSPOT PAPER NAPKINS,0
17490,581481,WALL ART GARDEN HAVEN,0
17490,567295,BLUE/CREAM STRIPE CUSHION COVER,0
17490,556958,IVORY KITCHEN SCALES,0
17490,567295,FLOWER VINE RAFFIA FOOD COVER,0
17490,568480,EMBROIDERED RIBBON REEL CLAIRE,0
17490,567295,AIRLINE BAG VINTAGE TOKYO 78,0
17490,556958,PACK OF 72 RETROSPOT CAKE CASES,0
17490,556958,ALARM CLOCK BAKELIKE IVORY,0
17490,568480,VINTAGE COFFEE GRINDER BOX,0
17490,581481,JAM CLOCK MAGNET,0
17490,567295,KINGS CHOICE MUG,0
17490,581481,DOORSTOP FOOTBALL DESIGN,0
17490,568480,EMBROIDERED RIBBON REEL RUBY,0
17490,581482,BAKING SET 9 PIECE RETROSPOT,0
17490,581482,KINGS CHOICE MUG,0
17490,581481,KNEELING MAT HOUSEWORK  DESIGN,0
17490,581482,GARDENERS KNEELING PAD CUP OF TEA,0
17490,581143,VINTAGE RED ENAMEL TRIM PLATE,0
17490,581481,TOY TIDY DOLLY GIRL DESIGN,0
17490,556958,SET/5 RED RETROSPOT LID GLASS BOWLS,0
17490,567295,6 RIBBONS EMPIRE,0
17490,568480,RED TOADSTOOL LED NIGHT LIGHT,0
17490,567295,GROW YOUR OWN BASIL IN ENAMEL MUG,0
17490,568480,CHRISTMAS LIGHTS 10 SANTAS,0
17490,581481,EMPIRE UNION JACK TV DINNER TRAY,0
17490,581481,PING MICROWAVE APRON,0
17490,556958,BLACK KITCHEN SCALES,0
17490,569936,VINTAGE RED TRIM ENAMEL BOWL,0
17490,581481,ROSE CARAVAN DOORSTOP,0
17490,556958,STRAWBERRY   PICNIC BAG,0
17490,581481,SQUARECUSHION COVER PINK UNION JACK,0
17490,556958,HANGING JAM JAR T-LIGHT HOLDER,0
17490,567295,CHOCOLATE CALCULATOR,0
17490,569936,RED FLORAL FELTCRAFT SHOULDER BAG,0
17490,581481,SET OF 2 ROUND TINS DUTCH CHEESE,0
17490,556958,RED KITCHEN SCALES,0
17490,556958,SET OF 3 REGENCY CAKE TINS,0
17490,556958,VINTAGE RED ENAMEL TRIM MUG,0
17490,581481,SET OF 2 ROUND TINS CAMEMBERT,0
17490,567295,RED/CREAM STRIPE CUSHION COVER,0
17490,556958,LUNCH BAG APPLE DESIGN,0
17490,581481,RED RETROSPOT TEA CUP AND SAUCER,0
17490,568480,VINTAGE RED ENAMEL TRIM MUG,0
17490,556958,JAM MAKING SET WITH JARS,0
17490,567295,6 RIBBONS RUSTIC CHARM,0
17490,567295,KINGS CHOICE TEA CADDY,0
17490,567295,FRIDGE MAGNETS US DINER ASSORTED,0
17490,556958,ALARM CLOCK BAKELIKE RED,0
17490,568480,ENAMEL MEASURING JUG CREAM,0
17490,568480,VINTAGE RED TRIM ENAMEL BOWL,0
17490,569936,ZINC FOLKART SLEIGH BELLS,0
17490,568480,LE JARDIN BOTANIQUE CUSHION COVER,0
17490,556958,PACK OF 20 NAPKINS RED APPLES,0
17490,568480,VINTAGE RED ENAMEL TRIM PLATE,0
17490,581482,SET OF 2 WOODEN MARKET CRATES,0
17490,569936,CARD HOLDER LOVE BIRD LARGE,0
17490,581482,AIRLINE BAG VINTAGE TOKYO 78,0
17490,581481,SET OF 2 TINS JARDIN DE PROVENCE,0
17490,581481,SET OF 3 CAKE TINS SKETCHBOOK,0
17490,556958,BAKING SET 9 PIECE RETROSPOT,0
17490,568480,RIBBON REEL SNOWY VILLAGE,0
17490,569936,RETROSPOT LAMP,0
17490,569936,LE JARDIN BOTANIQUE CUSHION COVER,0
17490,568480,RETROSPOT LAMP,0
17572,565090,GRAND CHOCOLATECANDLE,0
17572,550265,GREEN REGENCY TEACUP AND SAUCER,0
17572,536524,"SWISS ROLL TOWEL, CHOCOLATE  SPOTS",0
17572,569002,CREAM SLICE FLANNEL CHOCOLATE SPOT,0
17572,550265,GRAND CHOCOLATECANDLE,0
17572,569002,GRAND CHOCOLATECANDLE,0
17572,536524,CREAM SLICE FLANNEL CHOCOLATE SPOT,0
17572,536524,CREAM SLICE FLANNEL PINK SPOT,0
17572,550265,VINTAGE CREAM 3 BASKET CAKE STAND,0
17572,565090,CREAM SLICE FLANNEL PINK SPOT,0
17572,536524,GREEN REGENCY TEACUP AND SAUCER,0
17572,550265,PINK REGENCY TEACUP AND SAUCER,0
17618,548988,FELTCRAFT PRINCESS LOLA DOLL,0
17618,580401,TEA BAG PLATE RED RETROSPOT,0
17618,538517,FELTCRAFT CUSHION OWL,0
17618,538517,CERAMIC STRAWBERRY CAKE MONEY BANK,0
17618,580401,SET/2 RED RETROSPOT TEA TOWELS,0
17618,538517,MONSTERS STENCIL CRAFT,0
17618,538517,PHOTO FRAME 3 CLASSIC HANGING,0
17618,538517,CLOTHES PEGS RETROSPOT PACK 24,0
17618,548988,VINTAGE CREAM 3 BASKET CAKE STAND,0
17618,538517,SET OF 6 3D KIT CARDS FOR KIDS,0
17618,580401,VINTAGE CREAM DOG FOOD CONTAINER,0
17618,538517,FELTCRAFT CHRISTMAS FAIRY,0
17618,548988,GREY FLORAL FELTCRAFT SHOULDER BAG,0
17618,538517,RED SPOTTY BISCUIT TIN,0
17618,538517,"TRAY, BREAKFAST IN BED",0
17618,538517,GREY FLORAL FELTCRAFT SHOULDER BAG,0
17618,580401,EASTER CRAFT 4 CHICKS,0
17618,538517,HAPPY STENCIL CRAFT,0
17618,538517,STRAWBERRY CERAMIC TRINKET BOX,0
17618,538517,WOOD STAMP SET HAPPY BIRTHDAY,0
17618,580401,3 TRADITIONAl BISCUIT CUTTERS  SET,0
17618,548988,SET/4 WHITE RETRO STORAGE CUBES,0
17618,548988,RED RETROSPOT CAKE STAND,0
17618,538517,PINK FLORAL FELTCRAFT SHOULDER BAG,0
17618,548988,FELTCRAFT PRINCESS OLIVIA DOLL,0
17618,548988,RED FLORAL FELTCRAFT SHOULDER BAG,0
17618,538517,VINTAGE HEADS AND TAILS CARD GAME,0
17618,580401,GINGERBREAD MAN COOKIE CUTTER,0
17618,548988,TEA BAG PLATE RED RETROSPOT,0
17618,538517,CERAMIC HEART FAIRY CAKE MONEY BANK,0
17618,538517,SWEETHEART CERAMIC TRINKET BOX,0
17618,538517,HOME SWEET HOME METAL SIGN,0
17618,548988,FELTCRAFT PRINCESS CHARLOTTE DOLL,0
17618,538517,VINTAGE SNAP CARDS,0
17618,538517,PORCELAIN BUTTERFLY OIL BURNER,0
17618,538517,FELTCRAFT CHRISTMAS FAIRY,0
17618,580401,SET OF 20 KIDS COOKIE CUTTERS,0
17618,538517,RED RETROSPOT BOWL,0
17618,538517,DOOR HANGER  MUM + DADS ROOM,0
17618,538517,WOODEN BOX OF DOMINOES,0
17618,538517,RETROSPOT RED WASHING UP GLOVES,0
17618,538517,FELTCRAFT CUSHION BUTTERFLY,0
17618,548988,JAM MAKING SET WITH JARS,0
17618,538517,LARGE POPCORN HOLDER,0
17618,580401,WALL ART KEEP CALM,0
17618,538517,HEADS AND TAILS SPORTING FUN,0
17618,538517,FELTCRAFT CUSHION RABBIT,0
