13034,537205,LADLE LOVE HEART PINK,0
13034,571273,VINTAGE CHRISTMAS STOCKING,0
13034,571273,SET 2 PANTRY DESIGN TEA TOWELS,0
13034,537205,HEART OF WICKER LARGE,0
13034,537205,HEART OF WICKER SMALL,0
13034,537205,SET/2 RED RETROSPOT TEA TOWELS,0
13034,571273,ROLL WRAP VINTAGE SPOT,0
13034,571273,WOODEN CROQUET GARDEN SET,0
13034,571273,12 PENCILS SMALL TUBE RED RETROSPOT,0
13034,537205,IVORY HANGING DECORATION  HEART,0
13034,571273,SET OF 6 SPICE TINS PANTRY DESIGN,0
13034,571273,ROLL WRAP 50'S CHRISTMAS,0
13034,571273,HOME SWEET HOME BOTTLE,0
13034,571273,6 RIBBONS RUSTIC CHARM,0
13034,571273,JAM MAKING SET WITH JARS,0
13034,571273,SET OF 2 TEA TOWELS APPLE AND PEARS,0
13034,537205,BIRDHOUSE DECORATION MAGIC GARDEN,0
13034,571273,BASKET OF TOADSTOOLS,0
13034,571273,SET 6 SCHOOL MILK BOTTLES IN CRATE,0
13034,571273,CHILDRENS APRON APPLES DESIGN,0
13034,537205,RETROSPOT RED WASHING UP GLOVES,0
13034,571273,SET OF 4 PANTRY JELLY MOULDS,0
13034,571273,PANTRY SCRUBBING BRUSH,0
13034,537205,ASSORTED COLOUR BIRD ORNAMENT,0
13034,571273,SET OF 4 KNICK KNACK TINS DOILY,0
13034,571273,ZINC FOLKART SLEIGH BELLS,0
13034,571273,PAINTED METAL PEARS ASSORTED,0
13034,571273,SET OF 3 HEART COOKIE CUTTERS,0
13034,571273,SET OF 6 SOLDIER SKITTLES,0
13034,537205,FOOD CONTAINER SET 3 LOVE HEART,0
13034,571273,ROLL WRAP 50'S RED CHRISTMAS,0
13034,537205,BIRDCAGE DECORATION TEALIGHT HOLDER,0
13034,571273,PANTRY MAGNETIC  SHOPPING LIST,0
13034,571273,TRADITIONAL KNITTING NANCY,0
13034,571273,CHARLOTTE BAG APPLES DESIGN,0
13034,571273,FUNKY WASHING UP GLOVES ASSORTED,0
13034,537205,JIGSAW TREE WITH BIRDHOUSE,0
13345,544934,CHILDREN'S APRON DOLLY GIRL,2
13345,544934,PAPER CHAIN KIT SKULLS,2
13345,544934,JUMBO BAG DOLLY GIRL DESIGN,2
13345,544934,CHILDRENS APRON SPACEBOY DESIGN,2
13345,544934,CHILDS BREAKFAST SET DOLLY GIRL,2
13345,544934,SPACEBOY TV DINNER TRAY,2
13345,544934,PAPER CHAIN KIT RETROSPOT,2
13345,544934,JUMBO STORAGE BAG SKULLS,2
13345,544934,SPACEBOY LUNCH BOX,2
13345,544934,JUMBO STORAGE BAG SUKI,2
13345,544934,TV DINNER TRAY DOLLY GIRL,2
13345,544934,CARRIAGE,2
13345,544934,S/6 WOODEN SKITTLES IN COTTON BAG,2
13345,544934,PAPER CHAIN KIT EMPIRE,2
13345,544934,DOLLY GIRL LUNCH BOX,2
13345,544934,LUNCH BAG DOLLY GIRL DESIGN,2
13345,544934,CHILDS BREAKFAST SET SPACEBOY,2
13345,544934,LUNCH BAG SPACEBOY DESIGN,2
13345,544934,4 TRADITIONAL SPINNING TOPS,2
13345,544934,BAKING MOULD EASTER EGG MILK CHOC,2
13602,569799,JINGLE BELL HEART ANTIQUE SILVER,0
13602,569799,CHRISTMAS LIGHTS 10 VINTAGE BAUBLES,0
13602,569799,CHRISTMAS CRAFT LITTLE FRIENDS,0
13602,569799,3D TRADITIONAL CHRISTMAS STICKERS,0
13602,569799,MONSTERS STENCIL CRAFT,0
13602,569799,HANGING MINI COLOURED BOTTLES,0
13602,569799,HAND WARMER OWL DESIGN,0
13602,569799,HAPPY STENCIL CRAFT,0
13602,569799,JUMBO BAG VINTAGE LEAF,0
13602,569799,SET OF 12 FAIRY CAKE BAKING CASES,0
13602,569799,RED VINTAGE SPOT BEAKER,0
13602,569799,WALL ART ONLY ONE PERSON,0
13602,569799,REVOLVER WOODEN RULER,0
13602,569799,CHRISTMAS CRAFT TREE TOP ANGEL,0
13602,569799,SET 12 COLOURING PENCILS DOILY,0
13602,569799,SKETCHBOOK MAGNETIC SHOPPING LIST,0
13602,569799,HAND WARMER UNION JACK,0
13602,569799,JUMBO BAG VINTAGE DOILY,0
13602,569799,PACK OF 6 BIRDY GIFT TAGS,0
13602,569799,REGENCY TEA STRAINER,0
13602,569799,GIRAFFE WOODEN RULER,0
13602,569799,LUNCH BAG VINTAGE DOILY,0
13602,569799,SET OF 4 KNICK KNACK TINS DOILY,0
13928,575135,WOOD 2 DRAWER CABINET WHITE FINISH,0
13928,575135,DOLLY CABINET 3 DRAWERS,0
13928,575135,SET OF 2 TRAYS HOME SWEET HOME,0
13928,579280,PARISIENNE JEWELLERY DRAWER,0
13928,564440,PARTY METAL SIGN,0
13928,561819,WHITE HANGING HEART T-LIGHT HOLDER,0
13928,564440,SINGLE HEART ZINC T-LIGHT HOLDER,0
13928,579280,HOME SWEET HOME BLACKBOARD,0
13928,575135,VICTORIAN  METAL POSTCARD SPRING,0
13928,561819,KEY CABINET MA CAMPAGNE,0
13928,575135,ZINC SWEETHEART WIRE LETTER RACK,0
13928,564440,VICTORIAN  METAL POSTCARD SPRING,0
13928,564440,WOODEN HAPPY BIRTHDAY GARLAND,0
13928,579280,WOOD 2 DRAWER CABINET WHITE FINISH,0
13928,561819,PARISIENNE KEY CABINET,0
13928,564440,SPOTTY BUNTING,0
13928,579280,HOME SWEET HOME 2 DRAWER CABINET,0
13928,579280,3 HOOK PHOTO SHELF ANTIQUE WHITE,0
13928,579280,RUSTIC MIRROR WITH LACE HEART,0
13928,564440,HANGING HEART ZINC T-LIGHT HOLDER,0
13928,564440,ZINC FOLKART SLEIGH BELLS,0
13928,575135,PARISIENNE KEY CABINET,0
13928,564440,ASSORTED COLOUR MINI CASES,0
13928,575135,HOME SWEET HOME KEY HOLDER,0
13928,561819,VICTORIAN SEWING BOX SMALL,0
13928,561819,CREAM SWEETHEART MINI CHEST,0
13928,575135,PARISIENNE JEWELLERY DRAWER,0
14524,545523,MOUSEY LONG LEGS SOFT TOY,1
14524,556780,COFFEE MUG CAT + BIRD DESIGN,1
14524,568880,LARGE APOTHECARY MEASURING JAR,1
14524,550322,RED RETROSPOT SHOPPER BAG,1
14524,568878,ROUND SNACK BOXES SET OF 4 FRUITS,1
14524,575061,SCOTTIE DOG HOT WATER BOTTLE,1
14524,568874,SET OF 20 KIDS COOKIE CUTTERS,1
14524,556780,ROUND SNACK BOXES SET OF 4 FRUITS,1
14524,545523,SET/2 RED RETROSPOT TEA TOWELS,1
14524,568878,FOOT STOOL HOME SWEET HOME,1
14524,556780,UNION STRIPE WITH FRINGE  HAMMOCK,1
14524,568874,GLASS APOTHECARY BOTTLE TONIC,1
14524,556780,RED RETROSPOT SHOPPER BAG,1
14524,545523,IVORY HANGING DECORATION  HEART,1
14524,556780,SWISS ROLL TOWEL PINK  SPOTS,1
14524,545523,12 PENCILS SMALL TUBE RED RETROSPOT,1
14524,575061,CHOCOLATE HOT WATER BOTTLE,1
14524,568878,HAND OVER THE CHOCOLATE   SIGN,1
14524,568878,STOOL HOME SWEET HOME,1
14524,545523,CHOCOLATE BOX RIBBONS,1
14524,550322,JUMBO BAG ALPHABET,1
14524,568878,RUSTIC STRAWBERRY JAM POT LARGE,1
14524,568880,JAZZ HEARTS ADDRESS BOOK,1
14524,568878,GARDENERS KNEELING PAD CUP OF TEA,1
14524,538714,3 TIER CAKE TIN GREEN AND CREAM,1
14524,538714,LOVE HEART NAPKIN BOX,1
14524,550319,TEA COSY RED  STRIPE,1
14524,550322,JUMBO STORAGE BAG SUKI,1
14524,538714,PLEASE ONE PERSON METAL SIGN,1
14524,568878,BELLE JARDINIERE CUSHION COVER,1
14524,556780,RED KITCHEN SCALES,1
14524,538714,HOMEMADE JAM SCENTED CANDLES,1
14524,538714,CHOCOLATE HOT WATER BOTTLE,1
14524,568880,APOTHECARY MEASURING JAR,1
14524,550319,ROUND SNACK BOXES SET OF 4 FRUITS,1
14524,568880,GLASS APOTHECARY BOTTLE ELIXIR,1
14524,550322,RED RETROSPOT PICNIC BAG,1
14524,545523,STRAWBERRY BATH SPONGE,1
14524,556780,FLOWER VINE RAFFIA FOOD COVER,1
14524,568874,LOVE SEAT ANTIQUE WHITE METAL,1
14524,550322,IVORY GIANT GARDEN THERMOMETER,1
14524,556780,PACK OF 20 NAPKINS PANTRY DESIGN,1
14524,568878,HOT WATER BOTTLE SEX BOMB,1
14524,568878,GINGHAM RECIPE BOOK BOX,1
14524,568878,RETROSPOT GIANT TUBE MATCHES,1
14524,545523,AREA PATROLLED METAL SIGN,1
14524,545523,SET OF 3 NOTEBOOKS IN PARCEL,1
14524,568878,JUMBO BAG PINK POLKADOT,1
14524,538714,CARD HOLDER GINGHAM HEART,1
14524,568880,SMALL APOTHECARY MEASURING JAR,1
14524,556780,CREAM HEART CARD HOLDER,1
14524,568878,GREY HEART HOT WATER BOTTLE,1
14524,550319,GINGHAM HEART  DOORSTOP RED,1
14524,568878,POSTE FRANCE CUSHION COVER,1
14524,568880,3D TRADITIONAL CHRISTMAS STICKERS,1
14524,568874,HOT WATER BOTTLE I AM SO POORLY,1
14524,538714,KINGS CHOICE GIANT TUBE MATCHES,1
14524,538714,PINK 3 PIECE POLKADOT CUTLERY SET,1
14524,550322,BALLOONS  WRITING SET,1
14524,545523,ASSORTED COLOUR METAL CAT,1
14524,568874,PLAYING CARDS JUBILEE UNION JACK,1
14524,568880,MAKE YOUR OWN FLOWERPOWER CARD KIT,1
14524,538714,CERAMIC CAKE BOWL + HANGING CAKES,1
14524,545523,BREAD BIN DINER STYLE RED,1
14524,545523,DOORMAT WELCOME PUPPIES,1
14524,550319,VINTAGE UNION JACK APRON,1
14524,556780,WHITE HANGING HEART T-LIGHT HOLDER,1
14524,545523,LADYBIRD + BEE RAFFIA FOOD COVER,1
14524,545523,ROUND SNACK BOXES SET OF 4 FRUITS,1
14524,550322,PINK HAWAIIAN PICNIC HAMPER FOR 2,1
14524,568874,SILVER HEARTS TABLE DECORATION,1
14524,545523,CHILDRENS CUTLERY POLKADOT BLUE,1
14524,550319,PLEASE ONE PERSON METAL SIGN,1
14524,556780,BUTTERFLIES STICKERS,1
14524,550319,GROW A FLYTRAP OR SUNFLOWER IN TIN,1
14524,550322,GLASS JAR DIGESTIVE BISCUITS,1
14524,538714,JAM MAKING SET PRINTED,1
14524,556780,LARGE CAKE TOWEL PINK SPOTS,1
14524,550319,TEA COSY BLUE STRIPE,1
14524,556780,REX CASH+CARRY JUMBO SHOPPER,1
14524,538714,RETROSPOT SMALL TUBE MATCHES,1
14524,568878,LE JARDIN BOTANIQUE CUSHION COVER,1
14524,538714,CERAMIC CAKE STAND + HANGING CAKES,1
14524,550322,MILK PAN RED RETROSPOT,1
14524,550322,RED WOOLLY HOTTIE WHITE HEART.,1
14524,550319,REX CASH+CARRY JUMBO SHOPPER,1
14524,538714,SET 3 WICKER OVAL BASKETS W LIDS,1
14524,550322,RED RETROSPOT MUG,1
14524,550322,RETROSPOT LARGE MILK JUG,1
14524,545523,BOTTLE BAG RETROSPOT,1
14524,568878,HOT WATER BOTTLE TEA AND SYMPATHY,1
14524,538714,REX CASH+CARRY JUMBO SHOPPER,1
14524,545523,REX CASH+CARRY JUMBO SHOPPER,1
14524,568880,GLASS APOTHECARY BOTTLE TONIC,1
14524,550322,GLASS JAR MARMALADE,1
14524,545523,HANGING CHICK GREEN DECORATION,1
14524,568880,SET 8 CANDLES VINTAGE DOILY,1
14524,556780,CHILDRENS CUTLERY SPACEBOY,1
14524,568878,CHOCOLATE HOT WATER BOTTLE,1
14524,545523,HEN HOUSE DECORATION,1
14524,550322,12 DAISY PEGS IN WOOD BOX,1
14524,538714,BIRD BOX CHRISTMAS TREE DECORATION,1
14524,545523,PLEASE ONE PERSON METAL SIGN,1
14524,556780,CARD HOLDER GINGHAM HEART,1
14524,568878,PLEASE ONE PERSON METAL SIGN,1
14524,568878,SCOTTIE DOG HOT WATER BOTTLE,1
14524,568880,BUTTERFLIES STICKERS,1
14524,568880,WRAP CHRISTMAS VILLAGE,1
14524,550322,SKULL LUNCH BOX WITH CUTLERY,1
14524,556780,COFFEE MUG DOG + BALL DESIGN,1
14524,538714,ANGEL DECORATION 3 BUTTONS,1
14524,556780,REGENCY CAKESTAND 3 TIER,1
14524,568874,SILVER STARS TABLE DECORATION,1
14524,545523,HANGING CHICK  YELLOW DECORATION,1
14524,550319,NO SINGING METAL SIGN,1
14524,550319,ROUND SNACK BOXES SET OF 4 SKULLS,1
14524,550322,LUNCH BAG RED RETROSPOT,1
14524,556780,HEARTS  STICKERS,1
14524,568880,WOOD STAMP SET BEST WISHES,1
14524,568880,FOLDING UMBRELLA CHOCOLATE POLKADOT,1
14524,545523,FLOWER VINE RAFFIA FOOD COVER,1
14524,550322,GLASS JAR ENGLISH CONFECTIONERY,1
14524,556780,BOTTLE BAG RETROSPOT,1
14524,568880,CHRISTMAS CRAFT LITTLE FRIENDS,1
14524,538714,"FEATHER PEN,LIGHT PINK",1
14524,545523,HANGING CHICK CREAM DECORATION,1
14524,545523,BISCUIT TIN VINTAGE RED,1
14524,545523,RED RETROSPOT SHOPPER BAG,1
14524,538714,NO SINGING METAL SIGN,1
14524,550319,BATHROOM SCALES FOOTPRINTS IN SAND,1
14524,568874,BUNDLE OF 3 ALPHABET EXERCISE BOOKS,1
14524,568878,HOME SWEET HOME HANGING HEART,1
14524,556780,SET 2 PANTRY DESIGN TEA TOWELS,1
14524,538714,CHRISTMAS GINGHAM HEART,1
14524,550322,RED HEART SHAPE LOVE BUCKET,1
14524,550319,JUMBO BAG ALPHABET,1
14524,568874,GYMKHANA TREASURE BOOK BOX,1
14524,538714,HEART DECORATION RUSTIC HANGING,1
14524,568878,HOME SWEET HOME CUSHION COVER,1
14524,538714,CHOCOLATE BOX RIBBONS,1
14524,545523,36 PENCILS TUBE RED RETROSPOT,1
14524,550322,GLASS JAR PEACOCK BATH SALTS,1
14524,556780,WOODEN ROUNDERS GARDEN SET,1
14524,568878,JUMBO BAG PEARS,1
14524,550322,SCOTTIES DESIGN WASHBAG,1
14524,568874,GLASS APOTHECARY BOTTLE ELIXIR,1
14524,538714,SCANDINAVIAN REDS RIBBONS,1
14524,556780,RED HANGING HEART T-LIGHT HOLDER,1
14524,545523,LUNCH BAG RED RETROSPOT,1
14524,545523,WOVEN FROST CUSHION COVER,1
14524,545523,HANGING HEN ON NEST DECORATION,1
14524,550322,FRYING PAN RED RETROSPOT,1
14524,568878,KEY CABINET MA CAMPAGNE,1
14524,550322,GLASS JAR DAISY FRESH COTTON WOOL,1
14524,568878,PINK HAPPY BIRTHDAY BUNTING,1
14524,568878,BREAD BIN DINER STYLE IVORY,1
14524,568878,BLUE HAPPY BIRTHDAY BUNTING,1
14524,545523,36 PENCILS TUBE SKULLS,1
14524,538714,STAR DECORATION RUSTIC,1
14524,550322,STRAWBERRY LUNCH BOX WITH CUTLERY,1
14524,538714,BRIGHT BLUES RIBBONS,1
14524,545523,WALL TIDY RETROSPOT,1
14524,550322,GLASS JAR KINGS CHOICE,1
14524,550322,SCANDINAVIAN PAISLEY PICNIC BAG,1
14524,550322,COSMETIC BAG VINTAGE ROSE PAISLEY,1
14524,568874,DOG BOWL CHASING BALL DESIGN,1
14524,568874,3 TRADITIONAl BISCUIT CUTTERS  SET,1
14524,568880,GLASS APOTHECARY BOTTLE PERFUME,1
14524,568878,WHITE HANGING HEART T-LIGHT HOLDER,1
14524,568878,LADIES & GENTLEMEN METAL SIGN,1
14524,568880,JAZZ HEARTS PURSE NOTEBOOK,1
14524,545523,RED HEART SHAPE LOVE BUCKET,1
14524,568878,HOT WATER BOTTLE KEEP CALM,1
14524,568880,WRAP 50'S  CHRISTMAS,1
14524,556780,COFFEE MUG APPLES DESIGN,1
14524,545523,ROSE COTTAGE KEEPSAKE BOX,1
14524,538714,SET OF 20 KIDS COOKIE CUTTERS,1
14524,538714,6 RIBBONS RUSTIC CHARM,1
14524,545523,PLEASE ONE PERSON METAL SIGN,1
14524,550319,CHILDRENS CUTLERY POLKADOT PINK,1
14524,545523,APPLE BATH SPONGE,1
14524,550322,RED DINER WALL CLOCK,1
14524,550322,RED RETROSPOT ROUND CAKE TINS,1
14524,545523,RED KITCHEN SCALES,1
14524,545523,RECIPE BOX RETROSPOT,1
14524,556780,MULTICOLOUR SPRING FLOWER MUG,1
14524,545523,DOG BOWL CHASING BALL DESIGN,1
14524,545523,MAKE YOUR OWN FLOWERPOWER CARD KIT,1
14524,545523,GINGHAM HEART  DOORSTOP RED,1
14524,545523,ROUND CAKE TIN VINTAGE RED,1
14524,550322,RED RETROSPOT CHARLOTTE BAG,1
14524,556780,CHILDRENS CUTLERY POLKADOT BLUE,1
14524,568880,GAOLERS KEYS DECORATIVE GARDEN,1
14524,550322,BREAD BIN DINER STYLE RED,1
14524,550319,BLUE POLKADOT GARDEN PARASOL,1
14524,568874,DOORMAT WELCOME PUPPIES,1
14524,556780,CREAM SLICE FLANNEL PINK SPOT,1
14859,567476,HAND WARMER SCOTTY DOG DESIGN,0
14859,567476,JUMBO STORAGE BAG SUKI,0
14859,567476,JUMBO BAG OWLS,0
14859,553873,JUMBO BAG SCANDINAVIAN BLUE PAISLEY,0
14859,567476,JUMBO BAG 50'S CHRISTMAS,0
14859,567476,BREAD BIN DINER STYLE IVORY,0
14859,578854,CLASSIC BICYCLE CLIPS,0
14859,567476,PACK OF 12 VINTAGE LEAF TISSUES,0
14859,567476,SET OF 5 LUCKY CAT MAGNETS,0
14859,578854,BINGO SET,0
14859,578854,HAND WARMER SCOTTY DOG DESIGN,0
14859,578854,JUMBO SHOPPER VINTAGE RED PAISLEY,0
14859,567476,JUMBO BAG STRAWBERRY,0
14859,578854,BICYCLE PUNCTURE REPAIR KIT,0
14859,553873,JUMBO BAG DOILEY PATTERNS,0
14859,567476,ROUND STORAGE TIN VINTAGE LEAF,0
14859,567476,PARISIENNE KEY CABINET,0
14859,567476,SET OF 4 KNICK KNACK TINS LEAF,0
14859,553873,JUMBO BAG VINTAGE LEAF,0
14859,578854,JUMBO BAG PINK VINTAGE PAISLEY,0
14859,567476,ROUND CAKE TIN VINTAGE GREEN,0
14859,578854,JUMBO BAG VINTAGE LEAF,0
14859,578854,CHRISTMAS TREE HANGING GOLD,0
14859,553873,JUMBO BAG RED RETROSPOT,0
14859,553873,MULTI COLOUR SILVER T-LIGHT HOLDER,0
14859,567476,BISCUIT TIN VINTAGE GREEN,0
14859,567476,GUMBALL COAT RACK,0
14859,553873,BOX OF 24 COCKTAIL PARASOLS,0
14859,567476,SET OF 5 PANCAKE DAY MAGNETS,0
14859,567476,JUMBO BAG SCANDINAVIAN BLUE PAISLEY,0
14859,567476,ENAMEL BREAD BIN CREAM,0
14859,578854,HOLIDAY FUN LUDO,0
14859,567476,JUMBO SHOPPER VINTAGE RED PAISLEY,0
14859,553873,POLKADOT PEN,0
14859,567476,HAND WARMER BIRD DESIGN,0
14859,578854,JUMBO BAG RED RETROSPOT,0
14859,578857,CLASSIC CHROME BICYCLE BELL,0
14859,567476,MONEY BOX BISCUITS DESIGN,0
14859,553873,ASSORTED COLOURS SILK FAN,0
14859,567476,MONEY BOX HOUSEKEEPING DESIGN,0
14859,567476,ALARM CLOCK BAKELIKE GREEN,0
14859,578854,JUMBO BAG PEARS,0
14859,553873,JUMBO BAG PINK VINTAGE PAISLEY,0
14859,567476,JUMBO BAG VINTAGE CHRISTMAS,0
14859,553873,JUMBO SHOPPER VINTAGE RED PAISLEY,0
14859,567476,SET OF 6 SPICE TINS PANTRY DESIGN,0
14859,567476,ALARM CLOCK BAKELIKE ORANGE,0
14859,578854,HAND WARMER BIRD DESIGN,0
14859,567476,SET OF 5 MINI GROCERY MAGNETS,0
14859,578854,JUMBO BAG VINTAGE DOILY,0
14859,578857,VINTAGE DOILY JUMBO BAG RED,0
14859,553873,JAM MAKING SET PRINTED,0
14859,567476,PAINTED METAL PEARS ASSORTED,0
14859,567476,FAMILY ALBUM WHITE PICTURE FRAME,0
14859,567476,BREAD BIN DINER STYLE RED,0
14859,567476,SET OF 3 REGENCY CAKE TINS,0
14859,567476,JUMBO BAG PEARS,0
14859,567476,JUMBO BAG VINTAGE DOILY,0
15311,541293,WHITE SPOT BLUE CERAMIC DRAWER KNOB,1
15311,549542,SET/2 RED RETROSPOT TEA TOWELS,1
15311,551440,FRENCH ENAMEL CANDLEHOLDER,1
15311,554644,LUNCH BAG CARS BLUE,1
15311,555344,RED RETROSPOT SHOPPER BAG,1
15311,563638,SMALL PURPLE BABUSHKA NOTEBOOK,1
15311,566558,JUMBO BAG TOYS,1
15311,570096,FRENCH LAUNDRY SIGN BLUE METAL,1
15311,580904,JUMBO STORAGE BAG SUKI,1
15311,540157,PAPER BUNTING RETROSPOT,1
15311,541575,DECORATIVE ROSE BATHROOM BOTTLE,1
15311,542409,RED DRAWER KNOB ACRYLIC EDWARDIAN,1
15311,545288,SET/10 RED POLKADOT PARTY CANDLES,1
15311,551440,JUMBO BAG WOODLAND ANIMALS,1
15311,551440,PAPER BUNTING VINTAGE PAISLEY,1
15311,552574,HANGING HEART JAR T-LIGHT HOLDER,1
15311,559141,PASTEL COLOUR HONEYCOMB FAN,1
15311,559459,RED HEART SHAPE LOVE BUCKET,1
15311,563638,MONEY BOX KINGS CHOICE DESIGN,1
15311,579432,DOORMAT WELCOME PUPPIES,1
15311,579432,HANGING WOOD AND FELT HEART,1
15311,580284,IVORY REFECTORY CLOCK,1
15311,539641,HOT BATHS SOAP HOLDER,1
15311,539982,NO SINGING METAL SIGN,1
15311,555344,BOX OF 24 COCKTAIL PARASOLS,1
15311,560203,DOORMAT 3 SMILEY CATS,1
15311,563638,MONEY BOX BISCUITS DESIGN,1
15311,540157,RED RETROSPOT MINI CASES,1
15311,540475,WOODEN HAPPY BIRTHDAY GARLAND,1
15311,541216,RED RETROSPOT CUP,1
15311,543740,JUMBO BAG OWLS,1
15311,551839,PAPER BUNTING WHITE LACE,1
15311,553691,EDWARDIAN PARASOL NATURAL,1
15311,554939,RED RETROSPOT CHARLOTTE BAG,1
15311,559141,LARGE YELLOW BABUSHKA NOTEBOOK,1
15311,560552,VINTAGE NOTEBOOK TRAVELOGUE,1
15311,574514,SKULL SHOULDER BAG,1
15311,578523,LARGE CAKE TOWEL PINK SPOTS,1
15311,578523,GARAGE KEY FOB,1
15311,540157,VINTAGE NOTEBOOK PARIS DAYS,1
15311,540157,NO SINGING METAL SIGN,1
15311,541216,RED RETROSPOT MUG,1
15311,542890,SET OF 6 FUNKY BEAKERS,1
15311,543124,BLACK BAROQUE WALL CLOCK,1
15311,558447,SWEETHEART CERAMIC TRINKET BOX,1
15311,560552,PINK UNION JACK  LUGGAGE TAG,1
15311,562096,TOILET SIGN OCCUPIED OR VACANT,1
15311,563262,POPCORN HOLDER,1
15311,566558,LETTER HOLDER HOME SWEET HOME,1
15311,567099,SKULLS WRITING SET,1
15311,567626,DOORMAT FANCY FONT HOME SWEET HOME,1
15311,568505,JUMBO BAG SCANDINAVIAN BLUE PAISLEY,1
15311,575919,PACK OF 6 SKULL PAPER PLATES,1
15311,575919,JAM JAR WITH GREEN LID,1
15311,575919,MULTI COLOUR SILVER T-LIGHT HOLDER,1
15311,540157,GLASS  BEURRE DISH,1
15311,540680,BLUE POLKADOT BOWL,1
15311,542409,FELT EGG COSY CHICKEN,1
15311,543124,CERAMIC STRAWBERRY MONEY BOX,1
15311,543463,PURPLE DRAWERKNOB ACRYLIC EDWARDIAN,1
15311,552574,PAPER BUNTING COLOURED LACE,1
15311,554644,LUNCH BAG SUKI DESIGN,1
15311,555855,SET 7 BABUSHKA NESTING BOXES,1
15311,559141,GIN + TONIC DIET METAL SIGN,1
15311,567099,FRENCH BLUE METAL DOOR SIGN 7,1
15311,567626,T-LIGHT HOLDER SILVER PETIT FOUR,1
15311,568505,ROTATING SILVER ANGELS T-LIGHT HLDR,1
15311,575919,FRENCH BLUE METAL DOOR SIGN 8,1
15311,580284,YOU'RE CONFUSING ME METAL SIGN,1
15311,539247,CHILLI LIGHTS,1
15311,542409,DOORMAT FANCY FONT HOME SWEET HOME,1
15311,543740,4 TRADITIONAL SPINNING TOPS,1
15311,549542,BUNNY EGG BOX,1
15311,557628,COOK WITH WINE METAL SIGN,1
15311,560552,CALENDAR IN SEASON DESIGN,1
15311,562619,PACK OF 12 PINK POLKADOT TISSUES,1
15311,572217,DOORMAT AIRMAIL,1
15311,574514,ENAMEL WASH BOWL CREAM,1
15311,575919,FRENCH KITCHEN SIGN BLUE METAL,1
15311,575919,WOODEN PICTURE FRAME WHITE FINISH,1
15311,536381,YOU'RE CONFUSING ME METAL SIGN,1
15311,539247,HAND WARMER BABUSHKA DESIGN,1
15311,541798,SKULL LUNCH BOX WITH CUTLERY,1
15311,543124,RED RETROSPOT UMBRELLA,1
15311,544398,RED HEART SHAPE LOVE BUCKET,1
15311,552574,BLUE SPOT CERAMIC DRAWER KNOB,1
15311,555344,SET OF 4 ENGLISH ROSE PLACEMATS,1
15311,563262,TOILET SIGN OCCUPIED OR VACANT,1
15311,567099,WOODEN HAPPY BIRTHDAY GARLAND,1
15311,567980,LILAC GAUZE BUTTERFLY LAMPSHADE,1
15311,536381,YELLOW BREAKFAST CUP AND SAUCER,1
15311,537195,BLACK/BLUE POLKADOT UMBRELLA,1
15311,540680,GREEN POLKADOT BOWL,1
15311,540957,VINTAGE CREAM CAT FOOD CONTAINER,1
15311,545653,RED RETROSPOT PURSE,1
15311,551440,FRENCH LAUNDRY SIGN BLUE METAL,1
15311,554939,SET OF 4 ENGLISH ROSE COASTERS,1
15311,559459,METAL SIGN CUPCAKE SINGLE HOOK,1
15311,562619,SINGLE HEART ZINC T-LIGHT HOLDER,1
15311,575321,JAM JAR WITH GREEN LID,1
15311,578819,FOOT STOOL HOME SWEET HOME,1
15311,540157,WOOD S/3 CABINET ANT WHITE FINISH,1
15311,540157,SKULL LUNCH BOX WITH CUTLERY,1
15311,541798,LARGE CAKE STAND  HANGING STRAWBERY,1
15311,542890,HEART OF WICKER LARGE,1
15311,543463,"KEY FOB , GARAGE DESIGN",1
15311,543740,BLUE BREAKFAST CUP AND SAUCER,1
15311,544062,JUMBO STORAGE BAG SKULLS,1
15311,544398,EDWARDIAN PARASOL NATURAL,1
15311,544777,SET OF 4 ENGLISH ROSE PLACEMATS,1
15311,545991,S/12 MINI RABBIT EASTER,1
15311,551440,PACK OF 20 NAPKINS RED APPLES,1
15311,563638,VINTAGE SNAP CARDS,1
15311,566558,ROUND SNACK BOXES SET OF4 WOODLAND,1
15311,567099,RETRO MOD TRAY,1
15311,567099,RETRO LONGBOARD IRONING BOARD COVER,1
15311,573865,RED TOADSTOOL LED NIGHT LIGHT,1
15311,539982,HAPPY STENCIL CRAFT,1
15311,541575,GREEN POLKADOT BOWL,1
15311,555855,CLASSIC CAFE SUGAR DISPENSER,1
15311,567980,RATTLE SNAKE EGGS,1
15311,580284,GUMBALL MAGAZINE RACK,1
15311,539247,WOOD S/3 CABINET ANT WHITE FINISH,1
15311,539247,SMALL GLASS SUNDAE DISH CLEAR,1
15311,542890,SET OF 6 HEART CHOPSTICKS,1
15311,545288,JUMBO BAG SCANDINAVIAN BLUE PAISLEY,1
15311,553691,TRIPLE WIRE HOOK IVORY HEART,1
15311,558447,GLASS BON BON JAR,1
15311,566558,EDWARDIAN PARASOL BLACK,1
15311,567099,PINK UNION JACK  LUGGAGE TAG,1
15311,570797,LARGE PURPLE BABUSHKA NOTEBOOK,1
15311,538076,NEW BAROQUE BLACK PHOTO ALBUM,1
15311,540475,PINK  HEART SHAPE LOVE BUCKET,1
15311,540957,BLUE POLKADOT BOWL,1
15311,543463,HEART GARLAND RUSTIC PADDED,1
15311,543463,GLASS CLOCHE SMALL,1
15311,543740,S/12 MINI RABBIT EASTER,1
15311,551440,HAND OVER THE CHOCOLATE   SIGN,1
15311,557225,DRAWER KNOB CERAMIC IVORY,1
15311,563262,GLASS BON BON JAR,1
15311,563638,VINTAGE LEAF MAGNETIC NOTEPAD,1
15311,569330,IVORY KNITTED MUG COSY,1
15311,572885,SET OF 3 HANGING OWLS OLLIE BEAK,1
15311,572885,SET/6 RED SPOTTY PAPER PLATES,1
15311,578018,RED RETROSPOT MUG,1
15311,580284,VICTORIAN SEWING BOX LARGE,1
15311,538651,BLUE POLKADOT CUP,1
15311,540157,BLUE STRIPE CERAMIC DRAWER KNOB,1
15311,541216,EDWARDIAN PARASOL NATURAL,1
15311,543463,RED SPOT CERAMIC DRAWER KNOB,1
15311,543463,LADIES & GENTLEMEN METAL SIGN,1
15311,550493,VINYL RECORD FRAME SILVER,1
15311,552574,RED STRIPE CERAMIC DRAWER KNOB,1
15311,553691,"KEY FOB , GARAGE DESIGN",1
15311,563638,200 RED + WHITE BENDY STRAWS,1
15311,565776,MEDIUM CERAMIC TOP STORAGE JAR,1
15311,570797,MEDIUM CERAMIC TOP STORAGE JAR,1
15311,578018,4 IVORY DINNER CANDLES SILVER FLOCK,1
15311,541575,CHARLOTTE BAG PINK POLKADOT,1
15311,541798,PACK 20 ENGLISH ROSE PAPER NAPKINS,1
15311,548863,DOORMAT MULTICOLOUR STRIPE,1
15311,559459,JUMBO BAG CHARLIE AND LOLA TOYS,1
15311,560203,JUMBO BAG WOODLAND ANIMALS,1
15311,563638,12 IVORY ROSE PEG PLACE SETTINGS,1
15311,575321,TRIPLE HOOK ANTIQUE IVORY ROSE,1
15311,579432,WOODEN HAPPY BIRTHDAY GARLAND,1
15311,581571,SKETCHBOOK MAGNETIC SHOPPING LIST,1
15311,542890,PAPER BUNTING WHITE LACE,1
15311,542890,BLUE OWL SOFT TOY,1
15311,543463,GLASS JAR DAISY FRESH COTTON WOOL,1
15311,544398,CERAMIC HEART FAIRY CAKE MONEY BANK,1
15311,545991,RED RETROSPOT PUDDING BOWL,1
15311,554939,LUNCH BAG SUKI DESIGN,1
15311,563638,DOORMAT BLACK FLOCK,1
15311,538857,VINTAGE CREAM DOG FOOD CONTAINER,1
15311,539982,PENCIL CASE LIFE IS BEAUTIFUL,1
15311,554644,BLUE CHENILLE SHAGGY CUSHION COVER,1
15311,563638,GLASS CLOCHE SMALL,1
15311,563638,GIRLS VINTAGE TIN SEASIDE BUCKET,1
15311,567099,MINIATURE ANTIQUE ROSE HOOK IVORY,1
15311,567099,RED LOVE HEART SHAPE CUP,1
15311,567980,ROCKING HORSE RED CHRISTMAS,1
15311,574514,CUTE CATS TAPE,1
15311,575919,JUMBO  BAG BAROQUE BLACK WHITE,1
15311,541216,CERAMIC HEART FAIRY CAKE MONEY BANK,1
15311,542890,MOODY BOY  DOOR HANGER,1
15311,543463,GARLAND WOODEN HAPPY EASTER,1
15311,545288,FELT EGG COSY CHICKEN,1
15311,545653,PINK & WHITE BREAKFAST TRAY,1
15311,546384,VINTAGE CREAM CAT FOOD CONTAINER,1
15311,546528,WHITE SPOT BLUE CERAMIC DRAWER KNOB,1
15311,554268,JUMBO BAG WOODLAND ANIMALS,1
15311,560203,WHITE SPOT BLUE CERAMIC DRAWER KNOB,1
15311,570096,ROUND SNACK BOXES SET OF4 WOODLAND,1
15311,573275,SINGLE ANTIQUE ROSE HOOK IVORY,1
15311,575919,3 HOOK PHOTO SHELF ANTIQUE WHITE,1
15311,576564,DOORMAT NEW ENGLAND,1
15311,537195,CHILLI LIGHTS,1
15311,538651,PINK 3 PIECE POLKADOT CUTLERY SET,1
15311,538651,FLOWER VINE RAFFIA FOOD COVER,1
15311,538651,FELT EGG COSY WHITE RABBIT,1
15311,539641,VINTAGE CREAM CAT FOOD CONTAINER,1
15311,540957,PINK  POLKADOT CUP,1
15311,543463,RED RETROSPOT MINI CASES,1
15311,545653,EDWARDIAN PARASOL NATURAL,1
15311,550493,NO SINGING METAL SIGN,1
15311,567099,CHILDREN'S APRON DOLLY GIRL,1
15311,574514,SKETCHBOOK MAGNETIC SHOPPING LIST,1
15311,576564,EDWARDIAN PARASOL PINK,1
15311,538857,RED TOADSTOOL LED NIGHT LIGHT,1
15311,543463,BUNNY EGG BOX,1
15311,544062,WOOD 2 DRAWER CABINET WHITE FINISH,1
15311,546528,DOORMAT NEW ENGLAND,1
15311,555344,LUNCH BAG CARS BLUE,1
15311,557225,COLOUR GLASS. STAR T-LIGHT HOLDER,1
15311,561295,LUNCH BAG APPLE DESIGN,1
15311,566558,EDWARDIAN PARASOL NATURAL,1
15311,567099,DINOSAURS  WRITING SET,1
15311,570797,SKULLS PARTY BAG + STICKER SET,1
15311,545288,PAPER CHAIN KIT 50'S CHRISTMAS,1
15311,546384,BROCANTE COAT RACK,1
15311,548863,EASTER BUNNY HANGING GARLAND,1
15311,554939,GREEN POLKADOT PLATE,1
15311,559141,SMALL PURPLE BABUSHKA NOTEBOOK,1
15311,560203,PACK OF 12 HEARTS DESIGN TISSUES,1
15311,562912,BLACK RECORD COVER FRAME,1
15311,563262,RED METAL BEACH SPADE,1
15311,570096,ROUND SNACK BOXES SET OF 4 SKULLS,1
15311,575919,MEDIUM CERAMIC TOP STORAGE JAR,1
15311,538076,4 TRADITIONAL SPINNING TOPS,1
15311,540157,RED STRIPE CERAMIC DRAWER KNOB,1
15311,548863,PAPER BUNTING WHITE LACE,1
15311,548863,CHILDRENS GARDEN GLOVES PINK,1
15311,556572,PAPER CHAIN KIT RETROSPOT,1
15311,562619,VICTORIAN GLASS HANGING T-LIGHT,1
15311,563638,CHILDRENS CUTLERY RETROSPOT RED,1
15311,565309,BLUE STRIPE CERAMIC DRAWER KNOB,1
15311,572885,ROTATING SILVER ANGELS T-LIGHT HLDR,1
15311,575919,GLASS CLOCHE SMALL,1
15311,579432,HANGING WOOD AND FELT FLOWER,1
15311,536381,GIRLY PINK TOOL SET,1
15311,537195,ANTIQUE SILVER TEA GLASS ETCHED,1
15311,548863,LUNCH BAG CARS BLUE,1
15311,554268,JUMBO BAG PINK POLKADOT,1
15311,554268,CHARLOTTE BAG DOLLY GIRL DESIGN,1
15311,557628,JUMBO BAG RED RETROSPOT,1
15311,563638,SKULL SHOULDER BAG,1
15311,563638,CALENDAR PAPER CUT DESIGN,1
15311,570797,DRAWER KNOB CRACKLE GLAZE IVORY,1
