12904,577751,WOODEN TREE CHRISTMAS SCANDINAVIAN,0
12904,557469,VINTAGE BEAD PINK PURSE,0
12904,557469,FUSCHIA FLOWER PURSE WITH BEADS,0
12904,557469,CLASSIC METAL BIRDCAGE PLANT HOLDER,0
12904,577751,HEART IVORY TRELLIS LARGE,0
12904,557469,TRIPLE HOOK ANTIQUE IVORY ROSE,0
12904,557469,SINGLE ANTIQUE ROSE HOOK IVORY,0
12904,557469,DOVE DECORATION PAINTED ZINC,0
12904,577751,LANDMARK FRAME BAKER STREET,0
12904,557469,WOODEN PICTURE FRAME WHITE FINISH,0
12904,557469,DANISH ROSE PHOTO FRAME,0
12904,557469,SET OF 3 REGENCY CAKE TINS,0
12904,577751,BOX OF 6 MINI VINTAGE CRACKERS,0
12904,557469,WOODEN FRAME ANTIQUE WHITE,0
12904,577751,HEART IVORY TRELLIS LARGE,0
12904,577751,MEMO BOARD COTTAGE DESIGN,0
12904,577751,CHERUB HEART DECORATION GOLD,0
12904,577751,IVORY WICKER HEART MEDIUM,0
12904,577751,WOODEN FRAME ANTIQUE WHITE,0
12904,577751,VICTORIAN  METAL POSTCARD SPRING,0
12904,577751,PARTY CONE CHRISTMAS DECORATION,0
12904,577751,LOVEBIRD HANGING DECORATION WHITE,0
12904,577751,LARGE WHITE HEART OF WICKER,0
12904,577751,WALL ART DOG LICENCE,0
12904,557469,HANGING CHICK GREEN DECORATION,0
12904,557469,PARTY BUNTING,0
12904,577751,TRIPLE HOOK ANTIQUE IVORY ROSE,0
12904,557469,IVORY HANGING DECORATION  HEART,0
12904,577751,CARD HOLDER GINGHAM HEART,0
12904,557469,MINIATURE ANTIQUE ROSE HOOK IVORY,0
12904,577751,SMALL WHITE HEART OF WICKER,0
12904,557469,HANGING CHICK CREAM DECORATION,0
12904,557469,FOLKART ZINC HEART CHRISTMAS DEC,0
12904,557469,PINK METAL CHICKEN HEART,0
12904,557469,VINTAGE UNION JACK BUNTING,0
12904,577751,VINTAGE BELLS GARLAND,0
12904,557469,PEACE SMALL WOOD LETTERS,0
12904,577751,OVAL WALL MIRROR DIAMANTE,0
12904,577751,WOODEN HEART CHRISTMAS SCANDINAVIAN,0
12904,557469,PAINTED METAL PEARS ASSORTED,0
12904,577751,WHITE CHRISTMAS GARLAND STARS TREES,0
12904,577751,ASSORTED COLOUR BIRD ORNAMENT,0
12904,557469,OVAL WALL MIRROR DIAMANTE,0
12904,557469,HOME SMALL WOOD LETTERS,0
12904,577751,MINIATURE ANTIQUE ROSE HOOK IVORY,0
12904,577751,FOLKART ZINC HEART CHRISTMAS DEC,0
12904,577751,ZINC FOLKART SLEIGH BELLS,0
12904,557469,HEART DECORATION PAINTED ZINC,0
12904,577751,LOVEBIRD HANGING DECORATION WHITE,0
12904,557469,HANGING HEART MIRROR DECORATION,0
12904,577751,GLITTER HEART DECORATION,0
12904,577751,WALL ART STOP FOR TEA,0
12904,577751,SINGLE ANTIQUE ROSE HOOK IVORY,0
12904,577751,SMALL PARISIENNE HEART PHOTO FRAME,0
12904,557469,PHOTO FRAME CORNICE,0
12904,557469,FRENCH LAVENDER SCENT HEART,0
12904,557469,LAVENDER SCENTED FABRIC HEART,0
12904,557469,FOUR HOOK  WHITE LOVEBIRDS,0
12904,557469,PHOTO FRAME 3 CLASSIC HANGING,0
12904,577751,GLITTER CHRISTMAS TREE WITH BELLS,0
12904,557469,VICTORIAN  METAL POSTCARD SPRING,0
12904,577751,LANDMARK FRAME OXFORD STREET,0
12904,577751,WOODEN STAR CHRISTMAS SCANDINAVIAN,0
12904,577751,IVORY WICKER HEART MEDIUM,0
12904,557469,HANGING CHICK  YELLOW DECORATION,0
12904,577751,CLASSIC METAL BIRDCAGE PLANT HOLDER,0
12904,577751,CREAM CUPID HEARTS COAT HANGER,0
12904,577751,SMALL WHITE HEART OF WICKER,0
12904,577751,METAL MERRY CHRISTMAS WREATH,0
12904,557469,BIRDCAGE DECORATION TEALIGHT HOLDER,0
12904,577751,CARD HOLDER LOVE BIRD SMALL,0
13235,552864,WOOD STAMP SET HAPPY BIRTHDAY,2
13235,552864,CUPCAKE LACE PAPER SET 6,2
13235,552864,JUMBO BAG RED RETROSPOT,2
13235,552864,WOODEN PICTURE FRAME WHITE FINISH,2
13235,552864,RED RETROSPOT CUP,2
13235,552864,MISTLETOE HEART WREATH CREAM,2
13235,552864,CHILDRENS CUTLERY DOLLY GIRL,2
13235,552864,HEART FILIGREE DOVE LARGE,2
13235,552864,ALUMINIUM STAMPED HEART,2
13235,552864,RED RETROSPOT BOWL,2
13235,552864,PACK OF 6 SKULL PAPER PLATES,2
13235,552864,SET 2 TEA TOWELS I LOVE LONDON,2
13235,552864,PARTY BUNTING,2
13235,552864,SPOTTY BUNTING,2
13235,552864,PACK OF 20 SKULL PAPER NAPKINS,2
13235,552864,ROUND PINK HEART MIRROR,2
13235,552864,LONDON BUS COFFEE MUG,2
13235,552864,CHARLOTTE BAG VINTAGE ALPHABET,2
13235,552864,RED RETROSPOT PLATE,2
13235,552864,BLUE PARTY BAGS,2
13235,552864,SCANDINAVIAN PAISLEY PICNIC BAG,2
13235,552864,VINTAGE UNION JACK BUNTING,2
13235,552864,CHILDRENS CUTLERY DOLLY GIRL,2
13235,552864,BLUE POLKADOT CUP,2
13235,552864,BLUE POLKADOT BOWL,2
13235,552864,PACK OF 6 SKULL PAPER CUPS,2
13235,552864,QUEENS GUARD COFFEE MUG,2
13235,552864,JUMBO  BAG BAROQUE BLACK WHITE,2
13235,552864,JUMBO BAG DOILEY PATTERNS,2
13235,552864,SET OF 4 JAM JAR MAGNETS,2
13235,552864,RETROSPOT TEA SET CERAMIC 11 PC,2
13235,552864,SET/5 RED RETROSPOT LID GLASS BOWLS,2
13235,552864,PINK  POLKADOT CUP,2
13235,552864,FOOD COVER WITH BEADS SET 2,2
13235,552864,RED COAT RACK PARIS FASHION,2
13235,552864,PINK  POLKADOT PLATE,2
13235,552864,60 TEATIME FAIRY CAKE CASES,2
13235,552864,MISTLETOE HEART WREATH GREEN,2
13235,552864,CHILDRENS CUTLERY SPACEBOY,2
13235,552864,PINK PARTY BAGS,2
13235,552864,VINTAGE EMBOSSED HEART,2
13235,552864,JUMBO BAG PINK POLKADOT,2
13235,552864,SET OF 20 KIDS COOKIE CUTTERS,2
13235,552864,BLUE COAT RACK PARIS FASHION,2
13235,552864,IVORY HANGING DECORATION  HEART,2
13235,552864,CHILDRENS CUTLERY SPACEBOY,2
13235,552864,PACK OF 6 SKULL PAPER CUPS,2
13235,552864,BREAD BIN DINER STYLE IVORY,2
13235,552864,JUMBO BAG APPLES,2
13235,552864,JUMBO BAG PEARS,2
13235,552864,PINK  POLKADOT CUP,2
13235,552864,COFFEE MUG PEARS  DESIGN,2
13235,552864,WOOD STAMP SET FLOWERS,2
13235,552864,"SET 3 RETROSPOT TEA,COFFEE,SUGAR",2
13235,552864,PINK VINTAGE PAISLEY PICNIC BAG,2
13235,552864,RED SPOTTY BISCUIT TIN,2
13235,552864,RED RETROSPOT CUP,2
13235,552864,WOOD STAMP SET BEST WISHES,2
13504,569838,CAKE STAND 3 TIER MAGIC GARDEN,0
13504,569838,PAPER BUNTING RETROSPOT,0
13504,569838,SILK PURSE BABUSHKA PINK,0
13504,569838,SWEETHEART 3 TIER CAKE STAND,0
13504,569838,CARD BILLBOARD FONT,0
13504,569838,LARGE HEART MEASURING SPOONS,0
13504,569838,RED RETROSPOT PURSE,0
13504,569838,CHICK GREY HOT WATER BOTTLE,0
13504,569838,PENCIL CASE LIFE IS BEAUTIFUL,0
13504,569838,TEA PARTY BIRTHDAY CARD,0
13504,569838,SPOTTY BUNTING,0
13504,569838,BOX OF 24 COCKTAIL PARASOLS,0
13504,569838,SET OF TEA COFFEE SUGAR TINS PANTRY,0
13504,569838,SAVE THE PLANET COTTON TOTE BAG,0
13504,569838,POLKADOT RAIN HAT,0
13504,569838,REGENCY CAKESTAND 3 TIER,0
13504,569838,SCOTTIE DOG HOT WATER BOTTLE,0
13504,569838,MAGNETS PACK OF 4 SWALLOWS,0
13504,569838,FAIRY CAKE DESIGN UMBRELLA,0
13504,569838,MAGNETS PACK OF 4 HOME SWEET HOME,0
13504,569838,FOLDING BUTTERFLY MIRROR IVORY,0
13504,569838,FAWN BLUE HOT WATER BOTTLE,0
13546,571476,GARDENIA 3 WICK MORRIS BOXED CANDLE,0
13546,578953,SET OF 3 CAKE TINS PANTRY DESIGN,0
13546,578953,SET OF 20 VINTAGE CHRISTMAS NAPKINS,0
13546,578953,SET OF 3 PANTRY WOODEN SPOONS,0
13546,571476,DAIRY MAID STRIPE MUG,0
13546,578953,JIGSAW TREE WITH WATERING CAN,0
13546,578953,PETIT TRAY CHIC,0
13546,571476,ENAMEL BREAD BIN CREAM,0
13546,571476,PAPER CHAIN KIT VINTAGE CHRISTMAS,0
13546,578953,BOX OF 6 MINI 50'S CRACKERS,0
13546,571476,SET/20 RED RETROSPOT PAPER NAPKINS,0
13546,571476,DAIRY MAID LARGE MILK JUG,0
13546,571476,SET OF 20 VINTAGE CHRISTMAS NAPKINS,0
13546,578953,ASSORTED SHAPES PHOTO CLIP SILVER,0
13546,578953,CLASSIC CHROME BICYCLE BELL,0
13546,571476,RETROSPOT CHILDRENS APRON,0
13546,578953,BLUE POLKADOT WASHING UP GLOVES,0
13546,554202,3 TRADITIONAl BISCUIT CUTTERS  SET,0
13546,554202,SET 20 NAPKINS FAIRY CAKES DESIGN,0
13546,571476,GARDENIA 1 WICK MORRIS BOXED CANDLE,0
13546,554202,PINK FAIRY CAKE CHILDRENS APRON,0
13546,578953,CLASSIC GLASS COOKIE JAR,0
13546,578953,RED RETROSPOT SUGAR JAM BOWL,0
13546,571476,RED RETROSPOT SUGAR JAM BOWL,0
13546,571476,PAPER CHAIN KIT 50'S CHRISTMAS,0
13546,578953,RECIPE BOX RETROSPOT,0
13546,554202,RED RETROSPOT SUGAR JAM BOWL,0
13546,554202,RED RETROSPOT SMALL MILK JUG,0
13546,571476,DAIRY MAID TOASTRACK,0
13546,578953,FAIRY CAKES NOTEBOOK A6 SIZE,0
13546,554202,60 TEATIME FAIRY CAKE CASES,0
13546,554202,ENAMEL MEASURING JUG CREAM,0
13546,578953,CERAMIC BOWL WITH STRAWBERRY DESIGN,0
13546,554202,RETROSPOT LARGE MILK JUG,0
13546,554202,BEST DAD CANDLE LETTERS,0
13546,578953,6PC WOOD PLATE SET DISPOSABLE,0
13546,578953,PANTRY MAGNETIC  SHOPPING LIST,0
13546,578953,SET OF 72 RETROSPOT PAPER  DOILIES,0
13546,571476,RED RETROSPOT SMALL MILK JUG,0
13546,571476,STRAWBERRY CERAMIC TRINKET BOX,0
13546,554202,PACK OF 72 RETROSPOT CAKE CASES,0
13546,554202,SET/10 PINK POLKADOT PARTY CANDLES,0
13546,571476,MOTORING TISSUE BOX,0
13546,578953,SET OF 60 PANTRY DESIGN CAKE CASES,0
13546,554202,SET OF 6 GIRLS CELEBRATION CANDLES,0
13546,554202,ASSORTED SHAPES PHOTO CLIP SILVER,0
13546,554202,SET/20 STRAWBERRY PAPER NAPKINS,0
13546,554202,SET/10 BLUE POLKADOT PARTY CANDLES,0
13546,578953,JIGSAW TREE WITH BIRDHOUSE,0
13546,578953,PAPER CHAIN KIT 50'S CHRISTMAS,0
13546,578953,SWEETHEART CERAMIC TRINKET BOX,0
13546,571476,SET OF 72 RETROSPOT PAPER  DOILIES,0
13546,578953,PANTRY KITCHEN THERMOMETER,0
13546,554202,SET/10 IVORY POLKADOT PARTY CANDLES,0
13546,571476,BLUE POLKADOT WASHING UP GLOVES,0
13546,571476,3 ROSE MORRIS BOXED CANDLES,0
13546,571476,36 DOILIES VINTAGE CHRISTMAS,0
13546,578953,BOX OF 6 MINI VINTAGE CRACKERS,0
13546,571476,VINTAGE CHRISTMAS STOCKING,0
13546,554202,CERAMIC BOWL WITH STRAWBERRY DESIGN,0
13546,554202,RED RETROSPOT BUTTER DISH,0
13546,578953,STRAWBERRY CERAMIC TRINKET POT,0
13546,571476,3 GARDENIA MORRIS BOXED CANDLES,0
13546,571476,BOX OF 6 MINI 50'S CRACKERS,0
13546,554202,RETROSPOT CHILDRENS APRON,0
13546,571476,PACK OF 72 RETROSPOT CAKE CASES,0
13546,571476,ENAMEL MEASURING JUG CREAM,0
13546,554202,CERAMIC PLATE STRAWBERRY DESIGN,0
13546,554202,ENAMEL BREAD BIN CREAM,0
13546,554202,BLACK AND WHITE DOG BOWL,0
13546,578953,LARGE CAKE TOWEL CHOCOLATE SPOTS,0
13546,554202,SET/10 RED POLKADOT PARTY CANDLES,0
13546,578953,SET/20 RED RETROSPOT PAPER NAPKINS,0
13546,571476,RECIPE BOX RETROSPOT,0
13546,578953,JIGSAW RABBIT AND BIRDHOUSE,0
13546,578953,BUNNY WOODEN PAINTED WITH BIRD,0
13546,571476,SET OF 4 ROSE BOTANICAL CANDLES,0
13546,578953,CLASSIC BICYCLE CLIPS,0
13546,578953,ASSORTED SHAPES PHOTO CLIP SILVER,0
13546,578953,PAPER CHAIN KIT VINTAGE CHRISTMAS,0
13546,571476,SET OF 3 CAKE TINS SKETCHBOOK,0
13546,554202,SET OF 36 TEATIME PAPER DOILIES,0
13546,578953,CERAMIC CAKE STAND + HANGING CAKES,0
13546,571476,FUNKY WASHING UP GLOVES ASSORTED,0
13546,578953,TEA TIME OVEN GLOVE,0
13546,578953,PACK OF 12 50'S CHRISTMAS TISSUES,0
13546,578953,BICYCLE PUNCTURE REPAIR KIT,0
13546,554202,SET/20 RED RETROSPOT PAPER NAPKINS,0
13546,571476,RETROSPOT RED WASHING UP GLOVES,0
13546,578953,60 TEATIME FAIRY CAKE CASES,0
13546,578953,RETROSPOT LARGE MILK JUG,0
13546,571476,BOX OF 6 MINI VINTAGE CRACKERS,0
13546,578953,RED  EGG  SPOON,0
13546,554202,SET OF 20 KIDS COOKIE CUTTERS,0
13546,571476,PINK FAIRY CAKE CHILDRENS APRON,0
13546,571476,RED RETROSPOT SMALL MILK JUG,0
13546,571476,BLUE FLY SWAT,0
13995,549299,LUNCH BAG SUKI DESIGN,0
13995,549299,BASKET OF TOADSTOOLS,0
13995,549299,SPACEBOY LUNCH BOX,0
13995,563368,LUNCH BAG RED RETROSPOT,0
13995,560776,LUNCH BAG DOILEY PATTERN,0
13995,571213,WALL ART ONLY ONE PERSON,0
13995,560776,12 DAISY PEGS IN WOOD BOX,0
13995,578526,LUNCH BAG VINTAGE DOILY,0
13995,563368,LUNCH BAG APPLE DESIGN,0
13995,549299,36 PENCILS TUBE RED RETROSPOT,0
13995,571213,LUNCH BAG WOODLAND,0
13995,560776,CARD SUKI BIRTHDAY,0
13995,571213,STRAWBERRY CHARLOTTE BAG,0
13995,578526,LUNCH BAG PAISLEY PARK,0
13995,560776,LUNCH BAG  BLACK SKULL.,0
13995,549299,DOORMAT HEARTS,0
13995,549299,SET OF 4 PANTRY JELLY MOULDS,0
13995,549299,PAPER BUNTING RETROSPOT,0
13995,578526,DOORMAT HEARTS,0
13995,560776,RED RETROSPOT PICNIC BAG,0
13995,578526,RABBIT NIGHT LIGHT,0
13995,560776,LUNCH BAG WOODLAND,0
13995,571213,NATURAL HANGING QUILTED HEARTS,0
13995,560776,BANQUET BIRTHDAY  CARD,0
13995,549299,RETROSPOT SMALL TUBE MATCHES,0
13995,571213,LUNCH BAG VINTAGE DOILY,0
13995,560776,LUNCH BAG PINK POLKADOT,0
13995,563368,TOADSTOOL BEDSIDE LIGHT,0
13995,571213,LUNCH BAG RED RETROSPOT,0
13995,563368,LUNCH BAG WOODLAND,0
13995,563368,LUNCH BAG CARS BLUE,0
13995,571213,WOODLAND MINI BACKPACK,0
13995,560776,SPACEBOY LUNCH BOX,0
13995,563368,LUNCH BAG  BLACK SKULL.,0
13995,549299,36 PENCILS TUBE SKULLS,0
13995,560776,SWALLOWS GREETING CARD,0
13995,560776,TRAVEL CARD WALLET TRANSPORT,0
13995,549299,WOODEN UNION JACK BUNTING,0
13995,549299,DAISIES  HONEYCOMB GARLAND,0
13995,578526,LUNCH BAG  BLACK SKULL.,0
13995,560776,CARD BIRTHDAY COWBOY,0
13995,571213,PRETTY HANGING QUILTED HEARTS,0
13995,571213,LUNCH BAG SUKI DESIGN,0
13995,578526,ZINC FOLKART SLEIGH BELLS,0
13995,571213,LUNCH BAG  BLACK SKULL.,0
13995,578526,SET 6 PAPER TABLE LANTERN HEARTS,0
13995,560776,HEART OF WICKER LARGE,0
13995,560776,TRAVEL CARD WALLET FLOWER MEADOW,0
13995,578526,WHITE SKULL HOT WATER BOTTLE,0
13995,560776,LUNCH BAG APPLE DESIGN,0
13995,571213,LUNCH BAG PINK POLKADOT,0
13995,578526,DOORMAT ENGLISH ROSE,0
13995,563368,DAISIES  HONEYCOMB GARLAND,0
13995,571213,HEART OF WICKER LARGE,0
13995,571213,HEART OF WICKER SMALL,0
13995,571213,LUNCH BAG CARS BLUE,0
13995,549299,LUNCH BAG CARS BLUE,0
13995,563368,LUNCH BAG SUKI DESIGN,0
13995,560776,PAPER BUNTING RETROSPOT,0
13995,560776,SET 6 PAPER TABLE LANTERN HEARTS,0
13995,560776,3 STRIPEY MICE FELTCRAFT,0
13995,549299,LUNCH BAG WOODLAND,0
13995,578526,CHICK GREY HOT WATER BOTTLE,0
13995,549299,SMALL GLASS HEART TRINKET POT,0
13995,549299,12 DAISY PEGS IN WOOD BOX,0
13995,560776,TEA PARTY BIRTHDAY CARD,0
13995,563368,LUNCH BAG VINTAGE DOILY,0
13995,560776,HEART OF WICKER SMALL,0
13995,560776,CARD BILLBOARD FONT,0
13995,560776,"KEY FOB , BACK DOOR",0
13995,560776,LUNCH BAG CARS BLUE,0
13995,571213,WALL ART BIG LOVE,0
13995,560776,"KEY FOB , SHED",0
13995,560776,GARAGE KEY FOB,0
13995,560776,TOADSTOOL BEDSIDE LIGHT,0
13995,578526,LUNCH BAG RED RETROSPOT,0
13995,571213,SET 6 PAPER TABLE LANTERN HEARTS,0
13995,578526,RED RETROSPOT SHOPPER BAG,0
13995,571213,CHARLOTTE BAG SUKI DESIGN,0
13995,560776,LUNCH BAG SUKI DESIGN,0
13995,560776,FELTCRAFT 6 FLOWER FRIENDS,0
13995,571213,HANGING QUILTED PATCHWORK APPLES,0
13995,571213,LUNCH BAG APPLE DESIGN,0
13995,549299,RETRO PLASTIC ELEPHANT TRAY,0
13995,578526,WOODLAND LARGE RED FELT HEART,0
13995,549299,LUNCH BAG PINK POLKADOT,0
14109,568588,PLEASE ONE PERSON METAL SIGN,0
14109,568588,36 PENCILS TUBE RED RETROSPOT,0
14109,568588,SET/3 VANILLA SCENTED CANDLE IN BOX,0
14109,568588,STRAWBERRY CERAMIC TRINKET BOX,0
14109,568588,FLUTED ANTIQUE CANDLE HOLDER,0
14109,568588,FAIRY CAKE BIRTHDAY CANDLE SET,0
14109,568588,FRENCH CARRIAGE LANTERN,0
14109,568588,36 PENCILS TUBE SKULLS,0
14109,568588,CHARLOTTE BAG PINK POLKADOT,0
14164,567457,SET OF 4 SANTA PLACE SETTINGS,0
14164,567457,CERAMIC STRAWBERRY CAKE MONEY BANK,0
14164,567457,DECORATIVE WICKER HEART MEDIUM,0
14164,567457,HEART FILIGREE DOVE  SMALL,0
14164,567457,SET OF 20 VINTAGE CHRISTMAS NAPKINS,0
14164,567457,GRAND CHOCOLATECANDLE,0
14164,567457,IVORY WICKER HEART LARGE,0
14164,567457,TREE T-LIGHT HOLDER WILLIE WINKIE,0
14164,567457,STAR T-LIGHT HOLDER WILLIE WINKIE,0
14164,569101,JUMBO BAG VINTAGE CHRISTMAS,0
14164,567457,WICKER WREATH SMALL,0
14164,567457,JUMBO BAG VINTAGE CHRISTMAS,0
14164,567457,IVORY HANGING DECORATION  HEART,0
14164,567457,GIANT 50'S CHRISTMAS CRACKER,0
14164,567457,EMBOSSED GLASS TEALIGHT HOLDER,0
14164,567457,CERAMIC HEART FAIRY CAKE MONEY BANK,0
14164,567457,HEART T-LIGHT HOLDER WILLIE WINKIE,0
14164,567457,WICKER WREATH LARGE,0
14164,567457,6 RIBBONS RUSTIC CHARM,0
14164,567457,36 DOILIES VINTAGE CHRISTMAS,0
14164,567457,6 RIBBONS ELEGANT CHRISTMAS,0
14164,567457,HEART OF WICKER SMALL,0
14164,567457,IVORY WICKER HEART MEDIUM,0
14164,567457,HEART OF WICKER LARGE,0
14164,567457,DECORATIVE WICKER HEART LARGE,0
14164,567457,PACK OF 6 PANNETONE GIFT BOXES,0
14164,567457,FOLKART ZINC HEART CHRISTMAS DEC,0
14164,567457,CERAMIC CHERRY CAKE MONEY BANK,0
14164,567457,TRADITIONAL CHRISTMAS RIBBONS,0
14413,538509,BABUSHKA LIGHTS STRING OF 10,2
14413,538509,MEMO BOARD COTTAGE DESIGN,2
14413,538509,PIGGY BANK RETROSPOT,2
14413,538509,OVERNIGHT BAG VINTAGE ROSE PAISLEY,2
14413,538509,RED RETROSPOT PURSE,2
14413,538509,PARTY FOOD SHOPPER BAG,2
14413,538509,LIGHT GARLAND BUTTERFILES PINK,2
14413,538509,PAPER CHAIN KIT RETROSPOT,2
14413,538509,HAIRCLIPS FORTIES FABRIC ASSORTED,2
14413,538509,SET/20 RED RETROSPOT PAPER NAPKINS,2
14413,538509,SET OF 9 BLACK SKULL BALLOONS,2
14413,538509,NOVELTY BISCUITS CAKE STAND 3 TIER,2
14413,538509,JUMBO BAG DOLLY GIRL DESIGN,2
14413,538509,PLASTERS IN TIN VINTAGE PAISLEY,2
14413,538509,RED RETROSPOT SHOPPER BAG,2
14413,538509,SET/6 RED SPOTTY PAPER PLATES,2
14413,538509,SET/2 RED RETROSPOT TEA TOWELS,2
14413,538509,JUMBO BAG PINK POLKADOT,2
14413,538509,PARTY CONES CARNIVAL ASSORTED,2
14413,538509,AIRLINE BAG VINTAGE TOKYO 78,2
14413,538509,REX CASH+CARRY JUMBO SHOPPER,2
14413,538509,PAPER CHAIN KIT 50'S CHRISTMAS,2
14714,576557,CREAM SWEETHEART MINI CHEST,0
14714,576557,STRAWBERRY CERAMIC TRINKET POT,0
14714,576557,IVORY WICKER HEART MEDIUM,0
14714,576557,MINI CAKE STAND WITH HANGING CAKES,0
14714,576557,IVORY WICKER HEART LARGE,0
14714,576557,SET 20 NAPKINS FAIRY CAKES DESIGN,0
14714,576557,CERAMIC CAKE STAND + HANGING CAKES,0
14714,576557,SMALL WHITE HEART OF WICKER,0
14714,576557,60 TEATIME FAIRY CAKE CASES,0
14714,576557,PINK DOUGHNUT TRINKET POT,0
15076,557319,ICE CREAM SUNDAE LIP GLOSS,2
15076,557319,SET OF 3 NOTEBOOKS IN PARCEL,2
15076,557319,HERB MARKER ROSEMARY,2
15076,557319,JAM MAKING SET WITH JARS,2
15076,557319,VINTAGE DONKEY TAIL GAME,2
15076,557319,SET/10 RED POLKADOT PARTY CANDLES,2
15076,557319,PACK OF 12 RED RETROSPOT TISSUES,2
15076,557319,RED RETROSPOT SUGAR JAM BOWL,2
15076,557319,3 TIER SWEETHEART GARDEN SHELF,2
15076,557319,SMALL POPCORN HOLDER,2
15076,557319,HERB MARKER PARSLEY,2
15076,557319,MINI CAKE STAND  HANGING STRAWBERY,2
15076,557319,HEART FILIGREE DOVE  SMALL,2
15076,557319,WHITE BROCANTE SOAP DISH,2
15076,557319,RED RETROSPOT CAKE STAND,2
15076,557319,LARGE CAKE STAND  HANGING STRAWBERY,2
15076,557319,RED RETROSPOT OVEN GLOVE,2
15076,557319,RETROSPOT LARGE MILK JUG,2
15076,557319,AREA PATROLLED METAL SIGN,2
15076,557319,STRAWBERRY CERAMIC TRINKET BOX,2
15076,557319,HANGING JAM JAR T-LIGHT HOLDER,2
15076,557319,CERAMIC PLATE STRAWBERRY DESIGN,2
15076,557319,HOMEMADE JAM SCENTED CANDLES,2
15076,557319,HERB MARKER CHIVES,2
15076,557319,HAND OVER THE CHOCOLATE   SIGN,2
15076,557319,SET/10 BLUE POLKADOT PARTY CANDLES,2
15076,557319,ROUND CAKE TIN VINTAGE GREEN,2
15076,557319,STRAWBERRY CHARLOTTE BAG,2
15076,557319,SET/10 PINK POLKADOT PARTY CANDLES,2
15076,557319,ZINC  HEART T-LIGHT HOLDER,2
15076,557319,SET OF 4 PANTRY JELLY MOULDS,2
15076,557319,SET OF 72 RETROSPOT PAPER  DOILIES,2
15076,557319,ROUND CAKE TIN VINTAGE RED,2
15076,557319,ZINC HEART FLOWER T-LIGHT HOLDER,2
15076,557319,CHILDRENS CUTLERY RETROSPOT RED,2
15076,557319,JAM MAKING SET PRINTED,2
15076,557319,ASSORTED COLOUR BIRD ORNAMENT,2
15076,557319,CLOTHES PEGS RETROSPOT PACK 24,2
15076,557319,PACK OF 72 RETROSPOT CAKE CASES,2
15076,557319,PACK OF 6 LARGE FRUIT STRAWS,2
15076,557319,PAPER BUNTING RETROSPOT,2
15076,557319,RETROSPOT TEA SET CERAMIC 11 PC,2
15076,557319,HERB MARKER BASIL,2
15076,557319,ZINC METAL HEART DECORATION,2
15076,557319,RED RETROSPOT SMALL MILK JUG,2
15076,557319,CLASSIC CAFE SUGAR DISPENSER,2
15076,557319,HERB MARKER THYME,2
15076,557319,HERB MARKER MINT,2
15076,557319,BLACK HEART CARD HOLDER,2
15078,580320,JUMBO STORAGE BAG SUKI,1
15078,544660,JUMBO BAG DOLLY GIRL DESIGN,1
15078,553933,SET OF 4 PANTRY JELLY MOULDS,1
15078,553933,AREA PATROLLED METAL SIGN,1
15078,561473,LUNCH BAG PINK POLKADOT,1
15078,563837,NO SINGING METAL SIGN,1
15078,574680,JUMBO BAG PINK VINTAGE PAISLEY,1
15078,580320,JUMBO BAG VINTAGE DOILY,1
15078,539570,JUMBO BAG RED RETROSPOT,1
15078,547687,HAND OVER THE CHOCOLATE   SIGN,1
15078,562775,JUMBO BAG PINK POLKADOT,1
15078,544660,TOY TIDY DOLLY GIRL DESIGN,1
15078,558920,DOILEY BISCUIT TIN,1
15078,571235,JUMBO SHOPPER VINTAGE RED PAISLEY,1
15078,568323,JUMBO BAG ALPHABET,1
15078,553933,RECYCLING BAG RETROSPOT,1
15078,580320,LUNCH BAG PINK POLKADOT,1
15078,545035,NO SINGING METAL SIGN,1
15078,571235,JUMBO BAG PINK POLKADOT,1
15078,579011,JUMBO BAG RED RETROSPOT,1
15078,544660,LUNCH BAG SPACEBOY DESIGN,1
15078,561473,JUMBO BAG RED RETROSPOT,1
15078,580319,PINK VINTAGE PAISLEY PICNIC BAG,1
15078,580320,HAND OVER THE CHOCOLATE   SIGN,1
15078,544660,SET OF 6 HERB TINS SKETCHBOOK,1
15078,564572,JUMBO BAG RED RETROSPOT,1
15078,574680,PACK OF 72 RETROSPOT CAKE CASES,1
15078,537365,PLEASE ONE PERSON METAL SIGN,1
15078,544660,I'M ON HOLIDAY METAL SIGN,1
15078,568323,JUMBO BAG WOODLAND ANIMALS,1
15078,568323,RED RETROSPOT UMBRELLA,1
15078,547687,JUMBO BAG RED RETROSPOT,1
15078,547687,JUMBO BAG SCANDINAVIAN BLUE PAISLEY,1
15078,550662,60 TEATIME FAIRY CAKE CASES,1
15078,550662,RECYCLING BAG RETROSPOT,1
15078,544660,PAPER CHAIN KIT RETROSPOT,1
15078,555289,RED RETROSPOT LUGGAGE TAG,1
15078,564572,LUNCH BAG VINTAGE DOILY,1
15078,550662,RED RETROSPOT LUGGAGE TAG,1
15078,561473,JUMBO BAG OWLS,1
15078,562775,JUMBO BAG OWLS,1
15078,567307,LUNCH BAG SUKI DESIGN,1
15078,580320,JUMBO BAG VINTAGE LEAF,1
15078,547687,LUNCH BAG PINK POLKADOT,1
15078,571235,JUMBO BAG RED RETROSPOT,1
15078,574680,JUMBO BAG ALPHABET,1
15078,563837,JUMBO BAG SCANDINAVIAN BLUE PAISLEY,1
15078,571236,GIN + TONIC DIET METAL SIGN,1
15078,555289,JUMBO STORAGE BAG SUKI,1
15078,558919,SET OF 4 PANTRY JELLY MOULDS,1
15078,564572,JUMBO BAG STRAWBERRY,1
15078,568323,PLEASE ONE PERSON METAL SIGN,1
15078,537365,JUMBO STORAGE BAG SKULLS,1
15078,561473,HAND OVER THE CHOCOLATE   SIGN,1
15078,574680,JUMBO BAG SCANDINAVIAN BLUE PAISLEY,1
15078,564572,LUNCH BAG ALPHABET DESIGN,1
15078,553933,JUMBO BAG RED RETROSPOT,1
15078,558919,JUMBO BAG RED RETROSPOT,1
15078,579011,JUMBO STORAGE BAG SUKI,1
15078,553933,BLACK/BLUE POLKADOT UMBRELLA,1
15078,539570,DOORMAT NEW ENGLAND,1
15078,541977,JUMBO BAG STRAWBERRY,1
15078,550662,JUMBO BAG WOODLAND ANIMALS,1
15078,547687,PAPER CHAIN KIT RETROSPOT,1
15078,563837,TRAVEL SEWING KIT,1
15078,580320,LUNCH BAG VINTAGE DOILY,1
15078,537365,COOK WITH WINE METAL SIGN,1
15078,555289,JUMBO BAG PINK VINTAGE PAISLEY,1
15078,564572,PACK OF 72 RETROSPOT CAKE CASES,1
15078,571235,BLACK/BLUE POLKADOT UMBRELLA,1
15078,558919,I'M ON HOLIDAY METAL SIGN,1
15078,561473,JUMBO BAG SCANDINAVIAN BLUE PAISLEY,1
15078,562775,AREA PATROLLED METAL SIGN,1
15078,563837,LUNCH BAG ALPHABET DESIGN,1
15078,564572,JUMBO BAG OWLS,1
15078,580319,SET OF 4 NAPKIN CHARMS 3 KEYS,1
15078,558919,BLACK/BLUE POLKADOT UMBRELLA,1
15078,564572,JUMBO BAG VINTAGE DOILY,1
15078,574680,JAM MAKING SET PRINTED,1
15078,544660,GINGERBREAD MAN COOKIE CUTTER,1
15078,545035,JUMBO BAG WOODLAND ANIMALS,1
15078,550662,PAPER BUNTING RETROSPOT,1
15078,571235,JUMBO BAG VINTAGE DOILY,1
15078,571235,JUMBO BAG PINK VINTAGE PAISLEY,1
15078,544660,LUNCH BAG DOLLY GIRL DESIGN,1
15078,564572,SET OF 4 KNICK KNACK TINS DOILY,1
15078,539570,DOORMAT WELCOME PUPPIES,1
15078,547687,JUMBO BAG PINK VINTAGE PAISLEY,1
15078,580320,LUNCH BAG RED RETROSPOT,1
15078,539570,GIN + TONIC DIET METAL SIGN,1
15078,553934,JUMBO BAG STRAWBERRY,1
15078,537365,JUMBO BAG WOODLAND ANIMALS,1
15078,539570,HAND OVER THE CHOCOLATE   SIGN,1
15078,544660,WOODEN OWLS LIGHT GARLAND,1
15078,562775,DOORMAT HEARTS,1
15078,545035,JUMBO BAG STRAWBERRY,1
15078,567307,BLACK/BLUE POLKADOT UMBRELLA,1
15078,555289,JUMBO BAG RED RETROSPOT,1
15078,567307,RED RETROSPOT UMBRELLA,1
15078,574680,JUMBO BAG RED RETROSPOT,1
15078,539570,JUMBO BAG SCANDINAVIAN PAISLEY,1
15078,567307,LUNCH BAG VINTAGE DOILY,1
15078,568323,JUMBO STORAGE BAG SUKI,1
15078,537365,JUMBO BAG SCANDINAVIAN PAISLEY,1
15078,544660,60 CAKE CASES DOLLY GIRL DESIGN,1
15078,547687,PLEASE ONE PERSON METAL SIGN,1
15078,562775,JUMBO BAG SPACEBOY DESIGN,1
15078,563837,JUMBO STORAGE BAG SUKI,1
15078,537365,HAND OVER THE CHOCOLATE   SIGN,1
15078,544660,REGENCY CAKESTAND 3 TIER,1
15078,544660,LIGHT GARLAND BUTTERFILES PINK,1
15078,547687,LUNCH BAG SUKI DESIGN,1
15078,562775,LUNCH BAG SPACEBOY DESIGN,1
15078,564572,JUMBO BAG SCANDINAVIAN BLUE PAISLEY,1
15078,537365,DOORMAT HEARTS,1
15078,574680,DOORMAT KEEP CALM AND COME IN,1
15078,579011,JUMBO SHOPPER VINTAGE RED PAISLEY,1
15078,558919,RECYCLING BAG RETROSPOT,1
15078,571235,JUMBO BAG TOYS,1
15078,544660,FRENCH TOILET SIGN BLUE METAL,1
15078,550662,PACK OF 6 SANDCASTLE FLAGS ASSORTED,1
15078,561473,JUMBO BAG TOYS,1
15078,562775,JUMBO BAG VINTAGE LEAF,1
15078,564572,JUMBO BAG VINTAGE LEAF,1
15078,537365,SET/5 RED RETROSPOT LID GLASS BOWLS,1
15078,561473,LUNCH BAG DOILEY PATTERN,1
15078,545035,COOK WITH WINE METAL SIGN,1
15078,555289,JUMBO BAG DOLLY GIRL DESIGN,1
15078,558919,JAM MAKING SET PRINTED,1
15078,561473,JUMBO BAG DOILEY PATTERNS,1
15078,571235,JUMBO BAG WOODLAND ANIMALS,1
15078,545035,REGENCY CAKESTAND 3 TIER,1
15078,545035,SET/5 RED RETROSPOT LID GLASS BOWLS,1
15078,544660,RECIPE BOX BLUE SKETCHBOOK DESIGN,1
15078,579011,JUMBO BAG ALPHABET,1
15078,550662,JUMBO BAG PINK POLKADOT,1
15078,553936,JUMBO BAG VINTAGE LEAF,1
15078,567307,60 TEATIME FAIRY CAKE CASES,1
15078,580320,LUNCH BAG SUKI DESIGN,1
15078,550662,JUMBO BAG DOLLY GIRL DESIGN,1
15078,539570,PLEASE ONE PERSON METAL SIGN,1
15078,550662,JUMBO SHOPPER VINTAGE RED PAISLEY,1
15078,537367,AREA PATROLLED METAL SIGN,1
15078,544660,SET 12 RETRO WHITE CHALK STICKS,1
15078,563837,JUMBO BAG PINK POLKADOT,1
15078,558919,JUMBO BAG PINK VINTAGE PAISLEY,1
15078,563837,JUMBO BAG OWLS,1
15078,563837,BLACK/BLUE POLKADOT UMBRELLA,1
15078,537365,JUMBO BAG TOYS,1
15078,547687,JUMBO BAG PINK POLKADOT,1
15078,558919,LUNCH BAG RED RETROSPOT,1
15078,574680,JUMBO BAG VINTAGE LEAF,1
15078,579011,JUMBO BAG OWLS,1
15078,580319,CHARLIE+LOLA PINK HOT WATER BOTTLE,1
15078,545035,LUNCH BAG RED RETROSPOT,1
15078,561473,TOY TIDY PINK POLKADOT,1
15078,553933,JUMBO BAG ALPHABET,1
15078,558919,JUMBO BAG DOILEY PATTERNS,1
15078,563837,JUMBO BAG RED RETROSPOT,1
15078,580319,RETROSPOT CANDLE  LARGE,1
15078,580319,SCANDINAVIAN PAISLEY PICNIC BAG,1
15078,580320,JUMBO BAG ALPHABET,1
15078,541977,JUMBO BAG SCANDINAVIAN PAISLEY,1
15078,580320,JUMBO BAG SPACEBOY DESIGN,1
