13630,549526,SET OF 6 HEART CHOPSTICKS,0
13630,557662,ANTIQUE SILVER T-LIGHT GLASS,0
13630,545057,SMALL GLASS SUNDAE DISH CLEAR,0
13630,549526,WRAP VINTAGE PETALS  DESIGN,0
13630,556059,SINGLE HEART ZINC T-LIGHT HOLDER,0
13630,568136,GREY HEART HOT WATER BOTTLE,0
13630,580525,GREY HEART HOT WATER BOTTLE,0
13630,549526,CHOCOLATE BOX RIBBONS,0
13630,556059,KINGS CHOICE GIANT TUBE MATCHES,0
13630,556059,ANTIQUE SILVER T-LIGHT GLASS,0
13630,549526,CITRONELLA CANDLE GARDEN POT,0
13630,568136,WICKER STAR,0
13630,549526,JUMBO BAG SCANDINAVIAN BLUE PAISLEY,0
13630,556059,ZINC T-LIGHT HOLDER STARS SMALL,0
13630,545057,GLASS CLOCHE LARGE,0
13630,568136,ANTIQUE SILVER T-LIGHT GLASS,0
13630,556059,HANGING HEART ZINC T-LIGHT HOLDER,0
13630,549526,IVORY ENCHANTED FOREST PLACEMAT,0
13630,549526,JUMBO  BAG BAROQUE BLACK WHITE,0
13630,545057,VICTORIAN GLASS HANGING T-LIGHT,0
13630,549526,SET OF 6 T-LIGHTS CACTI,0
13630,568136,RED ENCHANTED FOREST PLACEMAT,0
13630,549526,MEDIUM CHINESE STYLE SCISSOR,0
13630,556059,VICTORIAN GLASS HANGING T-LIGHT,0
13630,549526,GREY HEART HOT WATER BOTTLE,0
13630,568136,IVORY ENCHANTED FOREST PLACEMAT,0
13630,549526,6 RIBBONS RUSTIC CHARM,0
13630,545057,WHITE LOVEBIRD LANTERN,0
13630,545057,CUPCAKE LACE PAPER SET 6,0
13630,549526,200 RED + WHITE BENDY STRAWS,0
13630,545057,PACK 3 BOXES BIRD PANNETONE,0
13630,549526,FANCY FONTS BIRTHDAY WRAP,0
13630,545057,PAPER BUNTING VINTAGE PAISLEY,0
13630,549526,WHITE LOVEBIRD LANTERN,0
13630,545057,FELTCRAFT CUSHION OWL,0
13630,549526,PACK OF 6 SANDCASTLE FLAGS ASSORTED,0
13630,549526,VICTORIAN GLASS HANGING T-LIGHT,0
13630,549526,JUMBO STORAGE BAG SUKI,0
13630,545057,EASTER CRAFT 4 CHICKS,0
13630,545057,BUNNY WOODEN PAINTED WITH BIRD,0
13630,556059,GLASS CLOCHE SMALL,0
13630,549526,ZINC HEART LATTICE CHARGER LARGE,0
13630,564563,T-LIGHT GLASS FLUTED ANTIQUE,0
13630,568136,VICTORIAN GLASS HANGING T-LIGHT,0
13630,549526,RECIPE BOX PANTRY YELLOW DESIGN,0
13630,545057,BUNNY WOODEN PAINTED WITH FLOWER,0
13630,549526,HANGING HEART ZINC T-LIGHT HOLDER,0
13630,557662,GLASS CLOCHE SMALL,0
13630,549526,RIDGED GLASS T-LIGHT HOLDER,0
13630,549526,ANTIQUE SILVER T-LIGHT GLASS,0
13630,549526,PINK PARTY BAGS,0
13630,549526,RED ENCHANTED FOREST PLACEMAT,0
13630,549526,SET/4 BLUE FLOWER CANDLES IN BOWL,0
13630,556059,RED ENCHANTED FOREST PLACEMAT,0
13630,549526,OFFICE MUG WARMER CHOC+BLUE,0
13630,580525,RED SHARK HELICOPTER,0
13630,549526,KINGS CHOICE GIANT TUBE MATCHES,0
13630,545057,ASSORTED COLOUR BIRD ORNAMENT,0
13630,564563,ANTIQUE ALL GLASS CANDLESTICK,0
13630,549526,MAGIC GARDEN FELT GARLAND,0
13630,545057,PAPER CHAIN KIT EMPIRE,0
13630,557662,VICTORIAN GLASS HANGING T-LIGHT,0
13630,549526,ZINC HEART LATTICE T-LIGHT HOLDER,0
13630,580525,RIDGED GLASS T-LIGHT HOLDER,0
13630,564563,REINDEER HEART DECORATION SILVER,0
13630,580525,VICTORIAN GLASS HANGING T-LIGHT,0
13630,549526,SILVER PLATE CANDLE BOWL SMALL,0
13630,549526,SINGLE HEART ZINC T-LIGHT HOLDER,0
13630,556059,ZINC T-LIGHT HOLDER STAR LARGE,0
13630,549526,HAND WARMER BIRD DESIGN,0
13630,564563,ANTIQUE SILVER T-LIGHT GLASS,0
13791,562332,LUNCH BAG  BLACK SKULL.,0
13791,562332,CHARLOTTE BAG PINK POLKADOT,0
13791,562332,RED RETROSPOT CHARLOTTE BAG,0
13791,558074,JUMBO BAG SCANDINAVIAN BLUE PAISLEY,0
13791,558074,LUNCH BAG  BLACK SKULL.,0
13791,562332,LUNCH BAG CARS BLUE,0
13791,558074,LUNCH BAG ALPHABET DESIGN,0
13791,558074,CHARLOTTE BAG PINK POLKADOT,0
13791,558074,LUNCH BAG CARS BLUE,0
13791,558074,JUMBO BAG STRAWBERRY,0
13791,558074,RED RETROSPOT CHARLOTTE BAG,0
13874,539314,ENAMEL FLOWER JUG CREAM,2
13874,539314,FINE WICKER HEART,2
13874,539314,WHITE BROCANTE SOAP DISH,2
13874,539314,RECYCLING BAG RETROSPOT,2
13874,539314,METAL 4 HOOK HANGER FRENCH CHATEAU,2
13874,539314,SMALL HEART FLOWERS HOOK,2
13874,539314,FOUR HOOK  WHITE LOVEBIRDS,2
13874,539314,NATURAL SLATE HEART CHALKBOARD,2
13874,539314,CREAM CUPID HEARTS COAT HANGER,2
13874,539314,LAVENDER SCENTED FABRIC HEART,2
13874,539314,WHITE HANGING HEART T-LIGHT HOLDER,2
13874,539314,HANGING HEART MIRROR DECORATION,2
13874,539314,ENAMEL BREAD BIN CREAM,2
13874,539314,PICNIC BASKET WICKER LARGE,2
13874,539314,ENCHANTED BIRD COATHANGER 5 HOOK,2
13874,539314,CREAM WALL PLANTER HEART SHAPED,2
13874,539314,ZINC METAL HEART DECORATION,2
13874,539314,IVORY EMBROIDERED QUILT,2
14670,545658,PINK POLKADOT BOWL,2
14670,545658,IVORY ENCHANTED FOREST PLACEMAT,2
14670,545658,BALLOON WATER BOMB PACK OF 35,2
14670,545658,CHILDS GARDEN FORK PINK,2
14670,545658,SET/4 BADGES BEETLES,2
14670,545658,DINOSAUR PARTY BAG + STICKER SET,2
14670,545655,HANGING FAIRY CAKE DECORATION,2
14670,545655,ZINC METAL HEART DECORATION,2
14670,545658,SET OF 72 RETROSPOT PAPER  DOILIES,2
14670,545658,RED RETROSPOT BIG BOWL,2
14670,545658,HEADS AND TAILS SPORTING FUN,2
14670,545658,PINK HAPPY BIRTHDAY BUNTING,2
14670,545658,SLEEPING CAT ERASERS,2
14670,545658,FELT FARM ANIMAL HEN,2
14670,545658,SET/10 PINK POLKADOT PARTY CANDLES,2
14670,545655,PACK OF 72 RETROSPOT CAKE CASES,2
14670,545658,EASTER TIN KEEPSAKE,2
14670,545658,COFFEE MUG CAT + BIRD DESIGN,2
14670,545658,BLUE POLKADOT PLATE,2
14670,545658,12 MESSAGE CARDS WITH ENVELOPES,2
14670,545658,RED RETROSPOT BOWL,2
14670,545658,SET 2 PANTRY DESIGN TEA TOWELS,2
14670,545658,POPPY'S PLAYHOUSE KITCHEN,2
14670,545658,PACK OF 12 HEARTS DESIGN TISSUES,2
14670,545658,VICTORIAN SEWING KIT,2
14670,545658,PACK OF 72 RETROSPOT CAKE CASES,2
14670,545658,ENVELOPE 50 CURIOUS IMAGES,2
14670,545658,SLEEPING CAT ERASERS,2
14670,545658,PINK PARTY BAGS,2
14670,545658,S/4 PINK FLOWER CANDLES IN BOWL,2
14670,545655,JAM MAKING SET PRINTED,2
14670,545658,S/12 MINI RABBIT EASTER,2
14670,545658,MINI JIGSAW BUNNIES,2
14670,545658,CURIOUS IMAGES GIFT WRAP SET,2
14670,545658,SET OF 6 VINTAGE NOTELETS KIT,2
14670,545655,BLUE POLKADOT PLATE,2
14670,545655,PACK OF 12 PINK POLKADOT TISSUES,2
14670,545655,YELLOW METAL CHICKEN HEART,2
14670,545655,GREEN POLKADOT BOWL,2
14670,545655,HEART DECORATION PAINTED ZINC,2
14670,545655,FELT FARM ANIMAL CHICKEN,2
14670,545658,12 DAISY PEGS IN WOOD BOX,2
14670,545655,CANDLEHOLDER PINK HANGING HEART,2
14670,545658,GREEN POLKADOT PLATE,2
14670,545655,LUNCH BAG PINK POLKADOT,2
14670,545655,BOX OF 24 COCKTAIL PARASOLS,2
14670,545655,PACK OF 12 SPACEBOY TISSUES,2
14670,545658,SET/6 RED SPOTTY PAPER PLATES,2
14670,545658,CREAM FELT EASTER EGG BASKET,2
14670,545655,HEARTS WRAPPING TAPE,2
14670,545655,IVORY HANGING DECORATION  BIRD,2
14670,545658,TEA TIME PARTY BUNTING,2
14670,545658,BLUE POLKADOT BOWL,2
14670,545655,RED HANGING HEART T-LIGHT HOLDER,2
14670,545658,PINK  POLKADOT PLATE,2
14670,545658,ENGLISH ROSE METAL WASTE BIN,2
14670,545658,SLEEPING CAT ERASERS,2
14670,545658,SMALL LICORICE DES PINK BOWL,2
14670,545655,SET 3 SONG BIRD PAPER EGGS ASSORTED,2
14670,545655,TRAVEL CARD WALLET TRANSPORT,2
14670,545658,SET OF 6 GIRLS CELEBRATION CANDLES,2
14670,545655,CHILDS GARDEN RAKE PINK,2
14670,545655,PACK OF 12 SPACEBOY TISSUES,2
14670,545658,FELT FARM ANIMAL WHITE BUNNY,2
14670,545658,SET OF 12  VINTAGE POSTCARD SET,2
14670,545655,ROSE DU SUD OVEN GLOVE,2
14670,545658,MINI FUNKY DESIGN TAPES,2
14670,545655,WHITE HANGING HEART T-LIGHT HOLDER,2
14670,545655,LOVE GARLAND PAINTED ZINC,2
14670,545655,CHILDS GARDEN SPADE BLUE,2
14670,545655,CHILDS GARDEN TROWEL BLUE,2
14670,545655,NUMBER TILE COTTAGE GARDEN 6,2
14670,545655,S/12 MINI RABBIT EASTER,2
14670,545658,BIRDCAGE DECORATION TEALIGHT HOLDER,2
14670,545658,RED HANGING HEART T-LIGHT HOLDER,2
14670,545658,SET/6 RED SPOTTY PAPER CUPS,2
14670,545658,ZINC METAL HEART DECORATION,2
14670,545658,EIGHT PIECE SNAKE  SET,2
14670,545658,CHILDS GARDEN TROWEL PINK,2
14670,545658,FELT FARM ANIMAL WHITE BUNNY,2
14670,545658,FELTCRAFT HAIRBAND RED AND BLUE,2
14670,545658,SET/4 BADGES CUTE CREATURES,2
14670,545658,VINTAGE UNION JACK APRON,2
14670,545658,SET OF 6 3D KIT CARDS FOR KIDS,2
14670,545655,UNION STRIPE WITH FRINGE  HAMMOCK,2
14670,545658,WHITE HANGING HEART T-LIGHT HOLDER,2
14670,545658,PACK OF 12 SPACEBOY TISSUES,2
14670,545655,PACK OF 12 BLUE PAISLEY TISSUES,2
14670,545655,DENIM PATCH PURSE PINK BUTTERFLY,2
14670,545658,6 RIBBONS RUSTIC CHARM,2
14670,545655,CHILDRENS GARDEN GLOVES BLUE,2
14670,545658,YELLOW METAL CHICKEN HEART,2
14670,545658,MINI JIGSAW SPACEBOY,2
14670,545655,STRAWBERRY CERAMIC TRINKET BOX,2
14670,545658,CHILDS GARDEN RAKE PINK,2
14670,545658,KITTY PENCIL ERASERS,2
14670,545658,CHILDRENS GARDEN GLOVES PINK,2
14670,545658,BUFFALO BILL TREASURE BOOK BOX,2
14670,545658,6 ROCKET BALLOONS,2
14670,545655,CERAMIC PLATE STRAWBERRY DESIGN,2
14670,545655,TUB 24 PINK FLOWER PEGS,2
14670,545655,CRAZY DAISY HEART DECORATION,2
14670,545658,SMALL MARSHMALLOWS PINK BOWL,2
14670,545655,LUNCH BAG SPACEBOY DESIGN,2
14670,545658,SET/4 BADGES BALLOON GIRL,2
14670,545655,FIVE HEART HANGING DECORATION,2
14670,545658,SMALL POPCORN HOLDER,2
14670,545655,OFFICE MUG WARMER CHOC+BLUE,2
14670,545655,CHILDRENS GARDEN GLOVES PINK,2
14670,545658,VINTAGE HEADS AND TAILS CARD GAME,2
14670,545655,MILK PAN PINK POLKADOT,2
14670,545658,PACK OF 20 NAPKINS PANTRY DESIGN,2
14670,545658,TREASURE ISLAND BOOK BOX,2
14670,545658,PINK POT PLANT CANDLE,2
14670,545655,CHILDS GARDEN FORK PINK,2
14670,545658,10 COLOUR SPACEBOY PEN,2
14670,545658,PINK LOVE HEART SHAPE CUP,2
14670,545658,GLOW IN DARK DOLPHINS,2
14670,545655,3 PIECE SPACEBOY COOKIE CUTTER SET,2
14670,545658,SET/20 RED RETROSPOT PAPER NAPKINS,2
14670,545658,FELT FARM ANIMAL HEN,2
14670,545658,SET/4 BLUE FLOWER CANDLES IN BOWL,2
14670,545655,WOODEN HEART CHRISTMAS SCANDINAVIAN,2
15144,580101,JUMBO BAG PEARS,1
15144,573109,DOORMAT KEEP CALM AND COME IN,1
15144,563718,JUMBO BAG VINTAGE LEAF,1
15144,563718,JUMBO BAG RED RETROSPOT,1
15144,571706,3 WHITE CHOC MORRIS BOXED CANDLES,1
15144,573109,IVORY DINER WALL CLOCK,1
15144,576372,COFFEE MUG PEARS  DESIGN,1
15144,570863,PLAYING CARDS KEEP CALM & CARRY ON,1
15144,576372,WOODEN SCHOOL COLOURING SET,1
15144,559341,JUMBO BAG RED RETROSPOT,1
15144,551840,COFFEE MUG DOG + BALL DESIGN,1
15144,551840,COFFEE MUG PEARS  DESIGN,1
15144,551840,DOORMAT MULTICOLOUR STRIPE,1
15144,566016,PACK OF 12 RED RETROSPOT TISSUES,1
15144,570863,JUMBO BAG PEARS,1
15144,580101,GARDENERS KNEELING PAD CUP OF TEA,1
15144,580101,JUMBO BAG APPLES,1
15144,542709,LUNCH BAG  BLACK SKULL.,1
15144,559341,PLASTERS IN TIN SPACEBOY,1
15144,568786,ALARM CLOCK BAKELIKE IVORY,1
15144,563718,JUMBO BAG SPACEBOY DESIGN,1
15144,542709,72 SWEETHEART FAIRY CAKE CASES,1
15144,547647,PACK OF 72 RETROSPOT CAKE CASES,1
15144,576372,TRADITIONAL PICK UP STICKS GAME,1
15144,566016,FELTCRAFT BOY JEAN-PAUL KIT,1
15144,559341,JUMBO BAG APPLES,1
15144,573109,DOORMAT WELCOME PUPPIES,1
15144,551840,DOORMAT VINTAGE LEAVES DESIGN,1
15144,561087,LUNCH BAG RED RETROSPOT,1
15144,563718,DOORMAT ENGLISH ROSE,1
15144,580101,JUMBO BAG VINTAGE LEAF,1
15144,580101,VINTAGE CHRISTMAS GIFT BAG LARGE,1
15144,542709,WORLD WAR 2 GLIDERS ASSTD DESIGNS,1
15144,566016,PLASTERS IN TIN WOODLAND ANIMALS,1
15144,566016,OVEN MITT APPLES DESIGN,1
15144,561087,LUNCH BAG PINK POLKADOT,1
15144,576372,ILLUSTRATED CAT BOWL,1
15144,551840,DOORMAT ENGLISH ROSE,1
15144,563718,JUMBO BAG PINK POLKADOT,1
15144,547647,PAPER CHAIN KIT EMPIRE,1
15144,568784,DOORMAT KEEP CALM AND COME IN,1
15144,576372,HOT WATER BOTTLE I AM SO POORLY,1
15144,570863,RETROSPOT HEART HOT WATER BOTTLE,1
15144,547647,36 PENCILS TUBE WOODLAND,1
15144,570863,ALARM CLOCK BAKELIKE IVORY,1
15144,551840,COFFEE MUG CAT + BIRD DESIGN,1
15144,576372,DOG BOWL CHASING BALL DESIGN,1
15144,580101,ALARM CLOCK BAKELIKE PINK,1
15144,566016,ILLUSTRATED CAT BOWL,1
15144,573109,KNITTED UNION FLAG HOT WATER BOTTLE,1
15144,542709,BOX OF VINTAGE JIGSAW BLOCKS,1
15144,573109,JUMBO BAG 50'S CHRISTMAS,1
15144,563718,JUMBO BAG WOODLAND ANIMALS,1
15144,576372,JUMBO BAG VINTAGE LEAF,1
15144,566016,ALARM CLOCK BAKELIKE CHOCOLATE,1
15144,561087,SET OF 12 FAIRY CAKE BAKING CASES,1
15144,561087,SET 40 HEART SHAPE PETIT FOUR CASES,1
15144,547647,LUNCH BAG RED RETROSPOT,1
15144,559341,PLASTERS IN TIN WOODLAND ANIMALS,1
15144,566016,PACK OF 12 LONDON TISSUES,1
15144,580101,IVORY DINER WALL CLOCK,1
15144,576372,LOVE HOT WATER BOTTLE,1
15144,580101,JUMBO BAG SPACEBOY DESIGN,1
15144,551840,DOORMAT TOPIARY,1
15144,580101,LONDON BUS COFFEE MUG,1
15144,563718,DOORMAT HEARTS,1
15144,566016,PACK OF 12 SUKI TISSUES,1
15144,561088,JUMBO BAG ALPHABET,1
15144,568786,JUMBO BAG VINTAGE LEAF,1
15144,568786,JUMBO BAG RED RETROSPOT,1
15144,571706,JUMBO STORAGE BAG SUKI,1
15144,561087,SET 12 KIDS  WHITE CHALK STICKS,1
15144,559341,PLASTERS IN TIN CIRCUS PARADE,1
15144,542709,JAM MAKING SET WITH JARS,1
15144,573109,RED DINER WALL CLOCK,1
15144,568786,ALARM CLOCK BAKELIKE ORANGE,1
15144,570863,GROW A FLYTRAP OR SUNFLOWER IN TIN,1
15144,576372,JUMBO BAG APPLES,1
15144,566016,KNITTED UNION FLAG HOT WATER BOTTLE,1
15144,566016,PACK OF 60 PINK PAISLEY CAKE CASES,1
15144,542709,TRADITIONAL WOODEN SKIPPING ROPE,1
15144,561087,12 PENCILS SMALL TUBE SKULL,1
15144,571706,ROSE 3 WICK MORRIS BOX CANDLE,1
15144,566016,PACK OF 60 DINOSAUR CAKE CASES,1
15144,573109,HOT WATER BOTTLE I AM SO POORLY,1
15144,573109,JUMBO BAG VINTAGE CHRISTMAS,1
15144,580101,ALARM CLOCK BAKELIKE GREEN,1
15144,568786,ALARM CLOCK BAKELIKE GREEN,1
15144,571706,3 ROSE MORRIS BOXED CANDLES,1
15144,580101,CHRISTMAS LIGHTS 10 SANTAS,1
15144,547647,LUNCH BAG PINK POLKADOT,1
15144,563718,JUMBO STORAGE BAG SUKI,1
15144,576372,JUMBO BAG RED RETROSPOT,1
15144,568786,COFFEE MUG PEARS  DESIGN,1
15144,576372,RABBIT NIGHT LIGHT,1
15144,580101,BLUE DINER WALL CLOCK,1
15144,566016,72 SWEETHEART FAIRY CAKE CASES,1
15144,576372,CHOCOLATE HOT WATER BOTTLE,1
15144,580101,JUMBO BAG 50'S CHRISTMAS,1
15144,551840,DOORMAT WELCOME PUPPIES,1
15144,566016,PLASTERS IN TIN CIRCUS PARADE,1
15144,542709,DOORMAT NEW ENGLAND,1
15144,551840,DOORMAT 3 SMILEY CATS,1
15144,566016,LONDON BUS COFFEE MUG,1
15144,566016,GROW A FLYTRAP OR SUNFLOWER IN TIN,1
15144,566016,PLASTERS IN TIN SPACEBOY,1
15144,547647,36 PENCILS TUBE RED RETROSPOT,1
15144,568784,DOORMAT VINTAGE LEAF,1
15144,580101,RED METAL BOX TOP SECRET,1
15144,576372,GARDENERS KNEELING PAD KEEP CALM,1
15144,551840,DOORMAT FAIRY CAKE,1
15144,566016,FELTCRAFT GIRL NICOLE KIT,1
15144,580101,ILLUSTRATED CAT BOWL,1
15144,580101,GIRAFFE WOODEN RULER,1
15144,566016,DOG BOWL CHASING BALL DESIGN,1
15144,542709,PLASTERS IN TIN WOODLAND ANIMALS,1
15144,561087,SET OF 12 MINI LOAF BAKING CASES,1
15144,566016,PLASTERS IN TIN VINTAGE PAISLEY,1
15144,573109,CHOCOLATE HOT WATER BOTTLE,1
15144,566016,PACK OF 60 SPACEBOY CAKE CASES,1
15144,547647,RETROSPOT PARTY BAG + STICKER SET,1
15144,563718,JUMBO BAG TOYS,1
15144,561087,BUNDLE OF 3 ALPHABET EXERCISE BOOKS,1
15144,547648,SET OF 4 PANTRY JELLY MOULDS,1
15144,542709,GLASS JAR ENGLISH CONFECTIONERY,1
15144,542709,PACK OF 72 RETROSPOT CAKE CASES,1
15144,559341,SET OF 4 KNICK KNACK TINS LEAF,1
15144,561087,LUNCH BAG ALPHABET DESIGN,1
15144,573109,JUMBO BAG TOYS,1
15144,566016,FELTCRAFT GIRL AMELIE KIT,1
15144,573109,RABBIT NIGHT LIGHT,1
15144,542709,SET OF 72 PINK HEART PAPER DOILIES,1
15144,570863,LOVE HOT WATER BOTTLE,1
15144,561087,SET OF 6 TEA TIME BAKING CASES,1
15144,551840,COFFEE MUG APPLES DESIGN,1
15144,551840,SCOTTIE DOG HOT WATER BOTTLE,1
15144,559341,SET OF 4 KNICK KNACK TINS POPPIES,1
15144,573109,ALARM CLOCK BAKELIKE GREEN,1
15144,580101,MINI LIGHTS WOODLAND MUSHROOMS,1
15144,580101,GARDENERS KNEELING PAD KEEP CALM,1
15144,551840,GOLD TEDDY BEAR,1
15144,573109,ALARM CLOCK BAKELIKE IVORY,1
15144,566016,ALARM CLOCK BAKELIKE RED,1
15144,570863,ALARM CLOCK BAKELIKE PINK,1
15144,551840,DOG BOWL CHASING BALL DESIGN,1
15144,576372,GARDENERS KNEELING PAD CUP OF TEA,1
15144,551840,BLACK CANDELABRA T-LIGHT HOLDER,1
15144,559341,JUMBO BAG VINTAGE LEAF,1
15144,559341,PLASTERS IN TIN STRONGMAN,1
15144,570863,HOT WATER BOTTLE I AM SO POORLY,1
15144,566016,ALARM CLOCK BAKELIKE PINK,1
15144,547647,LUNCH BAG CARS BLUE,1
15144,566016,ALARM CLOCK BAKELIKE ORANGE,1
15144,571706,JUMBO BAG WOODLAND ANIMALS,1
15144,573109,DOORMAT WELCOME TO OUR HOME,1
15144,563718,JUMBO BAG STRAWBERRY,1
15144,573109,ALARM CLOCK BAKELIKE CHOCOLATE,1
15144,542709,PACK OF 12 COLOURED PENCILS,1
15144,568786,COFFEE MUG APPLES DESIGN,1
15144,576372,GROW A FLYTRAP OR SUNFLOWER IN TIN,1
15144,568786,COFFEE MUG CAT + BIRD DESIGN,1
15144,568786,JUMBO BAG STRAWBERRY,1
15144,570863,CHOCOLATE HOT WATER BOTTLE,1
15144,561087,LUNCH BAG SPACEBOY DESIGN,1
15144,561087,SET OF 36 DOILIES PANTRY DESIGN,1
15144,563718,DOORMAT 3 SMILEY CATS,1
15144,571706,3 GARDENIA MORRIS BOXED CANDLES,1
15144,563718,JUMBO BAG PEARS,1
15144,542709,BOX OF VINTAGE ALPHABET BLOCKS,1
15144,580101,JUMBO BAG ALPHABET,1
15144,570863,ALARM CLOCK BAKELIKE RED,1
15144,547647,SET/6 RED SPOTTY PAPER CUPS,1
15144,576372,KNEELING MAT HOUSEWORK  DESIGN,1
15144,542709,PLASTERS IN TIN SKULLS,1
15144,547647,PACK OF 60 PINK PAISLEY CAKE CASES,1
15144,570863,FELTCRAFT CHRISTMAS FAIRY,1
15144,566016,PACK OF 72 RETROSPOT CAKE CASES,1
15144,561088,JUMBO BAG APPLES,1
15144,566016,ALARM CLOCK BAKELIKE IVORY,1
15144,571706,CHOCOLATE 3 WICK MORRIS BOX CANDLE,1
15144,542709,RED  HARMONICA IN BOX,1
15144,561087,JAM MAKING SET PRINTED,1
15144,580101,FELTCRAFT GIRL AMELIE KIT,1
15144,576372,JUMBO BAG PEARS,1
15144,570863,GARDENERS KNEELING PAD KEEP CALM,1
15144,573109,BLUE DINER WALL CLOCK,1
15144,576372,PACK OF 6 COCKTAIL PARASOL STRAWS,1
15144,559341,PLASTERS IN TIN VINTAGE PAISLEY,1
15144,547647,LUNCH BAG  BLACK SKULL.,1
15144,547648,PANTRY ROLLING PIN,1
15144,566016,PACK OF 12 WOODLAND TISSUES,1
15144,573109,DOORMAT 3 SMILEY CATS,1
15144,542709,WOODEN BOX OF DOMINOES,1
15144,547647,DOORMAT NEW ENGLAND,1
15144,561088,JUMBO BAG DOILEY PATTERNS,1
15144,547647,PACK OF 60 MUSHROOM CAKE CASES,1
15144,542709,SET OF 72 RETROSPOT PAPER  DOILIES,1
15144,580101,PINK DINER WALL CLOCK,1
15144,561087,JAM MAKING SET WITH JARS,1
15144,551840,ILLUSTRATED CAT BOWL,1
15144,573109,ALARM CLOCK BAKELIKE RED,1
15144,547647,200 RED + WHITE BENDY STRAWS,1
15144,559341,JUMBO BAG PEARS,1
15144,570863,ALARM CLOCK BAKELIKE GREEN,1
15144,566016,PACK OF 12 HEARTS DESIGN TISSUES,1
15144,566016,60 TEATIME FAIRY CAKE CASES,1
15144,552174,BLACK CANDELABRA T-LIGHT HOLDER,1
15144,576372,HAND WARMER OWL DESIGN,1
15144,570863,ALARM CLOCK BAKELIKE CHOCOLATE,1
15144,566016,ALARM CLOCK BAKELIKE GREEN,1
15144,571706,PLAYING CARDS I LOVE LONDON,1
15144,576372,JUMBO STORAGE BAG SUKI,1
15144,542709,JAM MAKING SET PRINTED,1
15144,563718,SET OF 60 VINTAGE LEAF CAKE CASES,1
15144,563718,JUMBO BAG APPLES,1
15144,568786,JUMBO BAG APPLES,1
15144,542709,TRADITIONAL MODELLING CLAY,1
16181,568529,ASSORTED CREEPY CRAWLIES,0
16181,568529,CLASSIC FRENCH STYLE BASKET NATURAL,0
16181,568529,SMALL CERAMIC TOP STORAGE JAR,0
16181,568529,JUMBO BAG STRAWBERRY,0
16181,568529,CHARLOTTE BAG PINK POLKADOT,0
16181,568529,PARTY BUNTING,0
16181,568529,HANGING HEART JAR T-LIGHT HOLDER,0
16181,568529,EUCALYPTUS & PINECONE  WREATH,0
16181,568529,HANGING METAL STAR LANTERN,0
16181,568529,RIBBON REEL STRIPES DESIGN,0
16181,568529,LARGE ROUND WICKER PLATTER,0
16468,568330,STOOL HOME SWEET HOME,0
16468,568330,JUMBO BAG PINK POLKADOT,0
16817,548917,PINK PADDED MOBILE,1
16817,581057,HOME SWEET HOME HOOK,1
16817,546330,EASTER CRAFT 4 CHICKS,1
16817,548917,SET OF 2 WOODEN MARKET CRATES,1
16817,555741,WATERING CAN GREEN DINOSAUR,1
16817,574867,CHRISTMAS CRAFT LITTLE FRIENDS,1
16817,538899,DANISH ROSE FOLDING CHAIR,1
16817,574867,HOT WATER BOTTLE TEA AND SYMPATHY,1
16817,546330,2 PICTURE BOOK EGGS EASTER BUNNY,1
16817,555741,DANISH ROSE BEDSIDE CABINET,1
16817,581057,CHRISTMAS CRAFT LITTLE FRIENDS,1
16817,581057,SINGLE WIRE HOOK PINK HEART,1
16817,537397,TOAST ITS - BEST MUM,1
16817,537397,HOT WATER BOTTLE BABUSHKA,1
16817,546330,GARLAND WOODEN HAPPY EASTER,1
16817,537397,CHRISTMAS GINGHAM STAR,1
16817,538899,HAND WARMER BABUSHKA DESIGN,1
16817,552018,ANTIQUE IVORY WIRE BOWL SMALL,1
16817,555741,PAPER CHAIN KIT RETROSPOT,1
16817,574867,SET OF TEA COFFEE SUGAR TINS PANTRY,1
16817,538899,ENGLISH ROSE HOT WATER BOTTLE,1
16817,548917,4 VANILLA BOTANICAL CANDLES,1
16817,552018,WATERING CAN GREEN DINOSAUR,1
16817,555741,MONSTERS STENCIL CRAFT,1
16817,552018,WATERING CAN BLUE ELEPHANT,1
16817,537397,HAND WARMER BIRD DESIGN,1
16817,581057,SET OF 2 TRAYS HOME SWEET HOME,1
16817,537397,SMALL RED BABUSHKA NOTEBOOK,1
16817,555741,ORIGAMI ROSE INCENSE IN TUBE,1
16817,546330,SET/4 SPRING FLOWER DECORATION,1
16817,552018,PICNIC BASKET WICKER SMALL,1
16817,548917,4 LILY  BOTANICAL DINNER CANDLES,1
16817,546330,SET OF 6 SPICE TINS PANTRY DESIGN,1
16817,552018,PINK PADDED MOBILE,1
16817,538899,VICTORIAN GLASS HANGING T-LIGHT,1
16817,546330,SET OF 6 HERB TINS SKETCHBOOK,1
16817,552018,RETROSPOT TEA SET CERAMIC 11 PC,1
16817,537397,SMALL PURPLE BABUSHKA NOTEBOOK,1
16817,552018,PAPER BUNTING COLOURED LACE,1
16817,574867,PAPER CHAIN KIT 50'S CHRISTMAS,1
16817,548917,MINI PAINTED GARDEN DECORATION,1
16817,574867,FAWN BLUE HOT WATER BOTTLE,1
16817,581057,MAKE YOUR OWN PLAYTIME CARD KIT,1
16817,538899,SET 3 WICKER STORAGE BASKETS,1
16817,537397,HAND WARMER BABUSHKA DESIGN,1
16817,547804,HANGING SPRING FLOWER EGG LARGE,1
16817,548917,ANTIQUE ALL GLASS CANDLESTICK,1
16817,581057,HOME SWEET HOME 2 DRAWER CABINET,1
16817,548917,MOTHER'S KITCHEN SPOON REST,1
16817,581057,BAG 125g SWIRLY MARBLES,1
16817,581057,LANTERN CREAM GAZEBO,1
16817,581057,HANGING METAL STAR LANTERN,1
16817,581057,BATHROOM HOOK,1
16817,548917,SET OF 6 HERB TINS SKETCHBOOK,1
16817,574867,PARTY CONE CHRISTMAS DECORATION,1
16817,537397,PAPER CHAIN KIT 50'S CHRISTMAS,1
16817,546330,WOODEN CROQUET GARDEN SET,1
16817,555741,WATERING CAN PINK BUNNY,1
16817,574867,PANTRY MAGNETIC  SHOPPING LIST,1
16817,555741,BEACH HUT SHELF W 3 DRAWERS,1
16817,555741,HAPPY STENCIL CRAFT,1
16817,574867,12 PENCIL SMALL TUBE WOODLAND,1
16817,548917,WHITE WOOD GARDEN PLANT LADDER,1
16817,546330,DECORATION  BUTTERFLY  MAGIC GARDEN,1
16817,555741,WATERING CAN BLUE ELEPHANT,1
16817,555741,GARDENERS KNEELING PAD CUP OF TEA,1
16817,552018,SMALL RED RETROSPOT WINDMILL,1
16817,537397,CHRISTMAS GINGHAM HEART,1
16817,555741,COLOURING PENCILS BROWN TUBE,1
16817,574867,CHOCOLATE HOT WATER BOTTLE,1
16817,581057,PAPER CHAIN KIT 50'S CHRISTMAS,1
16817,581057,CHOCOLATE HOT WATER BOTTLE,1
16817,555741,RIDGED GLASS FINGER BOWL,1
16817,555741,LE GRAND TRAY CHIC SET,1
16817,574867,SET OF 6 SPICE TINS PANTRY DESIGN,1
16817,548917,MINI  ZINC GARDEN DECORATIONS,1
16817,552018,MINIATURE ANTIQUE ROSE HOOK IVORY,1
16817,552018,WHITE WOOD GARDEN PLANT LADDER,1
16817,574867,BISCUIT TIN 50'S CHRISTMAS,1
16817,581057,MAKE YOUR OWN FLOWERPOWER CARD KIT,1
16817,546330,HANGING SPRING FLOWER EGG LARGE,1
16817,581057,SILVER JEWELLED MIRROR TRINKET TRAY,1
16817,581057,HANGING METAL HEART LANTERN,1
16817,548917,SET OF 6 SPICE TINS PANTRY DESIGN,1
16817,548917,BULL DOG BOTTLE OPENER,1
16817,537397,FINE WICKER HEART,1
17190,570733,JAM MAKING SET PRINTED,0
17190,553380,LOVE SEAT ANTIQUE WHITE METAL,0
17190,570733,PACK OF 20 NAPKINS RED APPLES,0
17190,570733,SET OF 10 LANTERNS FAIRY LIGHT STAR,0
17190,570733,PANTRY MAGNETIC  SHOPPING LIST,0
17190,570733,PANTRY CHOPPING BOARD,0
17190,570733,JUMBO BAG RED RETROSPOT,0
17190,570733,JAM JAR WITH PINK LID,0
17190,570733,CHILDREN'S CIRCUS PARADE MUG,0
17190,570733,JUMBO BAG PINK POLKADOT,0
17190,570733,PAPER CHAIN KIT VINTAGE CHRISTMAS,0
17190,570733,JUMBO BAG STRAWBERRY,0
17190,570733,PAPER CHAIN KIT 50'S CHRISTMAS,0
17190,570733,SET 4 VALENTINE DECOUPAGE HEART BOX,0
17190,570733,VINTAGE CHRISTMAS GIFT SACK,0
17190,570733,WRAP PAISLEY PARK,0
17190,570733,WRAP ALPHABET POSTER,0
17190,570733,PANTRY WASHING UP BRUSH,0
17190,570733,RUSTIC STRAWBERRY JAM POT LARGE,0
17321,569261,S/6 WOODEN SKITTLES IN COTTON BAG,0
17321,569261,PLAYING CARDS JUBILEE UNION JACK,0
17321,569261,4 TRADITIONAL SPINNING TOPS,0
17321,569261,TRADITIONAL KNITTING NANCY,0
17321,569261,SET OF 4 KNICK KNACK TINS LONDON,0
17321,569261,GINGERBREAD MAN COOKIE CUTTER,0
17321,569261,BLUE DINER WALL CLOCK,0
17321,569261,FELTCRAFT CUSHION BUTTERFLY,0
17321,569261,ANTIQUE SILVER BAUBLE LAMP,0
17321,569261,PINK DINER WALL CLOCK,0
17321,569261,SET 36 COLOUR PENCILS DOLLY GIRL,0
17321,569261,PRETTY HANGING QUILTED HEARTS,0
17321,569261,PAINT YOUR OWN CANVAS SET,0
17321,569261,HANGING QUILTED PATCHWORK APPLES,0
17321,580068,RED METAL BOX TOP SECRET,0
17321,569261,SET 36 COLOUR PENCILS SPACEBOY,0
17321,569261,MONSTERS STENCIL CRAFT,0
17321,569261,GROW A FLYTRAP OR SUNFLOWER IN TIN,0
17321,569261,VINTAGE DONKEY TAIL GAME,0
17321,569261,SMALL WHITE HEART OF WICKER,0
17321,569261,BICYCLE SAFTEY WALL ART,0
17321,569261,GARDENERS KNEELING PAD CUP OF TEA,0
17321,569261,SET 36 COLOURING PENCILS DOILY,0
17321,569261,WATERING CAN GREEN DINOSAUR,0
17321,569261,APPLE BATH SPONGE,0
17321,569261,ROMANTIC PINKS RIBBONS,0
17321,569261,TRADITIONAL KNITTING NANCY,0
17321,569261,VINTAGE PAISLEY STATIONERY SET,0
17321,569261,ENAMEL MEASURING JUG CREAM,0
17321,569261,REVOLVER WOODEN RULER,0
17321,569261,FELTCRAFT HAIRBAND PINK AND PURPLE,0
17321,569261,DOGGY RUBBER,0
17321,569261,ALPHABET STENCIL CRAFT,0
17321,569261,HAND WARMER OWL DESIGN,0
17321,569261,LARGE YELLOW BABUSHKA NOTEBOOK,0
17321,569261,DOLLY GIRL MINI BACKPACK,0
17321,569261,ICE CREAM BUBBLES,0
17321,569261,PLASTERS IN TIN VINTAGE PAISLEY,0
17321,569261,3 TRADITIONAl BISCUIT CUTTERS  SET,0
17321,569261,MAGNETS PACK OF 4 CHILDHOOD MEMORY,0
17321,569261,GIRAFFE WOODEN RULER,0
17321,569261,MAGNETS PACK OF 4 RETRO PHOTO,0
17321,569261,SET OF 4 KNICK KNACK TINS DOILY,0
17321,569261,AIRLINE BAG VINTAGE JET SET RED,0
17321,569261,SQUARECUSHION COVER PINK UNION JACK,0
17321,569261,RED GINGHAM ROSE JEWELLERY BOX,0
17321,569261,HAPPY STENCIL CRAFT,0
17321,569261,BUFFALO BILL TREASURE BOOK BOX,0
17321,569261,HAND WARMER BABUSHKA DESIGN,0
17321,569261,PINK PARTY BAGS,0
17321,569261,SET OF 20 KIDS COOKIE CUTTERS,0
17321,569261,MODERN FLORAL STATIONERY SET,0
17321,569261,MIRROR CORNICE,0
17321,569261,SLEEPING CAT ERASERS,0
17321,569261,TRADITIONAL WOODEN SKIPPING ROPE,0
17321,569261,TREASURE TIN GYMKHANA DESIGN,0
