13168,544465,RED RETROSPOT WRAP,0
13168,542112,MILK PAN RED RETROSPOT,0
13168,554492,WHITE HANGING HEART T-LIGHT HOLDER,0
13168,574247,SET OF 4 KNICK KNACK TINS DOILY,0
13168,542112,12 PENCILS TALL TUBE SKULLS,0
13168,574247,WOOD 2 DRAWER CABINET WHITE FINISH,0
13168,544465,LAVENDER INCENSE IN TIN,0
13168,542112,WOOD S/3 CABINET ANT WHITE FINISH,0
13168,554492,SLATE TILE NATURAL HANGING,0
13168,574247,CREAM SWEETHEART MINI CHEST,0
13168,542112,AREA PATROLLED METAL SIGN,0
13168,574247,SET/3 OCEAN SCENT CANDLE JEWEL BOX,0
13168,574247,COOK WITH WINE METAL SIGN,0
13168,542112,REGENCY CAKESTAND 3 TIER,0
13168,542112,DO NOT TOUCH MY STUFF DOOR HANGER,0
13168,574247,YOU'RE CONFUSING ME METAL SIGN,0
13168,542112,METAL SIGN TAKE IT OR LEAVE IT,0
13168,574247,RED SPOT PAPER GIFT BAG,0
13168,542112,IVORY HANGING DECORATION  HEART,0
13168,542112,LADIES & GENTLEMEN METAL SIGN,0
13168,544465,ANTIQUE SILVER TEA GLASS ENGRAVED,0
13168,544465,IVORY KITCHEN SCALES,0
13168,542112,HEART OF WICKER SMALL,0
13168,542112,HOT BATHS METAL SIGN,0
13168,554492,NATURAL SLATE HEART CHALKBOARD,0
13168,574247,HEART OF WICKER SMALL,0
13168,542112,MILK PAN PINK POLKADOT,0
13168,542112,RECIPE BOX PANTRY YELLOW DESIGN,0
13168,542112,METAL SIGN EMPIRE TEA,0
13168,544465,BAKING MOULD CHOCOLATE CUPCAKES,0
13168,542112,PACK OF 60 DINOSAUR CAKE CASES,0
13168,542112,72 SWEETHEART FAIRY CAKE CASES,0
13168,542112,YELLOW METAL CHICKEN HEART,0
13168,574247,WHITE HANGING HEART T-LIGHT HOLDER,0
13168,542112,PACK OF 72 SKULL CAKE CASES,0
13168,542112,SET/3 ROSE CANDLE IN JEWELLED BOX,0
13168,542112,WOODEN FRAME ANTIQUE WHITE,0
13168,542112,PINK UNION JACK  PASSPORT COVER,0
13168,542112,WOOD 2 DRAWER CABINET WHITE FINISH,0
13168,542112,METAL SIGN NEIGHBOURHOOD WITCH,0
13168,542112,ROSE SCENT CANDLE JEWELLED DRAWER,0
13168,542112,IVORY GIANT GARDEN THERMOMETER,0
13168,554492,ENAMEL MEASURING JUG CREAM,0
13168,542112,IVORY KITCHEN SCALES,0
13168,574247,3 DRAWER ANTIQUE WHITE WOOD CABINET,0
13168,544465,PINK AND BLACK STRING CURTAIN,0
13168,574247,ROSE SCENT CANDLE JEWELLED DRAWER,0
13168,542112,CHERRY BLOSSOM PASSPORT COVER,0
13168,542112,CANDLEHOLDER PINK HANGING HEART,0
13168,542112,RED RETROSPOT WRAP,0
13168,554492,COOK WITH WINE METAL SIGN,0
13168,542112,HAND OVER THE CHOCOLATE   SIGN,0
13168,542112,PHOTO FRAME CORNICE,0
13168,574247,4 IVORY DINNER CANDLES SILVER FLOCK,0
13168,554492,HAND OVER THE CHOCOLATE   SIGN,0
13168,542112,YOU'RE CONFUSING ME METAL SIGN,0
13168,542112,S/4 VALENTINE DECOUPAGE HEART BOX,0
13168,542112,TEA FOR ONE POLKADOT,0
13168,542112,SET OF 72 SKULL PAPER  DOILIES,0
13168,542112,SET/3 OCEAN SCENT CANDLE JEWEL BOX,0
13168,542112,60 TEATIME FAIRY CAKE CASES,0
13168,542112,"DECORATION , WOBBLY RABBIT , METAL",0
13168,544465,6 RIBBONS RUSTIC CHARM,0
13168,542112,DOORMAT UNION FLAG,0
13168,554492,WOOD S/3 CABINET ANT WHITE FINISH,0
13168,542112,DOORMAT HEARTS,0
13168,544465,SET 3 SONG BIRD PAPER EGGS ASSORTED,0
13168,542112,SILVER HANGING T-LIGHT HOLDER,0
13168,574247,RETROSPOT HEART HOT WATER BOTTLE,0
13168,544465,WRAP DOILEY DESIGN,0
13168,542112,SET OF 72 RETROSPOT PAPER  DOILIES,0
13168,542112,WOODEN PICTURE FRAME WHITE FINISH,0
13168,542112,SET OF 3 HEART COOKIE CUTTERS,0
13168,574247,WHITE SKULL HOT WATER BOTTLE,0
13168,544465,RED CHARLIE+LOLA PERSONAL DOORSIGN,0
13168,542112,OFFICE MUG WARMER POLKADOT,0
13168,542112,AREA PATROLLED METAL SIGN,0
13168,542112,PINK METAL CHICKEN HEART,0
13168,544465,AREA PATROLLED METAL SIGN,0
13168,542112,RED HANGING HEART T-LIGHT HOLDER,0
13168,542112,DOORMAT RED RETROSPOT,0
13168,544465,SET OF 3 CAKE TINS PANTRY DESIGN,0
13168,544465,BLACK KITCHEN SCALES,0
13168,542112,GINGHAM ROSE WRAP,0
13168,554492,METAL SIGN HIS DINNER IS SERVED,0
13168,574247,RED SPOT GIFT BAG LARGE,0
13168,542112,SET OF 72 PINK HEART PAPER DOILIES,0
13168,542112,DOORMAT RESPECTABLE HOUSE,0
13168,544465,"FLOWER FAIRY,5 SUMMER B'DRAW LINERS",0
13168,542112,COOK WITH WINE METAL SIGN,0
13168,542112,YOU'RE CONFUSING ME METAL SIGN,0
13168,542112,SET OF 3 CAKE TINS PANTRY DESIGN,0
13168,542112,HEN HOUSE DECORATION,0
13168,574247,HAND OVER THE CHOCOLATE   SIGN,0
13168,544465,CHOCOLATE BOX RIBBONS,0
13168,542112,SOAP DISH BROCANTE,0
13168,542112,SKULLS WRITING SET,0
13168,574247,METAL SIGN DROP YOUR PANTS,0
13168,554492,GIN + TONIC DIET METAL SIGN,0
13168,542112,WRAP POPPIES  DESIGN,0
13168,544465,VANILLA INCENSE IN TIN,0
13168,554492,YOU'RE CONFUSING ME METAL SIGN,0
13168,542112,PINK OVAL JEWELLED MIRROR,0
13168,542112,POTTERING IN THE SHED METAL SIGN,0
13168,542112,GRAND CHOCOLATECANDLE,0
13168,544465,FANCY FONTS BIRTHDAY WRAP,0
13168,544465,DO NOT TOUCH MY STUFF DOOR HANGER,0
13168,544465,WHITE HANGING HEART T-LIGHT HOLDER,0
13168,542112,SET OF 3 BUTTERFLY COOKIE CUTTERS,0
13168,574247,SET/3 ROSE CANDLE IN JEWELLED BOX,0
13168,542112,SET OF 36 DINOSAUR PAPER DOILIES,0
13168,544465,GLITTER HANGING BUTTERFLY STRING,0
13168,544465,RED KITCHEN SCALES,0
13168,574247,WOODEN PICTURE FRAME WHITE FINISH,0
13168,542112,WRAP DOILEY DESIGN,0
13168,542112,TOADSTOOL MONEY BOX,0
13168,542112,HANGING HEART ZINC T-LIGHT HOLDER,0
13168,542112,DOORMAT BLACK FLOCK,0
13168,542112,PIGGY BANK RETROSPOT,0
13168,542112,HEART OF WICKER LARGE,0
13168,544465,BAKING MOULD TOFFEE CUP CHOCOLATE,0
13168,542112,PLEASE ONE PERSON METAL SIGN,0
13168,542112,COLOUR GLASS T-LIGHT HOLDER HANGING,0
13168,544465,EASTER DECORATION SITTING BUNNY,0
13168,554492,NATURAL SLATE RECTANGLE CHALKBOARD,0
13168,542112,SWEETHEART CAKESTAND 3 TIER,0
13667,559921,36 PENCILS TUBE WOODLAND,2
13667,559921,36 PENCILS TUBE RED RETROSPOT,2
13667,559921,RETROSPOT CHILDRENS APRON,2
13667,559921,MAGNETS PACK OF 4 VINTAGE COLLAGE,2
13667,559921,OYSTER TRINKET BOX,2
13667,559921,GARDENERS KNEELING PAD KEEP CALM,2
13667,559921,BLUE PAISLEY TISSUE BOX,2
13667,559921,FUNKY WASHING UP GLOVES ASSORTED,2
13667,559921,CLASSIC FRENCH STYLE BASKET BROWN,2
13667,559921,GRASS HOPPER WOODEN WALL CLOCK,2
13667,559921,LAUNDRY 15C METAL SIGN,2
13667,559921,BLUE REFECTORY CLOCK,2
13667,559921,VINTAGE PAISLEY STATIONERY SET,2
13667,559921,FOLDING UMBRELLA PINKWHITE POLKADOT,2
13667,559921,PACK OF 12 SUKI TISSUES,2
13667,559921,PLASTERS IN TIN STRONGMAN,2
13667,559921,RED REFECTORY CLOCK,2
13667,559921,MAGNETS PACK OF 4 HOME SWEET HOME,2
13667,559921,FRENCH ENAMEL WATER BASIN,2
13667,559921,JAZZ HEARTS ADDRESS BOOK,2
13667,559921,FLOWER BLUE CLOCK WITH SUCKER,2
13667,559921,WOODEN FRAME ANTIQUE WHITE,2
13667,559921,JAZZ HEARTS PURSE NOTEBOOK,2
13667,559921,RED KITCHEN SCALES,2
13667,559921,BOOM BOX SPEAKER GIRLS,2
13667,559921,RED RETROSPOT TISSUE BOX,2
13667,559921,PINK PAISLEY SQUARE TISSUE BOX,2
13667,559921,FOLDING UMBRELLA CREAM POLKADOT,2
13667,559921,GARDENERS KNEELING PAD CUP OF TEA,2
13667,559921,CHILDRENS CUTLERY CIRCUS PARADE,2
13667,559921,PACK OF 12 RED RETROSPOT TISSUES,2
13667,559921,12 PENCILS SMALL TUBE SKULL,2
13667,559921,FLOWER PURPLE CLOCK WITH SUCKER,2
13667,559921,WASHROOM METAL SIGN,2
13667,559921,KITCHEN METAL SIGN,2
13667,559921,PINK FAIRY CAKE CHILDRENS APRON,2
13667,559921,RED HANGING HEART T-LIGHT HOLDER,2
13667,559921,LUNCH BOX WITH CUTLERY RETROSPOT,2
13667,559921,PACK OF 12 PINK PAISLEY TISSUES,2
13667,559921,IVORY KITCHEN SCALES,2
13667,559921,SKULLS SQUARE TISSUE BOX,2
13667,559921,FOLDING UMBRELLA WHITE/RED POLKADOT,2
13667,559921,WHITE HANGING HEART T-LIGHT HOLDER,2
13667,559921,BOOM BOX SPEAKER BOYS,2
13667,559921,COLUMBIAN CUBE CANDLE,2
13667,559921,BAKING SET 9 PIECE RETROSPOT,2
13667,559921,PACK OF 12 SPACEBOY TISSUES,2
13667,559921,PIGGY BANK RETROSPOT,2
13667,559921,AIRLINE BAG VINTAGE TOKYO 78,2
13667,559921,ENGLISH ROSE NOTEBOOK A7 SIZE,2
13667,559921,AIRLINE BAG VINTAGE JET SET RED,2
13667,559921,CHARLIE+LOLA MY ROOM DOOR SIGN,2
13667,559921,PLASTERS IN TIN VINTAGE PAISLEY,2
13667,559921,SPOTTY BUNTING,2
13667,559921,BATHROOM METAL SIGN,2
13667,559921,FOLDING UMBRELLA BLACKBLUE POLKADOT,2
13667,559921,FOLDING UMBRELLA RED/WHITE POLKADOT,2
13667,559921,NO JUNK MAIL METAL SIGN,2
13667,559921,12 PENCILS TALL TUBE POSY,2
13667,559921,CHILDRENS CUTLERY DOLLY GIRL,2
13667,559921,NO JUNK MAIL METAL SIGN,2
13667,559921,GROW YOUR OWN BASIL IN ENAMEL MUG,2
13667,559921,CHARLIE & LOLA WASTEPAPER BIN FLORA,2
13667,559921,WHITE STITCHED WALL CLOCK,2
13667,559921,RED RETROSPOT TEA CUP AND SAUCER,2
13667,559921,MOTORING TISSUE BOX,2
13667,559921,OPEN CLOSED METAL SIGN,2
13667,559921,TOILET METAL SIGN,2
13667,559921,IVORY REFECTORY CLOCK,2
13667,559921,PACK OF 12 LONDON TISSUES,2
13667,559921,COLUMBIAN CANDLE ROUND,2
13667,559921,JUMBO SHOPPER VINTAGE RED PAISLEY,2
13667,559921,SAVOY ART DECO CLOCK,2
13667,559921,AIRLINE BAG VINTAGE JET SET BROWN,2
13667,559921,COLUMBIAN CANDLE ROUND,2
13667,559921,PACK OF 12 BLUE PAISLEY TISSUES,2
13667,559921,PLASTERS IN TIN SKULLS,2
13667,559921,AIRLINE BAG VINTAGE JET SET WHITE,2
13667,559921,CANDLEHOLDER PINK HANGING HEART,2
13667,559921,KNEELING MAT HOUSEWORK  DESIGN,2
13667,559921,BLACK STITCHED WALL CLOCK,2
13667,559921,TOADSTOOL MONEY BOX,2
13667,559921,FAN BLACK FRAME,2
13911,543250,PACK OF 72 RETROSPOT CAKE CASES,1
13911,547035,LIGHT GARLAND BUTTERFILES PINK,1
13911,552306,SAVE THE PLANET MUG,1
13911,554843,GROW A FLYTRAP OR SUNFLOWER IN TIN,1
13911,547035,WHITE WOOD GARDEN PLANT LADDER,1
13911,559836,WATERING CAN BLUE ELEPHANT,1
13911,552306,POTTING SHED TEA MUG,1
13911,543921,UNION STRIPE WITH FRINGE  HAMMOCK,1
13911,560392,PAPER POCKET TRAVELING FAN,1
13911,559836,LARGE WHITE HEART OF WICKER,1
13911,559836,BIRDCAGE DECORATION TEALIGHT HOLDER,1
13911,554843,SET OF 6 T-LIGHTS CACTI,1
13911,547035,SET OF 6 T-LIGHTS CACTI,1
13911,543921,CREAM FELT EASTER EGG BASKET,1
13911,543250,RETROSPOT CHILDRENS APRON,1
13911,559836,CACTI T-LIGHT CANDLES,1
13911,543250,60 TEATIME FAIRY CAKE CASES,1
13911,559836,T-LIGHT HOLDER SWEETHEART HANGING,1
13911,543921,S/12 VANILLA  BOTANICAL T-LIGHTS,1
13911,554843,HERB MARKER BASIL,1
13911,549318,YELLOW POT PLANT CANDLE,1
13911,543921,SET/6 FROG PRINCE T-LIGHT CANDLES,1
13911,552306,UNION STRIPE WITH FRINGE  HAMMOCK,1
13911,549318,WOODEN PICTURE FRAME WHITE FINISH,1
13911,547035,BUNNY DECORATION MAGIC GARDEN,1
13911,543250,LAVENDER SCENTED FABRIC HEART,1
13911,543250,SPOTTY PINK DUCK DOORSTOP,1
13911,559836,FILIGRIS HEART WITH BUTTERFLY,1
13911,543250,SET OF 6 T-LIGHTS EASTER CHICKS,1
13911,559836,WOODEN PICTURE FRAME WHITE FINISH,1
13911,543250,12 PENCILS TALL TUBE RED RETROSPOT,1
13911,549318,DOORMAT FANCY FONT HOME SWEET HOME,1
13911,543921,RECIPE BOX RETROSPOT,1
13911,559836,SMALL WHITE HEART OF WICKER,1
13911,559836,HANGING METAL HEART LANTERN,1
13911,547035,BAKING SET SPACEBOY DESIGN,1
13911,559836,WHITE HANGING HEART T-LIGHT HOLDER,1
13911,554843,PAPER POCKET TRAVELING FAN,1
13911,554843,NAMASTE SWAGAT INCENSE,1
13911,554843,ASSORTED LAQUERED INCENSE HOLDERS,1
13911,559836,PHOTO FRAME 3 CLASSIC HANGING,1
13911,559836,LOVEBIRD HANGING DECORATION WHITE,1
13911,543921,PAINTED PINK RABBIT,1
13911,547035,CITRONELLA CANDLE GARDEN POT,1
13911,549318,SILVER STANDING GNOME,1
13911,571099,ASSORTED COLOURS SILK FAN,1
13911,543250,JAM MAKING SET WITH JARS,1
13911,552306,POTTERING MUG,1
13911,543250,TRAVEL SEWING KIT,1
13911,549318,APRON MODERN VINTAGE COTTON,1
13911,549318,TRADITIONAL WOODEN CATCH CUP GAME,1
13911,552306,SET 12 LAVENDER  BOTANICAL T-LIGHTS,1
13911,543921,PINK FLOWERS RABBIT EASTER,1
13911,559836,GARDENERS KNEELING PAD CUP OF TEA,1
13911,560392,TRAVEL CARD WALLET SUKI,1
13911,554843,HERB MARKER MINT,1
13911,543250,PACK OF 12 STICKY BUNNIES,1
13911,552306,ENCHANTED BIRD PLANT CAGE,1
13911,559836,GARDENERS KNEELING PAD KEEP CALM,1
13911,552306,GROW A FLYTRAP OR SUNFLOWER IN TIN,1
13911,543250,RED  HARMONICA IN BOX,1
13911,547035,PINK FAIRY CAKE CHILDRENS APRON,1
13911,547035,GIN & TONIC DIET GREETING CARD,1
13911,547035,BAG 125g SWIRLY MARBLES,1
13911,549318,CLASSIC METAL BIRDCAGE PLANT HOLDER,1
13911,559836,PHOTO FRAME CORNICE,1
13911,543921,GIN & TONIC DIET GREETING CARD,1
13911,547035,SET OF 4 PANTRY JELLY MOULDS,1
13911,559836,LARGE HANGING IVORY & RED WOOD BIRD,1
13911,549318,SILVER FISHING GNOME,1
13911,559836,HANGING FAIRY CAKE DECORATION,1
13911,552306,IF YOU CAN'T STAND THE HEAT MUG,1
13911,559836,WOOD BLACK BOARD ANT WHITE FINISH,1
13911,559836,LANTERN CREAM GAZEBO,1
13911,543250,SINGLE HEART ZINC T-LIGHT HOLDER,1
13911,559836,ENCHANTED BIRD COATHANGER 5 HOOK,1
13911,552306,GLAMOROUS  MUG,1
13911,547035,MINI PAINT SET VINTAGE,1
13911,560392,PACK OF 12 SUKI TISSUES,1
13911,543921,"DECORATION , WOBBLY RABBIT , METAL",1
13911,554843,HERB MARKER ROSEMARY,1
13911,543921,EASTER BUNNY HANGING GARLAND,1
13911,559836,WOOD S/3 CABINET ANT WHITE FINISH,1
13911,543921,SET 12 LAVENDER  BOTANICAL T-LIGHTS,1
13911,554843,FENG SHUI PILLAR CANDLE,1
13911,554843,MAGIC DRAWING SLATE DINOSAUR,1
13911,543921,BLUE FELT EASTER EGG BASKET,1
13911,543250,PACK OF 12 PINK POLKADOT TISSUES,1
13911,543250,CHILDS GARDEN FORK BLUE,1
13911,543250,CHILDS GARDEN TROWEL BLUE,1
13911,549318,RED  HARMONICA IN BOX,1
13911,559836,HOME GARLAND PAINTED ZINC,1
13911,559836,MIRRORED DOVE WALL DECORATION,1
13911,560392,CHARLOTTE BAG SUKI DESIGN,1
13911,549318,BAKING SET 9 PIECE RETROSPOT,1
13911,552306,WHITE WOOD GARDEN PLANT LADDER,1
13911,554843,ORIGAMI JASMINE INCENSE/CANDLE SET,1
13911,549318,S/6 WOODEN SKITTLES IN COTTON BAG,1
13911,543250,CACTI T-LIGHT CANDLES,1
13911,543250,TEA TIME OVEN GLOVE,1
13911,547035,SET/10 RED POLKADOT PARTY CANDLES,1
13911,543921,MULTICOLOUR EASTER RABBIT,1
13911,560392,LUNCH BAG SUKI DESIGN,1
13911,559836,LOVE GARLAND PAINTED ZINC,1
13911,552306,SMALL RED RETROSPOT WINDMILL,1
13911,547035,GINGERBREAD MAN COOKIE CUTTER,1
13911,543250,PINK CREAM FELT CRAFT TRINKET BOX,1
13911,559836,WATERING CAN PINK BUNNY,1
13911,549318,SMALL RED RETROSPOT WINDMILL,1
13911,554843,ASSORTED COLOURS SILK FAN,1
13911,554843,HERB MARKER THYME,1
13911,560392,ASSORTED COLOURS SILK FAN,1
13911,543250,CHILDS GARDEN TROWEL PINK,1
13911,552306,BAG 125g SWIRLY MARBLES,1
13911,571099,PAPER POCKET TRAVELING FAN,1
13911,547035,FLAG OF ST GEORGE CHAIR,1
13911,571099,WRAP SUKI AND FRIENDS,1
13911,543250,BAKING SET 9 PIECE RETROSPOT,1
13911,543921,PINK FELT EASTER RABBIT GARLAND,1
13911,543250,BROWN CHECK CAT DOORSTOP,1
13911,547035,WATERING CAN PINK BUNNY,1
13911,552306,GIN AND TONIC MUG,1
13911,571099,PACK OF 12 SUKI TISSUES,1
13911,543921,GARLAND WOODEN HAPPY EASTER,1
13911,547035,HANGING METAL HEART LANTERN,1
13911,552306,SMALL IVORY HEART WALL ORGANISER,1
13911,560392,WRAP SUKI AND FRIENDS,1
13911,549318,GROW A FLYTRAP OR SUNFLOWER IN TIN,1
13911,552306,WHITE METAL LANTERN,1
13911,547035,GROW A FLYTRAP OR SUNFLOWER IN TIN,1
13911,549318,JOY LARGE WOOD LETTERS,1
13911,552306,CLASSIC METAL BIRDCAGE PLANT HOLDER,1
13911,554843,ORIGAMI VANILLA INCENSE/CANDLE SET,1
13911,559836,HEART IVORY TRELLIS LARGE,1
13911,559836,FOUR HOOK  WHITE LOVEBIRDS,1
13911,543250,CERAMIC STRAWBERRY CAKE MONEY BANK,1
13911,559836,CLASSIC METAL BIRDCAGE PLANT HOLDER,1
13911,547035,WATERING CAN BLUE ELEPHANT,1
13911,554843,MINI JIGSAW DINOSAUR,1
13911,559836,HEART DECORATION PAINTED ZINC,1
13911,554843,GROW YOUR OWN BASIL IN ENAMEL MUG,1
13911,559836,SINGLE HEART ZINC T-LIGHT HOLDER,1
13911,560392,NAMASTE SWAGAT INCENSE,1
13911,543250,CHILDS GARDEN FORK PINK,1
13911,552306,ENGLISH ROSE GARDEN SECATEURS,1
13911,543250,HOMEMADE JAM SCENTED CANDLES,1
13911,543250,TEA TIME PARTY BUNTING,1
13911,552306,LIGHT GARLAND BUTTERFILES PINK,1
14108,564800,BOTANICAL ROSE GIFT WRAP,0
14108,575212,VINTAGE DOILY TRAVEL SEWING KIT,0
14108,575212,JAM MAKING SET PRINTED,0
14108,575212,ALARM CLOCK BAKELIKE GREEN,0
14108,564800,TRAVEL CARD WALLET VINTAGE TICKET,0
14108,575212,PACK OF 6 PANNETONE GIFT BOXES,0
14108,575212,PLAYING CARDS KEEP CALM & CARRY ON,0
14108,564800,SET OF 5 LUCKY CAT MAGNETS,0
14108,575212,SET OF 10 LED DOLLY LIGHTS,0
14108,564800,ILLUSTRATED CAT BOWL,0
14108,564800,MULTICOLOUR HONEYCOMB FAN,0
14108,575212,CHRISTMAS LIGHTS 10 VINTAGE BAUBLES,0
14108,575212,SET OF 5 LUCKY CAT MAGNETS,0
14108,575212,SET 12 RETRO WHITE CHALK STICKS,0
14108,575212,HEART MINI PORTRAIT FRAME,0
14108,564800,ENGLISH ROSE GARDEN SECATEURS,0
14108,575212,ANTIQUE HEART SHELF UNIT,0
14108,575212,CHRISTMAS TABLE SILVER CANDLE SPIKE,0
14108,564800,SCOTTIE DOG HOT WATER BOTTLE,0
14108,564800,TRAVEL CARD WALLET TRANSPORT,0
14108,575212,MINI PLAYING CARDS SPACEBOY,0
14108,575212,PAPER CHAIN KIT RETROSPOT,0
14108,564800,RED RETROSPOT WRAP,0
14108,575212,RED REFECTORY CLOCK,0
14108,564800,REVOLVER WOODEN RULER,0
14108,564800,DOG BOWL CHASING BALL DESIGN,0
14108,564800,VINTAGE CREAM DOG FOOD CONTAINER,0
14108,575212,BOX OF 6 MINI VINTAGE CRACKERS,0
14108,564800,BROWN CHECK CAT DOORSTOP,0
14108,564800,BUFFALO BILL TREASURE BOOK BOX,0
14108,564800,VINTAGE CREAM CAT FOOD CONTAINER,0
14108,564800,RETRO LONGBOARD IRONING BOARD COVER,0
14108,575212,FAIRY CAKE FLANNEL ASSORTED COLOUR,0
14108,575212,CARDHOLDER HOLLY WREATH METAL,0
14354,580398,CUPID DESIGN SCENTED CANDLES,0
14354,580398,T-LIGHT HOLDER HANGING LACE,0
14354,575391,ROMANTIC IMAGES GIFT WRAP SET,0
14354,580398,GROW YOUR OWN FLOWERS SET OF 3,0
14354,575391,6 RIBBONS RUSTIC CHARM,0
14354,575391,SMALL HANGING IVORY/RED WOOD BIRD,0
14354,575391,CHRISTMAS RETROSPOT ANGEL WOOD,0
14354,575391,SET OF 6 RIBBONS VINTAGE CHRISTMAS,0
14354,575391,SET OF 2 CHRISTMAS DECOUPAGE CANDLE,0
14629,580720,OFFICE MUG WARMER BLACK+SILVER,0
14629,572317,CHOCOLATE BOX RIBBONS,0
14629,572317,TOILET SIGN OCCUPIED OR VACANT,0
14629,572317,"KEY FOB , SHED",0
14629,580720,REGENCY CAKESTAND 3 TIER,0
14629,580720,WOOD STOCKING CHRISTMAS SCANDISPOT,0
14629,580720,HEART FILIGREE DOVE LARGE,0
14629,580720,WALL ART BIG LOVE,0
14629,572317,BLACK RECORD COVER FRAME,0
14629,580720,MULTI COLOUR SILVER T-LIGHT HOLDER,0
14629,580720,AIRLINE BAG VINTAGE TOKYO 78,0
14629,572317,50'S CHRISTMAS GIFT BAG LARGE,0
14629,580720,LOVEBIRD HANGING DECORATION WHITE,0
14629,580720,HAND WARMER SCOTTY DOG DESIGN,0
14629,572317,OFFICE MUG WARMER CHOC+BLUE,0
14629,572317,LANDMARK FRAME COVENT GARDEN,0
14629,580720,MULTI HEARTS  STICKERS,0
14629,572317,DOORMAT WELCOME PUPPIES,0
14629,580720,ANTIQUE HEART SHELF UNIT,0
14629,572317,BLACK MINI TAPE MEASURE,0
14629,572317,AREA PATROLLED METAL SIGN,0
14629,572317,WALL ART VILLAGE SHOW,0
14629,572317,3 RAFFIA RIBBONS 50'S CHRISTMAS,0
14629,580720,WOODEN STAR CHRISTMAS SCANDINAVIAN,0
14629,580720,VINTAGE DOILY DELUXE SEWING KIT,0
14629,572317,DOORMAT KEEP CALM AND COME IN,0
14629,580720,AIRLINE BAG VINTAGE JET SET WHITE,0
14629,580720,MULTICOLOUR SPRING FLOWER MUG,0
14629,580720,HOT WATER BOTTLE KEEP CALM,0
14629,572317,IVORY KITCHEN SCALES,0
14629,572317,HAND WARMER RED LOVE HEART,0
14629,572317,HAND WARMER SCOTTY DOG DESIGN,0
14629,572317,DOORMAT VINTAGE LEAF,0
14629,572317,LANDMARK FRAME BAKER STREET,0
14629,572317,HOT WATER BOTTLE TEA AND SYMPATHY,0
14629,572317,36 PENCILS TUBE RED RETROSPOT,0
14629,572317,LOVE HOT WATER BOTTLE,0
14629,580720,SET3 BOOK BOX GREEN GINGHAM FLOWER,0
14629,572317,SET OF 3 CAKE TINS SKETCHBOOK,0
14629,572317,DO NOT TOUCH MY STUFF DOOR HANGER,0
14629,572317,RED KITCHEN SCALES,0
14629,572317,RETROSPOT HEART HOT WATER BOTTLE,0
14629,580720,T-LIGHT GLASS FLUTED ANTIQUE,0
14629,572317,DOORMAT WELCOME TO OUR HOME,0
14629,572317,SET OF 3 HEART COOKIE CUTTERS,0
14629,580720,DOILY THANK YOU CARD,0
14629,572317,EGG FRYING PAN PINK,0
14629,572317,WRAP 50'S  CHRISTMAS,0
14629,580720,ALPHABET HEARTS STICKER SHEET,0
14629,580720,SET OF 2 ROUND TINS CAMEMBERT,0
14629,572317,CHOCOLATE HOT WATER BOTTLE,0
14629,580720,OFFICE MUG WARMER CHOC+BLUE,0
14629,572317,SET OF 3 REGENCY CAKE TINS,0
14629,572317,OFFICE MUG WARMER POLKADOT,0
14629,572317,BUFFALO BILL TREASURE BOOK BOX,0
14629,572317,WALL ART DOG LICENCE,0
14629,580720,PLAYING CARDS KEEP CALM & CARRY ON,0
14629,580720,PAPER CHAIN KIT VINTAGE CHRISTMAS,0
14629,572317,LANDMARK FRAME NOTTING HILL,0
14629,572317,WRAP CHRISTMAS VILLAGE,0
14629,572317,DOOR HANGER  MUM + DADS ROOM,0
14629,580720,VINTAGE GLASS T-LIGHT HOLDER,0
14629,572317,VINTAGE DOILY DELUXE SEWING KIT,0
14629,572317,SILVER MUG BONE CHINA TREE OF LIFE,0
14629,580720,FOLKART ZINC HEART CHRISTMAS DEC,0
14629,580720,GINGHAM HEART  DOORSTOP RED,0
14629,572317,GARAGE KEY FOB,0
14629,572317,6 GIFT TAGS VINTAGE CHRISTMAS,0
14629,580720,ICON MUG REVOLUTIONARY,0
14629,580720,MINI PLAYING CARDS BUFFALO BILL,0
14629,572317,REGENCY CAKESTAND 3 TIER,0
14629,572317,BULL DOG BOTTLE OPENER,0
14629,580720,BICYCLE PUNCTURE REPAIR KIT,0
14629,572317,SET OF TEA COFFEE SUGAR TINS PANTRY,0
14629,580720,WALL ART DOG LICENCE,0
14629,572317,NOEL WOODEN BLOCK LETTERS,0
14629,572317,PACK OF SIX LED TEA LIGHTS,0
14629,580720,WHITE WICKER STAR,0
14629,572317,RIBBON REEL MAKING SNOWMEN,0
14629,572317,SILVER MUG BONE CHINA TREE OF LIFE,0
14629,580720,HAND WARMER BIRD DESIGN,0
14629,580720,SMALL WHITE HEART OF WICKER,0
14629,572317,RIBBON REEL CHRISTMAS SOCK BAUBLE,0
14629,572317,DOORMAT MERRY CHRISTMAS RED,0
14629,572317,HOT WATER BOTTLE KEEP CALM,0
14629,580720,CLASSIC CHROME BICYCLE BELL,0
14629,572317,ICON MUG REVOLUTIONARY,0
14629,572317,6 GIFT TAGS 50'S CHRISTMAS,0
14629,572317,SET 6 PAPER TABLE LANTERN HEARTS,0
14629,572317,VINTAGE UNION JACK BUNTING,0
14629,580720,ANTIQUE SILVER T-LIGHT GLASS,0
14629,580720,WALL ART KEEP CALM,0
14629,580720,GINGHAM HEART DECORATION,0
14629,580720,STAR DECORATION PAINTED ZINC,0
14629,572317,LANDMARK FRAME CAMDEN TOWN,0
14629,580720,VINTAGE UNION JACK MEMOBOARD,0
14629,572317,VINTAGE PAISLEY STATIONERY SET,0
14629,580720,BOOM BOX SPEAKER GIRLS,0
14629,580720,RETROSPOT CIGAR BOX MATCHES,0
14629,580720,HEART IVORY TRELLIS LARGE,0
14629,572317,PLEASE ONE PERSON METAL SIGN,0
14629,580720,LANDMARK FRAME LONDON BRIDGE,0
14629,572317,LANDMARK FRAME OXFORD STREET,0
14629,572317,RIBBON REEL CHRISTMAS PRESENT,0
14629,580720,RED GINGHAM ROSE JEWELLERY BOX,0
14629,572317,ROUND SNACK BOXES SET OF 4 FRUITS,0
14629,580720,HEARTS GIFT TAPE,0
14629,572317,VINTAGE DOILY TRAVEL SEWING KIT,0
14629,580720,HAND WARMER RED LOVE HEART,0
14629,580720,TRADITIONAL WOODEN SKIPPING ROPE,0
14629,580720,SET OF 2 ROUND TINS DUTCH CHEESE,0
14629,580720,CLASSIC BICYCLE CLIPS,0
14629,580720,PAPERWEIGHT VINTAGE PAISLEY,0
14629,580720,FAMILY PHOTO FRAME CORNICE,0
14629,572317,DOORMAT HOME SWEET HOME BLUE,0
14629,580720,LANDMARK FRAME COVENT GARDEN,0
14629,572317,HOT BATHS METAL SIGN,0
14629,572317,ENAMEL FIRE BUCKET CREAM,0
14629,580720,AIRLINE BAG VINTAGE WORLD CHAMPION,0
14629,580720,DOORMAT KEEP CALM AND COME IN,0
14629,572317,3 TIER CAKE TIN GREEN AND CREAM,0
14629,572317,RIBBON REEL SNOWY VILLAGE,0
14629,572317,HOT WATER BOTTLE I AM SO POORLY,0
14629,580720,SET/3 RED GINGHAM ROSE STORAGE BOX,0
14629,572317,VINTAGE CHRISTMAS GIFT BAG LARGE,0
14629,572317,12 PENCILS TALL TUBE WOODLAND,0
14629,572317,BLACK KITCHEN SCALES,0
14629,572317,TRADTIONAL ALPHABET STAMP SET,0
14629,580720,WOODEN HEART CHRISTMAS SCANDINAVIAN,0
14629,580720,SET 6 PAPER TABLE LANTERN HEARTS,0
14629,572317,WALL ART KEEP CALM,0
14629,580720,AREA PATROLLED METAL SIGN,0
14629,572317,HAND WARMER BIRD DESIGN,0
14629,580720,SCOTTIE DOG HOT WATER BOTTLE,0
14629,572317,CARD CHRISTMAS VILLAGE,0
14629,572317,WALL ART BICYCLE SAFETY,0
14629,572317,WOODEN REGATTA BUNTING,0
14629,572317,SET OF 3 CAKE TINS PANTRY DESIGN,0
14629,572317,OFFICE MUG WARMER PINK,0
14629,580720,SET 6 PAPER TABLE LANTERN STARS,0
14629,580720,BOOM BOX SPEAKER BOYS,0
14629,572317,MOODY BOY  DOOR HANGER,0
14629,580720,HAND WARMER OWL DESIGN,0
14629,580720,ANTIQUE SILVER TEA GLASS ENGRAVED,0
14629,572317,12 PENCILS TALL TUBE RED RETROSPOT,0
14629,580720,FOLKART ZINC HEART CHRISTMAS DEC,0
14629,572317,GOLD MUG BONE CHINA TREE OF LIFE,0
14629,580720,PACK OF SIX LED TEA LIGHTS,0
14629,580720,SET OF 6 3D KIT CARDS FOR KIDS,0
14629,572317,DOORMAT I LOVE LONDON,0
14758,547793,PARTY BUNTING,0
14758,547793,RETROSPOT LAMP,0
14758,560282,RETROSPOT LAMP,0
14758,560282,REGENCY CAKESTAND 3 TIER,0
14758,551439,BLUE POLKADOT COFFEE MUG,0
14758,560282,COFFEE MUG PEARS  DESIGN,0
14758,551439,RETROSPOT LAMP,0
14758,553662,SET 6 PAPER TABLE LANTERN STARS,0
14758,547793,WOODEN HAPPY BIRTHDAY GARLAND,0
14758,560282,COFFEE MUG PINK PAISLEY DESIGN,0
14758,560282,KEY CABINET MA CAMPAGNE,0
14758,547793,DOORMAT RED RETROSPOT,0
14758,551439,NATURAL SLATE CHALKBOARD LARGE,0
14758,547793,CREAM SWEETHEART MINI CHEST,0
14758,547793,COFFEE MUG CAT + BIRD DESIGN,0
14758,560282,LARGE ANTIQUE WHITE PHOTO FRAME,0
14758,560282,RED RETROSPOT PUDDING BOWL,0
14758,551439,WOOD S/3 CABINET ANT WHITE FINISH,0
14758,553662,PARISIENNE JEWELLERY DRAWER,0
14758,547793,ENAMEL FLOWER JUG CREAM,0
14758,553662,PARISIENNE CURIO CABINET,0
14758,547793,TWO DOOR CURIO CABINET,0
14758,547793,CUPBOARD 3 DRAWER MA CAMPAGNE,0
14758,547793,PHOTO FRAME 3 CLASSIC HANGING,0
14758,553662,MULTICOLOUR POLKADOT PLATE,0
14758,553662,ENAMEL WASH BOWL CREAM,0
14758,560282,COFFEE MUG APPLES DESIGN,0
14758,547793,COFFEE MUG DOG + BALL DESIGN,0
14758,553662,SET OF 10 LED DOLLY LIGHTS,0
14758,547793,COFFEE MUG BLUE PAISLEY DESIGN,0
14758,551439,PARTY BUNTING,0
14758,551439,TABLECLOTH RED APPLES DESIGN,0
14758,547793,SET OF 20 KIDS COOKIE CUTTERS,0
14758,551439,CUPBOARD 3 DRAWER MA CAMPAGNE,0
14758,547793,COFFEE MUG PEARS  DESIGN,0
14758,560282,RED RETROSPOT CAKE STAND,0
14758,547793,BOX OF 24 COCKTAIL PARASOLS,0
14758,551439,RED RETROSPOT CAKE STAND,0
14758,560282,COFFEE MUG BLUE PAISLEY DESIGN,0
14758,547793,SET OF 3 NOTEBOOKS IN PARCEL,0
14758,547793,CAKE STAND 3 TIER MAGIC GARDEN,0
14758,551439,PHOTO FRAME CORNICE,0
14758,560282,BLUE POLKADOT BEAKER,0
14758,547793,"RUSTIC WOODEN CABINET, GLASS DOORS",0
14758,547793,TRIPLE PHOTO FRAME CORNICE,0
14758,547793,FAMILY PHOTO FRAME CORNICE,0
14758,553662,COFFEE MUG PINK PAISLEY DESIGN,0
14758,560282,ENAMEL FLOWER JUG CREAM,0
14758,551439,BEACH HUT SHELF W 3 DRAWERS,0
14758,560282,RED RETROSPOT TEA CUP AND SAUCER,0
14758,547793,CHEST OF DRAWERS GINGHAM HEART,0
14758,553662,WHITE WOOD GARDEN PLANT LADDER,0
14758,547793,COFFEE MUG APPLES DESIGN,0
14758,551439,HAND TOWEL PALE BLUE W FLOWERS,0
14758,551439,SET/2 RED RETROSPOT TEA TOWELS,0
