16168,559810,20 DOLLY PEGS RETROSPOT,1
16168,563468,WOODEN UNION JACK BUNTING,1
16168,568216,RED BABY BUNTING,1
16168,565724,PAPER LANTERN 5 POINT SEQUIN STAR,1
16168,565724,GREEN REGENCY TEACUP AND SAUCER,1
16168,568216,PINK BABY BUNTING,1
16168,552254,PAPER BUNTING WHITE LACE,1
16168,541976,GREEN GIANT GARDEN THERMOMETER,1
16168,564723,RABBIT NIGHT LIGHT,1
16168,555011,3D HEARTS  HONEYCOMB PAPER GARLAND,1
16168,560269,PARTY METAL SIGN,1
16168,560269,POTTERING IN THE SHED METAL SIGN,1
16168,565724,REGENCY CAKESTAND 3 TIER,1
16168,559810,COLOUR GLASS T-LIGHT HOLDER HANGING,1
16168,562152,3D HEARTS  HONEYCOMB PAPER GARLAND,1
16168,549850,NATURAL SLATE CHALKBOARD LARGE,1
16168,571169,MIRRORED DISCO BALL,1
16168,552254,PARTY METAL SIGN,1
16168,578196,15CM CHRISTMAS GLASS BALL 20 LIGHTS,1
16168,559810,GARDENERS KNEELING PAD KEEP CALM,1
16168,564723,GARDENERS KNEELING PAD KEEP CALM,1
16168,549670,BLUE STRIPE CERAMIC DRAWER KNOB,1
16168,563465,NATURAL SLATE RECTANGLE CHALKBOARD,1
16168,552254,ROTATING LEAVES T-LIGHT HOLDER,1
16168,568216,PARISIENNE KEY CABINET,1
16168,549670,3D HEARTS  HONEYCOMB PAPER GARLAND,1
16168,553181,GARDENERS KNEELING PAD CUP OF TEA,1
16168,537053,ROTATING SILVER ANGELS T-LIGHT HLDR,1
16168,565724,PINK REGENCY TEACUP AND SAUCER,1
16168,562152,WHITE HANGING HEART T-LIGHT HOLDER,1
16168,571169,CARD HOLDER LOVE BIRD LARGE,1
16168,546633,WHITE HANGING HEART T-LIGHT HOLDER,1
16168,555695,REGENCY CAKESTAND 3 TIER,1
16168,541976,NATURAL SLATE CHALKBOARD LARGE,1
16168,553181,GARDENERS KNEELING PAD KEEP CALM,1
16168,555695,GARDENERS KNEELING PAD KEEP CALM,1
16168,571169,YELLOW GIANT GARDEN THERMOMETER,1
16168,579410,POTTERING MUG,1
16168,555695,REGENCY MILK JUG PINK,1
16168,568216,CARD MOTORBIKE SANTA,1
16168,568216,BEWARE OF THE CAT METAL SIGN,1
16168,563465,NATURAL SLATE CHALKBOARD LARGE,1
16168,579410,POTTERING IN THE SHED METAL SIGN,1
16168,549670,COLOUR GLASS T-LIGHT HOLDER HANGING,1
16168,546633,LARGE CIRCULAR MIRROR MOBILE,1
16168,537053,IVORY GIANT GARDEN THERMOMETER,1
16168,552254,JUMBO BAG SCANDINAVIAN BLUE PAISLEY,1
16168,559810,VINTAGE CHRISTMAS BUNTING,1
16168,549670,BLUE SPOT CERAMIC DRAWER KNOB,1
16168,555011,GLASS  BEURRE DISH,1
16168,552254,POTTERING IN THE SHED METAL SIGN,1
16168,575415,VINTAGE CHRISTMAS BUNTING,1
16168,565724,PAPER LANTERN 9 POINT DELUXE STAR,1
16168,560269,I'M ON HOLIDAY METAL SIGN,1
16168,562152,GREEN GIANT GARDEN THERMOMETER,1
16168,541976,POTTERING MUG,1
16168,577771,JUMBO BAG APPLES,1
16168,549670,WHITE SPOT BLUE CERAMIC DRAWER KNOB,1
16168,574665,GARDENERS KNEELING PAD KEEP CALM,1
16168,537053,GREEN GIANT GARDEN THERMOMETER,1
16168,571169,BLUE GIANT GARDEN THERMOMETER,1
16168,574665,VINTAGE BELLS GARLAND,1
16168,577771,JUMBO BAG PEARS,1
16168,574666,RABBIT NIGHT LIGHT,1
16168,565157,RABBIT NIGHT LIGHT,1
16168,568216,PARTY METAL SIGN,1
16168,559810,PINK BABY BUNTING,1
16168,555695,PINK REGENCY TEACUP AND SAUCER,1
16168,564723,GARDENERS KNEELING PAD CUP OF TEA,1
16168,565724,ROSES REGENCY TEACUP AND SAUCER,1
16168,571169,SET OF 12 T-LIGHTS VINTAGE DOILY,1
16168,563465,SLATE TILE NATURAL HANGING,1
16168,563468,PINK BABY BUNTING,1
16168,568216,HOT WATER BOTTLE KEEP CALM,1
16168,549670,RED SPOT CERAMIC DRAWER KNOB,1
16168,571169,CARD HOLDER LOVE BIRD SMALL,1
16168,562152,YELLOW GIANT GARDEN THERMOMETER,1
16168,555695,ROSES REGENCY TEACUP AND SAUCER,1
16168,560269,DISCO BALL ROTATOR BATTERY OPERATED,1
16168,565724,LARGE CIRCULAR MIRROR MOBILE,1
16168,541976,IVORY GIANT GARDEN THERMOMETER,1
16168,552254,SPOTTY BUNTING,1
16168,559810,LARGE CIRCULAR MIRROR MOBILE,1
16168,555011,YELLOW GIANT GARDEN THERMOMETER,1
16168,576395,DISCO BALL ROTATOR BATTERY OPERATED,1
16168,562152,COLOUR GLASS T-LIGHT HOLDER HANGING,1
16168,579410,POTTING SHED TEA MUG,1
16168,549670,PAPER BUNTING WHITE LACE,1
16168,562152,RED HANGING HEART T-LIGHT HOLDER,1
16168,563465,NATURAL SLATE HEART CHALKBOARD,1
16168,576395,MIRRORED DISCO BALL,1
16168,541976,NATURAL SLATE HEART CHALKBOARD,1
16168,568216,POTTERING IN THE SHED METAL SIGN,1
16248,570213,HOME SWEET HOME BOTTLE,0
16248,570213,HAND WARMER OWL DESIGN,0
16248,570213,KNICKERBOCKERGLORY MAGNET ASSORTED,0
16248,570213,SET OF 5 MINI GROCERY MAGNETS,0
16248,570213,SET OF 6 T-LIGHTS SANTA,0
16248,570213,SET OF 6 NATIVITY MAGNETS,0
16248,570213,HAND WARMER SCOTTY DOG DESIGN,0
16419,558065,ANTIQUE SILVER TEA GLASS ENGRAVED,0
16419,546123,CLASSIC METAL BIRDCAGE PLANT HOLDER,0
16419,546123,PARTY BUNTING,0
16419,542868,LARGE PINK GLASS SUNDAE DISH,0
16419,563832,ANTIQUE SILVER TEA GLASS ENGRAVED,0
16419,542868,ANTIQUE GLASS PEDESTAL BOWL,0
16419,542868,S/2 ZINC HEART DESIGN PLANTERS,0
16419,563832,ASSORTED COLOUR BIRD ORNAMENT,0
16419,546123,REGENCY CAKESTAND 3 TIER,0
16419,558030,REGENCY MILK JUG PINK,0
16419,542868,VINTAGE GLASS COFFEE CADDY,0
16419,558030,CLASSIC METAL BIRDCAGE PLANT HOLDER,0
16419,558030,ANTIQUE SILVER TEA GLASS ENGRAVED,0
16419,546123,ANTIQUE SILVER TEA GLASS ENGRAVED,0
16419,558030,REGENCY TEAPOT ROSES,0
16419,546123,S/2 ZINC HEART DESIGN PLANTERS,0
16419,542868,ENAMEL WASH BOWL CREAM,0
16419,542868,WOOD BLACK BOARD ANT WHITE FINISH,0
16419,546123,POTTING SHED SEED ENVELOPES,0
16419,542868,REX CASH+CARRY JUMBO SHOPPER,0
16419,542868,RIBBON REEL STRIPES DESIGN,0
16419,562133,IVORY REFECTORY CLOCK,0
16419,562133,ANTIQUE SILVER TEA GLASS ENGRAVED,0
16419,562133,SMALL APOTHECARY MEASURING JAR,0
16419,562133,SMOKEY GREY COLOUR D.O.F. GLASS,0
16419,546123,POTTING SHED TWINE,0
16419,542868,ZINC METAL HEART DECORATION,0
16419,558030,ASSORTED COLOUR BIRD ORNAMENT,0
16419,542868,ZINC HEART LATTICE T-LIGHT HOLDER,0
16419,562133,ASSORTED COLOUR BIRD ORNAMENT,0
16419,562133,VICTORIAN GLASS HANGING T-LIGHT,0
16419,562133,ZINC HERB GARDEN CONTAINER,0
16419,542868,WHITE HYDRANGEA ART FLOWER,0
16419,542868,ENAMEL BREAD BIN CREAM,0
16419,542868,ANTIQUE SILVER TEA GLASS ENGRAVED,0
16419,542868,ASSORTED COLOUR BIRD ORNAMENT,0
16419,563832,REX CASH+CARRY JUMBO SHOPPER,0
16419,558065,CLASSIC METAL BIRDCAGE PLANT HOLDER,0
16419,542868,BISCUIT TIN VINTAGE RED,0
16419,562133,LARGE APOTHECARY MEASURING JAR,0
16419,563832,PARTY BUNTING,0
16419,558030,GREEN REGENCY TEACUP AND SAUCER,0
16419,563832,LARGE BONNE JAM JAR  T-LIGHT HOLDER,0
16419,562133,COCKTAIL SWORDS 50 PIECES,0
16419,542868,CREAM CLIMBING HYDRANGA ART FLOWER,0
16419,562133,WHITE BAMBOO RIBS LAMPSHADE,0
16419,562133,SKULL AND CROSSBONES  GARLAND,0
16419,558030,WHITE HEARTS WIRE PLANT POT HOLDER,0
16419,558030,RIBBON REEL STRIPES DESIGN,0
16419,542868,ANTIQUE TALL SWIRLGLASS TRINKET POT,0
16479,579427,CHILDS BREAKFAST SET CIRCUS PARADE,0
16479,579427,GLASS  SONGBIRD STORAGE JAR,0
16479,579427,SET/5 RED RETROSPOT LID GLASS BOWLS,0
16479,579427,WHITE HONEYCOMB PAPER GARLAND,0
16479,579427,3 ROSE MORRIS BOXED CANDLES,0
16479,579427,HOT WATER BOTTLE KEEP CALM,0
16479,579443,POPCORN HOLDER,0
16479,579443,POPPY'S PLAYHOUSE BATHROOM,0
16479,579443,SAVE THE PLANET MUG,0
16479,579443,POPPY'S PLAYHOUSE KITCHEN,0
16479,579443,VINTAGE BILLBOARD LOVE/HATE MUG,0
16479,579443,GLASS TWIST BON BON JAR,0
16479,579427,RECIPE BOX PANTRY YELLOW DESIGN,0
16479,579427,LAVENDER TOILETTE BOTTLE,0
16479,579443,PLAYING CARDS KEEP CALM & CARRY ON,0
16479,579427,RETROSPOT HEART HOT WATER BOTTLE,0
16479,579427,GUMBALL COAT RACK,0
16479,579443,HOME SWEET HOME MUG,0
16479,579427,PAPER LANTERN 9 POINT SNOW STAR,0
16479,579427,CLASSIC GLASS COOKIE JAR,0
16479,579427,SET 36 COLOUR PENCILS LOVE LONDON,0
16479,579443,VINTAGE BILLBOARD MUG,0
16479,579427,SET OF 10 LANTERNS FAIRY LIGHT STAR,0
16479,579427,GIRAFFE WOODEN RULER,0
16479,579443,KINGS CHOICE MUG,0
16479,579443,CHILDRENS CUTLERY CIRCUS PARADE,0
16479,579443,REVOLVER WOODEN RULER,0
16479,579427,RABBIT NIGHT LIGHT,0
16479,579443,PLAYING CARDS JUBILEE UNION JACK,0
16479,579443,POPPY'S PLAYHOUSE LIVINGROOM,0
16479,579427,GIANT 50'S CHRISTMAS CRACKER,0
16479,579427,RECIPE BOX RETROSPOT,0
16479,579427,NOEL WOODEN BLOCK LETTERS,0
16479,579427,PAPER LANTERN 9 POINT SNOW STAR,0
16479,579427,REX CASH+CARRY JUMBO SHOPPER,0
16884,573931,ICE CREAM PEN LIP GLOSS,0
16884,573931,RABBIT NIGHT LIGHT,0
16884,574011,REX CASH+CARRY JUMBO SHOPPER,0
16884,574011,NOEL WOODEN BLOCK LETTERS,0
16884,573931,PACKING CHARGE,0
16884,573931,POPCORN HOLDER,0
16884,573931,PLAYING CARDS JUBILEE UNION JACK,0
16884,573931,PICTURE DOMINOES,0
16884,574011,WICKER STAR,0
16884,573931,SET 36 COLOUR PENCILS LOVE LONDON,0
16884,573931,PLAYING CARDS I LOVE LONDON,0
16884,573931,CERAMIC CHERRY CAKE MONEY BANK,0
16884,573931,PAPER CHAIN KIT 50'S CHRISTMAS,0
16884,574011,SET 2 TEA TOWELS I LOVE LONDON,0
16884,573931,ICE CREAM SUNDAE LIP GLOSS,0
16884,574011,HEART OF WICKER LARGE,0
16884,573931,BLUE HARMONICA IN BOX,0
16884,574011,GINGHAM HEART DECORATION,0
16884,573931,TRADTIONAL ALPHABET STAMP SET,0
16884,573931,TRADITIONAL PICK UP STICKS GAME,0
16884,574011,CHRISTMAS RETROSPOT STAR WOOD,0
16884,574011,KEEP CALM BIRTHDAY WRAP,0
16884,574011,CHRISTMAS RETROSPOT TREE WOOD,0
16884,574011,6 GIFT TAGS VINTAGE CHRISTMAS,0
16884,573931,TOTE BAG I LOVE LONDON,0
16884,573931,ICE CREAM BUBBLES,0
17411,568140,TRELLIS COAT RACK,0
17411,578948,SET OF 10 LANTERNS FAIRY LIGHT STAR,0
17411,547511,SET/3 POT PLANT CANDLES,0
17411,568140,EMBOSSED GLASS TEALIGHT HOLDER,0
17411,578948,CLASSIC CHROME BICYCLE BELL,0
17411,547511,RECYCLED ACAPULCO MAT PINK,0
17411,547511,CREAM HEART CARD HOLDER,0
17411,568140,LOVE HOT WATER BOTTLE,0
17411,568140,RECYCLED ACAPULCO MAT GREEN,0
17411,578948,SET OF 10 LED DOLLY LIGHTS,0
17411,547511,SWEETHEART WIRE WALL TIDY,0
17411,547511,CACTI T-LIGHT CANDLES,0
17411,568140,VINTAGE GLASS T-LIGHT HOLDER,0
17411,568140,PAPER LANTERN 9 POINT HOLLY STAR L,0
17411,547511,SET OF 6 T-LIGHTS TOADSTOOLS,0
17411,568140,RAIN PONCHO RETROSPOT,0
17411,578948,CLASSIC BICYCLE CLIPS,0
17411,547511,RECYCLED ACAPULCO MAT LAVENDER,0
17411,568140,HOT WATER BOTTLE KEEP CALM,0
17411,578948,CHILLI LIGHTS,0
17411,547511,HANGING HEART ZINC T-LIGHT HOLDER,0
17411,547511,ASSORTED COLOUR BIRD ORNAMENT,0
17411,568140,15CM CHRISTMAS GLASS BALL 20 LIGHTS,0
17411,547511,WHITE BROCANTE SOAP DISH,0
17411,568140,RECYCLED ACAPULCO MAT BLUE,0
17411,547511,HYACINTH BULB T-LIGHT CANDLES,0
17411,568140,RED  HARMONICA IN BOX,0
17411,547511,BLUE POT PLANT CANDLE,0
17411,568140,HOT WATER BOTTLE I AM SO POORLY,0
17411,568140,SILVER HANGING T-LIGHT HOLDER,0
17411,578948,PACK OF SIX LED TEA LIGHTS,0
17411,578948,RABBIT NIGHT LIGHT,0
17411,578948,TRADTIONAL ALPHABET STAMP SET,0
17411,568140,CARDHOLDER HOLLY WREATH METAL,0
17411,547511,CHILLI LIGHTS,0
17411,578948,BICYCLE PUNCTURE REPAIR KIT,0
17411,547511,VICTORIAN GLASS HANGING T-LIGHT,0
17411,568140,HANGING HEART JAR T-LIGHT HOLDER,0
17411,568140,PAPER LANTERN 5 POINT STAR MOON,0
17411,547511,RECYCLED ACAPULCO MAT TURQUOISE,0
17411,547511,RECYCLED ACAPULCO MAT GREEN,0
17430,574754,HEART WOODEN CHRISTMAS DECORATION,0
17430,574754,IVORY HANGING DECORATION  EGG,0
17430,574754,NATURAL SLATE HEART CHALKBOARD,0
17430,538037,GROW YOUR OWN BASIL IN ENAMEL MUG,0
17430,574754,WHITE HANGING HEART T-LIGHT HOLDER,0
17430,574754,MINI PAINT SET VINTAGE,0
17430,538037,HOMEMADE JAM SCENTED CANDLES,0
17430,574754,ROCKING HORSE RED CHRISTMAS,0
17430,538037,PICNIC BASKET WICKER SMALL,0
17430,538037,COLOUR GLASS. STAR T-LIGHT HOLDER,0
17430,574754,HAND WARMER SCOTTY DOG DESIGN,0
17430,574754,JUMBO BAG PINK POLKADOT,0
17430,574754,6 RIBBONS RUSTIC CHARM,0
17430,538037,12 PENCILS SMALL TUBE SKULL,0
17609,541265,SET OF 3 NOTEBOOKS IN PARCEL,0
17609,573345,LARGE WHITE HEART OF WICKER,0
17609,541265,JUMBO  BAG BAROQUE BLACK WHITE,0
17609,541265,BLUE EASTER EGG HUNT START POST,0
17609,541265,12 PINK HEN+CHICKS IN BASKET,0
17609,568566,IVORY WICKER HEART LARGE,0
17609,573345,SET OF 6 T-LIGHTS SANTA,0
17609,541265,LUNCH BAG SPACEBOY DESIGN,0
17609,573345,NAMASTE SWAGAT INCENSE,0
17609,541265,HEART STRING MEMO HOLDER HANGING,0
17609,568566,COLOUR GLASS. STAR T-LIGHT HOLDER,0
17609,541265,BASKET OF TOADSTOOLS,0
17609,543645,TOY TIDY PINK POLKADOT,0
17609,541265,CHARLOTTE BAG SUKI DESIGN,0
17609,541265,MINI LADLE LOVE HEART RED,0
17609,541265,EASTER DECORATION EGG BUNNY,0
17609,543645,BOTTLE BAG RETROSPOT,0
17609,573345,TRAVEL CARD WALLET KEEP CALM,0
17609,543645,LUNCH BAG CARS BLUE,0
17609,573345,HEART WOODEN CHRISTMAS DECORATION,0
17609,541265,"DECORATION , WOBBLY CHICKEN, METAL",0
17609,573345,VINTAGE BELLS GARLAND,0
17609,541265,Manual,0
17609,573345,TRAVEL CARD WALLET SKULLS,0
17609,568566,HAND WARMER RED LOVE HEART,0
17609,541265,SUKI  SHOULDER BAG,0
17609,541265,TOAST ITS - I LOVE YOU,0
17609,543645,WALL TIDY RETROSPOT,0
17609,568566,WHITE WOOD GARDEN PLANT LADDER,0
17609,573345,CHRISTMAS HANGING TREE WITH BELL,0
17609,541265,ROSE COTTAGE KEEPSAKE BOX,0
17609,573349,SPACEBOY MINI BACKPACK,0
17609,543645,STRAWBERRY   PICNIC BAG,0
17609,568566,PETIT TRAY CHIC,0
17609,573345,ROTATING LEAVES T-LIGHT HOLDER,0
17609,573349,DOLLY GIRL MINI BACKPACK,0
17609,568566,BEADED CRYSTAL HEART BLUE  LARGE,0
17609,573345,PAINTED PINK RABBIT,0
17609,541265,RED HANGING HEART T-LIGHT HOLDER,0
17609,573345,CHRISTMAS METAL POSTCARD WITH BELLS,0
17609,573345,EGG CUP NATURAL CHICKEN,0
17609,573345,HEART T-LIGHT HOLDER WILLIE WINKIE,0
17609,541265,ENGLISH ROSE GARDEN SECATEURS,0
17609,541265,ASS FLORAL PRINT MULTI SCREWDRIVER,0
17609,573345,BOTTLE BAG RETROSPOT,0
17609,573345,EASTER DECORATION EGG BUNNY,0
17609,541265,SET OF SALT AND PEPPER TOADSTOOLS,0
17609,541265,TOAST ITS - HAPPY BIRTHDAY,0
17609,573345,GLITTER HEART DECORATION,0
17609,573349,ASSORTED COLOUR BIRD ORNAMENT,0
17609,573345,LUNCH BAG DOLLY GIRL DESIGN,0
17609,573345,CHRISTMAS MUSICAL ZINC STAR,0
17609,541265,RIBBON REEL HEARTS DESIGN,0
17609,568566,HAND WARMER BABUSHKA DESIGN,0
17609,573345,3 GARDENIA MORRIS BOXED CANDLES,0
17609,541265,PINK HEART RED HANDBAG,0
17609,543645,LUNCH BAG PINK POLKADOT,0
17609,541265,3 HOOK HANGER MAGIC GARDEN,0
17609,573345,JAZZ HEARTS PURSE NOTEBOOK,0
17609,573345,LUNCH BAG PAISLEY PARK,0
17609,541265,RED FLOCK LOVE HEART PHOTO FRAME,0
17609,541265,CHARLOTTE BAG DOLLY GIRL DESIGN,0
17609,541265,MEMO BOARD COTTAGE DESIGN,0
17609,541265,RED HEART SHAPE LOVE BUCKET,0
17609,543645,SET 7 BABUSHKA NESTING BOXES,0
17609,568566,IVORY CHANDELIER T-LIGHT HOLDER,0
17609,541265,MEASURING TAPE BABUSHKA PINK,0
17609,541265,LUNCH BAG  BLACK SKULL.,0
17609,573345,ASS FLORAL PRINT MULTI SCREWDRIVER,0
17609,541265,JUMBO  BAG BAROQUE BLACK WHITE,0
17609,573345,MUSICAL ZINC HEART DECORATION,0
17609,541265,JUMBO BAG STRAWBERRY,0
17609,541265,3 PINK HEN+CHICKS IN BASKET,0
17609,541265,EASTER BUNNY WITH BASKET ON BACK,0
17609,541265,JUMBO BAG TOYS,0
17609,541265,DOORSTOP RETROSPOT HEART,0
17609,573345,WOODEN ADVENT CALENDAR CREAM,0
17609,541265,HEART CALCULATOR,0
17609,573345,REINDEER HEART DECORATION GOLD,0
17609,568566,HOME BUILDING BLOCK WORD,0
17609,541265,LUNCH BOX WITH CUTLERY RETROSPOT,0
17609,573345,IVORY WICKER HEART SMALL,0
17609,573345,15CM CHRISTMAS GLASS BALL 20 LIGHTS,0
17609,543645,LUNCH BAG SUKI  DESIGN,0
17609,573345,WOODEN TREE CHRISTMAS SCANDINAVIAN,0
17609,573345,PAINTED METAL PEARS ASSORTED,0
17609,573345,MADRAS NOTEBOOK MEDIUM,0
17609,573345,LUNCH BAG RED RETROSPOT,0
17609,573345,LUNCH BAG CARS BLUE,0
17609,541265,SET OF 4 ROSE BOTANICAL CANDLES,0
17609,541265,PINK HEART SHAPE PHOTO FRAME,0
17609,543645,RED RETROSPOT SHOPPER BAG,0
17609,543645,LUNCH BAG SUKI  DESIGN,0
17609,573345,PARTY CHARMS 50 PIECES,0
17609,543645,SCANDINAVIAN PAISLEY PICNIC BAG,0
17609,573345,ASS FLORAL PRINT MULTI SCREWDRIVER,0
17609,573345,ROCKING HORSE RED CHRISTMAS,0
17609,541265,SET 3 PAPER VINTAGE CHICK PAPER EGG,0
17609,573345,PENS ASSORTED FUNKY JEWELED,0
17609,541265,RED LOVE HEART SHAPE CUP,0
17609,573345,JUMBO BAG 50'S CHRISTMAS,0
17609,541265,FOUR HOOK  WHITE LOVEBIRDS,0
17609,573345,JUMBO  BAG BAROQUE BLACK WHITE,0
17609,573345,LUNCH BAG SUKI DESIGN,0
17609,541265,WHITE LOVEBIRD LANTERN,0
17609,573345,ROSE 1 WICK MORRIS BOXED CANDLE,0
17609,541265,JUMBO BAG PINK VINTAGE PAISLEY,0
17609,541265,RED KITCHEN SCALES,0
17609,541265,RED RETROSPOT OVEN GLOVE,0
17609,541265,JUMBO BAG TOYS,0
17609,541265,RETROSPOT PADDED SEAT CUSHION,0
17609,568566,IVORY WIRE SWEETHEART LETTER TRAY,0
17609,541265,STRAWBERRY SHOPPER BAG,0
17609,568566,FOUR HOOK  WHITE LOVEBIRDS,0
17609,541265,SET 3 SONG BIRD PAPER EGGS ASSORTED,0
17609,573349,LUNCH BAG ALPHABET DESIGN,0
17609,541265,BUNNY EGG BOX,0
17609,568566,PAPER LANTERN 9 POINT HOLLY STAR L,0
17609,573345,WOODEN HEART CHRISTMAS SCANDINAVIAN,0
17609,541265,GARLAND WOODEN HAPPY EASTER,0
17609,568566,PAPER LANTERN 9 POINT DELUXE STAR,0
17609,541265,STRAWBERRY CHARLOTTE BAG,0
17609,573345,SWEETHEART WIRE WALL TIDY,0
17609,573349,JUMBO BAG ALPHABET,0
17609,541265,5 HOOK HANGER RED MAGIC TOADSTOOL,0
17609,573345,STAR  T-LIGHT HOLDER,0
17609,573345,GLASS STAR FROSTED T-LIGHT HOLDER,0
17609,568566,FLOWERS CHANDELIER T-LIGHT HOLDER,0
17609,541265,CREAM CUPID HEARTS COAT HANGER,0
17609,541265,EASTER DECORATION SITTING BUNNY,0
17609,568566,TRIPLE HOOK ANTIQUE IVORY ROSE,0
17609,541265,HEART OF WICKER SMALL,0
17609,543645,RED RETROSPOT PICNIC BAG,0
17609,573345,TRAVEL CARD WALLET I LOVE LONDON,0
17609,541265,JUMBO STORAGE BAG SUKI,0
17609,541265,SMALL HEART MEASURING SPOONS,0
17609,573345,SET OF 6 NATIVITY MAGNETS,0
17609,573345,HEART DECORATION WITH PEARLS,0
17609,541265,RED ENCHANTED FOREST PLACEMAT,0
17609,573345,MEDIUM CERAMIC TOP STORAGE JAR,0
17609,543645,PINK VINTAGE PAISLEY PICNIC BAG,0
17609,568566,SMALL IVORY HEART WALL ORGANISER,0
17609,543645,JUMBO BAG PINK POLKADOT,0
17609,541265,EDWARDIAN PARASOL RED,0
17609,568566,LETTER HOLDER HOME SWEET HOME,0
17609,541265,EASTER DECORATION EGG BUNNY,0
17609,541265,EASTER BUNNY WREATH,0
17609,541265,CHARLOTTE BAG DOLLY GIRL DESIGN,0
17609,573345,SMALL WHITE HEART OF WICKER,0
17609,573345,JINGLE BELL HEART DECORATION,0
17609,541265,JUMBO BAG OWLS,0
17609,543645,SWEETHEART WIRE WALL TIDY,0
17609,573349,LUNCH BAG APPLE DESIGN,0
17609,573345,IVORY WICKER HEART MEDIUM,0
17609,573345,HEART WREATH DECORATION WITH BELL,0
17609,573345,JUMBO SHOPPER VINTAGE RED PAISLEY,0
17609,568566,LOVE BUILDING BLOCK WORD,0
17609,573345,LUNCH BAG PAISLEY PARK,0
17609,568566,HAND WARMER SCOTTY DOG DESIGN,0
17609,568566,IVORY SWEETHEART WIRE LETTER RACK,0
17609,573345,RED ROCKING HORSE HAND PAINTED,0
17609,573345,WHITE WICKER STAR,0
17609,568566,PAPER LANTERN 9 POINT HOLLY STAR S,0
17609,568566,HAND WARMER OWL DESIGN,0
17609,573345,COSY HOUR CIGAR BOX MATCHES,0
17609,541265,TOY TIDY SPACEBOY,0
17609,573345,SMALL CERAMIC TOP STORAGE JAR,0
17609,568566,LOVEBIRD HANGING DECORATION WHITE,0
17609,541265,CREAM SWEETHEART MINI CHEST,0
17609,573345,TRAVEL CARD WALLET UNION JACK,0
17609,573345,ROSE 3 WICK MORRIS BOX CANDLE,0
17609,541265,RED ENCHANTED FOREST PLACEMAT,0
17609,568566,ASSORTED COLOUR BIRD ORNAMENT,0
17609,543645,LUNCH BAG WOODLAND,0
17609,541265,RETROSPOT HEART HOT WATER BOTTLE,0
17609,573345,HEART DECORATION PAINTED ZINC,0
17609,541265,DECORATION  BUTTERFLY  MAGIC GARDEN,0
17609,543645,LUNCH BAG DOLLY GIRL DESIGN,0
17609,568566,BEADED CHANDELIER T-LIGHT HOLDER,0
17609,573345,Manual,0
17609,541265,HEART OF WICKER LARGE,0
17609,541265,LOVE BUILDING BLOCK WORD,0
17609,541265,RED DRAWER KNOB ACRYLIC EDWARDIAN,0
17609,568566,SWEETHEART WIRE MAGAZINE RACK,0
17609,573345,IVORY WICKER HEART LARGE,0
17609,541265,BLACK ENCHANTED FOREST PLACEMAT,0
17609,573345,LUNCH BAG SPACEBOY DESIGN,0
17609,541265,LUNCH BAG DOLLY GIRL DESIGN,0
17609,573345,PACK 3 BOXES CHRISTMAS PANNETONE,0
17609,573345,4 VANILLA BOTANICAL CANDLES,0
17609,573349,I LOVE LONDON MINI BACKPACK,0
17609,573345,IVORY HANGING DECORATION  HEART,0
17609,541265,RED VICTORIAN FABRIC OVAL BOX,0
17609,568566,WHITE HANGING HEART T-LIGHT HOLDER,0
17609,541265,GREEN EASTER EGG HUNT START POST,0
17609,541265,LARGE HEART MEASURING SPOONS,0
17609,573345,GREEN CHRISTMAS TREE CARD HOLDER,0
17609,541265,PIN CUSHION BABUSHKA RED,0
17609,541265,EASTER BUNNY WITH BASKET ON BACK,0
17609,573345,LAUREL HEART ANTIQUE SILVER,0
17609,573345,PAINTED METAL HEART WITH HOLLY BELL,0
17609,541265,STRING OF STARS CARD HOLDER,0
17609,568566,3 HEARTS HANGING DECORATION RUSTIC,0
17609,541265,CHARLIE + LOLA RED HOT WATER BOTTLE,0
17609,543645,LUNCH BAG RED RETROSPOT,0
17609,541265,SKULL LUNCH BOX WITH CUTLERY,0
17609,573345,PAINTED METAL PEARS ASSORTED,0
17609,541265,YELLOW METAL CHICKEN HEART,0
17609,541265,JUMBO BAG WOODLAND ANIMALS,0
17609,573345,ASS FLORAL PRINT SPIRIT LEVEL,0
17609,541265,EASTER DECORATION HANGING BUNNY,0
17609,573345,CHRISTMAS MUSICAL ZINC TREE,0
17609,541265,EASTER DECORATION SITTING BUNNY,0
17609,568566,IVORY WICKER HEART MEDIUM,0
17609,573345,SWISS CHALET TREE DECORATION,0
17609,573345,REINDEER HEART DECORATION SILVER,0
17609,541265,5 HOOK HANGER MAGIC TOADSTOOL,0
17609,568566,TRIPLE WIRE HOOK IVORY HEART,0
17609,541265,ASS FLORAL PRINT SPIRIT LEVEL,0
17609,541265,JUMBO BAG SCANDINAVIAN PAISLEY,0
17609,541265,WHITE WOOD GARDEN PLANT LADDER,0
17609,568566,SINGLE ANTIQUE ROSE HOOK IVORY,0
17609,573345,ENGLISH ROSE GARDEN SECATEURS,0
17609,541265,PINK METAL CHICKEN HEART,0
17609,573345,TRAVEL CARD WALLET SUKI,0
17609,541265,LUNCH BAG SUKI  DESIGN,0
17609,541265,SET/3 RABBITS FLOWER SKIPPPING ROPE,0
17609,573345,CHRISTMAS HANGING SNOWFLAKE,0
17609,541265,LUNCH BAG WOODLAND,0
17609,568566,HAND WARMER RED RETROSPOT,0
17609,573345,TRAVEL CARD WALLET VINTAGE TICKET,0
17609,541265,RECIPE BOX RETROSPOT,0
17609,543645,FOUR HOOK  WHITE LOVEBIRDS,0
17720,563722,SET OF 3 WOODEN HEART DECORATIONS,0
17720,576056,CHOCOLATE HOT WATER BOTTLE,0
17720,551396,CREAM SWEETHEART MINI CHEST,0
17720,551396,PAPER BUNTING WHITE LACE,0
17720,563722,ASSORTED COLOUR BIRD ORNAMENT,0
17720,576056,15CM CHRISTMAS GLASS BALL 20 LIGHTS,0
17720,563722,FRENCH STYLE EMBOSSED HEART CABINET,0
17720,563722,NATURAL SLATE RECTANGLE CHALKBOARD,0
17720,551396,PAPER CHAIN KIT EMPIRE,0
17720,563722,SET 6 SCHOOL MILK BOTTLES IN CRATE,0
17720,551396,CLASSIC METAL BIRDCAGE PLANT HOLDER,0
17720,563722,HANGING HEART ZINC T-LIGHT HOLDER,0
17720,576056,CLASSIC METAL BIRDCAGE PLANT HOLDER,0
17720,563722,REGENCY CAKESTAND 3 TIER,0
17720,563722,BIRDHOUSE GARDEN MARKER,0
17720,551396,NATURAL SLATE RECTANGLE CHALKBOARD,0
17720,563722,CHRISTMAS STAR WISH LIST CHALKBOARD,0
17720,537469,CHOCOLATE HOT WATER BOTTLE,0
17720,576056,NATURAL SLATE RECTANGLE CHALKBOARD,0
17720,563722,DANISH ROSE BEDSIDE CABINET,0
17720,563722,RETROSPOT WOODEN HEART DECORATION,0
17720,563722,HANGING MINI COLOURED BOTTLES,0
17720,563722,S/4 CACTI CANDLES,0
17720,576056,6 RIBBONS RUSTIC CHARM,0
17720,551396,ENAMEL FLOWER JUG CREAM,0
17720,576056,WALL ART STOP FOR TEA,0
17720,576056,WOODEN HAPPY BIRTHDAY GARLAND,0
17720,563722,CUPBOARD 3 DRAWER MA CAMPAGNE,0
17720,576056,SET OF 3 WOODEN HEART DECORATIONS,0
17720,551396,WOOD BLACK BOARD ANT WHITE FINISH,0
17720,551396,MULTI COLOUR SILVER T-LIGHT HOLDER,0
17720,563722,DAISY GARDEN MARKER,0
17720,551396,FINE WICKER HEART,0
17720,551396,CUPBOARD 3 DRAWER MA CAMPAGNE,0
17720,551396,PACK OF 6 BIRDY GIFT TAGS,0
17720,551396,WHITE METAL LANTERN,0
17720,576056,SET OF 6 T-LIGHTS TOADSTOOLS,0
17720,551396,CHOCOLATE HOT WATER BOTTLE,0
17720,576056,ASSORTED COLOUR BIRD ORNAMENT,0
17720,551396,ASSORTED COLOUR BIRD ORNAMENT,0
17720,563722,HEART T-LIGHT HOLDER WILLIE WINKIE,0
17720,576056,NATURAL HANGING QUILTED HEARTS,0
17720,563722,LOVEBIRD HANGING DECORATION WHITE,0
17720,576056,3 RAFFIA RIBBONS 50'S CHRISTMAS,0
17720,551396,CHEST OF DRAWERS GINGHAM HEART,0
17720,563722,WHITE WOOD GARDEN PLANT LADDER,0
17720,563722,PARISIENNE CURIO CABINET,0
17720,576056,CACTI T-LIGHT CANDLES,0
17720,563722,CACTI T-LIGHT CANDLES,0
17720,551396,HANGING HEART ZINC T-LIGHT HOLDER,0
18121,559424,GAOLERS KEYS DECORATIVE GARDEN,2
18121,559424,VICTORIAN GLASS HANGING T-LIGHT,2
18121,559424,SET 12 KIDS  WHITE CHALK STICKS,2
18121,559424,WAKE UP COCKEREL TILE COASTER,2
18121,559424,HEN HOUSE DECORATION,2
18121,559901,POTTING SHED TEA MUG,2
18121,559424,GARDENERS KNEELING PAD CUP OF TEA,2
18121,559901,GARDENERS KNEELING PAD CUP OF TEA,2
18121,559424,FRIDGE MAGNETS US DINER ASSORTED,2
18121,559424,NATURAL SLATE HEART CHALKBOARD,2
18121,559424,ENAMEL MEASURING JUG CREAM,2
18121,559424,ZINC T-LIGHT HOLDER STARS SMALL,2
18121,559424,ANTIQUE SILVER T-LIGHT GLASS,2
18121,559424,HANGING HEN ON NEST DECORATION,2
18121,559424,HANGING HEART ZINC T-LIGHT HOLDER,2
18121,559424,ANTIQUE GLASS DRESSING TABLE POT,2
18121,559424,FRIDGE MAGNETS LES ENFANTS ASSORTED,2
18121,559424,CITRONELLA CANDLE GARDEN POT,2
18121,559424,FOLKART ZINC HEART CHRISTMAS DEC,2
18121,559424,ASSORTED COLOUR BIRD ORNAMENT,2
18121,559424,ZINC HERB GARDEN CONTAINER,2
18121,559424,POTTING SHED TEA MUG,2
18121,559424,POTTING SHED TEA MUG,2
18121,559424,HEART FILIGREE DOVE LARGE,2
18121,559424,NATURAL SLATE RECTANGLE CHALKBOARD,2
18121,559424,RIBBON REEL STRIPES DESIGN,2
18121,559424,ZINC METAL HEART DECORATION,2
18121,559424,CITRONELLA CANDLE FLOWERPOT,2
18121,559424,LOVE BUILDING BLOCK WORD,2
18121,559424,SLATE TILE NATURAL HANGING,2
18121,559424,ANTIQUE SILVER TEA GLASS ENGRAVED,2
