12833,560264,PICTURE FRAME WOOD TRIPLE PORTRAIT,2
12833,560264,ANTIQUE CREAM CUTLERY CUPBOARD,2
12833,560264,NATURAL SLATE HEART CHALKBOARD,2
12833,560264,PARISIENNE CURIO CABINET,2
12833,560264,CANDLE PLATE LACE WHITE,2
12833,560264,LARGE WHITE HEART OF WICKER,2
12833,560264,WHITE WOOD GARDEN PLANT LADDER,2
12833,560264,WOOD BLACK BOARD ANT WHITE FINISH,2
12833,560264,ANTIQUE SILVER T-LIGHT GLASS,2
12833,560264,FRENCH CARRIAGE LANTERN,2
12833,560264,SET OF 3 BLACK FLYING DUCKS,2
12833,560264,ENCHANTED BIRD COATHANGER 5 HOOK,2
12833,560264,3 HOOK PHOTO SHELF ANTIQUE WHITE,2
12833,560264,SMALL HANGING IVORY/RED WOOD BIRD,2
12833,560264,FROSTED WHITE BASE,2
12833,560264,PHOTO FRAME CORNICE,2
12833,560264,CUPBOARD 3 DRAWER MA CAMPAGNE,2
12833,560264,KEY CABINET MA CAMPAGNE,2
12833,560264,ASSORTED COLOUR BIRD ORNAMENT,2
12833,560264,PARTY BUNTING,2
12833,560264,VICTORIAN  METAL POSTCARD SPRING,2
12833,560264,HEART OF WICKER SMALL,2
12833,560264,PAINTED METAL PEARS ASSORTED,2
12833,560264,TRIPLE PHOTO FRAME CORNICE,2
13373,570273,FELTCRAFT DOLL ROSIE,0
13373,558861,PURPLE DRAWERKNOB ACRYLIC EDWARDIAN,0
13373,545998,ROUND CAKE TIN VINTAGE RED,0
13373,545998,JUMBO BAG RED RETROSPOT,0
13373,545998,FELTCRAFT GIRL NICOLE KIT,0
13373,570273,RED PUDDING SPOON,0
13373,570273,CHOCOLATE HOT WATER BOTTLE,0
13373,545998,HERB MARKER ROSEMARY,0
13373,545998,WHITE WOOD GARDEN PLANT LADDER,0
13373,570273,PLAYING CARDS KEEP CALM & CARRY ON,0
13373,570273,HOT WATER BOTTLE TEA AND SYMPATHY,0
13373,545998,BISCUIT TIN VINTAGE GREEN,0
13373,558861,BLUE VINTAGE SPOT BEAKER,0
13373,570273,RIBBON REEL LACE DESIGN,0
13373,558861,VINTAGE RED TRIM ENAMEL BOWL,0
13373,570273,GREEN CHRISTMAS TREE CARD HOLDER,0
13373,558861,GREEN DRAWER KNOB ACRYLIC EDWARDIAN,0
13373,558861,PINK HORSE SOCK PUPPET,0
13373,558861,VINTAGE RED ENAMEL TRIM JUG,0
13373,570273,VINTAGE RED ENAMEL TRIM PLATE,0
13373,570273,HOT WATER BOTTLE KEEP CALM,0
13373,558861,DOILEY STORAGE TIN,0
13373,545998,RECYCLED ACAPULCO MAT RED,0
13373,545998,MAKE YOUR OWN MONSOON CARD KIT,0
13373,558861,UNION STRIPE WITH FRINGE  HAMMOCK,0
13373,558861,PARTY CHARMS 50 PIECES,0
13373,545998,PINK FLORAL FELTCRAFT SHOULDER BAG,0
13373,545998,FELTCRAFT PRINCESS LOLA DOLL,0
13373,545998,YELLOW FLOWERS FELT HANDBAG KIT,0
13373,570273,SET OF 6 TEA TIME BAKING CASES,0
13373,558861,SET OF 3 WOODEN HEART DECORATIONS,0
13373,545998,PINK DRAWER KNOB ACRYLIC EDWARDIAN,0
13373,570273,VINTAGE DOILY TRAVEL SEWING KIT,0
13373,545998,CAKE STAND LOVEBIRD 2 TIER PINK,0
13373,558861,PINK CREAM FELT CRAFT TRINKET BOX,0
13373,570273,FELTCRAFT PRINCESS CHARLOTTE DOLL,0
13373,545998,CHICK GREY HOT WATER BOTTLE,0
13373,558861,WOOD BLACK BOARD ANT WHITE FINISH,0
13373,570273,VINTAGE CHRISTMAS TABLECLOTH,0
13373,545998,HOT WATER BOTTLE I AM SO POORLY,0
13373,558861,PINK VINTAGE SPOT BEAKER,0
13373,558861,LARGE WHITE HEART OF WICKER,0
13373,570273,WOODEN HEART CHRISTMAS SCANDINAVIAN,0
13373,558861,FELTCRAFT CUSHION RABBIT,0
13373,570273,HOT WATER BOTTLE I AM SO POORLY,0
13373,558861,RECYCLED ACAPULCO MAT RED,0
13373,570273,3 RAFFIA RIBBONS 50'S CHRISTMAS,0
13373,545998,HERB MARKER THYME,0
13373,545998,CLEAR DRAWER KNOB ACRYLIC EDWARDIAN,0
13373,558861,FELTCRAFT GIRL AMELIE KIT,0
13373,558861,PINK DINER WALL CLOCK,0
13373,570273,ASS FLORAL PRINT MULTI SCREWDRIVER,0
13373,545998,HERB MARKER BASIL,0
13373,558861,DRAWER KNOB CRACKLE GLAZE IVORY,0
13373,545998,GREEN DRAWER KNOB ACRYLIC EDWARDIAN,0
13373,545998,JAM JAR WITH PINK LID,0
13373,558861,DRAWER KNOB CRACKLE GLAZE PINK,0
13373,558861,RED RETROSPOT UMBRELLA,0
13373,558861,WHITE SPOT RED CERAMIC DRAWER KNOB,0
13373,570273,SET OF 12 MINI LOAF BAKING CASES,0
13373,545998,PAINTED PINK RABBIT,0
13373,558861,BISCUIT TIN 50'S CHRISTMAS,0
13373,545998,DAISIES  HONEYCOMB GARLAND,0
13373,558861,DRAWER KNOB CERAMIC IVORY,0
13373,545998,SET OF 3 CAKE TINS PANTRY DESIGN,0
13373,558861,DRAWER KNOB CRACKLE GLAZE GREEN,0
13373,570273,RED FLORAL FELTCRAFT SHOULDER BAG,0
13373,545998,JUMBO BAG PINK VINTAGE PAISLEY,0
13373,570273,PINK CREAM FELT CRAFT TRINKET BOX,0
13373,570273,FELTCRAFT CUSHION OWL,0
13373,558861,SET OF 3 WOODEN STOCKING DECORATION,0
13373,545998,BLUE STRIPE CERAMIC DRAWER KNOB,0
13373,558861,SET OF 2 CERAMIC CHRISTMAS REINDEER,0
13373,558861,SET OF 4 KNICK KNACK TINS POPPIES,0
13373,570273,VINTAGE RED ENAMEL TRIM JUG,0
13373,570273,FELTCRAFT GIRL AMELIE KIT,0
13373,558861,RECYCLED ACAPULCO MAT LAVENDER,0
13373,545998,PACK OF 6 BIRDY GIFT TAGS,0
13373,570273,3 RAFFIA RIBBONS VINTAGE CHRISTMAS,0
13373,570273,RED HANGING HEART T-LIGHT HOLDER,0
13373,545998,FELTCRAFT CUSHION BUTTERFLY,0
13373,558861,DRAWER KNOB CERAMIC BLACK,0
13373,545998,HERB MARKER PARSLEY,0
13373,558861,BISCUIT TIN VINTAGE CHRISTMAS,0
13373,570273,SET OF 6 RIBBONS VINTAGE CHRISTMAS,0
13373,558861,BLUE STRIPE CERAMIC DRAWER KNOB,0
13373,570273,SET OF 20 VINTAGE CHRISTMAS NAPKINS,0
13373,570273,MOODY GIRL DOOR HANGER,0
13373,570273,FELTCRAFT DOLL EMILY,0
13373,558861,3 STRIPEY MICE FELTCRAFT,0
13373,558861,VINTAGE RED ENAMEL TRIM MUG,0
13373,570273,BISCUIT TIN 50'S CHRISTMAS,0
13373,545998,RECYCLED ACAPULCO MAT TURQUOISE,0
13373,570273,VINTAGE CHRISTMAS BUNTING,0
13373,545998,BUNNY WOODEN PAINTED WITH BIRD,0
13373,545998,BAKING MOULD EASTER EGG MILK CHOC,0
13373,558861,SET OF 4 KNICK KNACK TINS DOILEY,0
13373,558861,JAM MAKING SET WITH JARS,0
13373,558861,SET OF 2 CERAMIC PAINTED HEARTS,0
13373,558861,VINTAGE SNAP CARDS,0
13373,545998,MEMO BOARD COTTAGE DESIGN,0
13373,570273,VINTAGE DOILY DELUXE SEWING KIT,0
13373,570273,VINTAGE CHRISTMAS STOCKING,0
13373,570273,POPCORN HOLDER,0
13373,570273,WHITE HANGING HEART T-LIGHT HOLDER,0
13373,558861,FLOWER VINE RAFFIA FOOD COVER,0
13373,558861,REGENCY CAKESTAND 3 TIER,0
13373,558861,STRAWBERRY RAFFIA FOOD COVER,0
13373,545998,3 TIER CAKE TIN GREEN AND CREAM,0
13373,545998,RED FLORAL FELTCRAFT SHOULDER BAG,0
13373,545998,PAINTED YELLOW WOODEN DAISY,0
13373,558861,RECYCLED ACAPULCO MAT BLUE,0
13373,558861,FELTCRAFT DOLL EMILY,0
13373,545998,FELTCRAFT BUTTERFLY HEARTS,0
13373,558861,DRAWER KNOB CRACKLE GLAZE BLUE,0
13373,558861,VINTAGE CREAM 3 BASKET CAKE STAND,0
13373,545998,CHOCOLATE HOT WATER BOTTLE,0
13373,558861,POPCORN HOLDER,0
13373,570273,BLUE PUDDING SPOON,0
13373,570273,PAPER CHAIN KIT 50'S CHRISTMAS,0
13373,570273,SPOTTY BUNTING,0
13373,558861,JAM MAKING SET PRINTED,0
13373,570273,CHRISTMAS CRAFT LITTLE FRIENDS,0
13373,545998,SET OF 3 BUTTERFLY COOKIE CUTTERS,0
13373,558861,RECYCLED ACAPULCO MAT TURQUOISE,0
13373,570273,DO NOT TOUCH MY STUFF DOOR HANGER,0
13373,545998,WHITE SPOT RED CERAMIC DRAWER KNOB,0
13373,570273,JAM MAKING SET WITH JARS,0
13373,558861,FELTCRAFT CUSHION OWL,0
13373,558861,RED VINTAGE SPOT BEAKER,0
13373,545998,FELTCRAFT DOLL ROSIE,0
13373,545998,FELTCRAFT CUSHION RABBIT,0
13373,558861,PANTRY MAGNETIC  SHOPPING LIST,0
13373,570273,PAINTED METAL HEART WITH HOLLY BELL,0
13373,570273,SET OF 6 SNACK LOAF BAKING CASES,0
13373,558861,EDWARDIAN PARASOL NATURAL,0
13373,558861,FELTCRAFT BUTTERFLY HEARTS,0
13373,570273,PACK 3 BOXES CHRISTMAS PANNETONE,0
13373,545998,FELTCRAFT GIRL AMELIE KIT,0
13373,558861,FELTCRAFT HAIRBAND PINK AND BLUE,0
13373,558861,FELTCRAFT PRINCESS LOLA DOLL,0
13373,570273,RED STRIPE CERAMIC DRAWER KNOB,0
13373,570273,SET OF 12 FAIRY CAKE BAKING CASES,0
13373,545998,HERB MARKER CHIVES,0
13373,545998,BISCUIT TIN VINTAGE RED,0
13373,570273,RETROSPOT WOODEN HEART DECORATION,0
13373,545998,3 TIER CAKE TIN RED AND CREAM,0
13373,570273,36 FOIL STAR CAKE CASES,0
13373,545998,WHITE SPOT BLUE CERAMIC DRAWER KNOB,0
13373,558861,RED FLORAL FELTCRAFT SHOULDER BAG,0
13373,545998,36 FOIL HEART CAKE CASES,0
13373,570273,CARD HOLDER LOVE BIRD LARGE,0
13373,570273,MISTLETOE HEART WREATH CREAM,0
13373,545998,ROUND CAKE TIN VINTAGE GREEN,0
13373,545998,HERB MARKER MINT,0
13373,570273,LOVE HOT WATER BOTTLE,0
13373,570273,PAPER CHAIN KIT RETROSPOT,0
13373,545998,FELTCRAFT DOLL EMILY,0
13651,573507,BISCUIT TIN VINTAGE RED,0
13651,574546,Bank Charges,0
13651,573507,VINTAGE RED ENAMEL TRIM JUG,0
13651,573507,ROUND CAKE TIN VINTAGE RED,0
13651,573507,PARTY METAL SIGN,0
13651,573507,WHITE SPOT BLUE CERAMIC DRAWER KNOB,0
13923,571413,VICTORIAN SEWING BOX SMALL,0
13923,571413,CARD MOTORBIKE SANTA,0
13923,571413,SET OF 6 T-LIGHTS SANTA,0
13923,571413,BOX OF 6 CHRISTMAS CAKE DECORATIONS,0
13923,571413,METAL SIGN HER DINNER IS SERVED,0
13923,571413,ELEPHANT BIRTHDAY CARD,0
13923,571413,LARGE IVORY HEART WALL ORGANISER,0
13923,571413,SPACEBOY BIRTHDAY CARD,0
13923,571413,SMALL IVORY HEART WALL ORGANISER,0
13923,571413,FRENCH TOILET SIGN BLUE METAL,0
13923,571413,METAL SIGN TAKE IT OR LEAVE IT,0
13923,571413,PICTURE FRAME WOOD TRIPLE PORTRAIT,0
13923,571413,FRENCH BATHROOM SIGN BLUE METAL,0
13923,571413,RING OF ROSES BIRTHDAY CARD,0
13923,571413,FAMILY ALBUM WHITE PICTURE FRAME,0
13923,571413,MAN FLU METAL SIGN,0
13923,571413,METAL SIGN EMPIRE TEA,0
13923,571413,GIN + TONIC DIET METAL SIGN,0
13923,571413,FRENCH KITCHEN SIGN BLUE METAL,0
13923,571413,RAINY LADIES BIRTHDAY CARD,0
13979,568528,VINTAGE CHRISTMAS STOCKING,0
13979,568528,SET OF 4 SANTA PLACE SETTINGS,0
13979,568528,PACK OF 6 COCKTAIL PARASOL STRAWS,0
13979,568528,SET OF 2 CERAMIC CHRISTMAS REINDEER,0
13979,568528,HAND WARMER RED RETROSPOT,0
13979,568528,HAND WARMER SCOTTY DOG DESIGN,0
13979,568528,SPACEBOY MINI BACKPACK,0
13979,568528,SET OF 12 FORK CANDLES,0
13979,568528,RED RETROSPOT WRAP,0
13979,568528,HAND WARMER UNION JACK,0
13979,568528,6 GIFT TAGS VINTAGE CHRISTMAS,0
13979,568528,BLUE POLKADOT WRAP,0
13979,568528,HAND WARMER OWL DESIGN,0
13979,568528,RED SPOT GIFT BAG LARGE,0
13979,568528,HAND WARMER RED LOVE HEART,0
13979,568528,JUMBO BAG VINTAGE CHRISTMAS,0
13979,568528,JUMBO BAG VINTAGE DOILY,0
13979,568528,CHRISTMAS TABLE SILVER CANDLE SPIKE,0
13979,568528,RED RETROSPOT CHARLOTTE BAG,0
13979,568528,DISCO BALL CHRISTMAS DECORATION,0
13979,568528,10 COLOUR SPACEBOY PEN,0
13979,568528,BOX OF 6 MINI VINTAGE CRACKERS,0
13979,568528,CHILDREN'S APRON DOLLY GIRL,0
13979,568528,JUMBO BAG RED RETROSPOT,0
13979,568528,PACK OF 6 LARGE FRUIT STRAWS,0
13979,568528,SET OF 10 LED DOLLY LIGHTS,0
13979,568528,JUMBO BAG VINTAGE LEAF,0
13979,568528,RED SPOT PAPER GIFT BAG,0
13979,568528,SET OF 3 WOODEN HEART DECORATIONS,0
13979,568528,JUMBO BAG PEARS,0
13979,568528,VINTAGE CHRISTMAS PAPER GIFT BAG,0
13979,568528,GREEN CHRISTMAS TREE CARD HOLDER,0
13979,568528,WOODLAND MINI BACKPACK,0
13979,568528,ROLL WRAP VINTAGE CHRISTMAS,0
13979,568528,VINTAGE CHRISTMAS GIFT SACK,0
13979,568528,JUMBO BAG ALPHABET,0
13979,568528,WICKER WREATH LARGE,0
13979,568528,SPACEBOY TV DINNER TRAY,0
13979,568528,SET OF 3 WOODEN TREE DECORATIONS,0
13979,568528,VINTAGE CHRISTMAS GIFT BAG LARGE,0
13979,568528,SET OF 3 WOODEN SLEIGH DECORATIONS,0
13979,568528,COCKTAIL SWORDS 50 PIECES,0
13979,568528,HAND WARMER BIRD DESIGN,0
13979,568528,SET OF 20 VINTAGE CHRISTMAS NAPKINS,0
13979,568528,WRAP COWBOYS,0
13979,568528,LUNCH BAG VINTAGE DOILY,0
13979,568528,ROLL WRAP VINTAGE SPOT,0
13979,568528,JAM MAKING SET WITH JARS,0
13979,568528,JAM MAKING SET PRINTED,0
13979,568528,JUMBO BAG APPLES,0
13979,568528,CHRISTMAS STAR WISH LIST CHALKBOARD,0
13979,568528,WOODLAND BUNNIES LOLLY MAKERS,0
13979,568528,ROTATING SILVER ANGELS T-LIGHT HLDR,0
13979,568528,WRAP  VINTAGE DOILY,0
14223,558992,DOORMAT SPOTTY HOME SWEET HOME,0
14223,547088,DOORMAT RED RETROSPOT,0
14223,566039,PACK OF 60 PINK PAISLEY CAKE CASES,0
14223,558992,SCANDINAVIAN 3 HEARTS NAPKIN RING,0
14223,566039,PACK OF 12 DOLLY GIRL TISSUES,0
14223,547088,GIRLS VINTAGE TIN SEASIDE BUCKET,0
14223,566039,PANTRY HOOK BALLOON WHISK,0
14223,547088,SET OF 6 SPICE TINS PANTRY DESIGN,0
14223,558992,MAGIC DRAWING SLATE PURDEY,0
14223,566039,LETTER HOLDER HOME SWEET HOME,0
14223,558992,SET OF TEA COFFEE SUGAR TINS PANTRY,0
14223,566039,MEMO BOARD COTTAGE DESIGN,0
14223,558992,BAKING SET 9 PIECE RETROSPOT,0
14223,566039,PANTRY 3 HOOK ROLLING PIN HANGER,0
14223,558992,SET OF 3 CAKE TINS PANTRY DESIGN,0
14223,558992,DOORMAT RED RETROSPOT,0
14223,566039,SET OF 3 REGENCY CAKE TINS,0
14223,547088,RED RETROSPOT PUDDING BOWL,0
14223,558992,PACK OF 12 PINK PAISLEY TISSUES,0
14223,566039,TREASURE TIN GYMKHANA DESIGN,0
14223,547088,BOYS VINTAGE TIN SEASIDE BUCKET,0
14223,558992,HOME GARLAND PAINTED ZINC,0
14223,566039,ASSORTED COLOUR MINI CASES,0
14223,558992,TREASURE TIN GYMKHANA DESIGN,0
14223,566039,ENGLISH ROSE NOTEBOOK A7 SIZE,0
14223,558992,SINGLE HEART ZINC T-LIGHT HOLDER,0
14223,566039,KITCHEN METAL SIGN,0
14223,558992,SET OF 36 DOILIES PANTRY DESIGN,0
14223,558992,REGENCY CAKESTAND 3 TIER,0
14223,547088,SET OF 36 PAISLEY FLOWER DOILIES,0
14223,558992,ASSORTED COLOUR MINI CASES,0
14223,566039,SET OF 6 SNACK LOAF BAKING CASES,0
14223,547088,DOORMAT ENGLISH ROSE,0
14223,558992,SET OF 12  VINTAGE POSTCARD SET,0
14223,558992,WASHROOM METAL SIGN,0
14223,558992,HEART OF WICKER SMALL,0
14223,547088,PACK OF 60 PINK PAISLEY CAKE CASES,0
14223,547088,MILK PAN RED RETROSPOT,0
14223,566039,CHILDRENS TOY COOKING UTENSIL SET,0
14223,547088,SET OF 3 CAKE TINS PANTRY DESIGN,0
14223,558992,MULTI COLOUR SILVER T-LIGHT HOLDER,0
14223,558992,ABC TREASURE BOOK BOX,0
14223,547088,DOORMAT NEW ENGLAND,0
14223,547088,ROUND CAKE TIN VINTAGE GREEN,0
14223,566039,RED RETROSPOT MINI CASES,0
14223,566039,PANTRY MAGNETIC  SHOPPING LIST,0
14223,547088,REGENCY CAKESTAND 3 TIER,0
14223,547088,DOORMAT WELCOME PUPPIES,0
14223,566039,OPEN CLOSED METAL SIGN,0
14223,566039,REGENCY CAKESTAND 3 TIER,0
14223,558992,RETROSPOT WOODEN HEART DECORATION,0
14223,566039,PANTRY HOOK SPATULA,0
14223,547088,LAUNDRY 15C METAL SIGN,0
14223,547088,ENAMEL FLOWER JUG CREAM,0
14223,547088,PACK OF 72 RETROSPOT CAKE CASES,0
14223,566039,LAUNDRY 15C METAL SIGN,0
14223,558992,WHITE BROCANTE SOAP DISH,0
14223,547088,WASHROOM METAL SIGN,0
14223,566039,RED RETROSPOT ROUND CAKE TINS,0
14223,566039,BAKING SET 9 PIECE RETROSPOT,0
14440,542277,HOME BUILDING BLOCK WORD,0
14440,568663,DOORMAT FANCY FONT HOME SWEET HOME,0
14440,538014,WOODEN PICTURE FRAME WHITE FINISH,0
14440,542277,WOODEN FRAME ANTIQUE WHITE,0
14440,580108,HOME BUILDING BLOCK WORD,0
14440,568663,WOODEN FRAME ANTIQUE WHITE,0
14440,538014,SET/3 VANILLA SCENTED CANDLE IN BOX,0
14440,573295,STOOL HOME SWEET HOME,0
14440,542277,HANGING HEART ZINC T-LIGHT HOLDER,0
14440,573295,DOORMAT AIRMAIL,0
14440,542277,HEART IVORY TRELLIS LARGE,0
14440,542277,WOODEN PICTURE FRAME WHITE FINISH,0
14440,542277,BATH BUILDING BLOCK WORD,0
14440,573295,DOORMAT FANCY FONT HOME SWEET HOME,0
14440,538014,WOODEN FRAME ANTIQUE WHITE,0
14440,538014,OCEAN SCENT CANDLE IN JEWELLED BOX,0
14440,568663,CHERUB HEART DECORATION SILVER,0
14440,538014,SET/3 ROSE CANDLE IN JEWELLED BOX,0
14440,538014,WOOD 2 DRAWER CABINET WHITE FINISH,0
14440,542277,SINGLE HEART ZINC T-LIGHT HOLDER,0
14440,542277,HEART OF WICKER LARGE,0
14440,542277,PAINTED METAL PEARS ASSORTED,0
14440,580108,WOOD 2 DRAWER CABINET WHITE FINISH,0
14440,580108,WOODEN FRAME ANTIQUE WHITE,0
14440,580108,WOODEN PICTURE FRAME WHITE FINISH,0
14440,568663,NATURAL SLATE HEART CHALKBOARD,0
14440,538014,CREAM SWEETHEART MINI CHEST,0
14440,542277,SET/3 VANILLA SCENTED CANDLE IN BOX,0
14440,538014,WOOD S/3 CABINET ANT WHITE FINISH,0
14440,542277,ASSORTED COLOUR BIRD ORNAMENT,0
14440,538014,HOME BUILDING BLOCK WORD,0
14440,542277,NATURAL SLATE HEART CHALKBOARD,0
14440,568663,HOME SWEET HOME HANGING HEART,0
14440,580108,CHRISTMAS STAR WISH LIST CHALKBOARD,0
14440,580108,LOVE BUILDING BLOCK WORD,0
14440,542277,WHITE HANGING HEART T-LIGHT HOLDER,0
14440,538014,NATURAL SLATE HEART CHALKBOARD,0
14440,568663,FOOT STOOL HOME SWEET HOME,0
14440,538014,SET/3 OCEAN SCENT CANDLE JEWEL BOX,0
14440,568663,WHITE HANGING HEART T-LIGHT HOLDER,0
14440,568663,LOVE BUILDING BLOCK WORD,0
14440,568663,WOODEN PICTURE FRAME WHITE FINISH,0
14440,542277,SET/3 OCEAN SCENT CANDLE JEWEL BOX,0
14440,538014,GRAND CHOCOLATECANDLE,0
14440,538014,HOMEMADE JAM SCENTED CANDLES,0
14440,542277,LOVE BUILDING BLOCK WORD,0
14440,542277,VICTORIAN  METAL POSTCARD SPRING,0
14440,542277,T-LIGHT HOLDER SWEETHEART HANGING,0
14440,580108,PLEASE ONE PERSON METAL SIGN,0
14440,580108,CREAM SWEETHEART MINI CHEST,0
14440,568663,DOORMAT AIRMAIL,0
14440,542277,HEART FILIGREE DOVE LARGE,0
14440,580108,3 DRAWER ANTIQUE WHITE WOOD CABINET,0
14440,573295,FOOT STOOL HOME SWEET HOME,0
14440,568663,STOOL HOME SWEET HOME,0
14710,573364,WICKER WREATH SMALL,0
14710,570653,SMALL APOTHECARY MEASURING JAR,0
14710,577507,PAPER CHAIN KIT 50'S CHRISTMAS,0
14710,573364,RED BABY BUNTING,0
14710,578829,3 RAFFIA RIBBONS 50'S CHRISTMAS,0
14710,570653,DOORMAT RED RETROSPOT,0
14710,570653,FAMILY ALBUM WHITE PICTURE FRAME,0
14710,570653,ANTIQUE SILVER TEA GLASS ENGRAVED,0
14710,573364,ALARM CLOCK BAKELIKE PINK,0
14710,570653,EMBROIDERED RIBBON REEL RUBY,0
14710,570653,JUMBO SHOPPER VINTAGE RED PAISLEY,0
14710,577507,CUPCAKE LACE PAPER SET 6,0
14710,577507,SET OF 10 LED DOLLY LIGHTS,0
14710,577507,SET 12 COLOUR PENCILS DOLLY GIRL,0
14710,570653,MULTI COLOUR SILVER T-LIGHT HOLDER,0
14710,577507,COFFEE MUG APPLES DESIGN,0
14710,570653,PEARL CRYSTAL PUMPKIN T-LIGHT HLDR,0
14710,577507,DOLLY GIRL LUNCH BOX,0
14710,570653,ZINC WIRE SWEETHEART LETTER TRAY,0
14710,570653,WALL ART BICYCLE SAFETY,0
14710,577507,GIRAFFE WOODEN RULER,0
14710,573364,HEART OF WICKER SMALL,0
14710,573364,RABBIT NIGHT LIGHT,0
14710,577507,RED  EGG  SPOON,0
14710,573364,ALARM CLOCK BAKELIKE RED,0
14710,570653,BLUE VICTORIAN FABRIC OVAL BOX,0
14710,570653,IVORY WIRE SWEETHEART LETTER TRAY,0
14710,577507,PINK OWL SOFT TOY,0
14710,577507,SET OF 20 KIDS COOKIE CUTTERS,0
14710,577507,BISCUIT TIN VINTAGE CHRISTMAS,0
14710,577507,SET/10 PINK POLKADOT PARTY CANDLES,0
14710,573364,ASSORTED COLOUR T-LIGHT HOLDER,0
14710,577507,SET OF 12 FORK CANDLES,0
14710,577507,CIRCUS PARADE CHILDRENS EGG CUP,0
14710,577507,FOLDING BUTTERFLY MIRROR HOT PINK,0
14710,577507,SET 12 COLOUR PENCILS LOVE LONDON,0
14710,577507,4 PEAR BOTANICAL DINNER CANDLES,0
14710,577507,SET OF 6 3D KIT CARDS FOR KIDS,0
14710,573364,SET 12 KIDS  WHITE CHALK STICKS,0
14710,570653,FRENCH STYLE STORAGE JAR JAM,0
14710,573364,SET OF 12 FAIRY CAKE BAKING CASES,0
14710,573364,BOX OF 6 MINI 50'S CRACKERS,0
14710,577507,SET 6 SCHOOL MILK BOTTLES IN CRATE,0
14710,578829,FELT EGG COSY WHITE RABBIT,0
14710,578829,HANGING CHICK  YELLOW DECORATION,0
14710,573364,RIBBON REEL STRIPES DESIGN,0
14710,577507,PICTURE DOMINOES,0
14710,570653,FRENCH STYLE STORAGE JAR BONBONS,0
14710,570653,DOORMAT VINTAGE LEAF,0
14710,570653,18PC WOODEN CUTLERY SET DISPOSABLE,0
14710,577507,VINTAGE DOILY JUMBO BAG RED,0
14710,570653,BUNDLE OF 3 ALPHABET EXERCISE BOOKS,0
14710,570653,RED VICTORIAN FABRIC OVAL BOX,0
14710,577507,FELT EGG COSY LADYBIRD,0
14710,577507,PACK OF 20 NAPKINS PANTRY DESIGN,0
14710,578829,FELT FARM ANIMAL RABBIT,0
14710,570653,CLASSIC GLASS COOKIE JAR,0
14710,573364,LARGE WHITE HEART OF WICKER,0
14710,573364,SET OF 6 3D KIT CARDS FOR KIDS,0
14710,573364,WICKER WREATH LARGE,0
14710,573364,SET 6 FOOTBALL CELEBRATION CANDLES,0
14710,570653,POPCORN HOLDER,0
14710,577507,ROUND SNACK BOXES SET OF4 WOODLAND,0
14710,577507,SET OF 4 KNICK KNACK TINS LONDON,0
14710,570653,WALL ART DOG LICENCE,0
14710,577507,SET 12 COLOUR PENCILS DOLLY GIRL,0
14710,577507,SET OF 3 HANGING OWLS OLLIE BEAK,0
14710,573364,PACK OF 6 BIRDY GIFT TAGS,0
14710,577507,QUEENS GUARD COFFEE MUG,0
14710,577507,SET OF 2 CERAMIC PAINTED HEARTS,0
14710,578829,PAINT YOUR OWN EGGS IN CRATE,0
14710,573364,HEART OF WICKER SMALL,0
14710,570653,LUNCH BAG SPACEBOY DESIGN,0
14710,577507,FOLDING BUTTERFLY MIRROR RED,0
14710,577507,SET OF 2 CERAMIC PAINTED HEARTS,0
14710,570653,6PC WOOD PLATE SET DISPOSABLE,0
14710,577507,POPPY'S PLAYHOUSE BEDROOM,0
14710,577507,COSY HOUR CIGAR BOX MATCHES,0
14710,577507,SET OF 3 HEART COOKIE CUTTERS,0
14710,570653,GLASS APOTHECARY BOTTLE TONIC,0
14710,577507,SET OF 4 KNICK KNACK TINS DOILY,0
14710,573364,CHRISTMAS CRAFT TREE TOP ANGEL,0
14710,573364,ASSORTED COLOUR BIRD ORNAMENT,0
14710,573364,SILVER HANGING T-LIGHT HOLDER,0
14710,573364,COSY HOUR CIGAR BOX MATCHES,0
14710,570653,JUMBO  BAG BAROQUE BLACK WHITE,0
14710,577507,PAPER BUNTING PAISLEY PARK,0
14710,578829,BICYCLE PUNCTURE REPAIR KIT,0
14710,573364,TRADITIONAL CHRISTMAS RIBBONS,0
14710,577507,SMALL DOLLY MIX DESIGN ORANGE BOWL,0
14710,578829,EGG CUP HENRIETTA HEN CREAM,0
14710,573364,SET OF 6 CAKE CHOPSTICKS,0
14710,573364,ZINC FOLKART SLEIGH BELLS,0
14710,578829,12 HANGING EGGS HAND PAINTED,0
14710,573364,SOLDIERS EGG CUP,0
14710,577507,BUNDLE OF 3 ALPHABET EXERCISE BOOKS,0
14710,578829,HAND PAINTED HANGING EASTER EGG,0
14710,577507,SET/6 COLLAGE PAPER PLATES,0
14710,577507,SET OF 4 KNICK KNACK TINS POPPIES,0
14710,577507,MINI LIGHTS WOODLAND MUSHROOMS,0
14710,577507,POPPY'S PLAYHOUSE KITCHEN,0
14710,577507,SET OF 3 NOTEBOOKS IN PARCEL,0
14710,578829,HANGING CHICK CREAM DECORATION,0
14710,570653,SMALL CHINESE STYLE SCISSOR,0
14710,577507,RABBIT NIGHT LIGHT,0
14710,573364,SET/10 RED POLKADOT PARTY CANDLES,0
14710,578829,CLASSIC CHROME BICYCLE BELL,0
14710,578829,CLASSIC BICYCLE CLIPS,0
14710,573364,WICKER WREATH SMALL,0
14710,578829,ZINC HEARTS PLANT POT HOLDER,0
14710,578829,TRADTIONAL ALPHABET STAMP SET,0
14710,570653,BUNDLE OF 3 SCHOOL EXERCISE BOOKS,0
14710,577507,SET OF 60 PANTRY DESIGN CAKE CASES,0
14710,578829,WIRE EGG BASKET,0
14710,577507,PINK/WHITE CHRISTMAS TREE 60CM,0
14710,578829,EGG CUP HENRIETTA HEN PINK,0
14710,573364,HEART OF WICKER LARGE,0
14710,577507,DAISY JOURNAL,0
14710,577507,DECORATIVE WICKER HEART LARGE,0
14710,577507,DOLLY GIRL LUNCH BOX,0
14710,577507,BOX OF 6 MINI 50'S CRACKERS,0
14710,578829,BUNNY DECORATION MAGIC GARDEN,0
14710,570653,FRENCH STYLE STORAGE JAR CAFE,0
14710,573364,RETROSPOT WOODEN HEART DECORATION,0
14710,577507,ROCKING HORSE RED CHRISTMAS,0
14710,577507,12 PENCIL SMALL TUBE WOODLAND,0
14710,573364,SET 12 KIDS COLOUR  CHALK STICKS,0
14710,577507,WOODEN STAR CHRISTMAS SCANDINAVIAN,0
14710,570653,PANTRY PASTRY BRUSH,0
14710,573364,JUMBO BAG 50'S CHRISTMAS,0
14710,573364,SCANDINAVIAN REDS RIBBONS,0
14710,573364,ZINC METAL HEART DECORATION,0
14710,573364,6 GIFT TAGS 50'S CHRISTMAS,0
14710,573364,SET OF 4 KNICK KNACK TINS DOILY,0
14710,577507,REVOLVER WOODEN RULER,0
14710,577507,JUMBO BAG 50'S CHRISTMAS,0
15024,575842,WOODEN STAR CHRISTMAS SCANDINAVIAN,1
15024,544151,ASSORTED COLOUR BIRD ORNAMENT,1
15024,563738,DOORMAT UNION FLAG,1
15024,537608,RIBBON REEL LACE DESIGN,1
15024,575842,PLASTERS IN TIN STRONGMAN,1
15024,579605,LARGE WHITE HEART OF WICKER,1
15024,563738,VICTORIAN GLASS HANGING T-LIGHT,1
15024,575842,METAL MERRY CHRISTMAS WREATH,1
15024,579605,3 HEARTS HANGING DECORATION RUSTIC,1
15024,579605,RETROSPOT CIGAR BOX MATCHES,1
15024,570642,EMPIRE GIFT WRAP,1
15024,537608,RED ENCHANTED FOREST PLACEMAT,1
15024,537608,PAPER CHAIN KIT 50'S CHRISTMAS,1
15024,544151,VICTORIAN GLASS HANGING T-LIGHT,1
15024,579605,PLASTERS IN TIN SPACEBOY,1
15024,570634,DECORATIVE WICKER HEART LARGE,1
15024,537608,NATURAL SLATE HEART CHALKBOARD,1
15024,537608,CARD MOTORBIKE SANTA,1
15024,562094,SILVER HANGING T-LIGHT HOLDER,1
15024,562094,VICTORIAN GLASS HANGING T-LIGHT,1
15024,575842,WHITE WOOD GARDEN PLANT LADDER,1
15024,570642,FANCY FONTS BIRTHDAY WRAP,1
15024,544151,CAST IRON HOOK GARDEN TROWEL,1
15024,575842,PAPER CHAIN KIT 50'S CHRISTMAS,1
15024,570642,CARD DOG AND BALL,1
15024,537608,WICKER WREATH SMALL,1
15024,579605,JINGLE BELL HEART DECORATION,1
15024,537608,DOORMAT NEW ENGLAND,1
15024,575842,PAPER CHAIN KIT VINTAGE CHRISTMAS,1
15024,537608,PLASTERS IN TIN STRONGMAN,1
15024,537608,CAST IRON HOOK GARDEN FORK,1
15024,579612,VINTAGE CREAM DOG FOOD CONTAINER,1
15024,537608,SILVER HANGING T-LIGHT HOLDER,1
15024,537608,BLUE 3 PIECE POLKADOT CUTLERY SET,1
15024,544151,LANTERN CREAM GAZEBO,1
15024,563738,DOORMAT WELCOME TO OUR HOME,1
15024,575842,WALL ART BICYCLE SAFETY,1
15024,575842,WOODEN TREE CHRISTMAS SCANDINAVIAN,1
15024,579605,PAPER CHAIN KIT VINTAGE CHRISTMAS,1
15024,537608,WOODEN HEART CHRISTMAS SCANDINAVIAN,1
15024,537608,SLATE TILE NATURAL HANGING,1
15024,537608,IVORY ENCHANTED FOREST PLACEMAT,1
15024,537608,RIBBON REEL STRIPES DESIGN,1
15024,570634,PHOTO FRAME CORNICE,1
15024,537608,ASSORTED COLOUR BIRD ORNAMENT,1
15024,579605,REX CASH+CARRY JUMBO SHOPPER,1
15024,537608,DOORSTOP RETROSPOT HEART,1
15024,575842,COSY HOUR CIGAR BOX MATCHES,1
15024,537608,PAPER CHAIN KIT VINTAGE CHRISTMAS,1
15024,537608,GROW YOUR OWN HERBS SET OF 3,1
15024,575842,ZINC FOLKART SLEIGH BELLS,1
15024,544151,SILVER HANGING T-LIGHT HOLDER,1
15024,563738,DOORMAT SPOTTY HOME SWEET HOME,1
15024,575842,WALL ART CLASSIC PUDDINGS,1
15024,537608,CAST IRON HOOK GARDEN TROWEL,1
15024,544151,CREAM WALL PLANTER HEART SHAPED,1
15024,563738,WHITE HANGING HEART T-LIGHT HOLDER,1
15024,563738,DOORMAT NEW ENGLAND,1
15024,575842,WOODEN STAR CHRISTMAS SCANDINAVIAN,1
15024,537608,FOLKART ZINC HEART CHRISTMAS DEC,1
15024,537608,PLASTERS IN TIN WOODLAND ANIMALS,1
15024,537608,PAPER CHAIN KIT RETROSPOT,1
15024,537608,GREEN 3 PIECE POLKADOT CUTLERY SET,1
15024,575842,CLASSIC CHROME BICYCLE BELL,1
15024,579605,VINTAGE BELLS GARLAND,1
15024,537608,GROW YOUR OWN BASIL IN ENAMEL MUG,1
15024,570634,WOODEN PICTURE FRAME WHITE FINISH,1
15024,575842,ASSORTED COLOUR BIRD ORNAMENT,1
15024,537608,DOORMAT FAIRY CAKE,1
15024,544151,NATURAL SLATE HEART CHALKBOARD,1
15024,537608,ROCKING HORSE RED CHRISTMAS,1
15024,575842,JINGLE BELL HEART ANTIQUE SILVER,1
15024,579605,PAPER CHAIN KIT RETROSPOT,1
15024,563738,CHILDS GARDEN SPADE BLUE,1
15024,575842,WOODEN HEART CHRISTMAS SCANDINAVIAN,1
15024,575842,PLASTERS IN TIN SPACEBOY,1
15024,563738,CHILDS GARDEN RAKE PINK,1
15024,537664,ANTIQUE GLASS HEART DECORATION,1
15024,544151,RIBBON REEL STRIPES DESIGN,1
15024,544151,RIBBON REEL LACE DESIGN,1
15024,537608,DOORMAT UNION FLAG,1
15024,579605,DOORMAT I LOVE LONDON,1
15024,563738,PLASTERS IN TIN SKULLS,1
15024,570634,WALL ART BICYCLE SAFETY,1
15024,537608,HEART OF WICKER LARGE,1
15024,570634,WALL ART VILLAGE SHOW,1
15024,570642,"FANCY FONT BIRTHDAY CARD,",1
15024,537608,PINK 3 PIECE POLKADOT CUTLERY SET,1
15024,579605,HEART OF WICKER SMALL,1
