14702,538168,PACK OF 60 MUSHROOM CAKE CASES,1
14702,571276,BLUE STRIPE CERAMIC DRAWER KNOB,1
14702,545577,SET OF 3 CAKE TINS PANTRY DESIGN,1
14702,563248,PARTY BUNTING,1
14702,542422,RIBBON REEL STRIPES DESIGN,1
14702,567943,EMBROIDERED RIBBON REEL SALLY,1
14702,558636,JAM MAKING SET PRINTED,1
14702,563248,RIBBON REEL LACE DESIGN,1
14702,580135,ANTIQUE SILVER TEA GLASS ENGRAVED,1
14702,571276,BAKING SET SPACEBOY DESIGN,1
14702,545577,BABY BOOM RIBBONS,1
14702,581471,CHRISTMAS CRAFT WHITE FAIRY,1
14702,563248,PACK OF 60 PINK PAISLEY CAKE CASES,1
14702,563248,SPOTTY BUNTING,1
14702,567943,HOME SWEET HOME CUSHION COVER,1
14702,574846,VINTAGE CHRISTMAS BUNTING,1
14702,571276,FELTCRAFT CHRISTMAS FAIRY,1
14702,581471,ZINC SWEETHEART SOAP DISH,1
14702,538168,RIBBON REEL HEARTS DESIGN,1
14702,571276,SET OF 12 FAIRY CAKE BAKING CASES,1
14702,571276,POSTE FRANCE CUSHION COVER,1
14702,571276,BELLE JARDINIERE CUSHION COVER,1
14702,545577,BLUE SPOT CERAMIC DRAWER KNOB,1
14702,559359,18PC WOODEN CUTLERY SET DISPOSABLE,1
14702,581471,CARD MOTORBIKE SANTA,1
14702,540395,BREAD BIN DINER STYLE RED,1
14702,545577,SCANDINAVIAN REDS RIBBONS,1
14702,563248,SET 20 NAPKINS FAIRY CAKES DESIGN,1
14702,567943,LE JARDIN BOTANIQUE CUSHION COVER,1
14702,540395,JAM JAR WITH PINK LID,1
14702,567943,PHOTO FRAME LINEN AND LACE LARGE,1
14702,538168,CHICK GREY HOT WATER BOTTLE,1
14702,559359,BLUE STRIPE CERAMIC DRAWER KNOB,1
14702,544335,JAM MAKING SET PRINTED,1
14702,542422,SET/10 BLUE POLKADOT PARTY CANDLES,1
14702,563248,ZINC HEART LATTICE T-LIGHT HOLDER,1
14702,538168,PAPER CHAIN KIT VINTAGE CHRISTMAS,1
14702,540395,SET OF 6 SPICE TINS PANTRY DESIGN,1
14702,540532,VINTAGE CREAM DOG FOOD CONTAINER,1
14702,545577,JAM MAKING SET WITH JARS,1
14702,569977,WALL ART CLASSIC PUDDINGS,1
14702,581471,HAND WARMER OWL DESIGN,1
14702,538168,RIBBON REEL STRIPES DESIGN,1
14702,571276,LOVE HOT WATER BOTTLE,1
14702,545577,GINGHAM HEART  DOORSTOP RED,1
14702,540532,ENAMEL MEASURING JUG CREAM,1
14702,542422,PINK CANDYSTUFT ARTIFICIAL FLOWER,1
14702,574846,SET OF 3 HANGING OWLS OLLIE BEAK,1
14702,580135,RETROSPOT HEART HOT WATER BOTTLE,1
14702,567943,GINGHAM RECIPE BOOK BOX,1
14702,538168,RIBBON REEL SOCKS AND MITTENS,1
14702,538168,HANGING HEART JAR T-LIGHT HOLDER,1
14702,544335,VINTAGE CREAM DOG FOOD CONTAINER,1
14702,571276,SET OF 2 ROUND TINS DUTCH CHEESE,1
14702,573542,SET OF 3 WOODEN TREE DECORATIONS,1
14702,540395,JAM MAKING SET WITH JARS,1
14702,581471,DOORMAT VINTAGE LEAF,1
14702,538168,RIBBON REEL LACE DESIGN,1
14702,538168,RETROSPOT HEART HOT WATER BOTTLE,1
14702,545577,HANGING HEART JAR T-LIGHT HOLDER,1
14702,573542,WALL ART STOP FOR TEA,1
14702,545577,VINTAGE CREAM CAT FOOD CONTAINER,1
14702,580135,MISTLETOE HEART WREATH GREEN,1
14702,544335,ROMANTIC PINKS RIBBONS,1
14702,545577,6 RIBBONS RUSTIC CHARM,1
14702,563248,HANGING HEART JAR T-LIGHT HOLDER,1
14702,540532,SET OF 3 CAKE TINS SKETCHBOOK,1
14702,538168,PACK OF 60 SPACEBOY CAKE CASES,1
14702,544335,ENAMEL MEASURING JUG CREAM,1
14702,563248,WHITE SPOT BLUE CERAMIC DRAWER KNOB,1
14702,571276,BISCUIT TIN VINTAGE CHRISTMAS,1
14702,538168,ENGLISH ROSE HOT WATER BOTTLE,1
14702,569977,BLACK CHRISTMAS TREE 120CM,1
14702,569977,WALL ART GARDEN HAVEN,1
14702,569977,WALL ART VINTAGE HEART,1
14702,581471,DOORMAT HOME SWEET HOME BLUE,1
14702,573542,CHRISTMAS RETROSPOT TREE WOOD,1
14702,540395,RETROSPOT HEART HOT WATER BOTTLE,1
14702,559359,PEARL CRYSTAL PUMPKIN T-LIGHT HLDR,1
14702,538168,PACK OF 72 RETROSPOT CAKE CASES,1
14702,567943,DRAWER KNOB CRACKLE GLAZE GREEN,1
14702,538168,BIRD HOUSE HOT WATER BOTTLE,1
14702,571276,BISCUIT TIN 50'S CHRISTMAS,1
14702,538168,PAPER CHAIN KIT 50'S CHRISTMAS,1
14702,571276,CHRISTMAS CRAFT WHITE FAIRY,1
14702,581471,GINGHAM HEART  DOORSTOP RED,1
14702,581471,SWEETHEART RECIPE BOOK STAND,1
14702,563248,SET OF 60 PANTRY DESIGN CAKE CASES,1
14702,563248,PACK OF 20 NAPKINS RED APPLES,1
14702,571276,WALL ART GARDEN HAVEN,1
14702,540532,SET OF 6 HERB TINS SKETCHBOOK,1
14702,544335,6 RIBBONS RUSTIC CHARM,1
14702,573542,ZINC BOX SIGN HOME,1
14702,540395,ROUND CAKE TIN VINTAGE GREEN,1
14702,571276,HOT WATER BOTTLE KEEP CALM,1
14702,540395,ROUND CAKE TIN VINTAGE RED,1
14702,574846,NOEL WOODEN BLOCK LETTERS,1
14702,542422,BREAD BIN DINER STYLE IVORY,1
14702,571276,WHITE SPOT RED CERAMIC DRAWER KNOB,1
14702,580135,WALL ART STOP FOR TEA,1
14702,567943,CURIO CABINET LINEN AND LACE,1
14702,569977,WALL ART STOP FOR TEA,1
14702,571276,ZINC FOLKART SLEIGH BELLS,1
14702,573542,ZINC FOLKART SLEIGH BELLS,1
14702,580135,RED WOOLLY HOTTIE WHITE HEART.,1
14702,540395,ENGLISH ROSE HOT WATER BOTTLE,1
14702,542422,HANGING HEART JAR T-LIGHT HOLDER,1
14702,540395,ENAMEL MEASURING JUG CREAM,1
14702,571276,SET OF 6 SNACK LOAF BAKING CASES,1
14702,567943,ZINC BOX SIGN HOME,1
14702,558636,SET OF 60 PANTRY DESIGN CAKE CASES,1
14702,571276,FRENCH BLUE METAL DOOR SIGN 5,1
14702,581471,DOORMAT NEW ENGLAND,1
14702,559359,HANGING HEART JAR T-LIGHT HOLDER,1
14702,538168,SCOTTIE DOG HOT WATER BOTTLE,1
14702,558636,BUTTERFLY CROCHET FOOD COVER,1
14702,563248,FRENCH LAUNDRY SIGN BLUE METAL,1
14702,573542,SILVER STARS TABLE DECORATION,1
14702,573542,HEART WOODEN CHRISTMAS DECORATION,1
14702,540532,SET OF 36 PAISLEY FLOWER DOILIES,1
14702,542422,DOORMAT RED RETROSPOT,1
14702,544335,IVORY KITCHEN SCALES,1
14702,545577,BREAD BIN DINER STYLE MINT,1
14702,563248,BREAD BIN DINER STYLE IVORY,1
14702,571276,RETROSPOT HEART HOT WATER BOTTLE,1
14702,571276,FRENCH BLUE METAL DOOR SIGN 1,1
14702,567943,SET OF 12 FAIRY CAKE BAKING CASES,1
14702,581471,DOORMAT HEARTS,1
14702,571276,RECIPE BOX PANTRY YELLOW DESIGN,1
14702,545577,RIBBON REEL HEARTS DESIGN,1
14702,567943,STOOL HOME SWEET HOME,1
14702,544335,DOG BOWL VINTAGE CREAM,1
14702,558636,WOODEN CROQUET GARDEN SET,1
14702,571276,CHRISTMAS CRAFT LITTLE FRIENDS,1
14702,571276,6 GIFT TAGS VINTAGE CHRISTMAS,1
14702,559359,SET/20 STRAWBERRY PAPER NAPKINS,1
14702,577694,MUSICAL ZINC HEART DECORATION,1
14702,544335,SET OF 6 SPICE TINS PANTRY DESIGN,1
14702,542422,FAMILY PHOTO FRAME CORNICE,1
14702,542422,DOORSTOP RETROSPOT HEART,1
14702,544335,BRIGHT BLUES RIBBONS,1
14702,567943,SET OF 2 TRAYS HOME SWEET HOME,1
14702,574846,BOX OF 6 MINI VINTAGE CRACKERS,1
14702,581471,CARD CHRISTMAS VILLAGE,1
14702,540532,RED KITCHEN SCALES,1
14702,558636,PACK OF 20 NAPKINS RED APPLES,1
14702,581471,IVORY KITCHEN SCALES,1
14702,540395,JAM MAKING SET PRINTED,1
14702,569977,WALL ART VILLAGE SHOW,1
14702,581471,DOORMAT SPOTTY HOME SWEET HOME,1
14702,558636,WHITE SPOT BLUE CERAMIC DRAWER KNOB,1
14702,573542,CHRISTMAS RETROSPOT STAR WOOD,1
14702,580135,SET OF 20 VINTAGE CHRISTMAS NAPKINS,1
14702,540532,SET OF 3 CAKE TINS PANTRY DESIGN,1
14702,563248,PACK OF 20 SPACEBOY NAPKINS,1
14702,558636,SET 20 NAPKINS FAIRY CAKES DESIGN,1
14702,563248,RED STRIPE CERAMIC DRAWER KNOB,1
14702,573542,CHRISTMAS MUSICAL ZINC TREE,1
14702,542422,BREAD BIN DINER STYLE MINT,1
14702,574846,BOX OF 6 MINI 50'S CRACKERS,1
14702,538168,SET 20 NAPKINS FAIRY CAKES DESIGN,1
14702,563248,T-LIGHT HOLDER HANGING LACE,1
14702,538168,CHRISTMAS CRAFT LITTLE FRIENDS,1
14702,559359,SET/20 RED RETROSPOT PAPER NAPKINS,1
14702,580135,CHICK GREY HOT WATER BOTTLE,1
14702,563248,RECYCLED ACAPULCO MAT BLUE,1
14702,580135,SET OF 6 TEA TIME BAKING CASES,1
14702,542422,DOORMAT TOPIARY,1
14702,574846,CHRISTMAS MUSICAL ZINC STAR,1
14702,581471,DOORMAT ENGLISH ROSE,1
14702,538168,SWEETHEART RECIPE BOOK STAND,1
14702,540532,SET OF 36 TEATIME PAPER DOILIES,1
14702,563248,SET/20 STRAWBERRY PAPER NAPKINS,1
14702,571276,WALL ART VILLAGE SHOW,1
14702,577694,CHRISTMAS MUSICAL ZINC STAR,1
14702,577694,VINTAGE CHRISTMAS BUNTING,1
14702,567943,SET OF 6 TEA TIME BAKING CASES,1
14702,573542,SET OF 6 RIBBONS VINTAGE CHRISTMAS,1
14702,581471,HAND WARMER RED LOVE HEART,1
14702,545577,IVORY KITCHEN SCALES,1
14702,559359,COLOUR GLASS T-LIGHT HOLDER HANGING,1
14702,569977,ZINC BOX SIGN HOME,1
14702,571276,CHICK GREY HOT WATER BOTTLE,1
14702,571276,ZINC BOX SIGN HOME,1
14702,577694,PAPER CHAIN KIT 50'S CHRISTMAS,1
14702,563248,PACK OF 72 RETROSPOT CAKE CASES,1
14702,571276,SET OF 12 MINI LOAF BAKING CASES,1
14702,540395,VINTAGE CREAM CAT FOOD CONTAINER,1
14702,538168,60 CAKE CASES VINTAGE CHRISTMAS,1
14702,558636,RECYCLED ACAPULCO MAT RED,1
14702,574846,CHICK GREY HOT WATER BOTTLE,1
14702,580135,SET OF 60 PANTRY DESIGN CAKE CASES,1
14702,563248,LARGE APOTHECARY MEASURING JAR,1
14702,571276,VINTAGE DOILY DELUXE SEWING KIT,1
14702,573542,SET OF 3 HANGING OWLS OLLIE BEAK,1
14702,573542,ZINC  STAR T-LIGHT HOLDER,1
14702,577694,SET OF 3 HANGING OWLS OLLIE BEAK,1
14702,540395,PAPER CHAIN KIT RETROSPOT,1
14702,538168,GLASS  BEURRE DISH,1
14702,544335,SCANDINAVIAN REDS RIBBONS,1
14702,567943,RECYCLED ACAPULCO MAT PINK,1
14702,573542,SILVER BELLS TABLE DECORATION,1
14702,574846,GIANT 50'S CHRISTMAS CRACKER,1
14702,540532,IVORY KITCHEN SCALES,1
14702,563248,TEA TIME PARTY BUNTING,1
14702,563248,6 RIBBONS RUSTIC CHARM,1
14702,571276,CHRISTMAS CRAFT TREE TOP ANGEL,1
14702,567943,EMBROIDERED RIBBON REEL EMILY,1
14702,542422,GINGHAM HEART  DOORSTOP RED,1
14702,573542,CHRISTMAS MUSICAL ZINC STAR,1
14738,552971,POTTERING IN THE SHED METAL SIGN,0
14738,561700,YOU'RE CONFUSING ME METAL SIGN,0
14738,561700,BEWARE OF THE CAT METAL SIGN,0
14738,549842,GIN + TONIC DIET METAL SIGN,0
14738,549842,CHOCOLATE THIS WAY METAL SIGN,0
14738,542382,PLEASE ONE PERSON METAL SIGN,0
14738,549842,PLEASE ONE PERSON METAL SIGN,0
14738,561700,DRAWER KNOB CRACKLE GLAZE IVORY,0
14738,573158,3 RAFFIA RIBBONS 50'S CHRISTMAS,0
14738,569890,COOK WITH WINE METAL SIGN,0
14738,569890,I'M ON HOLIDAY METAL SIGN,0
14738,573158,ROCOCO WALL MIRROR WHITE,0
14738,542382,BLUE DINER WALL CLOCK,0
14738,569890,YOU'RE CONFUSING ME METAL SIGN,0
14738,573158,HOT WATER BOTTLE I AM SO POORLY,0
14738,573158,SCOTTIE DOG HOT WATER BOTTLE,0
14738,573158,HOT WATER BOTTLE TEA AND SYMPATHY,0
14738,542382,SET/6 PINK  BUTTERFLY T-LIGHTS,0
14738,542382,EGG CUP NATURAL CHICKEN,0
14738,561700,GIN + TONIC DIET METAL SIGN,0
14738,552971,PLEASE ONE PERSON METAL SIGN,0
14738,573158,HOT WATER BOTTLE SEX BOMB,0
14738,542382,IVORY DINER WALL CLOCK,0
14738,569890,METAL SIGN TAKE IT OR LEAVE IT,0
14738,552971,WHITE HANGING HEART T-LIGHT HOLDER,0
14738,569890,HAND OVER THE CHOCOLATE   SIGN,0
14738,569890,WOODEN TREE CHRISTMAS SCANDINAVIAN,0
14738,549842,I'M ON HOLIDAY METAL SIGN,0
14738,552971,COOK WITH WINE METAL SIGN,0
14738,542382,RED HANGING HEART T-LIGHT HOLDER,0
14738,554524,TOXIC AREA  DOOR HANGER,0
14738,552971,GIN + TONIC DIET METAL SIGN,0
14738,542382,CACTI T-LIGHT CANDLES,0
14738,561700,METAL SIGN TAKE IT OR LEAVE IT,0
14738,569890,CHOCOLATE HOT WATER BOTTLE,0
14738,549842,RED RETROSPOT UMBRELLA,0
14738,542382,SET OF 6 T-LIGHTS EASTER CHICKS,0
14738,569890,HOT WATER BOTTLE TEA AND SYMPATHY,0
14738,561700,POTTERING IN THE SHED METAL SIGN,0
14738,549842,IVORY GIANT GARDEN THERMOMETER,0
14738,549842,CHOCOLATE HOT WATER BOTTLE,0
14738,573158,CHOCOLATE HOT WATER BOTTLE,0
14738,573158,SET OF 6 RIBBONS VINTAGE CHRISTMAS,0
14738,552971,PARTY METAL SIGN,0
14738,569890,GIN + TONIC DIET METAL SIGN,0
14738,573158,CHRISTMAS LIGHTS 10 REINDEER,0
14738,561700,HAND OVER THE CHOCOLATE   SIGN,0
14738,573158,TRADITIONAL CHRISTMAS RIBBONS,0
14738,569890,WOODEN STAR CHRISTMAS SCANDINAVIAN,0
14738,542382,FAIRY CAKE DESIGN UMBRELLA,0
14738,561700,ASSORTED TUTTI FRUTTI BRACELET,0
14738,569890,PLEASE ONE PERSON METAL SIGN,0
14738,542382,BLACK/BLUE POLKADOT UMBRELLA,0
14738,542382,SET 3 SONG BIRD PAPER EGGS ASSORTED,0
14757,568189,PAINTED METAL PEARS ASSORTED,0
14757,568189,TRIPLE HOOK ANTIQUE IVORY ROSE,0
14757,568189,PHOTO FRAME LINEN AND LACE LARGE,0
14757,568189,GREEN VINTAGE SPOT BEAKER,0
14757,568189,SMALL PARISIENNE HEART PHOTO FRAME,0
14757,568189,PARISIENNE KEY CABINET,0
14757,568189,CLOTHES PEGS RETROSPOT PACK 24,0
14757,568189,WOODEN PICTURE FRAME WHITE FINISH,0
14757,568189,PICTURE FRAME WOOD TRIPLE PORTRAIT,0
14757,568189,RUSTIC MIRROR WITH LACE HEART,0
14757,568189,WOOD 2 DRAWER CABINET WHITE FINISH,0
14757,568189,SHELF WITH 4 HOOKS HOME SWEET HOME,0
14757,568189,LUNCH BAG VINTAGE DOILY,0
14757,568189,ASSORTED COLOUR BIRD ORNAMENT,0
14757,568189,SET 36 COLOURING PENCILS DOILY,0
14757,568189,LUNCH BAG RED RETROSPOT,0
14757,568189,WOODEN FRAME ANTIQUE WHITE,0
14757,568189,PARISIENNE SEWING BOX,0
14757,568189,GREY HEART HOT WATER BOTTLE,0
14973,561654,ASSORTED COLOUR BIRD ORNAMENT,0
14973,561654,VICTORIAN  METAL POSTCARD SPRING,0
14973,561654,FILIGRIS HEART WITH BUTTERFLY,0
14973,564357,ASSORTED COLOUR BIRD ORNAMENT,0
14973,561654,3D HEARTS  HONEYCOMB PAPER GARLAND,0
14973,551393,VINTAGE BLUE KITCHEN CABINET,0
14973,551393,SET OF 36 MUSHROOM PAPER DOILIES,0
14973,561654,REGENCY CAKESTAND 3 TIER,0
14973,561654,PACK OF 20 NAPKINS RED APPLES,0
14973,564357,SET OF 3 BUTTERFLY COOKIE CUTTERS,0
14973,551393,RUSTIC  SEVENTEEN DRAWER SIDEBOARD,0
14973,561654,RED DRAWER KNOB ACRYLIC EDWARDIAN,0
14973,561654,GIN & TONIC DIET GREETING CARD,0
14973,551393,SET OF 36 PAISLEY FLOWER DOILIES,0
14973,564357,RUSTIC  SEVENTEEN DRAWER SIDEBOARD,0
14973,561654,GREEN DRAWER KNOB ACRYLIC EDWARDIAN,0
14973,564357,SWEETHEART WIRE MAGAZINE RACK,0
14973,561654,PINK DRAWER KNOB ACRYLIC EDWARDIAN,0
14973,561654,SWEETHEART WIRE MAGAZINE RACK,0
14973,564357,SET OF 3 HEART COOKIE CUTTERS,0
14973,561654,PURPLE DRAWERKNOB ACRYLIC EDWARDIAN,0
14973,561654,ZINC METAL HEART DECORATION,0
14973,561654,BLUE DRAWER KNOB ACRYLIC EDWARDIAN,0
14973,561654,DANISH ROSE PHOTO FRAME,0
14973,564357,PARISIENNE KEY CABINET,0
14973,564357,3 PIECE SPACEBOY COOKIE CUTTER SET,0
14973,561654,SET 20 NAPKINS FAIRY CAKES DESIGN,0
14973,561654,WHITE WOOD GARDEN PLANT LADDER,0
14973,561654,SET OF 12  VINTAGE POSTCARD SET,0
14973,561654,SET/20 STRAWBERRY PAPER NAPKINS,0
14973,561654,MINIATURE ANTIQUE ROSE HOOK IVORY,0
14973,551393,SET OF 72 PINK HEART PAPER DOILIES,0
15561,559877,FELTCRAFT GIRL AMELIE KIT,0
15561,579096,FOLDING BUTTERFLY MIRROR HOT PINK,0
15561,579096,PLAYING CARDS I LOVE LONDON,0
15561,552263,SPACEBOY BABY GIFT SET,0
15561,552263,GUMBALL MAGAZINE RACK,0
15561,579096,FOLDING BUTTERFLY MIRROR IVORY,0
15561,552263,RED METAL BEACH SPADE,0
15561,579096,PLAYING CARDS JUBILEE UNION JACK,0
15561,552263,LUNCH BAG DOILEY PATTERN,0
15561,559877,WHEELBARROW FOR CHILDREN,0
15561,559877,WOODEN ROUNDERS GARDEN SET,0
15561,552263,DOLLY GIRL BABY GIFT SET,0
15561,559877,"NURSERY A,B,C PAINTED LETTERS",0
15561,559879,MULTICOLOUR 3D BALLS GARLAND,0
15561,552263,LUNCH BAG ALPHABET DESIGN,0
15561,559877,SET 12 KIDS COLOUR  CHALK STICKS,0
15561,552263,BOYS VINTAGE TIN SEASIDE BUCKET,0
15561,579096,SET 36 COLOUR PENCILS LOVE LONDON,0
15561,579096,REVOLVER WOODEN RULER,0
15561,579096,CLASSIC CHROME BICYCLE BELL,0
15561,559877,FELTCRAFT GIRL NICOLE KIT,0
15561,579096,4 TRADITIONAL SPINNING TOPS,0
15561,579096,TRADITIONAL NAUGHTS & CROSSES,0
15561,579096,SET OF 6 RIBBONS PARTY,0
15561,559877,VINTAGE SNAKES & LADDERS,0
15561,579096,TRADTIONAL ALPHABET STAMP SET,0
15561,559877,FELTCRAFT BOY JEAN-PAUL KIT,0
16026,573066,HERB MARKER PARSLEY,0
16026,573066,TRADITIONAL NAUGHTS & CROSSES,0
16026,573066,PLASTERS IN TIN CIRCUS PARADE,0
16026,573066,FLUTED ANTIQUE CANDLE HOLDER,0
16026,573066,ASSORTED COLOUR T-LIGHT HOLDER,0
16026,573066,RED  HARMONICA IN BOX,0
16026,573066,FIRST AID TIN,0
16026,573066,SEWING SUSAN 21 NEEDLE SET,0
16026,573066,TREASURE ISLAND BOOK BOX,0
16026,573066,CHILDS GARDEN FORK PINK,0
16026,573066,EMERGENCY FIRST AID TIN,0
16026,573066,CHILDS GARDEN FORK BLUE,0
16026,573066,HERB MARKER MINT,0
16026,573066,MINI JIGSAW DOLLY GIRL,0
16026,573066,FIRST AID TIN,0
16026,573066,MINI JIGSAW PURDEY,0
16026,573066,BLUE HARMONICA IN BOX,0
16026,573066,SET OF 9 HEART SHAPED BALLOONS,0
16026,573066,HERB MARKER ROSEMARY,0
16026,573066,HERB MARKER CHIVES,0
16026,573066,VINTAGE  2 METRE FOLDING RULER,0
16026,573066,MAGIC TREE -PAPER FLOWERS,0
16026,573066,TRADITIONAL PICK UP STICKS GAME,0
16026,573066,PLASTERS IN TIN STRONGMAN,0
16026,573066,TRAVEL SEWING KIT,0
16026,573066,HERB MARKER BASIL,0
16026,573066,GYMKHANA TREASURE BOOK BOX,0
16026,573066,BALLOON PUMP WITH 10 BALLOONS,0
16026,573066,BLUE HARMONICA IN BOX,0
16026,573066,HERB MARKER THYME,0
16026,573066,GENTLEMAN SHIRT REPAIR KIT,0
16026,573066,VINTAGE DOILY TRAVEL SEWING KIT,0
16325,559313,POTTING SHED TEA MUG,0
16325,572320,PAPER CHAIN KIT 50'S CHRISTMAS,0
16325,559313,SMALL RED RETROSPOT MUG IN BOX,0
16325,572320,ASSORTED COLOUR BIRD ORNAMENT,0
16325,549310,STRIPEY CHOCOLATE NESTING BOXES,0
16325,572320,MEDIUM CERAMIC TOP STORAGE JAR,0
16325,549310,PAPER CHAIN KIT EMPIRE,0
16325,549310,GLASS JAR ENGLISH CONFECTIONERY,0
16325,559313,WOODEN UNION JACK BUNTING,0
16325,549310,WOODEN UNION JACK BUNTING,0
16325,572320,PAPER CHAIN KIT VINTAGE CHRISTMAS,0
16325,559313,RED METAL BOX TOP SECRET,0
16325,559313,SPOTTY BUNTING,0
16325,559313,FIVE HEART HANGING DECORATION,0
16325,549310,ASSORTED COLOUR BIRD ORNAMENT,0
16325,572320,GLASS JAR ENGLISH CONFECTIONERY,0
16325,559313,GLASS JAR ENGLISH CONFECTIONERY,0
16325,559313,VINTAGE UNION JACK BUNTING,0
16344,558894,ENAMEL FLOWER JUG CREAM,2
16344,558894,ENAMEL FLOWER JUG CREAM,2
16758,569685,36 DOILIES VINTAGE CHRISTMAS,0
16758,569685,BOX OF 6 MINI 50'S CRACKERS,0
16758,569685,RIBBON REEL MAKING SNOWMEN,0
16758,569685,RED  HARMONICA IN BOX,0
16758,569685,3 TIER CAKE TIN RED AND CREAM,0
16758,569685,BLUE HARMONICA IN BOX,0
16758,569685,VINTAGE CHRISTMAS CAKE FRILL,0
16758,569685,MOTHER'S KITCHEN SPOON REST,0
16758,569685,WHITE WOOD GARDEN PLANT LADDER,0
16758,569685,VINTAGE CHRISTMAS PAPER GIFT BAG,0
16758,569685,6 GIFT TAGS VINTAGE CHRISTMAS,0
16758,569685,VINTAGE CHRISTMAS TABLECLOTH,0
16758,569685,RIBBON REEL SNOWY VILLAGE,0
16758,569685,SET OF 6 SPICE TINS PANTRY DESIGN,0
16758,569685,ROLL WRAP VINTAGE CHRISTMAS,0
16758,569685,3 TIER CAKE TIN GREEN AND CREAM,0
16758,569685,RED RETROSPOT PEG BAG,0
16758,569685,RIBBON REEL CHRISTMAS SOCK BAUBLE,0
16758,569685,SET OF 20 VINTAGE CHRISTMAS NAPKINS,0
16758,569685,JUMBO BAG VINTAGE CHRISTMAS,0
16758,569685,BOX OF 6 MINI VINTAGE CRACKERS,0
16758,569685,SET OF 3 CAKE TINS PANTRY DESIGN,0
17250,580877,DRAWER KNOB CRACKLE GLAZE PINK,0
17250,580877,HOME SWEET HOME BOTTLE,0
17250,580877,T-LIGHT HOLDER HANGING LOVE BIRD,0
17250,580877,BLUE SPOT CERAMIC DRAWER KNOB,0
17250,580877,DAISY SKETCHBOOK,0
17250,547556,WHITE HANGING HEART T-LIGHT HOLDER,0
17250,547556,SWEETHEART CREAM STEEL TABLE RECT,0
17250,547556,HANGING CHICK  YELLOW DECORATION,0
17250,580877,CLEAR DRAWER KNOB ACRYLIC EDWARDIAN,0
17250,547556,S/12 MINI RABBIT EASTER,0
17250,547556,LAVENDER INCENSE IN TIN,0
17250,580877,SET OF 4 KNICK KNACK TINS DOILY,0
17250,580877,MONSTERS STENCIL CRAFT,0
17250,580877,PARTY INVITES DINOSAURS,0
17250,580877,12 PENCIL SMALL TUBE WOODLAND,0
17250,580877,PACK OF 6 HANDBAG GIFT BOXES,0
17250,547556,PARTY BUNTING,0
17250,580877,REGENCY CAKESTAND 3 TIER,0
17250,547556,RETROSPOT TEA SET CERAMIC 11 PC,0
17250,547556,VANILLA SCENT CANDLE JEWELLED BOX,0
17250,580877,BOTANICAL LAVENDER GIFT WRAP,0
17250,580877,CHRISTMAS HANGING STAR WITH BELL,0
17250,580877,SET 36 COLOUR PENCILS SPACEBOY,0
17250,547556,CREAM CUPID HEARTS COAT HANGER,0
17250,547556,CREAM HEART CARD HOLDER,0
17250,580877,WOODEN STAR CHRISTMAS SCANDINAVIAN,0
17250,547556,VANILLA INCENSE IN TIN,0
17250,580877,SET OF 3 HANGING OWLS OLLIE BEAK,0
17250,580877,VINTAGE DOILY TRAVEL SEWING KIT,0
17250,580877,PHOTO FRAME 3 CLASSIC HANGING,0
17250,580877,DRAWER KNOB CERAMIC IVORY,0
17250,547556,ROMANTIC IMAGES SCRAP BOOK SET,0
17250,547556,DINOSAURS  WRITING SET,0
17250,580877,LAVENDER TOILETTE BOTTLE,0
17250,547556,PACK OF 12 STICKY BUNNIES,0
17250,580877,HOT WATER BOTTLE I AM SO POORLY,0
17250,547556,EASTER DECORATION HANGING BUNNY,0
17250,547556,JUMBO BAG CHARLIE AND LOLA TOYS,0
17250,580877,WHITE ROCKING HORSE HAND PAINTED,0
17250,547556,DAIRY MAID LARGE MILK JUG,0
17250,580877,BISCUIT TIN 50'S CHRISTMAS,0
17250,547556,10 COLOUR SPACEBOY PEN,0
17250,580877,RED FLOWER CROCHET FOOD COVER,0
17250,580877,WHITE SPOT BLUE CERAMIC DRAWER KNOB,0
17250,580877,BLUE HARMONICA IN BOX,0
17250,547556,ASSORTED COLOUR SILK GLASSES CASE,0
17250,580877,HAPPY STENCIL CRAFT,0
17250,580877,DRAWER KNOB CRACKLE GLAZE GREEN,0
17250,547556,APRON MODERN VINTAGE COTTON,0
17250,580877,ROTATING SILVER ANGELS T-LIGHT HLDR,0
17250,547556,HANGING MEDINA LANTERN SMALL,0
17250,580877,12 PENCIL SMALL TUBE WOODLAND,0
17250,580877,VINTAGE UNION JACK BUNTING,0
17250,580877,BATH BUILDING BLOCK WORD,0
17250,547556,BALLOONS  WRITING SET,0
17250,547556,SKULLS WRITING SET,0
17491,547569,SET OF 3 CAKE TINS PANTRY DESIGN,1
17491,574169,ROUND CAKE TIN VINTAGE RED,1
17491,547569,MULTICOLOUR 3D BALLS GARLAND,1
17491,541473,SET OF 3 BUTTERFLY COOKIE CUTTERS,1
17491,537592,PACK OF 6 BIRDY GIFT TAGS,1
17491,574169,JUMBO BAG 50'S CHRISTMAS,1
17491,547569,HANGING CHICK  YELLOW DECORATION,1
17491,541473,FRENCH ENAMEL POT W LID,1
17491,565515,VINTAGE CHRISTMAS GIFT SACK,1
17491,561807,BLUE VINTAGE SPOT BEAKER,1
17491,581436,"KEY FOB , BACK DOOR",1
17491,561807,WOODLAND  HEIGHT CHART STICKERS,1
17491,541473,GLITTER HANGING BUTTERFLY STRING,1
17491,537592,ASSORTED COLOUR BIRD ORNAMENT,1
17491,547569,WOODEN ROUNDERS GARDEN SET,1
17491,537592,PAPER BUNTING WHITE LACE,1
17491,578807,PACK OF 6 BIRDY GIFT TAGS,1
17491,547569,MULTI COLOUR SILVER T-LIGHT HOLDER,1
17491,581436,"KEY FOB , SHED",1
17491,574169,PACK OF SIX LED TEA LIGHTS,1
17491,556084,MULTI COLOUR SILVER T-LIGHT HOLDER,1
17491,556084,WOODEN CROQUET GARDEN SET,1
17491,565515,JUMBO BAG PEARS,1
17491,578807,JINGLE BELL HEART ANTIQUE SILVER,1
17491,581436,GARAGE KEY FOB,1
17491,565515,JUMBO BAG 50'S CHRISTMAS,1
17491,581436,ALARM CLOCK BAKELIKE GREEN,1
17491,547569,MOROCCAN TEA GLASS,1
17491,565515,DOORMAT HOME SWEET HOME BLUE,1
17491,565515,FANCY FONTS BIRTHDAY WRAP,1
17491,568317,DOORMAT MERRY CHRISTMAS RED,1
17491,581436,SMALL GLASS HEART TRINKET POT,1
17491,541473,EASTER TIN BUCKET,1
17491,565515,CLASSIC GLASS COOKIE JAR,1
17491,537592,"KEY FOB , BACK DOOR",1
17491,574169,JUMBO BAG VINTAGE CHRISTMAS,1
17491,578807,JUMBO BAG VINTAGE CHRISTMAS,1
17491,581436,PAPER CHAIN KIT 50'S CHRISTMAS,1
17491,547569,PINK POLKADOT WRAP,1
17491,581436,PAPER BUNTING WHITE LACE,1
17491,541473,SET OF 9 HEART SHAPED BALLOONS,1
17491,547569,EASTER TREE YELLOW BIRDS,1
17491,568317,JINGLE BELL HEART ANTIQUE SILVER,1
17491,561807,FRENCH WC SIGN BLUE METAL,1
17491,561807,RED VINTAGE SPOT BEAKER,1
17491,578807,VINTAGE DOILY JUMBO BAG RED,1
17491,568317,PACK OF 6 BIRDY GIFT TAGS,1
17491,561807,ROUND CAKE TIN VINTAGE RED,1
17491,547569,YELLOW METAL CHICKEN HEART,1
17491,568317,HOME SWEET HOME CUSHION COVER,1
17491,581436,FRENCH KITCHEN SIGN BLUE METAL,1
17491,581436,ROUND CAKE TIN VINTAGE RED,1
17491,568317,RED WOOLLY HOTTIE WHITE HEART.,1
17491,547569,BLUE POLKADOT WRAP,1
17491,574169,PAPER CHAIN KIT 50'S CHRISTMAS,1
17491,547569,BIRD DECORATION GREEN POLKADOT,1
17491,581436,ALARM CLOCK BAKELIKE RED,1
17491,556084,CLASSIC GLASS COOKIE JAR,1
17491,565515,JUMBO BAG VINTAGE CHRISTMAS,1
17491,565515,LOVE HOT WATER BOTTLE,1
17491,537592,"KEY FOB , SHED",1
17491,561807,BREAD BIN DINER STYLE RED,1
17491,568317,BREAD BIN DINER STYLE RED,1
17491,561807,JUMBO BAG DOILEY PATTERNS,1
17491,568317,LOVE HOT WATER BOTTLE,1
17491,541473,"KEY FOB , GARAGE DESIGN",1
17491,547569,"DECORATION , WOBBLY CHICKEN, METAL",1
17491,574169,JUMBO BAG VINTAGE DOILY,1
17491,565515,JUMBO BAG VINTAGE DOILY,1
17491,574169,ASSORTED COLOUR BIRD ORNAMENT,1
17491,561807,FRENCH LAUNDRY SIGN BLUE METAL,1
17491,547569,BIRD DECORATION RED RETROSPOT,1
17491,561807,VINTAGE CHRISTMAS GIFT SACK,1
17491,541473,ANTIQUE SILVER TEA GLASS ETCHED,1
17491,581436,"KEY FOB , FRONT  DOOR",1
17491,547569,FRENCH WC SIGN BLUE METAL,1
17491,565515,SET OF 4 KNICK KNACK TINS DOILY,1
17491,568317,DOORMAT HEARTS,1
17491,581436,MULTI COLOUR SILVER T-LIGHT HOLDER,1
17491,561807,SET OF 4 KNICK KNACK TINS DOILEY,1
17491,547569,SET 3 SONG BIRD PAPER EGGS ASSORTED,1
17491,561807,SPOTTY BUNTING,1
17491,541473,"KEY FOB , FRONT  DOOR",1
17491,556084,SPOTTY BUNTING,1
17491,547569,FRENCH BATHROOM SIGN BLUE METAL,1
17491,556084,WOODEN ROUNDERS GARDEN SET,1
17491,578807,JUMBO BAG PEARS,1
17491,547569,WRAP DOILEY DESIGN,1
17491,561807,SET OF 3 REGENCY CAKE TINS,1
17491,565515,HOT WATER BOTTLE KEEP CALM,1
17491,561807,BLACK/BLUE POLKADOT UMBRELLA,1
17491,565515,WRAP  VINTAGE DOILY,1
17491,568317,CHICK GREY HOT WATER BOTTLE,1
17491,581436,IVORY RETRO KITCHEN WALL CLOCK,1
17491,547569,PAPER CHAIN KIT RETROSPOT,1
17491,561807,REGENCY CAKE SLICE,1
17491,561807,RED RETROSPOT UMBRELLA,1
17491,561807,PAPER CHAIN KIT 50'S CHRISTMAS,1
17491,561807,RED BABY BUNTING,1
17491,565515,PAPER CHAIN KIT 50'S CHRISTMAS,1
17491,574169,SET OF 3 CAKE TINS PANTRY DESIGN,1
17491,547569,GARLAND WOODEN HAPPY EASTER,1
17491,574169,JUMBO BAG PEARS,1
17491,547569,FRENCH ENAMEL POT W LID,1
17491,578807,JUMBO BAG 50'S CHRISTMAS,1
17491,581436,LARGE ROUND WICKER PLATTER,1
17491,581436,FRENCH BATHROOM SIGN BLUE METAL,1
17491,565515,WRAP RED VINTAGE DOILY,1
17491,568317,HOT WATER BOTTLE KEEP CALM,1
17515,542121,AREA PATROLLED METAL SIGN,0
17515,553515,TWO DOOR CURIO CABINET,0
17515,553515,COOK WITH WINE METAL SIGN,0
17515,553515,FRENCH ENAMEL POT W LID,0
17515,553515,IVORY WIRE KITCHEN ORGANISER,0
17515,542121,FRENCH BLUE METAL DOOR SIGN 9,0
17515,542121,FRENCH BLUE METAL DOOR SIGN 2,0
17515,546771,FRENCH BLUE METAL DOOR SIGN 5,0
17515,546771,STEEL SWEETHEART ROUND TABLE CREAM,0
17515,542121,CREAM SWEETHEART MINI CHEST,0
17515,553515,AREA PATROLLED METAL SIGN,0
17515,575090,BEWARE OF THE CAT METAL SIGN,0
17515,546771,FRENCH BLUE METAL DOOR SIGN 8,0
17515,553515,MAN FLU METAL SIGN,0
17515,542121,WOOD BLACK BOARD ANT WHITE FINISH,0
17515,553515,FRENCH BLUE METAL DOOR SIGN 6,0
17515,542121,CUPBOARD 3 DRAWER MA CAMPAGNE,0
17515,542121,FRENCH TOILET SIGN BLUE METAL,0
17515,542121,MAN FLU METAL SIGN,0
17515,546771,TWO DOOR CURIO CABINET,0
17515,553515,I'M ON HOLIDAY METAL SIGN,0
17515,542121,FRENCH BLUE METAL DOOR SIGN 3,0
17515,546771,FRENCH BLUE METAL DOOR SIGN 1,0
