17321,569261,LARGE RED BABUSHKA NOTEBOOK,0
17321,569261,ASSORTED COLOURS SILK FAN,0
17321,569261,NATURAL HANGING QUILTED HEARTS,0
17321,569261,PINK VINTAGE SPOT BEAKER,0
17321,569261,WATERING CAN PINK BUNNY,0
17321,569261,WRAP CHRISTMAS VILLAGE,0
17321,569261,ALARM CLOCK BAKELIKE PINK,0
17321,569261,TOADSTOOL BEDSIDE LIGHT,0
17321,569261,PLAYING CARDS VINTAGE DOILY,0
17321,569261,SIX DRAWER OFFICE TIDY,0
17321,569261,GIRAFFE WOODEN RULER,0
17321,569261,GREEN CHRISTMAS TREE CARD HOLDER,0
17321,569261,BLUE GIANT GARDEN THERMOMETER,0
17321,569261,GARDENERS KNEELING PAD KEEP CALM,0
17321,569261,FELTCRAFT HAIRBANDS PINK AND WHITE,0
17321,569261,ASSORTED COLOUR MINI CASES,0
17321,569261,WHITE GOOSE FEATHER CHRISTMAS TREE,0
17321,569261,SWEETHEART BIRD HOUSE,0
17321,569261,WOODLAND MINI BACKPACK,0
17321,569261,REX CASH+CARRY JUMBO SHOPPER,0
17321,569261,BUBBLEGUM RING ASSORTED,0
17321,569261,HEART OF WICKER SMALL,0
17321,569261,JUMBO BAG VINTAGE CHRISTMAS,0
17321,569261,GYMKHANA TREASURE BOOK BOX,0
17321,569261,WHITE GOOSE FEATHER TREE 60CM,0
17321,569261,FELTCRAFT HAIRBAND PINK AND BLUE,0
17321,569261,LARGE PURPLE BABUSHKA NOTEBOOK,0
17321,569261,ROTATING SILVER ANGELS T-LIGHT HLDR,0
17321,569261,REVOLVER WOODEN RULER,0
17321,569261,PLAYING CARDS I LOVE LONDON,0
17321,569261,PARTY PIZZA DISH BLUE POLKADOT,0
17321,569261,MAGIC SHEEP WOOL GROWING FROM PAPER,0
17321,569261,MAGIC TREE -PAPER FLOWERS,0
17321,569261,PLASTERS IN TIN STRONGMAN,0
17321,569261,SET 36 COLOUR PENCILS LOVE LONDON,0
17321,569261,4 TRADITIONAL SPINNING TOPS,0
17321,569261,STRAWBERRY BATH SPONGE,0
17321,569261,FELTCRAFT HAIRBAND RED AND BLUE,0
17321,569261,ICE CREAM SUNDAE LIP GLOSS,0
17321,569261,FOLDING BUTTERFLY MIRROR HOT PINK,0
17321,569261,RED METAL BOX TOP SECRET,0
17321,569261,15CM CHRISTMAS GLASS BALL 20 LIGHTS,0
17321,569261,TRADITIONAL MODELLING CLAY,0
17481,565795,VINTAGE HEADS AND TAILS CARD GAME,0
17481,580891,SMALL PURPLE BABUSHKA NOTEBOOK,0
17481,578335,MAGIC DRAWING SLATE CIRCUS PARADE,0
17481,578335,SET OF 6 SOLDIER SKITTLES,0
17481,578335,LARGE WHITE HONEYCOMB PAPER BELL,0
17481,574306,JAZZ HEARTS PURSE NOTEBOOK,0
17481,574306,JAM MAKING SET PRINTED,0
17481,574306,WALL ART CLASSIC PUDDINGS,0
17481,574306,SET OF 20 VINTAGE CHRISTMAS NAPKINS,0
17481,580891,RETROSPOT CANDLE  LARGE,0
17481,565795,SWALLOWS GREETING CARD,0
17481,580891,RETROSPOT CANDLE  MEDIUM,0
17481,565795,MEMO BOARD RETROSPOT  DESIGN,0
17481,574306,RED RETROSPOT SMALL MILK JUG,0
17481,574306,WOODEN STAR CHRISTMAS SCANDINAVIAN,0
17481,565795,LA JARDIN BOTANIQUE CUSHION COVER,0
17481,565795,36 PENCILS TUBE RED RETROSPOT,0
17481,574306,STAR DECORATION PAINTED ZINC,0
17481,578335,12 PENCILS SMALL TUBE RED RETROSPOT,0
17481,578335,ANTIQUE ALL GLASS CANDLESTICK,0
17481,580891,SET OF 20 VINTAGE CHRISTMAS NAPKINS,0
17481,574306,PAPER CHAIN KIT 50'S CHRISTMAS,0
17481,578335,CINNAMON SCENTED VOTIVE CANDLE,0
17481,580891,RED KITCHEN SCALES,0
17481,578335,VINTAGE CHRISTMAS PAPER GIFT BAG,0
17481,574306,SET/20 RED RETROSPOT PAPER NAPKINS,0
17481,578335,VINTAGE CHRISTMAS STOCKING,0
17481,565795,RETROSPOT TEA SET CERAMIC 11 PC,0
17481,580891,ROLL WRAP VINTAGE SPOT,0
17481,578335,GIN AND TONIC MUG,0
17481,578335,WHITE WICKER STAR,0
17481,565795,SET OF 2 TRAYS HOME SWEET HOME,0
17481,574306,RETROSPOT TEA SET CERAMIC 11 PC,0
17481,580891,A PRETTY THANK YOU CARD,0
17481,580891,JOY WOODEN BLOCK LETTERS,0
17481,565795,JAM MAKING SET PRINTED,0
17481,565795,BAKING SET 9 PIECE RETROSPOT,0
17481,580891,PEACE WOODEN BLOCK LETTERS,0
17481,578335,PAPER LANTERN 9 POINT SNOW STAR,0
17481,574306,PICTURE DOMINOES,0
17481,565795,POLYESTER FILLER PAD 45x45cm,0
17481,574306,WOODEN HEART CHRISTMAS SCANDINAVIAN,0
17481,574306,RED STAR CARD HOLDER,0
17481,565795,BATHROOM METAL SIGN,0
17481,578335,RETROSPOT TEA SET CERAMIC 11 PC,0
17481,578335,GARDENERS KNEELING PAD KEEP CALM,0
17481,574306,RED KITCHEN SCALES,0
17481,574306,WALL ART BIG LOVE,0
17481,574306,CHRISTMAS TREE PAINTED ZINC,0
17481,578335,RECIPE BOX RETROSPOT,0
17481,578335,RED RETROSPOT UMBRELLA,0
17481,580891,PAPER CHAIN KIT VINTAGE CHRISTMAS,0
17481,565795,RED RETROSPOT PEG BAG,0
17481,578335,BOX OF 6 MINI 50'S CRACKERS,0
17481,578335,FLUTED ANTIQUE CANDLE HOLDER,0
17481,574306,ROLL WRAP VINTAGE SPOT,0
17481,578335,RED HANGING HEART T-LIGHT HOLDER,0
17481,578335,JINGLE BELL HEART ANTIQUE SILVER,0
17481,574306,GARDENERS KNEELING PAD KEEP CALM,0
17481,580891,CAKE STAND LOVEBIRD 2 TIER WHITE,0
17481,578335,MEMO BOARD RETROSPOT  DESIGN,0
17481,565795,RETROSPOT LAMP,0
17481,578335,BISCUIT TIN VINTAGE CHRISTMAS,0
17481,574306,HOT WATER BOTTLE KEEP CALM,0
17481,578335,PAPER CHAIN KIT 50'S CHRISTMAS,0
17481,574306,SET OF 72 RETROSPOT PAPER  DOILIES,0
17481,565795,BISCUIT TIN VINTAGE CHRISTMAS,0
17481,565795,EMPIRE BIRTHDAY CARD,0
17481,574306,HEART SHAPED HOLLY WREATH,0
17481,580891,PAPER CHAIN KIT 50'S CHRISTMAS,0
17481,565795,RED RETROSPOT SMALL MILK JUG,0
17481,578335,VINTAGE GLASS T-LIGHT HOLDER,0
17481,574306,4 LAVENDER BOTANICAL DINNER CANDLES,0
17481,565795,JAZZ HEARTS PURSE NOTEBOOK,0
17481,578335,BOX OF 6 MINI VINTAGE CRACKERS,0
17481,580891,LARGE RED BABUSHKA NOTEBOOK,0
17481,565795,HOME SWEET HOME CUSHION COVER,0
17481,578335,PACK OF SIX LED TEA LIGHTS,0
17481,580891,RETROSPOT CANDLE  SMALL,0
17481,578335,EAU DE NILE HEART SHAPE PHOTO FRAME,0
17481,565795,SET OF 10 LED DOLLY LIGHTS,0
17481,574306,FOLKART STAR CHRISTMAS DECORATIONS,0
17654,545835,SET/5 RED RETROSPOT LID GLASS BOWLS,2
17654,545835,STRAWBERRY   PICNIC BAG,2
17654,545835,HEART OF WICKER SMALL,2
17654,545835,HANGING HEN ON NEST DECORATION,2
17654,545835,ENAMEL MEASURING JUG CREAM,2
17654,545835,SET OF 4 NAPKIN CHARMS CUTLERY,2
17654,545835,BLUE SPOT CERAMIC DRAWER KNOB,2
17654,545835,HANGING CHICK GREEN DECORATION,2
17654,545835,POTTING SHED TWINE,2
17654,545835,HANGING CHICK CREAM DECORATION,2
17654,545835,EASTER TIN CHICKS PINK DAISY,2
17654,545835,IVORY HANGING DECORATION  BIRD,2
17654,545835,EASTER TIN KEEPSAKE,2
17654,545835,EASTER TIN CHICKS IN GARDEN,2
17654,545835,POTTING SHED TEA MUG,2
17654,545835,GAOLERS KEYS DECORATIVE GARDEN,2
17654,545835,MEMO BOARD RETROSPOT  DESIGN,2
17654,545835,IVORY KITCHEN SCALES,2
17654,545835,VINTAGE UNION JACK MEMOBOARD,2
17654,545835,ENGLISH ROSE GARDEN SECATEURS,2
17654,545835,RED RETROSPOT SMALL MILK JUG,2
17654,545835,RED KITCHEN SCALES,2
