12875,538420,ASSORTED LAQUERED INCENSE HOLDERS,2
12875,560582,ASSORTED LAQUERED INCENSE HOLDERS,2
13013,564223,OWL DOORSTOP,1
13013,574327,RIBBON REEL SNOWY VILLAGE,1
13013,536947,RED RETROSPOT TRADITIONAL TEAPOT,1
13013,548919,PANTRY ROLLING PIN,1
13013,581417,VINTAGE CHRISTMAS BUNTING,1
13013,559367,BLUE POLKADOT WASHING UP GLOVES,1
13013,536946,3D CHRISTMAS STAMPS STICKERS,1
13013,536947,POLKADOT PEN,1
13013,559367,FRENCH LAVENDER SCENT HEART,1
13013,536946,RED RETROSPOT CAKE STAND,1
13013,536947,RED RETROSPOT CAKE STAND,1
13013,564223,TEA COSY RED  STRIPE,1
13013,564223,SET/20 RED RETROSPOT PAPER NAPKINS,1
13013,569738,STOOL HOME SWEET HOME,1
13013,536947,RED RETROSPOT PURSE,1
13013,559367,SET OF 3 REGENCY CAKE TINS,1
13013,536946,BOX OF 24 COCKTAIL PARASOLS,1
13013,536947,CLOTHES PEGS RETROSPOT PACK 24,1
13013,559367,RETROSPOT RED WASHING UP GLOVES,1
13013,561529,RED RETROSPOT PEG BAG,1
13013,565993,BLUE OWL SOFT TOY,1
13013,581417,PAPER CHAIN KIT VINTAGE CHRISTMAS,1
13013,536946,CHRISTMAS LIGHTS 10 REINDEER,1
13013,577332,CHOCOLATE HOT WATER BOTTLE,1
13013,559367,CAKE STAND LOVEBIRD 2 TIER WHITE,1
13013,552779,SET/5 RED RETROSPOT LID GLASS BOWLS,1
13013,536947,ENGLISH ROSE NOTEBOOK A7 SIZE,1
13013,559367,CAKE STAND VICTORIAN FILIGREE SMALL,1
13013,564223,KNITTED UNION FLAG HOT WATER BOTTLE,1
13013,536946,SILK PURSE BABUSHKA BLUE,1
13013,536946,PAPER BUNTING RETROSPOT,1
13013,548919,LARGE PINK GLASS SUNDAE DISH,1
13013,564223,RED RETROSPOT APRON,1
13013,574327,60 CAKE CASES VINTAGE CHRISTMAS,1
13013,536947,SET/6 RED SPOTTY PAPER PLATES,1
13013,548919,GREEN REGENCY TEACUP AND SAUCER,1
13013,565993,KNITTED UNION FLAG HOT WATER BOTTLE,1
13013,548919,PANTRY PASTRY BRUSH,1
13013,552779,ALARM CLOCK BAKELIKE ORANGE,1
13013,569738,BELLE JARDINIERE CUSHION COVER,1
13013,548919,PINK REGENCY TEACUP AND SAUCER,1
13013,565993,HOT WATER BOTTLE I AM SO POORLY,1
13013,548919,ENVELOPE 50 BLOSSOM IMAGES,1
13013,536947,SET/6 RED SPOTTY PAPER CUPS,1
13013,569738,PANTRY HOOK TEA STRAINER,1
13013,562599,GLASS JAR PEACOCK BATH SALTS,1
13013,536946,MEASURING TAPE BABUSHKA RED,1
13013,569738,LE JARDIN BOTANIQUE CUSHION COVER,1
13013,577332,PAPER CHAIN KIT VINTAGE CHRISTMAS,1
13013,536946,PAPER CHAIN KIT 50'S CHRISTMAS,1
13013,561529,RED RETROSPOT OVEN GLOVE,1
13013,574327,VINTAGE CHRISTMAS BUNTING,1
13013,536947,20 DOLLY PEGS RETROSPOT,1
13013,536947,RED RETROSPOT OVEN GLOVE,1
13013,574327,HOT WATER BOTTLE I AM SO POORLY,1
13013,577332,SET OF 20 VINTAGE CHRISTMAS NAPKINS,1
13013,536947,RETROSPOT CIGAR BOX MATCHES,1
13013,574327,SET OF 20 VINTAGE CHRISTMAS NAPKINS,1
13013,548919,CLASSIC METAL BIRDCAGE PLANT HOLDER,1
13013,552779,TRAVEL SEWING KIT,1
13013,569738,KNITTED UNION FLAG HOT WATER BOTTLE,1
13013,562599,ASSORTED COLOUR BIRD ORNAMENT,1
13013,564223,"SET 3 RETROSPOT TEA,COFFEE,SUGAR",1
13013,581417,KNITTED UNION FLAG HOT WATER BOTTLE,1
13013,536947,RED RETROSPOT BUTTER DISH,1
13013,559367,PANTRY ROLLING PIN,1
13013,564223,CLOTHES PEGS RETROSPOT PACK 24,1
13013,548919,PANTRY WASHING UP BRUSH,1
13013,536946,PACK 3 BOXES CHRISTMAS PANNETONE,1
13013,565993,RED RETROSPOT OVEN GLOVE DOUBLE,1
13013,552779,RED RETROSPOT PEG BAG,1
13013,574327,GUMBALL COAT RACK,1
13013,536947,ENGLISH ROSE HOT WATER BOTTLE,1
13013,562599,GRAND CHOCOLATECANDLE,1
13013,548919,EMPIRE TISSUE BOX,1
13013,562599,GLASS APOTHECARY BOTTLE TONIC,1
13013,548919,PANTRY SCRUBBING BRUSH,1
13013,577332,SET OF 5 PANCAKE DAY MAGNETS,1
13013,536947,12 PENCILS TALL TUBE RED RETROSPOT,1
13013,565993,BIRD DECORATION RED RETROSPOT,1
13013,569738,SHELF WITH 4 HOOKS HOME SWEET HOME,1
13013,577332,SET OF 4 JAM JAR MAGNETS,1
13013,564223,EMPIRE UNION JACK TV DINNER TRAY,1
13013,536947,"SET 3 RETROSPOT TEA,COFFEE,SUGAR",1
13013,565993,HOT WATER BOTTLE TEA AND SYMPATHY,1
13013,574327,VINTAGE CHRISTMAS TABLECLOTH,1
13013,536947,CHRISTMAS TOILET ROLL,1
13013,548919,JAM JAR WITH GREEN LID,1
13013,536946,PACK OF 72 RETROSPOT CAKE CASES,1
13013,564223,BLUE OWL SOFT TOY,1
13013,536947,RED RETROSPOT ROUND CAKE TINS,1
13013,536947,60 TEATIME FAIRY CAKE CASES,1
13013,536946,PAPER CHAIN KIT VINTAGE CHRISTMAS,1
13013,536946,GREEN REGENCY TEACUP AND SAUCER,1
13013,536947,RED RETROSPOT TEA CUP AND SAUCER,1
13013,552779,SPOTTY BUNTING,1
13013,574327,OWL DOORSTOP,1
13013,548919,JAM JAR WITH PINK LID,1
13013,564223,RED RETROSPOT SUGAR JAM BOWL,1
13013,536946,SILK PURSE BABUSHKA RED,1
13013,561529,PARTY BUNTING,1
13013,564223,HOT WATER BOTTLE I AM SO POORLY,1
13013,559367,GLASS APOTHECARY BOTTLE ELIXIR,1
13013,569738,HANGING HEART BONHEUR,1
13013,561529,SMALL PARISIENNE HEART PHOTO FRAME,1
13013,574327,YOU'RE CONFUSING ME METAL SIGN,1
13013,562599,JAM JAR WITH GREEN LID,1
13013,581417,60 CAKE CASES VINTAGE CHRISTMAS,1
13013,548919,SET OF 4 PANTRY JELLY MOULDS,1
13013,559367,GLASS APOTHECARY BOTTLE TONIC,1
13013,536946,PLASTERS IN TIN VINTAGE PAISLEY,1
13013,536947,POLKADOT MUG PINK,1
13013,559367,GRAND CHOCOLATECANDLE,1
13013,548919,PAPERWEIGHT KINGS CHOICE,1
13013,569738,PANTRY 3 HOOK ROLLING PIN HANGER,1
13013,536946,ASSORTED COLOUR BIRD ORNAMENT,1
13013,536946,SCANDINAVIAN REDS RIBBONS,1
13013,548919,PACK OF 6 SANDCASTLE FLAGS ASSORTED,1
13013,574327,PAPER CHAIN KIT VINTAGE CHRISTMAS,1
13013,536947,BOX OF 24 COCKTAIL PARASOLS,1
13013,536946,RED RETROSPOT MINI CASES,1
13013,536947,BABUSHKA LIGHTS STRING OF 10,1
13013,548919,KINGS CHOICE GIANT TUBE MATCHES,1
13013,536947,RED RETROSPOT SUGAR JAM BOWL,1
13013,536947,FAIRY CAKE NOTEBOOK A5 SIZE,1
13013,548919,REGENCY CAKESTAND 3 TIER,1
13013,536947,SET/2 RED RETROSPOT TEA TOWELS,1
13013,536947,SET OF 4 ENGLISH ROSE COASTERS,1
13013,561529,PARISIENNE KEY CABINET,1
13013,561529,GUMBALL COAT RACK,1
13013,536947,SET OF 72 RETROSPOT PAPER  DOILIES,1
13013,559367,PANTRY WASHING UP BRUSH,1
13013,548919,VINTAGE UNION JACK PENNANT,1
13013,581417,PAPER CHAIN KIT EMPIRE,1
13013,562599,GLASS APOTHECARY BOTTLE ELIXIR,1
13013,536946,ASSORTED COLOURS SILK FAN,1
13013,561529,SET OF 72 RETROSPOT PAPER  DOILIES,1
13013,577332,VINTAGE CHRISTMAS STOCKING,1
13013,548919,WRAP DOILEY DESIGN,1
13013,564223,RED RETROSPOT SMALL MILK JUG,1
13013,559367,HOMEMADE JAM SCENTED CANDLES,1
13013,536946,CHRISTMAS LIGHTS 10 VINTAGE BAUBLES,1
13013,561529,PACK OF 72 RETROSPOT CAKE CASES,1
13013,559367,ASSORTED COLOUR BIRD ORNAMENT,1
13013,561529,SET/5 RED RETROSPOT LID GLASS BOWLS,1
13013,562599,JAM JAR WITH PINK LID,1
13013,536946,PACK 3 BOXES BIRD PANNETONE,1
13013,536947,SET/10 RED POLKADOT PARTY CANDLES,1
13013,548919,6 RIBBONS EMPIRE,1
13013,561529,PAPER CHAIN KIT RETROSPOT,1
13013,548919,WOODEN UNION JACK BUNTING,1
13013,569738,HOT WATER BOTTLE I AM SO POORLY,1
13013,536946,LAVENDER SCENTED FABRIC HEART,1
13013,581417,RIBBON REEL SNOWY VILLAGE,1
13013,536947,RETROSPOT PARTY BAG + STICKER SET,1
13013,565993,PINK OWL SOFT TOY,1
13013,552779,CLOTHES PEGS RETROSPOT PACK 24,1
13013,565993,OWL DOORSTOP,1
13013,548919,SET 2 PANTRY DESIGN TEA TOWELS,1
13013,559367,CAKE PLATE LOVEBIRD WHITE,1
13013,536946,60 CAKE CASES VINTAGE CHRISTMAS,1
13013,548919,KINGS CHOICE BISCUIT TIN,1
13013,562599,GLASS APOTHECARY BOTTLE PERFUME,1
13013,536947,SMALL RED BABUSHKA NOTEBOOK,1
13013,548919,PACK OF 20 NAPKINS PANTRY DESIGN,1
13013,565993,VINTAGE UNION JACK DOORSTOP,1
13013,552779,YOU'RE CONFUSING ME METAL SIGN,1
13013,577332,SCOTTIE DOG HOT WATER BOTTLE,1
13013,536946,MEASURING TAPE BABUSHKA PINK,1
13013,536947,RED RETROSPOT MUG,1
13013,562599,GLASS JAR DAISY FRESH COTTON WOOL,1
13013,559367,ICE CREAM SUNDAE LIP GLOSS,1
13013,564223,I'M ON HOLIDAY METAL SIGN,1
13013,565993,RED RETROSPOT UMBRELLA,1
13013,548919,KINGS CHOICE TEA CADDY,1
13013,562599,DOILEY STORAGE TIN,1
13013,577332,HOT WATER BOTTLE TEA AND SYMPATHY,1
13013,569738,VINTAGE COFFEE GRINDER BOX,1
13013,574327,PANTRY HOOK SPATULA,1
13013,574327,PAPER CHAIN KIT 50'S CHRISTMAS,1
13013,569738,HANGING  BUTTERFLY T-LIGHT HOLDER,1
13013,536946,SET OF 20 VINTAGE CHRISTMAS NAPKINS,1
13013,536946,CHRISTMAS LIGHTS 10 SANTAS,1
13013,536946,ROSES REGENCY TEACUP AND SAUCER,1
13013,536947,REGENCY CAKESTAND 3 TIER,1
13013,536947,"\"RECORD FRAME 7\"\" SINGLE SIZE \"",1
13013,548919,SMALL PINK GLASS SUNDAE DISH,1
13013,565993,NOVELTY BISCUITS CAKE STAND 3 TIER,1
13013,581417,PARTY BUNTING,1
13013,536946,RIBBON REEL SNOWY VILLAGE,1
13013,536947,SET/20 RED RETROSPOT PAPER NAPKINS,1
13013,565993,KEY CABINET MA CAMPAGNE,1
13013,561529,RECIPE BOX RETROSPOT,1
13013,577332,60 CAKE CASES VINTAGE CHRISTMAS,1
13013,561529,YOU'RE CONFUSING ME METAL SIGN,1
13013,536947,SET OF 3 COLOURED  FLYING DUCKS,1
13013,548919,PAPER CHAIN KIT EMPIRE,1
13013,569738,PAPER CHAIN KIT 50'S CHRISTMAS,1
13013,536946,SILK PURSE BABUSHKA PINK,1
13013,548919,EMPIRE BIRTHDAY CARD,1
13013,536947,RED RETROSPOT PEG BAG,1
13013,577332,RIBBON REEL SNOWY VILLAGE,1
13013,548919,VINTAGE UNION JACK APRON,1
13013,552779,PARTY BUNTING,1
13013,536946,PAPER CHAIN KIT RETROSPOT,1
13013,536947,PACK 20 ENGLISH ROSE PAPER NAPKINS,1
13013,548919,GLASS JAR KINGS CHOICE,1
13013,559367,GLASS APOTHECARY BOTTLE PERFUME,1
13013,561529,CLOTHES PEGS RETROSPOT PACK 24,1
13013,564223,PINK OWL SOFT TOY,1
13013,536947,PACK OF 72 RETROSPOT CAKE CASES,1
13013,564223,PAPER CHAIN KIT RETROSPOT,1
13013,552779,SET OF 6 SPICE TINS PANTRY DESIGN,1
13013,559367,PLASTERS IN TIN VINTAGE PAISLEY,1
13013,577332,SET OF 4 SANTA PLACE SETTINGS,1
13013,548919,PANTRY APPLE CORER,1
13013,574327,VINTAGE CHRISTMAS STOCKING,1
13013,577332,YOU'RE CONFUSING ME METAL SIGN,1
13013,581417,HOT WATER BOTTLE I AM SO POORLY,1
13259,570210,MAGNETS PACK OF 4 VINTAGE LABELS,0
13259,570210,SET OF 5 PANCAKE DAY MAGNETS,0
13259,570210,SET 12 COLOUR PENCILS DOLLY GIRL,0
13259,570210,WOOD STAMP SET THANK YOU,0
13259,570210,PLEASE ONE PERSON METAL SIGN,0
13259,570210,BAKING MOULD CHOCOLATE CUPCAKES,0
13259,570210,PANTRY SCRUBBING BRUSH,0
13259,570210,SET 12 COLOUR PENCILS SPACEBOY,0
13259,570210,PANTRY HOOK SPATULA,0
13259,570210,SET OF 5 MINI GROCERY MAGNETS,0
13259,570210,FOLDING UMBRELLA RED/WHITE POLKADOT,0
13259,570210,PANTRY PASTRY BRUSH,0
13259,570210,FOLDING UMBRELLA BLACKBLUE POLKADOT,0
13259,570210,METAL SIGN DROP YOUR PANTS,0
13259,570210,METAL SIGN NEIGHBOURHOOD WITCH,0
13259,570210,MORE BUTTER METAL SIGN,0
13259,570210,EGG FRYING PAN MINT,0
13259,570210,CHARLIE + LOLA RED HOT WATER BOTTLE,0
13259,570210,WOOD STAMP SET THANK YOU,0
13259,570210,WOOD STAMP SET FLOWERS,0
13259,570210,SET 2 PANTRY DESIGN TEA TOWELS,0
13259,570210,AREA PATROLLED METAL SIGN,0
13259,570210,SET 36 COLOUR PENCILS LOVE LONDON,0
13259,570210,MOTHER'S KITCHEN SPOON REST,0
13259,570210,STAR T-LIGHT HOLDER WILLIE WINKIE,0
13259,570210,SET OF 4 PANTRY JELLY MOULDS,0
13259,570210,FRENCH BATHROOM SIGN BLUE METAL,0
13259,570210,SET OF 20 VINTAGE CHRISTMAS NAPKINS,0
13259,570210,SET OF 4 JAM JAR MAGNETS,0
13259,570210,BAKING MOULD HEART MILK CHOCOLATE,0
13259,570210,BLACK TEA TOWEL CLASSIC DESIGN,0
13259,570210,FOLDING UMBRELLA CHOCOLATE POLKADOT,0
13259,570210,PANTRY APPLE CORER,0
13259,570210,KENSINGTON COFFEE SET,0
13259,570210,HAND OVER THE CHOCOLATE   SIGN,0
13259,570210,WASHROOM METAL SIGN,0
13259,570210,BABY MOUSE RED GINGHAM DRESS,0
13259,570210,SET OF 5 LUCKY CAT MAGNETS,0
13259,570210,RETROSPOT TEA SET CERAMIC 11 PC,0
13259,570210,SET OF 2 TEA TOWELS APPLE AND PEARS,0
13259,570210,MOUSE TOY WITH PINK T-SHIRT,0
13259,570210,EGG FRYING PAN IVORY,0
13259,570210,SET 12 COLOURING PENCILS DOILY,0
13259,570210,MISTLETOE HEART WREATH CREAM,0
13259,570210,METAL SIGN TAKE IT OR LEAVE IT,0
13259,570210,TRAVEL CARD WALLET VINTAGE TICKET,0
13259,570210,36 DOILIES VINTAGE CHRISTMAS,0
13259,570210,FELTCRAFT CUSHION OWL,0
13259,570210,LAUNDRY 15C METAL SIGN,0
13259,570210,WOOD STAMP SET HAPPY BIRTHDAY,0
13259,570210,PANTRY HOOK BALLOON WHISK,0
13259,570210,MOCK LOBSTER FRIDGE MAGNET,0
13259,570210,HEART T-LIGHT HOLDER WILLIE WINKIE,0
13259,570210,STAR  T-LIGHT HOLDER,0
13259,570210,3 GARDENIA MORRIS BOXED CANDLES,0
13259,570210,BEWARE OF THE CAT METAL SIGN,0
13259,570210,PANTRY HOOK TEA STRAINER,0
13259,570210,VINTAGE CREAM DOG FOOD CONTAINER,0
13259,570210,WOOD STAMP SET BEST WISHES,0
13259,570210,PARTY METAL SIGN,0
13259,570210,60 CAKE CASES VINTAGE CHRISTMAS,0
13259,570210,PINK HEART SHAPE EGG FRYING PAN,0
13259,570210,CHRISTMAS TREE T-LIGHT HOLDER,0
13259,570210,DOG TOY WITH PINK CROCHET SKIRT,0
13259,570210,PARTY TIME PENCIL ERASERS,0
13259,570210,LADIES & GENTLEMEN METAL SIGN,0
13259,570210,CHOCOLATE THIS WAY METAL SIGN,0
13259,570210,EGG FRYING PAN PINK,0
13259,570210,FOLDING UMBRELLA PINKWHITE POLKADOT,0
13259,570210,WOOD STAMP SET HAPPY BIRTHDAY,0
13259,570210,EDWARDIAN PARASOL NATURAL,0
13259,570210,COSY HOUR GIANT TUBE MATCHES,0
13259,570210,PACK OF 20 NAPKINS PANTRY DESIGN,0
13259,570210,PACK OF 20 NAPKINS RED APPLES,0
13259,570210,VANILLA SCENT CANDLE JEWELLED BOX,0
13259,570210,EGG FRYING PAN IVORY,0
13259,570210,BLACK TEA TOWEL CLASSIC DESIGN,0
13259,570210,CHARLIE+LOLA PINK HOT WATER BOTTLE,0
13259,570210,FRENCH LAUNDRY SIGN BLUE METAL,0
13259,570210,SET 2 TEA TOWELS I LOVE LONDON,0
13259,570210,BAKING MOULD HEART WHITE CHOCOLATE,0
13411,564330,OVEN MITT APPLES DESIGN,0
13411,564330,RETROSPOT PADDED SEAT CUSHION,0
13411,564330,IVORY WICKER HEART LARGE,0
13411,564330,SET OF 10 LED DOLLY LIGHTS,0
13411,564330,"ART LIGHTS,FUNK MONKEY",0
13411,564330,RED RETROSPOT OVEN GLOVE,0
13411,564330,GROW YOUR OWN BASIL IN ENAMEL MUG,0
13411,564330,PHOTO FRAME 3 CLASSIC HANGING,0
13411,564330,CANDLEHOLDER PINK HANGING HEART,0
13411,564330,WHITE HANGING HEART T-LIGHT HOLDER,0
13411,564330,TEA TIME OVEN GLOVE,0
13411,564330,BLACK TEA TOWEL CLASSIC DESIGN,0
13411,564330,RED RETROSPOT OVEN GLOVE,0
13411,564330,RED HANGING HEART T-LIGHT HOLDER,0
13411,564330,ZINC HERB GARDEN CONTAINER,0
13411,564330,TEA TIME PARTY BUNTING,0
13411,564330,CREAM HEART CARD HOLDER,0
13411,564330,SMALL WHITE HEART OF WICKER,0
13483,569631,PACK OF 12 COLOURED PENCILS,0
13483,569631,MINI JIGSAW CIRCUS PARADE,0
13483,569631,VINTAGE SNAP CARDS,0
13483,569631,BALLOON ART MAKE YOUR OWN FLOWERS,0
13483,569631,TRADITIONAL MODELLING CLAY,0
13483,569631,MAGIC DRAWING SLATE CIRCUS PARADE,0
13483,569631,POPPY'S PLAYHOUSE KITCHEN,0
13483,569631,4 TRADITIONAL SPINNING TOPS,0
13483,569631,PACK OF 12 TRADITIONAL CRAYONS,0
13483,569631,SET OF 6 3D KIT CARDS FOR KIDS,0
13670,568204,HEART SHAPED HOLLY WREATH,0
13670,568204,MAGIC DRAWING SLATE DOLLY GIRL,0
13670,568204,ICE CREAM SUNDAE LIP GLOSS,0
13670,568204,SET OF 6 SNACK LOAF BAKING CASES,0
13670,568204,SET 36 COLOURING PENCILS DOILY,0
13670,568204,SET OF 12 MINI LOAF BAKING CASES,0
13670,568204,6 GIFT TAGS 50'S CHRISTMAS,0
13670,568204,VINTAGE CHRISTMAS CAKE FRILL,0
13670,568204,DOORMAT NEW ENGLAND,0
13670,568204,SET OF 4 KNICK KNACK TINS DOILY,0
13670,568204,VICTORIAN SEWING KIT,0
13670,568204,VINTAGE DONKEY TAIL GAME,0
13670,568204,CARD WEDDING DAY,0
13670,568204,PAPER CHAIN KIT 50'S CHRISTMAS,0
13670,568204,CARD MOTORBIKE SANTA,0
13670,568204,TEA PARTY BIRTHDAY CARD,0
13670,568204,CARD DOLLY GIRL,0
13670,568204,CARD BIRTHDAY COWBOY,0
13670,568204,PAPER CHAIN KIT VINTAGE CHRISTMAS,0
13670,568204,60 CAKE CASES VINTAGE CHRISTMAS,0
13670,568204,SET OF 6 RIBBONS VINTAGE CHRISTMAS,0
13670,568204,3D TRADITIONAL CHRISTMAS STICKERS,0
13670,568204,FELTCRAFT PRINCESS OLIVIA DOLL,0
13670,568204,PENNY FARTHING BIRTHDAY CARD,0
13670,568204,36 DOILIES VINTAGE CHRISTMAS,0
13717,549916,CHILDS BREAKFAST SET CIRCUS PARADE,0
13717,562127,BLACK CHAMPAGNE GLASS,0
13717,543915,CLASSICAL ROSE SMALL VASE,0
13717,571230,VINTAGE CHRISTMAS GIFT BAG LARGE,0
13717,543915,DANISH ROSE DECORATIVE PLATE,0
13717,549916,REGENCY CAKESTAND 3 TIER,0
13717,571230,ROLL WRAP 50'S CHRISTMAS,0
13717,571230,6 GIFT TAGS VINTAGE CHRISTMAS,0
13717,557492,FUSCHIA VOILE POINTY SHOE DEC,0
13717,543915,3 ROSE MORRIS BOXED CANDLES,0
13717,574887,CHRISTMAS HANGING SNOWFLAKE,0
13717,574887,EASTER DECORATION EGG BUNNY,0
13717,562127,ICON PLACEMAT POP ART ELVIS,0
13717,574887,AIRLINE BAG VINTAGE JET SET WHITE,0
13717,557492,MINI  ZINC GARDEN DECORATIONS,0
13717,549916,COLOUR GLASS T-LIGHT HOLDER HANGING,0
13717,562127,REGENCY CAKESTAND 3 TIER,0
13717,574887,MOTORING TISSUE BOX,0
13717,549916,HOMEMADE JAM SCENTED CANDLES,0
13717,549916,ASSORTED COLOUR BIRD ORNAMENT,0
13717,571230,VINTAGE CHRISTMAS PAPER GIFT BAG,0
13717,574887,MOCK LOBSTER FRIDGE MAGNET,0
13717,571230,ROLL WRAP VINTAGE CHRISTMAS,0
13717,543915,SAVE THE PLANET COTTON TOTE BAG,0
13717,562127,ENGLISH ROSE GARDEN SECATEURS,0
13717,574887,SUKI  SHOULDER BAG,0
13717,543915,SET OF 4 FAIRY CAKE PLACEMATS,0
13717,557492,MINI PAINTED GARDEN DECORATION,0
13717,549916,GROW A FLYTRAP OR SUNFLOWER IN TIN,0
13717,549916,BLUE POLKADOT EGG CUP,0
13717,543915,SET/6 EAU DE NIL BIRD T-LIGHTS,0
13717,557492,SET/6 BEAD COASTERS GAUZE BAG GOLD,0
13717,549916,WISE MAN STAR SHAPE EGG PAN,0
13717,557492,POPART WOODEN PENCILS ASST,0
13717,574887,AIRLINE BAG VINTAGE TOKYO 78,0
13717,543915,STRAWBERRY CERAMIC TRINKET BOX,0
13717,549916,HOT WATER BOTTLE I AM SO POORLY,0
13717,574887,AIRLINE BAG VINTAGE JET SET RED,0
13717,557492,BLOND DOLL DOORSTOP,0
13717,557492,PAINTED SEA SHELL METAL WINDCHIME,0
13717,574887,SKULL SHOULDER BAG,0
13717,571230,ENGLISH ROSE GARDEN SECATEURS,0
13717,571230,REINDEER HEART DECORATION GOLD,0
13717,557492,DECORATION WOBBLY CHICKEN,0
13717,574887,EGG CUP NATURAL CHICKEN,0
13717,571230,RED ROCKING HORSE HAND PAINTED,0
13717,562127,LOVE HEART TRINKET POT,0
13717,543915,COLOURING PENCILS BROWN TUBE,0
13717,549916,HEART IVORY TRELLIS SMALL,0
13717,571230,WOODEN ADVENT CALENDAR CREAM,0
13717,571230,GIANT 50'S CHRISTMAS CRACKER,0
13717,557492,LOVE HEART TRINKET POT,0
13717,543915,SWEETHEART CERAMIC TRINKET BOX,0
13717,543915,MINI PAINTED GARDEN DECORATION,0
13717,557492,VINTAGE PAISLEY STATIONERY SET,0
13717,549916,MINI PAINTED GARDEN DECORATION,0
13717,574887,AIRLINE BAG VINTAGE WORLD CHAMPION,0
13717,562127,SAVOY ART DECO CLOCK,0
13717,543915,BALLOON WATER BOMB PACK OF 35,0
13717,557492,REGENCY CAKESTAND 3 TIER,0
13717,543915,ENGLISH ROSE GARDEN SECATEURS,0
13717,549916,LOVEBIRD HANGING DECORATION WHITE,0
13717,557492,EGG CUP NATURAL CHICKEN,0
13717,574887,CHRISTMAS PUDDING TRINKET POT,0
13717,543915,ASSTD DESIGN 3D PAPER STICKERS,0
13717,571230,HANGING  BUTTERFLY T-LIGHT HOLDER,0
13717,562127,ENGLISH ROSE SPIRIT LEVEL,0
13717,557492,ENVELOPE 50 BLOSSOM IMAGES,0
13717,562127,SET OF 3 BIRD LIGHT PINK FEATHER,0
13717,571230,HOT WATER BOTTLE KEEP CALM,0
13717,557492,PENS ASSORTED FUNNY FACE,0
13717,562127,GROOVY CACTUS INFLATABLE,0
13717,557492,JAZZ HEARTS ADDRESS BOOK,0
13717,562127,FRENCH STYLE STORAGE JAR BONBONS,0
13717,562127,GREEN DRAWER KNOB ACRYLIC EDWARDIAN,0
13717,543915,STRAWBERRY SHOPPER BAG,0
13717,549916,CREAM SWEETHEART EGG HOLDER,0
13717,543915,RED RETROSPOT SHOPPER BAG,0
13717,543915,BLUE SPOT CERAMIC DRAWER KNOB,0
13717,543915,CLASSIC FRENCH STYLE BASKET NATURAL,0
13717,571230,EGG CUP HENRIETTA HEN PINK,0
13717,574887,AIRLINE BAG VINTAGE JET SET BROWN,0
13717,557492,MADRAS NOTEBOOK LARGE,0
13717,543915,LETS GO SHOPPING COTTON TOTE BAG,0
13717,543915,OWL DOORSTOP,0
13717,574887,SWISS CHALET TREE DECORATION,0
13717,562127,WHITE STITCHED WALL CLOCK,0
13717,557492,PENS ASSORTED SPACEBALL,0
13717,557492,DECORATION SITTING BUNNY,0
13717,571230,REGENCY CAKESTAND 3 TIER,0
13717,571230,MILK MAIDS MUG,0
13717,562127,BEADED CRYSTAL HEART GREEN LARGE,0
13717,549916,IVORY DINER WALL CLOCK,0
13717,557492,HEART DECORATION RUSTIC HANGING,0
13717,549916,SET OF 5 LUCKY CAT MAGNETS,0
13717,543915,GREEN DRAWER KNOB ACRYLIC EDWARDIAN,0
13717,571230,CHRISTMAS TREE HANGING GOLD,0
13717,571230,VINTAGE CHRISTMAS STOCKING,0
13717,562127,BEADED CRYSTAL HEART PINK LARGE,0
13717,557492,PINK STOCKING CHRISTMAS DECORATION,0
13717,543915,PARTY FOOD SHOPPER BAG,0
13717,562127,RED FLOCK LOVE HEART PHOTO FRAME,0
14175,570598,VINTAGE CHRISTMAS TABLECLOTH,0
14175,570598,DOORMAT MERRY CHRISTMAS RED,0
14175,570598,GARDENERS KNEELING PAD KEEP CALM,0
14175,570598,WALL ART LOVES' SECRET,0
14175,570598,STOOL HOME SWEET HOME,0
14175,570598,SET OF 12 FORK CANDLES,0
14175,570598,WRAP GREEN PEARS,0
14175,557626,PINK POT PLANT CANDLE,0
14175,570598,REGENCY CAKE SLICE,0
14175,541204,LARGE CAKE STAND HANGING HEARTS,0
14175,570598,IVORY KITCHEN SCALES,0
14175,541204,GIN + TONIC DIET METAL SIGN,0
14175,570598,VINTAGE CHRISTMAS STOCKING,0
14175,557626,CITRONELLA CANDLE FLOWERPOT,0
14175,570598,WRAP PINK FAIRY CAKES,0
14175,570598,DOORMAT HOME SWEET HOME BLUE,0
14175,570598,RED KITCHEN SCALES,0
14175,570598,FULL ENGLISH BREAKFAST PLATE,0
14175,557626,I LOVE LONDON BABY GIFT SET,0
14175,557626,WRAP DOLLY GIRL,0
14175,570598,PANTRY HOOK BALLOON WHISK,0
14175,570598,T-LIGHT HOLDER SILVER HEART HANDLE,0
14175,557626,SPACEBOY BABY GIFT SET,0
14175,570598,HOME SWEET HOME KEY HOLDER,0
14175,557626,CHOCOLATE THIS WAY METAL SIGN,0
14175,570598,FOOT STOOL HOME SWEET HOME,0
14175,557626,PAINT YOUR OWN CANVAS SET,0
14175,570598,METAL SIGN DROP YOUR PANTS,0
14175,570598,VINTAGE CHRISTMAS BUNTING,0
14175,570598,STAR T-LIGHT HOLDER WILLIE WINKIE,0
14175,570598,NINE DRAWER OFFICE TIDY,0
14175,570598,TREE T-LIGHT HOLDER WILLIE WINKIE,0
14175,570598,SILVER HANGING T-LIGHT HOLDER,0
14175,570598,GREEN CHRISTMAS TREE CARD HOLDER,0
14175,570598,SET 12 COLOUR PENCILS DOLLY GIRL,0
14175,541204,YOU'RE CONFUSING ME METAL SIGN,0
14175,557626,REGENCY CAKESTAND 3 TIER,0
14175,557626,RED RETROSPOT WRAP,0
14175,570598,YOU'RE CONFUSING ME METAL SIGN,0
14175,570598,SET OF 2 CERAMIC CHRISTMAS TREES,0
14175,570598,BICYCLE SAFTEY WALL ART,0
14175,541204,BEADED CRYSTAL HEART PINK LARGE,0
14175,541204,TOAST ITS - I LOVE YOU,0
14175,557626,FRENCH TOILET SIGN BLUE METAL,0
14175,570598,CHRISTMAS LIGHTS 10 REINDEER,0
14175,570598,TRAVEL CARD WALLET I LOVE LONDON,0
14175,570598,PLEASE ONE PERSON METAL SIGN,0
14175,570598,HOT BATHS METAL SIGN,0
14175,541204,FAMILY PHOTO FRAME CORNICE,0
14175,570598,MAGIC DRAWING SLATE DOLLY GIRL,0
14175,541204,PINK HEART SHAPE EGG FRYING PAN,0
14175,557626,TRAVEL SEWING KIT,0
14175,557626,WRAP CIRCUS PARADE,0
14175,570598,SET 2 TEA TOWELS I LOVE LONDON,0
14175,570598,CHILDRENS CUTLERY POLKADOT PINK,0
14175,570598,CLASSIC CAFE SUGAR DISPENSER,0
14175,541204,BATHROOM METAL SIGN,0
14175,570598,ROLL WRAP VINTAGE SPOT,0
14175,557626,POPCORN HOLDER,0
14175,557626,GIN + TONIC DIET METAL SIGN,0
14175,557626,RED RETROSPOT PLATE,0
14175,557626,BLUE POLKADOT WRAP,0
14175,570598,SET 12 COLOUR PENCILS LOVE LONDON,0
14175,557626,PINK POLKADOT WRAP,0
14175,570598,HOT WATER BOTTLE TEA AND SYMPATHY,0
14175,570598,ROCKING HORSE GREEN CHRISTMAS,0
14175,557626,GREEN GIANT GARDEN THERMOMETER,0
14175,570598,POPCORN HOLDER,0
14175,570598,LARGE IVORY HEART WALL ORGANISER,0
14175,570598,PLAYING CARDS I LOVE LONDON,0
14175,570598,EMBOSSED GLASS TEALIGHT HOLDER,0
14175,570598,6 GIFT TAGS VINTAGE CHRISTMAS,0
14175,570598,PANTRY HOOK TEA STRAINER,0
14175,570598,SET OF 5 MINI GROCERY MAGNETS,0
14175,570598,STOP FOR TEA WALL ART,0
14175,570598,SIX DRAWER OFFICE TIDY,0
14175,557626,CHILDRENS CUTLERY SPACEBOY,0
14175,570598,HEART T-LIGHT HOLDER WILLIE WINKIE,0
14175,570598,CHILDRENS CUTLERY POLKADOT BLUE,0
14175,557626,RED RETROSPOT BOWL,0
14175,570598,WRAP ENGLISH ROSE,0
14175,557626,BLUE POT PLANT CANDLE,0
14175,557626,SET OF 10 LED DOLLY LIGHTS,0
14175,570598,DOORMAT KEEP CALM AND COME IN,0
14175,570598,CHRISTMAS LIGHTS 10 SANTAS,0
14175,557626,WRAP ENGLISH ROSE,0
14175,570598,DOORMAT ENGLISH ROSE,0
14175,570598,HOT WATER BOTTLE KEEP CALM,0
14175,570598,LONDON BUS COFFEE MUG,0
14175,570598,HEART TRELLIS TRIPLE T-LIGHT HOLDER,0
14175,570598,KNITTED UNION FLAG HOT WATER BOTTLE,0
14175,557626,FULL ENGLISH BREAKFAST PLATE,0
14175,570598,VINTAGE CHRISTMAS GIFT SACK,0
14175,570598,REGENCY SUGAR TONGS,0
14175,570598,ROTATING SILVER ANGELS T-LIGHT HLDR,0
14175,557626,RED RETROSPOT CAKE STAND,0
14175,557626,BLUE POLKADOT PLATE,0
14175,541204,CAKE STAND LOVEBIRD 2 TIER WHITE,0
14175,557626,WRAP ALPHABET DESIGN,0
14175,570598,WRAP RED APPLES,0
14175,570598,SET OF 2 CERAMIC PAINTED HEARTS,0
14175,570598,ROLL WRAP VINTAGE CHRISTMAS,0
14175,557626,REGENCY TEAPOT ROSES,0
14175,570598,WALL ART CLASSIC PUDDINGS,0
14175,570598,6 GIFT TAGS 50'S CHRISTMAS,0
14175,570598,CARDHOLDER HOLLY WREATH METAL,0
14175,541204,PLEASE ONE PERSON METAL SIGN,0
14175,570598,PAPER CHAIN KIT 50'S CHRISTMAS,0
14175,557626,DOLLY GIRL BABY GIFT SET,0
14175,541204,TOILET METAL SIGN,0
14175,570598,PANTRY HOOK SPATULA,0
14175,570598,MAGIC DRAWING SLATE CIRCUS PARADE,0
14175,541204,TOAST ITS - BEST MUM,0
14175,557626,CHILDRENS CUTLERY DOLLY GIRL,0
14175,557626,REGENCY MILK JUG PINK,0
14175,557626,BLUE POLKADOT BEAKER,0
14175,557626,I'M ON HOLIDAY METAL SIGN,0
14175,557626,HANGING HEART ZINC T-LIGHT HOLDER,0
14175,570598,COOK WITH WINE METAL SIGN,0
14175,570598,DOORMAT WELCOME TO OUR HOME,0
14175,557626,FRENCH KITCHEN SIGN BLUE METAL,0
14175,570598,ROCKING HORSE RED CHRISTMAS,0
14175,570598,HOME SWEET HOME BLACKBOARD,0
14175,557626,SINGLE HEART ZINC T-LIGHT HOLDER,0
14175,570598,WALL ART ONLY ONE PERSON,0
14175,570598,HOMEMADE JAM SCENTED CANDLES,0
14175,570598,SET OF 4 JAM JAR MAGNETS,0
14175,570598,MINI PAINT SET VINTAGE,0
14175,570598,RED STAR CARD HOLDER,0
14175,570598,PANTRY 3 HOOK ROLLING PIN HANGER,0
14175,557626,REGENCY SUGAR BOWL GREEN,0
14175,570598,MAGIC DRAWING SLATE SPACEBOY,0
14175,541204,COOK WITH WINE METAL SIGN,0
14175,570598,VINTAGE GLASS T-LIGHT HOLDER,0
14175,570598,GIRAFFE WOODEN RULER,0
14175,570598,HAND OVER THE CHOCOLATE   SIGN,0
14175,557626,POTTERING IN THE SHED METAL SIGN,0
14175,541204,METAL SIGN TAKE IT OR LEAVE IT,0
14175,557626,RED POLKADOT BEAKER,0
14175,557626,FRENCH BATHROOM SIGN BLUE METAL,0
14175,557626,BLUE POLKADOT BOWL,0
14175,557626,HOMEMADE JAM SCENTED CANDLES,0
14175,570598,SET OF 6 T-LIGHTS SANTA,0
14175,541204,KITCHEN METAL SIGN,0
14175,570598,REGENCY TEA STRAINER,0
14175,541204,DOORMAT FANCY FONT HOME SWEET HOME,0
14175,557626,FRENCH LAUNDRY SIGN BLUE METAL,0
14175,570598,REGENCY CAKESTAND 3 TIER,0
14175,570598,GIN + TONIC DIET METAL SIGN,0
14314,564380,WATERING CAN BLUE ELEPHANT,0
14314,564380,MOODY BOY  DOOR HANGER,0
