17515,546771,AREA PATROLLED METAL SIGN,0
17515,553515,FRENCH BLUE METAL DOOR SIGN 3,0
17515,542121,COOK WITH WINE METAL SIGN,0
17515,553515,"AIRLINE LOUNGE,METAL SIGN",0
17515,546771,BROCANTE SHELF WITH HOOKS,0
17515,546771,FRENCH ENAMEL WATER BASIN,0
17515,546771,POTTERING IN THE SHED METAL SIGN,0
17515,553515,BEWARE OF THE CAT METAL SIGN,0
17515,542121,POTTERING IN THE SHED METAL SIGN,0
17515,575090,LADIES & GENTLEMEN METAL SIGN,0
17515,546771,RECYCLED ACAPULCO MAT BLUE,0
17515,542121,PLEASE ONE PERSON METAL SIGN,0
17515,542121,GIN + TONIC DIET METAL SIGN,0
17515,546771,SWEETHEART WIRE WALL TIDY,0
17515,542121,STEEL SWEETHEART ROUND TABLE CREAM,0
17515,575090,OPEN CLOSED METAL SIGN,0
17515,575090,METAL 4 HOOK HANGER FRENCH CHATEAU,0
17515,553515,FRENCH BLUE METAL DOOR SIGN 5,0
17515,553515,FRENCH BLUE METAL DOOR SIGN 0,0
17515,542121,KEY CABINET MA CAMPAGNE,0
17515,542121,"AIRLINE LOUNGE,METAL SIGN",0
17515,546771,YELLOW COAT RACK PARIS FASHION,0
17515,542121,FRENCH BLUE METAL DOOR SIGN 7,0
17515,546771,TOILET SIGN OCCUPIED OR VACANT,0
17515,575090,FRENCH ENAMEL WATER BASIN,0
17515,553515,FRENCH BLUE METAL DOOR SIGN 2,0
17515,546771,FRENCH BLUE METAL DOOR SIGN 3,0
17515,546771,ENAMEL WASH BOWL CREAM,0
17515,542121,FRENCH BLUE METAL DOOR SIGN 0,0
17515,546771,BLUE COAT RACK PARIS FASHION,0
17515,546771,FRENCH BLUE METAL DOOR SIGN 6,0
17515,575090,METAL SIGN TAKE IT OR LEAVE IT,0
17515,575090,ENAMEL WASH BOWL CREAM,0
17515,546771,FRENCH KITCHEN SIGN BLUE METAL,0
17515,546771,WOOD S/3 CABINET ANT WHITE FINISH,0
17515,542121,FAIRY SOAP SOAP HOLDER,0
17515,553515,FRENCH BLUE METAL DOOR SIGN 8,0
17515,546771,FRENCH BLUE METAL DOOR SIGN 2,0
17515,553515,FRENCH BLUE METAL DOOR SIGN 4,0
17515,542121,FRENCH BLUE METAL DOOR SIGN 5,0
17515,542121,CHOCOLATE THIS WAY METAL SIGN,0
17515,542121,REGENCY CAKESTAND 3 TIER,0
17515,553515,FRENCH BLUE METAL DOOR SIGN 6,0
17515,542121,FRENCH BLUE METAL DOOR SIGN 4,0
17515,546771,REGENCY CAKESTAND 3 TIER,0
17515,542121,BEWARE OF THE CAT METAL SIGN,0
17515,546771,FRENCH BATHROOM SIGN BLUE METAL,0
17515,546771,SWEETHEART WIRE MAGAZINE RACK,0
17515,546771,BEWARE OF THE CAT METAL SIGN,0
17515,542121,METAL SIGN TAKE IT OR LEAVE IT,0
17515,575090,COOK WITH WINE METAL SIGN,0
17515,542121,FRENCH KITCHEN SIGN BLUE METAL,0
17515,542121,FRENCH GARDEN SIGN BLUE METAL,0
17515,553515,METAL SIGN TAKE IT OR LEAVE IT,0
17515,575090,AREA PATROLLED METAL SIGN,0
17515,575090,FRENCH ENAMEL POT W LID,0
17515,542121,FRENCH BLUE METAL DOOR SIGN 1,0
17515,553515,OPEN CLOSED METAL SIGN,0
17515,553515,FRENCH BLUE METAL DOOR SIGN 1,0
17515,542121,HELLO SAILOR BLUE SOAP HOLDER,0
17515,542121,FRENCH BATHROOM SIGN BLUE METAL,0
17515,542121,FRENCH ENAMEL POT W LID,0
17515,546771,FRENCH BLUE METAL DOOR SIGN 4,0
17515,546771,FRENCH BLUE METAL DOOR SIGN 0,0
17522,581361,SET OF 2 ROUND TINS CAMEMBERT,0
17522,556222,GOLD MINI TAPE MEASURE,0
17522,553427,PEARL CRYSTAL PUMPKIN T-LIGHT HLDR,0
17522,556222,SMALL MEDINA STAMPED METAL BOWL,0
17522,556222,IVORY KITCHEN SCALES,0
17522,556222,"FEATHER PEN,HOT PINK",0
17522,556222,ANTIQUE GLASS HEART DECORATION,0
17522,561045,SMALL WHITE HEART OF WICKER,0
17522,552004,SET/6 GREEN SPRING PAPER CUPS,0
17522,556222,PINK PAISLEY CUSHION COVER,0
17522,553427,RIDGED GLASS FINGER BOWL,0
17522,556222,WOODEN HAPPY BIRTHDAY GARLAND,0
17522,556222,MINI WOODEN HAPPY BIRTHDAY GARLAND,0
17522,556222,PACK OF 6 SANDCASTLE FLAGS ASSORTED,0
17522,552004,RIDGED GLASS FINGER BOWL,0
17522,552004,GAOLERS KEYS DECORATIVE GARDEN,0
17522,556222,FRYING PAN PINK POLKADOT,0
17522,561045,ROUND BLUE CLOCK WITH SUCKER,0
17522,556222,PEARL CRYSTAL PUMPKIN T-LIGHT HLDR,0
17522,556222,VICTORIAN GLASS HANGING T-LIGHT,0
17522,556222,"FEATHER PEN,LIGHT PINK",0
17522,556222,SET/6 FRUIT SALAD  PAPER PLATES,0
17522,552004,JARDIN ETCHED GLASS FRUITBOWL,0
17522,556222,WOODEN ROUNDERS GARDEN SET,0
17522,552004,REGENCY CAKESTAND 3 TIER,0
17522,556222,GOLD WINE GOBLET,0
17522,556222,MIRROR MOSAIC GOBLET CANDLE HOLDER,0
17522,581361,SET OF 2 TINS JARDIN DE PROVENCE,0
17522,556222,PACK OF 20 NAPKINS RED APPLES,0
17522,556222,BOX OF 24 COCKTAIL PARASOLS,0
17522,561045,"FEATHER PEN,LIGHT PINK",0
17522,556222,AIRLINE BAG VINTAGE TOKYO 78,0
17522,552004,PEARL CRYSTAL PUMPKIN T-LIGHT HLDR,0
17522,556222,SET/6 GREEN SPRING PAPER CUPS,0
17522,552004,COLOUR GLASS T-LIGHT HOLDER HANGING,0
17522,581361,VICTORIAN GLASS HANGING T-LIGHT,0
17522,556222,REX CASH+CARRY JUMBO SHOPPER,0
17522,556222,ALARM CLOCK BAKELIKE PINK,0
17522,556222,SILVER DISCO HANDBAG,0
17522,561045,"FEATHER PEN,HOT PINK",0
17522,581361,STORAGE TIN VINTAGE LEAF,0
17522,552004,RED TOADSTOOL LED NIGHT LIGHT,0
17522,556222,LARGE CIRCULAR MIRROR MOBILE,0
17522,556222,BALLOON WATER BOMB PACK OF 35,0
17522,552004,VICTORIAN GLASS HANGING T-LIGHT,0
17522,561045,SET/10 BLUE POLKADOT PARTY CANDLES,0
17522,553427,LED TEA LIGHTS,0
17522,552004,SET/20 STRAWBERRY PAPER NAPKINS,0
17522,581361,SET OF 3 CAKE TINS SKETCHBOOK,0
17522,561045,KINGS CHOICE GIANT TUBE MATCHES,0
17522,556222,SWEETHEART WIRE FRUIT BOWL,0
17522,556222,POSY CANDY BAG,0
17522,556222,PACK OF 6 SANDCASTLE FLAGS ASSORTED,0
17522,556222,MINI FUNKY DESIGN TAPES,0
17522,556222,SKULL SHOULDER BAG,0
17522,556222,S/4 PINK FLOWER CANDLES IN BOWL,0
17522,561045,GAOLERS KEYS DECORATIVE GARDEN,0
17522,581361,SET OF 2 ROUND TINS DUTCH CHEESE,0
17522,556222,DISCO BALL CHRISTMAS DECORATION,0
17522,556222,AGED GLASS SILVER T-LIGHT HOLDER,0
17522,556222,LARGE MEDINA STAMPED METAL BOWL,0
17522,556222,Manual,0
17522,556222,STAR PORTABLE TABLE LIGHT,0
17522,561045,"FEATHER PEN,COAL BLACK",0
17522,556222,PINK FLY SWAT,0
17522,556222,SMALL WHITE HEART OF WICKER,0
17522,556222,BLUE FLY SWAT,0
17522,556222,RIDGED GLASS FINGER BOWL,0
17522,556222,TUMBLER BAROQUE,0
17522,556222,SILVER BELLS TABLE DECORATION,0
17522,556222,PINK FLY SWAT,0
17522,556222,REX CASH+CARRY JUMBO SHOPPER,0
17522,556222,SMALL FOLDING SCISSOR(POINTED EDGE),0
17537,543535,EMPIRE UNION JACK TV DINNER TRAY,0
17537,543535,GREY HEART HOT WATER BOTTLE,0
17537,575520,ICE CREAM SUNDAE LIP GLOSS,0
17537,543535,FUNKY DIVA PEN,0
17537,543535,FAIRY CAKE FLANNEL ASSORTED COLOUR,0
17537,543535,TUB 24 PINK FLOWER PEGS,0
17537,543535,HOMEMADE JAM SCENTED CANDLES,0
17537,543535,GREEN MURANO TWIST BRACELET,0
17537,543535,YELLOW EASTER EGG HUNT START POST,0
17537,575520,MIDNIGHT GLAMOUR SCARF KNITTING KIT,0
17537,543535,TURQUOISE CRYSTAL+GLASS BRACELET,0
17537,575520,FRAPPUCINO SCARF KNITTING KIT,0
17537,543535,SET/4 BLUE FLOWER CANDLES IN BOWL,0
17537,543535,PINK SWEETHEART BRACELET,0
17537,543535,SOAP DISH BROCANTE,0
17537,543535,PURPLE SWEETHEART BRACELET,0
17537,543535,IVORY GIANT GARDEN THERMOMETER,0
17537,543535,GREEN ENAMEL FLOWER HAIR TIE,0
17537,543535,WHITE MURANO TWIST BRACELET,0
17537,543535,ANT COPPER RED BOUDICCA BRACELET,0
17537,543535,VINTAGE ROSE BEAD BRACELET BLACK,0
17537,543535,RECIPE BOX RETROSPOT,0
17537,543535,BLACK SWEETHEART BRACELET,0
17537,543535,SET OF 3 BUTTERFLY COOKIE CUTTERS,0
17537,543535,COLOUR GLASS T-LIGHT HOLDER HANGING,0
17537,543535,ROSE COTTAGE KEEPSAKE BOX,0
17537,543535,SET/10 BLUE POLKADOT PARTY CANDLES,0
17537,575520,PENS ASSORTED FUNNY FACE,0
17537,543535,WHITE ENAMEL FLOWER HAIR TIE,0
17537,543535,SET OF 2 TEA TOWELS APPLE AND PEARS,0
17537,543535,HEART OF WICKER SMALL,0
17537,543535,VINTAGE ROSE BEAD BRACELET RASPBERR,0
17537,543535,BUTTERFLY HAIR BAND,0
17537,543535,GRAND CHOCOLATECANDLE,0
17537,543535,S/4 IVORY MINI ROSE CANDLE IN BOWL,0
17537,543535,RECIPE BOX BLUE SKETCHBOOK DESIGN,0
17537,543535,FAIRY CAKES NOTEBOOK A7 SIZE,0
17537,543535,GREEN GIANT GARDEN THERMOMETER,0
17537,575520,ICE CREAM PEN LIP GLOSS,0
17537,543535,FIRE POLISHED GLASS BRACELET BLACK,0
17537,543535,SUMMER FUN DESIGN SHOWER CAP,0
17537,543535,ANT COPPER TURQ BOUDICCA BRACELET,0
17537,543535,SET OF 6 GIRLS CELEBRATION CANDLES,0
17537,543535,BLUE SWEETHEART BRACELET,0
17537,543535,LAUNDRY 15C METAL SIGN,0
17537,543535,PINK CRYSTAL+GLASS BRACELET,0
17537,543535,FUNKY WASHING UP GLOVES ASSORTED,0
17537,543535,CERAMIC CAKE DESIGN SPOTTED PLATE,0
17537,543535,ANT COPPER LIME BOUDICCA BRACELET,0
17537,543535,ANT COPPER PINK BOUDICCA BRACELET,0
17537,543535,JADE CRYSTAL+GLASS BRACELET,0
17537,543535,CITRONELLA CANDLE FLOWERPOT,0
17537,543535,ESSENTIAL BALM 3.5g TIN IN ENVELOPE,0
17537,543535,SMALL CHOCOLATES PINK BOWL,0
17537,543535,CERAMIC CAKE DESIGN SPOTTED MUG,0
17537,575520,CRYSTAL STUD EARRINGS CLEAR DISPLAY,0
17537,543535,S/4 PINK FLOWER CANDLES IN BOWL,0
17537,543535,FAIRY CAKES NOTEBOOK A6 SIZE,0
17537,543535,WHITE TRAVEL ALARM CLOCK,0
17537,543535,SMALL FOLDING SCISSOR(POINTED EDGE),0
17537,575520,PIG KEYRING WITH LIGHT & SOUND,0
17537,543535,SET OF 3 NOTEBOOKS IN PARCEL,0
17537,543535,BLUE MURANO TWIST BRACELET,0
17537,575520,GIANT 50'S CHRISTMAS CRACKER,0
17537,575520,PENS ASSORTED SPACEBALL,0
17537,543535,PEARL CRYSTAL PUMPKIN T-LIGHT HLDR,0
17537,575520,CRYSTAL STUD EARRINGS ASSORTED COL,0
17537,543535,PINK DOUGHNUT TRINKET POT,0
17537,543535,SMALL MARSHMALLOWS PINK BOWL,0
17537,575520,CHRISTMAS PUDDING TRINKET POT,0
17537,543535,AREA PATROLLED METAL SIGN,0
17537,575520,RABBIT NIGHT LIGHT,0
17537,575520,BOX OF 6 CHRISTMAS CAKE DECORATIONS,0
17537,575520,DOUGHNUT LIP GLOSS,0
17633,568829,DRAWER KNOB CRACKLE GLAZE IVORY,0
17633,564746,RED STRIPE CERAMIC DRAWER KNOB,0
17633,564746,RABBIT NIGHT LIGHT,0
17633,568829,RECIPE BOX PANTRY YELLOW DESIGN,0
17633,575078,VINTAGE DOILY DELUXE SEWING KIT,0
17633,563071,JAM MAKING SET WITH JARS,0
17633,575078,SET OF 20 VINTAGE CHRISTMAS NAPKINS,0
17633,568829,VINTAGE CHRISTMAS BUNTING,0
17633,575078,HOME SWEET HOME METAL SIGN,0
17633,575078,"SET 3 RETROSPOT TEA,COFFEE,SUGAR",0
17633,564746,DOORMAT NEW ENGLAND,0
17633,563071,ASSORTED BOTTLE TOP  MAGNETS,0
17633,575078,BOX OF 6 MINI VINTAGE CRACKERS,0
17633,568829,RETROSPOT WOODEN HEART DECORATION,0
17633,563071,HEART OF WICKER SMALL,0
17633,575078,JUMBO BAG 50'S CHRISTMAS,0
17633,568829,LUNCH BAG VINTAGE DOILY,0
17633,575078,JUMBO BAG VINTAGE CHRISTMAS,0
17633,564746,DRAWER KNOB CRACKLE GLAZE IVORY,0
17633,563071,VICTORIAN GLASS HANGING T-LIGHT,0
17633,568829,SET 6 SCHOOL MILK BOTTLES IN CRATE,0
17633,568829,BISCUIT TIN VINTAGE CHRISTMAS,0
17633,568829,VINTAGE CHRISTMAS GIFT SACK,0
17633,563071,LUNCH BAG CARS BLUE,0
17633,564746,SET OF 2 TEA TOWELS APPLE AND PEARS,0
17633,563071,HOME BUILDING BLOCK WORD,0
17633,575078,PLAYING CARDS VINTAGE DOILY,0
17633,563071,RECIPE BOX PANTRY YELLOW DESIGN,0
17633,568829,ROLL WRAP 50'S RED CHRISTMAS,0
17633,568829,CHRISTMAS RETROSPOT ANGEL WOOD,0
17633,563071,DOORMAT SPOTTY HOME SWEET HOME,0
17633,563071,DOORMAT ENGLISH ROSE,0
17633,563071,HOME SWEET HOME METAL SIGN,0
17633,564746,DRAWER KNOB CRACKLE GLAZE BLUE,0
17633,568829,JUMBO BAG VINTAGE CHRISTMAS,0
17633,568829,SET OF 20 VINTAGE CHRISTMAS NAPKINS,0
17633,563071,JUMBO BAG VINTAGE DOILY,0
17633,575078,LUNCH BAG PAISLEY PARK,0
17633,568829,ROLL WRAP 50'S CHRISTMAS,0
17633,575078,JUMBO BAG PAISLEY PARK,0
17633,564746,WHITE SPOT RED CERAMIC DRAWER KNOB,0
17633,564746,DRAWER KNOB CRACKLE GLAZE PINK,0
17633,564746,DRAWER KNOB VINTAGE GLASS STAR,0
17633,575078,SET OF TEA COFFEE SUGAR TINS PANTRY,0
17633,568829,BOX OF 6 MINI VINTAGE CRACKERS,0
17633,568829,VINTAGE CHRISTMAS STOCKING,0
17633,564746,HOME SWEET HOME METAL SIGN,0
17633,568829,ROLL WRAP VINTAGE CHRISTMAS,0
17633,568829,HOME SWEET HOME BOTTLE,0
17633,564746,DOORMAT WELCOME TO OUR HOME,0
17633,563071,ZINC T-LIGHT HOLDER STAR LARGE,0
17633,575078,VINTAGE DOILY JUMBO BAG RED,0
17633,564746,DOORMAT SPOTTY HOME SWEET HOME,0
17633,575078,JUMBO BAG RED RETROSPOT,0
17633,575078,PLAYING CARDS KEEP CALM & CARRY ON,0
17633,563071,LUNCH BAG VINTAGE DOILY,0
17633,563071,ZINC METAL HEART DECORATION,0
17633,568829,CHRISTMAS RETROSPOT STAR WOOD,0
17633,575078,JAM MAKING SET PRINTED,0
17633,568829,ROLL WRAP VINTAGE SPOT,0
17633,575078,JUMBO SHOPPER VINTAGE RED PAISLEY,0
17633,564746,DRAWER KNOB VINTAGE GLASS HEXAGON,0
17633,563071,6 RIBBONS RUSTIC CHARM,0
17633,563071,DOORMAT NEW ENGLAND,0
17633,568829,JUMBO BAG 50'S CHRISTMAS,0
17633,563071,WOOD S/3 CABINET ANT WHITE FINISH,0
17633,563071,SINGLE HEART ZINC T-LIGHT HOLDER,0
17633,563071,LUNCH BAG PINK POLKADOT,0
17633,575078,PHARMACIE FIRST AID TIN,0
17633,563071,JUMBO BAG APPLES,0
18033,569714,12 PENCILS SMALL TUBE SKULL,0
18033,569714,12 PENCILS TALL TUBE WOODLAND,0
18033,569714,SPACEBOY MINI BACKPACK,0
18033,569714,WOODLAND MINI BACKPACK,0
18033,569714,LUNCH BAG VINTAGE LEAF DESIGN,0
18033,569714,SUKI  SHOULDER BAG,0
18033,569714,12 PENCILS TALL TUBE POSY,0
18033,569714,AIRLINE BAG VINTAGE JET SET WHITE,0
18033,569714,PENS ASSORTED FUNNY FACE,0
18033,569714,A4 WALL TIDY RED FLOWERS,0
18033,569714,LUNCH BAG ALPHABET DESIGN,0
18033,569714,SCANDINAVIAN PAISLEY PICNIC BAG,0
18033,569714,A4 WALL TIDY BLUE OFFICE,0
18033,569714,RED RETROSPOT CHARLOTTE BAG,0
18033,569714,SET OF 4 KNICK KNACK TINS DOILY,0
18033,569714,LUNCH BAG VINTAGE DOILY,0
18033,569714,I LOVE LONDON MINI BACKPACK,0
18033,569714,12 PENCIL SMALL TUBE WOODLAND,0
18033,569714,AIRLINE BAG VINTAGE WORLD CHAMPION,0
18033,569714,PENS ASSORTED SPACEBALL,0
18033,569714,POPART WOODEN PENCILS ASST,0
18033,569714,SUKI  SHOULDER BAG,0
18033,569714,WOODLAND CHARLOTTE BAG,0
18033,569714,LUNCH BAG SUKI DESIGN,0
18033,569714,LUNCH BAG SPACEBOY DESIGN,0
18033,569714,AIRLINE BAG VINTAGE TOKYO 78,0
18033,569714,12 PENCILS SMALL TUBE RED RETROSPOT,0
18033,569714,DOLLY GIRL MINI BACKPACK,0
18033,569714,SMALL POP BOX FUNKY MONKEY,0
18033,569714,SKULL SHOULDER BAG,0
18033,569714,LUNCH BAG CARS BLUE,0
18033,569714,LUNCH BAG DOLLY GIRL DESIGN,0
18033,569714,POPART RECT PENCIL SHARPENER ASST,0
