14758,551439,COFFEE MUG APPLES DESIGN,0
14758,547793,LANTERN CREAM GAZEBO,0
14758,560282,MINT GREEN ROSE TOWEL,0
14758,547793,PENCIL CASE LIFE IS BEAUTIFUL,0
14758,553662,PARISIENNE SEWING BOX,0
14758,551439,CREAM SWEETHEART MINI CHEST,0
14758,553662,SMALL PARISIENNE HEART PHOTO FRAME,0
14758,547793,RED RETROSPOT CAKE STAND,0
14758,553662,COFFEE MUG BLUE PAISLEY DESIGN,0
14758,547793,PACK OF 6 BIRDY GIFT TAGS,0
14758,553662,DAIRY MAID LARGE MILK JUG,0
14758,551439,FAMILY PHOTO FRAME CORNICE,0
14758,551439,FAMILY ALBUM WHITE PICTURE FRAME,0
14758,547793,FAMILY ALBUM WHITE PICTURE FRAME,0
14758,547793,COFFEE MUG PINK PAISLEY DESIGN,0
14758,553662,PARISIENNE KEY CABINET,0
14790,548455,CACTI T-LIGHT CANDLES,0
14790,575849,PASTEL COLOUR HONEYCOMB FAN,0
14790,548455,LUNCH BAG  BLACK SKULL.,0
14790,563161,MULTICOLOUR HONEYCOMB FAN,0
14790,575849,LUNCH BAG RED RETROSPOT,0
14790,578111,PACK OF 72 SKULL CAKE CASES,0
14790,563161,BIRDCAGE DECORATION TEALIGHT HOLDER,0
14790,575849,MULTICOLOUR HONEYCOMB FAN,0
14790,563161,12 PENCILS TALL TUBE WOODLAND,0
14790,548455,OWL DOORSTOP,0
14790,548455,WOODLAND CHARLOTTE BAG,0
14790,563161,LUNCH BAG RED RETROSPOT,0
14790,548455,LUNCH BAG SUKI DESIGN,0
14790,563161,LUNCH BAG WOODLAND,0
14790,548455,SPACE OWL,0
14790,563161,BOUDOIR SQUARE TISSUE BOX,0
14790,563161,12 PENCILS TALL TUBE RED RETROSPOT,0
14790,548455,12 PENCILS TALL TUBE RED RETROSPOT,0
14790,575849,LUNCH BAG WOODLAND,0
14790,563161,LUNCH BAG SUKI DESIGN,0
14790,563161,SET/4 BIRD MIRROR MAGNETS,0
14790,575849,LUNCH BAG  BLACK SKULL.,0
14790,548455,12 PENCILS TALL TUBE SKULLS,0
14790,563161,RED TOADSTOOL LED NIGHT LIGHT,0
14790,575849,BOX OF 24 COCKTAIL PARASOLS,0
14790,563161,LUNCH BAG  BLACK SKULL.,0
14790,563161,CHARLOTTE BAG SUKI DESIGN,0
14790,575849,PLASTERS IN TIN SKULLS,0
14790,575849,LUNCH BAG SUKI DESIGN,0
14790,575849,ASSORTED COLOURS SILK FAN,0
14790,575849,BIRDCAGE DECORATION TEALIGHT HOLDER,0
14790,575849,RED HEART SHAPE LOVE BUCKET,0
14790,563161,PSYCHEDELIC TILE HOOK,0
14790,578111,CHRISTMAS LIGHTS 10 REINDEER,0
14790,578111,CHILLI LIGHTS,0
14790,575849,WOODLAND CHARLOTTE BAG,0
14790,563161,CACTI T-LIGHT CANDLES,0
14790,575849,CHARLOTTE BAG SUKI DESIGN,0
14790,563161,SET/6 EAU DE NIL BIRD T-LIGHTS,0
14790,563161,WOODLAND CHARLOTTE BAG,0
14790,578111,PACK OF 72 RETROSPOT CAKE CASES,0
14790,548455,"ART LIGHTS,FUNK MONKEY",0
14790,548455,12 PENCILS TALL TUBE WOODLAND,0
14790,563161,PASTEL COLOUR HONEYCOMB FAN,0
14790,578111,ASSORTED COLOURS SILK FAN,0
14790,563161,SET/6 PINK BIRD T-LIGHT CANDLES,0
14842,573020,HAND WARMER UNION JACK,0
14842,555158,PANTRY ROLLING PIN,0
14842,573020,GREEN REGENCY TEACUP AND SAUCER,0
14842,555158,PACK OF 12 SUKI TISSUES,0
14842,573020,50'S CHRISTMAS PAPER GIFT BAG,0
14842,573020,SET OF 3 BUTTERFLY COOKIE CUTTERS,0
14842,555158,SET 7 BABUSHKA NESTING BOXES,0
14842,573020,12 PENCILS TALL TUBE SKULLS,0
14842,573020,JUMBO BAG VINTAGE LEAF,0
14842,555158,SET 6 PAPER TABLE LANTERN HEARTS,0
14842,565598,ALARM CLOCK BAKELIKE PINK,0
14842,573020,PANTRY CHOPPING BOARD,0
14842,573020,12 PENCILS TALL TUBE RED RETROSPOT,0
14842,555158,PACK OF 60 DINOSAUR CAKE CASES,0
14842,573020,REGENCY MILK JUG PINK,0
14842,573020,PLAYING CARDS KEEP CALM & CARRY ON,0
14842,573020,HAND WARMER OWL DESIGN,0
14842,555158,JAM MAKING SET WITH JARS,0
14842,555158,RED DINER WALL CLOCK,0
14842,573020,CARD HOLDER LOVE BIRD LARGE,0
14842,573020,SET OF 20 VINTAGE CHRISTMAS NAPKINS,0
14842,573020,TRADITIONAL KNITTING NANCY,0
14842,555158,BAKING SET 9 PIECE RETROSPOT,0
14842,555158,DOORMAT 3 SMILEY CATS,0
14842,565598,ALARM CLOCK BAKELIKE IVORY,0
14842,573020,VINTAGE CHRISTMAS GIFT BAG LARGE,0
14842,555158,PACK OF 6 BIRDY GIFT TAGS,0
14842,555158,JUMBO STORAGE BAG SUKI,0
14842,555158,RED RETROSPOT OVEN GLOVE,0
14842,555158,SPOTTY BUNTING,0
14842,573020,VINTAGE LEAF CHOPPING BOARD,0
14842,555158,PICNIC BASKET WICKER LARGE,0
14842,555158,SUKI  SHOULDER BAG,0
14842,573020,VINTAGE CHRISTMAS PAPER GIFT BAG,0
14842,555158,FELTCRAFT CUSHION OWL,0
14842,555158,ROSES REGENCY TEACUP AND SAUCER,0
14842,573020,PAPER CHAIN KIT 50'S CHRISTMAS,0
14842,573020,POPPY FIELDS CHOPPING BOARD,0
14842,555158,RECIPE BOX PANTRY YELLOW DESIGN,0
14842,555158,36 PENCILS TUBE SKULLS,0
14842,573020,BUNDLE OF 3 RETRO NOTE BOOKS,0
14842,555158,FAIRY TALE COTTAGE NIGHTLIGHT,0
14842,555158,MINI PAINT SET VINTAGE,0
14842,565598,PARTY BUNTING,0
14842,573020,STORAGE TIN VINTAGE DOILY,0
14842,555158,BABUSHKA LIGHTS STRING OF 10,0
14842,573020,JUMBO BAG VINTAGE CHRISTMAS,0
14842,573020,PINK CREAM FELT CRAFT TRINKET BOX,0
14842,555158,PINK FLORAL FELTCRAFT SHOULDER BAG,0
14842,555158,IVORY DINER WALL CLOCK,0
14842,573020,BLUE REFECTORY CLOCK,0
14842,573020,STORAGE TIN VINTAGE LEAF,0
14842,555158,PINK REGENCY TEACUP AND SAUCER,0
14842,565598,SET OF 3 CAKE TINS PANTRY DESIGN,0
14842,555158,PACK OF 6 PANNETONE GIFT BOXES,0
14842,555158,REGENCY TEA PLATE ROSES,0
14842,555158,PACK OF 12 RED RETROSPOT TISSUES,0
14842,573020,JUMBO BAG 50'S CHRISTMAS,0
14842,555158,FELTCRAFT CUSHION RABBIT,0
14842,555158,36 PENCILS TUBE RED RETROSPOT,0
14842,565598,VINTAGE DONKEY TAIL GAME,0
14842,573020,SET OF 3 CAKE TINS PANTRY DESIGN,0
14842,555158,JAM MAKING SET PRINTED,0
14842,555158,SET OF 10 LED DOLLY LIGHTS,0
14842,573020,GUMBALL COAT RACK,0
14842,573020,HAND WARMER BIRD DESIGN,0
14842,573020,RABBIT NIGHT LIGHT,0
14842,555158,BUNDLE OF 3 RETRO NOTE BOOKS,0
14842,573020,GROW A FLYTRAP OR SUNFLOWER IN TIN,0
14842,573020,VINTAGE CHRISTMAS STOCKING,0
14842,573020,VINTAGE SNAP CARDS,0
14842,555158,ZINC T-LIGHT HOLDER STARS SMALL,0
14842,573020,BISCUIT TIN 50'S CHRISTMAS,0
14842,555158,FELTCRAFT 6 FLOWER FRIENDS,0
14842,565598,SET OF 60 PANTRY DESIGN CAKE CASES,0
14842,573020,GARDENERS KNEELING PAD KEEP CALM,0
14842,573020,PINK FLORAL FELTCRAFT SHOULDER BAG,0
14842,555158,ALARM CLOCK BAKELIKE CHOCOLATE,0
14842,543253,VINTAGE RED KITCHEN CABINET,0
14842,555158,BUNDLE OF 3 SCHOOL EXERCISE BOOKS,0
14842,555158,DOORMAT UNION FLAG,0
14842,555158,CHARLOTTE BAG SUKI DESIGN,0
14842,565598,SET OF 4 KNICK KNACK TINS DOILEY,0
14842,555158,FELTCRAFT DOLL MOLLY,0
14842,555158,REGENCY TEA PLATE PINK,0
14842,555158,6 RIBBONS RUSTIC CHARM,0
14842,573020,RED FLORAL FELTCRAFT SHOULDER BAG,0
14842,555158,ALARM CLOCK BAKELIKE RED,0
14842,573020,SILVER STARS TABLE DECORATION,0
14842,555158,MEMO BOARD RETROSPOT  DESIGN,0
14842,573020,SET OF 72 RETROSPOT PAPER  DOILIES,0
14842,555158,GUMBALL COAT RACK,0
14842,555158,DOORMAT WELCOME PUPPIES,0
14842,565598,DOILEY STORAGE TIN,0
14842,573020,ENAMEL BREAD BIN CREAM,0
14842,555158,ASSORTED COLOUR MINI CASES,0
14842,555158,HANGING HEART ZINC T-LIGHT HOLDER,0
14842,565598,FELTCRAFT CUSHION BUTTERFLY,0
14842,573020,ROSES REGENCY TEACUP AND SAUCER,0
14842,573020,FELTCRAFT CUSHION OWL,0
14842,555158,DOORMAT HEARTS,0
14842,573020,ASSORTED COLOUR BIRD ORNAMENT,0
14842,555158,ALARM CLOCK BAKELIKE PINK,0
14842,555158,GREEN REGENCY TEACUP AND SAUCER,0
14842,573020,SET OF TEA COFFEE SUGAR TINS PANTRY,0
14842,573020,BISCUIT TIN VINTAGE CHRISTMAS,0
14842,555158,FOOD COVER WITH BEADS SET 2,0
14842,573020,JINGLE BELL HEART DECORATION,0
14842,555158,SET/5 RED RETROSPOT LID GLASS BOWLS,0
14842,573020,HOT WATER BOTTLE KEEP CALM,0
14842,555158,GUMBALL MAGAZINE RACK,0
14842,555158,REGENCY CAKESTAND 3 TIER,0
14842,555158,ASSORTED COLOUR BIRD ORNAMENT,0
14842,543253,ALARM CLOCK BAKELIKE RED,0
14842,555158,PAPER CHAIN KIT RETROSPOT,0
14842,555158,SET 6 PAPER TABLE LANTERN STARS,0
14842,573020,FELTCRAFT CHRISTMAS FAIRY,0
14842,555158,SET 10 NIGHT OWL LIGHTS,0
14842,555158,SET OF 20 KIDS COOKIE CUTTERS,0
14842,555158,SET OF 4 PANTRY JELLY MOULDS,0
14842,573020,HOMEMADE JAM SCENTED CANDLES,0
14842,555158,PAPER CHAIN KIT EMPIRE,0
14842,555158,HOMEMADE JAM SCENTED CANDLES,0
14842,565598,SET OF 3 REGENCY CAKE TINS,0
14842,555158,DOORMAT KEEP CALM AND COME IN,0
14842,555158,36 PENCILS TUBE WOODLAND,0
14842,555158,MAKE YOUR OWN FLOWERPOWER CARD KIT,0
14842,555158,MAKE YOUR OWN MONSOON CARD KIT,0
14842,555158,DOORMAT VINTAGE LEAVES DESIGN,0
14842,573020,50'S CHRISTMAS GIFT BAG LARGE,0
14842,573020,CHILDRENS APRON APPLES DESIGN,0
14842,555158,COLOUR GLASS T-LIGHT HOLDER HANGING,0
14842,555158,PACK OF 20 NAPKINS PANTRY DESIGN,0
14842,573020,ALARM CLOCK BAKELIKE PINK,0
14842,555158,FELTCRAFT DOLL EMILY,0
14842,573020,PEG BAG APPLES DESIGN,0
14842,555158,MAKE YOUR OWN PLAYTIME CARD KIT,0
14842,555158,JUMBO BAG VINTAGE LEAF,0
14842,573020,ALARM CLOCK BAKELIKE RED,0
14842,565598,SPOTTY BUNTING,0
14842,555158,LUNCH BOX WITH CUTLERY RETROSPOT,0
14842,573020,PAPER CHAIN KIT VINTAGE CHRISTMAS,0
14842,555158,REGENCY TEA PLATE GREEN,0
14842,565598,JUMBO BAG VINTAGE LEAF,0
14842,555158,PACK OF 6 HANDBAG GIFT BOXES,0
15165,536539,PLASTERS IN TIN WOODLAND ANIMALS,2
15165,536539,STAR PORTABLE TABLE LIGHT,2
15165,536539,HOMEMADE JAM SCENTED CANDLES,2
15165,536539,RECYCLING BAG RETROSPOT,2
15165,536539,CREAM SWEETHEART WALL CABINET,2
15165,536539,HOT WATER BOTTLE TEA AND SYMPATHY,2
15165,536539,3 HOOK PHOTO SHELF ANTIQUE WHITE,2
15165,536539,FAWN BLUE HOT WATER BOTTLE,2
15165,536539,FAIRY CAKE BIRTHDAY CANDLE SET,2
15165,536539,DOORMAT ENGLISH ROSE,2
15165,536539,HAND WARMER RED RETROSPOT,2
15165,536539,VINTAGE UNION JACK APRON,2
15165,536539,ENGLISH ROSE HOT WATER BOTTLE,2
15165,536539,ROMANTIC IMAGES NOTEBOOK SET,2
15165,536539,DOORMAT UNION FLAG,2
15165,536539,SET OF 6 T-LIGHTS TOADSTOOLS,2
15165,536539,WOOD S/3 CABINET ANT WHITE FINISH,2
15165,536539,CURIOUS  IMAGES NOTEBOOK SET,2
15165,536539,REGENCY CAKESTAND 3 TIER,2
15165,536539,HAND WARMER BIRD DESIGN,2
15165,536539,ROUND SNACK BOXES SET OF4 WOODLAND,2
15165,536539,PLASTERS IN TIN VINTAGE PAISLEY,2
15165,536539,RED GINGHAM ROSE JEWELLERY BOX,2
15165,536539,METAL 4 HOOK HANGER FRENCH CHATEAU,2
15165,536539,GRAND CHOCOLATECANDLE,2
15165,536539,VINTAGE KEEPSAKE BOX PARIS DAYS,2
15165,536539,DOORMAT TOPIARY,2
15171,540983,PINK BABY BUNTING,2
15171,540983,RED BABY BUNTING,2
15171,540983,VINTAGE UNION JACK BUNTING,2
15171,540983,TEA TIME PARTY BUNTING,2
15171,540983,PAPER BUNTING RETROSPOT,2
15246,550290,MINI PAINT SET VINTAGE,2
15246,539089,EASTER TIN KEEPSAKE,2
15246,539089,FELTCRAFT 6 FLOWER FRIENDS,2
15246,539089,WHITE HANGING HEART T-LIGHT HOLDER,2
15246,539089,GLITTER BUTTERFLY CLIPS,2
15246,550290,POPPY'S PLAYHOUSE BEDROOM,2
15246,550290,COFFEE MUG APPLES DESIGN,2
15246,550290,POPPY'S PLAYHOUSE LIVINGROOM,2
15246,550290,CHILDRENS DOLLY GIRL MUG,2
15246,550290,TABLECLOTH RED APPLES DESIGN,2
15246,539089,GREEN 3 PIECE POLKADOT CUTLERY SET,2
15246,550290,GLASS JAR KINGS CHOICE,2
15246,550290,FELTCRAFT CUSHION RABBIT,2
15246,539089,FELTCRAFT DOLL MOLLY,2
15246,550290,REGENCY CAKESTAND 3 TIER,2
15246,550290,FELTCRAFT PRINCESS CHARLOTTE DOLL,2
15246,550290,STRAWBERRY CERAMIC TRINKET BOX,2
15246,550290,POPPY'S PLAYHOUSE KITCHEN,2
15246,539089,HAIRCLIPS FORTIES FABRIC ASSORTED,2
15246,539089,JUMBO STORAGE BAG SUKI,2
15246,539089,ALARM CLOCK BAKELIKE IVORY,2
15246,550290,GLITTER HANGING BUTTERFLY STRING,2
15246,550290,ALARM CLOCK BAKELIKE RED,2
15246,550290,SMALL PURPLE BABUSHKA NOTEBOOK,2
15246,550290,CANDLEHOLDER PINK HANGING HEART,2
15246,550290,POPPY'S PLAYHOUSE BATHROOM,2
15246,550290,FELTCRAFT PRINCESS LOLA DOLL,2
15246,539089,COFFEE MUG APPLES DESIGN,2
15246,550290,LUNCH BAG SUKI  DESIGN,2
15246,550290,FELTCRAFT CUSHION OWL,2
15246,539089,NATURAL SLATE HEART CHALKBOARD,2
15246,550290,GLASS JAR ENGLISH CONFECTIONERY,2
15246,539089,PINK CREAM FELT CRAFT TRINKET BOX,2
15399,577074,CHRISTMAS METAL POSTCARD WITH BELLS,0
15399,577074,DAISY NOTEBOOK,0
15399,577074,OVEN MITT APPLES DESIGN,0
15399,567678,GARDENERS KNEELING PAD KEEP CALM,0
15399,577074,BLUE PAISLEY POCKET BOOK,0
15399,577074,MAGIC SHEEP WOOL GROWING FROM PAPER,0
15399,581383,VINTAGE HEADS AND TAILS CARD GAME,0
15399,577074,ROMANTIC IMAGES GIFT WRAP SET,0
15399,581383,LUNCH BAG APPLE DESIGN,0
15399,581383,VINTAGE SNAKES & LADDERS,0
15399,581383,HOLIDAY FUN LUDO,0
15399,567678,VICTORIAN SEWING BOX SMALL,0
15399,581383,ROTATING LEAVES T-LIGHT HOLDER,0
15399,581383,PAPER CHAIN KIT VINTAGE CHRISTMAS,0
15399,567678,SET OF 4 JAM JAR MAGNETS,0
15399,577074,PACK OF 20 NAPKINS RED APPLES,0
15399,577074,GIFT BAG PSYCHEDELIC APPLES,0
15399,567678,HAND WARMER SCOTTY DOG DESIGN,0
15399,567678,LUNCH BAG APPLE DESIGN,0
15399,567678,SET OF 3 REGENCY CAKE TINS,0
15399,581383,MAGIC SHEEP WOOL GROWING FROM PAPER,0
15399,577074,CURIOUS IMAGES GIFT WRAP SET,0
15399,577074,CHRYSANTHEMUM NOTEBOOK,0
15399,577074,BOHEMIAN COLLAGE STATIONERY SET,0
15399,581383,SET OF 20 VINTAGE CHRISTMAS NAPKINS,0
15399,567678,LUNCH BAG ALPHABET DESIGN,0
15399,567678,TRADITIONAL KNITTING NANCY,0
15399,581383,PAPERWEIGHT VINTAGE COLLAGE,0
15399,581383,FOLK ART METAL STAR T-LIGHT HOLDER,0
15399,581383,GARDENERS KNEELING PAD KEEP CALM,0
15399,581383,LUNCH BAG RED RETROSPOT,0
15399,581383,FOLKART STAR CHRISTMAS DECORATIONS,0
15399,577074,GROW YOUR OWN BASIL IN ENAMEL MUG,0
15399,567678,SET OF 6 SPICE TINS PANTRY DESIGN,0
15399,577074,OFFICE MUG WARMER POLKADOT,0
15399,581383,PINK VINTAGE PAISLEY PICNIC BAG,0
15399,577074,CHRISTMAS HANGING STAR WITH BELL,0
15399,581383,GARDENERS KNEELING PAD CUP OF TEA,0
15399,567678,PAPER CHAIN KIT VINTAGE CHRISTMAS,0
15399,577074,PAINTED METAL PEARS ASSORTED,0
15399,567678,TRADITIONAL WOODEN CATCH CUP GAME,0
15399,581383,4 PEAR BOTANICAL DINNER CANDLES,0
15399,581383,PAPER CHAIN KIT 50'S CHRISTMAS,0
15399,577074,GIN + TONIC DIET METAL SIGN,0
15399,567678,LUNCH BAG WOODLAND,0
15399,581383,PINK BITTY LIGHT CHAIN,0
15399,567678,DELUXE SEWING KIT,0
15399,567678,PAPER CHAIN KIT 50'S CHRISTMAS,0
15399,567678,HAND WARMER BIRD DESIGN,0
15399,577074,CARD PSYCHEDELIC APPLES,0
16114,557672,RECIPE BOX PANTRY YELLOW DESIGN,2
16114,557672,GREEN REGENCY TEACUP AND SAUCER,2
16114,557672,PINK REGENCY TEACUP AND SAUCER,2
16114,557672,SET OF TEA COFFEE SUGAR TINS PANTRY,2
16114,557672,3 TRADITIONAl BISCUIT CUTTERS  SET,2
16114,557672,SET OF 3 CAKE TINS PANTRY DESIGN,2
16114,557672,ROSES REGENCY TEACUP AND SAUCER,2
16114,557672,CALENDAR PAPER CUT DESIGN,2
17183,571290,ENAMEL BREAD BIN CREAM,1
17183,580147,BREAD BIN DINER STYLE RED,1
17183,571290,HOT WATER BOTTLE TEA AND SYMPATHY,1
17183,571290,HOT WATER BOTTLE KEEP CALM,1
17183,577063,EMPIRE TISSUE BOX,1
17183,577063,HAND WARMER SCOTTY DOG DESIGN,1
17183,571290,ASSORTED COLOUR BIRD ORNAMENT,1
17183,571290,BLUE GIANT GARDEN THERMOMETER,1
17183,571290,COSY HOUR CIGAR BOX MATCHES,1
17183,577063,CHOCOLATE HOT WATER BOTTLE,1
17183,580147,HAND WARMER UNION JACK,1
17183,571290,IVORY DINER WALL CLOCK,1
17183,573386,WOODEN STAR CHRISTMAS SCANDINAVIAN,1
17183,574832,EMPIRE TISSUE BOX,1
17183,574832,CHOCOLATE HOT WATER BOTTLE,1
17183,564668,SET OF 12 FORK CANDLES,1
17183,571290,4 TRADITIONAL SPINNING TOPS,1
17183,573386,YELLOW GIANT GARDEN THERMOMETER,1
17183,573386,LANDMARK FRAME OXFORD STREET,1
17183,564668,KNITTED UNION FLAG HOT WATER BOTTLE,1
17183,574832,VINTAGE DOILY TRAVEL SEWING KIT,1
17183,577063,HOT WATER BOTTLE TEA AND SYMPATHY,1
17183,564668,ENGLISH ROSE GARDEN SECATEURS,1
17183,580147,HAND WARMER SCOTTY DOG DESIGN,1
17183,564668,ENGLISH ROSE SPIRIT LEVEL,1
17183,571290,VINTAGE DOILY TRAVEL SEWING KIT,1
17183,577063,KNITTED UNION FLAG HOT WATER BOTTLE,1
17183,580147,CHOCOLATE HOT WATER BOTTLE,1
17183,574832,HOT WATER BOTTLE KEEP CALM,1
17183,564668,ASS FLORAL PRINT MULTI SCREWDRIVER,1
17183,571290,EMPIRE TISSUE BOX,1
17183,580147,SCOTTIE DOG HOT WATER BOTTLE,1
17183,571290,ASSORTED BOTTLE TOP  MAGNETS,1
17183,574832,SET OF 12 FORK CANDLES,1
17183,573386,DOORMAT UNION FLAG,1
17183,573386,HANGING HEART JAR T-LIGHT HOLDER,1
17183,571290,IVORY REFECTORY CLOCK,1
17183,574832,HOT WATER BOTTLE I AM SO POORLY,1
17183,571290,SET OF 12 FORK CANDLES,1
17183,573386,PACK OF SIX LED TEA LIGHTS,1
17183,571290,EGG FRYING PAN IVORY,1
17183,574832,COSY HOUR CIGAR BOX MATCHES,1
17183,571290,ENAMEL WASH BOWL CREAM,1
17183,571290,ALARM CLOCK BAKELIKE IVORY,1
17183,573386,COSY HOUR CIGAR BOX MATCHES,1
17183,580147,EGG FRYING PAN IVORY,1
17183,573386,CHOCOLATE HOT WATER BOTTLE,1
17183,571290,DOORMAT UNION FLAG,1
17183,577063,SCOTTIE DOG HOT WATER BOTTLE,1
17183,573386,HAND WARMER UNION JACK,1
17183,571290,KNITTED UNION FLAG HOT WATER BOTTLE,1
17183,571290,YELLOW GIANT GARDEN THERMOMETER,1
17183,580147,HOT WATER BOTTLE I AM SO POORLY,1
17183,580147,HOT WATER BOTTLE TEA AND SYMPATHY,1
17183,571290,ENAMEL FLOWER JUG CREAM,1
17183,574832,BREAD BIN DINER STYLE RED,1
17183,580147,HOT WATER BOTTLE KEEP CALM,1
17183,571290,ENAMEL WATERING CAN CREAM,1
17183,580147,GREY HEART HOT WATER BOTTLE,1
17183,573386,HAND WARMER OWL DESIGN,1
17183,571290,CHRISTMAS METAL TAGS ASSORTED,1
17183,574832,HOT WATER BOTTLE TEA AND SYMPATHY,1
17183,564668,CHOCOLATE HOT WATER BOTTLE,1
17183,571290,BREAD BIN DINER STYLE RED,1
17183,564668,SCOTTIE DOG HOT WATER BOTTLE,1
17183,577063,HAND WARMER UNION JACK,1
17183,571290,SET OF 4 SANTA PLACE SETTINGS,1
17183,580147,SET OF 12 FORK CANDLES,1
17183,564668,KINGS CHOICE GIANT TUBE MATCHES,1
17183,571290,POTTERING MUG,1
17183,571290,HAND WARMER UNION JACK,1
17183,564668,VINTAGE  2 METER FOLDING RULER,1
17183,580147,KINGS CHOICE TEA CADDY,1
17768,580059,WHITE SKULL HOT WATER BOTTLE,0
17768,558100,DOORMAT HEARTS,0
17768,574709,DOORMAT KEEP CALM AND COME IN,0
17768,574709,HOT WATER BOTTLE I AM SO POORLY,0
17768,574709,DOORMAT HOME SWEET HOME BLUE,0
17768,574709,TRAVEL CARD WALLET RETROSPOT,0
17768,574709,MULTI HEARTS  STICKERS,0
17768,558100,DOORMAT ENGLISH ROSE,0
17768,574709,DOORMAT UNION FLAG,0
17768,574709,PLASTERS IN TIN VINTAGE PAISLEY,0
17768,580059,GRAND CHOCOLATECANDLE,0
17768,574709,3 HEARTS HANGING DECORATION RUSTIC,0
17768,558100,STEEL SWEETHEART ROUND TABLE CREAM,0
17768,580059,POPCORN HOLDER,0
17768,558100,DOORMAT HOME SWEET HOME BLUE,0
17768,574709,RABBIT NIGHT LIGHT,0
17768,574709,CREAM SWEETHEART MINI CHEST,0
17768,574709,FRYING PAN RED RETROSPOT,0
17768,558100,DOORMAT SPOTTY HOME SWEET HOME,0
17768,574709,JUMBO BAG PINK POLKADOT,0
17768,574709,PAPER CHAIN KIT VINTAGE CHRISTMAS,0
17768,580059,SCOTTIE DOG HOT WATER BOTTLE,0
17768,580059,HAND WARMER UNION JACK,0
17768,574709,HAND WARMER UNION JACK,0
17768,580059,HAND WARMER UNION JACK,0
17768,558100,IVORY REFECTORY CLOCK,0
17768,574709,SET OF 20 KIDS COOKIE CUTTERS,0
17768,574709,RED RETROSPOT WRAP,0
17768,574709,DOLLY GIRL LUNCH BOX,0
17768,558100,DOORMAT UNION JACK GUNS AND ROSES,0
17768,558100,BATH BUILDING BLOCK WORD,0
17768,580059,CHRISTMAS RETROSPOT STAR WOOD,0
17768,574709,MILK PAN RED RETROSPOT,0
17768,574709,SET OF 6 T-LIGHTS SNOWMEN,0
17768,574709,PIZZA PLATE IN BOX,0
17768,574709,JUMBO STORAGE BAG SKULLS,0
17768,574709,KEY RING BASEBALL BOOT UNION JACK,0
17768,574709,HAND WARMER OWL DESIGN,0
17768,580059,RED WOOLLY HOTTIE WHITE HEART.,0
17768,574709,KEY RING BASEBALL BOOT ASSORTED,0
17768,574709,SWEETIES  STICKERS,0
17768,558100,PINK POLKADOT WRAP,0
17768,580059,TV DINNER TRAY DOLLY GIRL,0
17768,558100,ZINC T-LIGHT HOLDER STARS SMALL,0
17768,558100,WOODEN SKITTLES GARDEN SET,0
17768,574709,JUMBO SHOPPER VINTAGE RED PAISLEY,0
17768,574709,DOUGHNUT LIP GLOSS,0
17768,558100,DOORMAT RED RETROSPOT,0
17768,558100,BLUE POLKADOT WRAP,0
17768,580059,GARDENERS KNEELING PAD KEEP CALM,0
17768,574709,OFFICE MUG WARMER PINK,0
17768,574709,PLASTERS IN TIN SPACEBOY,0
17768,574709,DOORMAT PEACE ON EARTH BLUE,0
17768,580059,SPACEBOY TV DINNER TRAY,0
17768,574709,JINGLE BELL HEART DECORATION,0
17768,580059,SET OF 6 T-LIGHTS SANTA,0
17768,580059,SCOTTIE DOG HOT WATER BOTTLE,0
17768,558100,DOORMAT KEEP CALM AND COME IN,0
17768,574709,DOORMAT RED RETROSPOT,0
17768,574709,PINK POLKADOT WRAP,0
17768,558100,HOME BUILDING BLOCK WORD,0
17768,558100,DOORMAT UNION FLAG,0
17768,574709,JUMBO BAG RED RETROSPOT,0
17768,574709,FULL ENGLISH BREAKFAST PLATE,0
17768,574709,HOT WATER BOTTLE I AM SO POORLY,0
17768,574709,POPCORN HOLDER,0
17768,580059,SET OF 6 T-LIGHTS SNOWMEN,0
17768,574709,TRAVEL CARD WALLET KEEP CALM,0
17768,580059,FULL ENGLISH BREAKFAST PLATE,0
17768,558100,T-LIGHT HOLDER HANGING LACE,0
17768,574709,SET OF 6 T-LIGHTS SANTA,0
17768,574709,CHRISTMAS RETROSPOT ANGEL WOOD,0
17768,580059,HOT WATER BOTTLE KEEP CALM,0
17768,558100,CREAM SWEETHEART MINI CHEST,0
17768,574709,WRAP CHRISTMAS VILLAGE,0
17768,558100,REX CASH+CARRY JUMBO SHOPPER,0
17768,574709,JUMBO BAG VINTAGE CHRISTMAS,0
17768,574709,CHRISTMAS RETROSPOT STAR WOOD,0
17768,558100,ZINC HEARTS PLANT POT HOLDER,0
17768,574709,PINK VINTAGE SPOT BEAKER,0
17768,558100,BLUE REFECTORY CLOCK,0
17768,574709,BLUE POLKADOT WRAP,0
17768,574709,CHRISTMAS RETROSPOT TREE WOOD,0
17768,574709,DOORMAT CHRISTMAS VILLAGE,0
17768,580059,GARDENERS KNEELING PAD CUP OF TEA,0
17768,580059,HOT WATER BOTTLE I AM SO POORLY,0
17768,580059,HAND WARMER RED LOVE HEART,0
17768,574709,60 CAKE CASES VINTAGE CHRISTMAS,0
17768,574709,JUMBO BAG SPACEBOY DESIGN,0
17768,580059,CHRISTMAS RETROSPOT ANGEL WOOD,0
17768,574709,HAND WARMER RED LOVE HEART,0
17768,580059,KEY RING BASEBALL BOOT UNION JACK,0
17768,580059,CHOCOLATE HOT WATER BOTTLE,0
17768,558100,CITRONELLA CANDLE FLOWERPOT,0
17768,574709,BROCADE RING PURSE,0
17768,574709,SPACEBOY LUNCH BOX,0
17768,580059,CHRISTMAS RETROSPOT TREE WOOD,0
17768,574709,TRAVEL CARD WALLET SKULLS,0
17824,571895,MINI JIGSAW SPACEBOY,0
17824,571895,PACK OF 12 TRADITIONAL CRAYONS,0
17824,571895,MINI JIGSAW DOLLY GIRL,0
17824,571895,TRADITIONAL MODELLING CLAY,0
17824,571895,PLAYING CARDS I LOVE LONDON,0
17824,571895,VINTAGE SNAKES & LADDERS,0
17824,571895,PLAYING CARDS KEEP CALM & CARRY ON,0
17824,571895,WORLD WAR 2 GLIDERS ASSTD DESIGNS,0
17824,571895,SET 12 COLOUR PENCILS LOVE LONDON,0
17824,571895,COLOURING PENCILS BROWN TUBE,0
17824,571895,PACK OF 12 COLOURED PENCILS,0
17824,571895,VINTAGE SNAP CARDS,0
17824,571895,WOODEN BOX OF DOMINOES,0
17955,551823,OPEN CLOSED METAL SIGN,2
17955,551823,WASHROOM METAL SIGN,2
17955,551826,SET 12 KIDS  WHITE CHALK STICKS,2
17955,551823,MULTICOLOUR HONEYCOMB FAN,2
17955,551962,RECYCLED ACAPULCO MAT TURQUOISE,2
17955,551962,RECYCLED ACAPULCO MAT LAVENDER,2
17955,551823,BEACH HUT MIRROR,2
17955,551823,IVORY DINER WALL CLOCK,2
17955,551826,SET 12 KIDS COLOUR  CHALK STICKS,2
17955,551823,RECYCLED ACAPULCO MAT TURQUOISE,2
17955,551823,S/2 BEACH HUT TREASURE CHESTS,2
17955,551962,RECYCLED ACAPULCO MAT PINK,2
17955,551823,RECYCLED ACAPULCO MAT PINK,2
17955,551823,RECYCLED ACAPULCO MAT GREEN,2
17955,551823,RECYCLED ACAPULCO MAT BLUE,2
17955,551962,RECYCLED ACAPULCO MAT BLUE,2
17955,551823,RECYCLED ACAPULCO MAT LAVENDER,2
17955,551962,RECYCLED ACAPULCO MAT GREEN,2
17955,554639,LARGE CIRCULAR MIRROR MOBILE,2
