16984,562031,FRENCH LAUNDRY SIGN BLUE METAL,1
16984,562031,VICTORIAN SEWING BOX SMALL,1
16984,562031,JUMBO  BAG BAROQUE BLACK WHITE,1
16984,566408,PLASTERS IN TIN SPACEBOY,1
16984,566408,ENGLISH ROSE HOT WATER BOTTLE,1
16984,566408,REGENCY CAKESTAND 3 TIER,1
16984,566408,OPEN CLOSED METAL SIGN,1
16984,562031,VICTORIAN GLASS HANGING T-LIGHT,1
16984,562031,SAVE THE PLANET MUG,1
16984,562031,PLASTERS IN TIN SKULLS,1
16984,562031,SMALL ZINC HEART WALL ORGANISER,1
16984,562031,ROUND CAKE TIN VINTAGE RED,1
16984,562031,VINTAGE GLASS T-LIGHT HOLDER,1
16984,566408,PAINTED METAL HEART WITH HOLLY BELL,1
16984,562031,BREAD BIN DINER STYLE IVORY,1
16984,562031,IVORY WIRE KITCHEN ORGANISER,1
16984,566408,PARTY INVITES WOODLAND,1
16984,562031,SMALL SILVER FLOWER CANDLE POT,1
16984,566408,AREA PATROLLED METAL SIGN,1
16984,562031,WHITE BROCANTE SOAP DISH,1
16984,562031,DOORMAT NEW ENGLAND,1
16984,562031,FRENCH TOILET SIGN BLUE METAL,1
16984,562031,SPOTTY BUNTING,1
16984,562031,FRENCH BLUE METAL DOOR SIGN 1,1
16984,562031,EDWARDIAN PARASOL RED,1
16984,566408,SHELF WITH 4 HOOKS HOME SWEET HOME,1
16984,566408,MINI JIGSAW GO TO THE FAIR,1
16984,562031,FRENCH BLUE METAL DOOR SIGN 6,1
16984,562031,WASHROOM METAL SIGN,1
16984,562031,METAL 4 HOOK HANGER FRENCH CHATEAU,1
16984,562031,QUEENS GUARD COFFEE MUG,1
16984,566408,RED DAISY POCKET BOOK,1
16984,562031,MINIATURE ANTIQUE ROSE HOOK IVORY,1
16984,562031,ZINC SWEETHEART SOAP DISH,1
16984,562031,MORE BUTTER METAL SIGN,1
16984,562031,BLUE GIANT GARDEN THERMOMETER,1
16984,562031,CREAM CUPID HEARTS COAT HANGER,1
16984,562031,FLUTED ANTIQUE CANDLE HOLDER,1
16984,562031,DOORMAT FANCY FONT HOME SWEET HOME,1
16984,562031,ZINC T-LIGHT HOLDER STARS SMALL,1
16984,566408,LADIES & GENTLEMEN METAL SIGN,1
16984,566408,ENAMEL MEASURING JUG CREAM,1
16984,562031,PSYCHEDELIC TILE COASTER,1
16984,562031,FRENCH WC SIGN BLUE METAL,1
16984,562031,DOORMAT RED RETROSPOT,1
16984,566408,DECORATIVE CATS BATHROOM BOTTLE,1
16984,562031,OPEN CLOSED METAL SIGN,1
16984,562031,ANTIQUE SILVER TEA GLASS ENGRAVED,1
16984,566408,REINDEER HEART DECORATION GOLD,1
16984,562031,3 TIER CAKE TIN GREEN AND CREAM,1
16984,562031,SPOTTY BUNTING,1
16984,562031,WHITE WIRE EGG HOLDER,1
16984,562031,VINTAGE ROSE BEAD BRACELET RASPBERR,1
16984,566408,PAPERWEIGHT KINGS CHOICE,1
16984,562031,POTTERING IN THE SHED METAL SIGN,1
16984,566408,HOME SWEET HOME HOOK,1
16984,562031,GAOLERS KEYS DECORATIVE GARDEN,1
16984,562031,ENAMEL FIRE BUCKET CREAM,1
16984,562031,HOME SWEET HOME MUG,1
16984,562031,DOORMAT BLACK FLOCK,1
16984,562031,SCANDINAVIAN PAISLEY PICNIC BAG,1
16984,562031,GINGHAM HEART  DOORSTOP RED,1
16984,562031,SWEETHEART WIRE WALL TIDY,1
16984,566408,PARTY INVITES DINOSAURS,1
16984,566408,PAPERWEIGHT VINTAGE COLLAGE,1
16984,562031,PHARMACIE FIRST AID TIN,1
16984,562031,GUMBALL MAGAZINE RACK,1
16984,562031,HYACINTH BULB T-LIGHT CANDLES,1
16984,562031,BATHROOM METAL SIGN,1
16984,566408,BAG 500g SWIRLY MARBLES,1
16984,562031,HANGING HEART ZINC T-LIGHT HOLDER,1
16984,562031,DRAWER KNOB VINTAGE GLASS BALL,1
16984,562031,BEWARE OF THE CAT METAL SIGN,1
16984,562031,BISCUIT TIN VINTAGE GREEN,1
16984,562031,T-LIGHT GLASS FLUTED ANTIQUE,1
16984,562031,HEART FILIGREE DOVE  SMALL,1
16984,562031,DECORATIVE FLORE BATHROOM BOTTLE,1
16984,566408,VINTAGE SEASIDE JIGSAW PUZZLES,1
16984,566408,GLASS APOTHECARY BOTTLE PERFUME,1
16984,562031,METAL SIGN EMPIRE TEA,1
16984,562031,WOOD BLACK BOARD ANT WHITE FINISH,1
16984,562031,"\"FLOWER GLASS GARLAND NECKL.36\"\"GREEN\"",1
16984,566408,METAL SIGN DROP YOUR PANTS,1
16984,566408,LAUREL HEART ANTIQUE GOLD,1
16984,566408,ANGEL DECORATION STARS ON DRESS,1
16984,566408,DOVE DECORATION PAINTED ZINC,1
16984,562031,GLASS JAR MARMALADE,1
16984,562031,ASSORTED COLOUR MINI CASES,1
16984,562031,SET 4 VALENTINE DECOUPAGE HEART BOX,1
16984,562031,WHITE SOAP RACK WITH 2 BOTTLES,1
16984,562031,ENAMEL WATERING CAN CREAM,1
16984,562031,FILIGRIS HEART WITH BUTTERFLY,1
16984,562031,MEMO BOARD RETROSPOT  DESIGN,1
16984,562031,VINTAGE ROSE BEAD BRACELET BLACK,1
16984,566408,BLUE PAISLEY NOTEBOOK,1
16984,562031,DOORMAT HOME SWEET HOME BLUE,1
16984,566408,PLEASE ONE PERSON METAL SIGN,1
16984,566408,PLASTERS IN TIN WOODLAND ANIMALS,1
16984,566408,WHITE ROCKING HORSE HAND PAINTED,1
16984,562031,HOME SWEET HOME METAL SIGN,1
16984,562031,PINK VINTAGE PAISLEY PICNIC BAG,1
16984,562031,LOVEBIRD HANGING DECORATION WHITE,1
16984,562031,SET OF 2 WOODEN MARKET CRATES,1
16984,566408,PLASTERS IN TIN WOODLAND ANIMALS,1
16984,562031,SOAP DISH BROCANTE,1
16984,562031,PARTY METAL SIGN,1
16984,562031,FRENCH BLUE METAL DOOR SIGN 0,1
16984,562031,MINT KITCHEN SCALES,1
16984,562031,COFFEE MUG BLUE PAISLEY DESIGN,1
16984,562031,GREEN GIANT GARDEN THERMOMETER,1
16984,562031,DOORMAT NEIGHBOURHOOD WITCH,1
16984,562031,PINK SWEETHEART BRACELET,1
16984,566408,SPOTTY BUNTING,1
16984,562031,FRENCH BLUE METAL DOOR SIGN 6,1
16984,562031,TRAVEL CARD WALLET UNION JACK,1
16984,562031,HANGING HEART WITH BELL,1
16984,562031,JUMBO BAG APPLES,1
16984,562031,BROCADE RING PURSE,1
16984,566408,PAPERWEIGHT CHILDHOOD MEMORIES,1
16984,566408,CHAMBRE HOOK,1
16984,562031,CREAM SWEETHEART MINI CHEST,1
16984,566408,PARTY INVITES BALLOON GIRL,1
16984,562031,FRENCH ENAMEL WATER BASIN,1
16984,566408,MINI JIGSAW SPACEBOY,1
16984,562031,LONDON BUS COFFEE MUG,1
16984,562031,BREAD BIN DINER STYLE RED,1
16984,562031,BLUE VICTORIAN FABRIC OVAL BOX,1
16984,566408,ABSTRACT CIRCLES POCKET BOOK,1
16984,562031,CHEST OF DRAWERS GINGHAM HEART,1
16984,566408,MAGIC DRAWING SLATE PURDEY,1
16984,566408,GLASS JAR ENGLISH CONFECTIONERY,1
16984,562031,GLASS JAR KINGS CHOICE,1
16984,562031,RED/CREAM STRIPE CUSHION COVER,1
16984,562031,FRENCH BLUE METAL DOOR SIGN 3,1
16984,566408,CHRISTMAS TREE PAINTED ZINC,1
16984,566408,BUFFALO BILL TREASURE BOOK BOX,1
16984,562031,HEART IVORY TRELLIS SMALL,1
16984,562031,BLACK SWEETHEART BRACELET,1
16984,562031,FRENCH BLUE METAL DOOR SIGN 7,1
16984,566408,GLASS JAR PEACOCK BATH SALTS,1
16984,562031,RED COAT RACK PARIS FASHION,1
16984,562031,ZINC SWEETHEART WIRE LETTER RACK,1
16984,562031,DECORATIVE CATS BATHROOM BOTTLE,1
16984,562031,RED KITCHEN SCALES,1
16984,566408,GLASS JAR MARMALADE,1
16984,566408,CHOCOLATE HOT WATER BOTTLE,1
16984,562031,BROCANTE SHELF WITH HOOKS,1
16984,562031,AGED GLASS SILVER T-LIGHT HOLDER,1
16984,566408,S/6 WOODEN SKITTLES IN COTTON BAG,1
16984,566408,VINTAGE SNAKES & LADDERS,1
16984,566408,GLASS JAR DIGESTIVE BISCUITS,1
16984,562031,WHITE BROCANTE SOAP DISH,1
16984,562031,HELLO SAILOR BATHROOM SET,1
16984,566408,PLASTERS IN TIN STRONGMAN,1
16984,566408,PICTURE DOMINOES,1
16984,562031,KINGS CHOICE BISCUIT TIN,1
16984,562031,DOORMAT NEW ENGLAND,1
16984,562031,AREA PATROLLED METAL SIGN,1
16984,562031,SET OF 6 HERB TINS SKETCHBOOK,1
16984,562031,IF YOU CAN'T STAND THE HEAT MUG,1
16984,562031,PURPLE SWEETHEART BRACELET,1
16984,566408,HEADS AND TAILS SPORTING FUN,1
16984,562031,WOODEN ROUNDERS GARDEN SET,1
16984,562031,DRAWER KNOB CERAMIC IVORY,1
16984,566408,CHRISTMAS TREE HANGING SILVER,1
16984,562031,RED VICTORIAN FABRIC OVAL BOX,1
16984,566408,STAR WREATH DECORATION WITH BELL,1
16984,562031,JAM MAKING SET WITH JARS,1
16984,562031,VINTAGE RED ENAMEL TRIM JUG,1
16984,562031,BROWN CHECK CAT DOORSTOP,1
16984,566408,BOX OF VINTAGE JIGSAW BLOCKS,1
16984,562031,DOORSTOP RETROSPOT HEART,1
16984,562031,SWEETHEART WIRE FRUIT BOWL,1
16984,562031,FLOWER GARLAND NECKLACE RED,1
16984,562031,JUMBO BAG SCANDINAVIAN BLUE PAISLEY,1
16984,562031,RED BOUDICCA LARGE BRACELET,1
16984,566408,GLASS APOTHECARY BOTTLE ELIXIR,1
16984,566408,PARTY METAL SIGN,1
16984,566408,DECORATIVE FLORE BATHROOM BOTTLE,1
16984,562031,MEDIUM CERAMIC TOP STORAGE JAR,1
16984,562031,BLUE/CREAM STRIPE CUSHION COVER,1
16984,566408,DOUGHNUT LIP GLOSS,1
16984,566408,SET OF 10 LED DOLLY LIGHTS,1
16984,562031,DOORMAT 3 SMILEY CATS,1
16984,566408,LAUREL STAR ANTIQUE SILVER,1
16984,562031,FIRE POLISHED GLASS BRACELET GREEN,1
16984,566408,WASHROOM METAL SIGN,1
16984,566408,PAPERWEIGHT HOME SWEET HOME,1
16984,562031,HOT BATHS SOAP HOLDER,1
16984,562031,SINGLE ANTIQUE ROSE HOOK IVORY,1
16984,562031,DOORMAT TOPIARY,1
16984,562031,DECORATIVE ROSE BATHROOM BOTTLE,1
16984,562031,FRENCH BLUE METAL DOOR SIGN 8,1
16984,562031,SILVER HANGING T-LIGHT HOLDER,1
16984,562031,VINTAGE CREAM CAT FOOD CONTAINER,1
16984,566408,TREASURE TIN GYMKHANA DESIGN,1
16984,562031,"AIRLINE LOUNGE,METAL SIGN",1
16984,562031,DOORMAT UNION JACK GUNS AND ROSES,1
16984,562031,WOODEN FRAME ANTIQUE WHITE,1
16984,566408,GYMKHANA TREASURE BOOK BOX,1
16984,562031,SWEETHEART CAKESTAND 3 TIER,1
16984,562031,HANGING HEART JAR T-LIGHT HOLDER,1
16984,562031,ASSORTED COLOUR BIRD ORNAMENT,1
16984,562031,IVORY SWEETHEART SOAP DISH,1
16984,562031,DOORMAT FAIRY CAKE,1
16984,566408,WASHROOM METAL SIGN,1
16984,562031,LA PALMIERA TILE COASTER,1
16984,562031,KNEELING MAT HOUSEWORK  DESIGN,1
16984,566408,BULL DOG BOTTLE OPENER,1
16984,562031,DRAWER KNOB CRACKLE GLAZE IVORY,1
16984,562031,BLACK/BLUE POLKADOT UMBRELLA,1
16984,562031,HELLO SAILOR BLUE SOAP HOLDER,1
16984,562031,PLASTERS IN TIN WOODLAND ANIMALS,1
16984,566408,GLASS JAR ENGLISH CONFECTIONERY,1
16984,562031,FRENCH BATHROOM SIGN BLUE METAL,1
16984,562031,CHOCOLATE THIS WAY METAL SIGN,1
16984,562031,YOU'RE CONFUSING ME METAL SIGN,1
16984,562031,ROSE COTTAGE KEEPSAKE BOX,1
16984,562031,JUMBO SHOPPER VINTAGE RED PAISLEY,1
16984,566408,REINDEER HEART DECORATION SILVER,1
16984,562031,VINTAGE UNION JACK BUNTING,1
16984,566408,LAUNDRY 15C METAL SIGN,1
16984,562031,GLASS JAR DAISY FRESH COTTON WOOL,1
16984,566408,MINI JIGSAW BAKE A CAKE,1
16984,566408,HOLIDAY FUN LUDO,1
16984,566408,MORE BUTTER METAL SIGN,1
16984,562031,TURQ+RED BOUDICCA LARGE BRACELET,1
16984,566408,GLASS JAR KINGS CHOICE,1
16984,562031,GLASS JAR PEACOCK BATH SALTS,1
16984,562031,IVORY WIRE SWEETHEART LETTER TRAY,1
16984,562031,DOORMAT ENGLISH ROSE,1
16984,566408,WHITE SKULL HOT WATER BOTTLE,1
16984,562031,JUMBO BAG RED RETROSPOT,1
16984,566408,TREASURE TIN BUFFALO BILL,1
16984,566408,GREEN FERN NOTEBOOK,1
16984,562031,VINTAGE CREAM DOG FOOD CONTAINER,1
16984,562031,FIRST AID TIN,1
16984,562031,FRENCH ENAMEL WATER BASIN,1
16984,566408,FILIGREE HEART BUTTERFLY WHITE,1
16984,562031,WHITE WIRE EGG HOLDER,1
16984,562031,KINGS CHOICE MUG,1
16984,562031,VINTAGE UNION JACK CUSHION COVER,1
16984,562031,PEARL CRYSTAL PUMPKIN T-LIGHT HLDR,1
16984,562031,FLOWERS TILE COASTER,1
16984,562031,WOODEN PICTURE FRAME WHITE FINISH,1
16984,566408,"RETRO PILL BOX KEY CHAIN,THE KING",1
16984,562031,PLASTERS IN TIN STRONGMAN,1
16984,562031,VINTAGE UNION JACK BUNTING,1
16984,562031,SET OF 3 CAKE TINS SKETCHBOOK,1
16984,562031,GOLD/M.O.P PENDANT ORBIT NECKLACE,1
16984,566408,VINTAGE SNAP CARDS,1
16984,566408,LAUREL STAR ANTIQUE GOLD,1
16984,562031,SALLE DE BAIN HOOK,1
16984,562031,FINE WICKER HEART,1
16984,562031,SMALL BLUE PROVENCAL CERAMIC BALL,1
16984,562031,EDWARDIAN PARASOL NATURAL,1
16984,566408,REGENCY CAKESTAND 3 TIER,1
16984,562031,PARTY BUNTING,1
16984,562031,ROUND CAKE TIN VINTAGE GREEN,1
16984,562031,UNION STRIPE CUSHION COVER,1
16984,566408,SET OF 6 SOLDIER SKITTLES,1
16984,562031,VICTORIAN SEWING BOX MEDIUM,1
16984,562031,DOORMAT AIRMAIL,1
16984,562031,PINK HEART OF GLASS BRACELET,1
16984,566408,CLASSIC GLASS COOKIE JAR,1
16984,566408,HOT WATER BOTTLE KEEP CALM,1
16984,566408,HEART WREATH DECORATION WITH BELL,1
16984,566408,RED ROCKING HORSE HAND PAINTED,1
16984,562031,HAND OVER THE CHOCOLATE   SIGN,1
16984,566408,RED RETROSPOT BUTTER DISH,1
16984,562031,WAKE UP COCKEREL TILE COASTER,1
16984,566408,GLASS JAR DIGESTIVE BISCUITS,1
16984,562031,ENAMEL WASH BOWL CREAM,1
16984,562031,JUMBO BAG DOILEY PATTERNS,1
16984,562031,HANGING HEART MIRROR DECORATION,1
16984,562031,DOORMAT HEARTS,1
16984,562031,SAVE THE PLANET MUG,1
16984,562031,ZINC WIRE KITCHEN ORGANISER,1
16984,566408,PARTY BUNTING,1
16984,566408,CHRYSANTHEMUM POCKET BOOK,1
16984,562031,GIN + TONIC DIET METAL SIGN,1
16984,562031,FRENCH BLUE METAL DOOR SIGN 4,1
16984,562031,COFFEE MUG PINK PAISLEY DESIGN,1
16984,562031,PLASTERS IN TIN SPACEBOY,1
16984,562031,GIN AND TONIC MUG,1
16984,562031,HEART DECORATION WITH PEARLS,1
16984,566408,CLASSIC CAFE SUGAR DISPENSER,1
16984,566408,SET 12 KIDS COLOUR  CHALK STICKS,1
16984,562031,PLASTERS IN TIN VINTAGE PAISLEY,1
16984,562031,PICNIC BASKET WICKER SMALL,1
16984,566408,MAGIC DRAWING SLATE LEAP FROG,1
16984,566408,VINTAGE BILLBOARD DRINK ME MUG,1
16984,562031,IVORY KITCHEN SCALES,1
16984,562031,STRAWBERRY SHOPPER BAG,1
16984,562031,PURPLE BOUDICCA LARGE BRACELET,1
16984,566408,CHRISTMAS TREE HANGING GOLD,1
16984,562031,GLASS JAR ENGLISH CONFECTIONERY,1
16984,562031,GLASS JAR DIGESTIVE BISCUITS,1
16984,562031,BLUE COAT RACK PARIS FASHION,1
16984,562031,LAUNDRY 15C METAL SIGN,1
16984,566408,MAGIC DRAWING SLATE BUNNIES,1
16984,562031,TOILET SIGN OCCUPIED OR VACANT,1
16984,562031,JUMBO BAG STRAWBERRY,1
16984,562031,SMALL CERAMIC TOP STORAGE JAR,1
16984,562031,VINTAGE UNION JACK MEMOBOARD,1
16984,566408,STAR DECORATION PAINTED ZINC,1
16984,562031,JUMBO BAG PINK VINTAGE PAISLEY,1
16984,566408,VINTAGE RED ENAMEL TRIM JUG,1
16984,562031,VINTAGE BILLBOARD LOVE/HATE MUG,1
16984,562031,GLASS APOTHECARY BOTTLE PERFUME,1
16984,562031,TRIPLE HOOK ANTIQUE IVORY ROSE,1
16984,562031,FRENCH KITCHEN SIGN BLUE METAL,1
16984,562031,TRAVEL CARD WALLET KEEP CALM,1
16984,562031,MAN FLU METAL SIGN,1
16984,566408,ABC TREASURE BOOK BOX,1
16984,562031,DOORMAT SPOTTY HOME SWEET HOME,1
16984,562031,GOLD M PEARL  ORBIT NECKLACE,1
16984,566408,LOVE HOT WATER BOTTLE,1
16984,566408,ANGEL DECORATION 3 BUTTONS,1
16984,562031,FRENCH GARDEN SIGN BLUE METAL,1
16984,562031,FRENCH BLUE METAL DOOR SIGN 5,1
16984,562031,GARDENERS KNEELING PAD KEEP CALM,1
16984,566408,MAGIC DRAWING SLATE CIRCUS PARADE,1
16984,566408,LAUREL HEART ANTIQUE SILVER,1
16984,562031,FLORAL BATHROOM SET,1
16984,562031,GREEN HEART OF GLASS BRACELET,1
16984,566408,MAGIC DRAWING SLATE DOLLY GIRL,1
16984,566408,TREASURE ISLAND BOOK BOX,1
16984,562031,ENCHANTED BIRD COATHANGER 5 HOOK,1
16984,562031,WHITE SOAP RACK WITH 2 BOTTLES,1
16984,562031,EMERGENCY FIRST AID TIN,1
16984,566408,MAGIC DRAWING SLATE SPACEBOY,1
16984,566408,SET OF 4 KNICK KNACK TINS POPPIES,1
16984,562031,GARDENERS KNEELING PAD CUP OF TEA,1
16984,566408,FILIGREE HEART DAISY WHITE,1
16984,562031,IVORY HANGING DECORATION  HEART,1
16984,562031,WHITE WOOD GARDEN PLANT LADDER,1
16984,562031,GLAMOROUS  MUG,1
16984,562031,SINGLE HEART ZINC T-LIGHT HOLDER,1
16984,562031,RED RETROSPOT MINI CASES,1
16984,566408,PAPERWEIGHT SAVE THE PLANET,1
16984,566408,ANGEL DECORATION PAINTED ZINC,1
16984,562031,SET OF 3 CAKE TINS PANTRY DESIGN,1
16984,566408,PARTY INVITES FOOTBALL,1
16984,562031,PLASTERS IN TIN CIRCUS PARADE,1
16984,562031,WOODEN CROQUET GARDEN SET,1
16984,562031,ENAMEL BREAD BIN CREAM,1
16984,562031,DOORMAT WELCOME PUPPIES,1
16984,562031,CACTI T-LIGHT CANDLES,1
16984,562031,CREAM SWEETHEART EGG HOLDER,1
16984,562031,FRENCH TOILET SIGN BLUE METAL,1
16984,562031,BULL DOG BOTTLE TOP WALL CLOCK,1
16984,562031,RED RETROSPOT SHOPPER BAG,1
16984,562031,GOLD M.O.P ORBIT BRACELET,1
16984,566408,REINDEER HEART DECORATION SILVER,1
16984,562031,NO SINGING METAL SIGN,1
16984,562031,RED RETROSPOT UMBRELLA,1
16984,562031,REGENCY CAKESTAND 3 TIER,1
16984,566408,TRADITIONAL WOODEN CATCH CUP GAME,1
16984,562031,JUMBO  BAG BAROQUE BLACK WHITE,1
16984,562031,ANT COPPER LIME BOUDICCA BRACELET,1
16984,566408,STAR DECORATION RUSTIC,1
16984,562031,PICNIC BASKET WICKER LARGE,1
16984,566408,MAGIC DRAWING SLATE DINOSAUR,1
16984,566408,TRADITIONAL WOODEN SKIPPING ROPE,1
16984,566408,SWISS CHALET TREE DECORATION,1
16984,562031,WHITE JEWELLED HEART DECORATION,1
16984,562031,HANGING CHICK CREAM DECORATION,1
16984,562031,CLEAR DRAWER KNOB ACRYLIC EDWARDIAN,1
16984,566408,PLASTERS IN TIN CIRCUS PARADE,1
16984,562031,GLASS APOTHECARY BOTTLE ELIXIR,1
16984,562031,YELLOW COAT RACK PARIS FASHION,1
16984,562031,ENAMEL FLOWER JUG CREAM,1
16984,562031,ZINC HERB GARDEN CONTAINER,1
16984,566408,ICE CREAM PEN LIP GLOSS,1
16984,562031,PARLOUR CERAMIC WALL HOOK,1
16984,562031,HANGING JAM JAR T-LIGHT HOLDER,1
16984,566408,"AIRLINE LOUNGE,METAL SIGN",1
17153,576568,MINI LIGHTS WOODLAND MUSHROOMS,0
17153,576568,JUMBO BAG RED RETROSPOT,0
17153,576568,WALL ART STOP FOR TEA,0
17153,576568,SET OF 10 LED DOLLY LIGHTS,0
17153,576568,JUMBO BAG VINTAGE CHRISTMAS,0
17153,576568,RED RETROSPOT CHARLOTTE BAG,0
17153,576568,RABBIT NIGHT LIGHT,0
17153,576568,CHARLOTTE BAG DOLLY GIRL DESIGN,0
17153,576568,CHARLOTTE BAG PINK POLKADOT,0
17153,576568,HOMEMADE JAM SCENTED CANDLES,0
17153,576568,JUMBO BAG SPACEBOY DESIGN,0
17153,576568,BAKING SET 9 PIECE RETROSPOT,0
17153,576568,JUMBO BAG PINK POLKADOT,0
17153,576568,VINTAGE SNAKES & LADDERS,0
17375,538655,BLUE TV TRAY TABLE,2
17375,554509,CARD BILLBOARD FONT,2
17375,554509,PHARMACIE FIRST AID TIN,2
17375,542741,BROCADE RING PURSE,2
17375,538655,MOROCCAN TEA GLASS,2
17375,538655,PACK/12 XMAS FUN CARD,2
17375,542741,"WRAP, BILLBOARD FONTS DESIGN",2
17375,554509,JUMBO BAG TOYS,2
17375,538655,RIBBON REEL HEARTS DESIGN,2
17375,538655,LARGE POPCORN HOLDER,2
17375,554509,GIN + TONIC DIET METAL SIGN,2
17375,554509,JUMBO BAG ALPHABET,2
17375,554509,MEMO BOARD RETROSPOT  DESIGN,2
17375,554509,FRYING PAN UNION FLAG,2
17375,554509,SWEETHEART WIRE FRUIT BOWL,2
17375,554509,ROMANTIC PINKS RIBBONS,2
17375,542741,12 PENCILS SMALL TUBE SKULL,2
17375,554509,FRYING PAN PINK POLKADOT,2
17375,554509,SMALL POPCORN HOLDER,2
17375,538655,PINK DOG CANNISTER,2
17375,542741,CANDY SHOP  STICKER SHEET,2
17375,554509,JUMBO BAG DOLLY GIRL DESIGN,2
17375,542741,ELEPHANT CLIP W SUCTION CUP,2
17375,554509,PINK FLY SWAT,2
17375,538655,SET/5 RED RETROSPOT LID GLASS BOWLS,2
17375,538655,TV DINNER TRAY AIR HOSTESS,2
17375,542741,PARTY INVITES DINOSAURS,2
17375,538655,PACK OF 60 MUSHROOM CAKE CASES,2
17375,542741,SET OF 6 3D KIT CARDS FOR KIDS,2
17375,542741,PARTY TIME PENCIL ERASERS,2
17375,554509,VINTAGE UNION JACK APRON,2
17375,542741,FRYING PAN UNION FLAG,2
17375,554509,DOORMAT FANCY FONT HOME SWEET HOME,2
17375,538655,PINK PAISLEY SQUARE TISSUE BOX,2
17375,554509,SMALL RED RETROSPOT WINDMILL,2
17375,542741,DINOSAUR PARTY BAG + STICKER SET,2
17375,538655,SMALL POPCORN HOLDER,2
17375,542741,MAGIC DRAWING SLATE SPACEBOY,2
17375,538655,ORANGE TV TRAY TABLE,2
17375,554509,CREAM SWEETHEART MINI CHEST,2
17375,542741,12 PENCIL SMALL TUBE WOODLAND,2
17375,542741,FRYING PAN PINK POLKADOT,2
17375,554509,BABY BOOM RIBBONS,2
17375,538655,72 SWEETHEART FAIRY CAKE CASES,2
17375,538655,RIBBON REEL POLKADOTS,2
17375,542741,BLUE TV TRAY TABLE,2
17375,554509,PINK PAISLEY SQUARE TISSUE BOX,2
17375,542741,TUB 24 PINK FLOWER PEGS,2
17375,542741,VINTAGE CARAVAN GIFT WRAP,2
17375,542741,ORANGE TV TRAY TABLE,2
17375,554509,ENAMEL MEASURING JUG CREAM,2
17375,538655,SMALL HANGING IVORY/RED WOOD BIRD,2
17375,538655,WRAP CHRISTMAS SCREEN PRINT,2
17375,542741,MAGIC DRAWING SLATE DOLLY GIRL,2
17375,538655,75 GREEN PETIT FOUR CASES,2
17375,542741,RETROSPOT PARTY BAG + STICKER SET,2
17375,538655,IVORY KITCHEN SCALES,2
17375,554509,JUMBO  BAG BAROQUE BLACK WHITE,2
17375,542741,WRAP MONSTER FUN,2
17375,554509,JUMBO BAG RED RETROSPOT,2
17375,554509,ENGLISH ROSE METAL WASTE BIN,2
17375,554509,DECORATIVE PLANT POT WITH FRIEZE,2
17375,538655,RED DRAGONFLY HELICOPTER,2
17375,542741,STRAWBERRY LUNCH BOX WITH CUTLERY,2
17375,554509,WHITE HEARTS WIRE PLANT POT HOLDER,2
17375,554509,FUNKY WASHING UP GLOVES ASSORTED,2
17375,538655,PACK OF 60 PINK PAISLEY CAKE CASES,2
17375,542741,PARTY INVITES JAZZ HEARTS,2
17375,538655,TEA TIME KITCHEN APRON,2
17696,559330,WRAP BILLBOARD FONTS DESIGN,1
17696,555734,METAL 4 HOOK HANGER FRENCH CHATEAU,1
17696,559330,SUKI  SHOULDER BAG,1
17696,573888,MOTORING TISSUE BOX,1
17696,545826,WOOD S/3 CABINET ANT WHITE FINISH,1
17696,573888,PACK OF 12 SUKI TISSUES,1
17696,573888,PINK POLKADOT WRAP,1
17696,564170,CARAVAN SQUARE TISSUE BOX,1
17696,561076,PINK GLASS CANDLEHOLDER,1
17696,573888,POMPOM CURTAIN,1
17696,559330,ASSORTED BOTTLE TOP  MAGNETS,1
17696,564170,VINTAGE CARAVAN GREETING CARD,1
17696,561076,WOODEN PICTURE FRAME WHITE FINISH,1
17696,573888,FANCY FONTS BIRTHDAY WRAP,1
17696,545826,VANILLA INCENSE IN TIN,1
17696,559330,SINGLE ANTIQUE ROSE HOOK IVORY,1
17696,564170,PACK OF 12 SUKI TISSUES,1
17696,559330,CERAMIC CAKE DESIGN SPOTTED MUG,1
17696,573888,ASSORTED BOTTLE TOP  MAGNETS,1
17696,545826,WRAP SUKI AND FRIENDS,1
17696,545826,WOODEN PICTURE FRAME WHITE FINISH,1
17696,561076,REGENCY TEAPOT ROSES,1
17696,573888,SET OF 6 T-LIGHTS SANTA,1
17696,564170,STRAWBERRY SHOPPER BAG,1
17696,564170,NO SINGING METAL SIGN,1
17696,564170,PARTY BUNTING,1
17696,559330,WRAP PINK FAIRY CAKES,1
17696,573888,PACK OF 12 SKULL TISSUES,1
17696,559330,"\"LETTER \"\"A\"\" BLING KEY RING\"",1
17696,555734,STRAWBERRY SHOPPER BAG,1
17696,573888,PACK OF 12 HEARTS DESIGN TISSUES,1
17696,559330,SET OF 6 T-LIGHTS TOADSTOOLS,1
17696,538178,CERAMIC PLATE STRAWBERRY DESIGN,1
17696,559330,"\"LETTER \"\"E\"\" BLING KEY RING\"",1
17696,573888,HOT BATHS METAL SIGN,1
17696,561076,RED RETROSPOT ROUND CAKE TINS,1
17696,564170,FAIRY CAKES NOTEBOOK A6 SIZE,1
17696,559330,DAIRY MAID TRADITIONAL TEAPOT,1
17696,555734,"SET 3 RETROSPOT TEA,COFFEE,SUGAR",1
17696,538178,CERAMIC CAKE DESIGN SPOTTED PLATE,1
17696,559330,FRENCH TOILET SIGN BLUE METAL,1
17696,564170,NO JUNK MAIL METAL SIGN,1
17696,559330,VINTAGE CARAVAN GREETING CARD,1
17696,573888,STRAWBERRY SHOPPER BAG,1
17696,573888,SLEEPING CAT ERASERS,1
17696,538178,STRAWBERRY FAIRY CAKE TEAPOT,1
17696,564170,ASSORTED BOTTLE TOP  MAGNETS,1
17696,561076,HOME SWEET HOME METAL SIGN,1
17696,573888,PINK GLASS CANDLEHOLDER,1
17696,564170,SKULLS SQUARE TISSUE BOX,1
17696,573888,SET OF 6 T-LIGHTS SNOWMEN,1
17696,545826,SET OF 6 T-LIGHTS TOADSTOOLS,1
17696,545826,BLUE POLKADOT WRAP,1
17696,538179,SET OF 6 T-LIGHTS SNOWMEN,1
17696,559330,STRAWBERRY SHOPPER BAG,1
17696,573888,CREAM CUPID HEARTS COAT HANGER,1
17696,545826,PAPER BUNTING COLOURED LACE,1
17696,559330,REGENCY TEAPOT ROSES,1
17696,545826,WOODEN FRAME ANTIQUE WHITE,1
17696,555734,WOOD 2 DRAWER CABINET WHITE FINISH,1
17696,545826,SLEEPING CAT ERASERS,1
17696,561076,CREAM CUPID HEARTS COAT HANGER,1
17696,561076,NO SINGING METAL SIGN,1
17696,564170,PACK OF 12 SKULL TISSUES,1
17696,564170,FRIDGE MAGNETS LA VIE EN ROSE,1
17696,545826,PAPER BUNTING RETROSPOT,1
17696,564170,DAIRY MAID TRADITIONAL TEAPOT,1
17696,559330,SKULLS AND CROSSBONES WRAP,1
17696,538178,POMPOM CURTAIN,1
17696,559330,SKULL SHOULDER BAG,1
17696,573888,RED RETROSPOT SHOPPER BAG,1
17696,545826,RED RETROSPOT WRAP,1
17696,555734,PAPER BUNTING COLOURED LACE,1
17696,561076,RED GINGHAM ROSE JEWELLERY BOX,1
17696,555734,NO JUNK MAIL METAL SIGN,1
17696,559330,FRENCH LAUNDRY SIGN BLUE METAL,1
17696,538178,CERAMIC STRAWBERRY DESIGN MUG,1
17696,559330,"\"LETTER \"\"C\"\" BLING KEY RING\"",1
17696,561076,POMPOM CURTAIN,1
17696,561076,BEWARE OF THE CAT METAL SIGN,1
17696,555734,SMALL HEART FLOWERS HOOK,1
17696,559330,CARD SUKI BIRTHDAY,1
17696,559330,FRIDGE MAGNETS LA VIE EN ROSE,1
17696,545826,SET/4 RED MINI ROSE CANDLE IN BOWL,1
17696,555734,HOME SWEET HOME METAL SIGN,1
17696,555734,RED RETROSPOT ROUND CAKE TINS,1
17696,564170,FRIDGE MAGNETS US DINER ASSORTED,1
17696,573888,FRIDGE MAGNETS US DINER ASSORTED,1
17696,559330,4 IVORY DINNER CANDLES SILVER FLOCK,1
17696,545826,CARD SUKI BIRTHDAY,1
17696,561076,WOODEN FRAME ANTIQUE WHITE,1
17696,561076,LAUNDRY 15C METAL SIGN,1
17696,538178,SET OF SALT AND PEPPER TOADSTOOLS,1
17696,559330,PINK GLASS CANDLEHOLDER,1
17696,545826,ASSORTED INCENSE PACK,1
17696,545826,SET OF SALT AND PEPPER TOADSTOOLS,1
17696,559330,6 RIBBONS RUSTIC CHARM,1
17696,573888,FRENCH KITCHEN SIGN BLUE METAL,1
17696,545826,PIGGY BANK RETROSPOT,1
17696,559330,WOODEN CROQUET GARDEN SET,1
17696,555734,PAPER BUNTING RETROSPOT,1
17696,564170,MEMO BOARD RETROSPOT  DESIGN,1
17696,573888,SMALL HEART FLOWERS HOOK,1
17696,573888,RED RETROSPOT WRAP,1
17696,559330,"\"LETTER \"\"K\"\" BLING KEY RING\"",1
17696,555734,HOT BATHS METAL SIGN,1
17696,559330,DAIRY MAID LARGE MILK JUG,1
17696,573888,CARD SUKI BIRTHDAY,1
17696,555734,SLEEPING CAT ERASERS,1
17696,559330,ROBOT BIRTHDAY CARD,1
17696,559330,TRIPLE HOOK ANTIQUE IVORY ROSE,1
17696,559330,HOME SWEET HOME MUG,1
17696,561076,FRIDGE MAGNETS LA VIE EN ROSE,1
17696,564170,RETRO MOD TRAY,1
17696,555734,DAIRY MAID TRADITIONAL TEAPOT,1
17873,549967,COOK WITH WINE METAL SIGN,0
17873,536559,"FEATHER PEN,COAL BLACK",0
17873,567522,COOK WITH WINE METAL SIGN,0
17873,545558,LAUNDRY 15C METAL SIGN,0
17873,549967,TOILET METAL SIGN,0
17873,556070,COOK WITH WINE METAL SIGN,0
17873,549967,NO SINGING METAL SIGN,0
17873,549967,BATHROOM METAL SIGN,0
17873,556070,CHOCOLATE THIS WAY METAL SIGN,0
17873,549967,LAUNDRY 15C METAL SIGN,0
17873,567522,NO SINGING METAL SIGN,0
17873,567522,AREA PATROLLED METAL SIGN,0
17873,545558,WASHROOM METAL SIGN,0
17873,549967,WASHROOM METAL SIGN,0
17873,556070,TRAVEL CARD WALLET KEEP CALM,0
17873,556070,TRAVEL CARD WALLET UNION JACK,0
17873,556070,HAND OVER THE CHOCOLATE   SIGN,0
17873,545558,TRAVEL CARD WALLET KEEP CALM,0
17873,545558,HOME SWEET HOME METAL SIGN,0
17873,545558,AREA PATROLLED METAL SIGN,0
17873,549967,AREA PATROLLED METAL SIGN,0
17873,567522,HAND OVER THE CHOCOLATE   SIGN,0
17873,556070,HOME SWEET HOME METAL SIGN,0
17873,545558,BATHROOM METAL SIGN,0
17873,536559,"FEATHER PEN,LIGHT PINK",0
17873,549967,KITCHEN METAL SIGN,0
17873,536559,DOORMAT AIRMAIL,0
17873,536559,"FEATHER PEN,HOT PINK",0
17873,545558,COOK WITH WINE METAL SIGN,0
17873,556070,HOT BATHS METAL SIGN,0
17873,536559,NUMBER TILE COTTAGE GARDEN 8,0
17873,549967,LADIES & GENTLEMEN METAL SIGN,0
17873,545558,HOT BATHS METAL SIGN,0
17873,536559,BIRTHDAY PARTY CORDON BARRIER TAPE,0
17873,567522,METAL SIGN DROP YOUR PANTS,0
17873,556070,Manual,0
17873,545558,TOILET METAL SIGN,0
17873,567522,CHOCOLATE THIS WAY METAL SIGN,0
17873,545558,LADIES & GENTLEMEN METAL SIGN,0
17873,536559,ANT WHITE WIRE HEART SPIRAL,0
17873,567522,LADIES & GENTLEMEN METAL SIGN,0
17873,545558,NO SINGING METAL SIGN,0
17873,536559,"FEATHER PEN,COAL BLACK",0
