12821,552479,GINGHAM HEART DECORATION,2
12821,552479,ALUMINIUM STAMPED HEART,2
12821,552479,HEART DECORATION WITH PEARLS,2
12821,552479,SET 7 BABUSHKA NESTING BOXES,2
12821,552479,HEART DECORATION PAINTED ZINC,2
12821,552479,HEART FILIGREE DOVE LARGE,2
13070,555101,JUMBO SHOPPER VINTAGE RED PAISLEY,2
13070,555101,JUMBO BAG STRAWBERRY,2
13070,555101,JUMBO BAG PINK VINTAGE PAISLEY,2
13070,555101,JUMBO  BAG BAROQUE BLACK WHITE,2
13070,555101,JUMBO BAG TOYS,2
13070,555101,JUMBO STORAGE BAG SUKI,2
13070,555101,JUMBO BAG PINK POLKADOT,2
13070,555101,JUMBO BAG WOODLAND ANIMALS,2
13070,555101,JUMBO BAG RED RETROSPOT,2
13130,565780,SET/2 RED RETROSPOT TEA TOWELS,0
13130,565780,RED RETROSPOT OVEN GLOVE,0
13262,547221,JAM JAR WITH PINK LID,2
13262,547221,TRAVEL SEWING KIT,2
13262,547221,3 HOOK PHOTO SHELF ANTIQUE WHITE,2
13262,547221,PACK OF 12 PINK POLKADOT TISSUES,2
13262,547221,DELUXE SEWING KIT,2
13262,547221,FAMILY ALBUM WHITE PICTURE FRAME,2
13262,547221,TRADITIONAL MODELLING CLAY,2
13262,547221,PACK OF 12 SUKI TISSUES,2
13262,547221,ROUND SNACK BOXES SET OF 4 FRUITS,2
13262,547221,ASSORTED COLOUR BIRD ORNAMENT,2
13262,547221,CHILDREN'S APRON DOLLY GIRL,2
13470,563499,LUNCH BAG WOODLAND,0
13470,563499,LUNCH BAG APPLE DESIGN,0
13470,563499,LUNCH BAG SPACEBOY DESIGN,0
13470,563499,LUNCH BAG  BLACK SKULL.,0
13470,565154,LUNCH BAG  BLACK SKULL.,0
13470,565154,LUNCH BAG APPLE DESIGN,0
13470,565154,LUNCH BAG RED RETROSPOT,0
13470,563499,LUNCH BAG RED RETROSPOT,0
13470,563499,LUNCH BAG CARS BLUE,0
13470,563499,LUNCH BAG ALPHABET DESIGN,0
13593,540489,CREAM HEART CARD HOLDER,0
13593,540489,GARLAND WOODEN HAPPY EASTER,0
13593,540489,DOORMAT WELCOME PUPPIES,0
13593,547028,WOODEN REGATTA BUNTING,0
13593,558542,LARGE WHITE HEART OF WICKER,0
13593,564165,GLASS BON BON JAR,0
13593,540489,HOME BUILDING BLOCK WORD,0
13593,558542,RED DINER WALL CLOCK,0
13593,558542,METAL 4 HOOK HANGER FRENCH CHATEAU,0
13593,540489,PARTY BUNTING,0
13593,540489,ANTIQUE SILVER TEA GLASS ETCHED,0
13593,558542,WHITE HANGING HEART T-LIGHT HOLDER,0
13593,564165,IVORY WICKER HEART LARGE,0
13593,564165,DRAWER KNOB CRACKLE GLAZE IVORY,0
13593,540489,SCOTTIE DOG HOT WATER BOTTLE,0
13593,564165,CLEAR DRAWER KNOB ACRYLIC EDWARDIAN,0
13593,564165,TRIPLE PHOTO FRAME CORNICE,0
13593,558542,RED HANGING HEART T-LIGHT HOLDER,0
13593,540489,ANTIQUE SILVER TEA GLASS ENGRAVED,0
13593,547028,PHOTO FRAME 3 CLASSIC HANGING,0
13593,564165,WHITE HANGING HEART T-LIGHT HOLDER,0
13593,540489,WOODEN PICTURE FRAME WHITE FINISH,0
13593,540489,BLUE STRIPE CERAMIC DRAWER KNOB,0
13593,564165,DOORMAT UNION FLAG,0
13593,564165,WOODEN PICTURE FRAME WHITE FINISH,0
13593,558542,HEART OF WICKER SMALL,0
13593,547028,WOODEN FRAME ANTIQUE WHITE,0
13593,564165,WELCOME  WOODEN BLOCK LETTERS,0
13593,540489,CLASSIC METAL BIRDCAGE PLANT HOLDER,0
13593,547028,RED HANGING HEART T-LIGHT HOLDER,0
13593,564165,PHOTO FRAME 3 CLASSIC HANGING,0
13593,564165,PHOTO FRAME CORNICE,0
13593,547028,SMALL GLASS HEART TRINKET POT,0
13593,558542,PHOTO FRAME CORNICE,0
13593,564165,METAL 4 HOOK HANGER FRENCH CHATEAU,0
13593,540489,RETROSPOT HEART HOT WATER BOTTLE,0
13593,558542,FRENCH GARDEN SIGN BLUE METAL,0
13593,547028,PARTY BUNTING,0
13593,564165,SPOTTY BUNTING,0
13593,540489,LOVE BUILDING BLOCK WORD,0
13593,564165,RED DINER WALL CLOCK,0
13593,547028,BLUE GIANT GARDEN THERMOMETER,0
13593,547028,IVORY GIANT GARDEN THERMOMETER,0
13593,540489,HEART OF WICKER SMALL,0
13593,540489,IVORY GIANT GARDEN THERMOMETER,0
13593,547028,BLUE DINER WALL CLOCK,0
13593,540489,COLOUR GLASS T-LIGHT HOLDER HANGING,0
13593,547028,IVORY DINER WALL CLOCK,0
13593,540489,CREAM CUPID HEARTS COAT HANGER,0
13593,540489,DOORMAT HEARTS,0
13593,558542,CANDLEHOLDER PINK HANGING HEART,0
13593,540489,EASTER DECORATION HANGING BUNNY,0
13593,558542,BLUE GIANT GARDEN THERMOMETER,0
13593,564165,T-LIGHT GLASS FLUTED ANTIQUE,0
13593,540489,TEA TIME PARTY BUNTING,0
13593,558542,CREAM CUPID HEARTS COAT HANGER,0
13593,564165,DRAWER KNOB CERAMIC IVORY,0
13593,558542,HANGING HEART ZINC T-LIGHT HOLDER,0
13593,558542,SMALL WHITE HEART OF WICKER,0
13593,564165,BATH BUILDING BLOCK WORD,0
13593,564165,DOORMAT NEW ENGLAND,0
13593,564165,VINTAGE GLASS T-LIGHT HOLDER,0
13593,540489,WOOD BLACK BOARD ANT WHITE FINISH,0
13593,540489,BATH BUILDING BLOCK WORD,0
13593,540489,METAL 4 HOOK HANGER FRENCH CHATEAU,0
13593,558542,HEART OF WICKER LARGE,0
13593,540489,3 HOOK PHOTO SHELF ANTIQUE WHITE,0
13593,540489,ROSE DU SUD CUSHION COVER,0
13593,558542,LARGE ANTIQUE WHITE PHOTO FRAME,0
13593,558542,FRENCH TOILET SIGN BLUE METAL,0
13593,564165,MINT DINER WALL CLOCK,0
13593,564165,ZINC T-LIGHT HOLDER STAR LARGE,0
13593,547165,COLOUR GLASS T-LIGHT HOLDER HANGING,0
13593,558542,PHOTO FRAME 3 CLASSIC HANGING,0
13593,558542,BATHROOM METAL SIGN,0
13593,564165,VINTAGE UNION JACK BUNTING,0
13593,540489,WHITE TISSUE REAM,0
13593,547028,CREAM CUPID HEARTS COAT HANGER,0
13593,547028,DOORMAT UNION FLAG,0
13593,564165,PARTY BUNTING,0
13593,540489,DOORMAT UNION FLAG,0
13593,558542,CREAM HEART CARD HOLDER,0
13593,540489,CHOCOLATE HOT WATER BOTTLE,0
13593,564165,BLUE DINER WALL CLOCK,0
13593,540489,DOORMAT NEW ENGLAND,0
13593,558542,PARTY METAL SIGN,0
13593,547028,PINK SMALL GLASS CAKE STAND,0
13593,547028,GUMBALL COAT RACK,0
13593,558542,BATH BUILDING BLOCK WORD,0
13593,564165,WOODEN FRAME ANTIQUE WHITE,0
13593,540489,ENGLISH ROSE HOT WATER BOTTLE,0
13593,547028,PLEASE ONE PERSON METAL SIGN,0
13593,547028,RED DINER WALL CLOCK,0
13593,564165,DRAWER KNOB CRACKLE GLAZE GREEN,0
13593,564165,SMALL WHITE HEART OF WICKER,0
13593,564165,COLOUR GLASS T-LIGHT HOLDER HANGING,0
13593,558542,TOILET METAL SIGN,0
13593,540489,WOODEN FRAME ANTIQUE WHITE,0
13593,540489,PHOTO FRAME CORNICE,0
13593,547028,NATURAL SLATE HEART CHALKBOARD,0
13593,540489,EASTER DECORATION SITTING BUNNY,0
13593,558542,SPOTTY BUNTING,0
13593,540489,PHOTO FRAME 3 CLASSIC HANGING,0
13593,540489,DOORMAT FAIRY CAKE,0
13593,558542,MINT DINER WALL CLOCK,0
13593,564165,DRAWER KNOB CRACKLE GLAZE BLUE,0
13593,558542,BLUE DINER WALL CLOCK,0
13593,558542,COLOUR GLASS T-LIGHT HOLDER HANGING,0
13593,564165,LARGE WHITE HEART OF WICKER,0
13593,547028,WOODEN PICTURE FRAME WHITE FINISH,0
13593,558542,FRENCH BATHROOM SIGN BLUE METAL,0
13593,564165,CREAM CUPID HEARTS COAT HANGER,0
13593,564165,ZINC T-LIGHT HOLDER STARS SMALL,0
13593,540489,EASTER DECORATION EGG BUNNY,0
13593,564165,LARGE ANTIQUE WHITE PHOTO FRAME,0
13593,540489,SMALL GLASS HEART TRINKET POT,0
13593,547028,CANDLEHOLDER PINK HANGING HEART,0
13593,547028,METAL 4 HOOK HANGER FRENCH CHATEAU,0
13593,547028,SALLE DE BAIN HOOK,0
13593,564165,HOME BUILDING BLOCK WORD,0
13593,547028,WHITE HANGING HEART T-LIGHT HOLDER,0
13593,564165,DOORMAT FAIRY CAKE,0
13593,540489,PLEASE ONE PERSON METAL SIGN,0
13593,558542,VINTAGE UNION JACK BUNTING,0
13593,564165,LOVE BUILDING BLOCK WORD,0
13593,540489,WHITE HANGING HEART T-LIGHT HOLDER,0
13593,558542,HOME BUILDING BLOCK WORD,0
13892,569903,4 TRADITIONAL SPINNING TOPS,0
13892,549248,SMALL PINK GLASS SUNDAE DISH,0
13892,569903,GREEN GOOSE FEATHER TREE 60CM,0
13892,569903,HANGING CLEAR MINI BOTTLE,0
13892,569903,EGG CUP NATURAL CHICKEN,0
13892,569903,JIGSAW TOADSTOOLS 3 PIECE,0
13892,569903,RED BABY BUNTING,0
13892,569903,METAL SIGN EMPIRE TEA,0
13892,569903,SILVER HANGING T-LIGHT HOLDER,0
13892,571550,ROSES REGENCY TEACUP AND SAUCER,0
13892,569903,CANDLE HOLDER SILVER MADELINE,0
13892,569903,PORCELAIN ROSE SMALL,0
13892,569903,SET OF 12  VINTAGE POSTCARD SET,0
13892,569903,ROMANTIC IMAGES GIFT WRAP SET,0
13892,569903,VINTAGE PAISLEY STATIONERY SET,0
13892,569903,HOME GARLAND PAINTED ZINC,0
13892,569903,SET/12 TAPER CANDLES,0
13892,569903,HEART DECORATION RUSTIC HANGING,0
13892,569903,SINGLE HEART ZINC T-LIGHT HOLDER,0
13892,575946,ROSES REGENCY TEACUP AND SAUCER,0
13892,569903,VINTAGE HEADS AND TAILS CARD GAME,0
13892,569903,ENVELOPE 50 BLOSSOM IMAGES,0
13892,549248,LOVE HEART TRINKET POT,0
13892,569903,EUCALYPTUS & PINECONE  WREATH,0
13892,571550,SILVER GLITTER FLOWER VOTIVE HOLDER,0
13892,569903,FRENCH STYLE STORAGE JAR BONBONS,0
13892,549248,PINK FLOCK GLASS CANDLEHOLDER,0
14053,558755,COLOURING PENCILS BROWN TUBE,0
14053,558755,COLOURING PENCILS BROWN TUBE,0
14053,562585,COLOURING PENCILS BROWN TUBE,0
14053,558755,RED GINGHAM ROSE JEWELLERY BOX,0
14828,540405,STRAWBERRY CHARLOTTE BAG,2
14828,554859,CHILDREN'S APRON DOLLY GIRL,2
14828,540405,WOODEN UNION JACK BUNTING,2
14828,548359,ASSORTED COLOURS SILK FAN,2
14828,554859,RED KITCHEN SCALES,2
14828,548359,SET 12 KIDS  WHITE CHALK STICKS,2
14828,554859,SET 7 BABUSHKA NESTING BOXES,2
14828,554859,PINK CREAM FELT CRAFT TRINKET BOX,2
14828,554859,IVORY KITCHEN SCALES,2
14828,540405,RED RETROSPOT CHARLOTTE BAG,2
14828,540405,CHINESE DRAGON PAPER LANTERNS,2
14828,554859,CHILDS BREAKFAST SET DOLLY GIRL,2
14828,554859,LIPSTICK PEN RED,2
14828,554859,PARTY BUNTING,2
14828,540405,PACK OF 72 RETROSPOT CAKE CASES,2
14828,548359,VINTAGE SNAP CARDS,2
14828,554859,CHARLOTTE BAG DOLLY GIRL DESIGN,2
14908,568313,CHRISTMAS GINGHAM TREE,0
14908,568313,3 DRAWER ANTIQUE WHITE WOOD CABINET,0
14908,568313,CLASSIC METAL BIRDCAGE PLANT HOLDER,0
14908,568313,GINGHAM HEART DECORATION,0
14908,568313,IVORY WICKER HEART MEDIUM,0
14908,568313,HEART IVORY TRELLIS SMALL,0
14908,568313,OPEN CLOSED METAL SIGN,0
14908,568313,LARGE WHITE HEART OF WICKER,0
14908,568313,IVORY WICKER HEART LARGE,0
15110,562451,POPCORN HOLDER,0
15110,572764,CHRISTMAS LIGHTS 10 VINTAGE BAUBLES,0
15110,542026,HOME BUILDING BLOCK WORD,0
15110,576660,BLUE DINER WALL CLOCK,0
15110,576660,ALARM CLOCK BAKELIKE GREEN,0
15110,572764,GLASS JAR ENGLISH CONFECTIONERY,0
15110,562451,ALARM CLOCK BAKELIKE RED,0
15110,572764,ALARM CLOCK BAKELIKE GREEN,0
15110,576660,HOT WATER BOTTLE TEA AND SYMPATHY,0
15110,576660,RED DINER WALL CLOCK,0
15110,542026,BLACK DINER WALL CLOCK,0
15110,576660,WOODEN SCHOOL COLOURING SET,0
15110,562451,HOME BUILDING BLOCK WORD,0
15110,576660,SET/4 WHITE RETRO STORAGE CUBES,0
15110,572764,ALARM CLOCK BAKELIKE RED,0
15110,542026,MAGNETS PACK OF 4 SWALLOWS,0
15110,542026,MAGNETS PACK OF 4 CHILDHOOD MEMORY,0
15110,562451,ALARM CLOCK BAKELIKE ORANGE,0
15110,562451,BLUE DINER WALL CLOCK,0
15110,542026,SMALL POPCORN HOLDER,0
15110,562451,RED DINER WALL CLOCK,0
15110,576660,ALARM CLOCK BAKELIKE CHOCOLATE,0
15110,562451,ALARM CLOCK BAKELIKE GREEN,0
15110,572764,ALARM CLOCK BAKELIKE CHOCOLATE,0
15110,562451,SET/4 WHITE RETRO STORAGE CUBES,0
15110,576660,ALARM CLOCK BAKELIKE RED,0
15110,562451,NO SINGING METAL SIGN,0
15110,572764,SET/4 WHITE RETRO STORAGE CUBES,0
15110,542026,GLASS JAR ENGLISH CONFECTIONERY,0
15110,542026,BLUE DINER WALL CLOCK,0
15110,572764,POPCORN HOLDER,0
15110,572764,HOT WATER BOTTLE TEA AND SYMPATHY,0
15110,542026,NO SINGING METAL SIGN,0
15110,542026,RED DINER WALL CLOCK,0
15110,562451,GLASS JAR ENGLISH CONFECTIONERY,0
15139,540461,SET OF 36 PAISLEY FLOWER DOILIES,2
15139,550032,SET/6 COLLAGE PAPER CUPS,2
15139,540461,PACK OF 20 SPACEBOY NAPKINS,2
15139,540461,PAPER BUNTING COLOURED LACE,2
15139,550032,SET/6 COLLAGE PAPER PLATES,2
15139,540461,CHERRY CROCHET FOOD COVER,2
15139,550032,APRON MODERN VINTAGE COTTON,2
15139,540461,SMALL POPCORN HOLDER,2
15139,550032,LARGE PINK GLASS SUNDAE DISH,2
15139,550032,BLUE POLKADOT EGG CUP,2
15139,540461,PACK OF 60 SPACEBOY CAKE CASES,2
15139,540461,RECIPE BOX PANTRY YELLOW DESIGN,2
15139,540461,PACK OF 60 PINK PAISLEY CAKE CASES,2
15303,544661,GUMBALL COAT RACK,2
15303,544661,APRON APPLE DELIGHT,2
15303,544661,REGENCY CAKESTAND 3 TIER,2
15303,544661,GIN + TONIC DIET METAL SIGN,2
15303,544661,ROUND SNACK BOXES SET OF 4 FRUITS,2
15303,544661,POTTERING IN THE SHED METAL SIGN,2
15303,544661,SET/5 RED RETROSPOT LID GLASS BOWLS,2
15303,544661,PACK 3 BOXES BIRD PANNETONE,2
15303,544661,CANDLEHOLDER PINK HANGING HEART,2
15303,544661,LUNCH BAG SPACEBOY DESIGN,2
15303,544661,ANTIQUE GLASS PEDESTAL BOWL,2
15303,544661,CHILDS GARDEN TROWEL PINK,2
15303,544661,WELCOME  WOODEN BLOCK LETTERS,2
15303,544661,LARGE RED RETROSPOT WINDMILL,2
15303,544661,SET OF 3 HEART COOKIE CUTTERS,2
15303,544661,CHILDS GARDEN FORK PINK,2
15303,544661,CHILDS GARDEN FORK BLUE,2
15303,544661,TABLECLOTH RED APPLES DESIGN,2
15303,544661,SOLDIERS EGG CUP,2
15303,544661,WHITE HANGING HEART T-LIGHT HOLDER,2
15303,544661,YOU'RE CONFUSING ME METAL SIGN,2
15303,544661,WOODEN SKITTLES GARDEN SET,2
15303,544661,CHILDRENS APRON APPLES DESIGN,2
15303,544661,GUMBALL MAGAZINE RACK,2
15303,544661,QUEENS GUARD COFFEE MUG,2
15303,544661,SET OF 3 BUTTERFLY COOKIE CUTTERS,2
15303,544661,WOODEN ROUNDERS GARDEN SET,2
15303,544661,CHILDS GARDEN TROWEL BLUE,2
15303,544661,CHOCOLATE THIS WAY METAL SIGN,2
15303,544661,CLOTHES PEGS RETROSPOT PACK 24,2
15303,544661,PEG BAG APPLES DESIGN,2
15350,536534,HAND WARMER BIRD DESIGN,2
15350,536534,CHOCOLATE HOT WATER BOTTLE,2
15350,536534,HAND WARMER SCOTTY DOG DESIGN,2
15350,536534,HAND WARMER OWL DESIGN,2
15350,536534,HAND WARMER BABUSHKA DESIGN,2
16136,570498,AGED GLASS SILVER T-LIGHT HOLDER,0
16136,545711,SET OF 4 NAPKIN CHARMS CUTLERY,0
16136,570498,CHERUB HEART DECORATION SILVER,0
16136,570498,PAPER CHAIN KIT 50'S CHRISTMAS,0
16136,570498,LAUREL HEART ANTIQUE SILVER,0
16136,570498,LARGE WHITE HEART OF WICKER,0
16136,545711,VINTAGE CREAM 3 BASKET CAKE STAND,0
16136,570498,LAUREL STAR ANTIQUE SILVER,0
16136,570498,CHRISTMAS TREE HANGING SILVER,0
16136,545711,GLASS CLOCHE SMALL,0
16136,567957,RETROSPOT WOODEN HEART DECORATION,0
16136,567957,CHRISTMAS RETROSPOT STAR WOOD,0
16136,545711,ASSORTED COLOUR BIRD ORNAMENT,0
16136,570498,CHERUB HEART DECORATION GOLD,0
16136,570498,PACK OF SIX LED TEA LIGHTS,0
16136,545711,NATURAL SLATE HEART CHALKBOARD,0
16136,567957,GLASS APOTHECARY BOTTLE PERFUME,0
16136,570498,PLACE SETTING WHITE HEART,0
16136,570498,REINDEER HEART DECORATION GOLD,0
16136,570498,15CM CHRISTMAS GLASS BALL 20 LIGHTS,0
16136,567957,GLASS APOTHECARY BOTTLE TONIC,0
16136,570498,JINGLE BELL HEART ANTIQUE SILVER,0
16136,570498,GIANT 50'S CHRISTMAS CRACKER,0
16136,570498,ASSORTED COLOUR BIRD ORNAMENT,0
16136,567957,CLASSIC GLASS COOKIE JAR,0
16136,567957,GLASS APOTHECARY BOTTLE ELIXIR,0
16136,545711,PLACE SETTING WHITE HEART,0
16136,570498,REINDEER HEART DECORATION SILVER,0
16136,545711,SET OF 4 NAPKIN CHARMS HEARTS,0
16136,570498,ANTIQUE SILVER BAUBLE LAMP,0
16136,570498,WHITE WICKER STAR,0
16136,567957,HANGING MINI COLOURED BOTTLES,0
16136,570498,CHRISTMAS TREE HANGING GOLD,0
16136,570498,LAUREL STAR ANTIQUE GOLD,0
16136,570498,PLACE SETTING WHITE STAR,0
16136,545711,GLASS CLOCHE LARGE,0
16136,570498,LAUREL HEART ANTIQUE GOLD,0
16292,562892,SET OF 6 TEA TIME BAKING CASES,0
16292,562892,SET OF 6 SNACK LOAF BAKING CASES,0
16292,562892,VINTAGE CHRISTMAS CAKE FRILL,0
16292,562892,CERAMIC CAKE STAND + HANGING CAKES,0
16292,562892,BISCUIT TIN 50'S CHRISTMAS,0
16292,562892,SET/10 RED POLKADOT PARTY CANDLES,0
16292,562892,SET/10 PINK POLKADOT PARTY CANDLES,0
16292,562892,SET OF 36 PAISLEY FLOWER DOILIES,0
16292,562892,SET OF 12 FAIRY CAKE BAKING CASES,0
16292,562892,MINI CAKE STAND WITH HANGING CAKES,0
16292,562892,SET OF 6 RIBBONS VINTAGE CHRISTMAS,0
16292,562892,PACK 3 BOXES CHRISTMAS PANNETONE,0
16292,562892,SET 40 HEART SHAPE PETIT FOUR CASES,0
16292,562892,60 CAKE CASES VINTAGE CHRISTMAS,0
16292,562892,36 DOILIES VINTAGE CHRISTMAS,0
16292,562892,TEA TIME KITCHEN APRON,0
16292,562892,BISCUIT TIN VINTAGE CHRISTMAS,0
16315,541015,ASSORTED COLOUR BIRD ORNAMENT,2
16315,541015,PAINTED METAL PEARS ASSORTED,2
16315,541015,DOG BOWL VINTAGE CREAM,2
16315,541015,VINTAGE CREAM DOG FOOD CONTAINER,2
16315,541015,GRAND CHOCOLATECANDLE,2
16315,541015,SWEETHEART RECIPE BOOK STAND,2
16315,541015,CERAMIC CAKE DESIGN SPOTTED MUG,2
16315,541015,SWEETHEART WIRE FRUIT BOWL,2
16315,541015,CERAMIC CAKE STAND + HANGING CAKES,2
16315,541015,CAT BOWL VINTAGE CREAM,2
16315,541015,CREAM SWEETHEART EGG HOLDER,2
16315,541015,GINGHAM HEART  DOORSTOP RED,2
16315,541015,BREAD BIN DINER STYLE IVORY,2
16315,541015,FINE WICKER HEART,2
16771,546117,PACK OF 12 HEARTS DESIGN TISSUES,0
16771,568198,AREA PATROLLED METAL SIGN,0
16771,574692,COOK WITH WINE METAL SIGN,0
16771,574692,4 PURPLE FLOCK DINNER CANDLES,0
16771,543022,LOVE HEART TRINKET POT,0
16771,568198,4 SKY BLUE DINNER CANDLES,0
16771,543022,DOORMAT HEARTS,0
16771,568198,AIRLINE BAG VINTAGE TOKYO 78,0
16771,568198,PACK OF 20 NAPKINS PANTRY DESIGN,0
16771,543022,FANNY'S REST STOPMETAL SIGN,0
16771,546117,SMALL STRIPES CHOCOLATE GIFT BAG,0
16771,568198,HEART OF WICKER SMALL,0
16771,568198,ZINC WILLIE WINKIE  CANDLE STICK,0
16771,540188,"FEATHER PEN,COAL BLACK",0
16771,543022,KITCHEN METAL SIGN,0
16771,546117,CERAMIC BIRDHOUSE CRESTED TIT SMALL,0
16771,540188,CARD BILLBOARD FONT,0
16771,546117,"FLOWER FAIRY,5 SUMMER B'DRAW LINERS",0
16771,543022,TV DINNER TRAY VINTAGE PAISLEY,0
16771,543022,SET/20 STRAWBERRY PAPER NAPKINS,0
16771,546117,GROW YOUR OWN HERBS SET OF 3,0
16771,546117,FELT EGG COSY WHITE RABBIT,0
16771,546117,EASTER DECORATION HANGING BUNNY,0
16771,546117,S/3 PINK SQUARE PLANTERS ROSES,0
16771,540188,WHITE HANGING HEART T-LIGHT HOLDER,0
16771,546117,DOORMAT SPOTTY HOME SWEET HOME,0
16771,546117,JAM MAKING SET PRINTED,0
16771,568198,CHRISTMAS LIGHTS 10 VINTAGE BAUBLES,0
16771,543022,DANISH ROSE PHOTO FRAME,0
16771,568198,4 TRADITIONAL SPINNING TOPS,0
16771,568198,CINAMMON SET OF 9 T-LIGHTS,0
16771,546117,RECIPE BOX BLUE SKETCHBOOK DESIGN,0
16771,568198,"AIRLINE LOUNGE,METAL SIGN",0
16771,546117,MUM'S KITCHEN CLOCK,0
16771,546117,PINK ROSE WASHBAG,0
16771,546117,PICTURE FRAME WOOD TRIPLE PORTRAIT,0
16771,543022,CREAM HEART CARD HOLDER,0
16771,543022,PINK OVAL JEWELLED MIRROR,0
16771,546117,JAM CLOCK MAGNET,0
16771,568198,MEMO BOARD COTTAGE DESIGN,0
16771,543022,CHOCOLATE THIS WAY METAL SIGN,0
16771,546117,RETROSPOT RED WASHING UP GLOVES,0
16771,546117,YELLOW COAT RACK PARIS FASHION,0
16771,546117,"\"POCKET MIRROR \"\"GLAMOROUS\"\"\"",0
16771,540188,CARD DOG AND BALL,0
16771,546117,TRIPLE PHOTO FRAME CORNICE,0
16771,546117,GREEN ROSE WASHBAG,0
16771,574692,METAL SIGN DROP YOUR PANTS,0
16771,568198,HEART IVORY TRELLIS SMALL,0
16771,543022,STRIPEY CHOCOLATE NESTING BOXES,0
16771,540188,CARD BIRTHDAY COWBOY,0
16771,568198,OPEN CLOSED METAL SIGN,0
16771,568198,MORE BUTTER METAL SIGN,0
16771,568198,WHITE HANGING HEART T-LIGHT HOLDER,0
16771,540188,6 CHOCOLATE LOVE HEART T-LIGHTS,0
16771,543022,REGENCY CAKESTAND 3 TIER,0
16771,546117,BLUE COAT RACK PARIS FASHION,0
16771,568198,SMALL PARISIENNE HEART PHOTO FRAME,0
16771,546117,Manual,0
16771,568198,ROTATING SILVER ANGELS T-LIGHT HLDR,0
16771,543022,HANGING HEART ZINC T-LIGHT HOLDER,0
16771,568198,GINGHAM HEART  DOORSTOP RED,0
16771,543022,FRENCH LAVENDER SCENT HEART,0
16771,543022,COFFEE SCENT PILLAR CANDLE,0
16771,546117,TEA FOR ONE POLKADOT,0
16771,546117,ROSE DU SUD OVEN GLOVE,0
16771,540188,SMALL HEART FLOWERS HOOK,0
16771,543022,ROSES REGENCY TEACUP AND SAUCER,0
16771,546117,PLACE SETTING WHITE STAR,0
16771,568198,"FEATHER PEN,HOT PINK",0
16771,540188,EDWARDIAN PARASOL NATURAL,0
16771,546117,SILVER FABRIC MIRROR,0
16771,540188,LOVE HEART TRINKET POT,0
16771,543022,RED HEART LUGGAGE TAG,0
16771,546117,HOME SWEET HOME MUG,0
16771,546117,REGENCY CAKESTAND 3 TIER,0
16771,540188,CARD WEDDING DAY,0
16771,546117,PANTRY WASHING UP BRUSH,0
16771,543022,HEART IVORY TRELLIS LARGE,0
16771,546117,SET 2 PANTRY DESIGN TEA TOWELS,0
16771,543022,PACK OF 12 HEARTS DESIGN TISSUES,0
16771,543022,BOTANICAL LAVENDER GIFT WRAP,0
16771,546117,GROW YOUR OWN FLOWERS SET OF 3,0
16771,568198,SAVE THE PLANET MUG,0
16771,574692,HEART IVORY TRELLIS LARGE,0
16771,574692,SET/12 TAPER CANDLES,0
16771,540188,BOOZE & WOMEN GREETING CARD,0
16771,546117,BLUE POLKADOT WASHING UP GLOVES,0
16771,574692,HOT BATHS METAL SIGN,0
16771,543022,GREEN REGENCY TEACUP AND SAUCER,0
16771,540188,FRENCH TOILET SIGN BLUE METAL,0
16771,568198,RED TOADSTOOL LED NIGHT LIGHT,0
16771,568198,SET OF 10 LED DOLLY LIGHTS,0
16771,574692,4 PINK DINNER CANDLE SILVER FLOCK,0
16771,546117,SET OF 3 CAKE TINS PANTRY DESIGN,0
16771,568198,STOOL HOME SWEET HOME,0
16771,546117,DOORSTOP RETROSPOT HEART,0
16771,568198,I'M ON HOLIDAY METAL SIGN,0
16771,540188,CANDLEHOLDER PINK HANGING HEART,0
16771,540188,CARD CIRCUS PARADE,0
16771,543022,CHERRY BLOSSOM CANVAS ART PICTURE,0
16771,568198,METAL SIGN DROP YOUR PANTS,0
16771,543022,CRAZY DAISY HEART DECORATION,0
16771,568198,MAGIC DRAWING SLATE LEAP FROG,0
16771,568198,HEART IVORY TRELLIS LARGE,0
16771,540188,EDWARDIAN PARASOL PINK,0
16771,568198,MAGIC DRAWING SLATE DOLLY GIRL,0
16771,540188,ANT WHITE WIRE HEART SPIRAL,0
16771,543022,PACK OF 20 NAPKINS PANTRY DESIGN,0
16771,543022,KENSINGTON COFFEE SET,0
16771,568198,GLAMOROUS  MUG,0
16771,568198,ZINC HEART LATTICE T-LIGHT HOLDER,0
16771,543022,STRAWBERRY BATH SPONGE,0
16771,543022,6 CHOCOLATE LOVE HEART T-LIGHTS,0
16771,543022,RED VICTORIAN FABRIC OVAL BOX,0
16771,568198,CREAM HEART CARD HOLDER,0
16771,543022,HOMEMADE JAM SCENTED CANDLES,0
16771,568198,SET OF 2 CHRISTMAS DECOUPAGE CANDLE,0
16771,546117,PANTRY ROLLING PIN,0
16771,546117,RECIPE BOX RETROSPOT,0
16771,568198,PHOTO FRAME LINEN AND LACE LARGE,0
16771,540188,WRAP CIRCUS PARADE,0
16771,543022,PHOTO FRAME 3 CLASSIC HANGING,0
16771,543022,HAND OVER THE CHOCOLATE   SIGN,0
16771,546117,BLUE FELT EASTER EGG BASKET,0
16771,546117,CUBIC MUG FLOCK BLUE ON BROWN,0
16771,543022,BEWARE OF THE CAT METAL SIGN,0
16771,546117,BROWN CHECK CAT DOORSTOP,0
16771,543022,LOVE HEART SOCK HANGER,0
16771,546117,EASTER DECORATION EGG BUNNY,0
16771,568198,SET/20 RED RETROSPOT PAPER NAPKINS,0
16771,568198,RED COAT RACK PARIS FASHION,0
16771,568198,WOODEN PICTURE FRAME WHITE FINISH,0
16771,546117,DOORMAT 3 SMILEY CATS,0
16771,568198,RUSTIC MIRROR WITH LACE HEART,0
16771,543022,CARD HOLDER GINGHAM HEART,0
16771,540188,COWBOYS AND INDIANS BIRTHDAY CARD,0
16771,543022,CHOC TRUFFLE GOLD TRINKET POT,0
16771,540188,LARGE STRIPES CHOCOLATE GIFT BAG,0
16771,543022,CAT BOWL VINTAGE CREAM,0
16771,568198,TOILET METAL SIGN,0
16771,543022,HOT BATHS METAL SIGN,0
16771,543022,CERAMIC HEART FAIRY CAKE MONEY BANK,0
16771,543022,GIN AND TONIC MUG,0
16771,540188,SMALL POLKADOT CHOCOLATE GIFT BAG,0
16771,568198,BLUE COAT RACK PARIS FASHION,0
16771,543022,HEART OF WICKER LARGE,0
16771,568198,BEWARE OF THE CAT METAL SIGN,0
16771,574692,CREAM CUPID HEARTS COAT HANGER,0
16771,568198,CHOCOLATE THIS WAY METAL SIGN,0
16771,543022,GLAMOROUS  MUG,0
16771,543022,DOORMAT UNION JACK GUNS AND ROSES,0
16771,540188,BANK ACCOUNT  GREETING  CARD,0
16771,543022,BROWN CHECK CAT DOORSTOP,0
16771,546117,SMALL HEART FLOWERS HOOK,0
16771,568198,CHRISTMAS LIGHTS 10 REINDEER,0
16771,568198,PACK OF SIX LED TEA LIGHTS,0
16771,540188,GIN & TONIC DIET GREETING CARD,0
16771,546117,PANTRY PASTRY BRUSH,0
16771,568198,MAGIC DRAWING SLATE LEAP FROG,0
16771,568198,ORANGE SCENTED SET/9 T-LIGHTS,0
16771,546117,CREAM FELT EASTER EGG BASKET,0
16771,546117,HEART FILIGREE DOVE LARGE,0
16771,574692,4 BLUE DINNER CANDLES SILVER FLOCK,0
16771,546117,METAL SIGN TAKE IT OR LEAVE IT,0
16771,540188,BLACK/BLUE POLKADOT UMBRELLA,0
16771,543022,PINK CAT BOWL,0
16771,540188,"WRAP, BILLBOARD FONTS DESIGN",0
16771,543022,WHITE HANGING HEART T-LIGHT HOLDER,0
16771,540188,RED RETROSPOT UMBRELLA,0
16771,540188,HOME SWEET HOME METAL SIGN,0
16771,546117,YOU'RE CONFUSING ME METAL SIGN,0
16771,546117,ROTATING LEAVES T-LIGHT HOLDER,0
16771,568198,HAND OVER THE CHOCOLATE   SIGN,0
16771,540188,WRAP WEDDING DAY,0
16771,543022,4 IVORY DINNER CANDLES SILVER FLOCK,0
16771,543022,HOME SWEET HOME MUG,0
16771,540188,GRAND CHOCOLATECANDLE,0
16771,568198,KITCHEN METAL SIGN,0
16771,568198,WORLD WAR 2 GLIDERS ASSTD DESIGNS,0
16771,574692,6 CHOCOLATE LOVE HEART T-LIGHTS,0
16771,568198,FAMILY ALBUM WHITE PICTURE FRAME,0
16771,546117,VICTORIAN  METAL POSTCARD SPRING,0
16771,546117,CLOTHES PEGS RETROSPOT PACK 24,0
16771,568198,WOODEN FRAME ANTIQUE WHITE,0
16771,540188,CREAM SWEETHEART LETTER RACK,0
16771,543022,LOVEBIRD HANGING DECORATION WHITE,0
16771,574692,DECORATIVE WICKER HEART SMALL,0
16771,546117,CREAM HEART CARD HOLDER,0
16771,546117,SET/20 RED RETROSPOT PAPER NAPKINS,0
16771,568198,BROWN CHECK CAT DOORSTOP,0
16771,543022,CREAM CUPID HEARTS COAT HANGER,0
16771,568198,LOVEBIRD HANGING DECORATION WHITE,0
16771,543022,I CAN ONLY PLEASE ONE PERSON MUG,0
16771,574692,CREAM HEART CARD HOLDER,0
16771,546117,HAND OPEN SHAPE GOLD,0
16771,543022,DOORSTOP RETROSPOT HEART,0
16771,546117,MEMO BOARD RETROSPOT  DESIGN,0
16771,568198,SHELF WITH 4 HOOKS HOME SWEET HOME,0
16771,568198,YELLOW COAT RACK PARIS FASHION,0
16771,546117,FAMILY PHOTO FRAME CORNICE,0
16771,546117,ETCHED GLASS COASTER,0
16771,543022,LAVENDER SCENTED FABRIC HEART,0
16771,543022,LOVE BUILDING BLOCK WORD,0
16771,568198,FANCY FONTS BIRTHDAY WRAP,0
16771,546117,WHITE HANGING HEART T-LIGHT HOLDER,0
16771,546117,HEART OF WICKER SMALL,0
16771,540188,SET/3 POT PLANT CANDLES,0
16771,543022,TRIPLE PHOTO FRAME CORNICE,0
16771,546117,WRAP DAISY CARPET,0
16771,568198,MAGIC DRAWING SLATE BAKE A CAKE,0
16771,543022,RECIPE BOX PANTRY YELLOW DESIGN,0
16771,546117,PHOTO FRAME 3 CLASSIC HANGING,0
16771,568198,PIGGY BANK RETROSPOT,0
16771,574692,"FEATHER PEN,COAL BLACK",0
16771,540188,NOEL WOODEN BLOCK LETTERS,0
16771,543022,HEART OF WICKER SMALL,0
16771,546117,COOK WITH WINE METAL SIGN,0
16771,546117,STRAWBERRY CERAMIC TRINKET BOX,0
16771,543022,POTTERING MUG,0
16771,543022,GINGERBREAD MAN COOKIE CUTTER,0
16771,543022,FIVE HEART HANGING DECORATION,0
16771,568198,PHOTO FRAME 3 CLASSIC HANGING,0
16771,568198,ETCHED GLASS COASTER,0
16771,568198,NO SINGING METAL SIGN,0
16771,540188,CERAMIC HEART FAIRY CAKE MONEY BANK,0
16771,543022,YELLOW SHARK HELICOPTER,0
16771,543022,ASSORTED INCENSE PACK,0
16771,546117,ASSORTED COLOURS SILK FAN,0
16771,546117,DOORMAT TOPIARY,0
16771,568198,ASSORTED INCENSE PACK,0
16771,546117,I'M ON HOLIDAY METAL SIGN,0
16771,546117,POTTERING MUG,0
16771,568198,AIRLINE BAG VINTAGE WORLD CHAMPION,0
16771,540188,MEMO BOARD COTTAGE DESIGN,0
16771,574692,"AIRLINE LOUNGE,METAL SIGN",0
16771,568198,BROCADE RING PURSE,0
16771,546117,LOVEBIRD HANGING DECORATION WHITE,0
16771,543022,BATHROOM METAL SIGN,0
