12913,543748,CRYSTAL DIAMANTE EXPANDABLE RING,0
12913,580630,STAR DECORATION RUSTIC,0
12913,578362,3 STRIPEY MICE FELTCRAFT,0
12913,543748,"NURSERY A,B,C PAINTED LETTERS",0
12913,578362,FELTCRAFT GIRL NICOLE KIT,0
12913,578362,ANGEL DECORATION STARS ON DRESS,0
12913,580630,FILIGREE HEART DAISY WHITE,0
12913,543748,ANTIQUE SILVER TEA GLASS ETCHED,0
12913,578362,SMALL GLASS HEART TRINKET POT,0
12913,578362,PAPER CHAIN KIT VINTAGE CHRISTMAS,0
12913,580630,CHRISTMAS HANGING SNOWFLAKE,0
12913,578362,PAPER CHAIN KIT RETROSPOT,0
12913,578362,JUMBO BAG RED RETROSPOT,0
12913,578362,ANTIQUE SILVER T-LIGHT GLASS,0
12913,578362,JUMBO BAG VINTAGE LEAF,0
12913,543748,WHITE METAL LANTERN,0
12913,545348,ANTIQUE SILVER TEA GLASS ETCHED,0
12913,578362,CHRISTMAS RETROSPOT ANGEL WOOD,0
12913,545348,WHITE TALL PORCELAIN T-LIGHT HOLDER,0
12913,578362,GREEN CHRISTMAS TREE CARD HOLDER,0
12913,537433,PAPER CHAIN KIT 50'S CHRISTMAS,0
12913,580630,CHRISTMAS HANGING STAR WITH BELL,0
12913,578362,RED STAR CARD HOLDER,0
12913,543748,HOME BUILDING BLOCK WORD,0
12913,580630,JUMBO BAG VINTAGE LEAF,0
12913,578362,FELTCRAFT GIRL AMELIE KIT,0
12913,580630,3 HEARTS HANGING DECORATION RUSTIC,0
12913,537433,PAPER CHAIN KIT VINTAGE CHRISTMAS,0
12913,545348,BLACK/BLUE POLKADOT UMBRELLA,0
12913,580630,HEART OF WICKER SMALL,0
12913,578362,CHRISTMAS CRAFT WHITE FAIRY,0
12913,578362,ANGEL DECORATION 3 BUTTONS,0
12913,578362,FELTCRAFT BOY JEAN-PAUL KIT,0
12913,578362,NATURAL SLATE HEART CHALKBOARD,0
12913,580630,ANGEL DECORATION 3 BUTTONS,0
12913,578362,3 HEARTS HANGING DECORATION RUSTIC,0
12913,578362,HEART OF WICKER SMALL,0
12913,543748,LOVE BUILDING BLOCK WORD,0
12913,580630,CHRISTMAS STAR WISH LIST CHALKBOARD,0
12913,578362,Next Day Carriage,0
12913,580630,FOLKART STAR CHRISTMAS DECORATIONS,0
12913,543748,DIAMANTE RING ASSORTED IN BOX.,0
12913,578362,FELTCRAFT DOLL ROSIE,0
12913,537433,HOME BUILDING BLOCK WORD,0
12913,578362,FOLKART STAR CHRISTMAS DECORATIONS,0
12913,545348,CRYSTAL DIAMANTE EXPANDABLE RING,0
12913,537433,ASSORTED COLOUR BIRD ORNAMENT,0
12913,580630,ANGEL DECORATION STARS ON DRESS,0
12913,580630,Next Day Carriage,0
12913,580630,PAPER CHAIN KIT 50'S CHRISTMAS,0
13621,563234,POPART WOODEN PENCILS ASST,0
13621,563234,TEATIME ROUND PENCIL SHARPENER,0
13621,563234,SPACEBOY CHILDRENS BOWL,0
13621,563234,SPACEBOY CHILDRENS CUP,0
13621,563234,TRADITIONAL WOODEN SKIPPING ROPE,0
13621,563234,DOLLY GIRL CHILDRENS CUP,0
13621,563234,ANIMAL STICKERS,0
13621,563234,TRADITIONAL WOODEN CATCH CUP GAME,0
13621,563234,12 PENCILS TALL TUBE POSY,0
13621,563234,PACK OF 12 TRADITIONAL CRAYONS,0
13621,563234,WOODEN BOX OF DOMINOES,0
13621,563234,RED  HARMONICA IN BOX,0
13621,563234,36 PENCILS TUBE WOODLAND,0
13621,563234,BAKING SET 9 PIECE RETROSPOT,0
13621,563234,BAG 125g SWIRLY MARBLES,0
13621,563234,VINTAGE SNAP CARDS,0
13621,563234,4 TRADITIONAL SPINNING TOPS,0
13621,563234,VINTAGE HEADS AND TAILS CARD GAME,0
13621,563234,DOLLY GIRL CHILDRENS BOWL,0
14642,570722,PARTY BUNTING,0
14642,570722,ANTIQUE SILVER T-LIGHT GLASS,0
14803,558565,ROSES REGENCY TEACUP AND SAUCER,2
14803,558565,SET OF 36 PAISLEY FLOWER DOILIES,2
14803,544456,GREEN REGENCY TEACUP AND SAUCER,2
14803,558565,75 GREEN PETIT FOUR CASES,2
14803,544456,DANISH ROSE DECORATIVE PLATE,2
14803,544456,PACK OF 20 NAPKINS PANTRY DESIGN,2
14803,544456,PINK REGENCY TEACUP AND SAUCER,2
14803,558565,GARDENIA 3 WICK MORRIS BOXED CANDLE,2
14803,544456,S/3 PINK SQUARE PLANTERS ROSES,2
14803,546101,SMALL CHOCOLATES PINK BOWL,2
14803,546101,SMALL DOLLY MIX DESIGN ORANGE BOWL,2
14803,558565,GREEN REGENCY TEACUP AND SAUCER,2
14803,558565,REX CASH+CARRY JUMBO SHOPPER,2
14803,558565,SET/3 OCEAN SCENT CANDLE JEWEL BOX,2
14803,544456,GREEN REGENCY TEACUP AND SAUCER,2
14803,558565,PACK OF 12 BLUE PAISLEY TISSUES,2
14803,558565,PACK OF 12 PINK POLKADOT TISSUES,2
14803,558565,PACK OF 12 HEARTS DESIGN TISSUES,2
14803,544456,SMALL MARSHMALLOWS PINK BOWL,2
14803,558565,3 ROSE MORRIS BOXED CANDLES,2
14803,558565,PINK REGENCY TEACUP AND SAUCER,2
14803,546101,REGENCY CAKESTAND 3 TIER,2
14803,558565,SET/3 VANILLA SCENTED CANDLE IN BOX,2
14803,558565,PINK PAISLEY SQUARE TISSUE BOX,2
14803,558565,PACK OF 12 PINK PAISLEY TISSUES,2
14803,558565,ROSE 3 WICK MORRIS BOX CANDLE,2
14803,558565,75 BLACK PETIT FOUR CASES,2
14803,558565,PINK DOG BOWL,2
14803,558565,SET OF 36 TEATIME PAPER DOILIES,2
14803,558565,REGENCY CAKESTAND 3 TIER,2
14803,544456,ROSES REGENCY TEACUP AND SAUCER,2
14803,558565,PINK DIAMANTE PEN IN GIFT BOX,2
14803,544456,BOX OF 6 ASSORTED COLOUR TEASPOONS,2
14803,544456,CANDY SPOT TEA COSY,2
14803,544456,PINK REGENCY TEACUP AND SAUCER,2
14803,544456,HOT WATER BOTTLE I AM SO POORLY,2
14803,546101,SMALL LICORICE DES PINK BOWL,2
14803,558565,PACK OF 12 SKULL TISSUES,2
14803,546101,SMALL MARSHMALLOWS PINK BOWL,2
14803,544456,CAKE PLATE LOVEBIRD PINK,2
14803,558565,BLACK AND WHITE DOG BOWL,2
14803,544456,CAKE PLATE LOVEBIRD PINK,2
14803,558565,PACK OF 12 SUKI TISSUES,2
14803,558565,CAKE PLATE LOVEBIRD PINK,2
15396,563754,FRYING PAN UNION FLAG,0
15396,563754,FRENCH CARRIAGE LANTERN,0
15396,563754,12 MESSAGE CARDS WITH ENVELOPES,0
15396,563754,RED RETROSPOT CHILDRENS UMBRELLA,0
15396,563754,DISCO BALL ROTATOR BATTERY OPERATED,0
15396,563754,PENNY FARTHING BIRTHDAY CARD,0
15396,563754,MIRRORED DISCO BALL,0
15396,563754,FELTCRAFT HAIRBANDS PINK AND WHITE,0
15396,563754,PINK CREAM FELT CRAFT TRINKET BOX,0
15396,563754,ICE CREAM SUNDAE LIP GLOSS,0
15396,563754,FELTCRAFT PRINCESS CHARLOTTE DOLL,0
15396,563754,UNION STRIPE WITH FRINGE  HAMMOCK,0
15396,563754,ROBOT BIRTHDAY CARD,0
15396,563754,VINTAGE UNION JACK BUNTING,0
15664,572021,HOT WATER BOTTLE KEEP CALM,0
15664,572021,PAINTED METAL PEARS ASSORTED,0
15664,572021,HOME BUILDING BLOCK WORD,0
15664,572021,LAUNDRY 15C METAL SIGN,0
15664,572021,YELLOW GIANT GARDEN THERMOMETER,0
15664,572021,BLUE GIANT GARDEN THERMOMETER,0
15664,572021,WASHROOM METAL SIGN,0
15664,572021,LANDMARK FRAME NOTTING HILL,0
15664,572021,CHICK GREY HOT WATER BOTTLE,0
15664,572021,BLUE SPOT CERAMIC DRAWER KNOB,0
15664,572021,ZINC T-LIGHT HOLDER STARS SMALL,0
15664,572021,ASSORTED COLOUR BIRD ORNAMENT,0
15664,572021,CHOCOLATE THIS WAY METAL SIGN,0
15664,572021,GAOLERS KEYS DECORATIVE GARDEN,0
15664,572021,HOT BATHS METAL SIGN,0
15664,572021,GREEN CHRISTMAS TREE CARD HOLDER,0
15664,572021,LANDMARK FRAME COVENT GARDEN,0
16209,563180,VICTORIAN GLASS HANGING T-LIGHT,0
16209,549255,SMALL SILVER TRELLIS CANDLEPOT,0
16209,555603,LARGE CIRCULAR MIRROR MOBILE,0
16209,563180,ASSORTED CIRCULAR MOBILE,0
16209,549255,POTTERING IN THE SHED METAL SIGN,0
16209,555603,MIRRORED WALL ART STARS,0
16209,556574,Next Day Carriage,0
16209,566322,HEART OF WICKER SMALL,0
16209,549255,BAKING SET 9 PIECE RETROSPOT,0
16209,549255,HANGING JAM JAR T-LIGHT HOLDER,0
16209,549255,SMALL SILVER FLOWER CANDLE POT,0
16209,555603,GARDENERS KNEELING PAD KEEP CALM,0
16209,555603,HANGING HEART JAR T-LIGHT HOLDER,0
16209,566322,WHITE HEARTS WIRE PLANT POT HOLDER,0
16209,549255,VINTAGE UNION JACK MEMOBOARD,0
16209,555603,MINI PAINTED GARDEN DECORATION,0
16209,563180,WHITE METAL LANTERN,0
16209,555603,PINK/BLUE DISC/MIRROR STRING,0
16209,563180,HANGING METAL HEART LANTERN,0
16209,555603,MIRRORED WALL ART SKULLS,0
16209,555603,JINGLE BELL HEART DECORATION,0
16209,566322,3 HEARTS HANGING DECORATION RUSTIC,0
16209,566322,GARDENERS KNEELING PAD KEEP CALM,0
16209,555603,MINI  ZINC GARDEN DECORATIONS,0
16209,555603,MIRRORED WALL ART POPPIES,0
16209,563180,WOODEN REGATTA BUNTING,0
16209,549255,CHRISTMAS LIGHTS 10 VINTAGE BAUBLES,0
16209,555603,POTTERING IN THE SHED METAL SIGN,0
16209,563180,LARGE CIRCULAR MIRROR MOBILE,0
16209,563180,ENGLISH ROSE GARDEN SECATEURS,0
16209,555603,WOODEN REGATTA BUNTING,0
16209,555603,ASS COL CIRCLE MOBILE,0
16209,563180,HANGING HEART JAR T-LIGHT HOLDER,0
16209,566322,GARDENERS KNEELING PAD CUP OF TEA,0
16209,555603,PAINTED SEA SHELL METAL WINDCHIME,0
16209,555603,GARDENERS KNEELING PAD CUP OF TEA,0
16209,563180,HANGING METAL STAR LANTERN,0
16209,563180,ASSORTED COLOURED CIRCLE MOBILE,0
16209,549255,SILVER PLATE CANDLE BOWL SMALL,0
16209,549255,HAND OVER THE CHOCOLATE   SIGN,0
16209,563180,WHITE LOVEBIRD LANTERN,0
16209,555603,VICTORIAN GLASS HANGING T-LIGHT,0
16209,556574,"\"RECORD FRAME 7\"\" SINGLE SIZE \"",0
16209,555603,HEART OF WICKER SMALL,0
16209,556574,BLACK RECORD COVER FRAME,0
16209,549255,RETROSPOT TEA SET CERAMIC 11 PC,0
16671,574333,NOEL WOODEN BLOCK LETTERS,0
16671,574333,TRADITIONAL CHRISTMAS RIBBONS,0
16671,575882,TRADITIONAL CHRISTMAS RIBBONS,0
16671,558310,PAPER CHAIN KIT 50'S CHRISTMAS,0
16671,558310,NOEL WOODEN BLOCK LETTERS,0
16671,558310,TRADITIONAL CHRISTMAS RIBBONS,0
17015,555845,WRAP GINGHAM ROSE,0
17015,569000,PAINT YOUR OWN CANVAS SET,0
17015,555845,CARD GINGHAM ROSE,0
17015,555845,MINI JIGSAW PURDEY,0
17015,555845,KINGS CHOICE BISCUIT TIN,0
17015,569000,FELTCRAFT PRINCESS CHARLOTTE DOLL,0
17015,569000,I'M ON HOLIDAY METAL SIGN,0
17015,555845,NATURAL SLATE CHALKBOARD LARGE,0
17015,569000,WOOD STAMP SET FLOWERS,0
17015,569000,CARD WEDDING DAY,0
17015,575755,HEART WREATH DECORATION WITH BELL,0
17015,569000,TEA PARTY  WRAPPING PAPER,0
17015,555845,HANGING CHICK CREAM DECORATION,0
17015,555845,FAIRY SOAP SOAP HOLDER,0
17015,555845,ENAMEL WATERING CAN CREAM,0
17015,569000,ASSORTED COLOUR BIRD ORNAMENT,0
17015,555845,WOODEN ROUNDERS GARDEN SET,0
17015,555845,"KEY FOB , BACK DOOR",0
17015,555845,BATHROOM METAL SIGN,0
17015,569000,POTTERING IN THE SHED METAL SIGN,0
17015,555845,VINTAGE EMBOSSED HEART,0
17015,555845,DOORMAT KEEP CALM AND COME IN,0
17015,555845,MAGIC DRAWING SLATE LEAP FROG,0
17015,569000,POPPY'S PLAYHOUSE KITCHEN,0
17015,569000,BLOSSOM  IMAGES NOTEBOOK SET,0
17015,555845,VINTAGE UNION JACK BUNTING,0
17015,555845,FLORAL BATHROOM SET,0
17015,569000,POPPY'S PLAYHOUSE BEDROOM,0
17015,555845,WRAP WEDDING DAY,0
17015,555845,PINK BLUE FELT CRAFT TRINKET BOX,0
17015,569000,EMPIRE BIRTHDAY CARD,0
17015,569000,FELTCRAFT BUTTERFLY HEARTS,0
17015,555845,HERB MARKER BASIL,0
17015,569000,BANQUET BIRTHDAY  CARD,0
17015,555845,TEA PARTY BIRTHDAY CARD,0
17015,569000,MAGNETS PACK OF 4 SWALLOWS,0
17015,569000,WOOD STAMP SET HAPPY BIRTHDAY,0
17015,555845,TEA PARTY  WRAPPING PAPER,0
17015,555845,PARTY METAL SIGN,0
17015,555845,CHILDS GARDEN FORK BLUE,0
17015,555845,MAGIC DRAWING SLATE PURDEY,0
17015,569000,VICTORIAN  METAL POSTCARD SPRING,0
17015,555845,JAM MAKING SET WITH JARS,0
17015,555845,ABSTRACT CIRCLES POCKET BOOK,0
17015,555845,"KEY FOB , FRONT  DOOR",0
17015,575755,WOODEN STAR CHRISTMAS SCANDINAVIAN,0
17015,569000,HEART FILIGREE DOVE  SMALL,0
17015,575755,WOODEN HEART CHRISTMAS SCANDINAVIAN,0
17015,569000,FELTCRAFT PRINCESS OLIVIA DOLL,0
17015,555845,COLOURING PENCILS BROWN TUBE,0
17015,555845,MINIATURE ANTIQUE ROSE HOOK IVORY,0
17015,555845,WOODEN SCHOOL COLOURING SET,0
17015,555845,"KEY FOB , GARAGE DESIGN",0
17015,555845,MINI JIGSAW DOLLY GIRL,0
17015,555845,MINI JIGSAW BUNNIES,0
17015,555845,FELTCRAFT PRINCESS LOLA DOLL,0
17015,569000,6 RIBBONS RUSTIC CHARM,0
17015,555845,NO JUNK MAIL METAL SIGN,0
17015,555845,4 TRADITIONAL SPINNING TOPS,0
17015,555845,WORLD WAR 2 GLIDERS ASSTD DESIGNS,0
17015,555845,WASHROOM METAL SIGN,0
17015,555845,JIGSAW TREE WITH BIRDHOUSE,0
17015,555845,FELTCRAFT HAIRBAND PINK AND PURPLE,0
17015,555845,HERB MARKER MINT,0
17015,575755,CHRISTMAS CRAFT LITTLE FRIENDS,0
17015,555845,"KEY FOB , SHED",0
17015,555845,FILIGRIS HEART WITH BUTTERFLY,0
17015,555845,EMPIRE BIRTHDAY CARD,0
17015,555845,60 CAKE CASES DOLLY GIRL DESIGN,0
17015,575755,LAUREL HEART ANTIQUE GOLD,0
17015,555845,SINGLE HEART ZINC T-LIGHT HOLDER,0
17015,569000,WRAP ENGLISH ROSE,0
17015,555845,MAGIC DRAWING SLATE GO TO THE FAIR,0
17015,569000,3 STRIPEY MICE FELTCRAFT,0
17015,569000,PACK OF 60 SPACEBOY CAKE CASES,0
17015,555845,GLASS JAR KINGS CHOICE,0
17015,555845,FILIGRIS HEART WITH BUTTERFLY,0
17015,569000,SPACEBOY BIRTHDAY CARD,0
17015,555845,CHILDS GARDEN FORK PINK,0
17015,555845,SET OF 60 PANTRY DESIGN CAKE CASES,0
17015,555845,BOTANICAL ROSE GIFT WRAP,0
17015,569000,BIRTHDAY BANQUET GIFT WRAP,0
17015,575755,CHERUB HEART DECORATION SILVER,0
17015,575755,CHRISTMAS METAL TAGS ASSORTED,0
17015,569000,HOME SWEET HOME METAL SIGN,0
17015,555845,JIGSAW TREE WITH WATERING CAN,0
17015,569000,BATHROOM METAL SIGN,0
17015,569000,"KEY FOB , SHED",0
17015,555845,LAUNDRY 15C METAL SIGN,0
17015,569000,WRAP BILLBOARD FONTS DESIGN,0
17015,569000,SET OF 12  VINTAGE POSTCARD SET,0
17015,555845,JAM MAKING SET PRINTED,0
17015,555845,BATHROOM METAL SIGN,0
17015,555845,FELTCRAFT BUTTERFLY HEARTS,0
17015,555845,METAL SIGN TAKE IT OR LEAVE IT,0
17015,569000,POPPY'S PLAYHOUSE BATHROOM,0
17015,555845,MINI JIGSAW GO TO THE FAIR,0
17015,575755,CARD CHRISTMAS VILLAGE,0
17015,555845,MINI JIGSAW BAKE A CAKE,0
17015,555845,BAKING SET SPACEBOY DESIGN,0
17015,569000,GARDENERS KNEELING PAD CUP OF TEA,0
17015,569000,WRAP GINGHAM ROSE,0
17015,569000,TOILET METAL SIGN,0
17015,569000,MAKE YOUR OWN PLAYTIME CARD KIT,0
17015,555845,GARDEN PATH POCKET BOOK,0
17015,575755,SWALLOW WOODEN CHRISTMAS DECORATION,0
17015,569000,TRAVEL CARD WALLET VINTAGE TICKET,0
17015,555845,MAGIC DRAWING SLATE CIRCUS PARADE,0
17015,555845,DECORATIVE FLORE BATHROOM BOTTLE,0
17015,555845,BAKING SET 9 PIECE RETROSPOT,0
17015,555845,12 IVORY ROSE PEG PLACE SETTINGS,0
17015,555845,METAL SIGN EMPIRE TEA,0
17015,569000,CARD BILLBOARD FONT,0
17015,555845,HANGING HEART ZINC T-LIGHT HOLDER,0
17015,555845,BOHEMIAN COLLAGE STATIONERY SET,0
17015,555845,SET OF 2 ROUND TINS DUTCH CHEESE,0
17015,555845,TOILET METAL SIGN,0
17015,555845,MAGIC DRAWING SLATE BUNNIES,0
17015,575755,6 GIFT TAGS 50'S CHRISTMAS,0
17015,555845,FLOWERS TILE HOOK,0
17015,555845,GARDENERS KNEELING PAD CUP OF TEA,0
17015,555845,ASSORTED COLOUR BIRD ORNAMENT,0
17015,555845,MAGIC DRAWING SLATE BAKE A CAKE,0
17015,555845,HANGING CHICK GREEN DECORATION,0
17015,569000,MAKE YOUR OWN FLOWERPOWER CARD KIT,0
17015,575755,3 RAFFIA RIBBONS 50'S CHRISTMAS,0
17015,569000,WOOD STAMP SET THANK YOU,0
17015,569000,60 CAKE CASES DOLLY GIRL DESIGN,0
17015,555845,VINTAGE PAISLEY STATIONERY SET,0
17015,569000,FILIGRIS HEART WITH BUTTERFLY,0
17015,569000,METAL SIGN HIS DINNER IS SERVED,0
17015,575755,CHRISTMAS CRAFT WHITE FAIRY,0
17015,555845,HERB MARKER ROSEMARY,0
17015,569000,FANCY FONTS BIRTHDAY WRAP,0
17015,555845,EMPIRE GIFT WRAP,0
17015,555845,NO SINGING METAL SIGN,0
17015,555845,FELTCRAFT HAIRBAND PINK AND BLUE,0
17015,555845,HAND OVER THE CHOCOLATE   SIGN,0
17015,569000,CARD GINGHAM ROSE,0
17015,569000,GARAGE KEY FOB,0
17015,569000,MAN FLU METAL SIGN,0
17015,569000,"KEY FOB , FRONT  DOOR",0
17015,555845,LOVE BUILDING BLOCK WORD,0
17015,569000,POPPY'S PLAYHOUSE LIVINGROOM,0
17015,555845,GARDENERS KNEELING PAD KEEP CALM,0
17015,555845,HEART FILIGREE DOVE  SMALL,0
17015,575755,STAR WREATH DECORATION WITH BELL,0
17015,569000,WRAP POPPIES  DESIGN,0
17015,555845,KITCHEN METAL SIGN,0
17015,569000,ROMANTIC IMAGES GIFT WRAP SET,0
17015,555845,PINK BLUE FELT CRAFT TRINKET BOX,0
17015,569000,ROMANTIC IMAGES NOTEBOOK SET,0
17015,555845,RECIPE BOX PANTRY YELLOW DESIGN,0
17015,555845,COOK WITH WINE METAL SIGN,0
17015,569000,WRAP  VINTAGE DOILY,0
17015,575755,STAR WOODEN CHRISTMAS DECORATION,0
17015,555845,POTTING SHED TEA MUG,0
17015,555845,FELTCRAFT HAIRBANDS PINK AND WHITE,0
17015,555845,HERB MARKER PARSLEY,0
17015,569000,NO SINGING METAL SIGN,0
17015,569000,TEA PARTY BIRTHDAY CARD,0
17015,555845,VINTAGE BILLBOARD DRINK ME MUG,0
17015,555845,SET OF 2 ROUND TINS CAMEMBERT,0
17015,569000,FELTCRAFT PRINCESS LOLA DOLL,0
17015,555845,VINTAGE HEADS AND TAILS CARD GAME,0
17015,555845,POTTING SHED SEED ENVELOPES,0
17015,575755,FELTCRAFT CHRISTMAS FAIRY,0
17015,555845,"FANCY FONT BIRTHDAY CARD,",0
17015,569000,GROW A FLYTRAP OR SUNFLOWER IN TIN,0
17015,555845,SET OF 2 TINS VINTAGE BATHROOM,0
17015,555845,BATH BUILDING BLOCK WORD,0
17015,555845,12 RED ROSE PEG PLACE SETTINGS,0
17015,569000,GARDENERS KNEELING PAD KEEP CALM,0
17015,569000,VINTAGE EMBOSSED HEART,0
17015,575755,SET OF 6 RIBBONS VINTAGE CHRISTMAS,0
17015,569000,PACK OF 60 PINK PAISLEY CAKE CASES,0
17015,555845,FANCY FONTS BIRTHDAY WRAP,0
17015,569000,PAINTED METAL PEARS ASSORTED,0
17015,575755,CHRISTMAS TREE HANGING GOLD,0
17015,555845,PACK OF 72 RETROSPOT CAKE CASES,0
17015,569000,"FANCY FONT BIRTHDAY CARD,",0
17015,569000,PACK OF 72 RETROSPOT CAKE CASES,0
17015,555845,FIRST AID TIN,0
17015,555845,HERB MARKER CHIVES,0
17015,569000,COOK WITH WINE METAL SIGN,0
17015,555845,FELTCRAFT HAIRBAND RED AND BLUE,0
17015,569000,BLOSSOM IMAGES GIFT WRAP SET,0
17015,569000,EMPIRE GIFT WRAP,0
17015,555845,MINI JIGSAW CIRCUS PARADE,0
17015,575755,WRAP CHRISTMAS VILLAGE,0
17015,569000,MAGNETS PACK OF 4 HOME SWEET HOME,0
17015,555845,PACK OF 60 PINK PAISLEY CAKE CASES,0
17015,569000,6 RIBBONS EMPIRE,0
17015,569000,WOOD STAMP SET BEST WISHES,0
17015,555845,HOT BATHS SOAP HOLDER,0
17015,555845,VINTAGE RED TEATIME MUG,0
17015,555845,SMALL HEART MEASURING SPOONS,0
17015,569000,TRAVEL CARD WALLET KEEP CALM,0
17015,569000,MINI PAINT SET VINTAGE,0
17015,569000,SPACEBOY GIFT WRAP,0
17015,575755,PAPER CHAIN KIT 50'S CHRISTMAS,0
17015,575755,ROLL WRAP 50'S CHRISTMAS,0
17015,569000,CURIOUS IMAGES GIFT WRAP SET,0
17015,555845,TRAVEL CARD WALLET KEEP CALM,0
17015,569000,WRAP WEDDING DAY,0
17015,555845,TRAVEL CARD WALLET VINTAGE ROSE,0
17015,569000,MAKE YOUR OWN MONSOON CARD KIT,0
17015,575755,3D TRADITIONAL CHRISTMAS STICKERS,0
17015,555845,VINTAGE SNAP CARDS,0
17015,555845,CARD WEDDING DAY,0
17015,555845,TRAVEL CARD WALLET VINTAGE TICKET,0
17015,555845,HERB MARKER THYME,0
17015,555845,HOME SWEET HOME MUG,0
17015,575755,HEART WOODEN CHRISTMAS DECORATION,0
17299,566266,TEA TIME PARTY BUNTING,0
17299,566266,NATURAL SLATE RECTANGLE CHALKBOARD,0
17299,566266,CARD PARTY GAMES,0
17299,579121,VINTAGE CHRISTMAS STOCKING,0
17299,557316,PLASTERS IN TIN SPACEBOY,0
17299,557316,JUMBO BAG DOILEY PATTERNS,0
17299,557316,SPACEBOY CHILDRENS BOWL,0
17299,566266,PARTY INVITES JAZZ HEARTS,0
17299,566266,BLUE PAISLEY SKETCHBOOK,0
17299,566266,CARD BILLBOARD FONT,0
17299,557316,WRAP DAISY CARPET,0
17299,564959,BLUE HARMONICA IN BOX,0
17299,566266,FOLKART STAR CHRISTMAS DECORATIONS,0
17299,566266,ASSORTED COLOUR BIRD ORNAMENT,0
17299,566266,JUMBO BAG 50'S CHRISTMAS,0
17299,566266,LARGE HANGING IVORY & RED WOOD BIRD,0
17299,564959,BAKING SET SPACEBOY DESIGN,0
17299,564959,BAKING SET 9 PIECE RETROSPOT,0
17299,557316,PURPLE PAPER PARASOL,0
17299,566266,12 PENCILS TALL TUBE POSY,0
17299,564959,VINTAGE CHRISTMAS GIFT SACK,0
17299,566266,PLASTERS IN TIN VINTAGE PAISLEY,0
17299,557316,CARD PARTY GAMES,0
17299,566266,CARD GINGHAM ROSE,0
17299,566266,TRAVEL CARD WALLET UNION JACK,0
17299,566266,PARTY BUNTING,0
17299,566266,WRAP BILLBOARD FONTS DESIGN,0
17299,566266,WOODEN HAPPY BIRTHDAY GARLAND,0
17299,566266,PINK HAPPY BIRTHDAY BUNTING,0
17299,579121,RABBIT NIGHT LIGHT,0
17299,557316,BIG DOUGHNUT FRIDGE MAGNETS,0
17299,557316,CARD BIRTHDAY COWBOY,0
17299,557316,ASSORTED COLOURS SILK FAN,0
17299,557316,CHINESE DRAGON PAPER LANTERNS,0
17299,557316,BUTTON BOX,0
17299,557316,BLUE HARMONICA IN BOX,0
17299,564959,VINTAGE CHRISTMAS STOCKING,0
17299,566266,SLATE TILE NATURAL HANGING,0
17299,557316,ROBOT BIRTHDAY CARD,0
17299,566266,BUNDLE OF 3 RETRO NOTE BOOKS,0
17299,557316,12 MESSAGE CARDS WITH ENVELOPES,0
17299,564959,RABBIT NIGHT LIGHT,0
17299,557316,BROCADE RING PURSE,0
17299,566266,BUNDLE OF 3 ALPHABET EXERCISE BOOKS,0
17299,566266,SWALLOWS GREETING CARD,0
17299,557316,BLUE POLKADOT WRAP,0
17299,566266,LAVENDER SCENTED FABRIC HEART,0
17299,579121,PINK POLKADOT WRAP,0
17299,557316,DOUGHNUT LIP GLOSS,0
17299,566266,WRAP PAISLEY PARK,0
17299,557316,CARD DOLLY GIRL,0
17299,566266,PARTY INVITES BALLOON GIRL,0
17299,579121,DOUGHNUT LIP GLOSS,0
17299,564959,RED  HARMONICA IN BOX,0
17299,566266,DRAWER KNOB CRACKLE GLAZE GREEN,0
17383,580731,ASSORTED TUTTI FRUTTI PEN,0
17383,580731,VINTAGE GLASS T-LIGHT HOLDER,0
17383,580731,3D CHRISTMAS STAMPS STICKERS,0
17383,580731,BOTTLE BAG RETROSPOT,0
17383,580731,TRADITIONAL CHRISTMAS RIBBONS,0
17383,580731,6 GIFT TAGS VINTAGE CHRISTMAS,0
17383,580731,RIBBON REEL SNOWY VILLAGE,0
17383,580731,MAGIC DRAWING SLATE GO TO THE FAIR,0
17383,580731,3D TRADITIONAL CHRISTMAS STICKERS,0
17383,580731,HILDA CANDY SPOT RABBIT,0
17383,580731,SET OF 6 T-LIGHTS SANTA,0
17383,580731,VINTAGE CHRISTMAS STOCKING,0
17383,580731,POPPY'S PLAYHOUSE LIVINGROOM,0
17383,580731,PAPER CHAIN KIT VINTAGE CHRISTMAS,0
17383,580731,CHRISTMAS LIGHTS 10 SANTAS,0
17383,580731,SET 36 COLOUR PENCILS SPACEBOY,0
17383,580731,MAGIC DRAWING SLATE SPACEBOY,0
17383,580731,OVERNIGHT BAG VINTAGE ROSE PAISLEY,0
17383,580731,MAGIC SHEEP WOOL GROWING FROM PAPER,0
17383,580731,ROLL WRAP 50'S CHRISTMAS,0
17383,580731,POPPY'S PLAYHOUSE BEDROOM,0
17383,580731,SET OF 6 RIBBONS VINTAGE CHRISTMAS,0
17383,580731,SET 12 COLOUR PENCILS LOVE LONDON,0
17383,580731,PACK OF 12 50'S CHRISTMAS TISSUES,0
17383,580731,SET OF 6 T-LIGHTS SNOWMEN,0
17383,580731,SUMMER DAISIES BAG CHARM,0
17383,580731,SCANDINAVIAN REDS RIBBONS,0
17383,580731,BOX OF 6 MINI VINTAGE CRACKERS,0
17383,580731,POPPY'S PLAYHOUSE BATHROOM,0
17383,580731,WRAP CHRISTMAS VILLAGE,0
17383,580731,ROLL WRAP VINTAGE CHRISTMAS,0
17383,580731,PACK OF SIX LED TEA LIGHTS,0
17383,580731,ASSORTED TUTTI FRUTTI  FOB NOTEBOOK,0
17383,580731,FLYING PIG WATERING CAN,0
17383,580731,SET OF 20 VINTAGE CHRISTMAS NAPKINS,0
17383,580731,EIGHT PIECE SNAKE  SET,0
17383,580731,MAGIC TREE -PAPER FLOWERS,0
17383,580731,SET 6 PAPER TABLE LANTERN STARS,0
17383,580731,REX CASH+CARRY JUMBO SHOPPER,0
17383,580731,6 RIBBONS ELEGANT CHRISTMAS,0
17383,580731,12 PENCIL SMALL TUBE WOODLAND,0
17383,580731,MOUSEY LONG LEGS SOFT TOY,0
17383,580731,PAPER CHAIN KIT 50'S CHRISTMAS,0
17383,580731,PACK OF 12 TRADITIONAL CRAYONS,0
17383,580731,12 MESSAGE CARDS WITH ENVELOPES,0
17383,580731,GLASS SPHERE CANDLE STAND MEDIUM,0
17383,580731,SET/12 TAPER CANDLES,0
17383,580731,NECKLACE+BRACELET SET FRUIT SALAD,0
17383,580731,POPPY'S PLAYHOUSE KITCHEN,0
17416,545530,36 PENCILS TUBE SKULLS,1
17416,575612,HAND WARMER RED LOVE HEART,1
17416,545530,PLASTERS IN TIN WOODLAND ANIMALS,1
17416,545530,PINK FLORAL FELTCRAFT SHOULDER BAG,1
17416,557119,CLOTHES PEGS RETROSPOT PACK 24,1
17416,563940,JUMBO STORAGE BAG SUKI,1
17416,575612,HAND WARMER UNION JACK,1
17416,545530,GYMKHANA TREASURE BOOK BOX,1
17416,545530,SET/12 FUNKY FELT FLOWER PEG IN BAG,1
17416,545530,PLASTERS IN TIN SKULLS,1
17416,563940,JUMBO BAG WOODLAND ANIMALS,1
17416,545530,36 PENCILS TUBE RED RETROSPOT,1
17416,575612,BLUE SPOT CERAMIC DRAWER KNOB,1
17416,545530,FELTCRAFT GIRL NICOLE KIT,1
17416,553919,UNION STRIPE CUSHION COVER,1
17416,545530,BLUE STRIPE CERAMIC DRAWER KNOB,1
17416,545530,MEMO BOARD COTTAGE DESIGN,1
17416,553919,SCANDINAVIAN PAISLEY PICNIC BAG,1
17416,567975,FELTCRAFT PRINCESS LOLA DOLL,1
17416,553919,PINK CREAM FELT CRAFT TRINKET BOX,1
17416,545530,WRAP DAISY CARPET,1
17416,575612,STRAWBERRY CHARLOTTE BAG,1
17416,545530,RED STRIPE CERAMIC DRAWER KNOB,1
17416,545530,JUMBO BAG WOODLAND ANIMALS,1
17416,545530,RED RETROSPOT CHARLOTTE BAG,1
17416,557119,BLUE STRIPE CERAMIC DRAWER KNOB,1
17416,545530,RED SPOT CERAMIC DRAWER KNOB,1
17416,563940,WOODLAND CHARLOTTE BAG,1
17416,575612,PINK FLORAL FELTCRAFT SHOULDER BAG,1
17416,563940,JUMBO SHOPPER VINTAGE RED PAISLEY,1
17416,545530,PLASTERS IN TIN SPACEBOY,1
17416,545530,PICNIC BASKET WICKER SMALL,1
17416,567975,RED POLKADOT BEAKER,1
17416,545530,JUMBO SHOPPER VINTAGE RED PAISLEY,1
17416,545530,DAIRY MAID LARGE MILK JUG,1
17416,563940,JUMBO BAG APPLES,1
17416,575612,RED SPOT CERAMIC DRAWER KNOB,1
17416,575612,EMPIRE TISSUE BOX,1
17416,545530,TEA PARTY  WRAPPING PAPER,1
17416,575612,BLOND DOLL DOORSTOP,1
17416,553919,LUNCH BAG APPLE DESIGN,1
17416,557119,SKULL SHOULDER BAG,1
17416,575612,WHITE SPOT RED CERAMIC DRAWER KNOB,1
17416,545530,LARGE WHITE/PINK ROSE ART FLOWER,1
17416,553919,LUNCH BAG DOLLY GIRL DESIGN,1
17416,554834,CHARLIE AND LOLA TABLE TINS,1
17416,563940,BLUE POLKADOT BEAKER,1
17416,545530,FELTCRAFT CUSHION BUTTERFLY,1
17416,563940,JUMBO BAG VINTAGE DOILY,1
17416,557119,RED SPOT CERAMIC DRAWER KNOB,1
17416,557119,BLUE SPOT CERAMIC DRAWER KNOB,1
17416,567975,CHARLIE+LOLA RED HOT WATER BOTTLE,1
17416,553919,ASSTD MULTICOLOUR CIRCLES MUG,1
17416,545530,JUMBO BAG SPACEBOY DESIGN,1
17416,545530,EASTER TIN KEEPSAKE,1
17416,563940,JUMBO STORAGE BAG SKULLS,1
17416,553919,SPOTTY BUNTING,1
17416,567975,FELTCRAFT CUSHION RABBIT,1
17416,557119,SET 7 BABUSHKA NESTING BOXES,1
17416,563940,JUMBO BAG DOLLY GIRL DESIGN,1
17416,575612,JUMBO STORAGE BAG SUKI,1
17416,553919,CHARLIE + LOLA BISCUITS TINS,1
17416,553919,ICE CREAM DESIGN GARDEN PARASOL,1
17416,563940,RED RETROSPOT TISSUE BOX,1
17416,545530,RETROSPOT LARGE MILK JUG,1
17416,563940,ENGLISH ROSE GARDEN SECATEURS,1
17416,545530,WRAP ENGLISH ROSE,1
17416,545530,RED/CREAM STRIPE CUSHION COVER,1
17416,545530,REGENCY CAKESTAND 3 TIER,1
17416,545530,UNION STRIPE CUSHION COVER,1
17416,557119,WHITE SPOT RED CERAMIC DRAWER KNOB,1
17416,575612,PINK CREAM FELT CRAFT TRINKET BOX,1
17416,545530,FELT FARM ANIMAL CHICKEN,1
17416,545530,SWEETHEART CERAMIC TRINKET BOX,1
17416,575612,VINTAGE DOILY JUMBO BAG RED,1
17416,545530,TREASURE ISLAND BOOK BOX,1
17416,545530,RED RETROSPOT PICNIC BAG,1
17416,557119,JUMBO BAG VINTAGE LEAF,1
17416,545530,BASKET OF TOADSTOOLS,1
17416,567975,SPOTTY BUNTING,1
17416,575612,JUMBO BAG PAISLEY PARK,1
17416,545530,VINTAGE CARAVAN GIFT WRAP,1
17416,563940,LUNCH BAG PINK POLKADOT,1
17416,545530,ABC TREASURE BOOK BOX,1
17416,575612,BLUE PAISLEY TISSUE BOX,1
17416,567975,DRAWER KNOB CERAMIC BLACK,1
17416,575612,HAND WARMER BABUSHKA DESIGN,1
17416,557119,JUMBO STORAGE BAG SUKI,1
17416,563940,BLUE PAISLEY TISSUE BOX,1
17416,563940,ASS FLORAL PRINT MULTI SCREWDRIVER,1
17416,545530,RED RETROSPOT UMBRELLA,1
17416,553919,BLUE/CREAM STRIPE CUSHION COVER,1
17416,553919,DAIRY MAID STRIPE MUG,1
17416,557119,WOOD BLACK BOARD ANT WHITE FINISH,1
17416,563940,CHARLIE & LOLA WASTEPAPER BIN BLUE,1
17416,575612,JUMBO SHOPPER VINTAGE RED PAISLEY,1
17416,545530,JUMBO BAG STRAWBERRY,1
