12845,546724,GINGERBREAD MAN COOKIE CUTTER,2
12845,546853,SET OF 20 KIDS COOKIE CUTTERS,2
12845,544662,TEA COSY RED  STRIPE,2
12845,544662,SET/5 RED RETROSPOT LID GLASS BOWLS,2
12845,544662,RED RETROSPOT UMBRELLA,2
12845,544662,RED RETROSPOT TISSUE BOX,2
12845,546724,SET OF 20 KIDS COOKIE CUTTERS,2
12845,546724,SET OF 3 BUTTERFLY COOKIE CUTTERS,2
12845,544662,12 PENCILS TALL TUBE RED RETROSPOT,2
12845,544662,GIRLS VINTAGE TIN SEASIDE BUCKET,2
12845,544662,SET OF 3 HEART COOKIE CUTTERS,2
12845,544662,BOYS VINTAGE TIN SEASIDE BUCKET,2
12845,544662,200 RED + WHITE BENDY STRAWS,2
12845,544662,RED RETROSPOT CHILDRENS UMBRELLA,2
12845,544662,EDWARDIAN PARASOL RED,2
12845,546462,CREAM FELT EASTER EGG BASKET,2
12845,544662,PACK OF 72 RETROSPOT CAKE CASES,2
12845,544662,RED  HARMONICA IN BOX,2
12845,544662,"SET 3 RETROSPOT TEA,COFFEE,SUGAR",2
12845,544662,ROUND CONTAINER SET OF 5 RETROSPOT,2
12845,544662,CLOTHES PEGS RETROSPOT PACK 24,2
12845,544662,RED KITCHEN SCALES,2
12845,544662,WOODEN UNION JACK BUNTING,2
12845,546724,3 PIECE SPACEBOY COOKIE CUTTER SET,2
12845,544662,12 PENCILS SMALL TUBE RED RETROSPOT,2
12845,544662,RED DINER WALL CLOCK,2
12845,544662,36 PENCILS TUBE RED RETROSPOT,2
13579,537223,CHRISTMAS CRAFT TREE TOP ANGEL,0
13579,537223,CHOCOLATE HOT WATER BOTTLE,0
13579,578681,15CM CHRISTMAS GLASS BALL 20 LIGHTS,0
13579,537223,HEART OF WICKER SMALL,0
13579,537223,HOT WATER BOTTLE I AM SO POORLY,0
13579,578681,GLASS SPHERE CANDLE STAND MEDIUM,0
13579,578681,JINGLE BELL HEART DECORATION,0
13579,578681,HEART OF WICKER SMALL,0
13579,537223,HOT WATER BOTTLE TEA AND SYMPATHY,0
13579,578681,LOVE HOT WATER BOTTLE,0
13579,578681,VINTAGE JINGLE BELLS HEART,0
13579,578681,GARDEN PATH JOURNAL,0
13579,578681,GARDEN PATH SKETCHBOOK,0
13579,578681,HOT WATER BOTTLE TEA AND SYMPATHY,0
13579,537223,CHRISTMAS CRAFT LITTLE FRIENDS,0
13579,578681,LANTERN CREAM GAZEBO,0
13579,537223,RETROSPOT HEART HOT WATER BOTTLE,0
13579,578681,FUNKY DIVA PEN,0
13579,578681,HOT WATER BOTTLE I AM SO POORLY,0
13579,578681,VINTAGE BELLS GARLAND,0
13579,537223,TOOL BOX SOFT TOY,0
13579,578681,CHRYSANTHEMUM NOTEBOOK,0
13579,537223,15CM CHRISTMAS GLASS BALL 20 LIGHTS,0
14034,559017,HEART WOODEN CHRISTMAS DECORATION,0
14034,577051,PARISIENNE SEWING BOX,0
14034,577051,ROSE 3 WICK MORRIS BOX CANDLE,0
14034,577051,WALL ART ANIMALS AND NATURE,0
14034,577051,NATURAL HANGING QUILTED HEARTS,0
14034,559017,PAINTED METAL STAR WITH HOLLY BELLS,0
14034,577051,FILIGRIS HEART WITH BUTTERFLY,0
14034,577051,JOY WOODEN BLOCK LETTERS,0
14034,559017,DOORMAT MERRY CHRISTMAS RED,0
14034,577051,MINT KITCHEN SCALES,0
14034,559017,HEART SHAPED HOLLY WREATH,0
14034,577051,RIBBON REEL STRIPES DESIGN,0
14034,559017,METAL MERRY CHRISTMAS WREATH,0
14034,577051,HEART DECORATION WITH PEARLS,0
14034,577051,VINTAGE DOILY TRAVEL SEWING KIT,0
14034,577051,MAGNETS PACK OF 4 VINTAGE COLLAGE,0
14034,577051,VINTAGE EMBOSSED HEART,0
14034,577051,EMBROIDERED RIBBON REEL SUSIE,0
14034,577051,RIBBON REEL FLORA + FAUNA,0
14034,559017,WOODEN STAR CHRISTMAS SCANDINAVIAN,0
14034,577051,BOX OF VINTAGE JIGSAW BLOCKS,0
14034,559017,CHRISTMAS HANGING STAR WITH BELL,0
14034,559017,SET 3 WICKER STORAGE BASKETS,0
14034,559017,RIBBON REEL CHRISTMAS SOCK BAUBLE,0
14034,577051,WOODEN HEART CHRISTMAS SCANDINAVIAN,0
14034,559017,FINE WICKER HEART,0
14034,577051,ZINC METAL HEART DECORATION,0
14034,577051,ORIGAMI ROSE INCENSE/CANDLE SET,0
14034,577051,SET OF 4 NAPKIN CHARMS 3 KEYS,0
14034,577051,HANGING HEART MIRROR DECORATION,0
14034,577051,CHOCOLATE CALCULATOR,0
14034,559017,BISCUIT TIN 50'S CHRISTMAS,0
14034,577051,MAGNETS PACK OF 4 RETRO PHOTO,0
14034,577051,FAMILY ALBUM WHITE PICTURE FRAME,0
14034,559017,SWALLOW WOODEN CHRISTMAS DECORATION,0
14034,577051,SET OF 4 NAPKIN CHARMS LEAVES,0
14034,577051,HANGING HEART WITH BELL,0
14034,559017,PARTY CONE CHRISTMAS DECORATION,0
14034,577051,ALARM CLOCK BAKELIKE PINK,0
14034,559017,HEART OF WICKER SMALL,0
14034,577051,DECORATIVE VINTAGE COFFEE  BOX,0
14034,577051,SET OF 3 WOODEN HEART DECORATIONS,0
14034,559017,3 HEARTS HANGING DECORATION RUSTIC,0
14034,577051,RETROSPOT WOODEN HEART DECORATION,0
14034,577051,SET OF 12  VINTAGE POSTCARD SET,0
14034,577051,ALARM CLOCK BAKELIKE IVORY,0
14034,577051,FOLKART ZINC HEART CHRISTMAS DEC,0
14034,577051,CHOCOLATE 1 WICK MORRIS BOX CANDLE,0
14034,577051,20 DOLLY PEGS RETROSPOT,0
14034,577051,EMBROIDERED RIBBON REEL SOPHIE,0
14034,577051,ASSORTED COLOUR BIRD ORNAMENT,0
14034,577051,MAGNETS PACK OF 4 HOME SWEET HOME,0
14034,577051,ORIGAMI SANDLEWOOD INCENSE/CAND SET,0
14034,577051,LADIES & GENTLEMEN METAL SIGN,0
14034,577051,NATURAL HANGING QUILTED HEARTS,0
14034,577051,RETROSPOT TEA SET CERAMIC 11 PC,0
14034,577051,ROLL WRAP VINTAGE CHRISTMAS,0
14034,559017,SET OF 3 WOODEN STOCKING DECORATION,0
14034,559017,CHRISTMAS MUSICAL ZINC STAR,0
14034,577051,ORIGAMI JASMINE INCENSE/CANDLE SET,0
14034,577051,GOLD MINI TAPE MEASURE,0
14034,577051,IVORY HANGING DECORATION  HEART,0
14034,577051,SWALLOWS GREETING CARD,0
14034,577051,RED RETROSPOT WRAP,0
14034,577051,PLACE SETTING WHITE HEART,0
14034,577051,BOX OF 6 MINI VINTAGE CRACKERS,0
14034,577051,FRIDGE MAGNETS US DINER ASSORTED,0
14034,577051,LOVEBIRD HANGING DECORATION WHITE,0
14034,577051,MINT DINER WALL CLOCK,0
14034,577051,MISTLETOE HEART WREATH CREAM,0
14034,559017,WICKER STAR,0
14034,577051,PRETTY HANGING QUILTED HEARTS,0
14034,559017,HEART WREATH DECORATION WITH BELL,0
14034,559017,RIBBON REEL MAKING SNOWMEN,0
14034,559020,HEART WREATH DECORATION WITH BELL,0
14034,577051,6 RIBBONS RUSTIC CHARM,0
14034,559017,HEART GARLAND RUSTIC PADDED,0
14034,577051,PLACE SETTING WHITE HEART,0
14034,577051,MAGNETS PACK OF 4 SWALLOWS,0
14034,559020,JINGLE BELL HEART ANTIQUE SILVER,0
14034,577051,SET OF 4 NAPKIN CHARMS CUTLERY,0
14034,559017,STAR WOODEN CHRISTMAS DECORATION,0
14034,577051,GINGHAM HEART  DOORSTOP RED,0
14034,577051,HEART DECORATION PAINTED ZINC,0
14034,559017,JINGLE BELL HEART ANTIQUE SILVER,0
14034,577051,RED RETROSPOT CHILDRENS UMBRELLA,0
14083,580647,BALLOON WATER BOMB PACK OF 35,0
14083,536945,SET OF 9 HEART SHAPED BALLOONS,0
14083,580647,CHERRY CROCHET FOOD COVER,0
14083,561815,SPOTTY BUNTING,0
14083,580647,UNION STRIPE WITH FRINGE  HAMMOCK,0
14083,580647,LARGE HEART MEASURING SPOONS,0
14083,536945,POLKA DOT RAFFIA FOOD COVER,0
14083,580647,WOODLAND SMALL BLUE FELT HEART,0
14083,580647,ROUND SNACK BOXES SET OF 4 SKULLS,0
14083,580647,A PRETTY THANK YOU CARD,0
14083,536945,OVERNIGHT BAG VINTAGE ROSE PAISLEY,0
14083,536945,VINTAGE SEASIDE JIGSAW PUZZLES,0
14083,580647,CLOTHES PEGS RETROSPOT PACK 24,0
14083,539637,LARGE MEDINA STAMPED METAL BOWL,0
14083,536945,"FOLK ART GREETING CARD,pack/12",0
14083,536945,SMALL CAMPHOR WOOD FIELD  MUSHROOM,0
14083,580647,TREASURE TIN BUFFALO BILL,0
14083,536945,BREAD BIN DINER STYLE RED,0
14083,580647,CARD I LOVE LONDON,0
14083,580647,PLASTERS IN TIN SPACEBOY,0
14083,580647,ROLL WRAP VINTAGE SPOT,0
14083,580647,GLASS SPHERE CANDLE STAND MEDIUM,0
14083,580647,RATTLE SNAKE EGGS,0
14083,536945,DOORMAT NEW ENGLAND,0
14083,580647,FRENCH FLORAL CUSHION COVER,0
14083,580647,CHRISTMAS CARD SINGING ANGEL,0
14083,536945,SET OF 9 BLACK SKULL BALLOONS,0
14083,580647,RETROSPOT CANDLE  SMALL,0
14083,580647,CARD BILLBOARD FONT,0
14083,536945,LIGHT GARLAND BUTTERFILES PINK,0
14083,539637,LOVE BUILDING BLOCK WORD,0
14083,536945,PAISLEY PATTERN  STICKERS,0
14083,536945,CHARLOTTE BAG DOLLY GIRL DESIGN,0
14083,536945,FLOWER VINE RAFFIA FOOD COVER,0
14083,580647,"ACRYLIC JEWEL ICICLE, PINK",0
14083,539637,REX CASH+CARRY JUMBO SHOPPER,0
14083,536945,EIGHT PIECE SNAKE  SET,0
14083,580647,20 DOLLY PEGS RETROSPOT,0
14083,539637,CHILLI LIGHTS,0
14083,580157,SET OF 6 RIBBONS COUNTRY STYLE,0
14083,536945,LAVENDER SCENTED FABRIC HEART,0
14083,536945,"\"ASSORTED FLOWER COLOUR \"\"LEIS\"\"\"",0
14083,580647,CARD BIRTHDAY COWBOY,0
14083,580647,RABBIT NIGHT LIGHT,0
14083,536945,PINK VINTAGE PAISLEY PICNIC BAG,0
14083,580647,TOADSTOOL BEDSIDE LIGHT,0
14083,580647,EGG CUP MILKMAID HEIDI,0
14083,536945,CHILDS BREAKFAST SET DOLLY GIRL,0
14083,561815,RED RETROSPOT UMBRELLA,0
14083,580647,EGG CUP MILKMAID INGRID,0
14083,539639,PACK OF 12 LONDON TISSUES,0
14083,580647,ROUND CONTAINER SET OF 5 RETROSPOT,0
14083,580647,RED DRAGONFLY HELICOPTER,0
14083,546390,DISCO BALL CHRISTMAS DECORATION,0
14083,536945,SET/3 RED GINGHAM ROSE STORAGE BOX,0
14083,539637,CHRISTMAS LIGHTS 10 VINTAGE BAUBLES,0
14083,580647,RED TOADSTOOL LED NIGHT LIGHT,0
14083,539637,SET 2 TEA TOWELS I LOVE LONDON,0
14083,580647,SNACK TRAY PAISLEY PARK,0
14083,536945,CAMPHOR WOOD PORTOBELLO MUSHROOM,0
14083,536945,BLUE/YELLOW FLOWER DESIGN BIG MUG,0
14083,536945,PLASTERS IN TIN WOODLAND ANIMALS,0
14083,536945,CHRISTMAS LIGHTS 10 VINTAGE BAUBLES,0
14083,561815,BLACK/BLUE POLKADOT UMBRELLA,0
14083,536945,PLASTERS IN TIN VINTAGE PAISLEY,0
14083,580647,VINTAGE ZINC WATERING CAN,0
14083,539639,PINK POT PLANT CANDLE,0
14083,539637,SET OF 20 VINTAGE CHRISTMAS NAPKINS,0
14083,580647,RECYCLED ACAPULCO MAT PINK,0
14083,536945,36 FOIL HEART CAKE CASES,0
14083,539639,LONDON BUS COFFEE MUG,0
14083,580647,SPACEBOY TV DINNER TRAY,0
14083,580647,CARD MOTORBIKE SANTA,0
14083,580647,FRYING PAN PINK POLKADOT,0
14083,536945,RETROSPOT RED WASHING UP GLOVES,0
14083,580647,BOX OF 6 ASSORTED COLOUR TEASPOONS,0
14083,580647,GLITTER HEART GARLAND WITH BELLS,0
14083,536945,"FLOWER FAIRY,5 SUMMER B'DRAW LINERS",0
14083,580647,FOLKART STAR CHRISTMAS DECORATIONS,0
14083,536945,PINK  HEART SHAPE LOVE BUCKET,0
14083,580647,12 COLOURED PARTY BALLOONS,0
14083,536945,YELLOW/PINK FLOWER DESIGN BIG MUG,0
14083,539637,RED RETROSPOT UMBRELLA,0
14083,536945,RED RETROSPOT UMBRELLA,0
14083,580647,LOVE HOT WATER BOTTLE,0
14083,580647,MINI LIGHTS WOODLAND MUSHROOMS,0
14083,539639,QUEENS GUARD COFFEE MUG,0
14083,580647,EIGHT PIECE SNAKE  SET,0
14083,536945,HEARTS  STICKERS,0
14083,580647,VINTAGE HEADS AND TAILS CARD GAME,0
14083,580647,ROLL WRAP 50'S CHRISTMAS,0
14083,580157,REX CASH+CARRY JUMBO SHOPPER,0
14083,536945,SPACEBOY BIRTHDAY CARD,0
14083,580647,JUMBO BAG PAISLEY PARK,0
14083,580647,GLASS HEART T-LIGHT HOLDER,0
14083,536945,PACK/12 BLUE FOLKART CARDS,0
14083,580647,SET OF 6 T-LIGHTS TOADSTOOLS,0
14083,536945,GREEN 3 PIECE POLKADOT CUTLERY SET,0
14083,539637,NUMBER TILE COTTAGE GARDEN 1,0
14083,580647,MULTICOLOUR SPRING FLOWER MUG,0
14083,580647,WRAP PAISLEY PARK,0
14083,580647,RETRO LONGBOARD IRONING BOARD COVER,0
14083,580647,RED BABY BUNTING,0
14083,580157,RETROSPOT SMALL TUBE MATCHES,0
14083,536945,HEART OF WICKER SMALL,0
14083,536945,GINGHAM HEART  DOORSTOP RED,0
14083,536945,RED LOVE HEART SHAPE CUP,0
14083,580647,RECYCLED ACAPULCO MAT BLUE,0
14083,580647,ROLL WRAP 50'S RED CHRISTMAS,0
14083,539639,COFFEE MUG CAT + BIRD DESIGN,0
14083,580647,SET/10 RED POLKADOT PARTY CANDLES,0
14083,536945,GUMBALL COAT RACK,0
14083,536945,SET/3 FLORAL GARDEN TOOLS IN BAG,0
14083,554506,CHINESE DRAGON PAPER LANTERNS,0
14083,580647,RED RETROSPOT SUGAR JAM BOWL,0
14083,539639,SET OF 6 T-LIGHTS SANTA,0
14083,562532,WOODEN REGATTA BUNTING,0
14083,536945,ROBOT MUG IN DISPLAY BOX,0
14083,580647,GINGHAM HEART  DOORSTOP RED,0
14083,536945,DOORMAT ENGLISH ROSE,0
14083,536945,SET OF 6 3D KIT CARDS FOR KIDS,0
14083,539637,ANTIQUE GLASS HEART DECORATION,0
14083,536945,ROSE DU SUD OVEN GLOVE,0
14083,536945,ENGLISH ROSE GARDEN SECATEURS,0
14083,580647,RIDGED BONNE JAM JAR T-LIGHT HOLDER,0
14083,580647,SPOTTY BUNTING,0
14083,536945,BOX OF 6 ASSORTED COLOUR TEASPOONS,0
14083,536945,PLASTERS IN TIN SKULLS,0
14083,536945,JUMBO SHOPPER VINTAGE RED PAISLEY,0
14083,539637,COLUMBIAN CANDLE RECTANGLE,0
14083,539637,DOORMAT ENGLISH ROSE,0
14083,539637,36 PENCILS TUBE SKULLS,0
14083,580647,CHRISTMAS TOILET ROLL,0
14083,580157,POPPY FIELDS CHOPPING BOARD,0
14083,580647,ANTIQUE ALL GLASS CANDLESTICK,0
14083,539637,DISCO BALL CHRISTMAS DECORATION,0
14083,580647,POLKA DOT RAFFIA FOOD COVER,0
14083,536945,PINK/GREEN FLOWER DESIGN BIG MUG,0
14083,536945,GREEN/BLUE FLOWER DESIGN BIG MUG,0
14083,539639,CREAM SLICE FLANNEL CHOCOLATE SPOT,0
14083,580647,SET OF 72 PINK HEART PAPER DOILIES,0
14083,539637,SET OF 6 T-LIGHTS TOADSTOOLS,0
14083,539637,S/4 VALENTINE DECOUPAGE HEART BOX,0
14083,554506,4 PURPLE FLOCK DINNER CANDLES,0
14083,536945,PINK FLOWER CROCHET FOOD COVER,0
14083,536945,SCANDINAVIAN PAISLEY PICNIC BAG,0
14083,580647,WOODLAND SMALL PINK FELT HEART,0
14083,580647,RED RETROSPOT SMALL MILK JUG,0
14083,580647,S/4 PINK FLOWER CANDLES IN BOWL,0
14083,536945,FUNKY WASHING UP GLOVES ASSORTED,0
14083,580647,PAISLEY PARK CARD,0
14083,536945,BALLOON ART MAKE YOUR OWN FLOWERS,0
14083,536945,PLASTERS IN TIN SPACEBOY,0
14083,539639,COFFEE MUG DOG + BALL DESIGN,0
14083,580647,COLOURED GLASS STAR T-LIGHT HOLDER,0
14083,580647,SKULL LUNCH BOX WITH CUTLERY,0
14083,536945,PACK 3 FIRE ENGINE/CAR PATCHES,0
14083,580157,3 HEARTS HANGING DECORATION RUSTIC,0
14083,539637,BISCUIT TIN VINTAGE GREEN,0
14083,536945,TOY TIDY SPACEBOY,0
14083,580157,RIBBON REEL CHRISTMAS PRESENT,0
14083,536945,CHARLIE AND LOLA CHARLOTTE BAG,0
14083,536945,ASSORTED CREEPY CRAWLIES,0
14083,536945,VINTAGE UNION JACK BUNTING,0
14083,536945,VINTAGE CARAVAN GREETING CARD,0
14083,536945,SET OF SKULL WALL STICKERS,0
14083,580647,HANGING HEART JAR T-LIGHT HOLDER,0
14083,539637,BISCUIT TIN VINTAGE RED,0
14083,580157,IVORY WICKER HEART LARGE,0
14083,580647,MINI WOODEN HAPPY BIRTHDAY GARLAND,0
14083,539639,SET 2 TEA TOWELS I LOVE LONDON,0
14083,580647,RECYCLED ACAPULCO MAT LAVENDER,0
14083,536945,PINK LOVE HEART SHAPE CUP,0
14083,539637,RED TOADSTOOL LED NIGHT LIGHT,0
14083,580647,DOORSTOP RETROSPOT HEART,0
14083,580647,BAKING SET 9 PIECE RETROSPOT,0
14083,539639,BOOM BOX SPEAKER BOYS,0
14523,564161,MIRROR MOSAIC T-LIGHT HOLDER ROUND,0
14523,564161,MARIE ANTOINETTE TRINKET BOX GOLD,0
14523,564161,IVORY PILLAR CANDLE SILVER FLOCK,0
14523,564161,IVORY PILLAR CANDLE GOLD FLOCK,0
14523,564161,COLUMBIAN CANDLE ROUND,0
14523,564161,ANTIQUE SILVER T-LIGHT GLASS,0
14523,564161,OPIUM SCENTED VOTIVE CANDLE,0
14523,564161,MIRRORED DISCO BALL,0
14523,564161,AGED GLASS SILVER T-LIGHT HOLDER,0
14523,564161,CUT GLASS T-LIGHT HOLDER OCTAGON,0
14523,564161,VINTAGE GLASS T-LIGHT HOLDER,0
14523,564161,WRAP 50'S  CHRISTMAS,0
14535,548987,6 EGG HOUSE PAINTED WOOD,0
14535,562377,REGENCY MILK JUG PINK,0
14535,570458,RETROSPOT RED WASHING UP GLOVES,0
14535,562377,SMALL WHITE HEART OF WICKER,0
14535,548987,FRENCH ENAMEL CANDLEHOLDER,0
14535,562377,MINT KITCHEN SCALES,0
14535,562377,FOOD COVER WITH BEADS SET 2,0
14535,548987,TEA TIME PARTY BUNTING,0
14535,562377,PINK HAPPY BIRTHDAY BUNTING,0
14535,570458,FULL ENGLISH BREAKFAST PLATE,0
14535,570458,SET OF 6 SPICE TINS PANTRY DESIGN,0
14535,548987,PINK REGENCY TEACUP AND SAUCER,0
14535,562377,MEDIUM CERAMIC TOP STORAGE JAR,0
14535,570458,DECORATIVE WICKER HEART SMALL,0
14535,548987,RETROSPOT LARGE MILK JUG,0
14535,562377,LARGE CERAMIC TOP STORAGE JAR,0
14535,570458,PLEASE ONE PERSON METAL SIGN,0
14535,562377,NATURAL SLATE RECTANGLE CHALKBOARD,0
14535,548987,VINTAGE UNION JACK PENNANT,0
14535,548987,WHITE HANGING HEART T-LIGHT HOLDER,0
14535,548987,PARTY BUNTING,0
14535,570458,DOLLY GIRL MINI BACKPACK,0
14535,570458,HAND WARMER BABUSHKA DESIGN,0
14535,562377,DINOSAUR LUNCH BOX WITH CUTLERY,0
14535,548987,SET OF 72 PINK HEART PAPER DOILIES,0
14535,548987,PAPER CHAIN KIT EMPIRE,0
14535,562377,DRAWER KNOB VINTAGE GLASS STAR,0
14535,570458,RIBBON REEL STRIPES DESIGN,0
14535,570458,RED  HARMONICA IN BOX,0
14535,562377,BLUE HAPPY BIRTHDAY BUNTING,0
14535,548987,SET OF 4 JAM JAR MAGNETS,0
14535,548987,PAPER BUNTING COLOURED LACE,0
14535,562377,JAM CLOCK MAGNET,0
14535,548987,RETROSPOT RED WASHING UP GLOVES,0
14535,562377,SPOTTY BUNTING,0
14535,548987,SET OF 3 CAKE TINS PANTRY DESIGN,0
14535,570458,METAL SIGN DROP YOUR PANTS,0
14535,548987,12 EGG HOUSE PAINTED WOOD,0
14535,562377,GREEN VINTAGE SPOT BEAKER,0
14535,570458,HANGING METAL STAR LANTERN,0
14535,548987,RED RETROSPOT SUGAR JAM BOWL,0
14535,548987,PACK OF 6 SANDCASTLE FLAGS ASSORTED,0
14535,562377,ROSES REGENCY TEACUP AND SAUCER,0
14535,570458,MOODY GIRL DOOR HANGER,0
14535,570458,SET OF 3 HANGING OWLS OLLIE BEAK,0
14535,548987,EASTER CRAFT 4 CHICKS,0
14535,562377,FRENCH ENAMEL WATER BASIN,0
14535,562377,PARTY BUNTING,0
14535,570458,SET 12 COLOURING PENCILS DOILY,0
14535,562377,DRAWER KNOB CERAMIC RED,0
14535,570458,SET 12 COLOUR PENCILS SPACEBOY,0
14535,570458,HAND WARMER OWL DESIGN,0
14535,548987,EMPIRE GIFT WRAP,0
14535,570458,HANGING METAL HEART LANTERN,0
14535,548987,PINK HAPPY BIRTHDAY BUNTING,0
14535,562377,SMALL CERAMIC TOP STORAGE JAR,0
14535,570458,BLUE VINTAGE SPOT BEAKER,0
14535,570458,PANTRY HOOK TEA STRAINER,0
14535,562377,RED STRIPE CERAMIC DRAWER KNOB,0
14535,570458,ASSORTED COLOURS SILK FAN,0
14535,570458,MOUSE TOY WITH PINK T-SHIRT,0
14535,548987,PAPER CHAIN KIT EMPIRE,0
14535,562377,WOOD BLACK BOARD ANT WHITE FINISH,0
14535,562377,CHILDRENS CUTLERY POLKADOT PINK,0
14535,548987,PAPER BUNTING RETROSPOT,0
14535,562377,VINTAGE  2 METER FOLDING RULER,0
14535,562377,POPART WOODEN PENCILS ASST,0
14535,562377,LUNCH BAG DOILEY PATTERN,0
14535,570458,JAM MAKING SET PRINTED,0
14535,548987,60 CAKE CASES DOLLY GIRL DESIGN,0
14535,548987,CANDLEHOLDER PINK HANGING HEART,0
14535,548987,WOODEN FRAME ANTIQUE WHITE,0
14535,570458,HANGING MINI COLOURED BOTTLES,0
14535,562377,HANGING HEART JAR T-LIGHT HOLDER,0
14535,562377,NATURAL SLATE CHALKBOARD LARGE,0
14535,570458,IVORY WICKER HEART LARGE,0
14535,548987,PACK OF 60 PINK PAISLEY CAKE CASES,0
14535,570458,GIN + TONIC DIET METAL SIGN,0
14535,570458,DRAWER KNOB CERAMIC IVORY,0
14535,562377,WHITE HANGING HEART T-LIGHT HOLDER,0
14535,570458,DOOR HANGER  MUM + DADS ROOM,0
14535,562377,PACK OF 20 NAPKINS PANTRY DESIGN,0
14535,570458,SET OF 12 T-LIGHTS VINTAGE DOILY,0
14535,562377,RETROSPOT RED WASHING UP GLOVES,0
14535,548987,JAM MAKING SET WITH JARS,0
14535,562377,CHILDRENS CUTLERY SPACEBOY,0
14535,562377,ASS FLORAL PRINT MULTI SCREWDRIVER,0
14535,548987,72 SWEETHEART FAIRY CAKE CASES,0
14535,548987,T-LIGHT HOLDER SWEETHEART HANGING,0
14535,548987,TOILET SIGN OCCUPIED OR VACANT,0
14535,548987,DISCO BALL ROTATOR BATTERY OPERATED,0
14535,570458,BAG 125g SWIRLY MARBLES,0
14535,562377,WRAP MAGIC FOREST,0
14535,570458,MINI PLAYING CARDS DOLLY GIRL,0
14535,548987,CHILDRENS CUTLERY POLKADOT GREEN,0
14535,562377,WOODEN PICTURE FRAME WHITE FINISH,0
14535,570458,CARAVAN SQUARE TISSUE BOX,0
14535,562377,WOODEN FRAME ANTIQUE WHITE,0
14535,570458,FRIDGE MAGNETS LES ENFANTS ASSORTED,0
14535,570458,ROLL WRAP VINTAGE CHRISTMAS,0
14535,570458,JAZZ HEARTS PURSE NOTEBOOK,0
14535,570458,RED RETROSPOT WRAP,0
14535,548987,IVORY GIANT GARDEN THERMOMETER,0
14535,562377,PINK VINTAGE SPOT BEAKER,0
14535,570458,HANGING JAM JAR T-LIGHT HOLDERS,0
14535,570458,HOT WATER BOTTLE KEEP CALM,0
14535,548987,DOORMAT HEARTS,0
14535,562377,SINGLE WIRE HOOK IVORY HEART,0
14535,570458,DECORATIVE WICKER HEART MEDIUM,0
14535,570458,SLEEPING CAT ERASERS,0
14535,548987,VINTAGE UNION JACK APRON,0
14535,570458,"AIRLINE LOUNGE,METAL SIGN",0
14535,570458,CHRISTMAS CRAFT TREE TOP ANGEL,0
14535,562377,DRAWER KNOB CRACKLE GLAZE IVORY,0
14535,562377,NATURAL SLATE HEART CHALKBOARD,0
14535,570458,RED CHARLIE+LOLA PERSONAL DOORSIGN,0
14535,548987,SWEETHEART CAKESTAND 3 TIER,0
14535,548987,BLUE PARTY BAGS,0
14535,562377,WRAP PAISLEY PARK,0
14535,570458,CARAVAN SQUARE TISSUE BOX,0
14535,548987,HOMEMADE JAM SCENTED CANDLES,0
14535,570458,ASSORTED BOTTLE TOP  MAGNETS,0
14535,562377,DRAWER KNOB CRACKLE GLAZE GREEN,0
14535,562377,LUNCH BAG ALPHABET DESIGN,0
14535,570458,DRAWER KNOB CERAMIC BLACK,0
14535,548987,IVORY HANGING DECORATION  HEART,0
14535,570458,ROLL WRAP VINTAGE SPOT,0
14535,570458,DRAWER KNOB VINTAGE GLASS HEXAGON,0
14535,548987,NATURAL SLATE HEART CHALKBOARD,0
14535,548987,BLUE STRIPE CERAMIC DRAWER KNOB,0
14535,562377,WOODEN SCHOOL COLOURING SET,0
14535,570458,ROLL WRAP 50'S CHRISTMAS,0
14535,570458,CHILDRENS TOY COOKING UTENSIL SET,0
14535,548987,SWEETHEART WIRE MAGAZINE RACK,0
14535,562377,BUNDLE OF 3 RETRO NOTE BOOKS,0
14535,570458,SET OF 4 PANTRY JELLY MOULDS,0
14535,548987,RED COAT RACK PARIS FASHION,0
14535,562377,SET OF 4 PANTRY JELLY MOULDS,0
14535,570458,PANTRY MAGNETIC  SHOPPING LIST,0
14535,570458,RETROSPOT HEART HOT WATER BOTTLE,0
14535,570458,CLASSIC CAFE SUGAR DISPENSER,0
14535,570458,DO NOT TOUCH MY STUFF DOOR HANGER,0
14535,548987,DAIRY MAID LARGE MILK JUG,0
14535,562377,JUMBO BAG APPLES,0
14535,570458,GREEN DRAWER KNOB ACRYLIC EDWARDIAN,0
14535,570458,PANTRY HOOK SPATULA,0
14535,548987,REX CASH+CARRY JUMBO SHOPPER,0
14535,548987,FILIGRIS HEART WITH BUTTERFLY,0
14535,562377,BUNDLE OF 3 ALPHABET EXERCISE BOOKS,0
14535,570458,PINK VINTAGE SPOT BEAKER,0
14535,548987,PANTRY SCRUBBING BRUSH,0
14535,562377,CHILDRENS CUTLERY RETROSPOT RED,0
14535,562377,SET OF 36 DOILIES PANTRY DESIGN,0
14535,570458,DRAWER KNOB VINTAGE GLASS STAR,0
14535,548987,60 TEATIME FAIRY CAKE CASES,0
14535,548987,HOME BUILDING BLOCK WORD,0
14535,562377,SWEETHEART WIRE MAGAZINE RACK,0
14535,562377,LUNCH BAG APPLE DESIGN,0
14535,570458,RED VINTAGE SPOT BEAKER,0
14535,570458,HAND WARMER UNION JACK,0
14535,562377,STRAWBERRY LUNCH BOX WITH CUTLERY,0
14535,570458,ROLL WRAP 50'S RED CHRISTMAS,0
14535,570458,WHITE SPOT RED CERAMIC DRAWER KNOB,0
14535,562377,IVORY KITCHEN SCALES,0
14535,562377,DOLLY GIRL LUNCH BOX,0
14535,562377,WRAP RED APPLES,0
14535,548987,RED RETROSPOT SMALL MILK JUG,0
14535,562377,LUNCH BAG VINTAGE LEAF DESIGN,0
14535,570458,WALL ART CLASSIC PUDDINGS,0
14535,570458,REX CASH+CARRY JUMBO SHOPPER,0
14535,548987,GREEN REGENCY TEACUP AND SAUCER,0
14535,548987,WRAP BILLBOARD FONTS DESIGN,0
14535,562377,SET OF 60 PANTRY DESIGN CAKE CASES,0
14535,570458,PANTRY HOOK BALLOON WHISK,0
14535,570458,ASS FLORAL PRINT SPIRIT LEVEL,0
14535,548987,WOODEN PICTURE FRAME WHITE FINISH,0
14535,548987,CHILDRENS CUTLERY RETROSPOT RED,0
14535,570458,GROOVY CACTUS INFLATABLE,0
14535,570458,HANGING HEART JAR T-LIGHT HOLDER,0
14535,562377,GAOLERS KEYS DECORATIVE GARDEN,0
14535,570458,RIBBON REEL POLKADOTS,0
14535,562377,SET OF 60 VINTAGE LEAF CAKE CASES,0
14535,570458,SWEETHEART RECIPE BOOK STAND,0
14535,548987,CREAM WALL PLANTER HEART SHAPED,0
14535,570458,GREEN VINTAGE SPOT BEAKER,0
14535,548987,PACK OF 60 MUSHROOM CAKE CASES,0
14535,548987,JAM CLOCK MAGNET,0
14535,548987,BIRTHDAY BANQUET GIFT WRAP,0
14535,562377,LUNCH BAG SUKI DESIGN,0
14535,570458,SPACEBOY MINI BACKPACK,0
14535,570458,MINI PLAYING CARDS SPACEBOY,0
14535,570458,VINTAGE DOILY TRAVEL SEWING KIT,0
14535,548987,RED  HARMONICA IN BOX,0
14535,562377,DOUGHNUT LIP GLOSS,0
14535,562377,ROUND SNACK BOXES SET OF 4 FRUITS,0
14535,570458,GRAND CHOCOLATECANDLE,0
14535,562377,JAZZ HEARTS ADDRESS BOOK,0
14535,570458,WALL ART BICYCLE SAFETY,0
14535,562377,BLUE VINTAGE SPOT BEAKER,0
14535,562377,UNION STRIPE WITH FRINGE  HAMMOCK,0
14535,562377,DRAWER KNOB CRACKLE GLAZE PINK,0
14535,562377,LUNCH BAG SPACEBOY DESIGN,0
14535,570458,FRENCH ENAMEL CANDLEHOLDER,0
14535,562377,CHILDRENS CUTLERY POLKADOT GREEN,0
14535,570458,COSY HOUR CIGAR BOX MATCHES,0
14535,548987,ROSES REGENCY TEACUP AND SAUCER,0
14535,548987,GAOLERS KEYS DECORATIVE GARDEN,0
14535,570458,MINI PLAYING CARDS BUFFALO BILL,0
14535,570458,DECORATIVE WICKER HEART LARGE,0
14535,548987,BLUE SPOT CERAMIC DRAWER KNOB,0
14535,548987,PINK PARTY BAGS,0
14535,570458,PANTRY 3 HOOK ROLLING PIN HANGER,0
14535,548987,HANGING HEART JAR T-LIGHT HOLDER,0
14535,548987,VINTAGE RED MUG,0
14535,562377,SET OF 3 CAKE TINS PANTRY DESIGN,0
14535,570458,SET 8 CANDLES VINTAGE DOILY,0
14535,570458,SET OF 3 WOODEN HEART DECORATIONS,0
14535,562377,COTTON APRON PANTRY DESIGN,0
14535,562377,WOOD STAMP SET FLOWERS,0
14535,570458,FRIDGE MAGNETS LA VIE EN ROSE,0
14535,548987,SET/5 RED RETROSPOT LID GLASS BOWLS,0
14535,548987,CITRONELLA CANDLE FLOWERPOT,0
14535,562377,ENGLISH ROSE SPIRIT LEVEL,0
14535,562377,BLUE POLKADOT WASHING UP GLOVES,0
14535,570458,MINI PAINT SET VINTAGE,0
14535,548987,BLUE GIANT GARDEN THERMOMETER,0
14535,570458,WORLD WAR 2 GLIDERS ASSTD DESIGNS,0
14535,548987,RED SPOT CERAMIC DRAWER KNOB,0
14535,548987,PAPER BUNTING RETROSPOT,0
14535,548987,JAM JAR WITH PINK LID,0
14535,570458,CAMOUFLAGE LED TORCH,0
14535,548987,BLUE COAT RACK PARIS FASHION,0
14535,570458,RED RETROSPOT TAPE,0
14535,570458,BLUE STRIPE CERAMIC DRAWER KNOB,0
14535,570458,CHRISTMAS CRAFT LITTLE FRIENDS,0
14535,548987,SET OF 5 MINI GROCERY MAGNETS,0
14535,570458,MOODY BOY  DOOR HANGER,0
14535,548987,PACK OF 72 RETROSPOT CAKE CASES,0
14535,548987,ROUND CAKE TIN VINTAGE RED,0
14535,548987,RAIN PONCHO RETROSPOT,0
14535,562377,JUMBO SHOPPER VINTAGE RED PAISLEY,0
14535,570458,ENGLISH ROSE HOT WATER BOTTLE,0
14535,570458,GAOLERS KEYS DECORATIVE GARDEN,0
14535,548987,HEART DECORATION WITH PEARLS,0
14535,562377,CREAM SWEETHEART MINI CHEST,0
14535,562377,HEART OF WICKER SMALL,0
14535,562377,VINTAGE UNION JACK BUNTING,0
14535,548987,SET OF 4 PANTRY JELLY MOULDS,0
14535,570458,HEART T-LIGHT HOLDER WILLIE WINKIE,0
14535,570458,RIBBON REEL MAKING SNOWMEN,0
14535,570458,SMALL PARISIENNE HEART PHOTO FRAME,0
14535,570458,60 CAKE CASES VINTAGE CHRISTMAS,0
14535,562377,JAM MAKING SET PRINTED,0
14535,562377,HEART OF WICKER LARGE,0
14535,570458,WALL ART LOVES' SECRET,0
14535,562377,IVORY SWEETHEART WIRE LETTER RACK,0
14535,570458,SET OF 3 CAKE TINS PANTRY DESIGN,0
14535,570458,BAKING SET SPACEBOY DESIGN,0
14535,562377,RED VINTAGE SPOT BEAKER,0
14535,562377,JUMBO BAG DOILEY PATTERNS,0
14535,562377,BLUE STRIPE CERAMIC DRAWER KNOB,0
14535,570458,PACK OF 12 CHRISTMAS FUN CARDS,0
14535,548987,PACK OF 60 DINOSAUR CAKE CASES,0
14535,570458,ROTATING SILVER ANGELS T-LIGHT HLDR,0
14535,570458,CHICK GREY HOT WATER BOTTLE,0
14535,570458,IVORY WICKER HEART MEDIUM,0
14535,570458,36 DOILIES VINTAGE CHRISTMAS,0
14535,548987,PACK OF 60 SPACEBOY CAKE CASES,0
14535,562377,VINTAGE DONKEY TAIL GAME,0
14535,562377,ENAMEL WASH BOWL CREAM,0
14535,562377,WOOD STAMP SET BEST WISHES,0
14535,570458,MINI PLAYING CARDS GYMKHANA,0
14535,570458,WALL ART STOP FOR TEA,0
14535,548987,PANTRY WASHING UP BRUSH,0
14535,562377,REX CASH+CARRY JUMBO SHOPPER,0
14535,570458,WALL ART VILLAGE SHOW,0
