17338,538626,ANGEL DECORATION PAINTED ZINC,1
17338,538626,WICKER STAR,1
17338,540968,BEADED PEARL HEART WHITE ON STICK,1
17338,544586,"KEY FOB , GARAGE DESIGN",1
17338,550477,MEDIUM MEDINA STAMPED METAL BOWL,1
17338,553710,PICNIC BASKET WICKER LARGE,1
17338,553710,LONDON BUS COFFEE MUG,1
17338,558709,FELTCRAFT GIRL AMELIE KIT,1
17338,558709,BOX OF 24 COCKTAIL PARASOLS,1
17338,538626,MAGIC DRAWING SLATE PURDEY,1
17338,540968,FELTCRAFT 6 FLOWER FRIENDS,1
17338,558709,PICNIC BOXES SET OF 3 RETROSPOT,1
17338,558709,BLUE EGG  SPOON,1
17338,563565,SET/3 VANILLA SCENTED CANDLE IN BOX,1
17338,578041,CARD HOLDER GINGHAM HEART,1
17338,544586,YELLOW COAT RACK PARIS FASHION,1
17338,544586,PINK FAIRY CAKE CHILDRENS APRON,1
17338,563565,GINGERBREAD MAN COOKIE CUTTER,1
17338,578041,LANTERN CREAM GAZEBO,1
17338,578041,OPEN CLOSED METAL SIGN,1
17338,550477,WHITE HANGING HEART T-LIGHT HOLDER,1
17338,558709,ASSORTED CIRCULAR MOBILE,1
17338,578041,SCOTTIE DOG HOT WATER BOTTLE,1
17338,578041,12 PENCILS TALL TUBE RED RETROSPOT,1
17338,578041,SILVER STARS TABLE DECORATION,1
17338,558709,FLORAL FOLK STATIONERY SET,1
17338,578041,SILVER GLITTER FLOWER VOTIVE HOLDER,1
17338,550477,POPPY'S PLAYHOUSE LIVINGROOM,1
17338,553710,COOK WITH WINE METAL SIGN,1
17338,578041,DELUXE SEWING KIT,1
17338,538626,BLACK SILOUETTE CANDLE PLATE,1
17338,540968,BAKING MOULD HEART MILK CHOCOLATE,1
17338,558709,SET/10 BLUE POLKADOT PARTY CANDLES,1
17338,563565,PARTY INVITES JAZZ HEARTS,1
17338,563565,GUMBALL COAT RACK,1
17338,578041,RED RETROSPOT CHILDRENS UMBRELLA,1
17338,578041,VINTAGE DONKEY TAIL GAME,1
17338,578041,REINDEER HEART DECORATION SILVER,1
17338,538626,SET OF 3 NOTEBOOKS IN PARCEL,1
17338,550477,POPPY'S PLAYHOUSE KITCHEN,1
17338,558709,ASSORTED COLOUR T-LIGHT HOLDER,1
17338,578041,TOXIC AREA  DOOR HANGER,1
17338,550477,FELTCRAFT PRINCESS LOLA DOLL,1
17338,578041,I'M ON HOLIDAY METAL SIGN,1
17338,540968,DOORMAT HOME SWEET HOME BLUE,1
17338,578041,SET/6 PINK  BUTTERFLY T-LIGHTS,1
17338,540968,S/4 VALENTINE DECOUPAGE HEART BOX,1
17338,563565,FELTCRAFT DOLL EMILY,1
17338,578041,BEWARE OF THE CAT METAL SIGN,1
17338,550477,CHINESE DRAGON PAPER LANTERNS,1
17338,563565,SET 6 FOOTBALL CELEBRATION CANDLES,1
17338,558709,BEWARE OF THE CAT METAL SIGN,1
17338,550477,COLOURING PENCILS BROWN TUBE,1
17338,550477,EASTER DECORATION SITTING BUNNY,1
17338,558709,FELTCRAFT GIRL NICOLE KIT,1
17338,563565,LOVEBIRD HANGING DECORATION WHITE,1
17338,550477,SAVE THE PLANET COTTON TOTE BAG,1
17338,578041,PICTURE DOMINOES,1
17338,578041,GARDENERS KNEELING PAD CUP OF TEA,1
17338,578041,FOUR HOOK  WHITE LOVEBIRDS,1
17338,540968,KNITTED UNION FLAG HOT WATER BOTTLE,1
17338,550477,CLOTHES PEGS RETROSPOT PACK 24,1
17338,563565,BOX OF VINTAGE JIGSAW BLOCKS,1
17338,563565,SMALL IVORY HEART WALL ORGANISER,1
17338,544586,"KEY FOB , FRONT  DOOR",1
17338,544586,HAND OVER THE CHOCOLATE   SIGN,1
17338,544586,HEART FILIGREE DOVE LARGE,1
17338,550477,PINK FAIRY CAKE CHILDRENS APRON,1
17338,578041,SET 12 RETRO WHITE CHALK STICKS,1
17338,578041,PAPER CHAIN KIT 50'S CHRISTMAS,1
17338,544586,WOODEN HAPPY BIRTHDAY GARLAND,1
17338,563565,FAN BLACK FRAME,1
17338,578041,BLACK/BLUE POLKADOT UMBRELLA,1
17338,540968,TRAVEL SEWING KIT,1
17338,544586,BOX OF VINTAGE JIGSAW BLOCKS,1
17338,553710,FELTCRAFT PRINCESS LOLA DOLL,1
17338,558709,SPACEBOY LUNCH BOX,1
17338,558709,COFFEE MUG DOG + BALL DESIGN,1
17338,578041,WOODEN PICTURE FRAME WHITE FINISH,1
17338,553710,LUNCH BOX I LOVE LONDON,1
17338,563565,HEART FILIGREE DOVE LARGE,1
17338,578041,HOT WATER BOTTLE KEEP CALM,1
17338,540968,RETROSPOT HEART HOT WATER BOTTLE,1
17338,550477,PACK OF 60 DINOSAUR CAKE CASES,1
17338,553710,WALL TIDY RETROSPOT,1
17338,558709,WALL TIDY RETROSPOT,1
17338,578041,SET/3 VANILLA SCENTED CANDLE IN BOX,1
17338,544586,EDWARDIAN PARASOL BLACK,1
17338,544586,LARGE PURPLE BABUSHKA NOTEBOOK,1
17338,558709,SET/3 VANILLA SCENTED CANDLE IN BOX,1
17338,563565,SEASIDE FLYING DISC,1
17338,578041,WOOD 2 DRAWER CABINET WHITE FINISH,1
17338,578041,CHRISTMAS CRAFT LITTLE FRIENDS,1
17338,578041,ROTATING SILVER ANGELS T-LIGHT HLDR,1
17338,544586,KEEP OUT BOYS DOOR HANGER,1
17338,544586,TRADITIONAL MODELLING CLAY,1
17338,550477,JUNGLE POPSICLES ICE LOLLY MOULDS,1
17338,558709,RECIPE BOX RETROSPOT,1
17338,563565,SET 12 RETRO WHITE CHALK STICKS,1
17338,540968,BOTTLE BAG RETROSPOT,1
17338,540968,CUPID DESIGN SCENTED CANDLES,1
17338,558709,ROUND CONTAINER SET OF 5 RETROSPOT,1
17338,563565,SAVE THE PLANET COTTON TOTE BAG,1
17338,550477,RETROSPOT TEA SET CERAMIC 11 PC,1
17338,558709,FOLDING UMBRELLA BLACKBLUE POLKADOT,1
17338,558709,FOLDING UMBRELLA RED/WHITE POLKADOT,1
17338,558709,LANTERN CREAM GAZEBO,1
17338,550477,POPPY'S PLAYHOUSE BATHROOM,1
17338,550477,AGED GLASS SILVER T-LIGHT HOLDER,1
17338,563565,FELTCRAFT DOLL ROSIE,1
17338,563565,ZINC METAL HEART DECORATION,1
17338,544586,WOODEN PICTURE FRAME WHITE FINISH,1
17338,550477,BEWARE OF THE CAT METAL SIGN,1
17338,578041,LARGE MEDINA STAMPED METAL BOWL,1
17338,578041,15CM CHRISTMAS GLASS BALL 20 LIGHTS,1
17338,538626,PACK OF 12 COLOURED PENCILS,1
17338,544586,PACK OF 72 RETROSPOT CAKE CASES,1
17338,544586,HOT WATER BOTTLE I AM SO POORLY,1
17338,578041,VINTAGE SNAKES & LADDERS,1
17338,550477,FELTCRAFT GIRL AMELIE KIT,1
17338,563565,CLASSIC CAFE SUGAR DISPENSER,1
17338,578041,CREAM SWEETHEART MINI CHEST,1
17338,578041,SET OF 3 BUTTERFLY COOKIE CUTTERS,1
17338,578041,IVORY WICKER HEART MEDIUM,1
17338,540968,BEWARE OF THE CAT METAL SIGN,1
17338,578041,EDWARDIAN PARASOL BLACK,1
17338,544586,SET OF 6 SPICE TINS PANTRY DESIGN,1
17338,544586,GARLAND WITH HEARTS AND BELLS,1
17338,550477,SET/3 RED GINGHAM ROSE STORAGE BOX,1
17338,558709,VANILLA SCENT CANDLE JEWELLED BOX,1
17338,563565,ROSE SCENT CANDLE IN JEWELLED BOX,1
17338,578041,DOOR HANGER  MUM + DADS ROOM,1
17338,578041,COFFEE MUG CAT + BIRD DESIGN,1
17338,544586,MOODY GIRL DOOR HANGER,1
17338,540968,DOORMAT SPOTTY HOME SWEET HOME,1
17338,540968,RECIPE BOX RETROSPOT,1
17338,550477,RED RETROSPOT CAKE STAND,1
17338,558709,WOODEN ROUNDERS GARDEN SET,1
17338,563565,LUNCH BOX I LOVE LONDON,1
17338,538626,GLITTER HEART GARLAND WITH BELLS,1
17338,544586,POPPY'S PLAYHOUSE KITCHEN,1
17338,544586,60 TEATIME FAIRY CAKE CASES,1
17338,550477,PHOTO FRAME CORNICE,1
17338,578041,POPPY'S PLAYHOUSE BATHROOM,1
17338,544586,SET/3 RED GINGHAM ROSE STORAGE BOX,1
17338,558709,ASSORTED COLOURS SILK FAN,1
17338,558709,GLASS APOTHECARY BOTTLE PERFUME,1
17338,540968,RED RETROSPOT CAKE STAND,1
17338,540968,LUNCH BOX I LOVE LONDON,1
17338,558709,JUNGLE POPSICLES ICE LOLLY MOULDS,1
17338,578041,DISCO BALL CHRISTMAS DECORATION,1
17338,538626,60 TEATIME FAIRY CAKE CASES,1
17338,538626,HOME SWEET HOME MUG,1
17338,540968,PIGGY BANK RETROSPOT,1
17338,544586,"HOOK, 1 HANGER ,MAGIC GARDEN",1
17338,544586,SMALL RED BABUSHKA NOTEBOOK,1
17338,558709,EDWARDIAN PARASOL RED,1
17338,563565,SINGLE ANTIQUE ROSE HOOK IVORY,1
17338,578041,SET OF 20 VINTAGE CHRISTMAS NAPKINS,1
17338,578041,STAR  T-LIGHT HOLDER,1
17338,550477,LONDON BUS COFFEE MUG,1
17338,578041,SMALL POLKADOT CHOCOLATE GIFT BAG,1
17338,558709,PHOTO FRAME CORNICE,1
17338,563565,WOODEN PICTURE FRAME WHITE FINISH,1
17338,550477,LUNCH BOX I LOVE LONDON,1
17338,550477,SET/6 TURQUOISE BUTTERFLY T-LIGHTS,1
17338,544586,DOORMAT NEW ENGLAND,1
17338,550477,SET/3 VANILLA SCENTED CANDLE IN BOX,1
17338,578041,STRIPEY CHOCOLATE NESTING BOXES,1
17338,578041,ALARM CLOCK BAKELIKE RED,1
17338,538626,IVORY PILLAR CANDLE SILVER FLOCK,1
17338,563565,POPPY'S PLAYHOUSE BATHROOM,1
17338,578041,CHRISTMAS HANGING STAR WITH BELL,1
17338,550477,3 TRADITIONAl BISCUIT CUTTERS  SET,1
17338,578041,ZINC HEART LATTICE T-LIGHT HOLDER,1
17338,578041,RED RETROSPOT CAKE STAND,1
17338,558709,SET OF 36 PAISLEY FLOWER DOILIES,1
17338,538626,MOROCCAN TEA GLASS,1
17338,540968,ZINC METAL HEART DECORATION,1
17338,550477,PACK OF 12 TRADITIONAL CRAYONS,1
17338,558709,WHITE HANGING HEART T-LIGHT HOLDER,1
17338,558709,FAN BLACK FRAME,1
17338,578041,FELTCRAFT CHRISTMAS FAIRY,1
17338,578041,MOODY BOY  DOOR HANGER,1
17338,553710,RED RETROSPOT CAKE STAND,1
17338,578041,60 CAKE CASES VINTAGE CHRISTMAS,1
17338,578041,DELUXE SEWING KIT,1
17338,558709,NEW BAROQUE BLACK PHOTO ALBUM,1
17338,550477,SET3 BOOK BOX GREEN GINGHAM FLOWER,1
17338,563565,SET/5 RED RETROSPOT LID GLASS BOWLS,1
17338,578041,HOT WATER BOTTLE SEX BOMB,1
17338,578041,RECIPE BOX RETROSPOT,1
17338,538626,STAR  T-LIGHT HOLDER,1
17338,544586,ORANGE SCENTED SET/9 T-LIGHTS,1
17338,558709,FAN BLACK FRAME,1
17338,578041,GINGERBREAD MAN COOKIE CUTTER,1
17338,578041,TEA BAG PLATE RED RETROSPOT,1
17338,538626,DISCO BALL ROTATOR BATTERY OPERATED,1
17338,544586,DOORMAT HOME SWEET HOME BLUE,1
17338,553710,TEA BAG PLATE RED RETROSPOT,1
17338,578041,VINTAGE HEADS AND TAILS CARD GAME,1
17338,563565,WOODEN HAPPY BIRTHDAY GARLAND,1
17338,563565,TREASURE TIN GYMKHANA DESIGN,1
17338,578041,SILVER HANGING T-LIGHT HOLDER,1
17338,540968,FELTCRAFT DOLL ROSIE,1
17338,540968,PACK OF 12 HEARTS DESIGN TISSUES,1
17338,578041,T-LIGHT HOLDER HANGING LACE,1
17338,578041,Manual,1
17338,553710,FELTCRAFT DOLL MARIA,1
17338,563565,FLORAL FOLK STATIONERY SET,1
17338,578041,BUNDLE OF 3 SCHOOL EXERCISE BOOKS,1
17338,544586,CINAMMON SET OF 9 T-LIGHTS,1
17338,550477,PACK OF 72 RETROSPOT CAKE CASES,1
17338,563565,FOLDING UMBRELLA BLACKBLUE POLKADOT,1
17338,578041,ROUND SNACK BOXES SET OF 4 FRUITS,1
17338,538626,MAGIC DRAWING SLATE GO TO THE FAIR,1
17338,540968,MOODY BOY  DOOR HANGER,1
17338,544586,VICTORIAN  METAL POSTCARD SPRING,1
17338,563565,VINTAGE PAISLEY STATIONERY SET,1
17338,578041,12 PENCILS TALL TUBE RED RETROSPOT,1
17338,578041,BUNDLE OF 3 RETRO NOTE BOOKS,1
17338,544586,FELTCRAFT PRINCESS CHARLOTTE DOLL,1
17338,553710,PINK FAIRY CAKE CHILDRENS APRON,1
17338,558709,RED HEART LUGGAGE TAG,1
17338,563565,TREASURE TIN BUFFALO BILL,1
17338,578041,ROUND SNACK BOXES SET OF4 WOODLAND,1
17338,544586,BLACK/BLUE POLKADOT UMBRELLA,1
17338,550477,SET OF 20 KIDS COOKIE CUTTERS,1
17338,563565,RED RETROSPOT OVEN GLOVE DOUBLE,1
17338,544586,PLEASE ONE PERSON METAL SIGN,1
17338,563565,FRIDGE MAGNETS US DINER ASSORTED,1
17338,540968,RETROSPOT TEA SET CERAMIC 11 PC,1
17338,550477,TRADITIONAL MODELLING CLAY,1
17338,563565,WOOD S/3 CABINET ANT WHITE FINISH,1
17338,540968,HEART DECORATION PAINTED ZINC,1
17338,544586,CHRYSANTHEMUM SKETCHBOOK,1
17338,563565,FELTCRAFT GIRL NICOLE KIT,1
17338,578041,COLOURED GLASS STAR T-LIGHT HOLDER,1
17338,538626,SCOTTIE DOG HOT WATER BOTTLE,1
17338,558709,HEART DECORATION PAINTED ZINC,1
17338,578041,LOVE HOT WATER BOTTLE,1
17338,578041,VINTAGE EMBOSSED HEART,1
17338,578041,LONDON BUS COFFEE MUG,1
17338,538626,ROTATING SILVER ANGELS T-LIGHT HLDR,1
17338,550477,COOK WITH WINE METAL SIGN,1
17338,553710,TV DINNER TRAY AIR HOSTESS,1
17338,563565,TOXIC AREA  DOOR HANGER,1
17338,578041,BOHEMIAN COLLAGE STATIONERY SET,1
17338,544586,NINJA RABBIT PINK,1
17338,544586,FELTCRAFT DOLL MARIA,1
17338,578041,SET/12 TAPER CANDLES,1
17338,540968,TOAST ITS - I LOVE YOU,1
17338,558709,BOHEMIAN COLLAGE STATIONERY SET,1
17338,578041,CHRISTMAS CRAFT LITTLE FRIENDS,1
17338,578041,PHOTO FRAME LINEN AND LACE SMALL,1
17338,540968,LANTERN CREAM GAZEBO,1
17338,544586,SET OF 36 TEATIME PAPER DOILIES,1
17338,544586,SPACEBOY TV DINNER TRAY,1
17338,550477,WALL TIDY RETROSPOT,1
17338,558709,LUNCH BOX I LOVE LONDON,1
17338,578041,LARGE ROUND WICKER PLATTER,1
17338,578041,SET/5 RED RETROSPOT LID GLASS BOWLS,1
17338,544586,RED RETROSPOT CAKE STAND,1
17338,550477,SET/3 OCEAN SCENT CANDLE JEWEL BOX,1
17338,544586,BLUE COAT RACK PARIS FASHION,1
17338,544586,COSY SLIPPER SHOES SMALL  RED,1
17338,558709,LOVEBIRD HANGING DECORATION WHITE,1
17338,538626,POPPY'S PLAYHOUSE LIVINGROOM,1
17338,550477,SEASIDE FLYING DISC,1
17338,558709,ROUND SNACK BOXES SET OF4 WOODLAND,1
17338,563565,WHITE HANGING HEART T-LIGHT HOLDER,1
17338,563565,3 STRIPEY MICE FELTCRAFT,1
17338,558709,COFFEE MUG CAT + BIRD DESIGN,1
17338,563565,FELTCRAFT GIRL AMELIE KIT,1
17338,578041,FELTCRAFT GIRL NICOLE KIT,1
17338,538626,POPPY'S PLAYHOUSE KITCHEN,1
17338,563565,SET OF 3 CAKE TINS PANTRY DESIGN,1
17338,578041,RED RETROSPOT OVEN GLOVE,1
17338,550477,RECYCLING BAG RETROSPOT,1
17338,558709,DECORATION  BUTTERFLY  MAGIC GARDEN,1
17338,563565,LARGE MEDINA STAMPED METAL BOWL,1
17338,563565,PARTY INVITES WOODLAND,1
17338,578041,EDWARDIAN PARASOL RED,1
17338,538626,RAINBOW PEGS PHOTO CLIP STRING,1
17338,540968,FELTCRAFT PRINCESS LOLA DOLL,1
17338,544586,MOODY BOY  DOOR HANGER,1
17338,563565,RED RETROSPOT ROUND CAKE TINS,1
17338,578041,BOX OF 24 COCKTAIL PARASOLS,1
17338,553710,POPPY'S PLAYHOUSE LIVINGROOM,1
17338,558709,MEDIUM MEDINA STAMPED METAL BOWL,1
17338,538626,KINGS CHOICE BISCUIT TIN,1
17338,540968,TOXIC AREA  DOOR HANGER,1
17338,544586,RETROSPOT TEA SET CERAMIC 11 PC,1
17338,544586,60 TEATIME FAIRY CAKE CASES,1
17338,558709,HEART FILIGREE DOVE LARGE,1
17338,538626,HAND WARMER BABUSHKA DESIGN,1
17338,544586,BALLOON WATER BOMB PACK OF 35,1
17338,550477,HEART IVORY TRELLIS LARGE,1
17338,553710,METAL SIGN TAKE IT OR LEAVE IT,1
17338,563565,TRADITIONAL KNITTING NANCY,1
17338,578041,FLORAL FOLK STATIONERY SET,1
17338,544586,FLORAL FOLK STATIONERY SET,1
17338,550477,LOVE POTION MASALA INCENSE,1
17338,553710,RECIPE BOX PANTRY YELLOW DESIGN,1
17338,553710,COFFEE MUG DOG + BALL DESIGN,1
17338,563565,LETS GO SHOPPING COTTON TOTE BAG,1
17338,578041,RETROSPOT TEA SET CERAMIC 11 PC,1
17338,540968,CREAM SWEETHEART MINI CHEST,1
17338,550477,FELTCRAFT CUSHION BUTTERFLY,1
17338,550477,WOODEN FRAME ANTIQUE WHITE,1
17338,578041,POPPY'S PLAYHOUSE BEDROOM,1
17338,540968,SMALL HEART MEASURING SPOONS,1
17338,578041,SKETCHBOOK MAGNETIC SHOPPING LIST,1
17338,544586,POPPY'S PLAYHOUSE KITCHEN,1
17338,544586,WOODEN FRAME ANTIQUE WHITE,1
17338,563565,PAINT YOUR OWN CANVAS SET,1
17338,538626,LUNCH BOX I LOVE LONDON,1
17338,544586,RECIPE BOX RETROSPOT,1
17338,563565,RED HEART LUGGAGE TAG,1
17338,563565,RABBIT  DESIGN  COTTON TOTE BAG,1
17338,563565,ZINC HEART LATTICE CHARGER SMALL,1
17338,544586,SET OF 2 ROUND TINS CAMEMBERT,1
17338,540968,ENGLISH ROSE HOT WATER BOTTLE,1
17338,578041,12 COLOURED PARTY BALLOONS,1
17338,578041,PHOTO FRAME CORNICE,1
17338,578041,ALARM CLOCK BAKELIKE PINK,1
17338,538626,RED RETROSPOT CAKE STAND,1
17338,538626,12 PENCIL SMALL TUBE WOODLAND,1
17338,550477,ASSORTED COLOUR T-LIGHT HOLDER,1
17338,538626,FELTCRAFT CHRISTMAS FAIRY,1
17338,544586,LARGE YELLOW BABUSHKA NOTEBOOK,1
17338,558709,WOODEN FRAME ANTIQUE WHITE,1
17338,563565,CREAM CUPID HEARTS COAT HANGER,1
17338,563565,36 FOIL HEART CAKE CASES,1
17338,578041,KNITTED UNION FLAG HOT WATER BOTTLE,1
17338,578041,SET OF 4 ROSE BOTANICAL CANDLES,1
17338,544586,RETROSPOT CHILDRENS APRON,1
17338,550477,COFFEE MUG DOG + BALL DESIGN,1
17338,558709,RED RETROSPOT CAKE STAND,1
17338,553710,POPPY'S PLAYHOUSE BATHROOM,1
17338,538626,GARLAND WITH STARS AND BELLS,1
17338,550477,HANGING CHICK  YELLOW DECORATION,1
17338,578041,SILVER HEARTS TABLE DECORATION,1
17338,540968,CHRISTMAS HANGING HEART WITH BELL,1
17338,544586,METAL SIGN TAKE IT OR LEAVE IT,1
17338,550477,SMALL DECO JEWELLERY STAND,1
17338,563565,3D SHEET OF DOG STICKERS,1
17338,563565,VANILLA SCENT CANDLE JEWELLED BOX,1
17338,578041,SET 12 KIDS COLOUR  CHALK STICKS,1
17338,544586,KNITTED UNION FLAG HOT WATER BOTTLE,1
17338,558709,SET OF 4 KNICK KNACK TINS LONDON,1
17338,558709,SET OF 4 KNICK KNACK TINS DOILEY,1
17338,563565,RED RETROSPOT CAKE STAND,1
17338,563565,MOODY GIRL DOOR HANGER,1
17338,540968,BLACK/BLUE POLKADOT UMBRELLA,1
17338,544586,WHITE HANGING HEART T-LIGHT HOLDER,1
17338,558709,HANGING JAM JAR T-LIGHT HOLDER,1
17338,563565,ROSE FOLKART HEART DECORATIONS,1
17338,578041,SWALLOWS GREETING CARD,1
17338,578041,HEART MINI PORTRAIT FRAME,1
17338,540968,BAKING MOULD HEART WHITE CHOCOLATE,1
17338,544586,IVORY GIANT GARDEN THERMOMETER,1
17338,563565,RED RETROSPOT BOWL,1
17338,544586,WALL TIDY RETROSPOT,1
17338,550477,SPACEBOY LUNCH BOX,1
17338,553710,POPPY'S PLAYHOUSE KITCHEN,1
17338,563565,SET/10 RED POLKADOT PARTY CANDLES,1
17338,544586,DOORMAT SPOTTY HOME SWEET HOME,1
17338,544586,LARGE RED BABUSHKA NOTEBOOK,1
17338,544586,SET OF 6 SOLDIER SKITTLES,1
17338,553710,WHITE HANGING HEART T-LIGHT HOLDER,1
17338,578041,LOVEBIRD HANGING DECORATION WHITE,1
17338,553710,JUNGLE POPSICLES ICE LOLLY MOULDS,1
17338,563565,ASSORTED COLOURS SILK FAN,1
17338,578041,SET/5 RED RETROSPOT LID GLASS BOWLS,1
17338,540968,VICTORIAN SEWING KIT,1
17338,563565,RED FLORAL FELTCRAFT SHOULDER BAG,1
17338,550477,DOORMAT WELCOME TO OUR HOME,1
17338,550477,WHITE SAGE INCENSE,1
17338,563565,WOODEN FRAME ANTIQUE WHITE,1
17338,578041,PACK OF 6 COCKTAIL PARASOL STRAWS,1
17338,540968,MIRRORED DISCO BALL,1
17338,544586,FELTCRAFT PRINCESS LOLA DOLL,1
17338,544586,ROUND SNACK BOXES SET OF 4 FRUITS,1
17338,550477,WATERING CAN BLUE ELEPHANT,1
17338,578041,DOILY THANK YOU CARD,1
17338,578041,ROUND SNACK BOXES SET OF 4 FRUITS,1
17338,550477,PICNIC BASKET WICKER LARGE,1
17338,550477,ALUMINIUM STAMPED HEART,1
17338,550477,EASTER DECORATION SITTING BUNNY,1
17338,553710,WHITE LOVEBIRD LANTERN,1
17338,558709,ZINC T-LIGHT HOLDER STAR LARGE,1
17338,578041,SET 12 RETRO WHITE CHALK STICKS,1
17338,538626,RECIPE BOX RETROSPOT,1
17338,538626,SET OF 2 ROUND TINS CAMEMBERT,1
17338,544586,BEWARE OF THE CAT METAL SIGN,1
17338,563565,ZINC SWEETHEART WIRE LETTER RACK,1
17338,563565,RED RETROSPOT OVEN GLOVE,1
17338,578041,ZINC T-LIGHT HOLDER STARS SMALL,1
17338,578041,SET/3 RED GINGHAM ROSE STORAGE BOX,1
17338,540968,HEART FILIGREE DOVE LARGE,1
17338,544586,PIGGY BANK RETROSPOT,1
17338,550477,JUMBO  BAG BAROQUE BLACK WHITE,1
17338,578041,NOEL WOODEN BLOCK LETTERS,1
17338,538626,GREY HEART HOT WATER BOTTLE,1
17338,544586,MEDIUM MEDINA STAMPED METAL BOWL,1
17338,544586,SET OF 3 NOTEBOOKS IN PARCEL,1
17338,544586,COLOURING PENCILS BROWN TUBE,1
17338,563565,GRAND CHOCOLATECANDLE,1
17338,538626,HOT WATER BOTTLE BABUSHKA,1
17338,540968,GARLAND WITH HEARTS AND BELLS,1
17338,544586,EDWARDIAN PARASOL RED,1
17338,563565,FELTCRAFT 6 FLOWER FRIENDS,1
17338,563565,SET OF 2 TINS JARDIN DE PROVENCE,1
17338,578041,POPPY'S PLAYHOUSE BATHROOM,1
17338,578041,PENCIL CASE LIFE IS BEAUTIFUL,1
17338,550477,LADIES & GENTLEMEN METAL SIGN,1
17338,550477,COLOURING PENCILS BROWN TUBE,1
17338,563565,PICNIC BOXES SET OF 3 RETROSPOT,1
17338,563565,SET OF TEA COFFEE SUGAR TINS PANTRY,1
17338,578041,12 COLOURED PARTY BALLOONS,1
17338,578041,ASSORTED COLOUR T-LIGHT HOLDER,1
17338,538626,IVORY PILLAR CANDLE GOLD FLOCK,1
17338,544586,S/6 WOODEN SKITTLES IN COTTON BAG,1
17338,550477,HAND OVER THE CHOCOLATE   SIGN,1
17338,578041,FELTCRAFT PRINCESS LOLA DOLL,1
17338,578041,RED STAR CARD HOLDER,1
17338,544586,PACK OF 12 COLOURED PENCILS,1
17338,563565,CITRONELLA CANDLE GARDEN POT,1
17338,563565,ZINC HEART LATTICE CHARGER LARGE,1
17338,540968,RED HANGING HEART T-LIGHT HOLDER,1
17338,544586,LOVEBIRD HANGING DECORATION WHITE,1
17338,553710,FELTCRAFT DOLL EMILY,1
17338,540968,PHOTO FRAME CORNICE,1
17338,544586,SET OF 3 NOTEBOOKS IN PARCEL,1
17338,550477,COFFEE MUG CAT + BIRD DESIGN,1
17338,563565,SET 12 KIDS COLOUR  CHALK STICKS,1
17338,578041,POPPY'S PLAYHOUSE KITCHEN,1
17338,578041,ALARM CLOCK BAKELIKE GREEN,1
17338,550477,FELTCRAFT PRINCESS CHARLOTTE DOLL,1
17338,553710,POPPY'S PLAYHOUSE BEDROOM,1
17338,563565,BOHEMIAN COLLAGE STATIONERY SET,1
17338,578041,SET OF 4 KNICK KNACK TINS LONDON,1
17338,578041,HAND WARMER RED LOVE HEART,1
17338,540968,HEART CALCULATOR,1
17338,540968,SET OF 72 PINK HEART PAPER DOILIES,1
17338,550477,LOVEBIRD HANGING DECORATION WHITE,1
17338,538626,KNITTED UNION FLAG HOT WATER BOTTLE,1
17338,544586,SAVE THE PLANET COTTON TOTE BAG,1
17338,558709,EDWARDIAN PARASOL NATURAL,1
17338,558709,RETROSPOT RED WASHING UP GLOVES,1
17338,578041,TEA BAG PLATE RED RETROSPOT,1
17338,544586,DINOSAURS  WRITING SET,1
17338,578041,WHITE HANGING HEART T-LIGHT HOLDER,1
17338,558709,SET/10 PINK POLKADOT PARTY CANDLES,1
17338,558709,LONDON BUS COFFEE MUG,1
17338,563565,SET OF 6 SOLDIER SKITTLES,1
17338,563565,PINK CREAM FELT CRAFT TRINKET BOX,1
17338,563565,QUEEN OF SKIES LUGGAGE TAG,1
17338,578041,HOT WATER BOTTLE TEA AND SYMPATHY,1
17338,538626,GARLAND WITH HEARTS AND BELLS,1
17338,544586,POPPY'S PLAYHOUSE BEDROOM,1
17338,544586,FRENCH ENAMEL CANDLEHOLDER,1
17338,563565,OCEAN SCENT CANDLE IN JEWELLED BOX,1
17338,563565,KINGS CHOICE TEA CADDY,1
17338,550477,IVORY PAPER CUP CAKE CASES,1
17338,550477,ROUND SNACK BOXES SET OF 4 FRUITS,1
17338,563565,WATERING CAN BLUE ELEPHANT,1
17338,558709,ASSORTED CIRCULAR MOBILE,1
17338,563565,POPPY'S PLAYHOUSE LIVINGROOM,1
17338,578041,LAUREL HEART ANTIQUE SILVER,1
17338,550477,S/4 PINK FLOWER CANDLES IN BOWL,1
17338,550477,NATURAL SLATE HEART CHALKBOARD,1
17338,563565,BEWARE OF THE CAT METAL SIGN,1
17338,540968,PORCELAIN BUTTERFLY OIL BURNER,1
17338,544586,GINGERBREAD MAN COOKIE CUTTER,1
17338,558709,SET/5 RED RETROSPOT LID GLASS BOWLS,1
17338,563565,PICNIC BASKET WICKER LARGE,1
17338,540968,WHITE HANGING HEART T-LIGHT HOLDER,1
17338,544586,CHRYSANTHEMUM NOTEBOOK,1
17338,558709,BALLOON WATER BOMB PACK OF 35,1
17338,558709,PINK EASTER HENS+FLOWER,1
17338,563565,SET/20 RED RETROSPOT PAPER NAPKINS,1
17338,578041,ENGLISH ROSE NOTEBOOK A7 SIZE,1
17338,540968,HAND OVER THE CHOCOLATE   SIGN,1
17338,544586,POPPY'S PLAYHOUSE BATHROOM,1
17338,578041,SET/6 PURPLE BUTTERFLY T-LIGHTS,1
17338,544586,METAL 4 HOOK HANGER FRENCH CHATEAU,1
17338,550477,RETROSPOT CHILDRENS APRON,1
17338,558709,SET/3 OCEAN SCENT CANDLE JEWEL BOX,1
17338,563565,DOLLY GIRL LUNCH BOX,1
17338,578041,SET/6 TURQUOISE BUTTERFLY T-LIGHTS,1
17338,544586,ROUND SNACK BOXES SET OF4 WOODLAND,1
17338,550477,METAL SIGN TAKE IT OR LEAVE IT,1
17338,553710,RETROSPOT TEA SET CERAMIC 11 PC,1
17338,553710,COFFEE MUG CAT + BIRD DESIGN,1
17338,558709,RED RETROSPOT LUGGAGE TAG,1
17338,558709,SET OF 4 KNICK KNACK TINS POPPIES,1
17338,540968,BEADED CRYSTAL HEART PINK SMALL,1
17338,550477,WOODEN PICTURE FRAME WHITE FINISH,1
17338,563565,POPPY'S PLAYHOUSE KITCHEN,1
17338,563565,HEART T-LIGHT HOLDER WILLIE WINKIE,1
17338,578041,GINGERBREAD MAN COOKIE CUTTER,1
17338,578041,ALARM CLOCK BAKELIKE RED,1
17338,578041,60 CAKE CASES VINTAGE CHRISTMAS,1
17338,544586,COOK WITH WINE METAL SIGN,1
17338,550477,GLASS JAR DAISY FRESH COTTON WOOL,1
17338,578041,PACK OF 6 COCKTAIL PARASOL STRAWS,1
17338,538626,PINK FAIRY CAKE CHILDRENS APRON,1
17338,544586,PHOTO FRAME CORNICE,1
17338,544586,CREAM CUPID HEARTS COAT HANGER,1
17338,544586,SET OF 6 HERB TINS SKETCHBOOK,1
17338,558709,12 COLOURED PARTY BALLOONS,1
17338,558709,QUEENS GUARD COFFEE MUG,1
17338,578041,HAND WARMER UNION JACK,1
17338,538626,VINTAGE SEASIDE JIGSAW PUZZLES,1
17338,558709,ZINC METAL HEART DECORATION,1
17525,538994,CHOCOLATE HOT WATER BOTTLE,2
17525,538994,DOORMAT ENGLISH ROSE,2
17525,538994,DOORMAT WELCOME TO OUR HOME,2
17525,538994,DOORMAT NEW ENGLAND,2
17525,538994,HOT WATER BOTTLE I AM SO POORLY,2
17525,538994,DOORMAT UNION FLAG,2
17525,538994,SCOTTIE DOG HOT WATER BOTTLE,2
17525,538994,HOT WATER BOTTLE BABUSHKA,2
17525,538994,KNITTED UNION FLAG HOT WATER BOTTLE,2
17526,544603,3 PIECE SPACEBOY COOKIE CUTTER SET,0
17526,538010,4 PEAR BOTANICAL DINNER CANDLES,0
17526,580598,WRAP CHRISTMAS VILLAGE,0
17526,580598,SET/10 PINK POLKADOT PARTY CANDLES,0
17526,580598,PACK OF 6 PANETTONE GIFT BOXES,0
17526,580598,TEA PARTY  WRAPPING PAPER,0
17526,538721,WHITE LOVEBIRD LANTERN,0
17526,544603,CAKE STAND 3 TIER MAGIC GARDEN,0
17526,580598,ANTIQUE SILVER BAUBLE LAMP,0
17526,544603,CAKE STAND WHITE TWO TIER LACE,0
17526,538010,WHITE METAL LANTERN,0
17526,580598,DOLLY CABINET 3 DRAWERS,0
17526,544603,SWEETHEART CAKESTAND 3 TIER,0
17526,538010,4 LAVENDER BOTANICAL DINNER CANDLES,0
17526,538010,BAKING MOULD EASTER EGG MILK CHOC,0
17526,538010,CAKE STAND 3 TIER MAGIC GARDEN,0
17526,580598,15CM CHRISTMAS GLASS BALL 20 LIGHTS,0
17526,580598,VICTORIAN GLASS HANGING T-LIGHT,0
17526,580598,3 PIECE SPACEBOY COOKIE CUTTER SET,0
17615,553917,VICTORIAN GLASS HANGING T-LIGHT,0
17615,551535,PAPER BUNTING WHITE LACE,0
17615,553917,LANTERN CREAM GAZEBO,0
17615,553917,SMALL GLASS HEART TRINKET POT,0
17615,553917,SWEETHEART CAKESTAND 3 TIER,0
17615,551535,VINTAGE CREAM 3 BASKET CAKE STAND,0
17615,551535,NATURAL SLATE CHALKBOARD LARGE,0
17615,562015,ZINC METAL HEART DECORATION,0
17615,551535,SMALL GLASS HEART TRINKET POT,0
17615,562015,SET 6 PAPER TABLE LANTERN HEARTS,0
17615,562015,SLATE TILE NATURAL HANGING,0
17615,551535,WATERING CAN GARDEN MARKER,0
17615,553917,DOORMAT WELCOME TO OUR HOME,0
17615,553917,MIRROR MOSAIC T-LIGHT HOLDER,0
17793,576274,WOODEN ADVENT CALENDAR CREAM,0
17793,576274,CHRYSANTHEMUM SKETCHBOOK,0
17793,576274,FLOWER FAIRY 5 DRAWER LINERS,0
17793,576274,UNION JACK FLAG PASSPORT COVER,0
17793,576274,FELTCRAFT GIRL NICOLE KIT,0
17793,576274,FELTCRAFT PRINCESS OLIVIA DOLL,0
17793,576274,POLKA DOT RAFFIA FOOD COVER,0
17793,576274,PEARLISED IVORY HEART LARGE,0
17793,576274,SET 36 COLOURING PENCILS DOILY,0
17793,576274,UNION JACK FLAG LUGGAGE TAG,0
17793,576274,PLASTERS IN TIN SKULLS,0
17793,576274,WHITE HANGING HEART T-LIGHT HOLDER,0
17793,576274,REGENCY CAKESTAND 3 TIER,0
17793,576274,DOG TOY WITH PINK CROCHET SKIRT,0
17793,576274,RATTLE SNAKE EGGS,0
17793,576274,DELUXE SEWING KIT,0
17793,576274,BUBBLEGUM RING ASSORTED,0
17793,576274,BUBBLEGUM RING ASSORTED,0
17793,576274,GROW YOUR OWN FLOWERS SET OF 3,0
17793,576274,REX CASH+CARRY JUMBO SHOPPER,0
17793,576274,JINGLE BELL HEART DECORATION,0
17793,576274,CREAM SWEETHEART MINI CHEST,0
17793,576274,DOORMAT NEW ENGLAND,0
17793,576274,36 PENCILS TUBE SKULLS,0
17793,576274,MINI PLAYING CARDS SPACEBOY,0
17793,576274,FELTCRAFT GIRL AMELIE KIT,0
17793,576274,PLASTERS IN TIN VINTAGE PAISLEY,0
17793,576274,BROCADE RING PURSE,0
17793,576274,PINK UNION JACK  PASSPORT COVER,0
17793,576274,PINK BLUE FELT CRAFT TRINKET BOX,0
17793,576274,WATERING CAN GARDEN MARKER,0
17793,576274,SET/3 OCEAN SCENT CANDLE JEWEL BOX,0
17793,576274,3 HEARTS HANGING DECORATION RUSTIC,0
17793,576274,BOX OF 6 MINI VINTAGE CRACKERS,0
17793,576274,PINK UNION JACK  LUGGAGE TAG,0
17793,576274,FELTCRAFT CUSHION OWL,0
17793,576274,SET 36 COLOURING PENCILS DOILY,0
