17416,545530,FELTCRAFT BUTTERFLY HEARTS,1
17416,553919,RED/CREAM STRIPE CUSHION COVER,1
17416,545530,JUMBO BAG CHARLIE AND LOLA TOYS,1
17416,545530,36 PENCILS TUBE WOODLAND,1
17416,545530,WRAP PINK FAIRY CAKES,1
17416,567975,HOT WATER BOTTLE KEEP CALM,1
17416,567975,PINK BLUE FELT CRAFT TRINKET BOX,1
17416,575612,HAND WARMER SCOTTY DOG DESIGN,1
17416,553919,LUNCH BAG RED RETROSPOT,1
17416,545530,BLUE/CREAM STRIPE CUSHION COVER,1
17416,545530,WRAP COWBOYS,1
17416,545530,FELTCRAFT CUSHION RABBIT,1
17416,545530,PINK CREAM FELT CRAFT TRINKET BOX,1
17416,553919,FUNKY MONKEY CUSHION COVER,1
17416,567975,PINK CREAM FELT CRAFT TRINKET BOX,1
17416,545530,FELT FARM ANIMAL RABBIT,1
17416,545530,DOORMAT UNION FLAG,1
17416,553919,LUNCH BAG SUKI DESIGN,1
17416,567975,RED SPOT CERAMIC DRAWER KNOB,1
17416,545530,FELTCRAFT 6 FLOWER FRIENDS,1
17416,557119,SUKI  SHOULDER BAG,1
17416,567975,FELTCRAFT CUSHION BUTTERFLY,1
17416,575612,RETROSPOT HEART HOT WATER BOTTLE,1
17416,557119,WHITE SPOT BLUE CERAMIC DRAWER KNOB,1
17416,575612,RED WOOLLY HOTTIE WHITE HEART.,1
17416,563940,RED POLKADOT BEAKER,1
17416,567975,RED STRIPE CERAMIC DRAWER KNOB,1
17416,567975,SPACEBOY MINI BACKPACK,1
17416,545530,RED FLORAL FELTCRAFT SHOULDER BAG,1
17416,545530,BLUE SPOT CERAMIC DRAWER KNOB,1
17416,575612,HOT WATER BOTTLE KEEP CALM,1
17416,563940,JUMBO BAG 50'S CHRISTMAS,1
17416,575612,HAND WARMER OWL DESIGN,1
17416,563940,UNION STRIPE WITH FRINGE  HAMMOCK,1
17416,563940,LUNCH BAG WOODLAND,1
17416,575612,BLUE STRIPE CERAMIC DRAWER KNOB,1
17416,553919,FRENCH FLORAL CUSHION COVER,1
17416,545530,FELTCRAFT CUSHION OWL,1
17416,563940,EMPIRE TISSUE BOX,1
17416,563940,LUNCH BAG SPACEBOY DESIGN,1
17416,567975,WOODLAND MINI BACKPACK,1
17416,553919,PINK BLUE FELT CRAFT TRINKET BOX,1
17416,563940,MOTORING TISSUE BOX,1
17416,563940,CHARLIE AND LOLA FIGURES TINS,1
17416,575612,DRAWER KNOB CERAMIC RED,1
17416,545530,FELTCRAFT PRINCESS OLIVIA DOLL,1
17416,563940,LUNCH BAG  BLACK SKULL.,1
17416,545530,WRAP DOILEY DESIGN,1
17416,567975,FELTCRAFT BUTTERFLY HEARTS,1
17416,575612,CHARLOTTE BAG DOLLY GIRL DESIGN,1
17416,553919,SUNSET CHECK HAMMOCK,1
17416,563940,SUNSET CHECK HAMMOCK,1
17416,563940,SQUARE CHERRY BLOSSOM CABINET,1
17416,575612,WHITE SPOT BLUE CERAMIC DRAWER KNOB,1
17416,575612,FELTCRAFT DOLL MOLLY,1
17416,545530,DAIRY MAID TRADITIONAL TEAPOT,1
17416,557119,SET OF 9 BLACK SKULL BALLOONS,1
17416,563940,LUNCH BAG CARS BLUE,1
17416,545530,COLOURING PENCILS BROWN TUBE,1
17416,567975,FELTCRAFT DOLL MOLLY,1
17416,553919,UNION STRIPE WITH FRINGE  HAMMOCK,1
17416,575612,WOODLAND CHARLOTTE BAG,1
17416,545530,SKULLS AND CROSSBONES WRAP,1
17416,563940,JUMBO BAG SPACEBOY DESIGN,1
17416,553919,LUNCH BAG PINK POLKADOT,1
17416,545530,EASTER TIN CHICKS PINK DAISY,1
17416,563940,FRENCH LATTICE CUSHION COVER,1
17416,545530,JUMBO BAG RED RETROSPOT,1
17416,545530,JUMBO STORAGE BAG SUKI,1
17416,545530,SPACEBOY GIFT WRAP,1
17416,563940,LUNCH BAG VINTAGE DOILY,1
17416,567975,FELTCRAFT CUSHION OWL,1
17416,545530,CHARLOTTE BAG SUKI DESIGN,1
17416,545530,WRAP SUKI AND FRIENDS,1
17416,545530,FELTCRAFT DOLL EMILY,1
17416,545530,ICE CREAM DESIGN GARDEN PARASOL,1
17416,545530,PINK BLUE FELT CRAFT TRINKET BOX,1
17416,545530,WRAP POPPIES  DESIGN,1
17416,545530,BLACK/BLUE POLKADOT UMBRELLA,1
17416,545530,STRAWBERRY CERAMIC TRINKET BOX,1
17416,575612,PINK BLUE FELT CRAFT TRINKET BOX,1
17416,575612,LOVE HOT WATER BOTTLE,1
17416,575612,DRAWER KNOB CERAMIC IVORY,1
17416,557119,DRAWER KNOB VINTAGE GLASS STAR,1
17416,545530,EASTER CRAFT 4 CHICKS,1
17416,545530,DOORMAT TOPIARY,1
17416,575612,RED RETROSPOT TISSUE BOX,1
17416,545530,FELTCRAFT PRINCESS CHARLOTTE DOLL,1
17416,563940,LUNCH BAG RED RETROSPOT,1
17416,567975,LOVE HOT WATER BOTTLE,1
17416,557119,MEMO BOARD RETROSPOT  DESIGN,1
17416,553919,LUNCH BAG CARS BLUE,1
17416,567975,FELTCRAFT PRINCESS OLIVIA DOLL,1
17416,545530,JUMBO STORAGE BAG SKULLS,1
17416,557119,RED STRIPE CERAMIC DRAWER KNOB,1
17416,563940,CHARLOTTE BAG SUKI DESIGN,1
17416,545530,JUMBO BAG PINK POLKADOT,1
17416,545530,WHITE CANDYSTUFT ARTIFICIAL FLOWER,1
17416,575612,MOTORING TISSUE BOX,1
17416,575612,SCOTTIE DOG HOT WATER BOTTLE,1
17416,567975,VINTAGE UNION JACK BUNTING,1
17416,575612,LUNCH BAG PAISLEY PARK,1
17416,545530,JUMBO  BAG BAROQUE BLACK WHITE,1
17416,545530,FELTCRAFT BOY JEAN-PAUL KIT,1
17416,545530,WRAP MONSTER FUN,1
17416,575612,PSYCHEDELIC TILE HOOK,1
17416,575612,PURPLE DRAWERKNOB ACRYLIC EDWARDIAN,1
17416,575612,FELTCRAFT DOLL ROSIE,1
17416,567975,DRAWER KNOB CERAMIC RED,1
17416,545530,FAIRY CAKE BIRTHDAY CANDLE SET,1
17416,545530,GREY FLORAL FELTCRAFT SHOULDER BAG,1
17416,567975,FELTCRAFT DOLL ROSIE,1
17416,545530,"WRAP, CAROUSEL",1
17416,545530,FELTCRAFT PRINCESS LOLA DOLL,1
17416,563940,CHARLIE & LOLA WASTEPAPER BIN FLORA,1
17416,545530,DOORMAT RED RETROSPOT,1
17416,545530,FELTCRAFT DOLL MOLLY,1
17416,575612,ENGLISH ROSE HOT WATER BOTTLE,1
17416,545530,FELT TOADSTOOL LARGE,1
17416,545530,JUMBO BAG TOYS,1
17416,567975,FELTCRAFT PRINCESS CHARLOTTE DOLL,1
17416,575612,CHRISTMAS PUDDING TRINKET POT,1
17416,545530,HANGING JAM JAR T-LIGHT HOLDER,1
17416,545530,JUMBO BAG PINK VINTAGE PAISLEY,1
17416,567975,BLUE STRIPE CERAMIC DRAWER KNOB,1
17416,575612,JUMBO BAG SPACEBOY DESIGN,1
17416,553919,FELTCRAFT BUTTERFLY HEARTS,1
17416,575612,FELTCRAFT DOLL EMILY,1
17416,545530,EMPIRE GIFT WRAP,1
17416,554834,CHARLIE AND LOLA FIGURES TINS,1
17416,545530,MEMO BOARD RETROSPOT  DESIGN,1
17416,567975,FELTCRAFT DOLL EMILY,1
17416,575612,RED STRIPE CERAMIC DRAWER KNOB,1
17416,563940,JUMBO BAG RED RETROSPOT,1
17416,575612,HAND WARMER RED RETROSPOT,1
17416,545530,JUMBO BAG DOLLY GIRL DESIGN,1
17416,553919,LUNCH BAG WOODLAND,1
17416,557119,MEMO BOARD COTTAGE DESIGN,1
17416,567975,WHITE SPOT BLUE CERAMIC DRAWER KNOB,1
17416,575612,RED RETROSPOT CHARLOTTE BAG,1
17416,575612,GREY HEART HOT WATER BOTTLE,1
17416,575612,CHARLOTTE BAG SUKI DESIGN,1
17416,575612,RED FLORAL FELTCRAFT SHOULDER BAG,1
17416,553919,PARTY BUNTING,1
17416,545530,POPART WOODEN PENCILS ASST,1
17416,567975,BLUE SPOT CERAMIC DRAWER KNOB,1
17416,545530,UNION STRIPE WITH FRINGE  HAMMOCK,1
17416,553919,MULTICOLOUR SPRING FLOWER MUG,1
17416,563940,CHARLOTTE BAG VINTAGE ALPHABET,1
17416,557119,DRAWER KNOB CRACKLE GLAZE BLUE,1
17416,545530,FELTCRAFT GIRL AMELIE KIT,1
17416,575612,JUMBO BAG TOYS,1
17416,545530,FELT FARM ANIMAL HEN,1
17416,545530,WHITE SPOT RED CERAMIC DRAWER KNOB,1
17416,557119,DRAWER KNOB CERAMIC IVORY,1
17416,563940,JUMBO BAG PINK VINTAGE PAISLEY,1
17416,575612,CHARLOTTE BAG PINK POLKADOT,1
17416,545530,DOLLY MIXTURE CHILDREN'S UMBRELLA,1
17416,557119,JUMBO BAG DOILEY PATTERNS,1
17416,563940,LUNCH BAG SUKI DESIGN,1
17416,563940,JUMBO BAG VINTAGE CHRISTMAS,1
17416,545530,VINTAGE UNION JACK MEMOBOARD,1
17416,563940,JUMBO BAG TOYS,1
17416,575612,WHITE SKULL HOT WATER BOTTLE,1
17416,563940,JUMBO  BAG BAROQUE BLACK WHITE,1
17416,567975,WHITE SPOT RED CERAMIC DRAWER KNOB,1
17416,553919,LOVE HEART TRINKET POT,1
17416,563940,JUMBO BAG ALPHABET,1
17416,553919,CLASSIC FRENCH STYLE BASKET GREEN,1
17416,557119,PACK OF 72 SKULL CAKE CASES,1
17416,575612,RED DRAWER KNOB ACRYLIC EDWARDIAN,1
17416,575612,HAND WARMER BIRD DESIGN,1
17856,581221,LARGE HANGING IVORY & RED WOOD BIRD,0
17856,545505,ANTIQUE SILVER TEA GLASS ENGRAVED,0
17856,547045,ANTIQUE TALL SWIRLGLASS TRINKET POT,0
17856,550772,SMALL GLASS SUNDAE DISH CLEAR,0
17856,547045,GLASS CHALICE GREEN  LARGE,0
17856,581221,Next Day Carriage,0
17856,550772,ANTIQUE TALL SWIRLGLASS TRINKET POT,0
17856,545505,GLASS CHALICE GREEN  LARGE,0
17856,581221,HEART WREATH DECORATION WITH BELL,0
17856,545505,TWO DOOR CURIO CABINET,0
17856,581221,STAR WREATH DECORATION WITH BELL,0
17856,545505,ANTIQUE TALL SWIRLGLASS TRINKET POT,0
17856,581221,ROCKING HORSE RED CHRISTMAS,0
17856,581221,RED ROCKING HORSE HAND PAINTED,0
17856,545505,SET 3 PAPER VINTAGE CHICK PAPER EGG,0
17861,580982,I LOVE LONDON BABY GIFT SET,1
17861,561378,SET OF 6 SNACK LOAF BAKING CASES,1
17861,548510,ENAMEL BREAD BIN CREAM,1
17861,548510,QUEENS GUARD COFFEE MUG,1
17861,559133,FOLDING BUTTERFLY MIRROR HOT PINK,1
17861,559133,TREASURE TIN BUFFALO BILL,1
17861,580982,QUEEN OF THE SKIES PASSPORT COVER,1
17861,580982,DAIRY MAID LARGE MILK JUG,1
17861,559133,VINTAGE SNAP CARDS,1
17861,559133,WRAP I LOVE LONDON,1
17861,580982,SWEETHEART CERAMIC TRINKET BOX,1
17861,559133,PACK OF 6 SKULL PAPER CUPS,1
17861,576555,LUNCH BOX I LOVE LONDON,1
17861,580982,SPACEBOY BABY GIFT SET,1
17861,559133,PARTY CHARMS 50 PIECES,1
17861,559133,WOODEN SKITTLES GARDEN SET,1
17861,561378,CAKE PLATE LOVEBIRD WHITE,1
17861,580982,RABBIT NIGHT LIGHT,1
17861,541916,PINK 3 PIECE POLKADOT CUTLERY SET,1
17861,559133,LUNCH BAG SPACEBOY DESIGN,1
17861,559133,CHILDS GARDEN FORK BLUE,1
17861,559133,SPACEBOY BABY GIFT SET,1
17861,580982,CHRISTMAS RETROSPOT ANGEL WOOD,1
17861,559133,I LOVE LONDON BABY GIFT SET,1
17861,559133,SWEETHEART CAKESTAND 3 TIER,1
17861,580982,WALL ART TREASURE AHOY,1
17861,559133,WATERING CAN PINK BUNNY,1
17861,559133,SET OF 5 MINI GROCERY MAGNETS,1
17861,548510,RETROSPOT PARTY BAG + STICKER SET,1
17861,559133,CHILDRENS CUTLERY DOLLY GIRL,1
17861,548510,WRAP I LOVE LONDON,1
17861,548510,RED RETROSPOT MINI CASES,1
17861,559133,FLYING PIG WATERING CAN,1
17861,580982,ROLL WRAP VINTAGE SPOT,1
17861,559133,BAKING SET SPACEBOY DESIGN,1
17861,580982,ROBOT BIRTHDAY CARD,1
17861,548510,RETROSPOT TEA SET CERAMIC 11 PC,1
17861,580982,CLOTHES PEGS RETROSPOT PACK 24,1
17861,559133,TRADITIONAL KNITTING NANCY,1
17861,559133,BAG 125g SWIRLY MARBLES,1
17861,580982,GIANT 50'S CHRISTMAS CRACKER,1
17861,559133,ICE CREAM PEN LIP GLOSS,1
17861,580982,GLITTER CHRISTMAS STAR,1
17861,580982,BOX OF 6 MINI 50'S CRACKERS,1
17861,575611,WRAP VINTAGE LEAF DESIGN,1
17861,559133,LUNCH BAG DOILEY PATTERN,1
17861,559133,SET/20 STRAWBERRY PAPER NAPKINS,1
17861,559133,4 TRADITIONAL SPINNING TOPS,1
17861,576555,EGG CUP MILKMAID HELGA,1
17861,548510,FELTCRAFT PRINCESS CHARLOTTE DOLL,1
17861,559133,COWBOYS AND INDIANS BIRTHDAY CARD,1
17861,559133,RABBIT NIGHT LIGHT,1
17861,559133,BAKING SET 9 PIECE RETROSPOT,1
17861,575611,MAGIC TREE -PAPER FLOWERS,1
17861,580982,SPACEBOY ROCKET LOLLY MAKERS,1
17861,559133,SET/10 RED POLKADOT PARTY CANDLES,1
17861,580982,LUNCH BAG  BLACK SKULL.,1
17861,548510,SKULLS AND CROSSBONES WRAP,1
17861,559133,GIRLS VINTAGE TIN SEASIDE BUCKET,1
17861,541916,CHILDS BREAKFAST SET SPACEBOY,1
17861,559133,WRAP CIRCUS PARADE,1
17861,575611,WRAP I LOVE LONDON,1
17861,559133,BALLOON PUMP WITH 10 BALLOONS,1
17861,548510,STRAWBERRY RAFFIA FOOD COVER,1
17861,559133,QUEENS GUARD COFFEE MUG,1
17861,559133,WOODEN ROUNDERS GARDEN SET,1
17861,580982,RED METAL BOX TOP SECRET,1
17861,561378,LUNCH BOX I LOVE LONDON,1
17861,559133,MAGIC TREE -PAPER FLOWERS,1
17861,559133,SMALL SKULL WINDMILL,1
17861,580982,WHITE ROCKING HORSE HAND PAINTED,1
17861,559133,DOUGHNUT LIP GLOSS,1
17861,559133,GROW A FLYTRAP OR SUNFLOWER IN TIN,1
17861,559133,SET OF 9 HEART SHAPED BALLOONS,1
17861,548510,FANCY FONTS BIRTHDAY WRAP,1
17861,561378,CHILDRENS APRON APPLES DESIGN,1
17861,561378,SET OF 6 TEA TIME BAKING CASES,1
17861,580982,VINTAGE HEADS AND TAILS CARD GAME,1
17861,559133,LUNCH BAG RED RETROSPOT,1
17861,580982,KEY RING BASEBALL BOOT UNION JACK,1
17861,559133,WORLD WAR 2 GLIDERS ASSTD DESIGNS,1
17861,575611,RED RETROSPOT WRAP,1
17861,559133,TOADSTOOL BEDSIDE LIGHT,1
17861,575611,WRAP ALPHABET DESIGN,1
17861,580982,GLITTER BUTTERFLY CLIPS,1
17861,580982,SKULLS GREETING CARD,1
17861,580982,CLASSIC CHROME BICYCLE BELL,1
17861,559133,CIRCUS PARADE BABY GIFT SET,1
17861,559133,SET/10 BLUE POLKADOT PARTY CANDLES,1
17861,580982,ICE CREAM BUBBLES,1
17861,575611,EMPIRE GIFT WRAP,1
17861,580982,RED SPOT GIFT BAG LARGE,1
17861,576555,EGG CUP HENRIETTA HEN CREAM,1
17861,580982,PAPER BUNTING RETROSPOT,1
17861,548510,PACK OF 6 SKULL PAPER PLATES,1
17861,559133,BROCADE RING PURSE,1
17861,548510,LUNCH BAG RED RETROSPOT,1
17861,559133,VINTAGE RED ENAMEL TRIM JUG,1
17861,575611,WRAP PAISLEY PARK,1
17861,541916,CAKE PLATE LOVEBIRD WHITE,1
17861,548510,LUNCH BAG  BLACK SKULL.,1
17861,580982,BLUE HARMONICA IN BOX,1
17861,580982,CHARLOTTE BAG VINTAGE ALPHABET,1
17861,548510,SKULLS PARTY BAG + STICKER SET,1
17861,559133,GLITTER HANGING BUTTERFLY STRING,1
17861,576555,EGG CUP MILKMAID HEIDI,1
17861,559133,PACK OF 6 COCKTAIL PARASOL STRAWS,1
17861,559133,SKULLS PARTY BAG + STICKER SET,1
17861,580982,COWBOYS AND INDIANS BIRTHDAY CARD,1
17861,580982,DOILY THANK YOU CARD,1
17861,541916,BLUE 3 PIECE POLKADOT CUTLERY SET,1
17861,580982,VINTAGE RED TRIM ENAMEL BOWL,1
17861,576555,RETRO PLASTIC 70'S TRAY,1
17861,576555,SET OF 12 FAIRY CAKE BAKING CASES,1
17861,559133,CARD I LOVE LONDON,1
17861,559133,STRAWBERRY CERAMIC TRINKET BOX,1
17861,580982,TV DINNER TRAY AIR HOSTESS,1
17861,576555,CAKE PLATE LOVEBIRD WHITE,1
17861,548510,HEART SHAPE WIRELESS DOORBELL,1
17861,559133,GLITTER BUTTERFLY CLIPS,1
17861,548510,WHITE BAMBOO RIBS LAMPSHADE,1
17861,559133,SET OF 5 PANCAKE DAY MAGNETS,1
17861,548510,PACK OF 12 LONDON TISSUES,1
17861,559133,SET/20 RED RETROSPOT PAPER NAPKINS,1
17861,548510,WORLD WAR 2 GLIDERS ASSTD DESIGNS,1
17861,559133,SET OF 6 SOLDIER SKITTLES,1
17861,580982,KEY RING BASEBALL BOOT ASSORTED,1
17861,559133,WATERING CAN GREEN DINOSAUR,1
17861,559133,WOODEN BOX OF DOMINOES,1
17861,580982,REVOLVER WOODEN RULER,1
17861,559133,PACK OF 6 SMALL FRUIT STRAWS,1
17861,541916,CARD I LOVE LONDON,1
17861,580982,WALL ART HORSE & PONY,1
17861,580982,ELEPHANT BIRTHDAY CARD,1
17861,576555,EGG CUP MILKMAID INGRID,1
17861,548510,RED  HARMONICA IN BOX,1
17861,559133,NOVELTY BISCUITS CAKE STAND 3 TIER,1
17861,548510,BAKING SET 9 PIECE RETROSPOT,1
17861,559133,COCKTAIL SWORDS 50 PIECES,1
17861,559133,TREASURE TIN GYMKHANA DESIGN,1
17861,559133,WRAP GINGHAM ROSE,1
17861,559133,SKULLS AND CROSSBONES WRAP,1
17861,580982,GIRAFFE WOODEN RULER,1
17861,541916,SET OF 3 HEART COOKIE CUTTERS,1
17861,548510,EASTER CRAFT 4 CHICKS,1
17861,559133,CHILDRENS CUTLERY SPACEBOY,1
17861,548510,PACK OF 6 SKULL PAPER CUPS,1
17861,559133,SET/6 RED SPOTTY PAPER CUPS,1
17861,559133,SET/6 RED SPOTTY PAPER PLATES,1
17861,580982,GLITTER HEART DECORATION,1
17861,548510,SET/20 RED RETROSPOT PAPER NAPKINS,1
17861,576555,SET OF 6 SNACK LOAF BAKING CASES,1
17861,559133,CHILDRENS CUTLERY CIRCUS PARADE,1
17861,559133,"ELEPHANT, BIRTHDAY CARD,",1
17861,580982,WRAP ALPHABET DESIGN,1
17861,559133,TOADSTOOL BEDSIDE LIGHT,1
17861,576555,SET OF 6 TEA TIME BAKING CASES,1
17861,575611,WRAP ALPHABET POSTER,1
17861,580982,MAGIC DRAWING SLATE PURDEY,1
17861,580982,WRAP 50'S  CHRISTMAS,1
17861,559133,BOX OF VINTAGE ALPHABET BLOCKS,1
17861,548510,SET OF 20 KIDS COOKIE CUTTERS,1
17861,548510,SPACEBOY BIRTHDAY CARD,1
17861,559133,PACK OF 20 SKULL PAPER NAPKINS,1
17861,541916,CHILDS BREAKFAST SET CIRCUS PARADE,1
17861,559137,SET/6 RED SPOTTY PAPER CUPS,1
17861,576555,SOLDIERS EGG CUP,1
17861,580982,WRAP KEEP CALM BIRTHDAY,1
17861,559133,SET/10 PINK POLKADOT PARTY CANDLES,1
17861,559133,RED METAL BEACH SPADE,1
17861,580982,SPACEBOY BIRTHDAY CARD,1
17861,548510,LOVE HEART TRINKET POT,1
17861,580982,LUNCH BAG SPACEBOY DESIGN,1
17861,548510,COWBOYS AND INDIANS BIRTHDAY CARD,1
17861,559133,FOLDING BUTTERFLY MIRROR RED,1
17861,559133,SET OF 4 KNICK KNACK TINS LONDON,1
17861,580982,BROCADE RING PURSE,1
17861,580982,CHRISTMAS LIGHTS 10 REINDEER,1
17861,580982,VINTAGE CHRISTMAS STOCKING,1
17861,548510,PAPER BUNTING RETROSPOT,1
17861,559133,ICE CREAM SUNDAE LIP GLOSS,1
17861,559133,VINTAGE DONKEY TAIL GAME,1
17861,580982,CHRISTMAS CRAFT TREE TOP ANGEL,1
17861,548510,LUNCH BAG SPACEBOY DESIGN,1
17861,559133,WOODEN CROQUET GARDEN SET,1
17861,559133,FANCY FONTS BIRTHDAY WRAP,1
17861,561378,SET OF 12 MINI LOAF BAKING CASES,1
17861,576555,SET OF 12 MINI LOAF BAKING CASES,1
17861,575611,FANCY FONTS BIRTHDAY WRAP,1
17861,559133,PINK PARTY BAGS,1
17861,559133,PACK OF 6 SKULL PAPER PLATES,1
17861,580982,VINTAGE RED ENAMEL TRIM PLATE,1
17861,580982,STRAWBERRY CHARLOTTE BAG,1
17861,561378,SET OF 12 FAIRY CAKE BAKING CASES,1
17861,548510,SET/6 RED SPOTTY PAPER PLATES,1
17861,548510,SET 3 PAPER VINTAGE CHICK PAPER EGG,1
17861,559133,WATERING CAN BLUE ELEPHANT,1
17861,548510,PACK OF 20 SKULL PAPER NAPKINS,1
17861,561378,RETRO MOD TRAY,1
17861,576555,RETRO PLASTIC POLKA TRAY,1
17861,559133,PINK CREAM FELT CRAFT TRINKET BOX,1
17861,559133,TOYBOX  WRAP,1
17861,559133,SMALL RED RETROSPOT WINDMILL,1
17861,575611,SKULLS AND CROSSBONES WRAP,1
17861,580982,MOTORING TISSUE BOX,1
17861,580982,SKULL DESIGN TV DINNER TRAY,1
17861,559133,RETROSPOT PARTY BAG + STICKER SET,1
17861,548510,SET/6 RED SPOTTY PAPER CUPS,1
17861,541916,LONDON BUS COFFEE MUG,1
17861,580982,LOVE HEART TRINKET POT,1
17861,580982,SET OF 9 HEART SHAPED BALLOONS,1
17861,580982,TOAST ITS - HAPPY BIRTHDAY,1
17861,580982,CHRISTMAS RETROSPOT STAR WOOD,1
17861,559133,RETROSPOT TEA SET CERAMIC 11 PC,1
17861,575611,SPACEBOY GIFT WRAP,1
17861,580982,DISCO BALL CHRISTMAS DECORATION,1
17861,548510,SPACEBOY GIFT WRAP,1
17861,580982,RED RETROSPOT CHARLOTTE BAG,1
17861,580982,JAM MAKING SET WITH JARS,1
