15311,543463,ZINC METAL HEART DECORATION,1
15311,545288,RED RETROSPOT PURSE,1
15311,546528,BLUE GLASS GEMS IN BAG,1
15311,546528,SKULL LUNCH BOX WITH CUTLERY,1
15311,552574,JUMBO BAG APPLES,1
15311,554644,RETROSPOT TEA SET CERAMIC 11 PC,1
15311,560552,JUMBO BAG TOYS,1
15311,560853,DOORMAT NEW ENGLAND,1
15311,572217,VINTAGE SNAP CARDS,1
15311,540957,RED RETROSPOT BOWL,1
15311,544777,PINK DRAWER KNOB ACRYLIC EDWARDIAN,1
15311,546384,EDWARDIAN PARASOL NATURAL,1
15311,561295,BLACK RECORD COVER FRAME,1
15311,566558,DRAWER KNOB CRACKLE GLAZE BLUE,1
15311,567099,FRENCH BLUE METAL DOOR SIGN 9,1
15311,571292,EDWARDIAN PARASOL PINK,1
15311,571292,SKULLS TAPE,1
15311,573275,RED RETROSPOT OVEN GLOVE DOUBLE,1
15311,575321,SINGLE ANTIQUE ROSE HOOK IVORY,1
15311,578018,GLITTER HANGING BUTTERFLY STRING,1
15311,541293,VINTAGE BILLBOARD LOVE/HATE MUG,1
15311,542409,EMERGENCY FIRST AID TIN,1
15311,543463,EDWARDIAN PARASOL BLACK,1
15311,545288,JUMBO BAG PINK VINTAGE PAISLEY,1
15311,545653,GREEN DRAWER KNOB ACRYLIC EDWARDIAN,1
15311,551440,EDWARDIAN PARASOL NATURAL,1
15311,554268,CLASSIC CAFE SUGAR DISPENSER,1
15311,554644,PHOTO FRAME CORNICE,1
15311,555344,JUMBO BAG ALPHABET,1
15311,558447,JUMBO SHOPPER VINTAGE RED PAISLEY,1
15311,559459,BLUE HAPPY BIRTHDAY BUNTING,1
15311,560203,PACK OF 12 SKULL TISSUES,1
15311,563638,LARGE PURPLE BABUSHKA NOTEBOOK,1
15311,563850,SET OF 4 JAM JAR MAGNETS,1
15311,568505,FRENCH BLUE METAL DOOR SIGN 6,1
15311,575919,JAM JAR WITH PINK LID,1
15311,578523,"ART LIGHTS,FUNK MONKEY",1
15311,580904,BULL DOG BOTTLE OPENER,1
15311,536381,"AIRLINE LOUNGE,METAL SIGN",1
15311,537195,BLUE & WHITE BREAKFAST TRAY,1
15311,538076,"\"RETRO \"\"TEA FOR ONE\"\" \"",1
15311,551440,12 IVORY ROSE PEG PLACE SETTINGS,1
15311,559141,FRENCH ENAMEL CANDLEHOLDER,1
15311,570096,EDWARDIAN PARASOL BLACK,1
15311,571292,ROUND SNACK BOXES SET OF4 WOODLAND,1
15311,571292,UNION JACK FLAG LUGGAGE TAG,1
15311,571292,SKULLS PARTY BAG + STICKER SET,1
15311,580284,ROTATING SILVER ANGELS T-LIGHT HLDR,1
15311,542003,JUMBO BAG RED RETROSPOT,1
15311,543124,FIVE HEART HANGING DECORATION,1
15311,548856,GLASS HEART T-LIGHT HOLDER,1
15311,553691,WOODEN HAPPY BIRTHDAY GARLAND,1
15311,563262,HEADS AND TAILS SPORTING FUN,1
15311,576564,CHRISTMAS PUDDING TRINKET POT,1
15311,580904,HANGING HEART JAR T-LIGHT HOLDER,1
15311,537195,PURPLE DRAWERKNOB ACRYLIC EDWARDIAN,1
15311,537808,PINK POLKADOT BOWL,1
15311,537808,PINK  POLKADOT CUP,1
15311,540680,JUMBO STORAGE BAG SUKI,1
15311,541798,GLASS  BEURRE DISH,1
15311,546528,STRAWBERRY LUNCH BOX WITH CUTLERY,1
15311,554268,LUNCH BAG SUKI DESIGN,1
15311,560552,SMALL RED BABUSHKA NOTEBOOK,1
15311,560552,PLACE SETTING WHITE HEART,1
15311,567099,FRENCH BLUE METAL DOOR SIGN 2,1
15311,573275,EDWARDIAN PARASOL BLACK,1
15311,541798,EMERGENCY FIRST AID TIN,1
15311,543463,S/12 MINI RABBIT EASTER,1
15311,543740,RED HEART SHAPE LOVE BUCKET,1
15311,544777,GREEN METAL SWINGING BUNNY,1
15311,550493,PAPER BUNTING COLOURED LACE,1
15311,551440,JUMBO BAG SPACEBOY DESIGN,1
15311,551839,JUMBO SHOPPER VINTAGE RED PAISLEY,1
15311,552574,RED RETROSPOT MINI CASES,1
15311,552574,UNION JACK FLAG PASSPORT COVER,1
15311,552574,HANGING JAM JAR T-LIGHT HOLDER,1
15311,554644,GLITTER HANGING BUTTERFLY STRING,1
15311,558447,STRAWBERRY LUNCH BOX WITH CUTLERY,1
15311,571292,3 HOOK PHOTO SHELF ANTIQUE WHITE,1
15311,573275,DRAWER KNOB CRACKLE GLAZE IVORY,1
15311,580904,CALENDAR IN SEASON DESIGN,1
15311,536381,TEA TIME DES TEA COSY,1
15311,540157,FELT EGG COSY CHICKEN,1
15311,540957,GREEN DRAWER KNOB ACRYLIC EDWARDIAN,1
15311,541216,GUMBALL MONOCHROME COAT RACK,1
15311,542890,OFFICE MUG WARMER PINK,1
15311,542890,DO NOT TOUCH MY STUFF DOOR HANGER,1
15311,543124,PLACE SETTING WHITE HEART,1
15311,543463,BLUE SPOT CERAMIC DRAWER KNOB,1
15311,543740,HEN HOUSE DECORATION,1
15311,562619,JUMBO STORAGE BAG SKULLS,1
15311,565776,SMALL CERAMIC TOP STORAGE JAR,1
15311,567980,EDWARDIAN PARASOL RED,1
15311,567980,BUNDLE OF 3 ALPHABET EXERCISE BOOKS,1
15311,570096,SMALL PURPLE BABUSHKA NOTEBOOK,1
15311,570797,SET OF 3 HANGING OWLS OLLIE BEAK,1
15311,575919,BLACK RECORD COVER FRAME,1
15311,578018,BLUE REFECTORY CLOCK,1
15311,540157,EDWARDIAN PARASOL BLACK,1
15311,540680,LARGE CIRCULAR MIRROR MOBILE,1
15311,540957,RED 3 PIECE RETROSPOT CUTLERY SET,1
15311,541293,LUNCH BOX WITH CUTLERY RETROSPOT,1
15311,541575,LUNCH BAG RED RETROSPOT,1
15311,546528,IVORY HANGING DECORATION  EGG,1
15311,555855,CHERRY CROCHET FOOD COVER,1
15311,561295,PACK 3 IRON ON DOG PATCHES,1
15311,562912,FRENCH WC SIGN BLUE METAL,1
15311,567626,CALENDAR PAPER CUT DESIGN,1
15311,567980,FIVE HEART HANGING DECORATION,1
15311,570797,DRAWER KNOB CRACKLE GLAZE GREEN,1
15311,575919,EDWARDIAN PARASOL NATURAL,1
15311,578523,SET/12 TAPER CANDLES,1
15311,578819,JUMBO BAG PINK POLKADOT,1
15311,540680,ANTIQUE SILVER TEA GLASS ETCHED,1
15311,541216,DECORATIVE CATS BATHROOM BOTTLE,1
15311,541798,GREEN POLKADOT PLATE,1
15311,542409,BLUE SPOT CERAMIC DRAWER KNOB,1
15311,545653,EASTER TREE YELLOW BIRDS,1
15311,549104,BLUE DRAWER KNOB ACRYLIC EDWARDIAN,1
15311,559141,BLUE HAPPY BIRTHDAY BUNTING,1
15311,560853,DRAWER KNOB CERAMIC BLACK,1
15311,561295,BLUE STRIPE CERAMIC DRAWER KNOB,1
15311,563638,HANGING HEART JAR T-LIGHT HOLDER,1
15311,563638,CHILDRENS CUTLERY POLKADOT PINK,1
15311,565776,JUMBO  BAG BAROQUE BLACK WHITE,1
15311,565776,MONEY BOX HOUSEKEEPING DESIGN,1
15311,567099,PINK ROSE WASHBAG,1
15311,567980,SMALL RED BABUSHKA NOTEBOOK,1
15311,570797,JUMBO BAG WOODLAND ANIMALS,1
15311,571292,DAIRY MAID TOASTRACK,1
15311,575919,PINK UNION JACK  LUGGAGE TAG,1
15311,578523,HANGING HEART MIRROR DECORATION,1
15311,578523,LARGE CHINESE STYLE SCISSOR,1
15311,537195,PARTY METAL SIGN,1
15311,541575,PAPER BUNTING COLOURED LACE,1
15311,542890,PICTURE FRAME WOOD TRIPLE PORTRAIT,1
15311,543124,FELT EGG COSY CHICKEN,1
15311,549104,WOODEN HAPPY BIRTHDAY GARLAND,1
15311,551440,CHARLOTTE BAG SUKI DESIGN,1
15311,553691,SET OF 72 SKULL PAPER  DOILIES,1
15311,569330,DINOSAUR LUNCH BOX WITH CUTLERY,1
15311,573275,ROTATING SILVER ANGELS T-LIGHT HLDR,1
15311,576564,ROTATING SILVER ANGELS T-LIGHT HLDR,1
15311,576564,HANGING HEART MIRROR DECORATION,1
15311,579432,DRAWER KNOB CRACKLE GLAZE PINK,1
15311,540157,JUMBO BAG RED RETROSPOT,1
15311,540157,"KEY FOB , GARAGE DESIGN",1
15311,543124,SET OF 3 HEART COOKIE CUTTERS,1
15311,545288,STARS GIFT TAPE,1
15311,545991,"METAL SIGN,CUPCAKE SINGLE HOOK",1
15311,548856,WOOD 2 DRAWER CABINET WHITE FINISH,1
15311,561295,JUMBO BAG PINK VINTAGE PAISLEY,1
15311,575919,CLASSIC CAFE SUGAR DISPENSER,1
15311,575919,JUMBO BAG DOLLY GIRL DESIGN,1
15311,576564,FOOT STOOL HOME SWEET HOME,1
15311,578819,FLOWER VINE RAFFIA FOOD COVER,1
15311,581571,LOVE BUILDING BLOCK WORD,1
15311,541216,HOME SWEET HOME METAL SIGN,1
15311,541216,SKULL LUNCH BOX WITH CUTLERY,1
15311,542003,PINK OWL SOFT TOY,1
15311,544062,JUMBO  BAG BAROQUE BLACK WHITE,1
15311,545288,BLUE STRIPE CERAMIC DRAWER KNOB,1
15311,552574,HEART GARLAND RUSTIC PADDED,1
15311,554644,GIN + TONIC DIET METAL SIGN,1
15311,554939,CHARLOTTE BAG VINTAGE ALPHABET,1
15311,560203,MONEY BOX KINGS CHOICE DESIGN,1
15311,572217,STRAWBERRY CERAMIC TRINKET BOX,1
15311,572217,SMALL PURPLE BABUSHKA NOTEBOOK,1
15311,537808,TEA TIME DES TEA COSY,1
15311,542890,RED RETROSPOT PURSE,1
15311,544777,LUNCH BOX WITH CUTLERY RETROSPOT,1
15311,545653,JUMBO SHOPPER VINTAGE RED PAISLEY,1
15311,546528,YOU'RE CONFUSING ME METAL SIGN,1
15311,548863,GREEN METAL SWINGING BUNNY,1
15311,550493,EASTER TREE YELLOW BIRDS,1
15311,551440,JUMBO BAG PINK VINTAGE PAISLEY,1
15311,563262,PANTRY MAGNETIC  SHOPPING LIST,1
15311,567980,SKULLS WRITING SET,1
15311,569330,STRAWBERRY LUNCH BOX WITH CUTLERY,1
15311,570096,CLASSIC CAFE SUGAR DISPENSER,1
15311,570797,FRENCH BLUE METAL DOOR SIGN 6,1
15311,572885,FRENCH BLUE METAL DOOR SIGN 3,1
15311,575919,FRENCH WC SIGN BLUE METAL,1
15311,575919,VINTAGE CREAM DOG FOOD CONTAINER,1
15311,578819,RETRO LONGBOARD IRONING BOARD COVER,1
15311,552574,JUMBO BAG ALPHABET,1
15311,554644,JUMBO BAG PINK VINTAGE PAISLEY,1
15311,559459,RED TOADSTOOL LED NIGHT LIGHT,1
15311,561677,RED TOADSTOOL LED NIGHT LIGHT,1
15311,562912,SMALL PURPLE BABUSHKA NOTEBOOK,1
15311,563638,TRADITIONAL MODELLING CLAY,1
15311,566558,BULL DOG BOTTLE OPENER,1
15311,575919,FRENCH GARDEN SIGN BLUE METAL,1
15311,578018,IVORY KNITTED MUG COSY,1
15311,538857,RED DRAWER KNOB ACRYLIC EDWARDIAN,1
15311,541575,IVORY PILLAR CANDLE GOLD FLOCK,1
15311,548863,DOORMAT FAIRY CAKE,1
15311,548863,WOODEN HAPPY BIRTHDAY GARLAND,1
15311,549542,GUMBALL MONOCHROME COAT RACK,1
15311,552574,ZINC WILLIE WINKIE  CANDLE STICK,1
15311,559141,JUMBO BAG APPLES,1
15311,560853,YOU'RE CONFUSING ME METAL SIGN,1
15311,560853,PANTRY MAGNETIC  SHOPPING LIST,1
15311,562912,EMPIRE UNION JACK TV DINNER TRAY,1
15311,580904,MINIATURE ANTIQUE ROSE HOOK IVORY,1
15311,537808,BLUE FLOCK CUSHION COVER,1
15311,541293,SET/20 RED RETROSPOT PAPER NAPKINS,1
15311,543463,BLUE OWL SOFT TOY,1
15311,550493,CHARLOTTE BAG APPLES DESIGN,1
15311,552574,WHITE SPOT RED CERAMIC DRAWER KNOB,1
15311,555855,OVERNIGHT BAG VINTAGE ROSE PAISLEY,1
15311,562096,MONEY BOX BISCUITS DESIGN,1
15311,563262,SET OF 72 RETROSPOT PAPER  DOILIES,1
15311,540680,GREEN POLKADOT PLATE,1
15311,540680,ANTIQUE SILVER TEA GLASS ENGRAVED,1
15311,540680,CHARLOTTE BAG SUKI DESIGN,1
15311,543124,PLACE SETTING WHITE STAR,1
15311,545991,PINK  POLKADOT PLATE,1
15311,555344,JUMBO BAG PINK POLKADOT,1
15311,555344,BLUE SPOT CERAMIC DRAWER KNOB,1
15311,562096,GOLD MINI TAPE MEASURE,1
15311,569330,RED REFECTORY CLOCK,1
15311,572885,GLITTER HANGING BUTTERFLY STRING,1
15311,580904,CLASSIC GLASS COOKIE JAR,1
15311,540957,GREEN POLKADOT PLATE,1
15311,542890,ASSORTED COLOUR LIZARD SUCTION HOOK,1
15311,555344,LARGE YELLOW BABUSHKA NOTEBOOK,1
15311,559905,FRENCH LAUNDRY SIGN BLUE METAL,1
15311,560853,TOILET SIGN OCCUPIED OR VACANT,1
15311,567099,FRENCH BLUE METAL DOOR SIGN 4,1
15311,569330,SKULL SHOULDER BAG,1
15311,578018,SET 10 NIGHT OWL LIGHTS,1
15311,539982,RED 3 PIECE RETROSPOT CUTLERY SET,1
15311,542890,"AIRLINE LOUNGE,METAL SIGN",1
15311,543124,CERAMIC STRAWBERRY CAKE MONEY BANK,1
15311,543740,YELLOW BREAKFAST CUP AND SAUCER,1
15311,553691,PHOTO FRAME 3 CLASSIC HANGING,1
15311,567099,BLUE CALCULATOR RULER,1
15311,575919,ASSORTED COLOUR LIZARD SUCTION HOOK,1
15311,578018,HANGING HEART MIRROR DECORATION,1
15311,540680,75 GREEN FAIRY CAKE CASES,1
15311,540957,PURPLE DRAWERKNOB ACRYLIC EDWARDIAN,1
15311,544062,HEART GARLAND RUSTIC PADDED,1
15311,545991,BLUE POLKADOT PLATE,1
15311,549542,GLASS CLOCHE SMALL,1
15311,551440,FRENCH WC SIGN BLUE METAL,1
15311,554939,CHARLOTTE BAG PINK POLKADOT,1
15311,560853,BOYS VINTAGE TIN SEASIDE BUCKET,1
15311,560853,CALENDAR IN SEASON DESIGN,1
15311,560853,RED SPOT CERAMIC DRAWER KNOB,1
15311,561295,GREEN POLKADOT PLATE,1
15311,563262,DOORMAT BLACK FLOCK,1
15311,563262,PHOTO CLIP LINE,1
15311,565776,ROUND SNACK BOXES SET OF 4 SKULLS,1
15311,567099,ENAMEL FLOWER JUG CREAM,1
15311,572885,ANTIQUE ALL GLASS CANDLESTICK,1
15311,537808,PAPER BUNTING RETROSPOT,1
15311,541575,DINOSAUR LUNCH BOX WITH CUTLERY,1
15311,544062,EDWARDIAN PARASOL NATURAL,1
15311,546384,CLEAR DRAWER KNOB ACRYLIC EDWARDIAN,1
15311,546384,BLACK/BLUE POLKADOT UMBRELLA,1
15311,550493,PINK FELT EASTER RABBIT GARLAND,1
15311,553691,RED RETROSPOT MINI CASES,1
15311,554644,WOODLAND CHARLOTTE BAG,1
15311,560853,SKETCHBOOK MAGNETIC SHOPPING LIST,1
15311,562619,VINTAGE SNAP CARDS,1
15311,568505,TEA TIME DES TEA COSY,1
15311,571292,DOORMAT ENGLISH ROSE,1
15311,572885,LARGE PURPLE BABUSHKA NOTEBOOK,1
15311,580284,SWEETHEART WIRE MAGAZINE RACK,1
15311,540957,LUNCH BAG PINK POLKADOT,1
15311,542409,PURPLE DRAWERKNOB ACRYLIC EDWARDIAN,1
15311,542890,SMALL HEART FLOWERS HOOK,1
15311,544777,SET OF 4 ENGLISH ROSE COASTERS,1
15311,545288,LUNCH BAG  BLACK SKULL.,1
15311,545991,BLACK SMALL GLASS CAKE STAND,1
15311,546384,BLUE HAPPY BIRTHDAY BUNTING,1
15311,546528,CHARLOTTE BAG SUKI DESIGN,1
15311,548863,PINK  HEART SHAPE LOVE BUCKET,1
15311,553691,COOK WITH WINE METAL SIGN,1
15311,555855,SMALL GLASS HEART TRINKET POT,1
15311,560552,BLUE  VOILE LAMPSHADE,1
15311,576564,3 DRAWER ANTIQUE WHITE WOOD CABINET,1
15311,578018,JUMBO BAG TOYS,1
15311,539982,LARGE YELLOW BABUSHKA NOTEBOOK,1
15311,541216,CUTE CATS TAPE,1
15311,541293,VINTAGE CREAM CAT FOOD CONTAINER,1
15311,541293,GREEN POLKADOT PLATE,1
15311,545653,HOT BATHS SOAP HOLDER,1
15311,545991,GARLAND WOODEN HAPPY EASTER,1
15311,546528,BLUE STRIPE CERAMIC DRAWER KNOB,1
15311,550493,PINK GLASS CANDLEHOLDER,1
15311,555344,LUNCH BAG PINK POLKADOT,1
15311,557628,JUMBO BAG ALPHABET,1
15311,561295,BLUE GLASS GEMS IN BAG,1
15311,562619,RAIN PONCHO RETROSPOT,1
15311,571628,SET OF 3 HANGING OWLS OLLIE BEAK,1
15311,573275,LARGE PURPLE BABUSHKA NOTEBOOK,1
15311,574514,4 TRADITIONAL SPINNING TOPS,1
15311,580904,MONEY BOX HOUSEKEEPING DESIGN,1
15555,550331,HANGING WOOD AND FELT HEART,1
15555,564724,SET OF 4 JAM JAR MAGNETS,1
15555,564724,12 PENCILS TALL TUBE SKULLS,1
15555,569216,FELTCRAFT BUTTERFLY HEARTS,1
15555,579001,CLOTHES PEGS RETROSPOT PACK 24,1
15555,558906,"RETRO PILL BOX , REVOLUTIONARY",1
15555,567912,FILIGREE HEART DAISY WHITE,1
15555,538156,WHITE BELL HONEYCOMB PAPER GARLAND,1
15555,538597,PAINTED METAL HEART WITH HOLLY BELL,1
15555,575339,CHILDRENS TOY COOKING UTENSIL SET,1
15555,579001,MAGIC DRAWING SLATE CIRCUS PARADE,1
15555,550331,JIGSAW TREE WITH WATERING CAN,1
15555,550331,SET 2 PANTRY DESIGN TEA TOWELS,1
15555,569216,VINTAGE BILLBOARD DRINK ME MUG,1
15555,574673,WOODEN HEART CHRISTMAS SCANDINAVIAN,1
15555,550331,SET OF 3 NOTEBOOKS IN PARCEL,1
15555,557123,PLASTERS IN TIN STRONGMAN,1
15555,558906,MAGNETS PACK OF 4 HOME SWEET HOME,1
15555,558906,PINK STITCHED WALL CLOCK,1
15555,564724,SET OF 5 PANCAKE DAY MAGNETS,1
15555,569216,TRAVEL CARD WALLET TRANSPORT,1
15555,555399,PLASTERS IN TIN SPACEBOY,1
15555,557123,LUNCH BAG RED RETROSPOT,1
15555,558906,ENGLISH ROSE NOTEBOOK A7 SIZE,1
15555,574673,HAPPY STENCIL CRAFT,1
15555,575339,SINGLE ANTIQUE ROSE HOOK IVORY,1
15555,537204,ANGEL DECORATION 3 BUTTONS,1
15555,554103,WRAP SUKI AND FRIENDS,1
15555,558906,LUNCH BAG  BLACK SKULL.,1
15555,567912,WOODLAND PARTY BAG + STICKER SET,1
15555,569216,TRAVEL CARD WALLET VINTAGE LEAF,1
15555,574673,SET 12 COLOUR PENCILS LOVE LONDON,1
15555,537204,GLITTER CHRISTMAS HEART,1
15555,538156,FOUR HOOK  WHITE LOVEBIRDS,1
15555,555399,TRADITIONAL MODELLING CLAY,1
15555,575339,SET OF 12 MINI LOAF BAKING CASES,1
15555,550331,POTTING SHED TEA MUG,1
15555,564724,LUNCH BAG RED RETROSPOT,1
15555,567912,LUNCH BAG DOLLY GIRL DESIGN,1
15555,569216,GREEN CHRISTMAS TREE CARD HOLDER,1
15555,570857,RETROSPOT TEA SET CERAMIC 11 PC,1
15555,574673,PLASTERS IN TIN CIRCUS PARADE,1
15555,555399,LUNCH BAG RED RETROSPOT,1
15555,558906,FAIRY CAKES NOTEBOOK A6 SIZE,1
15555,567912,HANGING WOOD AND FELT HEART,1
15555,564724,SKULLS GREETING CARD,1
15555,564724,PLASTERS IN TIN CIRCUS PARADE,1
15555,564724,36 PENCILS TUBE RED RETROSPOT,1
15555,564724,POTTERING MUG,1
15555,567912,ASSORTED TUTTI FRUTTI BRACELET,1
15555,537204,STAR DECORATION RUSTIC,1
15555,538156,METAL 4 HOOK HANGER FRENCH CHATEAU,1
15555,570857,REGENCY CAKESTAND 3 TIER,1
15555,574673,TRAVEL CARD WALLET I LOVE LONDON,1
15555,579001,BUNDLE OF 3 RETRO NOTE BOOKS,1
15555,579001,SET OF 3 HANGING OWLS OLLIE BEAK,1
15555,579001,VINTAGE LEAF MAGNETIC NOTEPAD,1
15555,554103,TEA TIME OVEN GLOVE,1
15555,557123,TRAVEL CARD WALLET TRANSPORT,1
15555,567912,DINOSAURS  WRITING SET,1
15555,579001,WRAP VINTAGE LEAF DESIGN,1
15555,550331,WOODEN SCHOOL COLOURING SET,1
15555,554103,JUMBO BAG STRAWBERRY,1
15555,567912,SET OF 3 WOODEN HEART DECORATIONS,1
15555,554103,GINGHAM HEART  DOORSTOP RED,1
15555,558906,TRAVEL CARD WALLET VINTAGE TICKET,1
15555,574673,DOLLY GIRL MINI BACKPACK,1
15555,538597,HEART FILIGREE DOVE  SMALL,1
15555,550331,BLACK PHOTO ALBUM,1
15555,564724,TRAVEL CARD WALLET I LOVE LONDON,1
15555,569216,TRADITIONAL MODELLING CLAY,1
15555,579001,PLASTERS IN TIN STRONGMAN,1
15555,537204,CHRISTMAS RETROSPOT HEART WOOD,1
15555,550331,MAGNETS PACK OF 4 CHILDHOOD MEMORY,1
15555,558906,LUNCH BAG DOLLY GIRL DESIGN,1
15555,538597,TRADITIONAL MODELLING CLAY,1
15555,569216,FOLK ART METAL STAR T-LIGHT HOLDER,1
15555,554103,HEART IVORY TRELLIS SMALL,1
15555,558906,GLAMOROUS  MUG,1
15555,558906,WOOD S/3 CABINET ANT WHITE FINISH,1
15555,570857,WOODEN ADVENT CALENDAR CREAM,1
15555,574673,CHRISTMAS HANGING TREE WITH BELL,1
15555,579001,SET 12 COLOURING PENCILS DOILY,1
15555,538597,CHRISTMAS TREE HEART DECORATION,1
15555,557123,TRADITIONAL MODELLING CLAY,1
15555,558906,TRAVEL CARD WALLET KEEP CALM,1
15555,579001,BICYCLE PUNCTURE REPAIR KIT,1
15555,579001,WRAP SUKI AND FRIENDS,1
15555,554103,TRAVEL CARD WALLET SKULLS,1
15555,579001,12 PENCILS TALL TUBE WOODLAND,1
15555,550331,BUNNY DECORATION MAGIC GARDEN,1
15555,554103,12 PENCIL SMALL TUBE WOODLAND,1
15555,558906,MAGNETS PACK OF 4 SWALLOWS,1
15555,538156,GARLAND WITH HEARTS AND BELLS,1
15555,538156,HAND WARMER BABUSHKA DESIGN,1
15555,567912,SET 12 COLOURING PENCILS DOILY,1
15555,569216,FELTCRAFT HAIRBAND PINK AND PURPLE,1
15555,579001,CARD CAT AND TREE,1
15555,550331,TRADITIONAL MODELLING CLAY,1
15555,554103,JUMBO BAG DOLLY GIRL DESIGN,1
15555,564724,WHITE HANGING HEART T-LIGHT HOLDER,1
15555,575339,REX CASH+CARRY JUMBO SHOPPER,1
15555,579001,WOODEN BOX OF DOMINOES,1
15555,538156,"FLOWER FAIRY,5 SUMMER B'DRAW LINERS",1
15555,554103,FELTCRAFT BUTTERFLY HEARTS,1
15555,557150,COSY SLIPPER SHOES LARGE GREEN,1
15555,567912,HEART FILIGREE DOVE  SMALL,1
15555,567912,TRAVEL CARD WALLET KEEP CALM,1
15555,569216,SPACEBOY MINI BACKPACK,1
15555,537204,CHRISTMAS RETROSPOT STAR WOOD,1
15555,564724,HEART IVORY TRELLIS LARGE,1
15555,567912,SILVER GLITTER FLOWER VOTIVE HOLDER,1
15555,550331,LARGE CIRCULAR MIRROR MOBILE,1
15555,554103,MONSTERS STENCIL CRAFT,1
15555,570857,PAPER LANTERN 9 POINT DELUXE STAR,1
15555,575339,MINIATURE ANTIQUE ROSE HOOK IVORY,1
15555,538597,Manual,1
15555,550331,MAGNETS PACK OF 4 SWALLOWS,1
15555,550331,"FANCY FONT BIRTHDAY CARD,",1
15555,558906,IF YOU CAN'T STAND THE HEAT MUG,1
15555,558906,SPACEBOY BIRTHDAY CARD,1
15555,574673,SPACEBOY GIFT WRAP,1
15555,574673,SET 36 COLOUR PENCILS SPACEBOY,1
15555,579001,TRAVEL CARD WALLET TRANSPORT,1
15555,554103,TRAVEL CARD WALLET SUKI,1
15555,557123,12 PENCIL SMALL TUBE WOODLAND,1
15555,564724,LUNCH BAG SPACEBOY DESIGN,1
15555,579001,SET OF 6 NATIVITY MAGNETS,1
15555,538597,12 PENCILS SMALL TUBE SKULL,1
15555,550331,LUNCH BAG RED RETROSPOT,1
15555,564724,12 PENCILS TALL TUBE WOODLAND,1
15555,569216,VINTAGE LEAF MAGNETIC NOTEPAD,1
15555,537204,ROCKING HORSE RED CHRISTMAS,1
15555,538156,FELTCRAFT CUSHION BUTTERFLY,1
15555,554103,FILIGRIS HEART WITH BUTTERFLY,1
15555,558906,RED HANGING HEART T-LIGHT HOLDER,1
15555,558906,PLASTERS IN TIN SKULLS,1
15555,564724,SET OF 5 MINI GROCERY MAGNETS,1
15555,579001,TRAVEL CARD WALLET FLOWER MEADOW,1
15555,550331,BUNNY WOODEN PAINTED WITH BIRD,1
15555,550331,EASTER TIN KEEPSAKE,1
15555,557123,SET OF 5 MINI GROCERY MAGNETS,1
15555,575339,TRIPLE HOOK ANTIQUE IVORY ROSE,1
15555,538156,6 RIBBONS RUSTIC CHARM,1
15555,554103,LUNCH BAG DOLLY GIRL DESIGN,1
15555,564724,LUNCH BAG ALPHABET DESIGN,1
15555,569216,BALLOONS  WRITING SET,1
15555,574673,WOOD STAMP SET BEST WISHES,1
15555,554103,MUSICAL ZINC HEART DECORATION,1
15555,558906,FAIRY CAKES NOTEBOOK A7 SIZE,1
15555,558906,EMPIRE TISSUE BOX,1
15555,575339,DOLLY CABINET 3 DRAWERS,1
15555,538597,WOODEN SCHOOL COLOURING SET,1
15555,554103,PINK VINTAGE PAISLEY PICNIC BAG,1
15555,567912,LUNCH BAG  BLACK SKULL.,1
15555,574673,MAGIC DRAWING SLATE DOLLY GIRL,1
15555,574673,TRAVEL CARD WALLET UNION JACK,1
15555,574673,VINTAGE LEAF MAGNETIC NOTEPAD,1
15555,537204,SWISS CHALET TREE DECORATION,1
15555,550331,PLASTERS IN TIN SPACEBOY,1
15555,554103,LUNCH BAG DOILEY PATTERN,1
15555,567912,LOVE HEART TRINKET POT,1
15555,574673,CHRISTMAS CRAFT WHITE FAIRY,1
15555,557150,SET OF 60 VINTAGE LEAF CAKE CASES,1
15555,579001,HAPPY STENCIL CRAFT,1
15555,554103,TRAVEL CARD WALLET VINTAGE ROSE,1
15555,555399,LUNCH BAG APPLE DESIGN,1
15555,555399,SET OF 5 LUCKY CAT MAGNETS,1
15555,555399,WOODEN SCHOOL COLOURING SET,1
15555,558906,WHITE STITCHED WALL CLOCK,1
15555,567912,JIGSAW RABBIT AND BIRDHOUSE,1
15555,569216,MONSTERS STENCIL CRAFT,1
15555,579001,SET 36 COLOUR PENCILS LOVE LONDON,1
15555,538156,BLUE PAISLEY SKETCHBOOK,1
15555,538597,PAINT YOUR OWN CANVAS SET,1
15555,558906,KINGS CHOICE MUG,1
15555,558906,SET OF 5 PANCAKE DAY MAGNETS,1
15555,564724,PLASTERS IN TIN SKULLS,1
15555,564724,WOOD 2 DRAWER CABINET WHITE FINISH,1
15555,567912,TEA TIME OVEN GLOVE,1
15555,574673,SET 36 COLOUR PENCILS LOVE LONDON,1
15555,564724,TRAVEL CARD WALLET VINTAGE TICKET,1
15555,567912,WOOD STAMP SET FLOWERS,1
15555,569216,PLAYING CARDS KEEP CALM & CARRY ON,1
15555,570857,BAKING SET 9 PIECE RETROSPOT,1
15555,550331,SET OF 5 LUCKY CAT MAGNETS,1
15555,550331,MAGNETS PACK OF 4 VINTAGE COLLAGE,1
15555,567912,HEART IVORY TRELLIS LARGE,1
15555,569216,PARTY CHARMS 50 PIECES,1
15555,569216,WHITE HANGING HEART T-LIGHT HOLDER,1
15555,569216,PINK/WHITE CHRISTMAS TREE 60CM,1
15555,574673,TRAVEL CARD WALLET SUKI,1
15555,579001,MAGIC DRAWING SLATE DINOSAUR,1
15555,579001,MONSTERS STENCIL CRAFT,1
15555,554103,SMALL HANGING IVORY/RED WOOD BIRD,1
15555,557123,TRAVEL CARD WALLET KEEP CALM,1
15555,557123,PLASTERS IN TIN CIRCUS PARADE,1
15555,558906,FLOWER BLUE CLOCK WITH SUCKER,1
15555,567912,CLOTHES PEGS RETROSPOT PACK 24,1
15555,575339,ROCOCO WALL MIRROR WHITE,1
15555,554103,VINTAGE UNION JACK DOORSTOP,1
15555,564724,TRAVEL CARD WALLET SUKI,1
15555,567912,BALLOONS  WRITING SET,1
15555,574673,LUNCH BAG VINTAGE DOILY,1
15555,579001,MAGIC DRAWING SLATE PURDEY,1
15555,579001,PANTRY MAGNETIC  SHOPPING LIST,1
15555,557123,PLASTERS IN TIN SPACEBOY,1
15555,558906,KINGS CHOICE GIANT TUBE MATCHES,1
15555,574673,GLITTER CHRISTMAS TREE,1
15555,574673,BAG 125g SWIRLY MARBLES,1
15555,557150,SWEETHEART WIRE MAGAZINE RACK,1
15555,558906,SET/4 BIRD MIRROR MAGNETS,1
15555,570857,BAKING MOULD ROSE WHITE CHOCOLATE,1
15555,574673,SET 12 COLOURING PENCILS DOILY,1
15555,574673,FOLKART STAR CHRISTMAS DECORATIONS,1
15555,575339,LE GRAND TRAY CHIC SET,1
15555,579001,SET 12 KIDS COLOUR  CHALK STICKS,1
15555,579001,TRADITIONAL MODELLING CLAY,1
15555,537204,RAINY LADIES BIRTHDAY CARD,1
15555,538597,12 PENCILS TALL TUBE WOODLAND,1
15555,550331,EASTER DECORATION HANGING BUNNY,1
15555,567912,FILIGREE HEART BIRD WHITE,1
15555,569216,PLASTERS IN TIN STRONGMAN,1
15555,537204,WHITE CHRISTMAS STAR DECORATION,1
15555,550331,EASTER TIN CHICKS IN GARDEN,1
15555,538156,FELTCRAFT PRINCESS OLIVIA DOLL,1
15555,567912,WOOD BLACK BOARD ANT WHITE FINISH,1
15555,554103,JUMBO STORAGE BAG SUKI,1
15555,554103,GIN AND TONIC MUG,1
15555,558906,TRAVEL CARD WALLET TRANSPORT,1
15555,574673,PLAYING CARDS I LOVE LONDON,1
15555,550331,GIN AND TONIC MUG,1
15555,558906,CANDLEHOLDER PINK HANGING HEART,1
15555,558906,LUNCH BAG DOILEY PATTERN,1
15555,564724,LUNCH BAG WOODLAND,1
15555,564724,PLASTERS IN TIN WOODLAND ANIMALS,1
15555,567912,"RETRO PILL BOX KEY CHAIN,THE KING",1
15555,567912,LUNCH BAG WOODLAND,1
15555,575339,SET OF 36 PANTRY PAPER DOILIES,1
15555,579001,12 PENCILS TALL TUBE RED RETROSPOT,1
15555,567912,TEA TIME DES TEA COSY,1
15555,567912,12 PENCILS TALL TUBE WOODLAND,1
15555,570857,EGG FRYING PAN MINT,1
15555,579001,WOODEN FRAME ANTIQUE WHITE,1
15555,558906,MAGNETS PACK OF 4 VINTAGE COLLAGE,1
15555,558906,EMPIRE BIRTHDAY CARD,1
15555,564724,HOME SWEET HOME MUG,1
15555,579001,SET 12 COLOUR PENCILS LOVE LONDON,1
15555,538597,BAG 125g SWIRLY MARBLES,1
15555,569216,LARGE WHITE HEART OF WICKER,1
15555,574673,WOOD 2 DRAWER CABINET WHITE FINISH,1
15555,579001,SET OF 3 WOODEN STOCKING DECORATION,1
15555,555399,LUNCH BAG SPACEBOY DESIGN,1
15555,558906,TRAVEL CARD WALLET SKULLS,1
15555,564724,BAG 500g SWIRLY MARBLES,1
15555,567912,CARD DOLLY GIRL,1
15555,570857,PANTRY PASTRY BRUSH,1
15555,574673,WOODEN STAR CHRISTMAS SCANDINAVIAN,1
15555,574673,ROCOCO WALL MIRROR WHITE,1
15555,579001,CLASSIC CHROME BICYCLE BELL,1
15555,579001,PACK OF 12 TRADITIONAL CRAYONS,1
15555,550331,PLASTERS IN TIN VINTAGE PAISLEY,1
15555,554103,PARTY BUNTING,1
15555,557123,REX CASH+CARRY JUMBO SHOPPER,1
15555,564724,SET 12 KIDS COLOUR  CHALK STICKS,1
15555,550331,PLASTERS IN TIN SKULLS,1
15555,554103,PLASTERS IN TIN SKULLS,1
15555,579001,SET OF 3 WOODEN TREE DECORATIONS,1
15555,579001,SET OF 3 WOODEN SLEIGH DECORATIONS,1
15555,564724,PAINT YOUR OWN CANVAS SET,1
15555,567912,SMALL HANGING IVORY/RED WOOD BIRD,1
15555,579001,SET 36 COLOUR PENCILS DOLLY GIRL,1
15555,537204,GLITTER CHRISTMAS TREE,1
15555,550331,HOME SWEET HOME MUG,1
15555,564724,LUNCH BAG SUKI DESIGN,1
15555,569216,TRAVEL CARD WALLET I LOVE LONDON,1
15555,574673,FOLKART CLIP ON STARS,1
15555,537204,SWALLOW WOODEN CHRISTMAS DECORATION,1
15555,550331,HANGING WOOD AND FELT BUTTERFLY,1
15555,558906,HEART OF WICKER LARGE,1
15555,567912,JIGSAW TREE WITH BIRDHOUSE,1
15555,575339,MINI LIGHTS WOODLAND MUSHROOMS,1
15555,579001,RETROSPOT GIANT TUBE MATCHES,1
15555,579001,TRAVEL CARD WALLET SUKI,1
15555,537204,CHRISTMAS RETROSPOT TREE WOOD,1
15555,550331,LUNCH BAG VINTAGE LEAF DESIGN,1
15555,569216,WOOD 2 DRAWER CABINET WHITE FINISH,1
15555,569216,TEA TIME OVEN GLOVE,1
15555,569216,CLOTHES PEGS RETROSPOT PACK 24,1
15555,570857,BAKING MOULD EASTER EGG MILK CHOC,1
15555,574673,SET 12 COLOUR PENCILS DOLLY GIRL,1
15555,555399,LUNCH BAG DOLLY GIRL DESIGN,1
15555,574673,ASSTD FRUIT+FLOWERS FRIDGE MAGNETS,1
15555,579001,SMALL WHITE HEART OF WICKER,1
15555,579001,LUNCH BAG APPLE DESIGN,1
15555,550331,PLASTERS IN TIN CIRCUS PARADE,1
15555,569216,TRAVEL CARD WALLET KEEP CALM,1
15555,538156,GREEN FERN SKETCHBOOK,1
15555,554103,CARD BILLBOARD FONT,1
15555,557123,TRAVEL CARD WALLET UNION JACK,1
15555,564724,PACK OF 72 SKULL CAKE CASES,1
15555,574673,SET 12 KIDS COLOUR  CHALK STICKS,1
15555,579001,WOODEN PICTURE FRAME WHITE FINISH,1
15555,550331,ALPHABET STENCIL CRAFT,1
15555,570857,TOAST ITS - FAIRY FLOWER,1
15555,579001,GLITTER CHRISTMAS STAR,1
15555,557150,RETROSPOT BABUSHKA DOORSTOP,1
