17301,577319,SET OF 6 SNACK LOAF BAKING CASES,0
17301,577319,REGENCY TEA PLATE ROSES,0
17301,577319,REGENCY TEA PLATE GREEN,0
17301,577319,RABBIT NIGHT LIGHT,0
17301,577319,LARGE WHITE HEART OF WICKER,0
17301,577319,DECORATIVE WICKER HEART MEDIUM,0
17301,577319,PACK OF 60 DINOSAUR CAKE CASES,0
17301,577319,PHOTO FRAME CORNICE,0
17301,577319,PLASTERS IN TIN STRONGMAN,0
17301,577319,WOOD STAMP SET HAPPY BIRTHDAY,0
17301,577319,SMALL WHITE HEART OF WICKER,0
17301,577319,JUMBO STORAGE BAG SUKI,0
17301,577319,SET OF 3 WOODEN SLEIGH DECORATIONS,0
17301,577319,DOLLY GIRL BEAKER,0
17301,577319,SET OF 60 VINTAGE LEAF CAKE CASES,0
17301,577319,SET OF 3 WOODEN HEART DECORATIONS,0
17301,577319,WOODEN TREE CHRISTMAS SCANDINAVIAN,0
17301,577319,DECORATIVE WICKER HEART LARGE,0
17301,577319,JUMBO BAG ALPHABET,0
17301,577319,IVORY WICKER HEART MEDIUM,0
17301,577319,SET OF 3 REGENCY CAKE TINS,0
17301,577319,SOLDIERS EGG CUP,0
17301,577319,I LOVE LONDON BEAKER,0
17301,577319,REGENCY SUGAR BOWL GREEN,0
17301,577319,ASSORTED COLOUR BIRD ORNAMENT,0
17301,577319,RETRO PLASTIC ELEPHANT TRAY,0
17301,577319,REGENCY TEA PLATE PINK,0
17301,577319,REVOLVER WOODEN RULER,0
17301,577319,RED TOADSTOOL LED NIGHT LIGHT,0
17301,577319,SET OF 12 MINI LOAF BAKING CASES,0
17301,577319,CHRISTMAS STAR WISH LIST CHALKBOARD,0
17301,577319,JUMBO BAG SPACEBOY DESIGN,0
17301,577319,IVORY WICKER HEART LARGE,0
17301,577319,WOODEN STAR CHRISTMAS SCANDINAVIAN,0
17301,577319,WICKER WREATH LARGE,0
17301,577319,PINK REGENCY TEACUP AND SAUCER,0
17301,577319,IVORY PAPER CUP CAKE CASES,0
17301,577319,SET OF 60 PANTRY DESIGN CAKE CASES,0
17301,577319,STAR DECORATION PAINTED ZINC,0
17301,577319,SET OF 3 BUTTERFLY COOKIE CUTTERS,0
17301,577319,IVORY WICKER HEART SMALL,0
17301,577319,SET OF 60 I LOVE LONDON CAKE CASES,0
17301,577319,WOODEN BOX OF DOMINOES,0
17301,577319,PACK OF 72 SKULL CAKE CASES,0
17301,577319,ANTIQUE SILVER BAUBLE LAMP,0
17301,577319,SET OF 12 FAIRY CAKE BAKING CASES,0
17301,577319,75 GREEN FAIRY CAKE CASES,0
17301,577319,REGENCY MILK JUG PINK,0
17301,577319,PACK OF 12 SPACEBOY TISSUES,0
17301,577319,GREEN REGENCY TEACUP AND SAUCER,0
17301,577319,60 CAKE CASES DOLLY GIRL DESIGN,0
17301,577319,PACK OF 12 SUKI TISSUES,0
17301,577319,JUMBO BAG WOODLAND ANIMALS,0
17301,577319,PACK OF 12 LONDON TISSUES,0
17301,577319,CAKE PLATE LOVEBIRD WHITE,0
17301,577319,SET OF 6 TEA TIME BAKING CASES,0
17301,577319,3 PIECE SPACEBOY COOKIE CUTTER SET,0
17301,577319,SPACEBOY BEAKER,0
17301,577319,PETIT TRAY CHIC,0
17339,565757,HANGING CLEAR MINI BOTTLE,0
17339,565757,SET 6 SCHOOL MILK BOTTLES IN CRATE,0
17339,538087,KNITTED UNION FLAG HOT WATER BOTTLE,0
17339,538087,WHITE SKULL HOT WATER BOTTLE,0
17339,538087,RED WOOLLY HOTTIE WHITE HEART.,0
17339,565757,GLASS APOTHECARY BOTTLE ELIXIR,0
17339,565757,GLASS APOTHECARY BOTTLE TONIC,0
17339,565757,FRENCH STYLE STORAGE JAR BONBONS,0
17339,538087,GREY HEART HOT WATER BOTTLE,0
17423,572474,VINTAGE CHRISTMAS BUNTING,0
17423,572474,CHRISTMAS RETROSPOT TREE WOOD,0
17423,572474,PAPER CHAIN KIT VINTAGE CHRISTMAS,0
17423,572474,PAPER LANTERN 9 POINT DELUXE STAR,0
17423,572474,CHRISTMAS GINGHAM TREE,0
17423,552044,CHILLI LIGHTS,0
17423,572474,SET OF 6 RIBBONS VINTAGE CHRISTMAS,0
17423,552044,SET/10 PINK POLKADOT PARTY CANDLES,0
17423,572474,GINGHAM HEART DECORATION,0
17423,552044,PAPER BUNTING RETROSPOT,0
17423,572474,RETROSPOT WOODEN HEART DECORATION,0
17423,572474,VINTAGE CHRISTMAS STOCKING,0
17423,552044,SET/10 RED POLKADOT PARTY CANDLES,0
17423,552044,SET 10 LIGHTS NIGHT OWL,0
17423,572474,3D CHRISTMAS STAMPS STICKERS,0
17423,572474,CHRISTMAS RETROSPOT ANGEL WOOD,0
17423,552044,CUPCAKE LACE PAPER SET 6,0
17423,552044,60 TEATIME FAIRY CAKE CASES,0
17423,552044,SET/10 BLUE POLKADOT PARTY CANDLES,0
17423,552044,PAPER CHAIN KIT RETROSPOT,0
17423,572474,CHRISTMAS RETROSPOT STAR WOOD,0
17423,552044,HANGING JAM JAR T-LIGHT HOLDER,0
17423,572474,PAPER CHAIN KIT 50'S CHRISTMAS,0
17423,572474,PAPER LANTERN 9 POINT SNOW STAR,0
17423,572474,CHRISTMAS GINGHAM STAR,0
17423,552044,PACK OF 72 RETROSPOT CAKE CASES,0
17712,572853,SET/4 WHITE RETRO STORAGE CUBES,0
17712,572853,VINTAGE CHRISTMAS PAPER GIFT BAG,0
17712,572853,HEART OF WICKER SMALL,0
17712,572853,FELTCRAFT DOLL EMILY,0
17712,572853,MR ROBOT SOFT TOY,0
17712,572853,DOG TOY WITH PINK CROCHET SKIRT,0
17712,572853,HOME SWEET HOME KEY HOLDER,0
17712,572853,SCOTTIE DOG HOT WATER BOTTLE,0
17712,572853,BLUE OWL SOFT TOY,0
17712,572853,MRS ROBOT SOFT TOY,0
17712,572853,GIFT BAG PSYCHEDELIC APPLES,0
17712,572853,RED GINGHAM TEDDY BEAR,0
17712,572853,METAL 4 HOOK HANGER FRENCH CHATEAU,0
17712,572853,ENGLISH ROSE HOT WATER BOTTLE,0
17712,572853,50'S CHRISTMAS PAPER GIFT BAG,0
17712,572853,MAKE YOUR OWN MONSOON CARD KIT,0
17712,572853,GRAND CHOCOLATECANDLE,0
17712,572853,MINIATURE ANTIQUE ROSE HOOK IVORY,0
17712,572853,FAIRY CAKE FLANNEL ASSORTED COLOUR,0
17712,572853,50'S CHRISTMAS GIFT BAG LARGE,0
17712,572853,HOMEMADE JAM SCENTED CANDLES,0
17712,572853,BAKING SET 9 PIECE RETROSPOT,0
17712,572853,FAMILY PHOTO FRAME CORNICE,0
17712,572853,GROW A FLYTRAP OR SUNFLOWER IN TIN,0
17712,572853,TRIPLE PHOTO FRAME CORNICE,0
17712,572853,HOT WATER BOTTLE TEA AND SYMPATHY,0
17712,572853,VINTAGE CHRISTMAS GIFT BAG LARGE,0
17712,572853,BLUE SCOTTIE DOG W FLOWER PATTERN,0
17712,572853,TRIPLE HOOK ANTIQUE IVORY ROSE,0
17744,548709,SMALL DOLLY MIX DESIGN ORANGE BOWL,0
17744,548709,SUKI  SHOULDER BAG,0
17744,576093,MAGNETS PACK OF 4 RETRO PHOTO,0
17744,541107,ROMANTIC IMAGES NOTEBOOK SET,0
17744,576093,ASSORTED BOTTLE TOP  MAGNETS,0
17744,576093,SMALL CHOCOLATES PINK BOWL,0
17744,576093,TOXIC AREA  DOOR HANGER,0
17744,548709,CURIOUS  IMAGES NOTEBOOK SET,0
17744,541699,ASS FLORAL PRINT MULTI SCREWDRIVER,0
17744,541107,LARGE CAKE TOWEL CHOCOLATE SPOTS,0
17744,576093,MAGNETS PACK OF 4 VINTAGE LABELS,0
17744,580875,ASSORTED BOTTLE TOP  MAGNETS,0
17744,539252,LOCAL CAFE MUG,0
17744,576093,SUKI  SHOULDER BAG,0
17744,580875,DOORSTOP RACING CAR DESIGN,0
17744,580875,SET OF 6 T-LIGHTS WEDDING CAKE,0
17744,580875,CERAMIC CHERRY CAKE MONEY BANK,0
17744,580875,MINI CAKE STAND  HANGING STRAWBERY,0
17744,580875,SET OF 2 ROUND TINS DUTCH CHEESE,0
17744,541107,S/4 VALENTINE DECOUPAGE HEART BOX,0
17744,541107,VINTAGE BEAD PINK SCARF,0
17744,541699,VINTAGE BEAD PINK PURSE,0
17744,580875,DANISH ROSE DECORATIVE PLATE,0
17744,539252,MAGNETS PACK OF 4 RETRO PHOTO,0
17744,539252,BLACK LOVE BIRD CANDLE,0
17744,576093,SMALL MARSHMALLOWS PINK BOWL,0
17744,580875,LARGE PURPLE BABUSHKA NOTEBOOK,0
17744,580875,LARGE CAKE TOWEL CHOCOLATE SPOTS,0
17744,580875,TOOTHPASTE TUBE PEN,0
17744,576093,MAGNETS PACK OF 4 SWALLOWS,0
17744,576093,BLUE CHARLIE+LOLA PERSONAL DOORSIGN,0
17744,580875,SMALL RED BABUSHKA NOTEBOOK,0
17744,576093,MADRAS NOTEBOOK MEDIUM,0
17744,539252,S/4 CACTI CANDLES,0
17744,576093,MAGNETS PACK OF 4 HOME SWEET HOME,0
17744,539252,VINTAGE BEAD PINK EVENING BAG,0
17744,580875,"SWISS ROLL TOWEL, CHOCOLATE  SPOTS",0
17744,541699,VINTAGE BEAD PINK SCARF,0
17744,576093,LIPSTICK PEN FUSCHIA,0
17744,580875,PIZZA PLATE IN BOX,0
17744,580875,OFFICE MUG WARMER CHOC+BLUE,0
17744,548709,STRIPY DESIGN SHOWER CAP,0
17744,541699,ENGLISH ROSE GARDEN SECATEURS,0
17744,548709,BLOSSOM  IMAGES NOTEBOOK SET,0
17744,580875,CERAMIC STRAWBERRY DESIGN MUG,0
17744,539252,COLOURING PENCILS BROWN TUBE,0
17744,541107,HEARTS GIFT TAPE,0
17744,548709,LOVE HEART TRINKET POT,0
17744,548709,PING MICROWAVE APRON,0
17744,576093,SET OF 12 FORK CANDLES,0
17744,580875,MONEY BOX FIRST AID DESIGN,0
17744,580875,RED HEART SHAPE LOVE BUCKET,0
17744,539252,SET/6 FROG PRINCE T-LIGHT CANDLES,0
17744,539252,SET/6 PINK BIRD T-LIGHT CANDLES,0
17744,576093,BLOSSOM  IMAGES NOTEBOOK SET,0
17744,576093,PENS ASSORTED FUNNY FACE,0
17744,580875,CERAMIC BOWL WITH STRAWBERRY DESIGN,0
17744,539252,IF YOU CAN'T STAND THE HEAT MUG,0
17744,539252,VINTAGE PINK DECORATIVE PARASOL,0
17744,576093,SMALL DOLLY MIX DESIGN ORANGE BOWL,0
17744,580875,CERAMIC STRAWBERRY CAKE MONEY BANK,0
17744,580875,BALLOON ART MAKE YOUR OWN FLOWERS,0
17744,539252,MAGIC SHEEP WOOL GROWING FROM PAPER,0
17744,548709,ORANGE TV TRAY TABLE,0
17744,576093,ROMANTIC IMAGES NOTEBOOK SET,0
17744,580875,CHOC TRUFFLE GOLD TRINKET POT,0
17744,541699,CERAMIC LOVE HEART MONEY BANK,0
17744,539252,CERAMIC LOVE HEART MONEY BANK,0
17744,548709,APRON MODERN VINTAGE COTTON,0
17744,576093,MOODY GIRL DOOR HANGER,0
17744,580875,PINK POT PLANT CANDLE,0
17744,580875,KNEELING MAT HOUSEWORK  DESIGN,0
17744,541107,HEART T-LIGHT HOLDER,0
17744,580875,LOCAL CAFE MUG,0
17744,580875,SET OF 2 TINS JARDIN DE PROVENCE,0
17744,548709,ROMANTIC IMAGES NOTEBOOK SET,0
17744,580875,LARGE CAKE STAND  HANGING STRAWBERY,0
17744,541699,SKULLS TAPE,0
17744,541699,BOOM BOX SPEAKER GIRLS,0
17744,580875,"NURSERY A,B,C PAINTED LETTERS",0
17744,580875,MUM'S KITCHEN CLOCK,0
17744,580875,MONEY BOX CONFECTIONERY DESIGN,0
17744,541107,HEART CALCULATOR,0
17744,541699,HEARTS GIFT TAPE,0
17744,580875,SET OF 2 TEA TOWELS PING MICROWAVE,0
17744,580875,LARGE YELLOW BABUSHKA NOTEBOOK,0
17744,580875,JOY WOODEN BLOCK LETTERS,0
17744,541107,JAZZ HEARTS PURSE NOTEBOOK,0
17744,548709,SUMMER FUN DESIGN SHOWER CAP,0
17744,580875,PINK DOUGHNUT TRINKET POT,0
17744,580875,PING MICROWAVE APRON,0
17744,580875,SET OF 3 GOLD FLYING DUCKS,0
17744,541107,SWEETHEART CERAMIC TRINKET BOX,0
17744,539252,POTTERING MUG,0
17744,541699,DECORATIVE ROSE BATHROOM BOTTLE,0
17744,541699,VINTAGE BEAD PINK EVENING BAG,0
17744,580875,PING! MICROWAVE PLATE,0
17744,580875,SPOTTY PINK DUCK DOORSTOP,0
17744,576093,ROMANTIC IMAGES GIFT WRAP SET,0
17744,580875,MONEY BOX POCKET MONEY DESIGN,0
17744,580875,SET OF 6 T-LIGHTS CACTI,0
17744,576093,CHRISTMAS PUDDING TRINKET POT,0
17744,541107,CURIOUS  IMAGES NOTEBOOK SET,0
17744,580875,PINK  HEART SHAPE LOVE BUCKET,0
17744,576093,MAGNETS PACK OF 4 VINTAGE COLLAGE,0
17744,580875,CERAMIC PLATE STRAWBERRY DESIGN,0
17744,580875,DOORSTOP FOOTBALL DESIGN,0
17744,541107,RED LOVE HEART SHAPE CUP,0
17744,541699,COLOURING PENCILS BROWN TUBE,0
17744,541699,PENS ASSORTED FUNNY FACE,0
17744,539252,PENS ASSORTED FUNNY FACE,0
17744,576093,FAIRY CAKE FLANNEL ASSORTED COLOUR,0
17744,541107,PACK OF 12 HEARTS DESIGN TISSUES,0
17744,580875,SET OF 6 T-LIGHTS TOADSTOOLS,0
17744,539252,VINTAGE BEAD PINK PURSE,0
17744,580875,SET OF 2 ROUND TINS CAMEMBERT,0
17744,541107,LOVE HEART POCKET WARMER,0
17744,541699,PAPERWEIGHT SAVE THE PLANET,0
17744,576093,MOODY BOY  DOOR HANGER,0
17744,541699,PING! MICROWAVE PLATE,0
17744,541107,RED HEART SHAPE LOVE BUCKET,0
17744,548709,SMALL POPCORN HOLDER,0
17744,576093,BLOSSOM IMAGES GIFT WRAP SET,0
17744,580875,BAG 500g SWIRLY MARBLES,0
17744,580875,WALL ART GARDEN HAVEN,0
17744,541699,S/4 VALENTINE DECOUPAGE HEART BOX,0
17744,539252,SET/6 BLACK BIRD T-LIGHT CANDLES,0
17744,541699,COLOURING PENCILS BROWN TUBE,0
17744,539252,COLOURING PENCILS BROWN TUBE,0
17744,539252,SET OF 4 BLACK LOVEBIRD COASTERS,0
17744,576093,RED CHARLIE+LOLA PERSONAL DOORSIGN,0
17744,580875,RETROSPOT BABUSHKA DOORSTOP,0
17744,580875,SET/6 FROG PRINCE T-LIGHT CANDLES,0
17744,539252,MAGNETS PACK OF 4 VINTAGE LABELS,0
17744,541107,LOVE HEART TRINKET POT,0
17744,580875,PEACE WOODEN BLOCK LETTERS,0
17831,574731,GREEN REGENCY TEACUP AND SAUCER,0
17831,574731,PINK REGENCY TEACUP AND SAUCER,0
