12826,568805,JUMBO BAG WOODLAND ANIMALS,0
12826,581022,LUNCH BAG  BLACK SKULL.,0
12826,542347,JUMBO BAG WOODLAND ANIMALS,0
12826,556681,JUMBO BAG PEARS,0
12826,538107,PAPER CHAIN KIT VINTAGE CHRISTMAS,0
12826,542347,RED RETROSPOT WRAP,0
12826,542347,CHARLOTTE BAG SUKI DESIGN,0
12826,568805,LUNCH BAG VINTAGE DOILY,0
12826,542347,RETROSPOT PARTY BAG + STICKER SET,0
12826,541574,PLASTERS IN TIN WOODLAND ANIMALS,0
12826,542347,PINK BABY BUNTING,0
12826,542347,CHARLOTTE BAG PINK POLKADOT,0
12826,538107,CHARLOTTE BAG SUKI DESIGN,0
12826,538107,36 PENCILS TUBE SKULLS,0
12826,541574,STRAWBERRY CHARLOTTE BAG,0
12826,542347,SPACEBOY BIRTHDAY CARD,0
12826,556681,LUNCH BAG PINK POLKADOT,0
12826,542347,WOODLAND CHARLOTTE BAG,0
12826,568805,JUMBO BAG VINTAGE DOILY,0
12826,568805,LUNCH BAG WOODLAND,0
12826,541574,PACK OF 20 SKULL PAPER NAPKINS,0
12826,542347,JUMBO STORAGE BAG SKULLS,0
12826,575682,JUMBO BAG APPLES,0
12826,575682,SET 36 COLOURING PENCILS DOILY,0
12826,541574,RED RETROSPOT TAPE,0
12826,556681,LUNCH BAG WOODLAND,0
12826,538107,PAPER CHAIN KIT 50'S CHRISTMAS,0
12826,575682,36 PENCILS TUBE SKULLS,0
12826,575682,PAPER CHAIN KIT 50'S CHRISTMAS,0
12826,542347,LUNCH BAG SPACEBOY DESIGN,0
12826,568805,LUNCH BAG APPLE DESIGN,0
12826,568805,36 PENCILS TUBE WOODLAND,0
12826,581022,VINTAGE DOILY JUMBO BAG RED,0
12826,575682,FAWN BLUE HOT WATER BOTTLE,0
12826,541574,PACK OF 72 RETROSPOT CAKE CASES,0
12826,575682,JUMBO BAG WOODLAND ANIMALS,0
12826,542347,LUNCH BAG CARS BLUE,0
12826,542347,WRAP SUKI AND FRIENDS,0
12826,538107,FAWN BLUE HOT WATER BOTTLE,0
12826,538107,WHITE SKULL HOT WATER BOTTLE,0
12826,581022,PAPER CHAIN KIT 50'S CHRISTMAS,0
12826,541574,BLUE POLKADOT WRAP,0
12826,556681,WORLD WAR 2 GLIDERS ASSTD DESIGNS,0
12826,541574,SUKI  SHOULDER BAG,0
12826,542347,LUNCH BAG SUKI  DESIGN,0
12826,568805,LUNCH BAG SUKI DESIGN,0
12826,542347,PAPER CHAIN KIT RETROSPOT,0
12826,542347,LUNCH BAG  BLACK SKULL.,0
12826,542347,CARD SUKI BIRTHDAY,0
12826,575682,PAPER CHAIN KIT VINTAGE CHRISTMAS,0
12826,541574,PINK POLKADOT WRAP,0
12826,556681,JUMBO BAG WOODLAND ANIMALS,0
12826,542347,SPACEBOY GIFT WRAP,0
12826,575682,36 PENCILS TUBE RED RETROSPOT,0
12826,542347,WHITE SKULL HOT WATER BOTTLE,0
12826,581022,JUMBO BAG 50'S CHRISTMAS,0
12826,542347,SMALL RED RETROSPOT WINDMILL,0
12826,538107,36 PENCILS TUBE WOODLAND,0
12826,568805,36 PENCILS TUBE SKULLS,0
12826,542347,SKULLS  WATER TRANSFER TATTOOS,0
12826,568805,JUMBO BAG APPLES,0
12826,556681,LUNCH BAG APPLE DESIGN,0
12826,568805,LUNCH BAG  BLACK SKULL.,0
12826,568805,PACKING CHARGE,0
12826,575682,WHITE SKULL HOT WATER BOTTLE,0
12826,538107,HOT WATER BOTTLE BABUSHKA,0
12826,575682,JUMBO STORAGE BAG SKULLS,0
12826,542347,JUMBO STORAGE BAG SUKI,0
12826,581022,JUMBO BAG PEARS,0
12826,542347,JUMBO BAG OWLS,0
12826,541574,SET/20 RED RETROSPOT PAPER NAPKINS,0
12826,541574,ROUND SNACK BOXES SET OF4 WOODLAND,0
12826,542347,FAWN BLUE HOT WATER BOTTLE,0
12826,541574,SET/6 RED SPOTTY PAPER CUPS,0
12826,581022,PACKING CHARGE,0
12826,575682,PACKING CHARGE,0
12826,542347,RED BABY BUNTING,0
12826,575682,JUMBO BAG 50'S CHRISTMAS,0
12826,575682,JUMBO BAG VINTAGE DOILY,0
12826,538107,PLASTERS IN TIN SKULLS,0
12826,541574,CARROT CHARLIE+LOLA COASTER SET,0
12826,541574,TOMATO CHARLIE+LOLA COASTER SET,0
12826,541574,WOODLAND CHARLOTTE BAG,0
12826,575682,PLASTERS IN TIN SKULLS,0
12826,568805,JUMBO BAG PEARS,0
12826,581022,JUMBO STORAGE BAG SKULLS,0
12826,575682,JUMBO STORAGE BAG SUKI,0
12826,541574,SKULLS TAPE,0
12826,556681,LUNCH BAG  BLACK SKULL.,0
12826,568805,JUMBO STORAGE BAG SKULLS,0
12826,541574,SET/6 RED SPOTTY PAPER PLATES,0
13932,544394,DOORMAT WELCOME SUNRISE,2
13932,544394,ALARM CLOCK BAKELIKE IVORY,2
13932,544394,PACK OF 6 PANNETONE GIFT BOXES,2
13932,544394,ALARM CLOCK BAKELIKE RED,2
13932,544394,RED DINER WALL CLOCK,2
13932,544394,IVORY DINER WALL CLOCK,2
13932,544394,WOODEN CROQUET GARDEN SET,2
13932,544394,ALARM CLOCK BAKELIKE CHOCOLATE,2
13932,544394,IVORY GIANT GARDEN THERMOMETER,2
13932,544394,PACK OF 6 HANDBAG GIFT BOXES,2
13932,544394,REGENCY CAKESTAND 3 TIER,2
13932,544394,BLUE DINER WALL CLOCK,2
13932,544394,ALARM CLOCK BAKELIKE PINK,2
13932,544394,ALARM CLOCK BAKELIKE ORANGE,2
13932,544394,ALARM CLOCK BAKELIKE GREEN,2
13932,544394,ROSES REGENCY TEACUP AND SAUCER,2
13938,574537,SET OF 6 SNACK LOAF BAKING CASES,0
13938,574537,SET OF 12 FAIRY CAKE BAKING CASES,0
13938,574537,RED RETROSPOT CUP,0
13938,574537,CLOTHES PEGS RETROSPOT PACK 24,0
13938,574537,SET OF 12 MINI LOAF BAKING CASES,0
13938,574537,SET OF 6 TEA TIME BAKING CASES,0
13938,574537,RED RETROSPOT CHARLOTTE BAG,0
13974,572231,ROLL WRAP VINTAGE SPOT,0
13974,572231,CHRISTMAS CRAFT WHITE FAIRY,0
13974,572231,CHRISTMAS GINGHAM STAR,0
13974,572231,RED STAR CARD HOLDER,0
13974,572231,50'S CHRISTMAS PAPER GIFT BAG,0
13974,572231,ROLL WRAP 50'S RED CHRISTMAS,0
13974,572231,FELTCRAFT CUSHION OWL,0
13974,572231,CHRISTMAS CRAFT LITTLE FRIENDS,0
13974,572231,WOODEN TREE CHRISTMAS SCANDINAVIAN,0
13974,572231,CHRISTMAS TREE HANGING SILVER,0
13974,572231,6 GIFT TAGS 50'S CHRISTMAS,0
13974,572231,PAPER CHAIN KIT 50'S CHRISTMAS,0
13974,572231,RED SPOT GIFT BAG LARGE,0
13974,572231,CHRISTMAS CRAFT TREE TOP ANGEL,0
13974,572231,GINGHAM RECIPE BOOK BOX,0
13974,572231,3 RAFFIA RIBBONS 50'S CHRISTMAS,0
13974,572231,REINDEER HEART DECORATION SILVER,0
13974,572231,HOT WATER BOTTLE KEEP CALM,0
13974,572231,RED SPOT PAPER GIFT BAG,0
13974,572231,VINTAGE DOILY TRAVEL SEWING KIT,0
13974,572231,LOVE HOT WATER BOTTLE,0
13974,572231,FELTCRAFT CUSHION BUTTERFLY,0
13974,572231,GREEN CHRISTMAS TREE CARD HOLDER,0
13974,572231,ROLL WRAP 50'S CHRISTMAS,0
13974,572231,SET OF 3 WOODEN HEART DECORATIONS,0
13974,572231,50'S CHRISTMAS GIFT BAG LARGE,0
13974,572231,FELTCRAFT PRINCESS CHARLOTTE DOLL,0
13974,572231,PINK CREAM FELT CRAFT TRINKET BOX,0
14068,541862,SET OF 3 CAKE TINS SKETCHBOOK,2
14068,541862,GREY HEART HOT WATER BOTTLE,2
14068,541862,SET OF 3 CAKE TINS PANTRY DESIGN,2
14068,541862,WHITE HANGING HEART T-LIGHT HOLDER,2
14068,541862,GREY HEART HOT WATER BOTTLE,2
14068,541862,HOT WATER BOTTLE I AM SO POORLY,2
14068,541862,TEA TIME DES TEA COSY,2
14068,541862,IVORY KITCHEN SCALES,2
14068,541862,CANDLEHOLDER PINK HANGING HEART,2
14068,541862,SET OF 6 HERB TINS SKETCHBOOK,2
14068,541862,RED KITCHEN SCALES,2
14068,541862,CHOCOLATE HOT WATER BOTTLE,2
14068,541862,SET OF 6 SPICE TINS PANTRY DESIGN,2
14068,541862,TEA TIME OVEN GLOVE,2
14068,541862,RETROSPOT HEART HOT WATER BOTTLE,2
14068,541862,CHARLIE+LOLA PINK HOT WATER BOTTLE,2
14068,541862,SCOTTIE DOG HOT WATER BOTTLE,2
14068,541862,RED HANGING HEART T-LIGHT HOLDER,2
14068,541862,SWEETHEART RECIPE BOOK STAND,2
14068,541862,JAM MAKING SET WITH JARS,2
14068,541862,SET OF 6 SPICE TINS PANTRY DESIGN,2
14068,541862,CERAMIC STRAWBERRY CAKE MONEY BANK,2
14068,541862,FAWN BLUE HOT WATER BOTTLE,2
14068,541862,CERAMIC HEART FAIRY CAKE MONEY BANK,2
14148,550756,BAKING SET SPACEBOY DESIGN,2
14148,550756,BAKING SET 9 PIECE RETROSPOT,2
14148,550756,REGENCY CAKESTAND 3 TIER,2
14226,553149,WHITE BROCANTE SOAP DISH,0
14226,575593,DOORMAT VINTAGE LEAF,0
14226,575593,SET OF 12 FAIRY CAKE BAKING CASES,0
14226,546669,JAM MAKING SET PRINTED,0
14226,546669,HERB MARKER CHIVES,0
14226,575593,SET OF 6 T-LIGHTS SANTA,0
14226,553149,LOVE BUILDING BLOCK WORD,0
14226,553149,SPOTTY BUNTING,0
14226,569079,SET 8 CANDLES VINTAGE DOILY,0
14226,546669,HERB MARKER MINT,0
14226,546669,ASSORTED EASTER GIFT TAGS,0
14226,569079,SET OF 12 FAIRY CAKE BAKING CASES,0
14226,546669,PORCELAIN ROSE SMALL,0
14226,546669,HERB MARKER ROSEMARY,0
14226,553149,SMALL CERAMIC TOP STORAGE JAR,0
14226,553149,PACK OF 12 BLUE PAISLEY TISSUES,0
14226,553149,REGENCY MILK JUG PINK,0
14226,546669,PINK REGENCY TEACUP AND SAUCER,0
14226,546669,REGENCY CAKESTAND 3 TIER,0
14226,546669,PACK 3 BOXES BIRD PANNETONE,0
14226,546669,HANGING CHICK  YELLOW DECORATION,0
14226,553149,REGENCY TEA PLATE GREEN,0
14226,546669,JIGSAW TREE WITH BIRDHOUSE,0
14226,553149,GINGHAM ROSE WRAP,0
14226,575593,HOT WATER BOTTLE I AM SO POORLY,0
14226,569079,HOT WATER BOTTLE KEEP CALM,0
14226,575593,HAND WARMER RED LOVE HEART,0
14226,575593,LOVE HOT WATER BOTTLE,0
14226,569079,SET OF 12 T-LIGHTS VINTAGE DOILY,0
14226,546669,ROSES REGENCY TEACUP AND SAUCER,0
14226,553149,SMALL CERAMIC TOP STORAGE JAR,0
14226,553149,LARGE CERAMIC TOP STORAGE JAR,0
14226,575830,BREAD BIN DINER STYLE IVORY,0
14226,553149,FOOD COVER WITH BEADS SET 2,0
14226,546669,HANGING METAL RABBIT DECORATION,0
14226,553149,REGENCY TEA PLATE ROSES,0
14226,546669,ASSORTED COLOUR BIRD ORNAMENT,0
14226,569079,SET OF 6 SNACK LOAF BAKING CASES,0
14226,569079,GREY HEART HOT WATER BOTTLE,0
14226,546669,HERB MARKER BASIL,0
14226,546669,HANGING CHICK GREEN DECORATION,0
14226,546669,JAM MAKING SET WITH JARS,0
14226,569079,KNITTED UNION FLAG HOT WATER BOTTLE,0
14226,553149,PACK OF 12 PINK PAISLEY TISSUES,0
14226,575593,HAND WARMER BIRD DESIGN,0
14226,575593,60 CAKE CASES VINTAGE CHRISTMAS,0
14226,553149,DOUBLE CERAMIC PARLOUR HOOK,0
14226,553149,MEDIUM CERAMIC TOP STORAGE JAR,0
14226,569079,PAPER CHAIN KIT VINTAGE CHRISTMAS,0
14226,546669,HERB MARKER THYME,0
14226,553149,REGENCY TEA PLATE PINK,0
14226,569079,RECIPE BOX PANTRY YELLOW DESIGN,0
14226,546669,HANGING CHICK CREAM DECORATION,0
14226,575593,RETROSPOT HEART HOT WATER BOTTLE,0
14226,575593,SET OF 4 PANTRY JELLY MOULDS,0
14226,569079,SCOTTIE DOG HOT WATER BOTTLE,0
14226,546669,JIGSAW RABBIT AND BIRDHOUSE,0
14226,575593,VINTAGE CHRISTMAS CAKE FRILL,0
14226,546669,GREEN REGENCY TEACUP AND SAUCER,0
14226,546669,MOROCCAN TEA GLASS,0
14226,575593,BREAD BIN DINER STYLE RED,0
14226,546669,HERB MARKER PARSLEY,0
14226,553149,REGENCY SUGAR BOWL GREEN,0
14226,569079,PLAYING CARDS KEEP CALM & CARRY ON,0
14226,569079,SET OF 12 MINI LOAF BAKING CASES,0
14226,553149,REGENCY TEAPOT ROSES,0
14351,558325,LANTERN CREAM GAZEBO,2
14861,571662,CHRISTMAS HANGING STAR WITH BELL,0
14861,571662,HOT WATER BOTTLE I AM SO POORLY,0
14861,571662,"ACRYLIC HANGING JEWEL,BLUE",0
14861,571662,HOT WATER BOTTLE KEEP CALM,0
14861,571662,HI TEC ALPINE HAND WARMER,0
14861,571662,CHOCOLATE HOT WATER BOTTLE,0
15526,574727,MEDIUM CERAMIC TOP STORAGE JAR,0
15526,574727,SMALL CERAMIC TOP STORAGE JAR,0
15526,574727,PICNIC BASKET WICKER LARGE,0
15526,574729,FOOT STOOL HOME SWEET HOME,0
16140,569638,FELTCRAFT PRINCESS LOLA DOLL,0
16140,569638,HEART OF WICKER SMALL,0
16140,536986,COWBOYS AND INDIANS BIRTHDAY CARD,0
16140,536986,HEART OF WICKER LARGE,0
16140,569638,12 PENCILS TALL TUBE SKULLS,0
16140,569638,TRADITIONAL WOODEN SKIPPING ROPE,0
16140,569638,ZINC FOLKART SLEIGH BELLS,0
16140,536986,MONEY BOX BISCUITS DESIGN,0
16140,569638,HAND WARMER OWL DESIGN,0
16140,569638,ZINC T-LIGHT HOLDER STARS SMALL,0
16140,569638,GINGERBREAD MAN COOKIE CUTTER,0
16140,569638,PLASTERS IN TIN SKULLS,0
16140,569638,36 DOILIES VINTAGE CHRISTMAS,0
16140,536986,WHITE SKULL HOT WATER BOTTLE,0
16140,569638,VINTAGE SNAP CARDS,0
16140,569638,12 PENCILS SMALL TUBE SKULL,0
16140,569638,FELTCRAFT PRINCESS OLIVIA DOLL,0
16140,569638,COLOUR GLASS T-LIGHT HOLDER HANGING,0
16140,536986,WICKER STAR,0
16140,569638,CHRISTMAS METAL TAGS ASSORTED,0
16140,569638,12 PENCIL SMALL TUBE WOODLAND,0
16140,536986,SET OF 20 VINTAGE CHRISTMAS NAPKINS,0
16140,569638,COWBOYS AND INDIANS BIRTHDAY CARD,0
16140,569638,BLUE DINER WALL CLOCK,0
16140,569638,HOT WATER BOTTLE I AM SO POORLY,0
16140,569638,3D TRADITIONAL CHRISTMAS STICKERS,0
16140,569638,FELTCRAFT PRINCESS CHARLOTTE DOLL,0
16140,569638,MINI PLAYING CARDS DOLLY GIRL,0
16140,569638,12 PENCILS TALL TUBE WOODLAND,0
16140,536986,MINI PAINT SET VINTAGE,0
16140,569638,SET OF 20 VINTAGE CHRISTMAS NAPKINS,0
16140,569638,MINI JIGSAW DOLLY GIRL,0
16140,569638,HAND WARMER BIRD DESIGN,0
16140,569638,MAGIC DRAWING SLATE DOLLY GIRL,0
16140,569638,HEART OF WICKER LARGE,0
16519,576349,LANDMARK FRAME LONDON BRIDGE,0
16519,538070,COLOURING PENCILS BROWN TUBE,0
16519,576349,GRAND CHOCOLATECANDLE,0
16519,576349,JUMBO STORAGE BAG SKULLS,0
16519,576349,NEW BAROQUE BLACK BOXES,0
16519,576349,SKULLS STORAGE BOX SMALL,0
16519,538070,BLUE GIANT GARDEN THERMOMETER,0
16519,538070,TWO DOOR CURIO CABINET,0
16519,538070,BLACK KITCHEN SCALES,0
16519,576349,Manual,0
16519,538070,COFFEE MUG DOG + BALL DESIGN,0
16519,576349,CHILDS BREAKFAST SET SPACEBOY,0
16519,576349,LANDMARK FRAME CAMDEN TOWN,0
16897,542601,FRENCH ENAMEL CANDLEHOLDER,2
16897,542601,VINTAGE BILLBOARD DRINK ME MUG,2
16897,542601,BLUE DINER WALL CLOCK,2
16897,542601,JARDIN ETCHED GLASS CHEESE DISH,2
16897,542601,GLASS CLOCHE LARGE,2
16897,542601,POTTING SHED SEED ENVELOPES,2
16897,542601,IVORY DINER WALL CLOCK,2
16897,542601,POTTING SHED TEA MUG,2
16897,542601,SET OF 6 SPICE TINS PANTRY DESIGN,2
16897,542601,DOORMAT UNION FLAG,2
16897,542601,SET OF 6 HERB TINS SKETCHBOOK,2
16897,542601,GLASS  BEURRE DISH,2
16897,542601,RED DRAGONFLY HELICOPTER,2
16897,542601,VINTAGE CREAM 3 BASKET CAKE STAND,2
16897,542601,3 TIER CAKE TIN GREEN AND CREAM,2
16897,543813,REGENCY CAKESTAND 3 TIER,2
16897,543813,SET/4 MODERN VINTAGE COTTON NAPKINS,2
16897,542601,ENAMEL BLUE RIM BISCUIT BIN,2
16897,543813,BLUE CHARLIE+LOLA PERSONAL DOORSIGN,2
16897,543813,POTTERING MUG,2
16897,542601,VINTAGE RED TEATIME MUG,2
16897,542601,DOORMAT FANCY FONT HOME SWEET HOME,2
16897,542601,GLASS CLOCHE SMALL,2
16897,543813,BAKING SET 9 PIECE RETROSPOT,2
16897,542601,RECIPE BOX PANTRY YELLOW DESIGN,2
16897,543813,RED CHARLIE+LOLA PERSONAL DOORSIGN,2
16897,542601,CHICK GREY HOT WATER BOTTLE,2
16897,542601,CHARLIE + LOLA RED HOT WATER BOTTLE,2
16897,542601,ROUND CAKE TIN VINTAGE RED,2
16897,542601,RECIPE BOX RETROSPOT,2
16897,542601,FRENCH BLUE METAL DOOR SIGN 8,2
16897,542601,ROUND CAKE TIN VINTAGE GREEN,2
16897,542601,FRENCH BLUE METAL DOOR SIGN 5,2
16897,543813,BOX OF VINTAGE ALPHABET BLOCKS,2
16897,542601,HOT BATHS SOAP HOLDER,2
16897,542601,SET OF 3 CAKE TINS PANTRY DESIGN,2
16897,542601,DOG BOWL VINTAGE CREAM,2
17772,579286,FRYING PAN UNION FLAG,0
17772,579286,CHRISTMAS CRAFT WHITE FAIRY,0
17772,579286,VINTAGE LEAF MAGNETIC NOTEPAD,0
17772,579286,VINTAGE DOILY DELUXE SEWING KIT,0
17772,579288,SILVER/AMETHYST DROP EARRINGS LEAF,0
17772,579286,PAPER CHAIN KIT 50'S CHRISTMAS,0
17772,579286,HEART CALCULATOR,0
17772,579286,HOME SWEET HOME CUSHION COVER,0
17772,579286,SET/12 FUNKY FELT FLOWER PEG IN BAG,0
17772,579286,ADVENT CALENDAR GINGHAM SACK,0
17772,579286,BINGO SET,0
17772,579286,S/4 PINK FLOWER CANDLES IN BOWL,0
17772,579286,COCKTAIL SWORDS 50 PIECES,0
17772,579286,DOORMAT TOPIARY,0
17772,579286,RABBIT NIGHT LIGHT,0
17772,579286,ANTIQUE SILVER T-LIGHT GLASS,0
17772,579286,SET OF 3 HEART COOKIE CUTTERS,0
17772,579286,BABY MOUSE RED GINGHAM DRESS,0
17772,579288,CRYSTAL HOOP EARRING FLORAL LEAF,0
17772,579286,POSTE FRANCE CUSHION COVER,0
17772,579286,SMALL WHITE HEART OF WICKER,0
17772,579288,STOOL HOME SWEET HOME,0
17772,579286,HAND OVER THE CHOCOLATE   SIGN,0
17772,579286,FULL ENGLISH BREAKFAST PLATE,0
17772,579286,SILVER HEARTS TABLE DECORATION,0
17772,579286,WALL ART HORSE & PONY,0
17772,579286,TOADSTOOL MONEY BOX,0
17772,579286,TRADITIONAL PICK UP STICKS GAME,0
17772,579286,PURPLE GEMSTONE NECKLACE 45CM,0
17772,579286,VINTAGE SNAKES & LADDERS,0
17772,579286,GREEN VINTAGE EARRINGS,0
17772,579286,WOODLAND BUNNIES LOLLY MAKERS,0
17772,579286,SET OF 3 NOTEBOOKS IN PARCEL,0
17772,579286,T-LIGHT HOLDER HANGING LOVE BIRD,0
17772,579286,DOLLY CABINET 3 DRAWERS,0
17772,579286,SMALL HEART MEASURING SPOONS,0
17772,579286,RED SPOT GIFT BAG LARGE,0
17772,579286,GROW YOUR OWN BASIL IN ENAMEL MUG,0
17772,579288,TURQ STONE/CRYSTAL EARRINGS,0
17772,579286,SILVER HOOP EARRINGS WITH FLOWER,0
17772,579286,BOX OF 24 COCKTAIL PARASOLS,0
17772,579286,TRELLIS COAT RACK,0
17772,579286,SET OF 60 VINTAGE LEAF CAKE CASES,0
17772,579286,MILK MAIDS MUG,0
17772,579286,REX CASH+CARRY JUMBO SHOPPER,0
17772,579286,VINTAGE HEADS AND TAILS CARD GAME,0
17772,579286,GARDENERS KNEELING PAD CUP OF TEA,0
17772,579288,CRYSTAL DIAMANTE STAR BROOCH,0
17772,579286,MAKE YOUR OWN MONSOON CARD KIT,0
17772,579286,60 CAKE CASES DOLLY GIRL DESIGN,0
18062,551546,PLASTERS IN TIN SPACEBOY,2
18062,540263,TRADITIONAL WOODEN CATCH CUP GAME,2
18062,557306,RECYCLED ACAPULCO MAT RED,2
18062,540263,STRAWBERRY HONEYCOMB  GARLAND,2
18062,551546,CHILDRENS CUTLERY CIRCUS PARADE,2
18062,551546,CHILDRENS CUTLERY DOLLY GIRL,2
18062,551546,RECYCLED ACAPULCO MAT RED,2
18062,551546,RECYCLED ACAPULCO MAT GREEN,2
18062,551546,PLASTERS IN TIN WOODLAND ANIMALS,2
18062,551546,WOODEN CROQUET GARDEN SET,2
18062,551546,WORLD WAR 2 GLIDERS ASSTD DESIGNS,2
18062,551546,WOODEN UNION JACK BUNTING,2
18062,540263,GUMBALL COAT RACK,2
18062,557306,RECYCLED ACAPULCO MAT LAVENDER,2
18062,557306,RECYCLED ACAPULCO MAT GREEN,2
18062,557306,VINTAGE DONKEY TAIL GAME,2
18062,551546,RECYCLED ACAPULCO MAT PINK,2
18062,557306,GUMBALL COAT RACK,2
18062,540263,MINI FUNKY DESIGN TAPES,2
18062,551546,PLASTERS IN TIN CIRCUS PARADE,2
18062,557306,RECYCLED ACAPULCO MAT TURQUOISE,2
18062,557306,RECYCLED ACAPULCO MAT PINK,2
18062,551546,MINI PAINT SET VINTAGE,2
18062,551546,CHILDRENS CUTLERY SPACEBOY,2
18062,551546,PLASTERS IN TIN STRONGMAN,2
18062,551546,PAPER BUNTING RETROSPOT,2
18062,540263,DOLLY HONEYCOMB GARLAND,2
18204,555124,WOODEN HAPPY BIRTHDAY GARLAND,0
18204,563937,RED METAL BOX TOP SECRET,0
18204,555124,GROW YOUR OWN BASIL IN ENAMEL MUG,0
18204,555124,RECIPE BOX PANTRY YELLOW DESIGN,0
18204,555124,BABY BOOM RIBBONS,0
18204,563937,PAPER CHAIN KIT RETROSPOT,0
18204,568991,SET 6 PAPER TABLE LANTERN STARS,0
18204,568991,BEWARE OF THE CAT METAL SIGN,0
18204,563937,PINK HAPPY BIRTHDAY BUNTING,0
18204,568991,FELTCRAFT DOLL MOLLY,0
18204,563937,"KEY FOB , FRONT  DOOR",0
18204,563937,WOODEN SCHOOL COLOURING SET,0
18204,568991,LARGE WHITE HEART OF WICKER,0
18204,568991,CHRISTMAS TOILET ROLL,0
18204,555124,CHOCOLATE BOX RIBBONS,0
18204,555124,WRAP PINK FAIRY CAKES,0
18204,555124,WRAP SUKI AND FRIENDS,0
18204,555124,CALENDAR PAPER CUT DESIGN,0
18204,563937,SLATE TILE NATURAL HANGING,0
18204,563937,SET OF 10 LED DOLLY LIGHTS,0
18204,563937,GINGERBREAD MAN COOKIE CUTTER,0
18204,555124,PLASTERS IN TIN WOODLAND ANIMALS,0
18204,555124,PLASTERS IN TIN SKULLS,0
18204,555124,SET OF 4 JAM JAR MAGNETS,0
18204,563937,DOORMAT RED RETROSPOT,0
18204,555124,DAISY GARDEN MARKER,0
18204,555124,SCANDINAVIAN REDS RIBBONS,0
18204,555124,"KEY FOB , SHED",0
18204,555124,MOODY BOY  DOOR HANGER,0
18204,555124,BIRDHOUSE GARDEN MARKER,0
18204,563937,GIRAFFE WOODEN RULER,0
18204,563937,36 PENCILS TUBE RED RETROSPOT,0
18204,563937,REGENCY CAKESTAND 3 TIER,0
18204,563937,VINTAGE CREAM CAT FOOD CONTAINER,0
18204,555124,PACK OF 60 DINOSAUR CAKE CASES,0
18204,568991,HAND WARMER RED RETROSPOT,0
18204,563937,CALENDAR PAPER CUT DESIGN,0
18204,555124,OFFICE MUG WARMER BLACK+SILVER,0
18204,555124,FANCY FONTS BIRTHDAY WRAP,0
18204,563937,BLUE HAPPY BIRTHDAY BUNTING,0
18204,568991,6 RIBBONS EMPIRE,0
18204,568991,HAND WARMER BABUSHKA DESIGN,0
18204,568991,CHRISTMAS LIGHTS 10 SANTAS,0
18204,568991,ROTATING LEAVES T-LIGHT HOLDER,0
18204,563937,DOUGHNUT LIP GLOSS,0
18204,568991,WHITE GOOSE FEATHER TREE 60CM,0
18204,555124,ROMANTIC PINKS RIBBONS,0
18204,568991,HAND WARMER OWL DESIGN,0
18204,568991,METAL SIGN HER DINNER IS SERVED,0
18204,568991,SILVER BELLS TABLE DECORATION,0
18204,568991,RIBBON REEL CHRISTMAS SOCK BAUBLE,0
18204,555124,"KEY FOB , BACK DOOR",0
18204,555124,GAOLERS KEYS DECORATIVE GARDEN,0
18204,555124,SET OF SALT AND PEPPER TOADSTOOLS,0
18204,568991,FELTCRAFT CUSHION BUTTERFLY,0
18204,555124,BIRTHDAY PARTY CORDON BARRIER TAPE,0
18204,563937,CREAM WALL PLANTER HEART SHAPED,0
18204,555124,BLUE POLKADOT WRAP,0
18204,568991,RIBBON REEL LACE DESIGN,0
18204,555124,KNEELING MAT HOUSEWORK  DESIGN,0
18204,568991,ICE CREAM PEN LIP GLOSS,0
18204,568991,SET OF 6 RIBBONS VINTAGE CHRISTMAS,0
18204,555124,36 PENCILS TUBE SKULLS,0
18204,568991,SET OF 6 RIBBONS VINTAGE CHRISTMAS,0
18204,555124,12 PENCILS SMALL TUBE SKULL,0
18204,563937,GARDENERS KNEELING PAD KEEP CALM,0
18204,568991,CHRISTMAS LIGHTS 10 REINDEER,0
18204,555124,MAGIC DRAWING SLATE DOLLY GIRL,0
18204,555124,DOORMAT SPOTTY HOME SWEET HOME,0
18204,555124,WOODEN OWLS LIGHT GARLAND,0
18204,568991,3D TRADITIONAL CHRISTMAS STICKERS,0
18204,555124,MINI WOODEN HAPPY BIRTHDAY GARLAND,0
18204,568991,GINGERBREAD MAN COOKIE CUTTER,0
18204,555124,BABY BOOM RIBBONS,0
18204,563937,6 RIBBONS RUSTIC CHARM,0
18204,555124,DOORMAT KEEP CALM AND COME IN,0
18204,555124,DOORMAT UNION FLAG,0
18204,555124,6 RIBBONS RUSTIC CHARM,0
18204,555124,HAND WARMER UNION JACK,0
18204,568991,MISTLETOE HEART WREATH GREEN,0
18204,563937,COLOUR GLASS T-LIGHT HOLDER HANGING,0
18204,563937,SET/10 PINK POLKADOT PARTY CANDLES,0
18204,568991,WHITE SKULL HOT WATER BOTTLE,0
18204,555124,PACK OF 72 SKULL CAKE CASES,0
18204,563937,"KEY FOB , BACK DOOR",0
18204,568991,SET OF 6 NATIVITY MAGNETS,0
18204,555124,PARTY METAL SIGN,0
18204,563937,GARAGE KEY FOB,0
18204,568991,HAND WARMER UNION JACK,0
18204,563937,SET OF 3 NOTEBOOKS IN PARCEL,0
18204,568991,FELTCRAFT BUTTERFLY HEARTS,0
18204,568991,HOT WATER BOTTLE TEA AND SYMPATHY,0
18204,555124,ZINC HERB GARDEN CONTAINER,0
18204,555124,DOORMAT RESPECTABLE HOUSE,0
18204,555124,PAPER CHAIN KIT RETROSPOT,0
18204,555124,"KEY FOB , FRONT  DOOR",0
18204,555124,MAGIC DRAWING SLATE PURDEY,0
18204,555124,DOORMAT HEARTS,0
18204,563937,PARTY METAL SIGN,0
18204,563937,KNEELING MAT HOUSEWORK  DESIGN,0
18204,555124,HEART OF WICKER LARGE,0
18204,568991,6 RIBBONS SHIMMERING PINKS,0
18204,555124,RED HEART SHAPE LOVE BUCKET,0
18204,563937,POTTERING IN THE SHED METAL SIGN,0
18204,563937,SET/10 BLUE POLKADOT PARTY CANDLES,0
18204,568991,ROTATING SILVER ANGELS T-LIGHT HLDR,0
18204,555124,PINK POLKADOT WRAP,0
18204,555124,SPACEBOY LUNCH BOX,0
18204,555124,ICE CREAM SUNDAE LIP GLOSS,0
18204,555124,3 STRIPEY MICE FELTCRAFT,0
18204,568991,3D CHRISTMAS STAMPS STICKERS,0
18204,555124,SCANDINAVIAN REDS RIBBONS,0
18204,568991,FELTCRAFT CHRISTMAS FAIRY,0
18204,555124,FELTCRAFT BUTTERFLY HEARTS,0
18204,568991,ABSTRACT CIRCLES SKETCHBOOK,0
18204,555124,HAND WARMER OWL DESIGN,0
18204,555124,SLATE TILE NATURAL HANGING,0
18204,568991,CHRISTMAS CRAFT LITTLE FRIENDS,0
18204,568991,URBAN BLACK RIBBONS,0
18204,568991,GARDENERS KNEELING PAD CUP OF TEA,0
18204,568991,BLUE HARMONICA IN BOX,0
18204,555124,DOORMAT NEW ENGLAND,0
18204,563937,36 PENCILS TUBE SKULLS,0
18204,555124,WATERING CAN GARDEN MARKER,0
18204,555124,SET/10 RED POLKADOT PARTY CANDLES,0
18204,563937,SET/10 RED POLKADOT PARTY CANDLES,0
18204,568991,HAND WARMER SCOTTY DOG DESIGN,0
18204,563937,"KEY FOB , SHED",0
18204,555124,FUNKY WASHING UP GLOVES ASSORTED,0
18204,568991,DOUGHNUT LIP GLOSS,0
18204,555124,12 MESSAGE CARDS WITH ENVELOPES,0
18204,555124,"KEY FOB , GARAGE DESIGN",0
18204,555124,MAGIC DRAWING SLATE BAKE A CAKE,0
18204,568991,HAND WARMER BIRD DESIGN,0
18204,555124,CHOCOLATE BOX RIBBONS,0
18204,555124,PAPER CHAIN KIT SKULLS,0
18204,563937,SMALL RED RETROSPOT WINDMILL,0
18204,555124,SET/10 BLUE POLKADOT PARTY CANDLES,0
18204,555124,PLASTERS IN TIN SPACEBOY,0
18204,563937,PACK OF 12 TRADITIONAL CRAYONS,0
18204,568991,RETROSPOT GIANT TUBE MATCHES,0
18204,568991,RIBBON REEL SNOWY VILLAGE,0
18204,555124,GARDENERS KNEELING PAD KEEP CALM,0
18204,555124,MAGIC DRAWING SLATE SPACEBOY,0
18204,568991,LARGE WHITE HEART OF WICKER,0
18204,568991,HAND WARMER RED LOVE HEART,0
18204,568991,GREEN GOOSE FEATHER TREE 60CM,0
18204,568991,PACK OF SIX LED TEA LIGHTS,0
18204,555124,PINK CREAM FELT CRAFT TRINKET BOX,0
18204,568991,LOVE HOT WATER BOTTLE,0
18204,563937,VINTAGE CREAM DOG FOOD CONTAINER,0
18204,563937,CHOCOLATE THIS WAY METAL SIGN,0
18204,568991,TRADITIONAL CHRISTMAS RIBBONS,0
18204,563937,BLACK RECORD COVER FRAME,0
18204,555124,OPEN CLOSED METAL SIGN,0
18204,555124,CERAMIC CHERRY CAKE MONEY BANK,0
18204,568991,PAPER CHAIN KIT 50'S CHRISTMAS,0
18204,568991,RED  HARMONICA IN BOX,0
18204,563937,I'M ON HOLIDAY METAL SIGN,0
18204,555124,3 PIECE SPACEBOY COOKIE CUTTER SET,0
18204,568991,PINK GOOSE FEATHER TREE 60CM,0
18204,555124,VINTAGE UNION JACK BUNTING,0
18204,563937,LARGE DECO JEWELLERY STAND,0
18204,568991,PARTY METAL SIGN,0
18204,568991,ROMANTIC PINKS RIBBONS,0
18204,568991,DOORMAT MERRY CHRISTMAS RED,0
18204,555124,PAPER CHAIN KIT EMPIRE,0
18204,555124,FELTCRAFT CHRISTMAS FAIRY,0
18204,563937,BABUSHKA LIGHTS STRING OF 10,0
18204,568991,PINK BLUE FELT CRAFT TRINKET BOX,0
18204,563937,36 PENCILS TUBE WOODLAND,0
18204,555124,CLOTHES PEGS RETROSPOT PACK 24,0
18204,563937,PACK OF 12 COLOURED PENCILS,0
18204,555124,MOODY GIRL DOOR HANGER,0
18204,555124,SET OF 3 BUTTERFLY COOKIE CUTTERS,0
18204,563937,GLAMOROUS  MUG,0
18204,568991,SCANDINAVIAN REDS RIBBONS,0
18204,555124,DOORMAT RED RETROSPOT,0
18204,568991,GARDENERS KNEELING PAD KEEP CALM,0
18204,568991,HOT WATER BOTTLE I AM SO POORLY,0
18204,555124,HEART OF WICKER SMALL,0
18204,555124,GROW YOUR OWN BASIL IN ENAMEL MUG,0
18204,563937,DOORMAT HOME SWEET HOME BLUE,0
18204,555124,SET/10 PINK POLKADOT PARTY CANDLES,0
18204,555124,HAND WARMER RED RETROSPOT,0
18204,555124,PLASTERS IN TIN STRONGMAN,0
18204,555124,SKULLS AND CROSSBONES WRAP,0
18204,555124,CITRONELLA CANDLE GARDEN POT,0
18204,563937,ANTIQUE SILVER T-LIGHT GLASS,0
18204,555124,CERAMIC STRAWBERRY CAKE MONEY BANK,0
18204,555124,KEEP OUT BOYS DOOR HANGER,0
18204,563937,GIN + TONIC DIET METAL SIGN,0
18255,566265,SILVER HANGING T-LIGHT HOLDER,0
18255,566265,RED RETROSPOT SMALL MILK JUG,0
18255,566265,WHITE HANGING HEART T-LIGHT HOLDER,0
18255,566265,ZINC HEART FLOWER T-LIGHT HOLDER,0
18255,566265,ANTIQUE SILVER T-LIGHT GLASS,0
18255,566265,COLOUR GLASS T-LIGHT HOLDER HANGING,0
