12939,546411,FELTCRAFT CUSHION RABBIT,1
12939,543829,PINK 3 PIECE POLKADOT CUTLERY SET,1
12939,561048,CHILDRENS CUTLERY POLKADOT PINK,1
12939,569858,CHILDRENS CUTLERY POLKADOT PINK,1
12939,543829,PINK  POLKADOT PLATE,1
12939,567634,JUMBO BAG PINK VINTAGE PAISLEY,1
12939,561048,PINK POLKADOT BOWL,1
12939,567634,JUMBO BAG RED RETROSPOT,1
12939,569858,CHILDRENS CUTLERY POLKADOT BLUE,1
12939,567633,CHILDRENS CUTLERY RETROSPOT RED,1
12939,543829,PINK POLKADOT BOWL,1
12939,543829,BLUE 3 PIECE POLKADOT CUTLERY SET,1
12939,561048,CHILDRENS CUTLERY POLKADOT BLUE,1
12939,540507,FELTCRAFT CUSHION BUTTERFLY,1
12939,543829,FELTCRAFT CUSHION RABBIT,1
12939,546411,JUMBO BAG WOODLAND ANIMALS,1
12939,543829,PINK  POLKADOT CUP,1
12939,569857,FELTCRAFT CUSHION OWL,1
12939,561048,RED RETROSPOT BOWL,1
12939,567634,FELTCRAFT CUSHION BUTTERFLY,1
12939,546411,FELTCRAFT CUSHION OWL,1
12939,567633,BLUE POLKADOT BOWL,1
12939,569858,PINK  POLKADOT CUP,1
12939,569857,JUMBO BAG WOODLAND ANIMALS,1
12939,569858,RED RETROSPOT PLATE,1
12939,569857,FELTCRAFT CUSHION RABBIT,1
12939,543829,RED RETROSPOT CUP,1
12939,569857,JUMBO BAG RED RETROSPOT,1
12939,569857,JUMBO BAG PINK VINTAGE PAISLEY,1
12939,543829,BLUE POLKADOT BOWL,1
12939,543829,RED RETROSPOT PLATE,1
12939,543829,FELTCRAFT CUSHION BUTTERFLY,1
12939,540507,SCOTTIE DOG HOT WATER BOTTLE,1
12939,546411,FELTCRAFT CUSHION BUTTERFLY,1
12939,567634,JUMBO BAG WOODLAND ANIMALS,1
12939,561048,RED RETROSPOT CUP,1
12939,540507,KNITTED UNION FLAG HOT WATER BOTTLE,1
12939,540507,FELTCRAFT CUSHION RABBIT,1
12939,546411,JUMBO BAG RED RETROSPOT,1
12939,540507,FELTCRAFT CUSHION OWL,1
12939,543829,RED 3 PIECE RETROSPOT CUTLERY SET,1
12939,540507,RED WOOLLY HOTTIE WHITE HEART.,1
12939,569858,PINK  POLKADOT PLATE,1
12939,543829,BLUE POLKADOT PLATE,1
12939,543829,BLUE POLKADOT CUP,1
12939,543829,RED RETROSPOT BOWL,1
12939,543829,FELTCRAFT CUSHION OWL,1
12988,544463,CHOCOLATE THIS WAY METAL SIGN,2
12988,544463,WHITE VINT ART DECO CRYSTAL NECKLAC,2
12988,544463,SUKI  SHOULDER BAG,2
12988,544463,GLASS BEAD HOOP NECKLACE MONTANA,2
12988,544463,COPPER/OLIVE GREEN FLOWER NECKLACE,2
12988,544463,SCANDINAVIAN PAISLEY PICNIC BAG,2
12988,544463,FELT FARM ANIMAL SHEEP,2
12988,544463,FELT FARM ANIMAL SHEEP,2
12988,544463,VINTAGE UNION JACK APRON,2
12988,544463,RED COAT RACK PARIS FASHION,2
12988,544463,SILVER LARIAT 40CM,2
12988,544463,FRENCH ENAMEL WATER BASIN,2
12988,544463,YELLOW COAT RACK PARIS FASHION,2
12988,544463,STRAWBERRY   PICNIC BAG,2
12988,544463,WHITE/PINK CHICK EASTER DECORATION,2
12988,544463,PLEASE ONE PERSON METAL SIGN,2
12988,544463,WHITE VINTAGE CRYSTAL BRACELET,2
12988,544463,LONG SILVER NECKLACE PASTEL FLOWER,2
12988,544463,HAPPY EASTER HANGING DECORATION,2
12988,544463,WHITE/PINK CHICK DECORATION,2
12988,544463,DECORATION  PINK CHICK MAGIC GARDEN,2
12988,544463,TURQ+RED BOUDICCA LARGE BRACELET,2
12988,544463,SKULL SHOULDER BAG,2
12988,544463,HEART OF WICKER LARGE,2
12988,544463,CREAM FELT EASTER EGG BASKET,2
12988,544463,NEW BAROQUE B'FLY NECKLACE GREEN,2
12988,544463,MIDNIGHT BLUE COPPER FLOWER NECKLAC,2
12988,544463,FELT FARM ANIMAL CHICKEN,2
12988,544463,METAL SIGN HER DINNER IS SERVED,2
12988,544463,PINK FELT EASTER RABBIT GARLAND,2
12988,544463,GOLD/M.O.P PENDANT ORBIT NECKLACE,2
12988,544463,GOLD M PEARL  ORBIT NECKLACE,2
12988,544463,MOUSEY LONG LEGS SOFT TOY,2
12988,544463,S/2 ZINC HEART DESIGN PLANTERS,2
12988,544463,RED RETROSPOT SHOPPER BAG,2
12988,544463,CANDLEHOLDER PINK HANGING HEART,2
12988,544463,SET OF 3 BIRD LIGHT PINK FEATHER,2
12988,544463,20 DOLLY PEGS RETROSPOT,2
12988,544463,OWL DOORSTOP,2
12988,544463,GOLD M.O.P ORBIT DROP EARRINGS,2
12988,544463,CANDLEHOLDER PINK HANGING HEART,2
12988,544463,FELT EGG COSY WHITE RABBIT,2
12988,544463,RASPBERRY ANT COPPER FLOWER NECKLAC,2
12988,544463,ASSORTED COLOUR BIRD ORNAMENT,2
12988,544463,WOODEN REGATTA BUNTING,2
12988,544463,BUNNY DECORATION MAGIC GARDEN,2
12988,544463,PINK BOUDICCA LARGE BRACELET,2
12988,544463,PINK VINTAGE PAISLEY PICNIC BAG,2
12988,544463,GREEN JUICY FRUIT PHOTO FRAME,2
12988,544463,FELT FARM ANIMAL RABBIT,2
12988,544463,GLASS BEAD HOOP NECKLACE GREEN,2
12988,544463,HAPPY EASTER HANGING DECORATION,2
12988,544463,PAPER BUNTING RETROSPOT,2
12988,544463,WOODEN FRAME ANTIQUE WHITE,2
12988,544463,FELT TOADSTOOL LARGE,2
12988,544463,WHITE VINTAGE CRYSTAL EARRINGS,2
12988,544463,MR ROBOT SOFT TOY,2
12988,544463,DECORATION  BUTTERFLY  MAGIC GARDEN,2
12988,544463,ENAMEL MEASURING JUG CREAM,2
12988,544463,GLASS BEAD HOOP NECKLACE AMETHYST,2
12988,544463,CHUNKY SILVER NECKLACE PASTEL FLOWE,2
12988,544463,SILVER BRACELET W PASTEL FLOWER,2
12988,544463,PINK FELT EASTER RABBIT GARLAND,2
12988,544463,FELT FARM ANIMAL SHEEP,2
12988,544463,MAN FLU METAL SIGN,2
12988,544463,DECORATION WHITE CHICK MAGIC GARDEN,2
12988,544463,BLACK CHUNKY BEAD BRACELET W STRAP,2
12988,544463,NEW BAROQUE B'FLY NECKLACE CRYSTAL,2
12988,544463,BAKING SET 9 PIECE RETROSPOT,2
12988,544463,VINTAGE UNION JACK MEMOBOARD,2
12988,544463,FELT EGG COSY CHICKEN,2
12988,544463,BLUE JUICY FRUIT PHOTO FRAME,2
12988,544463,MRS ROBOT SOFT TOY,2
12988,544463,BLUE FELT EASTER EGG BASKET,2
12988,544463,HEART OF WICKER LARGE,2
12988,544463,BLUE COAT RACK PARIS FASHION,2
12988,544463,I'M ON HOLIDAY METAL SIGN,2
12988,544463,PINK  HEART SHAPE LOVE BUCKET,2
12988,544463,FLORAL PINK MONSTER,2
12988,544463,EASTER TIN CHICKS IN GARDEN,2
12988,544463,FELT EGG COSY CHICKEN,2
12988,544463,REGENCY CAKESTAND 3 TIER,2
12988,544463,FELT FARM ANIMAL CHICKEN,2
13569,578017,CARDHOLDER GINGHAM CHRISTMAS TREE,0
13569,578017,LIPSTICK PEN RED,0
13569,537595,FREESTYLE CANVAS ART PICTURE,0
13569,578017,JUMBO BAG VINTAGE DOILY,0
13569,578017,EGG FRYING PAN BLUE,0
13569,578017,DOORMAT SPOTTY HOME SWEET HOME,0
13569,537595,JUMBO BAG PINK VINTAGE PAISLEY,0
13569,578017,PACK OF 72 SKULL CAKE CASES,0
13569,578017,LIPSTICK PEN RED,0
13569,578017,PINK REGENCY TEACUP AND SAUCER,0
13569,578017,ABSTRACT CIRCLES SKETCHBOOK,0
13569,537595,"SET 3 RETROSPOT TEA,COFFEE,SUGAR",0
13569,537595,WHITE SKULL HOT WATER BOTTLE,0
13569,578017,SILVER STARS TABLE DECORATION,0
13569,578017,POPCORN HOLDER,0
13569,578017,HOME SWEET HOME BLACKBOARD,0
13569,578017,12 PENCILS SMALL TUBE RED RETROSPOT,0
13569,578017,ROUND SNACK BOXES SET OF4 WOODLAND,0
13569,578017,NEW BAROQUE JEWELLERY BOX,0
13569,537595,WOOD 2 DRAWER CABINET WHITE FINISH,0
13569,578017,FUNKY WASHING UP GLOVES ASSORTED,0
13569,578017,BLACK RECORD COVER FRAME,0
13569,537595,FUNKY WASHING UP GLOVES ASSORTED,0
13569,578017,LUNCH BAG CARS BLUE,0
13569,578017,ASSORTED TUTTI FRUTTI PEN,0
13569,537595,CUBIC MUG FLOCK BLUE ON BROWN,0
13569,537595,SET3 BOOK BOX GREEN GINGHAM FLOWER,0
13569,578017,Manual,0
13569,578017,SILVER HANGING T-LIGHT HOLDER,0
13569,578017,SPACEBOY LUNCH BOX,0
13569,578017,T-LIGHT GLASS FLUTED ANTIQUE,0
13569,578017,CHERRY BLOSSOM  DECORATIVE FLASK,0
13569,578017,VINTAGE LEAF MAGNETIC NOTEPAD,0
13569,578017,ROUND SNACK BOXES SET OF 4 FRUITS,0
13569,578017,JUMBO STORAGE BAG SUKI,0
13569,537595,SCENTED VELVET LOUNGE CANDLE,0
13569,578017,"FANCY FONT BIRTHDAY CARD,",0
13569,578017,BLUE POLKADOT CUP,0
13569,537595,BLACK KITCHEN SCALES,0
13569,578017,LUNCH BAG PINK POLKADOT,0
13569,537595,CUBIC MUG FLOCK PINK ON BROWN,0
13569,537595,AFGHAN SLIPPER SOCK PAIR,0
13569,578017,THREE MINI HANGING FRAMES,0
13569,578017,PAINT YOUR OWN CANVAS SET,0
13569,578017,PLASTERS IN TIN SPACEBOY,0
13569,537595,KNITTED UNION FLAG HOT WATER BOTTLE,0
13569,578017,RECIPE BOX PANTRY YELLOW DESIGN,0
13569,578017,LUNCH BAG RED VINTAGE DOILY,0
13569,578017,FELTCRAFT DOLL EMILY,0
13569,537595,KINGS CHOICE GIANT TUBE MATCHES,0
13569,578017,PACK OF 60 SPACEBOY CAKE CASES,0
13569,578017,POPCORN HOLDER,0
13569,578017,BREAD BIN DINER STYLE IVORY,0
13569,578017,IVORY STRING CURTAIN WITH POLE,0
13569,578017,GLASS STAR FROSTED T-LIGHT HOLDER,0
13569,578017,DOORMAT NEW ENGLAND,0
13569,578017,RETROSPOT GIANT TUBE MATCHES,0
13569,578017,WHITE HANGING HEART T-LIGHT HOLDER,0
13569,537595,SKULL DESIGN TV DINNER TRAY,0
13569,537595,SET/3 OCEAN SCENT CANDLE JEWEL BOX,0
13569,578017,GIN + TONIC DIET METAL SIGN,0
13569,537595,TOOTHPASTE TUBE PEN,0
13569,537595,RECIPE BOX PANTRY YELLOW DESIGN,0
13569,578017,GLASS APOTHECARY BOTTLE PERFUME,0
13569,537595,HANGING HEART MIRROR DECORATION,0
13569,578017,CHRISTMAS STAR WISH LIST CHALKBOARD,0
13569,537595,BOX OF 24 COCKTAIL PARASOLS,0
13569,578017,CLASSIC METAL BIRDCAGE PLANT HOLDER,0
13569,537595,FAWN BLUE HOT WATER BOTTLE,0
13569,578017,SILVER HEARTS TABLE DECORATION,0
13569,537595,PORCELAIN BUTTERFLY OIL BURNER,0
13569,578017,SET3 BOOK BOX GREEN GINGHAM FLOWER,0
13569,537595,SMALL POPCORN HOLDER,0
13569,578017,DOORMAT TOPIARY,0
13569,578017,JUMBO BAG PINK POLKADOT,0
13569,578017,HOME BUILDING BLOCK WORD,0
13569,578017,LUNCH BAG  BLACK SKULL.,0
13569,578017,WOODEN STAR CHRISTMAS SCANDINAVIAN,0
13569,578017,SET 12 COLOUR PENCILS SPACEBOY,0
13680,540275,LUNCH BOX WITH CUTLERY RETROSPOT,1
13680,540275,JUMBO  BAG BAROQUE BLACK WHITE,1
13680,540275,60 TEATIME FAIRY CAKE CASES,1
13680,540033,HOUSE WRECKING METAL SIGN,1
13680,540033,WRAP PINK FAIRY CAKES,1
13680,581404,GARDENERS KNEELING PAD KEEP CALM,1
13680,540033,DOORMAT FAIRY CAKE,1
13680,573548,CHOCOLATE HOT WATER BOTTLE,1
13680,573548,COOK WITH WINE METAL SIGN,1
13680,540275,CHILLI LIGHTS,1
13680,581404,CINAMMON & ORANGE WREATH,1
13680,581404,GARDENERS KNEELING PAD CUP OF TEA,1
13680,540033,CERAMIC CHERRY CAKE MONEY BANK,1
13680,573548,SILVER STARS TABLE DECORATION,1
13680,581404,ROSE CARAVAN DOORSTOP,1
13680,540275,JUMBO BAG OWLS,1
13680,581404,YOU'RE CONFUSING ME METAL SIGN,1
13680,540033,DOORMAT WELCOME TO OUR HOME,1
13680,540033,CERAMIC CAKE DESIGN SPOTTED MUG,1
13680,573548,HANGING HEART ZINC T-LIGHT HOLDER,1
13680,581404,METAL SIGN DROP YOUR PANTS,1
13680,573548,RED RETROSPOT BOWL,1
13680,581404,HAND OVER THE CHOCOLATE   SIGN,1
13680,540033,MAN FLU METAL SIGN,1
13680,581404,BAKING MOULD HEART WHITE CHOCOLATE,1
13680,540033,PARTY INVITES WOODLAND,1
13680,540275,WOODLAND CHARLOTTE BAG,1
13680,581404,RECIPE BOX RETROSPOT,1
13680,581404,GIANT 50'S CHRISTMAS CRACKER,1
13680,540033,TRADITIONAL MODELLING CLAY,1
13680,573548,HANGING HEART JAR T-LIGHT HOLDER,1
13680,581404,HOME SWEET HOME HANGING HEART,1
13680,581404,WICKER WREATH SMALL,1
13680,540033,PARTY INVITES FOOTBALL,1
13680,540033,SPACEBOY CHILDRENS EGG CUP,1
13680,540275,LUNCH BAG  BLACK SKULL.,1
13680,573548,HOT WATER BOTTLE SEX BOMB,1
13680,573548,DECORATIVE WICKER HEART LARGE,1
13680,573548,WOODEN TREE CHRISTMAS SCANDINAVIAN,1
13680,581404,STRAWBERRY BATH SPONGE,1
13680,573548,WICKER STAR,1
13680,573548,PINK POLKADOT BOWL,1
13680,573548,WHITE HANGING HEART T-LIGHT HOLDER,1
13680,573548,GIN + TONIC DIET METAL SIGN,1
13680,573548,ZINC T-LIGHT HOLDER STAR LARGE,1
13680,573548,WOODEN HEART CHRISTMAS SCANDINAVIAN,1
13680,540033,SINGLE HEART ZINC T-LIGHT HOLDER,1
13680,581404,CREAM HANGING HEART T-LIGHT HOLDER,1
13680,540033,MORE BUTTER METAL SIGN,1
13680,540033,PACK OF 12 COLOURED PENCILS,1
13680,581404,WALL ART KEEP CALM,1
13680,573548,SMALL CHOCOLATES PINK BOWL,1
13680,573548,SILVER HEARTS TABLE DECORATION,1
13680,581404,LOVE BUILDING BLOCK WORD,1
13680,581404,RETROSPOT BABUSHKA DOORSTOP,1
13680,540033,COOK WITH WINE METAL SIGN,1
13680,581404,HANGING HEART BONHEUR,1
13680,540033,CARD CIRCUS PARADE,1
13680,540033,STRAWBERRY FAIRY CAKE TEAPOT,1
13680,540033,RED HANGING HEART T-LIGHT HOLDER,1
13680,540275,ROUND SNACK BOXES SET OF 4 FRUITS,1
13680,540033,WOODEN SCHOOL COLOURING SET,1
13680,573548,ZINC METAL HEART DECORATION,1
13680,581404,HOT WATER BOTTLE TEA AND SYMPATHY,1
13680,581404,CHRISTMAS TOILET ROLL,1
13680,540033,NO SINGING METAL SIGN,1
13680,573548,LADIES & GENTLEMEN METAL SIGN,1
13680,573548,PINK POLKADOT WRAP,1
13680,581404,LADIES & GENTLEMEN METAL SIGN,1
13680,581404,HAND WARMER SCOTTY DOG DESIGN,1
13680,581404,STORAGE TIN HOME SWEET HOME,1
13680,540033,RED RETROSPOT TRADITIONAL TEAPOT,1
13680,581404,CHOCOLATE THIS WAY METAL SIGN,1
13680,573548,PLACE SETTING WHITE HEART,1
13680,581404,RECIPE BOX PANTRY YELLOW DESIGN,1
13680,581404,GINGHAM BABUSHKA DOORSTOP,1
13680,540033,PARTY INVITES JAZZ HEARTS,1
13680,581404,CERAMIC CHERRY CAKE MONEY BANK,1
13680,573548,STAR T-LIGHT HOLDER WILLIE WINKIE,1
13680,581404,RETROSPOT CIGAR BOX MATCHES,1
13680,540275,LUNCH BAG WOODLAND,1
13680,540033,RED RETROSPOT PEG BAG,1
13680,581404,VINTAGE DOILY DELUXE SEWING KIT,1
13680,540033,PINK FAIRY CAKE CHILDRENS APRON,1
13680,573548,BEWARE OF THE CAT METAL SIGN,1
13680,540033,DOORMAT AIRMAIL,1
13680,581404,BAKING MOULD TOFFEE CUP CHOCOLATE,1
13680,540275,JUMBO BAG PINK POLKADOT,1
13680,581404,GRAND CHOCOLATECANDLE,1
13680,573548,GREEN POLKADOT BOWL,1
13680,540275,TEA TIME PARTY BUNTING,1
13680,540033,HANGING HEART ZINC T-LIGHT HOLDER,1
13680,573548,RED RETROSPOT WRAP,1
13680,573548,SMALL MARSHMALLOWS PINK BOWL,1
13680,540033,METAL SIGN NEIGHBOURHOOD WITCH,1
13680,540033,GIN & TONIC DIET GREETING CARD,1
13680,573548,WHITE WICKER STAR,1
13680,573548,HEART OF WICKER LARGE,1
13680,573548,SET OF 3 WOODEN STOCKING DECORATION,1
13680,540033,CHOCOLATE THIS WAY METAL SIGN,1
13680,540033,JUMBO BAG TOYS,1
13680,573548,HOT STUFF HOT WATER BOTTLE,1
13680,573548,BLUE POLKADOT BOWL,1
13680,573548,HOT WATER BOTTLE KEEP CALM,1
13680,581404,EGG FRYING PAN MINT,1
13680,540033,LADIES & GENTLEMEN METAL SIGN,1
13680,581404,APPLE BATH SPONGE,1
13680,573548,DECORATIVE WICKER HEART MEDIUM,1
13680,540275,PINK 3 PIECE POLKADOT CUTLERY SET,1
13680,573548,RED WOOLLY HOTTIE WHITE HEART.,1
13680,581404,WICKER STAR,1
13680,540033,SOLDIERS EGG CUP,1
13680,540275,LUNCH BAG CARS BLUE,1
13680,540275,LUNCH BAG RED RETROSPOT,1
13680,581404,SET/5 RED RETROSPOT LID GLASS BOWLS,1
13680,573548,HEART OF WICKER SMALL,1
13680,581404,DOORSTOP FOOTBALL DESIGN,1
13680,581404,GINGHAM HEART  DOORSTOP RED,1
13680,540275,ROUND SNACK BOXES SET OF4 WOODLAND,1
13680,573548,GINGHAM HEART  DOORSTOP RED,1
13680,581404,BAKING MOULD HEART MILK CHOCOLATE,1
13680,573548,SINGLE HEART ZINC T-LIGHT HOLDER,1
13680,581404,HANGING HEART BONHEUR,1
13680,581404,PLEASE ONE PERSON METAL SIGN,1
13680,540033,PINK DOUGHNUT TRINKET POT,1
13680,573548,SWEETHEART WALL TIDY,1
13680,573548,ZINC T-LIGHT HOLDER STARS SMALL,1
13680,573548,WOODEN FRAME ANTIQUE WHITE,1
13680,540275,JUMBO BAG WOODLAND ANIMALS,1
13680,581404,GIN AND TONIC DIET METAL SIGN,1
13680,573548,TOILET SIGN OCCUPIED OR VACANT,1
13680,581404,PLAYING CARDS KEEP CALM & CARRY ON,1
13680,573548,POTTERING IN THE SHED METAL SIGN,1
13680,581404,COOK WITH WINE METAL SIGN,1
13680,581404,N0 SINGING METAL SIGN,1
13680,573548,PINK PAISLEY ROSE GIFT WRAP,1
13680,540033,PARTY INVITES BALLOON GIRL,1
13680,573548,WRAP 50'S  CHRISTMAS,1
13680,540033,CANDLEHOLDER PINK HANGING HEART,1
13680,540275,JUMBO BAG RED RETROSPOT,1
13680,573548,TREE T-LIGHT HOLDER WILLIE WINKIE,1
13680,573548,LADIES & GENTLEMEN METAL SIGN,1
13680,581404,HAND WARMER RED RETROSPOT,1
13680,581404,HEART OF WICKER SMALL,1
13680,581404,BAKING MOULD ROSE MILK CHOCOLATE,1
13680,573548,WRAP DAISY CARPET,1
13680,573548,WOODEN PICTURE FRAME WHITE FINISH,1
13680,581404,EGG FRYING PAN BLUE,1
13680,540033,FAIRY SOAP SOAP HOLDER,1
13680,540033,DOORMAT RESPECTABLE HOUSE,1
13680,581404,CERAMIC STRAWBERRY DESIGN MUG,1
13680,540033,RED RETROSPOT WRAP,1
13680,581404,WHITE WICKER STAR,1
13680,573548,RETROSPOT HEART HOT WATER BOTTLE,1
13680,581404,BAKING MOULD ROSE WHITE CHOCOLATE,1
13680,581404,HEART OF WICKER LARGE,1
13680,573548,T-LIGHT HOLDER HANGING LACE,1
13680,540033,PLEASE ONE PERSON METAL SIGN,1
13680,573548,HEART T-LIGHT HOLDER WILLIE WINKIE,1
13680,573548,WOODEN STAR CHRISTMAS SCANDINAVIAN,1
13680,581404,CERAMIC HEART FAIRY CAKE MONEY BANK,1
13680,540033,BLUE POLKADOT WRAP,1
13680,581404,HOME SWEET HOME HANGING HEART,1
13680,540275,SET/3 RED GINGHAM ROSE STORAGE BOX,1
13680,581404,EGG FRYING PAN PINK,1
13680,573548,LARGE WHITE HEART OF WICKER,1
13680,540033,PARTY INVITES DINOSAURS,1
13680,540275,SMALL POPCORN HOLDER,1
13680,540033,ROBOT BIRTHDAY CARD,1
13680,540033,GIN + TONIC DIET METAL SIGN,1
13680,573548,SET OF 3 WOODEN TREE DECORATIONS,1
13680,581404,SMALL WHITE HEART OF WICKER,1
13680,573548,PACK OF SIX LED TEA LIGHTS,1
13680,581404,METAL SIGN TAKE IT OR LEAVE IT,1
13680,581404,JUMBO BAG 50'S CHRISTMAS,1
13680,540033,WHITE HANGING HEART T-LIGHT HOLDER,1
13680,540275,PICNIC BOXES SET OF 3 RETROSPOT,1
13680,540033,TOYBOX  WRAP,1
13680,573548,HOT WATER BOTTLE TEA AND SYMPATHY,1
13680,573548,HOT BATHS METAL SIGN,1
13680,573548,DOORMAT KEEP CALM AND COME IN,1
13680,540033,DOORMAT UNION FLAG,1
13680,540275,RED 3 PIECE RETROSPOT CUTLERY SET,1
13680,573548,SET OF 3 WOODEN SLEIGH DECORATIONS,1
13680,581404,GINGERBREAD MAN COOKIE CUTTER,1
13680,540033,RED 3 PIECE RETROSPOT CUTLERY SET,1
13680,573548,METAL SIGN NEIGHBOURHOOD WITCH,1
13680,581404,PACK OF SIX LED TEA LIGHTS,1
13680,540033,HOT BATHS SOAP HOLDER,1
13680,581404,HOT BATHS METAL SIGN,1
13680,573548,METAL SIGN DROP YOUR PANTS,1
13680,573548,DOORSTOP RETROSPOT HEART,1
13680,540033,PINK POLKADOT WRAP,1
13680,581404,HAND WARMER UNION JACK,1
14484,572079,ASSORTED COLOUR BIRD ORNAMENT,0
14484,572079,LUNCH BAG VINTAGE DOILY,0
14484,572079,GLASS APOTHECARY BOTTLE TONIC,0
14484,572079,T-LIGHT GLASS FLUTED ANTIQUE,0
14484,572079,GLASS APOTHECARY BOTTLE ELIXIR,0
14484,572079,ROLL WRAP VINTAGE SPOT,0
14484,572079,RED SPOT GIFT BAG LARGE,0
14484,572079,LAVENDER TOILETTE BOTTLE,0
14484,572079,HEART BEADED TRELLIS DECORATION,0
14484,572079,ANGEL DECORATION 3 BUTTONS,0
14484,572079,RED SPOT PAPER GIFT BAG,0
14484,572079,FLUTED ANTIQUE CANDLE HOLDER,0
14484,572079,CLASSIC GLASS COOKIE JAR,0
14484,572079,GLASS APOTHECARY BOTTLE PERFUME,0
14601,579269,LAVENDER SCENT CAKE CANDLE,0
14601,579269,ROTATING LEAVES T-LIGHT HOLDER,0
14601,579269,GRAND CHOCOLATECANDLE,0
14601,579269,COFFEE SCENT PILLAR CANDLE,0
14601,579269,SET OF 6 T-LIGHTS SANTA,0
14601,579269,3 WHITE CHOC MORRIS BOXED CANDLES,0
14601,579269,6 CHOCOLATE LOVE HEART T-LIGHTS,0
14863,575673,BLUE SPOT CERAMIC DRAWER KNOB,0
14863,575673,RED DRAWER KNOB ACRYLIC EDWARDIAN,0
14863,575673,4 LILY  BOTANICAL DINNER CANDLES,0
14863,575673,SET OF 10 LED DOLLY LIGHTS,0
14863,575673,WHITE SPOT RED CERAMIC DRAWER KNOB,0
14863,575673,4 VANILLA BOTANICAL CANDLES,0
14863,575673,BLUE STRIPE CERAMIC DRAWER KNOB,0
14863,575673,NATURAL SLATE HEART CHALKBOARD,0
14863,575673,RED SPOT CERAMIC DRAWER KNOB,0
14863,575673,RED STRIPE CERAMIC DRAWER KNOB,0
14863,575673,PACK OF SIX LED TEA LIGHTS,0
14962,546436,NATURAL SLATE CHALKBOARD LARGE,2
14962,546436,SWEETHEART WIRE MAGAZINE RACK,2
14962,546436,WOOD BLACK BOARD ANT WHITE FINISH,2
14962,546436,VINTAGE UNION JACK PENNANT,2
14962,546436,WHITE WOOD GARDEN PLANT LADDER,2
15121,544900,BAKING SET 9 PIECE RETROSPOT,0
15121,572093,SET OF 6 SOLDIER SKITTLES,0
15121,544900,PINK BLUE FELT CRAFT TRINKET BOX,0
15121,544900,SET OF 6 SPICE TINS PANTRY DESIGN,0
15121,544900,VINTAGE UNION JACK BUNTING,0
15121,572093,FELTCRAFT GIRL NICOLE KIT,0
15121,544900,TRAVEL SEWING KIT,0
15121,572093,10 COLOUR SPACEBOY PEN,0
15121,544900,SINGLE HEART ZINC T-LIGHT HOLDER,0
15121,544900,SET OF 3 CAKE TINS PANTRY DESIGN,0
15121,572093,SET OF 12 MINI LOAF BAKING CASES,0
15121,544900,JAM MAKING SET WITH JARS,0
15121,544900,FELTCRAFT 6 FLOWER FRIENDS,0
15121,572093,ANTIQUE HEART SHELF UNIT,0
15121,572093,BISCUIT TIN VINTAGE CHRISTMAS,0
15121,544900,TRADITIONAL KNITTING NANCY,0
15121,544900,"HOOK, 1 HANGER ,MAGIC GARDEN",0
15121,544900,3 STRIPEY MICE FELTCRAFT,0
15121,544900,CHERRY CROCHET FOOD COVER,0
15121,572093,NATURAL SLATE RECTANGLE CHALKBOARD,0
15121,544900,RECIPE BOX PANTRY YELLOW DESIGN,0
15121,544900,PARTY BUNTING,0
15121,544900,SET OF 3 HEART COOKIE CUTTERS,0
15121,544900,BAKING SET SPACEBOY DESIGN,0
15121,572093,BOTANICAL GARDENS WALL CLOCK,0
15121,572093,VINTAGE CHRISTMAS STOCKING,0
15121,544900,PANTRY ROLLING PIN,0
15121,572093,SET OF 6 SNACK LOAF BAKING CASES,0
15158,572683,BLUE ROSE FABRIC MIRROR,0
15158,572683,VINTAGE CHRISTMAS PAPER GIFT BAG,0
15158,572683,HAND WARMER BIRD DESIGN,0
15158,572683,CHICK GREY HOT WATER BOTTLE,0
15158,572683,VINTAGE CHRISTMAS GIFT BAG LARGE,0
15158,572683,PACK OF 12 PAISLEY PARK TISSUES,0
15158,572683,FAWN BLUE HOT WATER BOTTLE,0
15809,553902,FRENCH FLORAL CUSHION COVER,0
15809,553902,HANGING HEART JAR T-LIGHT HOLDER,0
15809,543586,WRAP DOILEY DESIGN,0
15809,543586,GUMBALL COAT RACK,0
15809,574307,CLASSIC CHROME BICYCLE BELL,0
15809,574307,ASSORTED COLOUR MINI CASES,0
15809,574307,BISCUIT TIN VINTAGE CHRISTMAS,0
15809,574307,SET OF 12 FAIRY CAKE BAKING CASES,0
15809,574307,FLORAL FOLK STATIONERY SET,0
15809,543586,ROUND CAKE TIN VINTAGE RED,0
15809,543586,PAPER BUNTING RETROSPOT,0
15809,574307,GUMBALL MAGAZINE RACK,0
15809,543586,RED KITCHEN SCALES,0
15809,553902,SET/6 COLLAGE PAPER CUPS,0
15809,553902,GIRLS VINTAGE TIN SEASIDE BUCKET,0
15809,543586,WRAP POPPIES  DESIGN,0
15809,547965,COTTON APRON PANTRY DESIGN,0
15809,574307,RABBIT NIGHT LIGHT,0
15809,543586,EASTER TIN BUCKET,0
15809,553902,REGENCY CAKESTAND 3 TIER,0
15809,543586,SET OF 6 SOLDIER SKITTLES,0
15809,543586,ANTIQUE SILVER TEA GLASS ETCHED,0
15809,543586,BISCUIT TIN VINTAGE RED,0
15809,556097,UNION STRIPE WITH FRINGE  HAMMOCK,0
15809,547965,SET 2 PANTRY DESIGN TEA TOWELS,0
15809,553902,UNION STRIPE WITH FRINGE  HAMMOCK,0
15809,543586,SET 3 PAPER VINTAGE CHICK PAPER EGG,0
15809,574307,DOORMAT KEEP CALM AND COME IN,0
15809,543586,BLUE POLKADOT EGG CUP,0
15809,543586,GUMBALL MAGAZINE RACK,0
15809,553902,PAPER BUNTING RETROSPOT,0
15809,547965,GUMBALL MAGAZINE RACK,0
15809,553902,REGENCY TEAPOT ROSES,0
15809,547965,RED POLKADOT COFFEE  MUG,0
15809,553902,SET/6 COLLAGE PAPER PLATES,0
15897,554989,JUMBO BAG TOYS,2
15897,554989,SET 2 PANTRY DESIGN TEA TOWELS,2
15897,554989,GARDEN PATH SKETCHBOOK,2
15897,554988,SANDALWOOD FAN,2
15897,554989,ENAMEL MEASURING JUG CREAM,2
15897,554989,COTTON APRON PANTRY DESIGN,2
15897,554988,JAZZ HEARTS PURSE NOTEBOOK,2
15897,554989,RECYCLED PENCIL WITH RABBIT ERASER,2
15897,554988,CLOTHES PEGS RETROSPOT PACK 24,2
15897,554988,RECYCLED PENCIL WITH RABBIT ERASER,2
15897,554988,BLUE & WHITE BREAKFAST TRAY,2
15897,554989,JAZZ HEARTS PURSE NOTEBOOK,2
15897,554988,PANTRY APPLE CORER,2
15897,554989,BLUE SQUARE COMPACT MIRROR,2
15897,554989,HAPPY STENCIL CRAFT,2
15897,554989,JUMBO BAG CHARLIE AND LOLA TOYS,2
15897,554989,SMALL DOLLY MIX DESIGN ORANGE BOWL,2
15897,554989,WOODEN SCHOOL COLOURING SET,2
15897,554989,COTTON APRON PANTRY DESIGN,2
15897,554989,BLUE PAISLEY SKETCHBOOK,2
15897,554989,BLUE & WHITE BREAKFAST TRAY,2
15897,554989,PANTRY APPLE CORER,2
16000,581105,NATURAL SLATE HEART CHALKBOARD,1
16000,581105,ALARM CLOCK BAKELIKE RED,1
16000,581105,HAND OVER THE CHOCOLATE   SIGN,1
16000,581105,JAM MAKING SET PRINTED,1
16000,581110,ANTIQUE HEART SHELF UNIT,1
16000,581105,CLASSIC BICYCLE CLIPS,1
16000,581107,SWEETHEART BIRD HOUSE,1
16000,581105,CLASSIC CHROME BICYCLE BELL,1
16000,581105,BICYCLE PUNCTURE REPAIR KIT,1
16022,547663,JUMBO STORAGE BAG SUKI,2
16022,547663,PACK 3 BOXES BIRD PANNETONE,2
16022,547663,RETROSPOT TEA SET CERAMIC 11 PC,2
16022,547663,VINTAGE RED MUG,2
16022,547663,BLACK AND WHITE DOG BOWL,2
16022,547663,PLASTERS IN TIN STRONGMAN,2
16022,547663,CHARLIE+LOLA PINK HOT WATER BOTTLE,2
16022,547663,VINTAGE CREAM DOG FOOD CONTAINER,2
16022,547663,TRAVEL CARD WALLET TRANSPORT,2
16022,547663,AIRLINE BAG VINTAGE JET SET BROWN,2
16022,547663,ANTIQUE SILVER T-LIGHT GLASS,2
16022,547663,AIRLINE BAG VINTAGE JET SET RED,2
16022,547663,PINK DOG BOWL,2
16022,547663,CIRCUS PARADE LUNCH BOX,2
16022,547663,CAT BOWL VINTAGE CREAM,2
16022,547663,ALARM CLOCK BAKELIKE RED,2
16022,547663,PARTY INVITES WOODLAND,2
16022,547663,CHARLIE + LOLA RED HOT WATER BOTTLE,2
16022,547663,AIRLINE BAG VINTAGE JET SET WHITE,2
16022,547663,CROCHET BEAR RED/BLUE  KEYRING,2
16022,547663,HAPPY STENCIL CRAFT,2
16022,547663,PARTY INVITES DINOSAURS,2
16022,547663,BEST DAD CANDLE LETTERS,2
16022,547663,PINK HAPPY BIRTHDAY BUNTING,2
16022,547663,BLUE HAPPY BIRTHDAY BUNTING,2
16022,547663,DELUXE SEWING KIT,2
16022,547663,ALARM CLOCK BAKELIKE IVORY,2
16022,547663,WOODEN REGATTA BUNTING,2
16022,547663,RETROSPOT TEA SET CERAMIC 11 PC,2
16022,547663,FELTCRAFT GIRL NICOLE KIT,2
16022,547663,CHARLIE AND LOLA TABLE TINS,2
16022,547663,PARTY INVITES FOOTBALL,2
16022,547663,APRON MODERN VINTAGE COTTON,2
16022,547663,PARTY INVITES WOODLAND,2
16022,547663,MR ROBOT SOFT TOY,2
16022,547663,ALPHABET STENCIL CRAFT,2
16022,547663,PACK OF 72 SKULL CAKE CASES,2
16022,547663,72 SWEETHEART FAIRY CAKE CASES,2
16022,547663,VINTAGE CREAM CAT FOOD CONTAINER,2
16022,547663,LUNCH BOX I LOVE LONDON,2
16022,547663,SAVE THE PLANET COTTON TOTE BAG,2
16022,547663,PINK CAT BOWL,2
16022,547663,IVORY DINER WALL CLOCK,2
16022,547663,FELTCRAFT BOY JEAN-PAUL KIT,2
16022,547663,GROW YOUR OWN BASIL IN ENAMEL MUG,2
16022,547663,PARTY INVITES BALLOON GIRL,2
16022,547663,CHARLIE AND LOLA FIGURES TINS,2
16022,547663,SPACE FROG,2
16022,547663,TRAVEL CARD WALLET TRANSPORT,2
16022,547663,LETS GO SHOPPING COTTON TOTE BAG,2
16022,547663,DOORMAT I LOVE LONDON,2
16022,547663,RETROSPOT CIGAR BOX MATCHES,2
16022,547663,3 STRIPEY MICE FELTCRAFT,2
16022,547663,BOX OF 9 PEBBLE CANDLES,2
16022,547663,DOG BOWL VINTAGE CREAM,2
16022,547663,LUNCH BAG SUKI DESIGN,2
16022,547663,PLASTERS IN TIN CIRCUS PARADE,2
16022,547663,BLACK AND WHITE CAT BOWL,2
16022,547663,BLACK TEA TOWEL CLASSIC DESIGN,2
16022,547663,FELTCRAFT GIRL AMELIE KIT,2
16022,547663,PINK HAWAIIAN PICNIC HAMPER FOR 2,2
16022,547663,MRS ROBOT SOFT TOY,2
16022,547663,FLORAL BLUE MONSTER,2
16022,547663,PACK OF 72 RETROSPOT CAKE CASES,2
16022,547663,NINJA RABBIT PINK,2
16022,547663,AIRLINE BAG VINTAGE TOKYO 78,2
16022,547663,PACK OF 12 LONDON TISSUES,2
16022,547663,LUNCH BAG CARS BLUE,2
16022,547663,RECIPE BOX BLUE SKETCHBOOK DESIGN,2
16022,547663,MONSTERS STENCIL CRAFT,2
16022,547663,PACK OF 60 DINOSAUR CAKE CASES,2
16168,574665,GARDENERS KNEELING PAD CUP OF TEA,1
16168,551145,WOODEN REGATTA BUNTING,1
16168,555011,GREEN GIANT GARDEN THERMOMETER,1
16168,564723,ROSES REGENCY TEACUP AND SAUCER,1
16168,551145,WOODEN UNION JACK BUNTING,1
