13922,539867,HAND WARMER BABUSHKA DESIGN,2
13922,539867,WHITE HANGING HEART T-LIGHT HOLDER,2
13922,539867,LOVE HEART POCKET WARMER,2
13922,539867,S/4 VALENTINE DECOUPAGE HEART BOX,2
13922,539867,CABIN BAG VINTAGE RETROSPOT,2
13922,539867,ROSE CARAVAN DOORSTOP,2
13922,539867,SET 3 WICKER STORAGE BASKETS,2
14741,538591,JAM MAKING SET PRINTED,0
14741,563694,ENAMEL FLOWER JUG CREAM,0
14741,571295,ZINC WILLIE WINKIE  CANDLE STICK,0
14741,558341,ZINC WILLIE WINKIE  CANDLE STICK,0
14741,558341,ASSORTED COLOURS SILK FAN,0
14741,538591,ZINC WILLIE WINKIE  CANDLE STICK,0
14741,538591,NATURAL SLATE HEART CHALKBOARD,0
14741,563694,VINTAGE RED ENAMEL TRIM PLATE,0
14741,558341,HEART OF WICKER SMALL,0
14741,563694,SPOTTY BUNTING,0
14741,579003,SPOTTY BUNTING,0
14741,536604,JAM MAKING SET PRINTED,0
14741,558341,VINTAGE RED ENAMEL TRIM JUG,0
14741,536604,CINAMMON SET OF 9 T-LIGHTS,0
14741,563694,VINTAGE RED ENAMEL TRIM MUG,0
14741,571295,ENAMEL MEASURING JUG CREAM,0
14741,563694,NATURAL SLATE HEART CHALKBOARD,0
14741,536604,HANGING HEART ZINC T-LIGHT HOLDER,0
14741,571295,RETROSPOT LAMP,0
14741,579003,VINTAGE CHRISTMAS BUNTING,0
14741,563694,VINTAGE RED TRIM ENAMEL BOWL,0
14741,579003,FLUTED ANTIQUE CANDLE HOLDER,0
14741,571295,ZINC FOLKART SLEIGH BELLS,0
14741,563694,RECYCLED ACAPULCO MAT TURQUOISE,0
14741,558341,VINTAGE RED ENAMEL TRIM MUG,0
14741,579003,WRAP RED VINTAGE DOILY,0
14741,571295,FLUTED ANTIQUE CANDLE HOLDER,0
14741,536604,CREAM HEART CARD HOLDER,0
14741,538591,RED WOOLLY HOTTIE WHITE HEART.,0
14741,536604,NATURAL SLATE HEART CHALKBOARD,0
14741,558341,CLASSIC FRENCH STYLE BASKET NATURAL,0
14741,579003,ANTIQUE SILVER T-LIGHT GLASS,0
14741,536604,GRAND CHOCOLATECANDLE,0
14741,571295,HOME SWEET HOME CUSHION COVER,0
14741,536604,ZINC WILLIE WINKIE  CANDLE STICK,0
14741,536604,FLUTED ANTIQUE CANDLE HOLDER,0
14741,558341,FRENCH ENAMEL CANDLEHOLDER,0
14741,558341,SPOTTY BUNTING,0
14741,563694,ENAMEL MEASURING JUG CREAM,0
14741,538591,FLUTED ANTIQUE CANDLE HOLDER,0
14741,538591,HANGING HEART ZINC T-LIGHT HOLDER,0
14741,538591,S/12 VANILLA  BOTANICAL T-LIGHTS,0
14741,579003,EMPIRE GIFT WRAP,0
14741,579003,CHILLI LIGHTS,0
14741,571295,HEART OF WICKER SMALL,0
14741,538591,WHITE GOOSE FEATHER CHRISTMAS TREE,0
14741,579003,ZINC WILLIE WINKIE  CANDLE STICK,0
14741,579003,NATURAL SLATE HEART CHALKBOARD,0
14741,538591,SET OF 12  VINTAGE POSTCARD SET,0
14741,571295,BELLE JARDINIERE CUSHION COVER,0
14741,579003,WRAP  VINTAGE DOILY,0
14741,571295,NATURAL SLATE HEART CHALKBOARD,0
14741,538591,CINAMMON SET OF 9 T-LIGHTS,0
14741,563694,VINTAGE RED ENAMEL TRIM JUG,0
14741,571295,SPOTTY BUNTING,0
14741,571295,ANTIQUE SILVER T-LIGHT GLASS,0
14741,536604,SOAP DISH BROCANTE,0
14741,571295,FRENCH ENAMEL CANDLEHOLDER,0
14741,571295,VINTAGE CHRISTMAS BUNTING,0
14966,578790,SET OF 60 I LOVE LONDON CAKE CASES,0
14966,578790,BUBBLEGUM RING ASSORTED,0
14966,578790,CHRISTMAS TOILET ROLL,0
14966,578790,CHRISTMAS CRAFT WHITE FAIRY,0
14966,578790,REX CASH+CARRY JUMBO SHOPPER,0
14966,578790,SET 6 SCHOOL MILK BOTTLES IN CRATE,0
14966,578790,CHRISTMAS TOILET ROLL,0
14966,578790,SET OF 9 HEART SHAPED BALLOONS,0
14966,578790,LIPSTICK PEN BABY PINK,0
14966,578790,LIPSTICK PEN RED,0
14966,578790,BLACK CHRISTMAS TREE 120CM,0
14966,578790,"FEATHER PEN,LIGHT PINK",0
14966,578790,FUNKY WASHING UP GLOVES ASSORTED,0
14966,578790,HOME SWEET HOME BOTTLE,0
14966,578790,JUMBO BAG 50'S CHRISTMAS,0
14966,578790,GREEN GOOSE FEATHER CHRISTMAS TREE,0
14966,578790,PAPER CHAIN KIT VINTAGE CHRISTMAS,0
14966,578790,PING! MICROWAVE PLATE,0
14966,578790,BIRTHDAY PARTY CORDON BARRIER TAPE,0
14966,578790,IVORY PILLAR CANDLE GOLD FLOCK,0
14966,578790,PINK CREAM FELT CRAFT TRINKET BOX,0
14966,578790,"FEATHER PEN,HOT PINK",0
14966,578790,PAPER CHAIN KIT RETROSPOT,0
14966,578790,VINTAGE CHRISTMAS PAPER GIFT BAG,0
14966,578790,SET OF 20 VINTAGE CHRISTMAS NAPKINS,0
14966,578790,HOT WATER BOTTLE KEEP CALM,0
14966,578790,6 GIFT TAGS VINTAGE CHRISTMAS,0
14966,578790,CHRISTMAS CRAFT LITTLE FRIENDS,0
14966,578790,VINTAGE CHRISTMAS BUNTING,0
14966,578790,SET OF 4 NAPKIN CHARMS INSTRUMENT,0
14966,578790,PIN CUSHION BABUSHKA RED,0
14966,578790,GIANT 50'S CHRISTMAS CRACKER,0
14966,578790,HEART SHAPE WIRELESS DOORBELL,0
14966,578790,JUMBO BAG VINTAGE CHRISTMAS,0
14966,578790,LUNCH BAG PINK POLKADOT,0
14966,578790,PAPER BUNTING RETROSPOT,0
14987,578351,WHITE HANGING HEART T-LIGHT HOLDER,0
14987,538006,WHITE HANGING HEART T-LIGHT HOLDER,0
14987,578351,RED HANGING HEART T-LIGHT HOLDER,0
14987,538006,RED HANGING HEART T-LIGHT HOLDER,0
15508,551860,PICNIC BASKET WICKER SMALL,2
15508,551860,POLKADOT COFFEE CUP & SAUCER PINK,2
15508,555500,ANTIQUE SILVER T-LIGHT GLASS,2
15508,555501,REGENCY TEA PLATE GREEN,2
15508,551412,RED HANGING HEART T-LIGHT HOLDER,2
15508,551412,HOMEMADE JAM SCENTED CANDLES,2
15508,555500,BLUE FLOCK GLASS CANDLEHOLDER,2
15508,555501,REGENCY MILK JUG PINK,2
15508,550503,"TRAY, BREAKFAST IN BED",2
15508,551412,WHITE HANGING HEART T-LIGHT HOLDER,2
15508,555501,REGENCY TEA SPOON,2
15508,555500,SILVER VANILLA  FLOWER CANDLE POT,2
15508,550503,ANTIQUE TALL SWIRLGLASS TRINKET POT,2
15508,551412,HOME BUILDING BLOCK WORD,2
15508,551412,LOVE BUILDING BLOCK WORD,2
15508,555500,SMALL HAMMERED SILVER CANDLEPOT,2
15508,555501,REGENCY TEA PLATE PINK,2
15508,551412,SET/3 VANILLA SCENTED CANDLE IN BOX,2
15508,555500,JUMBO SHOPPER VINTAGE RED PAISLEY,2
15508,555500,REGENCY SUGAR BOWL GREEN,2
15508,555501,REGENCY SUGAR BOWL GREEN,2
15508,555500,MONEY BOX BISCUITS DESIGN,2
15508,555500,CLASSIC GLASS COOKIE JAR,2
15508,550503,EMBOSSED GLASS TEALIGHT HOLDER,2
15508,551412,ROSE SCENT CANDLE IN JEWELLED BOX,2
15508,551860,IVORY SWEETHEART WIRE LETTER RACK,2
15508,555501,METAL SIGN EMPIRE TEA,2
15508,550503,ANTIQUE GLASS DRESSING TABLE POT,2
15508,551412,CERAMIC STRAWBERRY DESIGN MUG,2
15508,551412,STRAWBERRY CERAMIC TRINKET BOX,2
15508,551412,STRAWBERRY FAIRY CAKE TEAPOT,2
15508,555500,DECORATIVE ROSE BATHROOM BOTTLE,2
15508,550503,PINK JEWELLED PHOTO FRAME,2
15508,551412,PACK OF 12 RED RETROSPOT TISSUES,2
15508,551412,PACK OF 12 BLUE PAISLEY TISSUES,2
15508,550503,ANTIQUE GLASS PEDESTAL BOWL,2
15508,555500,JUMBO  BAG BAROQUE BLACK WHITE,2
15508,551412,CANDLEHOLDER PINK HANGING HEART,2
15508,555500,MIRROR MOSAIC VOTIVE HOLDER,2
15508,555501,REGENCY TEAPOT ROSES,2
15508,551860,WHITE HANGING HEART T-LIGHT HOLDER,2
15508,551860,PICNIC BASKET WICKER LARGE,2
15508,551860,T-LIGHT HOLDER SWEETHEART HANGING,2
15508,550503,FRENCH CHATEAU LARGE PLATTER,2
15508,550503,VICTORIAN GLASS HANGING T-LIGHT,2
15508,555501,REGENCY CAKE FORK,2
15508,550503,REGENCY CAKESTAND 3 TIER,2
15508,555500,RED HANGING HEART T-LIGHT HOLDER,2
15508,555500,TRAVEL CARD WALLET VINTAGE TICKET,2
15508,550503,PINK REGENCY TEACUP AND SAUCER,2
15508,550503,PLACE SETTING WHITE HEART,2
15508,555500,GLASS JAR DAISY FRESH COTTON WOOL,2
15508,551860,PINK REGENCY TEACUP AND SAUCER,2
15508,551860,GREEN REGENCY TEACUP AND SAUCER,2
15508,551412,RED RETROSPOT MUG,2
15508,551860,REGENCY CAKESTAND 3 TIER,2
15508,555501,REGENCY SUGAR TONGS,2
15508,555501,REGENCY TEA STRAINER,2
15508,555500,GLASS JAR PEACOCK BATH SALTS,2
15508,550503,GREEN REGENCY TEACUP AND SAUCER,2
15508,551860,GLASS JAR ENGLISH CONFECTIONERY,2
15508,555501,REGENCY TEA PLATE ROSES,2
15508,550503,ROSES REGENCY TEACUP AND SAUCER,2
15508,551412,SET/5 RED RETROSPOT LID GLASS BOWLS,2
15508,551860,SET/5 RED RETROSPOT LID GLASS BOWLS,2
15508,555500,MONEY BOX CONFECTIONERY DESIGN,2
15508,550503,DAIRY MAID TRADITIONAL TEAPOT,2
15508,555500,T-LIGHT HOLDER HANGING LACE,2
15508,555501,VINTAGE UNION JACK APRON,2
15508,551860,GLASS JAR DAISY FRESH COTTON WOOL,2
15508,551412,IF YOU CAN'T STAND THE HEAT MUG,2
15508,551860,ROSES REGENCY TEACUP AND SAUCER,2
15508,555500,JUMBO BAG ALPHABET,2
15508,555500,GLASS JAR DIGESTIVE BISCUITS,2
15508,555504,REGENCY TEA STRAINER,2
15508,550503,JUMBO BAG RED RETROSPOT,2
15508,551860,DAIRY MAID TOASTRACK,2
15508,550503,JUMBO BAG ALPHABET,2
15508,551412,SQUARE FLOOR CUSHION VINTAGE RED,2
15508,551860,SET OF 6 SPICE TINS PANTRY DESIGN,2
15508,555500,SILVER PLATE CANDLE BOWL SMALL,2
15508,555500,JUMBO BAG DOILEY PATTERNS,2
15508,551860,GLASS JAR PEACOCK BATH SALTS,2
15508,550503,DAIRY MAID LARGE MILK JUG,2
15508,555500,MONEY BOX KINGS CHOICE DESIGN,2
15508,555501,SPOTTY BUNTING,2
15508,551412,SMALL WHITE RETROSPOT MUG IN BOX,2
15508,555500,DECORATIVE FLORE BATHROOM BOTTLE,2
15508,551412,PACK OF 12 HEARTS DESIGN TISSUES,2
15508,550503,DAIRY MAID STRIPE MUG,2
15508,551412,SET OF 6 SPICE TINS PANTRY DESIGN,2
15508,555501,REGENCY CAKESTAND 3 TIER,2
15511,572095,DOORMAT VINTAGE LEAF,0
15511,566923,IVORY KITCHEN SCALES,0
15511,572095,LILY BROOCH AMETHYST COLOUR,0
15511,572095,HEART OF WICKER LARGE,0
15511,571038,ENGLISH ROSE SMALL SCENTED FLOWER,0
15511,572095,RED RETROSPOT SHOPPER BAG,0
15511,571038,RED RETROSPOT CAKE STAND,0
15511,573915,SET OF 60 PANTRY DESIGN CAKE CASES,0
15511,566923,MEMO BOARD RETROSPOT  DESIGN,0
15511,573915,VINTAGE DOILY TRAVEL SEWING KIT,0
15511,566923,DRAWER KNOB CRACKLE GLAZE IVORY,0
15511,571038,HANGING  BUTTERFLY T-LIGHT HOLDER,0
15511,573915,GINGHAM HEART  DOORSTOP RED,0
15511,573915,STRAWBERRY SHOPPER BAG,0
15511,579012,3 ROSE MORRIS BOXED CANDLES,0
15511,571038,GARDENIA 3 WICK MORRIS BOXED CANDLE,0
15511,566923,DOORSTOP RETROSPOT HEART,0
15511,571038,DOORMAT FAIRY CAKE,0
15511,571038,WHITE HANGING BEADS CANDLE HOLDER,0
15511,571038,ROSE 1 WICK MORRIS BOXED CANDLE,0
15511,571038,RETROSPOT LAMP,0
15511,573915,SET OF 4 ENGLISH ROSE COASTERS,0
15511,579012,SET/6 PINK  BUTTERFLY T-LIGHTS,0
15511,573915,WHITE METAL LANTERN,0
15511,571038,ORIENTAL RED CUSHION COVER,0
15511,571038,PHOTO FRAME CORNICE,0
15511,573915,PINK FLOWER CROCHET FOOD COVER,0
15511,571038,REGENCY CAKESTAND 3 TIER,0
15511,573915,MEMO BOARD COTTAGE DESIGN,0
15511,572095,HANGING  BUTTERFLY T-LIGHT HOLDER,0
15511,571038,SET/6 TURQUOISE BUTTERFLY T-LIGHTS,0
15511,566923,STOOL HOME SWEET HOME,0
15511,573915,ROUND PINK HEART MIRROR,0
15511,573915,PINK PAISLEY SQUARE TISSUE BOX,0
15511,579012,IVORY PILLAR CANDLE SILVER FLOCK,0
15511,579012,3 ROSE MORRIS BOXED CANDLES,0
15511,571038,SET OF 3 REGENCY CAKE TINS,0
15511,571038,SET/3 RED GINGHAM ROSE STORAGE BOX,0
15511,573915,ZINC FOLKART SLEIGH BELLS,0
15511,566923,FLOWER VINE RAFFIA FOOD COVER,0
15511,571038,3 ROSE MORRIS BOXED CANDLES,0
15511,573915,REGENCY CAKESTAND 3 TIER,0
15511,579012,GREEN REGENCY TEACUP AND SAUCER,0
15511,572095,SET/6 TURQUOISE BUTTERFLY T-LIGHTS,0
15511,571038,HANGING QUILTED PATCHWORK APPLES,0
15511,566923,WOOD BLACK BOARD ANT WHITE FINISH,0
15511,571038,SET/6 PINK  BUTTERFLY T-LIGHTS,0
15511,573915,GAOLERS KEYS DECORATIVE GARDEN,0
15511,566923,BROWN CHECK CAT DOORSTOP,0
15511,572095,LARGE CAKE STAND  HANGING STRAWBERY,0
15511,573915,CHRISTMAS RETROSPOT STAR WOOD,0
15511,571038,SWALLOW SQUARE TISSUE BOX,0
15511,572095,DOORMAT ENGLISH ROSE,0
15511,572095,GARDENIA 3 WICK MORRIS BOXED CANDLE,0
15511,573915,FILIGREE HEART DAISY WHITE,0
15511,573915,SET/12 FUNKY FELT FLOWER PEG IN BAG,0
15511,573915,BLACK/BLUE POLKADOT UMBRELLA,0
15511,572095,GARDENIA 1 WICK MORRIS BOXED CANDLE,0
15511,579012,LARGE WHITE HEART OF WICKER,0
15511,573915,HANGING QUILTED PATCHWORK APPLES,0
15511,571038,ROSE CARAVAN DOORSTOP,0
15511,573915,SWEETHEART BIRD HOUSE,0
15511,579012,SET 12 COLOURING PENCILS DOILY,0
15511,572095,FLOWER VINE RAFFIA FOOD COVER,0
15511,571038,DOORMAT RED RETROSPOT,0
15511,573915,HEART OF WICKER SMALL,0
15511,579012,SET OF 3 REGENCY CAKE TINS,0
15511,572095,12 PENCIL SMALL TUBE WOODLAND,0
15511,579012,BLUE PAISLEY TISSUE BOX,0
15511,573915,ASSORTED TUTTI FRUTTI PEN,0
15511,572095,EMPIRE UNION JACK TV DINNER TRAY,0
15511,579012,NOEL WOODEN BLOCK LETTERS,0
15511,571038,RED RETROSPOT SHOPPER BAG,0
15511,572095,RED RETROSPOT SHOPPER BAG,0
15511,566923,LARGE ROUND WICKER PLATTER,0
15511,579012,SET 12 COLOURING PENCILS DOILY,0
15511,579012,CHRYSANTHEMUM  JOURNAL,0
15511,573915,DECORATIVE WICKER HEART MEDIUM,0
15511,566923,REGENCY CAKESTAND 3 TIER,0
15511,566923,HEART OF WICKER LARGE,0
15511,573915,SMALL WHITE HEART OF WICKER,0
15511,573915,VICTORIAN SEWING BOX SMALL,0
15511,573915,IVY HEART WREATH,0
15511,573915,60 TEATIME FAIRY CAKE CASES,0
15511,566923,GREEN DRAWER KNOB ACRYLIC EDWARDIAN,0
15511,566923,GAOLERS KEYS DECORATIVE GARDEN,0
15511,573915,12 RED ROSE PEG PLACE SETTINGS,0
15511,572095,DOORMAT SPOTTY HOME SWEET HOME,0
15511,579012,REGENCY CAKESTAND 3 TIER,0
15511,566923,CHERRY CROCHET FOOD COVER,0
15511,572095,STRAWBERRY SHOPPER BAG,0
15511,573915,JUMBO BAG PAISLEY PARK,0
15511,571038,CREAM SWEETHEART MINI CHEST,0
15511,573915,SWEETHEART WIRE MAGAZINE RACK,0
15511,572095,GAOLERS KEYS DECORATIVE GARDEN,0
15511,572095,PINK FLOWER CROCHET FOOD COVER,0
15511,573915,BOUDOIR SQUARE TISSUE BOX,0
15511,573915,3 ROSE MORRIS BOXED CANDLES,0
15511,573915,ROSE 3 WICK MORRIS BOX CANDLE,0
15511,571038,BOUDOIR SQUARE TISSUE BOX,0
15511,573915,HOME BUILDING BLOCK WORD,0
15511,573915,FOOT STOOL HOME SWEET HOME,0
15511,573915,BLACK HEART CARD HOLDER,0
15511,579012,STOOL HOME SWEET HOME,0
15511,571038,BAKING SET 9 PIECE RETROSPOT,0
15511,573915,3 GARDENIA MORRIS BOXED CANDLES,0
15511,572095,EUCALYPTUS & PINECONE  WREATH,0
15511,566923,VINTAGE UNION JACK DOORSTOP,0
15511,566923,ZINC HERB GARDEN CONTAINER,0
15511,573915,T-LIGHT HOLDER HANGING LOVE BIRD,0
15511,573915,SET OF 4 ENGLISH ROSE COASTERS,0
15511,573915,EUCALYPTUS & PINECONE  WREATH,0
15511,579012,DOORMAT SPOTTY HOME SWEET HOME,0
15511,579012,SET 12 COLOUR PENCILS LOVE LONDON,0
15511,573915,SET OF 4 ENGLISH ROSE PLACEMATS,0
15511,573915,PACK OF 60 SPACEBOY CAKE CASES,0
15511,573915,POLKA DOT RAFFIA FOOD COVER,0
15511,571038,SET OF 10 LED DOLLY LIGHTS,0
15511,579012,ROSE CARAVAN DOORSTOP,0
15511,579012,PINK PILLAR CANDLE SILVER FLOCK,0
15511,573915,CUPCAKE LACE PAPER SET 6,0
15511,572095,SET/6 PINK  BUTTERFLY T-LIGHTS,0
15511,573915,LARGE ROUND WICKER PLATTER,0
15511,579012,SET/6 PURPLE BUTTERFLY T-LIGHTS,0
15511,566923,WHITE HANGING HEART T-LIGHT HOLDER,0
15511,566923,LARGE CAKE STAND  HANGING STRAWBERY,0
15511,579012,PINK REGENCY TEACUP AND SAUCER,0
15511,572095,LILY BROOCH OLIVE COLOUR,0
15511,572095,STRAWBERRY SHOPPER BAG,0
15511,571038,3 GARDENIA MORRIS BOXED CANDLES,0
15511,579012,DOORMAT ENGLISH ROSE,0
15511,571038,RED HANGING HEART T-LIGHT HOLDER,0
15511,573915,RETROSPOT WOODEN HEART DECORATION,0
15511,573915,IVORY WICKER HEART MEDIUM,0
15511,573915,DOORSTOP RETROSPOT HEART,0
15511,571038,RETROSPOT CANDLE  MEDIUM,0
15511,573915,JUMBO SHOPPER VINTAGE RED PAISLEY,0
15511,573915,EAU DE NILE HEART SHAPE PHOTO FRAME,0
15511,571038,DOORMAT ENGLISH ROSE,0
15511,573915,PEARL CRYSTAL PUMPKIN T-LIGHT HLDR,0
15511,579012,3 ROSE MORRIS BOXED CANDLES,0
15511,572095,DOORMAT UNION JACK GUNS AND ROSES,0
15511,573915,FLOWER VINE RAFFIA FOOD COVER,0
15511,572095,DIAMANTE BOW BROOCH GREEN COLOUR,0
15511,566923,SET OF 2 TRAYS HOME SWEET HOME,0
15511,573915,BLUE HARMONICA IN BOX,0
15511,579012,BLUE POT PLANT CANDLE,0
15511,566923,VINTAGE COFFEE GRINDER BOX,0
15511,579012,SET 12 COLOUR PENCILS SPACEBOY,0
15511,566923,VINTAGE UNION JACK MEMOBOARD,0
15511,572095,GARDENIA 1 WICK MORRIS BOXED CANDLE,0
15511,571038,DOORMAT NEW ENGLAND,0
15511,579012,DOORMAT NEW ENGLAND,0
15511,566923,SWEETHEART RECIPE BOOK STAND,0
15511,571038,STRAWBERRY SHOPPER BAG,0
15511,566923,DRAWER KNOB CRACKLE GLAZE PINK,0
15511,571038,RED RETROSPOT TISSUE BOX,0
15511,579012,WOOD BLACK BOARD ANT WHITE FINISH,0
15757,569637,HANGING HEART JAR T-LIGHT HOLDER,0
15757,569637,CHARLOTTE BAG VINTAGE ALPHABET,0
15757,569637,ROLL WRAP 50'S CHRISTMAS,0
15757,569637,DOUGHNUT LIP GLOSS,0
15757,569637,PARISIENNE JEWELLERY DRAWER,0
15757,552121,HOME BUILDING BLOCK WORD,0
15757,552121,HANGING HEART JAR T-LIGHT HOLDER,0
15757,552121,FELTCRAFT GIRL AMELIE KIT,0
15757,552121,GREEN CAT FLORAL CUSHION COVER,0
15757,569637,RED RETROSPOT CHARLOTTE BAG,0
15757,569637,BLUE HARMONICA IN BOX,0
15757,569637,CARDHOLDER GINGHAM CHRISTMAS TREE,0
15757,569637,SET OF 4 KNICK KNACK TINS LONDON,0
15757,569637,FELTCRAFT DOLL MOLLY,0
15757,552121,LOVE BUILDING BLOCK WORD,0
15757,552121,GINGHAM HEART DECORATION,0
15757,569637,PARTY BUNTING,0
15757,552121,DOORSTOP RETROSPOT HEART,0
15757,552121,3 STRIPEY MICE FELTCRAFT,0
15757,569637,6 GIFT TAGS 50'S CHRISTMAS,0
15757,569637,PACK OF 12 50'S CHRISTMAS TISSUES,0
15757,569637,VINTAGE DOILY DELUXE SEWING KIT,0
15757,552121,BLUE POLKADOT WRAP,0
15757,569637,SPOTTY BUNTING,0
15757,552121,GAOLERS KEYS DECORATIVE GARDEN,0
15757,569637,BINGO SET,0
15757,569637,SET 2 TEA TOWELS I LOVE LONDON,0
15757,569637,PINK CREAM FELT CRAFT TRINKET BOX,0
15757,552121,GEORGIAN TRINKET BOX,0
15757,569637,CHRISTMAS STAR WISH LIST CHALKBOARD,0
15757,569637,BAG 250g SWIRLY MARBLES,0
15757,569637,WORLD WAR 2 GLIDERS ASSTD DESIGNS,0
15757,552121,"BIRTHDAY CARD, RETRO SPOT",0
15757,569637,CARD HOLDER LOVE BIRD LARGE,0
15757,569637,MOUSE TOY WITH PINK T-SHIRT,0
15757,569637,WOODEN PICTURE FRAME WHITE FINISH,0
15757,552121,FELTCRAFT 6 FLOWER FRIENDS,0
15757,569637,JUMBO BAG 50'S CHRISTMAS,0
15757,552121,RED RETROSPOT WRAP,0
15757,552121,TRAVEL CARD WALLET KEEP CALM,0
15757,569637,PLAYING CARDS KEEP CALM & CARRY ON,0
15757,569637,TRADITIONAL KNITTING NANCY,0
15757,552121,ASSORTED COLOUR BIRD ORNAMENT,0
15757,569637,FELTCRAFT 6 FLOWER FRIENDS,0
15757,569637,BUBBLEGUM RING ASSORTED,0
16343,578325,TRADITIONAL PICK UP STICKS GAME,0
16343,578325,COFFEE MUG APPLES DESIGN,0
16343,578326,PACK OF 6 BIRDY GIFT TAGS,0
16343,578325,12 MESSAGE CARDS WITH ENVELOPES,0
16343,578325,RED SPOT PAPER GIFT BAG,0
16343,578325,RETROSPOT GIANT TUBE MATCHES,0
16343,578326,BLUE HARMONICA IN BOX,0
16343,578326,12 MESSAGE CARDS WITH ENVELOPES,0
16343,578325,STRIPEY CHOCOLATE NESTING BOXES,0
16343,578325,BINGO SET,0
16343,578325,MEMO BOARD RETROSPOT  DESIGN,0
16343,578326,COFFEE MUG APPLES DESIGN,0
16343,578325,PACK OF 6 BIRDY GIFT TAGS,0
16343,578326,JUMBO BAG PEARS,0
16343,578326,12 MESSAGE CARDS WITH ENVELOPES,0
16343,578325,SMALL STRIPES CHOCOLATE GIFT BAG,0
16343,578325,3 TRADITIONAl BISCUIT CUTTERS  SET,0
16343,578325,RED SPOT GIFT BAG LARGE,0
16343,578325,SET OF 3 BUTTERFLY COOKIE CUTTERS,0
16343,578325,BLUE POLKADOT WASHING UP GLOVES,0
16343,578325,WOODEN BOX OF DOMINOES,0
16343,578325,SET OF 20 KIDS COOKIE CUTTERS,0
16343,578326,SET/2 RED RETROSPOT TEA TOWELS,0
16343,578325,RETROSPOT CIGAR BOX MATCHES,0
16343,578325,JUMBO BAG PEARS,0
16343,578326,BAG 500g SWIRLY MARBLES,0
16343,578326,RED SPOT PAPER GIFT BAG,0
16343,578325,GINGHAM RECIPE BOOK BOX,0
16343,578326,SET OF 2 TEA TOWELS APPLE AND PEARS,0
16343,578325,JUMBO BAG PEARS,0
16343,578325,12 MESSAGE CARDS WITH ENVELOPES,0
16343,578325,PACK OF 6 BIRDY GIFT TAGS,0
16343,578326,WOODEN ROUNDERS GARDEN SET,0
16343,578325,WOODEN ROUNDERS GARDEN SET,0
16343,578326,GINGHAM RECIPE BOOK BOX,0
16343,578326,ROLL WRAP VINTAGE SPOT,0
16343,578326,PACK OF 12 LONDON TISSUES,0
16343,578325,EGG FRYING PAN MINT,0
16343,578326,COFFEE MUG PEARS  DESIGN,0
16343,578326,3 TRADITIONAl BISCUIT CUTTERS  SET,0
16343,578326,RED SPOT GIFT BAG LARGE,0
16343,578326,RED RETROSPOT ROUND CAKE TINS,0
16343,578325,SET OF 2 TEA TOWELS APPLE AND PEARS,0
16531,574060,LOVE HEART POCKET WARMER,0
16531,577091,CAMOUFLAGE LED TORCH,0
16531,544412,CHILDS GARDEN BRUSH BLUE,0
16531,574060,RETROSPOT HEART HOT WATER BOTTLE,0
16531,568344,MINI PLAYING CARDS BUFFALO BILL,0
16531,574060,PAPER CHAIN KIT 50'S CHRISTMAS,0
16531,562389,36 PENCILS TUBE WOODLAND,0
16531,542098,FELTCRAFT CUSHION RABBIT,0
16531,542098,FELTCRAFT HAIRBANDS PINK AND WHITE,0
16531,568344,WORLD WAR 2 GLIDERS ASSTD DESIGNS,0
16531,577091,ASSTD DESIGN RACING CAR PEN,0
16531,568344,WHEELBARROW FOR CHILDREN,0
16531,568344,BUBBLEGUM RING ASSORTED,0
16531,562389,PARTY INVITES WOODLAND,0
16531,544412,CREAM FELT EASTER EGG BASKET,0
16531,562389,PACK OF 12 COLOURED PENCILS,0
16531,562389,RED  HARMONICA IN BOX,0
16531,542098,WHEELBARROW FOR CHILDREN,0
16531,542098,GROW A FLYTRAP OR SUNFLOWER IN TIN,0
16531,562389,PARTY INVITES FOOTBALL,0
16531,562389,WATERING CAN GREEN DINOSAUR,0
16531,568344,FOLDING BUTTERFLY MIRROR HOT PINK,0
16531,568344,PLASTERS IN TIN WOODLAND ANIMALS,0
16531,574060,TRADITIONAL PICK UP STICKS GAME,0
16531,544412,SET OF 9 BLACK SKULL BALLOONS,0
16531,568344,TRADITIONAL WOODEN SKIPPING ROPE,0
16531,538845,FELTCRAFT PRINCESS LOLA DOLL,0
16531,544412,PARTY TIME PENCIL ERASERS,0
16531,542098,FELT FARM ANIMAL RABBIT,0
16531,544412,12 COLOURED PARTY BALLOONS,0
16531,574060,MINI LIGHTS WOODLAND MUSHROOMS,0
16531,562389,WATERING CAN PINK BUNNY,0
16531,568344,PLASTERS IN TIN STRONGMAN,0
16531,542098,FELT FARM ANIMAL HEN,0
16531,574060,CHILDRENS TOY COOKING UTENSIL SET,0
16531,544412,CERAMIC PIRATE CHEST MONEY BANK,0
16531,544412,ASSORTED CREEPY CRAWLIES,0
16531,574060,RABBIT NIGHT LIGHT,0
16531,544412,WHEELBARROW FOR CHILDREN,0
16531,544412,WOODLAND PARTY BAG + STICKER SET,0
16531,562389,ALPHABET STENCIL CRAFT,0
16531,542098,EASTER TIN BUCKET,0
16531,538845,RED  HARMONICA IN BOX,0
16531,577091,RABBIT NIGHT LIGHT,0
16531,577091,DISCO BALL ROTATOR BATTERY OPERATED,0
16531,574060,BINGO SET,0
16531,562389,RED METAL BOX TOP SECRET,0
16531,544412,TOADSTOOL MONEY BOX,0
16531,544412,RETROSPOT PARTY BAG + STICKER SET,0
16531,538845,FELTCRAFT PRINCESS CHARLOTTE DOLL,0
16531,544412,BALLOON ART MAKE YOUR OWN FLOWERS,0
16531,577091,ADVENT CALENDAR GINGHAM SACK,0
16531,544412,EIGHT PIECE SNAKE  SET,0
16531,544412,SET OF 20 KIDS COOKIE CUTTERS,0
16531,568344,GIRAFFE WOODEN RULER,0
16531,538845,BAG 125g SWIRLY MARBLES,0
16531,574060,WHITE SKULL HOT WATER BOTTLE,0
16531,574060,HI TEC ALPINE HAND WARMER,0
16531,568344,REVOLVER WOODEN RULER,0
16531,562389,TOADSTOOL MONEY BOX,0
16531,574060,SET OF 20 KIDS COOKIE CUTTERS,0
16531,538845,SET 12 KIDS COLOUR  CHALK STICKS,0
16531,562389,SMALL RED RETROSPOT WINDMILL,0
16531,577091,MIRRORED DISCO BALL,0
16531,574060,RED  HARMONICA IN BOX,0
16531,568344,MINI PLAYING CARDS FUN FAIR,0
16531,568344,BUNDLE OF 3 SCHOOL EXERCISE BOOKS,0
16531,544412,FELTCRAFT DOLL ROSIE,0
16531,562389,VINTAGE SNAP CARDS,0
16531,562389,GREEN METAL BOX ARMY SUPPLIES,0
16531,538845,PAPER CHAIN KIT 50'S CHRISTMAS,0
16531,544412,CHILDS GARDEN BRUSH PINK,0
16531,574060,BOX OF VINTAGE ALPHABET BLOCKS,0
16531,544412,SKULLS PARTY BAG + STICKER SET,0
16531,562389,CARTOON  PENCIL SHARPENERS,0
16531,577091,WOODEN ADVENT CALENDAR CREAM,0
16531,542098,RED  HARMONICA IN BOX,0
17291,543202,GLASS CLOCHE LARGE,2
17372,549556,FLYING PIG WATERING CAN,0
17372,558102,TRAVEL CARD WALLET I LOVE LONDON,0
17372,538852,HAPPY STENCIL CRAFT,0
17372,558102,DOORMAT KEEP CALM AND COME IN,0
17372,573336,TRADITIONAL PICK UP STICKS GAME,0
17372,556207,RED RETROSPOT BOWL,0
17372,538418,SET/3 VANILLA SCENTED CANDLE IN BOX,0
17372,549556,SET/4 BLUE FLOWER CANDLES IN BOWL,0
17372,549556,CHILDS GARDEN TROWEL PINK,0
17372,556207,PINK  POLKADOT CUP,0
17372,542258,PINK HAPPY BIRTHDAY BUNTING,0
17372,570424,SET OF 6 HALLOWEEN GHOST T-LIGHTS,0
17372,538852,MINI CAKE STAND T-LIGHT HOLDER,0
17372,542258,SET/10 PINK POLKADOT PARTY CANDLES,0
17372,549556,EASTER TIN KEEPSAKE,0
17372,558102,DOORMAT WELCOME PUPPIES,0
17372,542258,RETRO PINK BALL ASHTRAY,0
17372,570424,SILVER BELLS TABLE DECORATION,0
17372,573336,VINTAGE LEAF MAGNETIC NOTEPAD,0
17372,570424,HOT WATER BOTTLE SEX BOMB,0
17372,538852,ALPHABET STENCIL CRAFT,0
17372,542258,MOUSE TOY WITH PINK T-SHIRT,0
17372,538418,PAPER CHAIN KIT 50'S CHRISTMAS,0
17372,549556,JAM JAR WITH PINK LID,0
17372,538852,SET OF 6 T-LIGHTS SNOWMEN,0
17372,538418,12 PENCILS SMALL TUBE SKULL,0
17372,538852,DOORMAT MERRY CHRISTMAS RED,0
17372,558102,REX CASH+CARRY JUMBO SHOPPER,0
17372,538418,75 GREEN PETIT FOUR CASES,0
17372,542258,MAGNETS PACK OF 4 SWALLOWS,0
17372,542258,SET OF 3 CAKE TINS PANTRY DESIGN,0
17372,538418,PAINTED METAL HEART WITH HOLLY BELL,0
17372,570424,3D VINTAGE CHRISTMAS STICKERS,0
17372,538852,CANDLEHOLDER PINK HANGING HEART,0
17372,570424,SET OF 6 RIBBONS VINTAGE CHRISTMAS,0
17372,538418,75 BLACK PETIT FOUR CASES,0
17372,570424,VINTAGE CHRISTMAS CAKE FRILL,0
17372,542258,CANDLEHOLDER PINK HANGING HEART,0
17372,573336,ROSE 1 WICK MORRIS BOXED CANDLE,0
17372,549556,PHOTO FRAME CORNICE,0
17372,558102,CHILDRENS CUTLERY POLKADOT PINK,0
17372,573336,3 GARDENIA MORRIS BOXED CANDLES,0
17372,573336,12 PENCILS TALL TUBE WOODLAND,0
17372,538852,BOX OF 9 PEBBLE CANDLES,0
17372,538418,72 SWEETHEART FAIRY CAKE CASES,0
17372,538852,SET OF 6 HERB TINS SKETCHBOOK,0
17372,538852,GUMBALL COAT RACK,0
17372,549556,MOTHER'S KITCHEN SPOON REST,0
17372,549556,GIRAFFE WOODEN RULER,0
17372,538852,HOME BUILDING BLOCK WORD,0
17372,538418,FUNKY WASHING UP GLOVES ASSORTED,0
17372,556207,BISCUITS SMALL BOWL LIGHT BLUE,0
17372,549556,BOX OF VINTAGE JIGSAW BLOCKS,0
17372,556207,IVORY KITCHEN SCALES,0
17372,570424,PAPER CHAIN KIT VINTAGE CHRISTMAS,0
17372,538418,PAPER CHAIN KIT LONDON,0
17372,549556,REVOLVER WOODEN RULER,0
17372,556207,SMALL MARSHMALLOWS PINK BOWL,0
17372,538418,SET/3 ROSE CANDLE IN JEWELLED BOX,0
17372,549556,CHILDRENS CUTLERY DOLLY GIRL,0
17372,538852,RECIPE BOX PANTRY YELLOW DESIGN,0
17372,549556,DELUXE SEWING KIT,0
17372,538418,PACK OF 72 SKULL CAKE CASES,0
17372,558102,SET OF 3 CAKE TINS PANTRY DESIGN,0
17372,556207,KNEELING MAT HOUSEWORK  DESIGN,0
17372,556207,RED KITCHEN SCALES,0
17372,549556,OCEAN SCENT CANDLE IN JEWELLED BOX,0
17372,573336,SET 36 COLOUR PENCILS DOLLY GIRL,0
17372,558102,MEDIUM CERAMIC TOP STORAGE JAR,0
17372,542258,MAGNETS PACK OF 4 HOME SWEET HOME,0
17372,538418,6 RIBBONS RUSTIC CHARM,0
17372,549556,SET/10 BLUE POLKADOT PARTY CANDLES,0
17372,549556,WOODEN SCHOOL COLOURING SET,0
17372,538852,SET OF 3 CAKE TINS SKETCHBOOK,0
17372,558102,BOX OF VINTAGE JIGSAW BLOCKS,0
17372,538852,SET OF 3 CAKE TINS PANTRY DESIGN,0
17372,573336,SET 36 COLOUR PENCILS LOVE LONDON,0
17372,542258,REX CASH+CARRY JUMBO SHOPPER,0
17372,549556,SET/6 FRUIT SALAD  PAPER PLATES,0
17372,570424,SET OF 6 NATIVITY MAGNETS,0
17372,573336,ROSE 3 WICK MORRIS BOX CANDLE,0
17372,558102,SET OF 4 KNICK KNACK TINS LONDON,0
17372,570424,3D TRADITIONAL CHRISTMAS STICKERS,0
