13000,547721,OVEN MITT APPLES DESIGN,0
13000,538186,DOORMAT SPOTTY HOME SWEET HOME,0
13000,538186,T-LIGHT GLASS FLUTED ANTIQUE,0
13000,538186,WHITE HANGING HEART T-LIGHT HOLDER,0
13000,547721,WHITE HANGING HEART T-LIGHT HOLDER,0
13000,547721,SET OF 3 CAKE TINS PANTRY DESIGN,0
13000,538186,RETROSPOT HEART HOT WATER BOTTLE,0
13000,538186,AGED GLASS SILVER T-LIGHT HOLDER,0
13000,547721,SET OF 6 SPICE TINS PANTRY DESIGN,0
13000,547721,APRON APPLE DELIGHT,0
13000,547721,SET/20 STRAWBERRY PAPER NAPKINS,0
13000,547721,SET OF SALT AND PEPPER TOADSTOOLS,0
13000,547721,RED RETROSPOT OVEN GLOVE,0
13000,547721,COTTON APRON PANTRY DESIGN,0
13000,547721,BLUE POLKADOT EGG CUP,0
13000,538186,GIN + TONIC DIET METAL SIGN,0
13000,547721,RED  EGG  SPOON,0
13000,547721,12 PENCILS SMALL TUBE RED RETROSPOT,0
13000,538186,HOT WATER BOTTLE BABUSHKA,0
13000,547721,SET/4 COLOURFUL MIXING BOWLS,0
13000,547721,PEG BAG APPLES DESIGN,0
13000,547721,SET/20 RED RETROSPOT PAPER NAPKINS,0
13000,538186,CHICK GREY HOT WATER BOTTLE,0
13000,538186,DOORMAT RED RETROSPOT,0
13000,547721,PACK OF 20 NAPKINS PANTRY DESIGN,0
13000,547721,RED RETROSPOT PEG BAG,0
13000,538186,COOK WITH WINE METAL SIGN,0
13000,547721,BLUE EGG  SPOON,0
13000,538186,DOORMAT UNION FLAG,0
13000,547721,CHILDRENS APRON APPLES DESIGN,0
13000,564381,HANGING HEART JAR T-LIGHT HOLDER,0
13018,548920,LUNCH BAG SPACEBOY DESIGN,1
13018,575986,RED RETROSPOT ROUND CAKE TINS,1
13018,548920,WRAP VINTAGE PETALS  DESIGN,1
13018,553064,PARISIENNE CURIO CABINET,1
13018,544904,SET OF 3 CAKE TINS PANTRY DESIGN,1
13018,561871,ICE CREAM PEN LIP GLOSS,1
13018,566862,CARD HOLDER GINGHAM HEART,1
13018,547095,GREEN FERN SKETCHBOOK,1
13018,547095,POPPY'S PLAYHOUSE KITCHEN,1
13018,553235,FELTCRAFT CUSHION BUTTERFLY,1
13018,568665,STRAWBERRY CERAMIC TRINKET BOX,1
13018,575202,VINTAGE KID DOLLY CARD,1
13018,554929,SPACEBOY CHILDRENS EGG CUP,1
13018,550342,FELTCRAFT DOLL MOLLY,1
13018,554929,PINK CREAM FELT CRAFT TRINKET BOX,1
13018,544211,RECIPE BOX PANTRY YELLOW DESIGN,1
13018,544211,JAM MAKING SET WITH JARS,1
13018,568665,WRAP ALPHABET DESIGN,1
13018,569868,SET 12 COLOUR PENCILS SPACEBOY,1
13018,575202,TRADITIONAL NAUGHTS & CROSSES,1
13018,575202,FELTCRAFT CHRISTMAS FAIRY,1
13018,561871,BOX OF 6 MINI 50'S CRACKERS,1
13018,575986,RED RETROSPOT TEA CUP AND SAUCER,1
13018,566006,LOVEBIRD HANGING DECORATION WHITE,1
13018,566006,HOME SWEET HOME HANGING HEART,1
13018,550341,POTTING SHED TEA MUG,1
13018,568665,PENS ASSORTED SPACEBALL,1
13018,553064,JUMBO BAG ALPHABET,1
13018,547095,POPPY'S PLAYHOUSE LIVINGROOM,1
13018,553063,CERAMIC STRAWBERRY CAKE MONEY BANK,1
13018,569868,ROUND SNACK BOXES SET OF4 WOODLAND,1
13018,575986,CHARLOTTE BAG VINTAGE ALPHABET,1
13018,578265,FELTCRAFT DOLL EMILY,1
13018,550341,LUNCH BAG APPLE DESIGN,1
13018,556571,DOORMAT KEEP CALM AND COME IN,1
13018,566862,PANTRY HOOK SPATULA,1
13018,547095,WRAP SUKI AND FRIENDS,1
13018,551199,RED RETROSPOT PEG BAG,1
13018,566006,SET OF 3 WOODEN HEART DECORATIONS,1
13018,578265,GIN + TONIC DIET METAL SIGN,1
13018,553063,SET OF SALT AND PEPPER TOADSTOOLS,1
13018,562783,SMALL WHITE HEART OF WICKER,1
13018,566863,BUTTERFLY CUSHION COVER,1
13018,544904,BUTTON BOX,1
13018,566006,STAR DECORATION PAINTED ZINC,1
13018,569868,CARD HOLDER LOVE BIRD LARGE,1
13018,569868,PINK PAISLEY ROSE GIFT WRAP,1
13018,559455,GIN & TONIC DIET GREETING CARD,1
13018,569868,HEART DECORATION WITH PEARLS,1
13018,550342,RIDGED GLASS POSY VASE,1
13018,553063,SOFT PINK ROSE TOWEL,1
13018,561871,BISCUIT TIN 50'S CHRISTMAS,1
13018,578265,15CM CHRISTMAS GLASS BALL 20 LIGHTS,1
13018,544211,PINK CREAM FELT CRAFT TRINKET BOX,1
13018,550342,SET OF 2 WOODEN MARKET CRATES,1
13018,553063,SET OF 6 SOLDIER SKITTLES,1
13018,556571,PEG BAG APPLES DESIGN,1
13018,569868,FAIRY CAKES NOTEBOOK A7 SIZE,1
13018,550341,POTTERING IN THE SHED METAL SIGN,1
13018,553235,WRAP DOILEY DESIGN,1
13018,553063,WATERING CAN BLUE ELEPHANT,1
13018,554929,SPACEBOY BIRTHDAY CARD,1
13018,562783,HOME SWEET HOME MUG,1
13018,544211,POPPY'S PLAYHOUSE BATHROOM,1
13018,575987,EMBROIDERED RIBBON REEL RACHEL,1
13018,547095,DECORATION  BUTTERFLY  MAGIC GARDEN,1
13018,544211,TRADITIONAL KNITTING NANCY,1
13018,548920,SET OF 6 FUNKY BEAKERS,1
13018,544904,RED RETROSPOT SMALL MILK JUG,1
13018,550342,CERAMIC CHERRY CAKE MONEY BANK,1
13018,550342,ENGLISH ROSE NOTEBOOK A7 SIZE,1
13018,553235,GIN + TONIC DIET METAL SIGN,1
13018,553235,FELTCRAFT PRINCESS OLIVIA DOLL,1
13018,553235,BOTANICAL LAVENDER GIFT WRAP,1
13018,561871,PAPER CHAIN KIT 50'S CHRISTMAS,1
13018,562783,POTTERING IN THE SHED METAL SIGN,1
13018,566006,CHRISTMAS CRAFT LITTLE FRIENDS,1
13018,548920,EMPIRE GIFT WRAP,1
13018,561871,RED RETROSPOT CHARLOTTE BAG,1
13018,561871,PINK CREAM FELT CRAFT TRINKET BOX,1
13018,561871,SET OF 3 CAKE TINS PANTRY DESIGN,1
13018,547095,FELT FARM ANIMAL SHEEP,1
13018,551199,PINK DOUGHNUT TRINKET POT,1
13018,566006,IVORY WICKER HEART MEDIUM,1
13018,550342,SET OF 4 ENGLISH ROSE COASTERS,1
13018,551199,"ELEPHANT, BIRTHDAY CARD,",1
13018,551199,DINOSAURS  WRITING SET,1
13018,575202,EGG CUP MILKMAID HEIDI,1
13018,547095,POPPY'S PLAYHOUSE BATHROOM,1
13018,554929,ENAMEL FLOWER JUG CREAM,1
13018,575203,RABBIT NIGHT LIGHT,1
13018,559455,ROBOT BIRTHDAY CARD,1
13018,551199,CERAMIC STRAWBERRY DESIGN MUG,1
13018,547095,WRAP VINTAGE PETALS  DESIGN,1
13018,550342,STRAWBERRY CERAMIC TRINKET BOX,1
13018,548920,LUNCH BAG WOODLAND,1
13018,559455,12 PENCILS TALL TUBE POSY,1
13018,544211,TRAVEL SEWING KIT,1
13018,553235,LOVEBIRD HANGING DECORATION WHITE,1
13018,559455,SPACEBOY BIRTHDAY CARD,1
13018,553063,CHILDS GARDEN SPADE PINK,1
13018,568665,ENAMEL FLOWER JUG CREAM,1
13018,561871,CHARLOTTE BAG VINTAGE ALPHABET,1
13018,562783,LUNCH BAG APPLE DESIGN,1
13018,568665,LUNCH BAG SUKI DESIGN,1
13018,554929,12 PENCILS TALL TUBE WOODLAND,1
13018,575986,SET OF 4 KNICK KNACK TINS LONDON,1
13018,544211,GROW A FLYTRAP OR SUNFLOWER IN TIN,1
13018,551199,HEART FILIGREE DOVE  SMALL,1
13018,569868,3 STRIPEY MICE FELTCRAFT,1
13018,548920,WRAP ENGLISH ROSE,1
13018,551199,PEARL CRYSTAL PUMPKIN T-LIGHT HLDR,1
13018,550342,SET 4 NURSERY DES ROUND BOXES,1
13018,562783,PENS ASSORTED FUNKY JEWELED,1
13018,544211,MAKE YOUR OWN PLAYTIME CARD KIT,1
13018,548920,ANTIQUE SILVER T-LIGHT GLASS,1
13018,554929,CARD PARTY GAMES,1
13018,568665,FELTCRAFT DOLL MOLLY,1
13018,550342,QUEENS GUARD COFFEE MUG,1
13018,553235,SET OF 3 HEART COOKIE CUTTERS,1
13018,561871,BISCUIT TIN VINTAGE CHRISTMAS,1
13018,578265,GIN & TONIC DIET GREETING CARD,1
13018,550341,FELTCRAFT BUTTERFLY HEARTS,1
13018,550342,RECIPE BOX PANTRY YELLOW DESIGN,1
13018,562783,PINK CREAM FELT CRAFT TRINKET BOX,1
13018,575202,RED RETROSPOT PEG BAG,1
13018,575986,VINTAGE HEADS AND TAILS CARD GAME,1
13018,561871,60 CAKE CASES VINTAGE CHRISTMAS,1
13018,544904,DOORMAT I LOVE LONDON,1
13018,550341,SAVE THE PLANET COTTON TOTE BAG,1
13018,550342,SET OF 6 SOLDIER SKITTLES,1
13018,554929,SWEETHEART CERAMIC TRINKET BOX,1
13018,569868,DARK BIRD HOUSE TREE DECORATION,1
13018,547095,PINK CREAM FELT CRAFT TRINKET BOX,1
13018,550342,ENAMEL FLOWER JUG CREAM,1
13018,551199,CERAMIC PIRATE CHEST MONEY BANK,1
13018,554929,CARD SUKI BIRTHDAY,1
13018,556571,COLOUR GLASS T-LIGHT HOLDER HANGING,1
13018,544904,RED HEART SHAPE LOVE BUCKET,1
13018,550341,3 PIECE SPACEBOY COOKIE CUTTER SET,1
13018,553063,VINTAGE SNAP CARDS,1
13018,556571,VICTORIAN SEWING BOX MEDIUM,1
13018,566862,I LOVE LONDON BEAKER,1
13018,550341,GIN AND TONIC MUG,1
13018,553235,GIN AND TONIC MUG,1
13018,566862,PAPER CHAIN KIT VINTAGE CHRISTMAS,1
13018,554929,ROUND SNACK BOXES SET OF4 WOODLAND,1
13018,575202,LUNCH BAG WOODLAND,1
13018,556571,RED RETROSPOT PEG BAG,1
13018,551199,ZINC T-LIGHT HOLDER STARS SMALL,1
13018,554929,FOOD CONTAINER SET 3 LOVE HEART,1
13018,559455,BALLOONS  WRITING SET,1
13018,548920,REGENCY CAKESTAND 3 TIER,1
13018,548920,MAGNETS PACK OF 4 VINTAGE COLLAGE,1
13018,568665,DOUGHNUT LIP GLOSS,1
13018,553063,WATERING CAN PINK BUNNY,1
13018,548920,SILVER HANGING T-LIGHT HOLDER,1
13018,550342,12 PENCILS SMALL TUBE SKULL,1
13018,566862,LAVENDER TOILETTE BOTTLE,1
13018,575202,SKULLS GREETING CARD,1
13018,548920,3 HOOK HANGER MAGIC GARDEN,1
13018,553235,FELTCRAFT CUSHION OWL,1
13018,561871,SET OF 60 PANTRY DESIGN CAKE CASES,1
13018,562783,WRAP RED APPLES,1
13018,561871,RED  HARMONICA IN BOX,1
13018,550341,SAVE THE PLANET MUG,1
13018,551199,ASSORTED COLOUR T-LIGHT HOLDER,1
13018,553235,FELTCRAFT PRINCESS LOLA DOLL,1
13018,575988,PLAYING CARDS KEEP CALM & CARRY ON,1
13018,575986,RED RETROSPOT SMALL MILK JUG,1
13018,554929,FOLDING BUTTERFLY MIRROR IVORY,1
13018,554929,CERAMIC HEART FAIRY CAKE MONEY BANK,1
13018,559455,CARD BIRTHDAY COWBOY,1
13018,559456,PANTRY MAGNETIC  SHOPPING LIST,1
13018,575202,ANTIQUE SILVER BAUBLE LAMP,1
13018,551199,CERAMIC HEART FAIRY CAKE MONEY BANK,1
13018,569868,BEADED CRYSTAL HEART GREEN LARGE,1
13018,547095,BLUE SCANDINAVIAN PAISLEY WRAP,1
13018,548920,FINE WICKER HEART,1
13018,553063,SET OF 6 SPICE TINS PANTRY DESIGN,1
13018,547095,FELTCRAFT CUSHION OWL,1
13018,575986,RED HEART SHAPE LOVE BUCKET,1
13018,553063,PIGGY BANK RETROSPOT,1
13018,553235,LUNCH BAG ALPHABET DESIGN,1
13018,562783,COLOUR GLASS T-LIGHT HOLDER HANGING,1
13018,566006,HANGING MINI COLOURED BOTTLES,1
13018,569868,VINTAGE DOILY TRAVEL SEWING KIT,1
13018,559455,CARD CIRCUS PARADE,1
13018,566862,PANTRY HOOK BALLOON WHISK,1
13018,554929,ROBOT BIRTHDAY CARD,1
13018,553063,HOME SWEET HOME MUG,1
13018,553235,FAIRY CAKES NOTEBOOK A7 SIZE,1
13018,575986,SET OF 6 SOLDIER SKITTLES,1
13018,569868,WALL ART BICYCLE SAFETY,1
13018,569868,WRAP PAISLEY PARK,1
13018,578265,TRADITIONAL KNITTING NANCY,1
13018,547095,EASTER CRAFT 4 CHICKS,1
13018,562783,WRAP PINK FAIRY CAKES,1
13018,569868,HANGING HEART WITH BELL,1
13018,569868,GINGHAM HEART  DOORSTOP RED,1
13018,556571,GARDENERS KNEELING PAD CUP OF TEA,1
13018,544211,POPPY'S PLAYHOUSE LIVINGROOM,1
13018,544211,BAKING SET SPACEBOY DESIGN,1
13018,544904,ASSORTED COLOUR MINI CASES,1
13018,544904,RED RETROSPOT TRADITIONAL TEAPOT,1
13018,548920,SCANDINAVIAN PAISLEY PICNIC BAG,1
13018,562783,GIN & TONIC DIET GREETING CARD,1
13018,556571,GIN & TONIC DIET GREETING CARD,1
13018,575202,15CM CHRISTMAS GLASS BALL 20 LIGHTS,1
13018,548920,WHITE WOOD GARDEN PLANT LADDER,1
13018,548920,SPACEBOY LUNCH BOX,1
13018,553235,HOME SWEET HOME MUG,1
13018,569868,SKULLS  STICKERS,1
13018,569868,GLITTER HEART DECORATION,1
13018,569868,CHRISTMAS HANGING STAR WITH BELL,1
13018,575202,WOODEN BOX OF DOMINOES,1
13018,553235,WRAP ALPHABET DESIGN,1
13018,575202,FELTCRAFT PRINCESS LOLA DOLL,1
13018,544211,FELTCRAFT BUTTERFLY HEARTS,1
13018,550342,LUNCH BAG  BLACK SKULL.,1
13018,561871,BUNDLE OF 3 ALPHABET EXERCISE BOOKS,1
13018,569868,FANCY FONTS BIRTHDAY WRAP,1
13018,575202,BOTANICAL LAVENDER BIRTHDAY CARD,1
13018,578265,VINTAGE DOILY TRAVEL SEWING KIT,1
13018,544904,SET OF 6 SPICE TINS PANTRY DESIGN,1
13018,566006,LARGE WHITE HEART OF WICKER,1
13018,566006,CHERUB HEART DECORATION SILVER,1
13018,578265,PINK BLUE FELT CRAFT TRINKET BOX,1
13018,550341,CLOCK MAGNET MUM'S KITCHEN,1
13018,547095,WRAP DOILEY DESIGN,1
13018,553063,RED  HARMONICA IN BOX,1
13018,548920,ICE CREAM PEN LIP GLOSS,1
13018,566006,HEART OF WICKER SMALL,1
13018,566863,PANTRY 3 HOOK ROLLING PIN HANGER,1
13018,568665,WOOD STAMP SET FLOWERS,1
13018,566862,CLASSIC GLASS COOKIE JAR,1
13018,575986,BOX OF VINTAGE JIGSAW BLOCKS,1
13018,556571,TEA TIME PARTY BUNTING,1
13018,559455,SKULLS WRITING SET,1
13018,569868,CERAMIC PIRATE CHEST MONEY BANK,1
13018,551199,VINTAGE CARAVAN GREETING CARD,1
13018,553063,WATERING CAN GREEN DINOSAUR,1
13018,568665,SWEETHEART CERAMIC TRINKET BOX,1
13018,568665,PINK CREAM FELT CRAFT TRINKET BOX,1
13018,544211,12 PENCILS TALL TUBE WOODLAND,1
13018,575986,JUMBO BAG ALPHABET,1
13018,554929,VICTORIAN SEWING KIT,1
13018,575988,BOX OF 6 CHRISTMAS CAKE DECORATIONS,1
13018,578265,ANTIQUE SILVER BAUBLE LAMP,1
13018,578265,CLASSIC CHROME BICYCLE BELL,1
13018,548920,ROUND SNACK BOXES SET OF4 WOODLAND,1
13018,550341,GLAMOROUS  MUG,1
13018,553063,CHILDS GARDEN TROWEL BLUE,1
13018,553235,WRAP PINK FAIRY CAKES,1
13018,566006,WICKER STAR,1
13018,575202,RABBIT NIGHT LIGHT,1
13018,578265,GLITTER CHRISTMAS TREE WITH BELLS,1
13018,554929,SEWING SUSAN 21 NEEDLE SET,1
13018,544211,HOMEMADE JAM SCENTED CANDLES,1
13018,544904,TRAVEL SEWING KIT,1
13018,547095,CHRYSANTHEMUM SKETCHBOOK,1
13018,550341,STRAWBERRY LUNCH BOX WITH CUTLERY,1
13018,554929,GARDENERS KNEELING PAD KEEP CALM,1
13018,566006,CHRISTMAS CRAFT TREE TOP ANGEL,1
13018,551199,GIN & TONIC DIET GREETING CARD,1
13018,547095,POPPY'S PLAYHOUSE BEDROOM,1
13018,551199,POTTING SHED TEA MUG,1
13018,547095,FELTCRAFT 6 FLOWER FRIENDS,1
13018,553063,RED RETROSPOT SUGAR JAM BOWL,1
13018,554929,GENTLEMAN SHIRT REPAIR KIT,1
13018,561871,GIANT 50'S CHRISTMAS CRACKER,1
13018,568665,PINK BLUE FELT CRAFT TRINKET BOX,1
13018,548920,WRAP RED APPLES,1
13018,566863,HOME SWEET HOME CUSHION COVER,1
13018,575988,PLAYING CARDS JUBILEE UNION JACK,1
13018,575988,ANTIQUE HEART SHELF UNIT,1
13018,548920,ASSORTED COLOUR T-LIGHT HOLDER,1
13018,550341,I'M ON HOLIDAY METAL SIGN,1
13018,550341,12 PENCILS TALL TUBE WOODLAND,1
13018,553063,PAPER CHAIN KIT EMPIRE,1
13018,562783,GIN AND TONIC MUG,1
13018,544904,RED RETROSPOT CHARLOTTE BAG,1
13018,550341,SET OF 3 BUTTERFLY COOKIE CUTTERS,1
13018,544904,RED RETROSPOT ROUND CAKE TINS,1
13018,551199,POTTERING MUG,1
13018,562783,MINIATURE ANTIQUE ROSE HOOK IVORY,1
13018,548920,FUNKY DIVA PEN,1
13018,550342,POCKET BAG BLUE PAISLEY RED SPOT,1
13018,553063,FLUTED ANTIQUE CANDLE HOLDER,1
13018,568665,COLOUR GLASS T-LIGHT HOLDER HANGING,1
13018,575202,LUNCH BAG PAISLEY PARK,1
13018,544211,3 STRIPEY MICE FELTCRAFT,1
13018,547095,PINK BLUE FELT CRAFT TRINKET BOX,1
13018,550342,PAPER BUNTING VINTAGE PAISLEY,1
13018,551199,GLAMOROUS  MUG,1
13018,554929,ASSORTED COLOUR T-LIGHT HOLDER,1
13018,566006,IVORY WICKER HEART SMALL,1
13018,568665,CERAMIC CHERRY CAKE MONEY BANK,1
13018,551199,IF YOU CAN'T STAND THE HEAT MUG,1
13018,569868,WALL ART LOVES' SECRET,1
13018,569868,RED TOADSTOOL LED NIGHT LIGHT,1
13018,575202,SET 12 VINTAGE DOILY CHALK,1
13018,575986,ANTIQUE SILVER T-LIGHT GLASS,1
13018,551199,COLOUR GLASS T-LIGHT HOLDER HANGING,1
13018,553235,LUNCH BAG DOILEY PATTERN,1
13018,553235,SMALL PARISIENNE HEART PHOTO FRAME,1
13018,569868,FOLKART ZINC HEART CHRISTMAS DEC,1
13018,575988,PLAYING CARDS I LOVE LONDON,1
13018,578265,3 STRIPEY MICE FELTCRAFT,1
13018,556571,POTTING SHED TEA MUG,1
13018,578265,DOORMAT KEEP CALM AND COME IN,1
13018,544904,LUNCH BOX I LOVE LONDON,1
13018,551199,SINGLE HEART ZINC T-LIGHT HOLDER,1
13018,562783,LUNCH BAG  BLACK SKULL.,1
13018,569868,WRAP RED VINTAGE DOILY,1
13018,559455,RETRO LEAVES MAGNETIC NOTEPAD,1
13018,548920,MAGNETS PACK OF 4 SWALLOWS,1
13018,559455,LARGE WHITE HEART OF WICKER,1
13018,566862,PANTRY HOOK TEA STRAINER,1
13018,559455,COLOUR GLASS T-LIGHT HOLDER HANGING,1
13018,562783,ENGLISH ROSE NOTEBOOK A7 SIZE,1
13018,547095,WRAP ENGLISH ROSE,1
13018,550341,CHILDS BREAKFAST SET DOLLY GIRL,1
13018,578265,VINTAGE DOILY DELUXE SEWING KIT,1
13018,547095,WRAP POPPIES  DESIGN,1
13018,554929,CHILDREN'S SPACEBOY MUG,1
13018,559455,PEG BAG APPLES DESIGN,1
13018,568665,CERAMIC STRAWBERRY CAKE MONEY BANK,1
13018,547095,FELT FARM ANIMAL RABBIT,1
13018,551199,SILVER HANGING T-LIGHT HOLDER,1
13018,554929,STRAWBERRY CERAMIC TRINKET BOX,1
13018,556571,POTTERING MUG,1
13018,561872,SET OF 4 KNICK KNACK TINS LONDON,1
13018,547095,DECORATION WHITE CHICK MAGIC GARDEN,1
13018,550342,TOADSTOOL MONEY BOX,1
13018,553235,HEART DECORATION RUSTIC HANGING,1
13018,559455,CARD PSYCHEDELIC APPLES,1
13018,559455,FOLDING BUTTERFLY MIRROR IVORY,1
13018,566862,SET OF 3 CAKE TINS PANTRY DESIGN,1
13018,553063,VINTAGE SNAKES & LADDERS,1
13018,559455,LOVEBIRD HANGING DECORATION WHITE,1
13018,550341,JAM MAKING SET WITH JARS,1
13018,551199,PEG BAG APPLES DESIGN,1
13018,544211,WOOD STAMP SET FLOWERS,1
13018,550342,PEG BAG APPLES DESIGN,1
13018,547095,VINTAGE HEADS AND TAILS CARD GAME,1
13018,548920,VICTORIAN SEWING KIT,1
13018,554929,SAVE THE PLANET MUG,1
13018,561871,SET OF TEA COFFEE SUGAR TINS PANTRY,1
13018,569868,"ACRYLIC JEWEL ICICLE, PINK",1
13018,578265,CHRISTMAS CRAFT LITTLE FRIENDS,1
13018,548920,WRAP POPPIES  DESIGN,1
13018,566863,HOT WATER BOTTLE KEEP CALM,1
13018,575202,HANGING MINI COLOURED BOTTLES,1
13018,566006,CHRISTMAS CRAFT WHITE FAIRY,1
13018,568665,METAL SIGN HIS DINNER IS SERVED,1
13018,544904,ROSE COTTAGE KEEPSAKE BOX,1
13018,548920,COLOUR GLASS T-LIGHT HOLDER HANGING,1
13018,544904,SET 2 PANTRY DESIGN TEA TOWELS,1
13018,548920,SPACEBOY CHILDRENS EGG CUP,1
13018,559455,GRASS HOPPER WOODEN WALL CLOCK,1
13018,544904,JAM MAKING SET PRINTED,1
13018,559455,3 PIECE SPACEBOY COOKIE CUTTER SET,1
13018,562783,VINTAGE CARAVAN GREETING CARD,1
13018,569868,MAGNETS PACK OF 4 SWALLOWS,1
13018,548920,BLUE SCANDINAVIAN PAISLEY WRAP,1
13018,559455,CARD SUKI BIRTHDAY,1
13018,575202,ICE CREAM PEN LIP GLOSS,1
13018,578265,MULTI COLOUR SILVER T-LIGHT HOLDER,1
13018,548920,SEWING SUSAN 21 NEEDLE SET,1
13018,554929,TRAVEL SEWING KIT,1
13018,578265,CHRISTMAS CRAFT TREE TOP ANGEL,1
13018,569868,PAINTED METAL HEART WITH HOLLY BELL,1
13018,553063,PINK  HEART SHAPE LOVE BUCKET,1
13018,553235,JINGLE BELL HEART DECORATION,1
13018,575202,MILK MAIDS MUG,1
13018,550342,SKULLS WRITING SET,1
13018,566006,12 PENCILS TALL TUBE SKULLS,1
13018,575986,RETROSPOT LARGE MILK JUG,1
13018,553063,KINGS CHOICE MUG,1
13018,553235,RABBIT NIGHT LIGHT,1
13018,566006,CHRISTMAS TREE HANGING SILVER,1
13018,568665,NO SINGING METAL SIGN,1
13018,544211,POPPY'S PLAYHOUSE BEDROOM,1
13018,554929,CERAMIC STRAWBERRY CAKE MONEY BANK,1
13018,554929,12 PENCILS TALL TUBE SKULLS,1
13018,566862,LUNCH BOX I LOVE LONDON,1
13018,578265,FELTCRAFT PRINCESS CHARLOTTE DOLL,1
13018,547095,VINTAGE CARAVAN GIFT WRAP,1
13018,548920,PAPERWEIGHT SAVE THE PLANET,1
13018,550342,FELTCRAFT PRINCESS LOLA DOLL,1
13018,544211,BAKING SET 9 PIECE RETROSPOT,1
13018,551199,SPACEBOY BIRTHDAY CARD,1
13018,561871,TRADITIONAL WOODEN CATCH CUP GAME,1
13018,561871,SET OF 60 I LOVE LONDON CAKE CASES,1
13018,575202,COWBOYS AND INDIANS BIRTHDAY CARD,1
13018,568665,WOOD STAMP SET BEST WISHES,1
13018,550342,PARTY BUNTING,1
13018,554929,CHILDRENS DOLLY GIRL MUG,1
13018,561872,GLASS SONGBIRD STORAGE JAR,1
13018,553063,RED HEART SHAPE LOVE BUCKET,1
13018,548920,PAPERWEIGHT VINTAGE COLLAGE,1
13018,550342,CHILDREN'S APRON DOLLY GIRL,1
13018,562783,HOME SWEET HOME METAL SIGN,1
13018,575202,"FANCY FONT BIRTHDAY CARD,",1
13018,553235,GINGHAM ROSE WRAP,1
13018,544904,RED RETROSPOT MUG,1
13018,547095,EMPIRE GIFT WRAP,1
13018,559455,PINK STITCHED WALL CLOCK,1
13018,575202,LUNCH BAG VINTAGE DOILY,1
13018,544211,PAPER BUNTING RETROSPOT,1
13018,551199,COWBOYS AND INDIANS BIRTHDAY CARD,1
13018,561871,JUMBO BAG 50'S CHRISTMAS,1
13018,561871,BLUE HARMONICA IN BOX,1
13018,575988,TRADITIONAL PICK UP STICKS GAME,1
13018,550341,LUNCH BAG VINTAGE LEAF DESIGN,1
13018,553063,CHILDS GARDEN SPADE BLUE,1
13018,562783,LUNCH BAG RED RETROSPOT,1
13018,569868,FELTCRAFT BUTTERFLY HEARTS,1
13018,550342,LUNCH BAG DOLLY GIRL DESIGN,1
13018,559455,SUKI  SHOULDER BAG,1
13018,550341,CHILDS BREAKFAST SET SPACEBOY,1
13018,561871,JUMBO BAG ALPHABET,1
13018,548920,10 COLOUR SPACEBOY PEN,1
13018,568665,CERAMIC HEART FAIRY CAKE MONEY BANK,1
13018,578265,CHRISTMAS TREE HANGING SILVER,1
13018,562783,ICE CREAM SUNDAE LIP GLOSS,1
13018,575986,BLUE HARMONICA IN BOX,1
13018,575987,EMBROIDERED RIBBON REEL EMILY,1
13018,566006,FELTCRAFT BUTTERFLY HEARTS,1
13018,569868,WRAP POPPIES  DESIGN,1
13018,575986,VINTAGE SNAP CARDS,1
13018,556571,GIN AND TONIC MUG,1
13018,559455,SKULL SHOULDER BAG,1
13018,550342,CHILDRENS APRON APPLES DESIGN,1
13018,544904,RED RETROSPOT TEA CUP AND SAUCER,1
13018,544904,RED RETROSPOT BUTTER DISH,1
13018,550342,DOLLY GIRL CHILDRENS EGG CUP,1
13018,575202,FELTCRAFT CUSHION OWL,1
13018,550341,PENS ASSORTED FUNNY FACE,1
13018,575986,DOUGHNUT LIP GLOSS,1
13018,553235,BUNDLE OF 3 RETRO NOTE BOOKS,1
13018,554929,12 PENCILS TALL TUBE POSY,1
13018,569868,WALL ART CLASSIC PUDDINGS,1
13018,566006,REINDEER HEART DECORATION SILVER,1
13018,544904,SET 2 TEA TOWELS I LOVE LONDON,1
13018,548920,CUPBOARD 3 DRAWER MA CAMPAGNE,1
13018,553064,DOORMAT KEEP CALM AND COME IN,1
13018,553064,CHARLOTTE BAG ALPHABET  DESIGN,1
13018,568665,WRAP VINTAGE LEAF DESIGN,1
13018,578265,BUNDLE OF 3 RETRO NOTE BOOKS,1
13018,551199,CHOC TRUFFLE GOLD TRINKET POT,1
13018,554929,ICE CREAM PEN LIP GLOSS,1
13018,569868,FELTCRAFT 6 FLOWER FRIENDS,1
13018,575202,FELTCRAFT DOLL ROSIE,1
13018,556571,LUNCH BAG VINTAGE LEAF DESIGN,1
13018,566862,SET OF 6 RIBBONS VINTAGE CHRISTMAS,1
13018,566006,HEART WOODEN CHRISTMAS DECORATION,1
13269,548708,FELT TOADSTOOL  SMALL,1
13269,552007,WATERING CAN BLUE ELEPHANT,1
13269,548708,BLACK RECORD COVER FRAME,1
13269,569536,POPCORN HOLDER,1
13269,548708,60 TEATIME FAIRY CAKE CASES,1
13269,577141,VINTAGE CHRISTMAS GIFT SACK,1
13269,538645,CAKE PLATE LOVEBIRD WHITE,1
13269,548708,AIRLINE BAG VINTAGE JET SET WHITE,1
13269,548708,MAGIC DRAWING SLATE SPACEBOY,1
13269,548708,BATHROOM METAL SIGN,1
13269,550784,JUMBO BAG RED RETROSPOT,1
13269,552007,RED POLKADOT BEAKER,1
13269,566393,SET 6 SCHOOL MILK BOTTLES IN CRATE,1
13269,556528,SPACEBOY LUNCH BOX,1
13269,566393,JUMBO BAG ALPHABET,1
13269,569536,CHILLI LIGHTS,1
13269,537058,CHRISTMAS LIGHTS 10 REINDEER,1
13269,548708,WASHROOM METAL SIGN,1
13269,566393,HANGING CLEAR MINI BOTTLE,1
13269,556528,JAM JAR WITH GREEN LID,1
13269,564022,WOODEN FRAME ANTIQUE WHITE,1
13269,569536,SPOTTY BUNTING,1
13269,548708,PACK OF 60 PINK PAISLEY CAKE CASES,1
13269,556528,PAPER CHAIN KIT RETROSPOT,1
13269,556528,BLACK RECORD COVER FRAME,1
13269,548708,PLASTERS IN TIN SKULLS,1
13269,569536,JUMBO BAG VINTAGE LEAF,1
13269,550784,BULL DOG BOTTLE OPENER,1
13269,581415,RABBIT NIGHT LIGHT,1
13269,559811,RAIN PONCHO RETROSPOT,1
13269,579144,WALL ART BICYCLE SAFETY,1
13269,548708,PACK OF 6 SANDCASTLE FLAGS ASSORTED,1
13269,550784,PARTY METAL SIGN,1
13269,579144,RECIPE BOX RETROSPOT,1
13269,564022,JUMBO BAG RED RETROSPOT,1
13269,579144,RECIPE BOX PANTRY YELLOW DESIGN,1
13269,581415,SET OF 4 PANTRY JELLY MOULDS,1
13269,550784,RECYCLING BAG RETROSPOT,1
13269,569536,BLACK RECORD COVER FRAME,1
13269,577141,CHRISTMAS LIGHTS 10 REINDEER,1
13269,581415,HAND WARMER BIRD DESIGN,1
13269,550784,12 PINK HEN+CHICKS IN BASKET,1
13269,566393,PACK OF 12 VINTAGE CHRISTMAS TISSUE,1
13269,548708,FRENCH GARDEN SIGN BLUE METAL,1
13269,548708,HOT BATHS METAL SIGN,1
13269,548708,NATURAL SLATE RECTANGLE CHALKBOARD,1
13269,579144,WOODEN FRAME ANTIQUE WHITE,1
13269,577141,JUMBO BAG VINTAGE CHRISTMAS,1
13269,579144,WOODLAND SMALL RED FELT HEART,1
13269,581415,JAM MAKING SET PRINTED,1
13269,579144,PACK OF 72 RETROSPOT CAKE CASES,1
13269,564022,JUMBO BAG ALPHABET,1
13269,569536,WRAP PAISLEY PARK,1
13269,538645,STRAWBERRY CERAMIC TRINKET BOX,1
13269,577141,BOX OF 6 CHRISTMAS CAKE DECORATIONS,1
13269,548708,WHITE HANGING HEART T-LIGHT HOLDER,1
13269,569536,WALL ART MID CENTURY MODERN,1
13269,548708,ROSE COTTAGE KEEPSAKE BOX,1
13269,548708,"\"RECORD FRAME 7\"\" SINGLE SIZE \"",1
13269,581415,BICYCLE PUNCTURE REPAIR KIT,1
13269,537058,60 CAKE CASES VINTAGE CHRISTMAS,1
13269,538645,JUMBO BAG RED RETROSPOT,1
13269,548708,WRAP POPPIES  DESIGN,1
13269,577141,"\"RECORD FRAME 7\"\" SINGLE SIZE \"",1
13269,548708,PICNIC BASKET WICKER LARGE,1
13269,552007,RAIN PONCHO RETROSPOT,1
13269,566393,JUMBO BAG VINTAGE CHRISTMAS,1
13269,581415,RED HEART SHAPE LOVE BUCKET,1
13269,548708,PARTY BUNTING,1
13269,564022,WOODEN PICTURE FRAME WHITE FINISH,1
13269,581415,SET 7 BABUSHKA NESTING BOXES,1
13269,548708,SET/6 COLLAGE PAPER PLATES,1
13269,550784,JAM JAR WITH GREEN LID,1
13269,569537,BICYCLE SAFTEY WALL ART,1
13269,579144,PICTURE DOMINOES,1
13269,537058,CHRISTMAS LIGHTS 10 VINTAGE BAUBLES,1
13269,548708,AIRLINE BAG VINTAGE WORLD CHAMPION,1
13269,548708,ENAMEL MEASURING JUG CREAM,1
13269,548708,12 PINK HEN+CHICKS IN BASKET,1
13269,564022,DOLLY GIRL LUNCH BOX,1
13269,548708,EASTER TIN KEEPSAKE,1
13269,538645,PENS ASSORTED FUNNY FACE,1
13269,550784,WRAP I LOVE LONDON,1
13269,579144,SET OF 4 PANTRY JELLY MOULDS,1
13269,548708,FRENCH KITCHEN SIGN BLUE METAL,1
13269,548708,LONDON BUS COFFEE MUG,1
13269,548708,PACK OF 60 MUSHROOM CAKE CASES,1
13269,559811,WOODEN PICTURE FRAME WHITE FINISH,1
13269,548708,"SMALL POP BOX,FUNKY MONKEY",1
13269,552007,PICNIC BASKET WICKER SMALL,1
13269,579144,PENS ASSORTED FUNNY FACE,1
13269,550784,VICTORIAN SEWING BOX MEDIUM,1
13269,552007,SMALL POPCORN HOLDER,1
13269,538645,LUNCH BOX I LOVE LONDON,1
13269,548708,GLASS JAR ENGLISH CONFECTIONERY,1
13269,548708,60 CAKE CASES DOLLY GIRL DESIGN,1
13269,548708,SET 12 KIDS COLOUR  CHALK STICKS,1
13269,577141,MINI LIGHTS WOODLAND MUSHROOMS,1
13269,550784,JUMBO BAG ALPHABET,1
13269,566393,SET 12 KIDS COLOUR  CHALK STICKS,1
13269,569537,MINI PLAYING CARDS SPACEBOY,1
13269,577141,RECIPE BOX PANTRY YELLOW DESIGN,1
13269,548708,ENAMEL FIRE BUCKET CREAM,1
13269,577141,PLASTERS IN TIN STRONGMAN,1
13269,537058,HOT WATER BOTTLE BABUSHKA,1
13269,556528,JUMBO BAG RED RETROSPOT,1
13269,548708,BLUE PUDDING SPOON,1
13269,566393,BOX OF 6 MINI VINTAGE CRACKERS,1
13269,548708,PICTURE DOMINOES,1
13269,538645,RAIN PONCHO RETROSPOT,1
13269,556528,PENS ASSORTED FUNNY FACE,1
13269,564022,SPACEBOY LUNCH BOX,1
13269,548708,SMALL POPCORN HOLDER,1
13269,577141,GIFT BAG PSYCHEDELIC APPLES,1
13269,577141,SPACEBOY LUNCH BOX,1
13269,581415,SEWING BOX RETROSPOT DESIGN,1
13269,550784,EASTER TIN BUNNY BOUQUET,1
13269,566393,SET OF 4 KNICK KNACK TINS LEAF,1
13269,552007,ENAMEL BREAD BIN CREAM,1
13269,564022,MAGNETS PACK OF 4 SWALLOWS,1
13269,577141,WALL ART BICYCLE SAFETY,1
13269,548708,SET OF 4 NAPKIN CHARMS CUTLERY,1
13269,566393,ROLL WRAP VINTAGE CHRISTMAS,1
13269,538645,AIRLINE BAG VINTAGE TOKYO 78,1
13269,556528,SET OF 4 KNICK KNACK TINS LEAVES,1
13269,569537,70'S ALPHABET WALL ART,1
13269,548708,WATERING CAN PINK BUNNY,1
13269,548708,CHILDREN'S SPACEBOY MUG,1
13269,552007,VINTAGE HEADS AND TAILS CARD GAME,1
13269,564022,WRAP PAISLEY PARK,1
