16771,543022,SET 20 NAPKINS FAIRY CAKES DESIGN,0
16771,543022,GREY HEART HOT WATER BOTTLE,0
16771,546117,CERAMIC HEART FAIRY CAKE MONEY BANK,0
16771,543022,BROCADE RING PURSE,0
16771,543022,VICTORIAN SEWING BOX SMALL,0
16771,543022,METAL TUBE CHIME ON BAMBOO,0
16771,546117,HOME SWEET HOME METAL SIGN,0
16771,543022,PINK GAUZE BUTTERFLY LAMPSHADE,0
16771,543022,YOU'RE CONFUSING ME METAL SIGN,0
16771,546117,"DECORATION , WOBBLY CHICKEN, METAL",0
16771,574692,HEART OF WICKER SMALL,0
16771,540188,LOVE BUILDING BLOCK WORD,0
16771,543022,LIGHT GARLAND BUTTERFILES PINK,0
16771,546117,FELT EGG COSY BLUE RABBIT,0
16771,568198,HOME SWEET HOME MUG,0
16938,556484,HANGING ENGRAVED METAL HEART,0
16938,543174,EDWARDIAN PARASOL NATURAL,0
16938,556484,GARDENERS KNEELING PAD CUP OF TEA,0
16938,556484,SMALL IVORY HEART WALL ORGANISER,0
16938,556484,PINK HAPPY BIRTHDAY BUNTING,0
16938,556484,BLUE COAT RACK PARIS FASHION,0
16938,556484,RED RETROSPOT SMALL MILK JUG,0
16938,556484,CREAM SWEETHEART MINI CHEST,0
16938,556484,VINTAGE SNAKES & LADDERS,0
16938,556484,WHITE WOOD GARDEN PLANT LADDER,0
16938,556484,BLACK PIRATE TREASURE CHEST,0
16938,556484,CHILDRENS CUTLERY POLKADOT GREEN,0
16938,556484,CHILDRENS CUTLERY RETROSPOT RED,0
16938,556484,MEDIUM MEDINA STAMPED METAL BOWL,0
16938,556484,CHOCOLATE BOX RIBBONS,0
16938,556484,PAPER CHAIN KIT EMPIRE,0
16938,556484,FELTCRAFT HAIRBANDS PINK AND WHITE,0
16938,556484,FELTCRAFT DOLL EMILY,0
16938,556484,BAKING MOULD HEART WHITE CHOCOLATE,0
16938,556484,BUBBLEGUM RING ASSORTED,0
16938,556484,RETROSPOT LARGE MILK JUG,0
16938,556484,LOVE BUILDING BLOCK WORD,0
16938,556484,MEMO BOARD RETROSPOT  DESIGN,0
16938,556484,BOX OF VINTAGE ALPHABET BLOCKS,0
16938,556484,CALENDAR PAPER CUT DESIGN,0
16938,579940,LARGE CERAMIC TOP STORAGE JAR,0
16938,556484,PACK OF 72 SKULL CAKE CASES,0
16938,556484,SPACEBOY CHILDRENS EGG CUP,0
16938,579940,FELTCRAFT PRINCESS OLIVIA DOLL,0
16938,556484,LARGE RED RETROSPOT WINDMILL,0
16938,556484,GREEN VINTAGE SPOT BEAKER,0
16938,556484,PETIT TRAY CHIC,0
16938,556484,SET OF 6 SOLDIER SKITTLES,0
16938,556484,MEDIUM CERAMIC TOP STORAGE JAR,0
16938,556484,PARTY INVITES DINOSAURS,0
16938,579940,SET OF 3 REGENCY CAKE TINS,0
16938,556484,RED RETROSPOT CAKE STAND,0
16938,556484,RIBBON REEL HEARTS DESIGN,0
16938,543174,VINTAGE SNAP CARDS,0
16938,556484,BAKING MOULD ROSE WHITE CHOCOLATE,0
16938,556484,HOLIDAY FUN LUDO,0
16938,556484,FELTCRAFT PRINCESS LOLA DOLL,0
16938,556484,BAKING MOULD HEART MILK CHOCOLATE,0
16938,556484,SET/10 PINK POLKADOT PARTY CANDLES,0
16938,556484,JUNGLE POPSICLES ICE LOLLY MOULDS,0
16938,556484,PINK BLUE FELT CRAFT TRINKET BOX,0
16938,556484,HOME BUILDING BLOCK WORD,0
16938,556484,TEA TIME PARTY BUNTING,0
16938,556484,CHILDRENS CUTLERY POLKADOT PINK,0
16938,556484,CLOCK MAGNET MUM'S KITCHEN,0
16938,556484,CHILDRENS CUTLERY POLKADOT PINK,0
16938,579940,MEDIUM CERAMIC TOP STORAGE JAR,0
16938,556484,COTTON APRON PANTRY DESIGN,0
16938,556484,MAGNETS PACK OF 4 HOME SWEET HOME,0
16938,579940,WRAP  VINTAGE DOILY,0
16938,556484,BLUE FLY SWAT,0
16938,556484,PICTURE DOMINOES,0
16938,579940,WRAP PAISLEY PARK,0
16938,556484,SET OF 4 PANTRY JELLY MOULDS,0
16938,556484,BOX OF VINTAGE JIGSAW BLOCKS,0
16938,556484,FELTCRAFT DOLL MOLLY,0
16938,556484,SWEETHEART RECIPE BOOK STAND,0
16938,556484,WHITE JEWELLED HEART DECORATION,0
16938,556484,BAKING MOULD CHOCOLATE CUPCAKES,0
16938,556484,PACK OF 60 MUSHROOM CAKE CASES,0
16938,556484,BABY BOOM RIBBONS,0
16938,556484,FELTCRAFT GIRL AMELIE KIT,0
16938,556484,FELTCRAFT HAIRBAND PINK AND PURPLE,0
16938,556484,PARTY INVITES SPACEMAN,0
16938,556484,SET OF 3 REGENCY CAKE TINS,0
16938,556484,SET OF 4 KNICK KNACK TINS DOILEY,0
16938,556484,SET OF 3 CAKE TINS PANTRY DESIGN,0
16938,556484,FELTCRAFT GIRL NICOLE KIT,0
16938,556484,SET 12 KIDS COLOUR  CHALK STICKS,0
16938,556484,FRENCH ENAMEL CANDLEHOLDER,0
16938,556484,RED SPOT CERAMIC DRAWER KNOB,0
16938,579940,FELTCRAFT PRINCESS CHARLOTTE DOLL,0
16938,543174,ROMANTIC PINKS RIBBONS,0
16938,556484,CHILDRENS CUTLERY SPACEBOY,0
16938,556484,WOODEN HAPPY BIRTHDAY GARLAND,0
16938,556484,LUNCH BAG DOILEY PATTERN,0
16938,556484,SET/6 PINK  BUTTERFLY T-LIGHTS,0
16938,579940,PAPER CHAIN KIT 50'S CHRISTMAS,0
16938,556484,MUM'S KITCHEN CLOCK,0
16938,556484,RETROSPOT TEA SET CERAMIC 11 PC,0
16938,556484,SET OF 4 JAM JAR MAGNETS,0
16938,556484,JAM MAKING SET PRINTED,0
16938,556484,BAKING MOULD ROSE MILK CHOCOLATE,0
16938,556484,60 TEATIME FAIRY CAKE CASES,0
16938,556484,EMERGENCY FIRST AID TIN,0
16938,556484,HERB MARKER BASIL,0
16938,556484,TRADITIONAL WOODEN CATCH CUP GAME,0
16938,556484,LUNCH BAG  BLACK SKULL.,0
16938,556484,EGG FRYING PAN RED,0
16938,556484,SET OF TEA COFFEE SUGAR TINS PANTRY,0
16938,556484,SMALL WHITE HEART OF WICKER,0
16938,556484,SMALL SKULL WINDMILL,0
16938,556484,LARGE IVORY HEART WALL ORGANISER,0
16938,556484,LARGE WHITE HEART OF WICKER,0
16938,556484,DOG BOWL VINTAGE CREAM,0
16938,556484,TREASURE TIN BUFFALO BILL,0
16938,556484,RECIPE BOX RETROSPOT,0
16938,556484,MAGNETS PACK OF 4 VINTAGE LABELS,0
16938,556484,SET OF SALT AND PEPPER TOADSTOOLS,0
16938,579940,CHILDRENS CUTLERY POLKADOT PINK,0
16938,556484,PINK POLKADOT WRAP,0
16938,556484,ANTIQUE IVORY WIRE BOWL SMALL,0
16938,556484,IVORY SWEETHEART WIRE LETTER RACK,0
16938,556484,ROUND SNACK BOXES SET OF 4 SKULLS,0
16938,556484,SET OF 9 BLACK SKULL BALLOONS,0
16938,556484,TREASURE TIN GYMKHANA DESIGN,0
16938,556484,FELTCRAFT PRINCESS OLIVIA DOLL,0
16938,543174,STRAWBERRY LUNCH BOX WITH CUTLERY,0
16938,556484,JAM CLOCK MAGNET,0
16938,556484,SMALL RED RETROSPOT WINDMILL,0
16938,556484,PARTY BUNTING,0
16938,556484,MAGNETS PACK OF 4 RETRO PHOTO,0
16938,579940,RECIPE BOX PANTRY YELLOW DESIGN,0
16938,556484,PARTY INVITES JAZZ HEARTS,0
16938,579940,RABBIT NIGHT LIGHT,0
16938,543174,6 RIBBONS RUSTIC CHARM,0
16938,556484,PAPERWEIGHT VINTAGE COLLAGE,0
16938,543174,JAM JAR WITH PINK LID,0
16938,556484,FOOD COVER WITH BEADS SET 2,0
16938,556484,CAT BOWL VINTAGE CREAM,0
16938,543174,VINTAGE HEADS AND TAILS CARD GAME,0
16938,556484,SET OF 4 KNICK KNACK TINS POPPIES,0
16938,556484,CHILDRENS CUTLERY POLKADOT BLUE,0
16938,556484,TRADITIONAL KNITTING NANCY,0
16938,556484,ROUND SNACK BOXES SET OF4 WOODLAND,0
16938,556484,TEA BAG PLATE RED RETROSPOT,0
16938,579940,FELTCRAFT PRINCESS LOLA DOLL,0
16938,556484,FELTCRAFT PRINCESS CHARLOTTE DOLL,0
16938,579940,RETROSPOT TEA SET CERAMIC 11 PC,0
16938,556484,KNEELING MAT HOUSEWORK  DESIGN,0
16938,556484,EMPIRE GIFT WRAP,0
16938,556484,WHITE SPOT RED CERAMIC DRAWER KNOB,0
16938,543174,RECIPE BOX PANTRY YELLOW DESIGN,0
16938,556484,CERAMIC PIRATE CHEST MONEY BANK,0
16938,556484,SET OF 36 TEATIME PAPER DOILIES,0
16938,556484,TOADSTOOL MONEY BOX,0
16938,556484,RED TOADSTOOL LED NIGHT LIGHT,0
16938,543174,WHITE HANGING HEART T-LIGHT HOLDER,0
16938,556484,DOILEY STORAGE TIN,0
16938,556484,ENAMEL MEASURING JUG CREAM,0
16938,556484,POPPY'S PLAYHOUSE BEDROOM,0
16938,556484,SET/6 TURQUOISE BUTTERFLY T-LIGHTS,0
16938,556484,FELTCRAFT 6 FLOWER FRIENDS,0
16938,556484,PICTURE DOMINOES,0
16938,556484,3 TRADITIONAl BISCUIT CUTTERS  SET,0
16938,556484,SILVER HEARTS TABLE DECORATION,0
16938,556484,SET OF 4 PANTRY JELLY MOULDS,0
16938,556484,SPOTTY BUNTING,0
16938,556484,IVORY WIRE SWEETHEART LETTER TRAY,0
16938,556484,COOK WITH WINE METAL SIGN,0
16938,556484,GREEN GIANT GARDEN THERMOMETER,0
16938,556484,JUMBO BAG WOODLAND ANIMALS,0
16938,543174,PAPER CHAIN KIT SKULLS,0
16938,556484,PINK VINTAGE PAISLEY PICNIC BAG,0
16938,543174,BLUE 3 PIECE POLKADOT CUTLERY SET,0
16938,556484,SET 2 PANTRY DESIGN TEA TOWELS,0
16938,579940,PINK POLKADOT WRAP,0
16938,579940,SET OF 6 3D KIT CARDS FOR KIDS,0
16938,556484,3 STRIPEY MICE FELTCRAFT,0
16938,556484,LARGE ROUND WICKER PLATTER,0
16938,556484,4 TRADITIONAL SPINNING TOPS,0
16938,543174,DINOSAUR LUNCH BOX WITH CUTLERY,0
16938,556484,STRIPES DESIGN MONKEY DOLL,0
16938,556484,RED COAT RACK PARIS FASHION,0
16938,556484,PARTY INVITES WOODLAND,0
16938,556484,SCANDINAVIAN REDS RIBBONS,0
16938,556484,BLUE CIRCLES DESIGN TEDDY,0
16938,556484,RED RETROSPOT SUGAR JAM BOWL,0
16938,556484,3 TRADITIONAl BISCUIT CUTTERS  SET,0
16938,556484,BUNDLE OF 3 ALPHABET EXERCISE BOOKS,0
16938,556484,BULL DOG BOTTLE TOP WALL CLOCK,0
16938,556484,CLASSIC METAL BIRDCAGE PLANT HOLDER,0
16938,556484,LUNCH BAG WOODLAND,0
16938,556484,PACK OF 60 PINK PAISLEY CAKE CASES,0
16938,556484,SWEETHEART WIRE MAGAZINE RACK,0
16938,556484,BRIGHT BLUES RIBBONS,0
16938,556484,SET OF 5 MINI GROCERY MAGNETS,0
16938,556484,BLUE POLKADOT WRAP,0
16938,556484,BLUE SPOT CERAMIC DRAWER KNOB,0
16938,556484,PINK FLY SWAT,0
16938,556484,WHITE HEARTS WIRE PLANT POT HOLDER,0
16938,556484,RED METAL BOX TOP SECRET,0
16938,556484,JUMBO STORAGE BAG SKULLS,0
16938,556484,GARDENERS KNEELING PAD KEEP CALM,0
16938,543174,PINK 3 PIECE POLKADOT CUTLERY SET,0
16938,556484,NATURAL SLATE HEART CHALKBOARD,0
16938,579940,FELTCRAFT HAIRBAND RED AND BLUE,0
16938,556484,BULL DOG BOTTLE OPENER,0
16938,556484,WHITE SPOT BLUE CERAMIC DRAWER KNOB,0
16938,556484,PINK VINTAGE SPOT BEAKER,0
16938,556484,JAM MAKING SET WITH JARS,0
16938,556484,PACK OF 72 RETROSPOT CAKE CASES,0
16938,579940,FELTCRAFT GIRL NICOLE KIT,0
16938,556484,HEART OF WICKER LARGE,0
16938,556484,SET/10 BLUE POLKADOT PARTY CANDLES,0
16938,556484,RED RETROSPOT BUTTER DISH,0
16938,556484,T-LIGHT HOLDER SWEETHEART HANGING,0
16938,556484,"ART LIGHTS,FUNK MONKEY",0
16938,579940,SET OF 4 KNICK KNACK TINS DOILY,0
16938,543174,EDWARDIAN PARASOL BLACK,0
16938,556484,MOTHER'S KITCHEN SPOON REST,0
16938,556484,LARGE SKULL WINDMILL,0
16938,556484,POPPY'S PLAYHOUSE KITCHEN,0
16938,556484,SET OF 60 PANTRY DESIGN CAKE CASES,0
16938,556484,12 COLOURED PARTY BALLOONS,0
16938,556484,WHITE HANGING HEART T-LIGHT HOLDER,0
16938,556484,SET 12 RETRO WHITE CHALK STICKS,0
16938,556484,SMALL CERAMIC TOP STORAGE JAR,0
16938,556484,BLUE VINTAGE SPOT BEAKER,0
16938,556484,FELTCRAFT HAIRBAND PINK AND BLUE,0
16938,579940,TRADITIONAL NAUGHTS & CROSSES,0
16938,556484,JUMBO BAG PINK VINTAGE PAISLEY,0
16938,556484,POPPY'S PLAYHOUSE LIVINGROOM,0
16938,556484,PINK CREAM FELT CRAFT TRINKET BOX,0
16938,556484,SET OF 36 DOILIES PANTRY DESIGN,0
16938,556523,HERB MARKER BASIL,0
16938,579940,WRAP FLOWER SHOP,0
16938,556484,CHOCOLATE THIS WAY METAL SIGN,0
16938,556484,SET OF 5 PANCAKE DAY MAGNETS,0
16938,579940,SET OF TEA COFFEE SUGAR TINS PANTRY,0
16938,556484,LUNCH BAG PINK POLKADOT,0
16938,556484,RABBIT NIGHT LIGHT,0
16938,556484,BLUE GIANT GARDEN THERMOMETER,0
16938,556484,PAPERWEIGHT HOME SWEET HOME,0
16938,556484,3 PIECE SPACEBOY COOKIE CUTTER SET,0
16938,556484,6 RIBBONS RUSTIC CHARM,0
16938,556484,CALENDAR FAMILY FAVOURITES,0
16938,556484,LARGE CERAMIC TOP STORAGE JAR,0
16938,556484,SMALL DECO JEWELLERY STAND,0
16938,556484,ROUND SNACK BOXES SET OF 4 FRUITS,0
16983,546425,GARLAND WOODEN HAPPY EASTER,0
16983,565407,FELTCRAFT CUSHION OWL,0
16983,537134,SCOTTIE DOG HOT WATER BOTTLE,0
16983,556479,PAPER CHAIN KIT RETROSPOT,0
16983,578924,PLASTERS IN TIN SPACEBOY,0
16983,578924,SET OF 2 CERAMIC CHRISTMAS TREES,0
16983,565407,10 COLOUR SPACEBOY PEN,0
16983,546425,BUNNY WOODEN PAINTED WITH FLOWER,0
16983,565407,PIECE OF CAMO STATIONERY SET,0
16983,541858,SPACEBOY BIRTHDAY CARD,0
16983,565407,MINI JIGSAW SPACEBOY,0
16983,556479,PAPER CHAIN KIT EMPIRE,0
16983,565407,12 PENCILS TALL TUBE WOODLAND,0
16983,578924,FOLKART STAR CHRISTMAS DECORATIONS,0
16983,541858,CARD BILLBOARD FONT,0
16983,546425,FELTCRAFT CUSHION OWL,0
16983,575950,CHRISTMAS PUDDING TRINKET POT,0
16983,556479,FELTCRAFT CUSHION RABBIT,0
16983,565407,WOODEN BOX OF DOMINOES,0
16983,575950,FELTCRAFT CUSHION OWL,0
16983,565407,MAGIC DRAWING SLATE BUNNIES,0
16983,537134,FELTCRAFT DOLL MOLLY,0
16983,575950,RED FLORAL FELTCRAFT SHOULDER BAG,0
16983,546425,BUNNY WOODEN PAINTED WITH BIRD,0
16983,575950,WHITE SKULL HOT WATER BOTTLE,0
16983,565407,RED PUDDING SPOON,0
16983,565407,FELTCRAFT GIRL AMELIE KIT,0
16983,578924,HOT WATER BOTTLE KEEP CALM,0
16983,546425,FELTCRAFT CUSHION RABBIT,0
16983,565407,PLASTERS IN TIN SPACEBOY,0
16983,565407,PLASTERS IN TIN VINTAGE PAISLEY,0
16983,541858,CARD WEDDING DAY,0
16983,565407,10 COLOUR SPACEBOY PEN,0
16983,541858,FELTCRAFT CUSHION BUTTERFLY,0
16983,546425,FELT TOADSTOOL  SMALL,0
16983,578924,DOCTOR'S BAG SOFT TOY,0
16983,578924,3 WHITE CHOC MORRIS BOXED CANDLES,0
16983,541858,DOORMAT TOPIARY,0
16983,546425,FELT TOADSTOOL LARGE,0
16983,565407,FELTCRAFT CUSHION RABBIT,0
16983,575950,SET OF 3 WOODEN TREE DECORATIONS,0
16983,578924,PICTURE DOMINOES,0
16983,541858,MOUSE TOY WITH PINK T-SHIRT,0
16983,556479,WOODEN BOX OF DOMINOES,0
16983,575950,CHRISTMAS PUDDING TRINKET POT,0
16983,578924,GIRAFFE WOODEN RULER,0
16983,546425,PAINTED PINK RABBIT,0
16983,546425,FELT EGG COSY CHICKEN,0
16983,556479,PAPER CHAIN KIT LONDON,0
16983,541858,FELTCRAFT CUSHION RABBIT,0
16983,578924,SCENTED VELVET LOUNGE CANDLE,0
16983,541858,BOTANICAL ROSE GREETING CARD,0
16983,541858,SWEETHEART CAKESTAND 3 TIER,0
16983,565407,SWEETHEART 3 TIER CAKE STAND,0
16983,565407,MAGIC SHEEP WOOL GROWING FROM PAPER,0
16983,578924,CHRISTMAS PUDDING TRINKET POT,0
16983,565407,MAGIC DRAWING SLATE DINOSAUR,0
16983,565407,SET/4 BADGES BEETLES,0
16983,565407,DOGGY RUBBER,0
16983,556479,RED FLORAL FELTCRAFT SHOULDER BAG,0
16983,556479,PINK FLORAL FELTCRAFT SHOULDER BAG,0
16983,541858,COWBOYS AND INDIANS BIRTHDAY CARD,0
16983,537134,CHRISTMAS TREE HEART DECORATION,0
16983,541858,T-LIGHT HOLDER SWEETHEART HANGING,0
16983,575950,PLASTERS IN TIN SPACEBOY,0
16983,556479,PLASTERS IN TIN VINTAGE PAISLEY,0
16983,565407,FELTCRAFT CHRISTMAS FAIRY,0
16983,578924,PLASTERS IN TIN SKULLS,0
16983,575950,WOODEN TREE CHRISTMAS SCANDINAVIAN,0
16983,565407,FELTCRAFT CUSHION BUTTERFLY,0
16983,575950,WOODEN STAR CHRISTMAS SCANDINAVIAN,0
16983,565407,YULETIDE IMAGES GIFT WRAP SET,0
16983,575950,PLASTERS IN TIN VINTAGE PAISLEY,0
16983,578924,TRADITIONAL PICK UP STICKS GAME,0
16983,556479,SPACEBOY BABY GIFT SET,0
16983,556479,JAZZ HEARTS PURSE NOTEBOOK,0
16983,578924,REVOLVER WOODEN RULER,0
16983,565407,PLASTERS IN TIN WOODLAND ANIMALS,0
16983,565407,12 PENCILS SMALL TUBE SKULL,0
16983,546425,PAINTED YELLOW WOODEN DAISY,0
16983,575950,WOODEN HEART CHRISTMAS SCANDINAVIAN,0
16983,565407,GIRAFFE WOODEN RULER,0
16983,565407,FELTCRAFT GIRL NICOLE KIT,0
16983,575950,CHRISTMAS TREE STAR DECORATION,0
16983,537134,WHITE CHRISTMAS STAR DECORATION,0
16983,575950,PINK FLORAL FELTCRAFT SHOULDER BAG,0
16983,565407,MAGIC DRAWING SLATE SPACEBOY,0
16983,575950,TOOL BOX SOFT TOY,0
16983,537134,FAWN BLUE HOT WATER BOTTLE,0
16983,556479,FELTCRAFT DOLL ROSIE,0
16983,556479,PLASTERS IN TIN STRONGMAN,0
16983,556479,ZINC HERB GARDEN CONTAINER,0
16983,556479,PLASTERS IN TIN WOODLAND ANIMALS,0
16983,575950,ROCKING HORSE GREEN CHRISTMAS,0
16983,556479,"NURSERY A,B,C PAINTED LETTERS",0
16983,575950,ENGLISH ROSE HOT WATER BOTTLE,0
16983,541858,FAWN AND MUSHROOM GREETING CARD,0
16983,578924,PLASTERS IN TIN CIRCUS PARADE,0
16983,565407,MINI JIGSAW DINOSAUR,0
16983,565407,SLEEPING CAT ERASERS,0
16983,556479,FELTCRAFT CUSHION BUTTERFLY,0
16983,575950,RETROSPOT HEART HOT WATER BOTTLE,0
16983,546425,ROSE 1 WICK MORRIS BOXED CANDLE,0
16983,578924,WOODEN BOX OF DOMINOES,0
16983,565407,IVORY PAPER CUP CAKE CASES,0
16983,565407,12 PENCIL SMALL TUBE WOODLAND,0
16983,546425,WOODEN HAPPY BIRTHDAY GARLAND,0
16983,565407,SET OF 72 RETROSPOT PAPER  DOILIES,0
16983,565407,FELTCRAFT HAIRBAND PINK AND PURPLE,0
16983,575950,LOVE HOT WATER BOTTLE,0
16983,556479,DOCTOR'S BAG SOFT TOY,0
16983,578924,CHRISTMAS HANGING STAR WITH BELL,0
16983,565407,SMALL BLUE PROVENCAL CERAMIC BALL,0
16983,546425,RED RETROSPOT PICNIC BAG,0
16983,565407,JAZZ HEARTS PURSE NOTEBOOK,0
16983,556479,TOOL BOX SOFT TOY,0
16983,565407,SET OF 6 3D KIT CARDS FOR KIDS,0
16983,546425,FELT EGG COSY WHITE RABBIT,0
16983,537134,REX CASH+CARRY JUMBO SHOPPER,0
16983,565407,75 GREEN FAIRY CAKE CASES,0
16983,565407,WOOD STAMP SET BEST WISHES,0
16983,546425,CANDY SPOT EGG WARMER RABBIT,0
16983,575950,HENRIETTA HEN MUG,0
16983,575950,DOG TOY WITH PINK CROCHET SKIRT,0
16983,578924,LOVE HOT WATER BOTTLE,0
16983,546425,GARDENIA 1 WICK MORRIS BOXED CANDLE,0
16983,546425,FELTCRAFT CUSHION BUTTERFLY,0
16983,556479,FELTCRAFT DOLL MOLLY,0
16983,578924,NOEL WOODEN BLOCK LETTERS,0
16983,546425,CERAMIC BIRDHOUSE CRESTED TIT SMALL,0
16983,537134,FELTCRAFT CUSHION RABBIT,0
16983,565407,PACK OF 12 TRADITIONAL CRAYONS,0
16983,565407,MAGIC DRAWING SLATE PURDEY,0
16983,537134,FELTCRAFT DOLL MARIA,0
16983,565407,WHITE BROCANTE SOAP DISH,0
16983,575950,ROCKING HORSE RED CHRISTMAS,0
16983,556479,WOODLAND PARTY BAG + STICKER SET,0
16983,537134,FELTCRAFT DOLL ROSIE,0
16983,565407,FELTCRAFT HAIRBAND PINK AND PURPLE,0
16983,541858,CARD BIRTHDAY COWBOY,0
16983,565407,PLASTERS IN TIN SKULLS,0
16983,565407,BLUE PUDDING SPOON,0
16983,541858,BUNNY EGG BOX,0
17187,551271,SET 2 TEA TOWELS I LOVE LONDON,2
17187,551271,GUMBALL COAT RACK,2
17187,551271,PICNIC BASKET WICKER SMALL,2
17187,551271,APRON MODERN VINTAGE COTTON,2
17187,551271,PICNIC BASKET WICKER LARGE,2
17187,551271,BOX OF 24 COCKTAIL PARASOLS,2
17187,551271,SWEETHEART CAKESTAND 3 TIER,2
17187,551271,SANDALWOOD FAN,2
17187,551271,PING MICROWAVE APRON,2
17187,551271,ASSORTED COLOURS SILK FAN,2
17338,563565,RETROSPOT RED WASHING UP GLOVES,1
17338,578041,SPACEBOY LUNCH BOX,1
17338,540968,TV DINNER TRAY AIR HOSTESS,1
17338,558709,LARGE ANTIQUE WHITE PHOTO FRAME,1
17338,563565,CARD HOLDER GINGHAM HEART,1
17338,578041,SET OF 6 SPICE TINS PANTRY DESIGN,1
17338,538626,MIRRORED DISCO BALL,1
17338,563565,RED RETROSPOT LUGGAGE TAG,1
17338,544586,TV DINNER TRAY AIR HOSTESS,1
17338,550477,ROUND SNACK BOXES SET OF4 WOODLAND,1
17338,558709,CHINESE DRAGON PAPER LANTERNS,1
17338,538626,36 PENCILS TUBE WOODLAND,1
17338,544586,LARGE MEDINA STAMPED METAL BOWL,1
17338,563565,TRIPLE HOOK ANTIQUE IVORY ROSE,1
17338,578041,HAND WARMER UNION JACK,1
17338,544586,PACK OF 72 RETROSPOT CAKE CASES,1
17338,550477,SET OF 3 CAKE TINS SKETCHBOOK,1
17338,563565,METAL SIGN TAKE IT OR LEAVE IT,1
17338,578041,PANTRY MAGNETIC  SHOPPING LIST,1
17338,550477,72 SWEETHEART FAIRY CAKE CASES,1
17338,578041,REGENCY CAKESTAND 3 TIER,1
17338,540968,DISCO BALL ROTATOR BATTERY OPERATED,1
17338,578041,72 SWEETHEART FAIRY CAKE CASES,1
17338,538626,PAPER CHAIN KIT 50'S CHRISTMAS,1
17338,544586,SPACE CADET BLACK,1
17338,544586,SPACEBOY LUNCH BOX,1
17338,550477,DOLLY GIRL LUNCH BOX,1
17338,563565,MOODY BOY  DOOR HANGER,1
17338,578041,LANTERN CREAM GAZEBO,1
17338,538626,MAGIC DRAWING SLATE DOLLY GIRL,1
17338,540968,DOORMAT UNION FLAG,1
17338,540968,SAVE THE PLANET COTTON TOTE BAG,1
17338,550477,WOODEN UNION JACK BUNTING,1
17338,550477,ZINC HEART LATTICE T-LIGHT HOLDER,1
17338,558709,RED PAPER PARASOL,1
17338,544586,SMALL PURPLE BABUSHKA NOTEBOOK,1
17338,550477,SET OF 3 BUTTERFLY COOKIE CUTTERS,1
17338,550477,LOVEBIRD HANGING DECORATION WHITE,1
17338,558709,RETROSPOT TEA SET CERAMIC 11 PC,1
17338,563565,ZINC HEART LATTICE T-LIGHT HOLDER,1
17338,578041,ASSORTED COLOUR MINI CASES,1
17338,578041,KEY RING BASEBALL BOOT UNION JACK,1
17338,544586,HANGING CHICK  YELLOW DECORATION,1
17338,553710,BEWARE OF THE CAT METAL SIGN,1
17338,544586,12 COLOURED PARTY BALLOONS,1
17338,544586,SET/5 RED RETROSPOT LID GLASS BOWLS,1
17338,553710,FELTCRAFT PRINCESS CHARLOTTE DOLL,1
17338,558709,ROUND SNACK BOXES SET OF 4 FRUITS,1
17338,544586,POPPY'S PLAYHOUSE LIVINGROOM,1
17338,550477,ZINC HEART LATTICE T-LIGHT HOLDER,1
17338,563565,QUEENS GUARD COFFEE MUG,1
17338,563565,Manual,1
17338,578041,WALL ART TREASURE AHOY,1
17338,578041,PACK OF 6 SMALL FRUIT STRAWS,1
17338,578041,RECIPE BOX RETROSPOT,1
17338,550477,POPPY'S PLAYHOUSE BEDROOM,1
17338,538626,FAWN BLUE HOT WATER BOTTLE,1
17338,540968,RED RETROSPOT SHOPPER BAG,1
17338,544586,PORCELAIN BUTTERFLY OIL BURNER,1
17338,563565,FELTCRAFT PRINCESS CHARLOTTE DOLL,1
17338,544586,3 GARDENIA MORRIS BOXED CANDLES,1
17338,553710,SPACEBOY LUNCH BOX,1
17338,553710,SET OF 3 CAKE TINS SKETCHBOOK,1
17338,544586,BEWARE OF THE CAT METAL SIGN,1
17338,563565,SET OF 6 GIRLS CELEBRATION CANDLES,1
17338,578041,EMBOSSED HEART TRINKET BOX,1
17338,544586,SALLE DE BAIN HOOK,1
17338,544586,BLUE TEA TOWEL CLASSIC DESIGN,1
17338,553710,HAND OVER THE CHOCOLATE   SIGN,1
17338,563565,MINI WOODEN HAPPY BIRTHDAY GARLAND,1
17338,563565,SMALL ZINC/GLASS CANDLEHOLDER,1
17338,578041,ROTATING LEAVES T-LIGHT HOLDER,1
17338,550477,DOORMAT SPOTTY HOME SWEET HOME,1
17338,563565,12 COLOURED PARTY BALLOONS,1
17338,578041,WHITE SAGE INCENSE,1
17338,558709,RECIPE BOX RETROSPOT,1
17338,563565,3 TIER CAKE TIN RED AND CREAM,1
17338,578041,3 DRAWER ANTIQUE WHITE WOOD CABINET,1
17338,578041,DOLLY GIRL LUNCH BOX,1
17338,550477,RECIPE BOX PANTRY YELLOW DESIGN,1
17338,550477,RED RETROSPOT PEG BAG,1
17338,540968,FOUR HOOK  WHITE LOVEBIRDS,1
17338,544586,RED RETROSPOT UMBRELLA,1
17338,563565,"FEATHER PEN,HOT PINK",1
17338,538626,PIGGY BANK RETROSPOT,1
17338,540968,SET OF 3 HEART COOKIE CUTTERS,1
17338,550477,LETS GO SHOPPING COTTON TOTE BAG,1
17338,578041,RED RETROSPOT UMBRELLA,1
17338,578041,3 HEARTS HANGING DECORATION RUSTIC,1
17338,540968,WALL TIDY RETROSPOT,1
17338,540968,PINK HEART SHAPE PHOTO FRAME,1
17338,544586,SET OF 3 CAKE TINS SKETCHBOOK,1
17338,553710,DOLLY GIRL LUNCH BOX,1
17338,563565,PINK FLORAL FELTCRAFT SHOULDER BAG,1
17338,540968,GLOW IN DARK DOLPHINS,1
17338,553710,SET/3 OCEAN SCENT CANDLE JEWEL BOX,1
17338,563565,ASSORTED COLOUR MINI CASES,1
17338,578041,PENCIL CASE LIFE IS BEAUTIFUL,1
17338,540968,CLASSIC WHITE FRAME,1
17338,544586,MOROCCAN TEA GLASS,1
17338,550477,GINGERBREAD MAN COOKIE CUTTER,1
17338,563565,LONDON BUS COFFEE MUG,1
17338,578041,GIANT 50'S CHRISTMAS CRACKER,1
17338,550477,NATURAL SLATE RECTANGLE CHALKBOARD,1
17338,553710,SET/3 VANILLA SCENTED CANDLE IN BOX,1
17338,563565,MEDIUM MEDINA STAMPED METAL BOWL,1
17338,563565,BALLOON PUMP WITH 10 BALLOONS,1
17338,578041,GREY HEART HOT WATER BOTTLE,1
17338,578041,ALUMINIUM STAMPED HEART,1
17338,578041,BOX OF 24 COCKTAIL PARASOLS,1
17338,540968,3 GARDENIA MORRIS BOXED CANDLES,1
17338,544586,TV DINNER TRAY DOLLY GIRL,1
17338,553710,SET/5 RED RETROSPOT LID GLASS BOWLS,1
17338,540968,LARGE CIRCULAR MIRROR MOBILE,1
17338,558709,PAPER BUNTING RETROSPOT,1
17338,563565,SET OF 2 TINS VINTAGE BATHROOM,1
17338,538626,VANILLA SCENT CANDLE JEWELLED BOX,1
17338,538626,SET OF 6 SOLDIER SKITTLES,1
17338,540968,FAMILY PHOTO FRAME CORNICE,1
17338,540968,SCOTTIE DOG HOT WATER BOTTLE,1
17338,563565,LANTERN CREAM GAZEBO,1
17338,540968,HOT WATER BOTTLE BABUSHKA,1
17338,540968,RED RETROSPOT LUGGAGE TAG,1
17338,544586,FELTCRAFT DOLL MARIA,1
17338,544586,WOODEN BOX OF DOMINOES,1
17338,544586,36 DOILIES DOLLY GIRL,1
17338,563565,HEART FILIGREE DOVE  SMALL,1
17338,563565,TOAST ITS - HAPPY BIRTHDAY,1
17338,538626,CORONA MEXICAN TRAY,1
17338,538626,RECIPE BOX RETROSPOT,1
17338,544586,LUNCH BOX I LOVE LONDON,1
17338,550477,PICNIC BOXES SET OF 3 RETROSPOT,1
17338,563565,"SET 3 RETROSPOT TEA,COFFEE,SUGAR",1
17338,538626,OCEAN SCENT CANDLE IN JEWELLED BOX,1
17338,550477,SET/5 RED RETROSPOT LID GLASS BOWLS,1
17338,578041,GREY HEART HOT WATER BOTTLE,1
17338,578041,IVORY WICKER HEART MEDIUM,1
17338,540968,SET/3 VANILLA SCENTED CANDLE IN BOX,1
17338,553710,WATERING CAN BLUE ELEPHANT,1
17338,558709,DOLLY GIRL LUNCH BOX,1
17338,558709,SILVER HEARTS TABLE DECORATION,1
17338,563565,PHOTO FRAME CORNICE,1
17338,544586,RETROSPOT RED WASHING UP GLOVES,1
17338,544586,SCOTTIE DOG HOT WATER BOTTLE,1
17338,538626,CHOCOLATE HOT WATER BOTTLE,1
17338,550477,TRANQUILITY MASALA INCENSE,1
17338,578041,4 IVORY DINNER CANDLES SILVER FLOCK,1
17338,544586,CHOCOLATE HOT WATER BOTTLE,1
17338,558709,AGED GLASS SILVER T-LIGHT HOLDER,1
17338,563565,FOLDING UMBRELLA RED/WHITE POLKADOT,1
17338,544586,LETS GO SHOPPING COTTON TOTE BAG,1
17338,563565,BALLOON WATER BOMB PACK OF 35,1
17338,578041,GRAND CHOCOLATECANDLE,1
17338,578041,ENGLISH ROSE HOT WATER BOTTLE,1
17338,538626,SET/3 VANILLA SCENTED CANDLE IN BOX,1
17338,540968,RED RETROSPOT CHILDRENS UMBRELLA,1
17338,563565,"FEATHER PEN,COAL BLACK",1
17338,578041,LUNCH BOX I LOVE LONDON,1
17338,540968,DOLLY GIRL LUNCH BOX,1
17338,553710,WOODEN PICTURE FRAME WHITE FINISH,1
17338,563565,PIGGY BANK RETROSPOT,1
17338,578041,LAUREL STAR ANTIQUE SILVER,1
17338,538626,PORCELAIN T-LIGHT HOLDERS ASSORTED,1
17338,550477,SET/6 TURQUOISE BUTTERFLY T-LIGHTS,1
17338,563565,3D SHEET OF CAT STICKERS,1
17338,578041,SET/20 RED RETROSPOT PAPER NAPKINS,1
17338,538626,DOLLY GIRL LUNCH BOX,1
17338,538626,WHITE HANGING HEART T-LIGHT HOLDER,1
17338,544586,"HOOK, 1 HANGER ,MAGIC GARDEN",1
17338,578041,SET/12 TAPER CANDLES,1
17338,578041,WHITE WICKER STAR,1
17338,538626,SET/3 OCEAN SCENT CANDLE JEWEL BOX,1
17338,538626,ENGLISH ROSE HOT WATER BOTTLE,1
17338,540968,GREY HEART HOT WATER BOTTLE,1
17338,544586,HOME SWEET HOME METAL SIGN,1
17338,558709,IVORY HANGING DECORATION  HEART,1
17338,563565,IVORY HANGING DECORATION  BIRD,1
17338,563565,SET/10 BLUE POLKADOT PARTY CANDLES,1
17338,538626,SET/5 RED RETROSPOT LID GLASS BOWLS,1
17338,538626,AGED GLASS SILVER T-LIGHT HOLDER,1
17338,544586,COSY SLIPPER SHOES SMALL GREEN,1
17338,558709,VICTORIAN GLASS HANGING T-LIGHT,1
17338,558709,WOODEN PICTURE FRAME WHITE FINISH,1
17338,563565,FILIGRIS HEART WITH BUTTERFLY,1
17338,578041,WOODEN FRAME ANTIQUE WHITE,1
17338,544586,RETROSPOT HEART HOT WATER BOTTLE,1
17338,558709,METAL 4 HOOK HANGER FRENCH CHATEAU,1
17338,563565,RED SPOTTY BISCUIT TIN,1
17338,544586,CLOTHES PEGS RETROSPOT PACK 24,1
17338,578041,RED RETROSPOT CAKE STAND,1
17338,578041,PACK OF 6 COCKTAIL PARASOL STRAWS,1
17338,538626,CARDHOLDER GINGHAM CHRISTMAS TREE,1
17338,550477,SET OF 3 HEART COOKIE CUTTERS,1
17338,540968,FELTCRAFT BUTTERFLY HEARTS,1
17338,578041,WALL ART BUFFALO BILL,1
17338,578041,HEART IVORY TRELLIS SMALL,1
17338,544586,RED COAT RACK PARIS FASHION,1
17338,550477,SET/6 PURPLE BUTTERFLY T-LIGHTS,1
17338,558709,20 DOLLY PEGS RETROSPOT,1
17338,544586,SMALL YELLOW BABUSHKA NOTEBOOK,1
17338,550477,FELTCRAFT GIRL NICOLE KIT,1
17338,578041,HAND WARMER RED LOVE HEART,1
17338,578041,GIN + TONIC DIET METAL SIGN,1
17338,578041,LAUREL STAR ANTIQUE SILVER,1
