15478,573384,3 HEARTS HANGING DECORATION RUSTIC,0
15478,573384,JUMBO BAG ALPHABET,0
15478,573384,SWEET HEART CAKE CARRIER,0
15478,571184,HOT WATER BOTTLE KEEP CALM,0
15740,572230,PAINTED METAL STAR WITH HOLLY BELLS,0
15740,572230,CARDHOLDER GINGHAM STAR,0
15740,572230,CARD HOLDER LOVE BIRD SMALL,0
15740,572230,NATURAL SLATE HEART CHALKBOARD,0
15740,572230,WOODEN HEART CHRISTMAS SCANDINAVIAN,0
15740,572230,HEART SHAPED HOLLY WREATH,0
15740,572230,CHRISTMAS METAL POSTCARD WITH BELLS,0
15740,572230,MISTLETOE HEART WREATH GREEN,0
15740,572230,SET OF 6 RIBBONS VINTAGE CHRISTMAS,0
15768,551347,WRAP ALPHABET DESIGN,0
15768,563381,WRAP ALPHABET DESIGN,0
15768,551347,VINTAGE SNAP CARDS,0
15768,551347,BLACK RECORD COVER FRAME,0
15768,563381,WOODEN SCHOOL COLOURING SET,0
15768,551347,VINTAGE RED KITCHEN CABINET,0
15768,563381,ALARM CLOCK BAKELIKE ORANGE,0
15768,553932,BAG 250g SWIRLY MARBLES,0
15768,563381,BAG 500g SWIRLY MARBLES,0
15768,563381,SET OF 4 KNICK KNACK TINS DOILY,0
15768,563381,REGENCY CAKESTAND 3 TIER,0
15768,551347,ORANGE TV TRAY TABLE,0
15768,553932,BAKING SET SPACEBOY DESIGN,0
15768,563381,SET 12 RETRO WHITE CHALK STICKS,0
15768,551347,ALARM CLOCK BAKELIKE ORANGE,0
15768,551347,RETRO MOD TRAY,0
15768,563381,ALARM CLOCK BAKELIKE GREEN,0
15768,551347,REGENCY CAKESTAND 3 TIER,0
15768,551347,SWEETIES  STICKERS,0
15768,553932,BUNDLE OF 3 SCHOOL EXERCISE BOOKS,0
15768,563381,BAKING SET 9 PIECE RETROSPOT,0
15768,553932,GUMBALL MAGAZINE RACK,0
15768,553932,VINTAGE SNAKES & LADDERS,0
15768,553932,BUNDLE OF 3 ALPHABET EXERCISE BOOKS,0
15768,553932,BAKING SET 9 PIECE RETROSPOT,0
15768,553932,HOLIDAY FUN LUDO,0
15768,551347,WRAP DOILEY DESIGN,0
16380,570242,CHRISTMAS CRAFT LITTLE FRIENDS,0
16380,570242,CHRISTMAS TREE HEART DECORATION,0
16380,570242,IVY HEART WREATH,0
16380,570242,36 PENCILS TUBE RED RETROSPOT,0
16380,570242,SET OF 10 LANTERNS FAIRY LIGHT STAR,0
16380,570242,PINK HEARTS LIGHT CHAIN,0
16380,570242,HEART FILIGREE DOVE  SMALL,0
16380,570242,6 GIFT TAGS 50'S CHRISTMAS,0
16380,570242,HEART FILIGREE DOVE  SMALL,0
16380,570242,CHRISTMAS CRAFT TREE TOP ANGEL,0
16380,570242,JAM MAKING SET WITH JARS,0
16380,570242,RED HEARTS LIGHT CHAIN,0
16380,570242,RETRO PLASTIC 70'S TRAY,0
16380,570242,HEART FILIGREE DOVE LARGE,0
16380,570242,CHRISTMAS TREE STAR DECORATION,0
16380,570242,WHITE WIRE EGG HOLDER,0
16380,570242,PLAYING CARDS JUBILEE UNION JACK,0
16380,570242,CHRISTMAS HANGING TREE WITH BELL,0
16380,570242,RED FLOWER CROCHET FOOD COVER,0
16380,570242,GREEN GOOSE FEATHER CHRISTMAS TREE,0
16380,570242,STAR DECORATION RUSTIC,0
16380,570242,PAINTED METAL HEART WITH HOLLY BELL,0
16380,570242,PAINTED METAL HEART WITH HOLLY BELL,0
16380,570242,CHRISTMAS HANGING STAR WITH BELL,0
16380,570242,SWISS CHALET TREE DECORATION,0
16380,570242,HANGING HEART WITH BELL,0
16380,570242,CHRISTMAS CRAFT WHITE FAIRY,0
16380,570242,STAR WOODEN CHRISTMAS DECORATION,0
16380,570242,GREEN BITTY LIGHT CHAIN,0
16380,570242,HANGING HEART WITH BELL,0
16380,570242,DISCO BALL CHRISTMAS DECORATION,0
16432,569850,FRENCH WC SIGN BLUE METAL,0
16432,569850,RED DRAGONFLY HELICOPTER,0
16432,569850,PLEASE ONE PERSON METAL SIGN,0
16432,569850,TOILET SIGN OCCUPIED OR VACANT,0
16432,569850,POPCORN HOLDER,0
16432,569850,DOORMAT RESPECTABLE HOUSE,0
16432,569850,GIN + TONIC DIET METAL SIGN,0
16432,569850,YOU'RE CONFUSING ME METAL SIGN,0
16806,557855,NUMBER TILE VINTAGE FONT 1,0
16806,564745,SET OF 6 HERB TINS SKETCHBOOK,0
16806,557855,NUMBER TILE VINTAGE FONT 9,0
16806,551714,CITRONELLA CANDLE GARDEN POT,0
16806,557855,DRAWER KNOB CERAMIC IVORY,0
16806,551714,ASSORTED COLOUR BIRD ORNAMENT,0
16806,551714,REX CASH+CARRY JUMBO SHOPPER,0
16806,550191,VICTORIAN GLASS HANGING T-LIGHT,0
16806,564745,LARGE ANTIQUE WHITE PHOTO FRAME,0
16806,551714,CITRONELLA CANDLE FLOWERPOT,0
16806,564745,JAM JAR WITH GREEN LID,0
16806,564745,LADS ONLY TISSUE BOX,0
16806,557855,GLASS APOTHECARY BOTTLE ELIXIR,0
16806,564745,NUMBER TILE VINTAGE FONT 5,0
16806,564745,LARGE CERAMIC TOP STORAGE JAR,0
16806,551714,Manual,0
16806,564745,WOODEN PICTURE FRAME WHITE FINISH,0
16806,564745,NUMBER TILE VINTAGE FONT 1,0
16806,564745,RECIPE BOX PANTRY YELLOW DESIGN,0
16806,564745,NUMBER TILE VINTAGE FONT 2,0
16806,557855,NUMBER TILE VINTAGE FONT 0,0
16806,564745,NUMBER TILE VINTAGE FONT 8,0
16806,564745,REX CASH+CARRY JUMBO SHOPPER,0
16806,550191,GLASS JAR PEACOCK BATH SALTS,0
16806,564745,NUMBER TILE VINTAGE FONT No,0
16806,564745,NUMBER TILE VINTAGE FONT 7,0
16806,564745,PANTRY MAGNETIC  SHOPPING LIST,0
16806,557855,NUMBER TILE VINTAGE FONT 2,0
16806,557855,NUMBER TILE VINTAGE FONT 8,0
16806,564745,WOODEN FRAME ANTIQUE WHITE,0
16806,550191,KINGS CHOICE TEA CADDY,0
16806,557855,RIDGED GLASS FINGER BOWL,0
16806,564745,VINTAGE LEAF MAGNETIC NOTEPAD,0
16806,550191,SMALL PINK GLASS SUNDAE DISH,0
16806,564745,SWALLOW SQUARE TISSUE BOX,0
16806,564745,NUMBER TILE VINTAGE FONT 0,0
16806,564745,SPACEBOY LUNCH BOX,0
16806,564745,PACK OF 12 TRADITIONAL CRAYONS,0
16806,564745,NUMBER TILE VINTAGE FONT 3,0
16806,551714,ENAMEL MEASURING JUG CREAM,0
16806,557855,REX CASH+CARRY JUMBO SHOPPER,0
16806,564745,HOME BUILDING BLOCK WORD,0
16806,564745,SET OF 4 PANTRY JELLY MOULDS,0
16806,550191,BROCANTE SHELF WITH HOOKS,0
16806,550191,CLASSIC METAL BIRDCAGE PLANT HOLDER,0
16806,564745,NUMBER TILE VINTAGE FONT 9,0
16806,551714,SET OF 2 TINS JARDIN DE PROVENCE,0
16806,551714,VICTORIAN GLASS HANGING T-LIGHT,0
16806,550191,JARDIN ETCHED GLASS CHEESE DISH,0
16806,557855,HOME BUILDING BLOCK WORD,0
16806,550191,HEART FILIGREE DOVE LARGE,0
16806,564745,NUMBER TILE VINTAGE FONT 4,0
16806,551714,3 HOOK PHOTO SHELF ANTIQUE WHITE,0
16806,550191,HANGING HEART JAR T-LIGHT HOLDER,0
16806,564745,FAMILY ALBUM WHITE PICTURE FRAME,0
16806,551714,NUMBER TILE VINTAGE FONT 2,0
16806,550191,RIDGED GLASS FINGER BOWL,0
16806,550191,JARDIN ETCHED GLASS FRUITBOWL,0
16806,564745,SKETCHBOOK MAGNETIC SHOPPING LIST,0
16806,550191,ASSORTED COLOUR BIRD ORNAMENT,0
16806,564745,HANGING HEART JAR T-LIGHT HOLDER,0
16806,557855,HANGING HEART JAR T-LIGHT HOLDER,0
16806,550191,LARGE PINK GLASS SUNDAE DISH,0
16806,564745,CARAVAN SQUARE TISSUE BOX,0
16806,564745,BLUE DRAGONFLY HELICOPTER,0
16806,564745,NUMBER TILE VINTAGE FONT 6,0
16806,557855,NUMBER TILE VINTAGE FONT 4,0
16806,564745,MEDIUM CERAMIC TOP STORAGE JAR,0
16806,550191,COFFEE MUG BLUE PAISLEY DESIGN,0
16806,551714,NUMBER TILE VINTAGE FONT 3,0
16806,557855,NUMBER TILE VINTAGE FONT 6,0
16806,564745,RECIPE BOX BLUE SKETCHBOOK DESIGN,0
16806,564745,3 HOOK PHOTO SHELF ANTIQUE WHITE,0
16806,564745,SPACEBOY BEAKER,0
16806,551714,JARDIN ETCHED GLASS FRUITBOWL,0
16806,550191,NATURAL SLATE RECTANGLE CHALKBOARD,0
16806,564745,PICTURE FRAME WOOD TRIPLE PORTRAIT,0
16806,564745,TRADITIONAL MODELLING CLAY,0
16806,557855,GLASS APOTHECARY BOTTLE PERFUME,0
16806,564745,NO JUNK MAIL METAL SIGN,0
16806,557855,NUMBER TILE VINTAGE FONT 7,0
16806,557855,GAOLERS KEYS DECORATIVE GARDEN,0
16806,550191,JARDIN ETCHED GLASS CHEESE DISH,0
16806,557855,DRAWER KNOB CRACKLE GLAZE IVORY,0
16806,551714,HANGING HEART JAR T-LIGHT HOLDER,0
16806,557855,NUMBER TILE VINTAGE FONT 5,0
16806,550191,COFFEE MUG PINK PAISLEY DESIGN,0
16806,557855,NUMBER TILE VINTAGE FONT 3,0
16806,564745,SMALL CERAMIC TOP STORAGE JAR,0
16806,550191,SET OF 6 SPICE TINS PANTRY DESIGN,0
16806,551714,GAOLERS KEYS DECORATIVE GARDEN,0
16806,551714,SET OF 2 ROUND TINS DUTCH CHEESE,0
16806,557855,ANTIQUE SILVER TEA GLASS ENGRAVED,0
16881,569420,ASSORTED COLOURS SILK FAN,0
17123,558671,HAND OVER THE CHOCOLATE   SIGN,2
17123,558671,FILIGREE HEART BUTTERFLY WHITE,2
17123,558671,HEART IVORY TRELLIS LARGE,2
17123,558671,WHITE HANGING HEART T-LIGHT HOLDER,2
17123,558671,NO SINGING METAL SIGN,2
17123,558671,SET OF 4 NAPKIN CHARMS HEARTS,2
17123,558671,HEART IVORY TRELLIS SMALL,2
17123,558671,FILIGREE HEART DAISY WHITE,2
17123,558671,LARGE CIRCULAR MIRROR MOBILE,2
