17372,538418,12 PENCILS TALL TUBE WOODLAND,0
17372,556207,STRAWBERRY CERAMIC TRINKET BOX,0
17372,549556,DOLLY GIRL CHILDRENS EGG CUP,0
17372,538852,BLACK SWEETHEART BRACELET,0
17372,542258,HEART IVORY TRELLIS LARGE,0
17372,556207,SET OF 3 BUTTERFLY COOKIE CUTTERS,0
17372,538418,3 TRADITIONAl BISCUIT CUTTERS  SET,0
17372,549556,CHILDS GARDEN FORK BLUE,0
17372,538418,3 PIECE SPACEBOY COOKIE CUTTER SET,0
17372,570424,SET/10 BLUE POLKADOT PARTY CANDLES,0
17372,538418,S/15 SILVER GLASS BAUBLES IN BAG,0
17372,558102,SET OF 3 REGENCY CAKE TINS,0
17372,573336,200 RED + WHITE BENDY STRAWS,0
17372,542258,RED HEART SHAPE LOVE BUCKET,0
17372,549556,TRAVEL CARD WALLET VINTAGE TICKET,0
17372,556207,TEA BAG PLATE RED RETROSPOT,0
17372,558102,RETRO LEAVES MAGNETIC NOTEPAD,0
17372,570424,VINTAGE CHRISTMAS GIFT SACK,0
17372,538418,BLUE POLKADOT WASHING UP GLOVES,0
17372,538418,SET OF 3 BUTTERFLY COOKIE CUTTERS,0
17372,538852,BLUE SWEETHEART BRACELET,0
17372,558102,PLASTERS IN TIN SKULLS,0
17372,542258,SET/10 BLUE POLKADOT PARTY CANDLES,0
17372,558102,SET OF 60 VINTAGE LEAF CAKE CASES,0
17372,573336,SET 12 COLOUR PENCILS DOLLY GIRL,0
17372,558102,36 PENCILS TUBE WOODLAND,0
17372,558102,COLOURING PENCILS BROWN TUBE,0
17372,538418,SET/3 OCEAN SCENT CANDLE JEWEL BOX,0
17372,538852,MONSTERS STENCIL CRAFT,0
17372,538418,36 PENCILS TUBE WOODLAND,0
17372,549556,QUEENS GUARD COFFEE MUG,0
17372,558102,TRAVEL CARD WALLET VINTAGE TICKET,0
17372,558102,REGENCY CAKESTAND 3 TIER,0
17372,570424,SET 6 PAPER TABLE LANTERN STARS,0
17372,542258,PHOTO FRAME CORNICE,0
17372,549556,CHILDS GARDEN BRUSH PINK,0
17372,558102,LUNCH BOX I LOVE LONDON,0
17372,538418,RED ENCHANTED FOREST PLACEMAT,0
17372,570424,HOT WATER BOTTLE KEEP CALM,0
17372,538418,PACK OF 60 SPACEBOY CAKE CASES,0
17372,558102,SET OF 4 KNICK KNACK TINS LEAVES,0
17372,538418,SCANDINAVIAN REDS RIBBONS,0
17372,538852,HOT WATER BOTTLE BABUSHKA,0
17372,556207,SMALL DOLLY MIX DESIGN ORANGE BOWL,0
17372,538418,PACK OF 12 LONDON TISSUES,0
17372,558102,SET/10 RED POLKADOT PARTY CANDLES,0
17372,558102,COLOURING PENCILS BROWN TUBE,0
17372,538418,WOODEN HEART CHRISTMAS SCANDINAVIAN,0
17372,538418,IVORY PAPER CUP CAKE CASES,0
17372,558102,JUNGLE POPSICLES ICE LOLLY MOULDS,0
17372,538852,CRYSTAL STUD EARRINGS ASSORTED COL,0
17372,549556,LUNCH BOX I LOVE LONDON,0
17372,542258,WHITE HANGING HEART T-LIGHT HOLDER,0
17372,549556,CHILDS GARDEN BRUSH BLUE,0
17372,558102,SKETCHBOOK MAGNETIC SHOPPING LIST,0
17372,549556,JIGSAW RABBIT AND BIRDHOUSE,0
17372,549556,DOLLY GIRL LUNCH BOX,0
17372,538852,SET OF 6 SPICE TINS PANTRY DESIGN,0
17372,573336,FUNKY WASHING UP GLOVES ASSORTED,0
17372,556207,BLUE POLKADOT CUP,0
17372,538852,GREY HEART HOT WATER BOTTLE,0
17372,549556,CHILDS GARDEN TROWEL BLUE,0
17372,558102,JAM MAKING SET WITH JARS,0
17372,558102,PICNIC BOXES SET OF 3 RETROSPOT,0
17372,570424,SILVER STARS TABLE DECORATION,0
17372,538852,CANDLE PLATE LACE WHITE,0
17372,542258,SET/10 RED POLKADOT PARTY CANDLES,0
17372,538418,PAPER CHAIN KIT VINTAGE CHRISTMAS,0
17372,538418,PACK OF 60 PINK PAISLEY CAKE CASES,0
17372,542258,RED HANGING HEART T-LIGHT HOLDER,0
17372,556207,BLUE POLKADOT BOWL,0
17372,570424,SET/6 PINK  BUTTERFLY T-LIGHTS,0
17372,538418,PACK OF 60 DINOSAUR CAKE CASES,0
17372,538852,LOVE HEART NAPKIN BOX,0
17372,538418,6 RIBBONS ELEGANT CHRISTMAS,0
17372,558102,NOVELTY BISCUITS CAKE STAND 3 TIER,0
17372,558102,SET/10 PINK POLKADOT PARTY CANDLES,0
17372,558102,SMALL WHITE HEART OF WICKER,0
17372,570424,SET/6 TURQUOISE BUTTERFLY T-LIGHTS,0
17372,549556,WOODEN FRAME ANTIQUE WHITE,0
17372,549556,CHILDRENS GARDEN GLOVES PINK,0
17372,558102,12 PENCILS TALL TUBE WOODLAND,0
17372,549556,S/4 PINK FLOWER CANDLES IN BOWL,0
17372,549556,CIRCUS PARADE CHILDRENS EGG CUP,0
17372,558102,ROUND CONTAINER SET OF 5 RETROSPOT,0
17372,538418,60 TEATIME FAIRY CAKE CASES,0
17372,538418,12 PENCIL SMALL TUBE WOODLAND,0
17372,538418,ROCKING HORSE GREEN CHRISTMAS,0
17372,570424,HOT WATER BOTTLE I AM SO POORLY,0
17372,573336,PACK OF 12 TRADITIONAL CRAYONS,0
17372,556207,JUNGLE POPSICLES ICE LOLLY MOULDS,0
17372,538418,60 CAKE CASES DOLLY GIRL DESIGN,0
17372,538852,WHITE HANGING HEART T-LIGHT HOLDER,0
17372,549556,MOUSE TOY WITH PINK T-SHIRT,0
17372,570424,SET OF 12 FORK CANDLES,0
17372,538852,SET/6 PURPLE BUTTERFLY T-LIGHTS,0
17372,549556,BIRDHOUSE DECORATION MAGIC GARDEN,0
17372,573336,3 ROSE MORRIS BOXED CANDLES,0
17372,538418,36 PENCILS TUBE SKULLS,0
17372,549556,EASTER TIN CHICKS PINK DAISY,0
17372,549556,WATERING CAN BLUE ELEPHANT,0
17372,556207,JUMBO SHOPPER VINTAGE RED PAISLEY,0
17372,542258,"DIAMANTE HEART SHAPED WALL MIRROR,",0
17372,573336,PACK OF 12 COLOURED PENCILS,0
17372,549556,SET/6 FRUIT SALAD PAPER CUPS,0
17372,558102,SET OF TEA COFFEE SUGAR TINS PANTRY,0
17372,558102,LARGE WHITE HEART OF WICKER,0
17372,573336,CLASSIC CHROME BICYCLE BELL,0
17372,549556,CIRCUS PARADE LUNCH BOX,0
17372,573336,CHILDRENS CUTLERY SPACEBOY,0
17372,538418,HEART FILIGREE DOVE  SMALL,0
17372,538418,SET/12 TAPER CANDLES,0
17372,549556,CHILDRENS CUTLERY CIRCUS PARADE,0
17372,570424,REX CASH+CARRY JUMBO SHOPPER,0
17372,538418,IVORY ENCHANTED FOREST PLACEMAT,0
17372,538418,PACK OF 60 MUSHROOM CAKE CASES,0
17372,558102,CHILDRENS CUTLERY POLKADOT PINK,0
17372,570424,3D CHRISTMAS STAMPS STICKERS,0
17372,549556,SET OF 4 PANTRY JELLY MOULDS,0
17372,538418,GINGERBREAD MAN COOKIE CUTTER,0
17372,538852,PACK OF 6 SWEETIE GIFT BOXES,0
17372,570424,LOVE HOT WATER BOTTLE,0
17372,558102,PANTRY MAGNETIC  SHOPPING LIST,0
17372,549556,TRAVEL SEWING KIT,0
17372,549556,CHILDRENS GARDEN GLOVES BLUE,0
17372,570424,SILVER HEARTS TABLE DECORATION,0
17372,538852,GUMBALL MONOCHROME COAT RACK,0
17372,549556,TRAVEL CARD WALLET RETRO PETALS,0
17372,549556,SET/10 PINK POLKADOT PARTY CANDLES,0
17372,538852,CINAMMON SET OF 9 T-LIGHTS,0
17372,542258,BLUE HAPPY BIRTHDAY BUNTING,0
17372,556207,RED RETROSPOT CUP,0
17372,556207,MOUSE TOY WITH PINK T-SHIRT,0
17372,570424,PAPER CHAIN KIT 50'S CHRISTMAS,0
17372,573336,SKETCHBOOK MAGNETIC SHOPPING LIST,0
17372,570424,SET 12 COLOUR PENCILS DOLLY GIRL,0
17372,556207,PINK POLKADOT BOWL,0
17372,538418,PAINTED METAL HEART WITH HOLLY BELL,0
17372,570424,SET/10 RED POLKADOT PARTY CANDLES,0
17372,549556,BOX OF VINTAGE ALPHABET BLOCKS,0
17372,573336,S/4 PINK FLOWER CANDLES IN BOWL,0
17372,538418,12 PENCILS TALL TUBE SKULLS,0
17372,538852,RECIPE BOX BLUE SKETCHBOOK DESIGN,0
17372,573336,CHILDRENS CUTLERY POLKADOT BLUE,0
17372,558102,SET/10 BLUE POLKADOT PARTY CANDLES,0
17372,538418,PACK OF 72 RETROSPOT CAKE CASES,0
17372,573336,12 PENCILS TALL TUBE RED RETROSPOT,0
17372,542258,LOVEBIRD HANGING DECORATION WHITE,0
17372,558102,CHILDRENS CUTLERY RETROSPOT RED,0
17372,538418,PAINTED METAL STAR WITH HOLLY BELLS,0
17372,549556,CHILDS GARDEN FORK PINK,0
17372,570424,SET 6 PAPER TABLE LANTERN HEARTS,0
17372,538852,HAND WARMER BABUSHKA DESIGN,0
17372,556207,SMALL CHOCOLATES PINK BOWL,0
17372,542258,MAGNETS PACK OF 4 CHILDHOOD MEMORY,0
17372,558102,PLASTERS IN TIN CIRCUS PARADE,0
17372,570424,SET/10 PINK POLKADOT PARTY CANDLES,0
17372,538418,HOLLY TOP CHRISTMAS STOCKING,0
17372,549556,DECORATION  BUTTERFLY  MAGIC GARDEN,0
17372,549556,CHILDRENS CUTLERY SPACEBOY,0
17372,549556,PANTRY PASTRY BRUSH,0
17372,570424,SET 36 COLOUR PENCILS LOVE LONDON,0
17372,573336,POPPY FIELDS CHOPPING BOARD,0
17372,570424,SET 12 COLOUR PENCILS SPACEBOY,0
17372,573336,TRADITIONAL NAUGHTS & CROSSES,0
17372,558102,SET OF 4 KNICK KNACK TINS POPPIES,0
17372,558102,PLASTERS IN TIN WOODLAND ANIMALS,0
17372,570424,SCOTTIE DOG HOT WATER BOTTLE,0
17746,549974,CHILDRENS APRON APPLES DESIGN,2
17746,549974,LARGE CAKE STAND HANGING HEARTS,2
17746,549974,SWEETHEART CAKESTAND 3 TIER,2
17746,549974,REGENCY CAKESTAND 3 TIER,2
17746,549974,CHILDREN'S APRON DOLLY GIRL,2
17746,549974,FAIRY CAKE BIRTHDAY CANDLE SET,2
18004,538510,DOORMAT BLACK FLOCK,2
18004,538510,FELT TOADSTOOL  SMALL,2
18004,538510,RIBBON REEL CHRISTMAS SOCK BAUBLE,2
18004,538510,3D TRADITIONAL CHRISTMAS STICKERS,2
18004,538510,RIBBON REEL SOCKS AND MITTENS,2
18004,538510,CHICK GREY HOT WATER BOTTLE,2
18004,538510,DOORMAT MULTICOLOUR STRIPE,2
18004,538510,JUMBO  BAG BAROQUE BLACK WHITE,2
18004,538510,REGENCY CAKESTAND 3 TIER,2
18004,538510,PENCIL CASE LIFE IS BEAUTIFUL,2
18004,538510,WOOD STAMP SET FLOWERS,2
18004,538510,LETTER SHAPE PENCIL SHARPENER,2
18004,538510,HEART CALCULATOR,2
18004,538510,NECKLACE+BRACELET SET FRUIT SALAD,2
18004,538510,PAINTED METAL PEARS ASSORTED,2
18004,538510,RIBBON REEL SOCKS AND MITTENS,2
18004,538510,SET OF 36 MUSHROOM PAPER DOILIES,2
18004,538510,36 PENCILS TUBE WOODLAND,2
18004,538510,PACK/12 XMAS FUN CARD,2
18004,538510,36 PENCILS TUBE POSY,2
18004,538510,RIBBON REEL SOCKS AND MITTENS,2
18004,538510,ASSORTED COLOUR BIRD ORNAMENT,2
18004,538510,PAPER CHAIN KIT 50'S CHRISTMAS,2
18004,538510,BOTTLE BAG RETROSPOT,2
18004,538510,PACK 3 BOXES CHRISTMAS PANNETONE,2
18004,538510,CHRISTMAS RETROSPOT TREE WOOD,2
18004,538510,DOCTOR'S BAG SOFT TOY,2
18004,538510,RED RETROSPOT SHOPPER BAG,2
18004,538510,3D TRADITIONAL CHRISTMAS STICKERS,2
18004,538510,BLUE GIANT GARDEN THERMOMETER,2
18004,538510,FAWN BLUE HOT WATER BOTTLE,2
18004,538510,ANGEL DECORATION 3 BUTTONS,2
18004,538510,GLITTER BUTTERFLY CLIPS,2
18004,538510,RIBBON REEL CHRISTMAS SOCK BAUBLE,2
18004,538510,SET OF 36 TEATIME PAPER DOILIES,2
18004,538510,ANTIQUE SILVER TEA GLASS ETCHED,2
18004,538510,JUMBO  BAG BAROQUE BLACK WHITE,2
