13269,548708,WATERING CAN BLUE ELEPHANT,1
13269,564022,JAM MAKING SET PRINTED,1
13269,552007,PICNIC BASKET WICKER LARGE,1
13269,548708,VINTAGE HEADS AND TAILS CARD GAME,1
13269,552007,PANTRY WASHING UP BRUSH,1
13269,548708,VICTORIAN SEWING BOX MEDIUM,1
13269,577140,TRADTIONAL ALPHABET STAMP SET,1
13269,548708,SPACEBOY LUNCH BOX,1
13269,548708,FELT TOADSTOOL LARGE,1
13269,579144,ROLL WRAP VINTAGE CHRISTMAS,1
13269,577141,CLASSIC CHROME BICYCLE BELL,1
13269,548708,WOODEN PICTURE FRAME WHITE FINISH,1
13269,559811,RECIPE BOX PANTRY YELLOW DESIGN,1
13269,564022,SET/4 BIRD MIRROR MAGNETS,1
13269,550784,SMALL POPCORN HOLDER,1
13269,569536,BUNDLE OF 3 SCHOOL EXERCISE BOOKS,1
13269,569537,MINI PLAYING CARDS GYMKHANA,1
13269,569536,SET OF 4 KNICK KNACK TINS DOILY,1
13269,538645,AIRLINE BAG VINTAGE JET SET RED,1
13269,548708,BAG 125g SWIRLY MARBLES,1
13269,556528,PARTY BUNTING,1
13269,548708,RETRO PLASTIC POLKA TRAY,1
13269,559811,JUMBO BAG VINTAGE LEAF,1
13269,548708,VINTAGE SNAP CARDS,1
13269,548708,EASTER TIN BUNNY BOUQUET,1
13269,579144,RABBIT NIGHT LIGHT,1
13269,579144,BLACK RECORD COVER FRAME,1
13269,548708,GLASS JAR KINGS CHOICE,1
13269,550784,WATERING CAN BLUE ELEPHANT,1
13269,566393,STORAGE TIN VINTAGE DOILY,1
13269,579144,PACK OF 6 SMALL FRUIT STRAWS,1
13269,548708,PARTY METAL SIGN,1
13269,548708,PACK OF 60 SPACEBOY CAKE CASES,1
13269,548708,PICTURE FRAME WOOD TRIPLE PORTRAIT,1
13269,581415,CLASSIC CHROME BICYCLE BELL,1
13269,556528,PARISIENNE CURIO CABINET,1
13269,552007,DAIRY MAID TRADITIONAL TEAPOT,1
13269,550784,PARTY BUNTING,1
13269,556528,JUMBO BAG VINTAGE LEAF,1
13269,581415,60 CAKE CASES VINTAGE CHRISTMAS,1
13269,548708,ENAMEL COLANDER CREAM,1
13269,569536,JUMBO BAG VINTAGE CHRISTMAS,1
13269,548708,MAGIC DRAWING SLATE PURDEY,1
13269,550784,PAPER CHAIN KIT EMPIRE,1
13269,556528,JUMBO BAG ALPHABET,1
13269,538645,6 ROCKET BALLOONS,1
13269,564022,RECIPE BOX RETROSPOT,1
13269,552007,TWO DOOR CURIO CABINET,1
13269,556528,JAM MAKING SET PRINTED,1
13269,548708,GLASS JAR DIGESTIVE BISCUITS,1
13269,550784,BLACK RECORD COVER FRAME,1
13269,569536,WOODEN FRAME ANTIQUE WHITE,1
13269,569536,WRAP ALPHABET POSTER,1
13269,577141,VINTAGE CHRISTMAS GIFT BAG LARGE,1
13269,552007,SET/6 COLLAGE PAPER CUPS,1
13269,577141,SET OF 4 PANTRY JELLY MOULDS,1
13269,548708,DOLLY GIRL LUNCH BOX,1
13269,548708,GINGERBREAD MAN COOKIE CUTTER,1
13269,577141,ROLL WRAP VINTAGE SPOT,1
13269,559811,WATERING CAN BLUE ELEPHANT,1
13269,569536,PICTURE FRAME WOOD TRIPLE PORTRAIT,1
13269,537058,SET 7 BABUSHKA NESTING BOXES,1
13269,548708,JAM JAR WITH GREEN LID,1
13269,579144,HAND WARMER BIRD DESIGN,1
13269,537058,HAND WARMER BIRD DESIGN,1
13269,548708,BULL DOG BOTTLE OPENER,1
13269,579144,CLASSIC BICYCLE CLIPS,1
13269,579144,PACK OF 12 VINTAGE CHRISTMAS TISSUE,1
13269,548708,PLASTERS IN TIN STRONGMAN,1
13269,559811,PARTY BUNTING,1
13269,577141,60 CAKE CASES VINTAGE CHRISTMAS,1
13269,577141,SET 7 BABUSHKA NESTING BOXES,1
13269,577141,DOLLY GIRL LUNCH BOX,1
13269,581415,CLASSIC BICYCLE CLIPS,1
13269,548708,QUEENS GUARD COFFEE MUG,1
13269,559811,PLASTERS IN TIN CIRCUS PARADE,1
13269,577141,RABBIT NIGHT LIGHT,1
13269,579144,BICYCLE PUNCTURE REPAIR KIT,1
13269,548708,BLACK MEDIUM GLASS CAKE STAND,1
13269,566393,SET OF 4 PANTRY JELLY MOULDS,1
13269,577140,JUMBO BAG PAISLEY PARK,1
13269,548708,EASTER TIN BUNNY BOUQUET,1
13269,556528,SET OF 60 VINTAGE LEAF CAKE CASES,1
13269,548708,AIRLINE BAG VINTAGE TOKYO 78,1
13269,569536,PACK OF 6 SMALL FRUIT STRAWS,1
13269,577141,PACK OF 72 RETROSPOT CAKE CASES,1
13269,548708,EASTER TIN CHICKS PINK DAISY,1
13269,566393,SET OF 12 FORK CANDLES,1
13269,569536,SET 6 SCHOOL MILK BOTTLES IN CRATE,1
13269,548708,SET/6 COLLAGE PAPER CUPS,1
13269,548708,RECIPE BOX RETROSPOT,1
13269,559811,SNOWSTORM PHOTO FRAME FRIDGE MAGNET,1
13269,579144,CLASSIC CHROME BICYCLE BELL,1
13269,550784,ORANGE TV TRAY TABLE,1
13269,559811,JUMBO BAG RED RETROSPOT,1
13269,569537,DOG LICENCE WALL ART,1
13269,548708,MAGIC DRAWING SLATE LEAP FROG,1
13269,548708,6 ROCKET BALLOONS,1
13269,559811,RECIPE BOX RETROSPOT,1
13269,564022,POPCORN HOLDER,1
13269,569536,MULTICOLOUR HONEYCOMB FAN,1
13269,548708,WOODEN FRAME ANTIQUE WHITE,1
13269,552007,SET OF SALT AND PEPPER TOADSTOOLS,1
13269,566393,GIANT 50'S CHRISTMAS CRACKER,1
13269,548708,MAGIC DRAWING SLATE BUNNIES,1
13269,579144,WOODEN PICTURE FRAME WHITE FINISH,1
13269,538645,PARTY PIZZA DISH GREEN POLKADOT,1
13269,569537,MINI PLAYING CARDS DOLLY GIRL,1
13269,548708,STRAWBERRY CERAMIC TRINKET BOX,1
13269,559811,PICTURE FRAME WOOD TRIPLE PORTRAIT,1
13269,559811,JAM MAKING SET PRINTED,1
13269,548708,ENAMEL BREAD BIN CREAM,1
13269,548708,PLASTERS IN TIN SPACEBOY,1
13269,552007,ENAMEL WATERING CAN CREAM,1
13269,577141,RAIN PONCHO RETROSPOT,1
13269,537058,"\"RECORD FRAME 7\"\" SINGLE SIZE \"",1
13269,550784,SET 12 KIDS COLOUR  CHALK STICKS,1
13269,548708,BAKING MOULD EASTER EGG MILK CHOC,1
13269,559811,POPCORN HOLDER,1
13269,537058,SET/5 RED RETROSPOT LID GLASS BOWLS,1
13269,577141,JAM MAKING SET PRINTED,1
13269,579144,60 CAKE CASES VINTAGE CHRISTMAS,1
13269,548708,JAM MAKING SET PRINTED,1
13269,550784,JUMBO SHOPPER VINTAGE RED PAISLEY,1
13269,552007,JUMBO SHOPPER VINTAGE RED PAISLEY,1
13269,556528,SMALL POPCORN HOLDER,1
13269,550784,GLASS JAR KINGS CHOICE,1
13269,537058,SET 2 TEA TOWELS I LOVE LONDON,1
13269,564022,RAIN PONCHO RETROSPOT,1
13269,569536,PARTY BUNTING,1
13269,548708,ORANGE TV TRAY TABLE,1
13269,548708,MINI PAINT SET VINTAGE,1
13269,548708,MAGIC DRAWING SLATE BAKE A CAKE,1
13269,577141,WRAP PAISLEY PARK,1
13269,537058,GINGERBREAD MAN COOKIE CUTTER,1
13269,548708,BOX OF 24 COCKTAIL PARASOLS,1
13269,579144,JUMBO BAG PAISLEY PARK,1
13269,548708,NO SINGING METAL SIGN,1
13269,566393,SET OF 5 MINI GROCERY MAGNETS,1
13269,569536,JUMBO BAG RED RETROSPOT,1
13269,581415,BLUE BIRDHOUSE DECORATION,1
13269,548708,JUMBO BAG RED RETROSPOT,1
13269,537058,MAGIC DRAWING SLATE CIRCUS PARADE,1
13269,538645,DOLLY GIRL LUNCH BOX,1
13269,538645,CHRISTMAS LIGHTS 10 VINTAGE BAUBLES,1
13269,548708,PANTRY PASTRY BRUSH,1
13269,548708,SET OF SALT AND PEPPER TOADSTOOLS,1
13269,577141,SET 6 SCHOOL MILK BOTTLES IN CRATE,1
13269,548708,TRIPLE PHOTO FRAME CORNICE,1
13269,548708,MAGIC DRAWING SLATE DOLLY GIRL,1
13269,566393,PARTY BUNTING,1
13269,556528,WRAP GINGHAM ROSE,1
13269,556528,SET 7 BABUSHKA NESTING BOXES,1
13269,556528,RED RETROSPOT WRAP,1
13269,564022,PARTY BUNTING,1
13269,566393,BISCUIT TIN 50'S CHRISTMAS,1
13269,569536,VINTAGE CHRISTMAS GIFT SACK,1
13269,537058,WASHROOM METAL SIGN,1
13269,556528,WATERING CAN BLUE ELEPHANT,1
13269,577141,ROLL WRAP VINTAGE CHRISTMAS,1
13269,548708,SMALL DOLLY MIX DESIGN ORANGE BOWL,1
13269,556528,STRAWBERRY CERAMIC TRINKET BOX,1
13269,559811,SET 7 BABUSHKA NESTING BOXES,1
13269,577141,JUMBO BAG RED RETROSPOT,1
13269,538645,PARTY PIZZA DISH RED RETROSPOT,1
13269,538645,SPACEBOY LUNCH BOX,1
13269,548708,WRAP VINTAGE PETALS  DESIGN,1
13269,564022,FRENCH STYLE STORAGE JAR BONBONS,1
13269,569536,PARISIENNE CURIO CABINET,1
13269,577140,BOX OF 6 CHRISTMAS CAKE DECORATIONS,1
13269,548708,PACK OF 72 SKULL CAKE CASES,1
13269,548708,PANTRY WASHING UP BRUSH,1
13269,538645,AIRLINE BAG VINTAGE JET SET BROWN,1
13269,548708,TWO DOOR CURIO CABINET,1
13269,550784,WATERING CAN PINK BUNNY,1
13269,552007,ENAMEL MEASURING JUG CREAM,1
13269,569537,MINI PLAYING CARDS BUFFALO BILL,1
13269,577141,PLASTERS IN TIN SPACEBOY,1
13269,548708,PACK OF 60 DINOSAUR CAKE CASES,1
13269,548708,STRAWBERRY FAIRY CAKE TEAPOT,1
13269,550784,GINGERBREAD MAN COOKIE CUTTER,1
13269,538645,HOT WATER BOTTLE BABUSHKA,1
13269,548708,SPACEBOY CHILDRENS EGG CUP,1
13269,559811,"\"RECORD FRAME 7\"\" SINGLE SIZE \"",1
13269,566393,SET OF 4 KNICK KNACK TINS DOILY,1
13294,555408,GUMBALL COAT RACK,2
13294,555408,FINE WICKER HEART,2
13294,548780,SET OF 4 NAPKIN CHARMS CROWNS,2
13294,555408,ASSORTED COLOUR BIRD ORNAMENT,2
13294,555408,RECYCLING BAG RETROSPOT,2
13294,548780,SCANDINAVIAN PAISLEY PICNIC BAG,2
13294,555408,ENAMEL COLANDER CREAM,2
13294,555408,ENAMEL MEASURING JUG CREAM,2
13294,548780,GENTLEMAN SHIRT REPAIR KIT,2
13294,548780,WRAP VINTAGE PETALS  DESIGN,2
13294,555408,CREAM SWEETHEART EGG HOLDER,2
13294,555408,NATURAL SLATE RECTANGLE CHALKBOARD,2
13294,555408,SET 7 BABUSHKA NESTING BOXES,2
13294,548780,WRAP PINK FAIRY CAKES,2
13294,548780,JUMBO BAG RED RETROSPOT,2
13294,548780,CREAM SWEETHEART EGG HOLDER,2
13294,548780,JUMBO SHOPPER VINTAGE RED PAISLEY,2
13294,555408,SUNSET CHECK HAMMOCK,2
13294,555408,GREEN GIANT GARDEN THERMOMETER,2
13294,548780,NATURAL SLATE CHALKBOARD LARGE,2
13294,548780,FANCY FONTS BIRTHDAY WRAP,2
13294,548780,PINK  HEART CONFETTI IN TUBE,2
13294,548780,VINTAGE CREAM 3 BASKET CAKE STAND,2
13294,548780,PANTRY WASHING UP BRUSH,2
13294,548780,UNION STRIPE WITH FRINGE  HAMMOCK,2
13294,548780,PANTRY ROLLING PIN,2
13294,548780,MOBILE VINTAGE HEARTS,2
13294,548780,GUMBALL COAT RACK,2
13294,548780,SKULLS AND CROSSBONES WRAP,2
13294,548780,PANTRY APPLE CORER,2
13294,555408,JUMBO BAG RED RETROSPOT,2
13294,555408,SET 6 PAPER TABLE LANTERN STARS,2
13294,548780,WRAP POPPIES  DESIGN,2
13294,555408,VINTAGE CREAM DOG FOOD CONTAINER,2
13294,555408,PIGGY BANK RETROSPOT,2
13294,548780,12 IVORY ROSE PEG PLACE SETTINGS,2
13294,555408,UNION STRIPE WITH FRINGE  HAMMOCK,2
13294,548780,BIRDS MOBILE VINTAGE DESIGN,2
13294,548780,NATURAL SLATE HEART CHALKBOARD,2
13294,548780,POLKA DOT RAFFIA FOOD COVER,2
13294,548780,SET/4 COLOURFUL MIXING BOWLS,2
13294,548780,VICTORIAN SEWING BOX SMALL,2
13294,555408,JUMBO SHOPPER VINTAGE RED PAISLEY,2
13294,555408,VINTAGE CREAM CAT FOOD CONTAINER,2
13294,548780,PIGGY BANK RETROSPOT,2
13294,548780,SET 20 NAPKINS FAIRY CAKES DESIGN,2
13294,548780,ROSE CARAVAN DOORSTOP,2
13294,548780,SET OF 4 PANTRY JELLY MOULDS,2
13294,555408,GARDENERS KNEELING PAD KEEP CALM,2
13294,555408,JUMBO BAG VINTAGE LEAF,2
13294,548780,GINGHAM ROSE WRAP,2
13294,555408,YELLOW GIANT GARDEN THERMOMETER,2
13294,548780,SWEETHEART WIRE WALL TIDY,2
13294,555408,SET/5 RED RETROSPOT LID GLASS BOWLS,2
13364,569003,BLUE STRIPE CERAMIC DRAWER KNOB,0
13364,569003,POLYESTER FILLER PAD 40x40cm,0
13364,569003,DRAWER KNOB CRACKLE GLAZE IVORY,0
13364,569003,BLUE DRAWER KNOB ACRYLIC EDWARDIAN,0
13364,569003,HOME SWEET HOME CUSHION COVER,0
13364,569003,LE JARDIN BOTANIQUE CUSHION COVER,0
13364,569003,PACKING CHARGE,0
13364,569003,DRAWER KNOB CERAMIC BLACK,0
13364,569003,DRAWER KNOB VINTAGE GLASS STAR,0
13364,569003,DRAWER KNOB CRACKLE GLAZE GREEN,0
13500,574314,HOT WATER BOTTLE TEA AND SYMPATHY,0
13500,576846,PAINTED METAL PEARS ASSORTED,0
13500,562774,HOT WATER BOTTLE I AM SO POORLY,0
13500,576846,HOT WATER BOTTLE I AM SO POORLY,0
13500,562774,SMALL IVORY HEART WALL ORGANISER,0
13500,576846,HOT WATER BOTTLE TEA AND SYMPATHY,0
13500,562774,SCOTTIE DOG HOT WATER BOTTLE,0
13500,576846,KINGS CHOICE TEA CADDY,0
13500,574314,SCOTTIE DOG HOT WATER BOTTLE,0
13500,576846,DELUXE SEWING KIT,0
13500,562774,SET OF 20 KIDS COOKIE CUTTERS,0
13500,562774,MEDIUM CERAMIC TOP STORAGE JAR,0
13500,574314,HOT WATER BOTTLE I AM SO POORLY,0
13500,576846,HAND WARMER RED RETROSPOT,0
13500,576846,WALL ART BICYCLE SAFETY,0
13500,574314,STAR WREATH DECORATION WITH BELL,0
13500,574314,CHRISTMAS GINGHAM TREE,0
13500,574314,JINGLE BELL HEART DECORATION,0
13500,576846,WALL ART VILLAGE SHOW,0
13500,562774,CHOCOLATE HOT WATER BOTTLE,0
13500,562774,PINK CREAM FELT CRAFT TRINKET BOX,0
13500,562774,ZINC SWEETHEART WIRE LETTER RACK,0
13500,562774,BAKING SET SPACEBOY DESIGN,0
13500,576846,HAND WARMER RED LOVE HEART,0
13500,576846,MAGIC DRAWING SLATE DINOSAUR,0
13500,576846,CLASSIC CHROME BICYCLE BELL,0
13500,562774,IVORY WIRE SWEETHEART LETTER TRAY,0
13500,574314,HEART WREATH DECORATION WITH BELL,0
13500,576846,BUTTON BOX,0
13500,576846,PIN CUSHION BABUSHKA RED,0
13500,562774,IVORY SWEETHEART WIRE LETTER RACK,0
13500,562774,LARGE CERAMIC TOP STORAGE JAR,0
13500,576846,GROW A FLYTRAP OR SUNFLOWER IN TIN,0
13500,574314,SET OF 20 VINTAGE CHRISTMAS NAPKINS,0
13500,562774,GINGERBREAD MAN COOKIE CUTTER,0
13500,574314,SET 6 SCHOOL MILK BOTTLES IN CRATE,0
13500,576846,BALLOONS  WRITING SET,0
13500,576846,WIRE EGG BASKET,0
13500,576846,WALL ART STOP FOR TEA,0
13500,576846,RETROSPOT HEART HOT WATER BOTTLE,0
13500,562774,FELTCRAFT CUSHION OWL,0
13500,576846,ASSORTED COLOUR BIRD ORNAMENT,0
13500,562774,RETROSPOT TEA SET CERAMIC 11 PC,0
13500,574314,HAND WARMER SCOTTY DOG DESIGN,0
13500,562774,PINK BLUE FELT CRAFT TRINKET BOX,0
13500,576846,TRADTIONAL ALPHABET STAMP SET,0
13500,576846,DINOSAURS  WRITING SET,0
13500,574314,60 CAKE CASES VINTAGE CHRISTMAS,0
13500,562774,BAKING SET 9 PIECE RETROSPOT,0
13500,574314,APOTHECARY MEASURING JAR,0
13500,574314,HAND WARMER UNION JACK,0
13500,574314,GINGHAM HEART DECORATION,0
13500,576846,HOME BUILDING BLOCK WORD,0
13500,574314,WALL ART CLASSIC PUDDINGS,0
13500,576846,WORLD WAR 2 GLIDERS ASSTD DESIGNS,0
13500,562774,FELTCRAFT CUSHION BUTTERFLY,0
13500,574314,LARGE APOTHECARY MEASURING JAR,0
13500,562774,TRADITIONAL KNITTING NANCY,0
13500,576846,TRADITIONAL MODELLING CLAY,0
13500,576846,REGENCY CAKESTAND 3 TIER,0
13500,574314,MULTI COLOUR SILVER T-LIGHT HOLDER,0
13500,562774,LARGE IVORY HEART WALL ORGANISER,0
13500,574314,CHOCOLATE HOT WATER BOTTLE,0
13500,576846,BAG 250g SWIRLY MARBLES,0
13500,576846,MAGIC DRAWING SLATE DOLLY GIRL,0
13893,544035,PAPER CHAIN KIT EMPIRE,2
13893,544035,GREEN 3 PIECE POLKADOT CUTLERY SET,2
13893,544035,PINK 3 PIECE POLKADOT CUTLERY SET,2
13893,544035,PACK OF 6 SANDCASTLE FLAGS ASSORTED,2
13893,544035,DOORMAT WELCOME PUPPIES,2
13893,544035,VINTAGE UNION JACK CUSHION COVER,2
13893,544035,DOORMAT FAIRY CAKE,2
13893,544035,VINTAGE UNION JACK BUNTING,2
13893,544035,DOORMAT TOPIARY,2
13893,544035,DOORMAT WELCOME TO OUR HOME,2
13893,544035,RED 3 PIECE RETROSPOT CUTLERY SET,2
13893,544035,ENAMEL BREAD BIN CREAM,2
13893,544035,VINTAGE UNION JACK MEMOBOARD,2
13893,544035,DOORMAT SPOTTY HOME SWEET HOME,2
13893,544035,MEMO BOARD RETROSPOT  DESIGN,2
13893,544035,KINGS CHOICE TEA CADDY,2
13893,544035,DOORMAT UNION FLAG,2
13893,544035,SWEETHEART RECIPE BOOK STAND,2
13893,544035,BLUE 3 PIECE POLKADOT CUTLERY SET,2
13893,544035,KINGS CHOICE BISCUIT TIN,2
13893,544035,DOORMAT ENGLISH ROSE,2
14111,565569,FRENCH PAISLEY CUSHION COVER,0
14111,578816,PLAYING CARDS KEEP CALM & CARRY ON,0
14111,564529,LANTERN CREAM GAZEBO,0
14111,578816,HAND WARMER RED RETROSPOT,0
14111,578816,RETROSPOT CIGAR BOX MATCHES,0
14111,578816,GRAND CHOCOLATECANDLE,0
14111,549756,AGED GLASS SILVER T-LIGHT HOLDER,0
14111,549756,ANTIQUE GLASS PEDESTAL BOWL,0
14111,565569,ROSE DU SUD CUSHION COVER,0
14111,578816,Next Day Carriage,0
14184,569482,RED STRIPE CERAMIC DRAWER KNOB,0
14184,569482,WALL ART CLASSIC PUDDINGS,0
14184,569482,RETROSPOT LAMP,0
14184,569482,GLASS APOTHECARY BOTTLE ELIXIR,0
14184,569482,RED SPOT CERAMIC DRAWER KNOB,0
14184,569482,IVORY DINER WALL CLOCK,0
14184,569482,WHITE SPOT RED CERAMIC DRAWER KNOB,0
14184,569482,GLASS APOTHECARY BOTTLE TONIC,0
14184,569482,CLASSIC CAFE SUGAR DISPENSER,0
14184,569482,NATURAL SLATE CHALKBOARD LARGE,0
14184,569482,IVORY KITCHEN SCALES,0
14184,569482,SMALL APOTHECARY MEASURING JAR,0
14184,569482,RED KITCHEN SCALES,0
14184,569482,HOME SWEET HOME CUSHION COVER,0
14184,569482,HOME SWEET HOME MUG,0
14184,569482,LARGE APOTHECARY MEASURING JAR,0
14184,569482,RED DINER WALL CLOCK,0
14184,569482,STORAGE TIN HOME SWEET HOME,0
14184,569482,DRAWER KNOB CRACKLE GLAZE IVORY,0
14184,569482,VILLAGE SHOW WALL ART,0
14184,569482,NATURAL SLATE HEART CHALKBOARD,0
14184,569482,APOTHECARY MEASURING JAR,0
14184,569482,BELLE JARDINIERE CUSHION COVER,0
14184,569482,GLASS APOTHECARY BOTTLE PERFUME,0
14504,549573,GLASS HEART T-LIGHT HOLDER,0
14504,545697,"ELEPHANT, BIRTHDAY CARD,",0
14504,545697,FIRST AID TIN,0
14504,545697,COWBOYS AND INDIANS BIRTHDAY CARD,0
14504,549573,S/4 IVORY MINI ROSE CANDLE IN BOWL,0
14504,572315,T-LIGHT GLASS FLUTED ANTIQUE,0
14504,545697,ANTIQUE SILVER TEA GLASS ENGRAVED,0
14504,545697,CARD GINGHAM ROSE,0
14504,547800,SHOE SHINE BOX,0
14504,547800,ENGLISH ROSE NOTEBOOK A6 SIZE,0
14504,547800,ASSORTED COLOUR BIRD ORNAMENT,0
14504,547800,SET 12 KIDS  WHITE CHALK STICKS,0
14504,549573,GLASS JAR ENGLISH CONFECTIONERY,0
14504,547800,AREA PATROLLED METAL SIGN,0
14504,549573,CRYSTAL PAIR HEART HAIR SLIDES,0
14504,547800,VINTAGE HEADS AND TAILS CARD GAME,0
14504,549573,EMERGENCY FIRST AID TIN,0
14504,545697,LAUNDRY 15C METAL SIGN,0
14504,545697,ASSORTED COLOUR BIRD ORNAMENT,0
14504,545697,VINTAGE UNION JACK MEMOBOARD,0
14504,547800,HOT BATHS METAL SIGN,0
14504,549573,CHOCOLATE THIS WAY METAL SIGN,0
14504,549573,PLEASE ONE PERSON METAL SIGN,0
14504,545697,"KEY FOB , GARAGE DESIGN",0
14504,545697,VINTAGE UNION JACK DOORSTOP,0
14504,549573,SET 12 RETRO WHITE CHALK STICKS,0
14504,549573,CROCHET ROSE PURSE WITH SUEDE BACK,0
14504,549573,SET OF 3 NOTEBOOKS IN PARCEL,0
14504,549573,OPEN CLOSED METAL SIGN,0
14504,549573,TURQUOISE HEART OF GLASS BRACELET,0
14504,572315,ASSORTED COLOUR BIRD ORNAMENT,0
14504,549573,COOK WITH WINE METAL SIGN,0
14504,545697,WASHROOM METAL SIGN,0
14504,545697,WOODEN PICTURE FRAME WHITE FINISH,0
14504,545697,SET OF 2 TINS VINTAGE BATHROOM,0
14504,549573,PINK HEART OF GLASS BRACELET,0
14504,549573,GIN + TONIC DIET METAL SIGN,0
14504,549573,ENCHANTED BIRD PLANT CAGE,0
14504,547800,PICTURE FRAME WOOD TRIPLE PORTRAIT,0
14504,572315,PHARMACIE FIRST AID TIN,0
14504,545697,WOOD BLACK BOARD ANT WHITE FINISH,0
14504,547800,SET 12 RETRO WHITE CHALK STICKS,0
14504,549573,GREEN SWEETHEART BRACELET,0
14504,549573,PHARMACIE FIRST AID TIN,0
14504,547800,WOOD S/3 CABINET ANT WHITE FINISH,0
14504,549573,CARNIVAL BRACELET,0
14504,572315,PACK OF SIX LED TEA LIGHTS,0
14504,549573,TIGRIS EYE CHUNKY CHARM BRACELET,0
14504,549573,LADIES & GENTLEMEN METAL SIGN,0
14504,547800,LADIES & GENTLEMEN METAL SIGN,0
14504,549573,WHITE HANGING HEART T-LIGHT HOLDER,0
14504,549573,GAOLERS KEYS DECORATIVE GARDEN,0
14504,572315,GAOLERS KEYS DECORATIVE GARDEN,0
14504,545697,T-LIGHT GLASS FLUTED ANTIQUE,0
14504,545697,3 HOOK PHOTO SHELF ANTIQUE WHITE,0
14504,549573,FELT EGG COSY WHITE RABBIT,0
14504,547800,HAND OVER THE CHOCOLATE   SIGN,0
14504,549573,SILVER BRACELET W PASTEL FLOWER,0
14504,549573,ZINC METAL HEART DECORATION,0
14504,549573,VINTAGE UNION JACK PENNANT,0
14504,545697,WOODEN FRAME ANTIQUE WHITE,0
14504,545697,FLORAL FOLK STATIONERY SET,0
14504,545697,LADIES & GENTLEMEN METAL SIGN,0
14504,549573,WHITE HEART OF GLASS BRACELET,0
14504,547800,SWEETHEART WIRE WALL TIDY,0
14504,545697,AREA PATROLLED METAL SIGN,0
14504,545697,SET OF 3 CAKE TINS PANTRY DESIGN,0
14504,545697,VINTAGE UNION JACK BUNTING,0
14504,572315,GLASS APOTHECARY BOTTLE PERFUME,0
14504,549573,HAND OVER THE CHOCOLATE   SIGN,0
14504,547800,VINTAGE SNAP CARDS,0
14504,549573,TOILET SIGN OCCUPIED OR VACANT,0
14504,547800,WOOD 2 DRAWER CABINET WHITE FINISH,0
14504,545697,SWALLOWS GREETING CARD,0
14504,545697,"KEY FOB , SHED",0
14504,545697,SET OF 2 ROUND TINS CAMEMBERT,0
14504,549573,NATURAL SLATE HEART CHALKBOARD,0
14504,572315,GLASS APOTHECARY BOTTLE ELIXIR,0
14504,547800,RIBBON REEL STRIPES DESIGN,0
14504,549573,HOT BATHS METAL SIGN,0
14504,545697,GINGHAM ROSE WRAP,0
14504,547800,CREAM SWEETHEART MINI CHEST,0
14504,549573,FLUTED ANTIQUE CANDLE HOLDER,0
14504,549573,PINK POLKADOT WRAP,0
14504,545697,"KEY FOB , FRONT  DOOR",0
14504,572315,ANTIQUE SILVER TEA GLASS ENGRAVED,0
14504,572315,HEART OF WICKER LARGE,0
14504,549573,AREA PATROLLED METAL SIGN,0
14504,549573,GIN & TONIC DIET GREETING CARD,0
14504,545697,WHITE HANGING HEART T-LIGHT HOLDER,0
14504,549573,METAL SIGN HER DINNER IS SERVED,0
14504,547800,VINTAGE SNAKES & LADDERS,0
14504,549573,HOT BATHS SOAP HOLDER,0
14504,545697,FAMILY ALBUM WHITE PICTURE FRAME,0
14504,572315,FIRST AID TIN,0
14504,545697,PICTURE FRAME WOOD TRIPLE PORTRAIT,0
14504,545697,"KEY FOB , BACK DOOR",0
14504,547800,FAMILY ALBUM WHITE PICTURE FRAME,0
14504,549573,WHITE GLASS CHUNKY CHARM BRACELET,0
14504,549573,PINK SWEETHEART BRACELET,0
14504,547800,SET OF 3 NOTEBOOKS IN PARCEL,0
14504,549573,FAIRY SOAP SOAP HOLDER,0
14504,549573,MOP PENDANT SHELL NECKLACE,0
14504,547800,GIN + TONIC DIET METAL SIGN,0
14504,545697,HOT BATHS METAL SIGN,0
14504,547800,3 HOOK PHOTO SHELF ANTIQUE WHITE,0
14504,572315,NATURAL SLATE HEART CHALKBOARD,0
14702,540532,SWEETHEART RECIPE BOOK STAND,1
14702,538168,ANTIQUE SILVER TEA GLASS ETCHED,1
14702,558636,SET OF 60 I LOVE LONDON CAKE CASES,1
14702,581471,DOORMAT UNION FLAG,1
14702,567943,POLYESTER FILLER PAD 40x40cm,1
14702,571276,RIBBON REEL CHRISTMAS PRESENT,1
14702,540395,JAM JAR WITH GREEN LID,1
14702,571276,DRAWER KNOB CRACKLE GLAZE GREEN,1
14702,573542,SET OF 3 WOODEN HEART DECORATIONS,1
14702,558636,BLUE STRIPE CERAMIC DRAWER KNOB,1
14702,559359,PACK OF 20 NAPKINS PANTRY DESIGN,1
14702,571276,FRENCH BLUE METAL DOOR SIGN 3,1
14702,571276,FRENCH KITCHEN SIGN BLUE METAL,1
14702,574846,SET OF 4 KNICK KNACK TINS DOILY,1
14702,563248,PACK OF 60 MUSHROOM CAKE CASES,1
14702,574846,WHITE SPOT BLUE CERAMIC DRAWER KNOB,1
14702,540532,BREAD BIN DINER STYLE IVORY,1
14702,571276,WALL ART CLASSIC PUDDINGS,1
14702,581471,SET OF 3 HANGING OWLS OLLIE BEAK,1
14702,563248,SET OF 36 DOILIES PANTRY DESIGN,1
14702,580135,HOT WATER BOTTLE KEEP CALM,1
14702,542422,SET/10 RED POLKADOT PARTY CANDLES,1
14702,558636,SET OF 60 VINTAGE LEAF CAKE CASES,1
14702,538168,3 HEARTS HANGING DECORATION RUSTIC,1
14702,540395,VINTAGE CREAM DOG FOOD CONTAINER,1
14702,544335,CAT BOWL VINTAGE CREAM,1
14702,563248,SET OF 36 PAISLEY FLOWER DOILIES,1
14702,571276,VINTAGE CHRISTMAS BUNTING,1
14702,574846,HOT WATER BOTTLE KEEP CALM,1
14702,581471,MISTLETOE HEART WREATH CREAM,1
14702,540532,LOVE HEART NAPKIN BOX,1
14702,559359,6PC WOOD PLATE SET DISPOSABLE,1
14702,542422,ENAMEL FIRE BUCKET CREAM,1
14702,581471,DOORMAT RED RETROSPOT,1
14702,571276,FRENCH WC SIGN BLUE METAL,1
14702,571276,6 GIFT TAGS 50'S CHRISTMAS,1
14702,540532,SET OF 6 SPICE TINS PANTRY DESIGN,1
14702,573542,CHRISTMAS RETROSPOT ANGEL WOOD,1
14702,540532,ROUND CAKE TIN VINTAGE RED,1
14702,571276,SCOTTIE DOG HOT WATER BOTTLE,1
14702,542422,JAM JAR WITH PINK LID,1
14702,538168,ANTIQUE SILVER TEA GLASS ENGRAVED,1
14702,571276,VINTAGE CHRISTMAS GIFT SACK,1
14702,573542,STAR WOODEN CHRISTMAS DECORATION,1
14702,573542,SWALLOW WOODEN CHRISTMAS DECORATION,1
14702,559359,RED SPOT CERAMIC DRAWER KNOB,1
14702,542422,DOORMAT UNION FLAG,1
14702,581471,DOORMAT FAIRY CAKE,1
14702,563248,60 TEATIME FAIRY CAKE CASES,1
14702,540532,SET OF 36 MUSHROOM PAPER DOILIES,1
14702,540532,SET OF 72 RETROSPOT PAPER  DOILIES,1
14702,573542,HEART TRELLIS TRIPLE T-LIGHT HOLDER,1
14702,538168,3D CHRISTMAS STAMPS STICKERS,1
14702,558636,RECYCLED ACAPULCO MAT GREEN,1
14702,571276,6 RIBBONS RUSTIC CHARM,1
14702,580135,CHRISTMAS CRAFT WHITE FAIRY,1
14702,581471,PAPER CHAIN KIT 50'S CHRISTMAS,1
14702,563248,FRENCH BLUE METAL DOOR SIGN 1,1
14702,577694,WALL ART STOP FOR TEA,1
14702,558636,RECYCLED ACAPULCO MAT BLUE,1
14702,571276,WALL ART STOP FOR TEA,1
14702,542422,FRENCH BLUE METAL DOOR SIGN 1,1
14702,581471,PAPER CHAIN KIT VINTAGE CHRISTMAS,1
14702,580135,BREAD BIN DINER STYLE IVORY,1
14702,577694,VINTAGE CHRISTMAS GIFT SACK,1
14702,580135,PAPER CHAIN KIT 50'S CHRISTMAS,1
14702,567943,EMBROIDERED RIBBON REEL DAISY,1
14702,571276,PAPER CHAIN KIT VINTAGE CHRISTMAS,1
14702,574846,CHRISTMAS CRAFT WHITE FAIRY,1
14702,580135,SET OF 12 FAIRY CAKE BAKING CASES,1
14702,558636,NATURAL SLATE HEART CHALKBOARD,1
14702,569977,SET OF 6 SNACK LOAF BAKING CASES,1
14702,571276,SET OF 6 TEA TIME BAKING CASES,1
14702,563248,DOORSTOP RETROSPOT HEART,1
14702,574846,CHRISTMAS CRAFT LITTLE FRIENDS,1
14702,574846,MUSICAL ZINC HEART DECORATION,1
14702,538168,RED WOOLLY HOTTIE WHITE HEART.,1
14702,571276,POLYESTER FILLER PAD 30CMx30CM,1
14702,571276,STORAGE TIN VINTAGE DOILY,1
14702,577694,CHRISTMAS MUSICAL ZINC TREE,1
14702,559359,ANTIQUE SILVER TEA GLASS ENGRAVED,1
14702,577694,BREAD BIN DINER STYLE IVORY,1
14702,538168,SCANDINAVIAN REDS RIBBONS,1
14702,540395,ENAMEL FIRE BUCKET CREAM,1
14702,540532,BREAD BIN DINER STYLE MINT,1
14702,558636,PACK OF 20 NAPKINS PANTRY DESIGN,1
14702,559359,SPOTTY BUNTING,1
14702,571276,ZINC SWEETHEART SOAP DISH,1
14702,581471,ANTIQUE SILVER T-LIGHT GLASS,1
14702,558636,COLOUR GLASS T-LIGHT HOLDER HANGING,1
14702,573542,VINTAGE CHRISTMAS BUNTING,1
14702,571276,BOX OF 6 MINI 50'S CRACKERS,1
14702,571276,PAPER CHAIN KIT 50'S CHRISTMAS,1
14702,538168,SILVER HANGING T-LIGHT HOLDER,1
14702,577694,SWEETHEART RECIPE BOOK STAND,1
14702,581471,VINTAGE CHRISTMAS BUNTING,1
14702,540395,PAPER CHAIN KIT LONDON,1
14702,573542,SET OF 3 WOODEN STOCKING DECORATION,1
14702,580135,VINTAGE CHRISTMAS GIFT SACK,1
14702,540395,SET OF 3 CAKE TINS SKETCHBOOK,1
14702,545577,BREAD BIN DINER STYLE RED,1
14702,581471,CAKE STAND LOVEBIRD 2 TIER WHITE,1
14702,577694,MISTLETOE HEART WREATH CREAM,1
14702,571276,FRENCH LAUNDRY SIGN BLUE METAL,1
14702,540532,ENAMEL FIRE BUCKET CREAM,1
14702,544335,JAM MAKING SET WITH JARS,1
14702,563248,PACK OF 20 NAPKINS PANTRY DESIGN,1
14702,563248,JAM MAKING SET PRINTED,1
14702,567943,LARGE APOTHECARY MEASURING JAR,1
14702,577694,BLUE STRIPE CERAMIC DRAWER KNOB,1
14702,559359,SET 20 NAPKINS FAIRY CAKES DESIGN,1
14702,538168,RIBBON REEL CHRISTMAS SOCK BAUBLE,1
14702,558636,FRENCH GARDEN SIGN BLUE METAL,1
14702,563248,SET OF 36 TEATIME PAPER DOILIES,1
14702,571276,SILVER STARS TABLE DECORATION,1
14702,574846,ANTIQUE SILVER T-LIGHT GLASS,1
14702,538168,CHRISTMAS CRAFT TREE TOP ANGEL,1
14702,540532,VINTAGE CREAM CAT FOOD CONTAINER,1
14702,540395,BREAD BIN DINER STYLE IVORY,1
14702,571276,FRENCH BLUE METAL DOOR SIGN 2,1
14702,573542,GIANT 50'S CHRISTMAS CRACKER,1
14702,542422,NATURAL SLATE HEART CHALKBOARD,1
14702,544335,SET OF 3 CAKE TINS PANTRY DESIGN,1
14702,581471,HAND WARMER BIRD DESIGN,1
14702,540395,SWEETHEART RECIPE BOOK STAND,1
14702,545577,RED STRIPE CERAMIC DRAWER KNOB,1
14702,574846,CHRISTMAS MUSICAL ZINC TREE,1
14702,540395,SET OF 6 HERB TINS SKETCHBOOK,1
14702,542422,SET/10 PINK POLKADOT PARTY CANDLES,1
14702,580135,ANTIQUE SILVER T-LIGHT GLASS,1
14702,540532,ROUND CAKE TIN VINTAGE GREEN,1
14702,563248,IVORY KITCHEN SCALES,1
